Text,Stelle,Inahlt,Wortzahl,Sentiment Rechnung,Sentiment-Score,alternativer Sentiment-Score,Invektiven,Invektivitäts-Score
apuleius.florida,9.0,"si, quis, fors, in, hic, pulcher, coitus, ex, ille, inuisor, meus, malignus, sedeo, quoniam, ut, in, magnus, ciuitas, hic, quoque, genus, inuenio, qui, bonus, obtrecto, malo, quam, imitor, et, qui, similitudo, despero, idem, adfectent, simultas, scilicet, uti, qui, suus, nomen, obscurus, sum, meus, innotesco, si, qui, igitur, ex, ille, liuido, splendidus, hic, auditorium, uelut, quidam, macula, sui, immisceo, uolo, paulisper, suus, oculus, per, hic, incredibilis, consido, circumfero, contemplo, frequentia, tantus, quantus, ante, ego, in, auditorium, philosophus, numquam, uisito, sum, reputo, cum, animus, suus, quantus, periculum, conseruo, existimatio, hic, adeo, qui, contemno, non, consuesco, cum, sum, arduus, et, oppidum, difficilis, uel, modicus, paucus, expectatio, satisfacere, praesertim, ego, qui, et, ante, pario, existimatio, et, uester, de, ego, benignus, praesumptio, nihil, non, quisquam, sino, neglegenter, atque, de, superus, pectus, hisco, quis, enim, uester, ego, unus, soloecismus, ignosco, quis, uel, unus, syllaba, barbaris, pronuntio, dono, quis, inconditus, et, uitiosus, uerbum, temere, quasi, deliro, oborior, permitto, blateraris, qui, tamen, alius, facilis, et, sanus, mereo, ignosco, meus, uerus, unumquodque, dico, acer, examino, sedulus, pensiculo, ad, lima, et, linea, certus, redigo, cum, torno, et, coturno, uerus, comparo, tantus, habeo, utilitas, excusatio, dignitas, difficultas, agnosco, igitur, difficultas, meus, neque, deprecor, quin, sic, existimo, neque, tamen, tu, paruus, quidam, et, prauus, similitudo, falsus, animus, habeo, quoniam, quidam, ut, saepe, dico, palliatus, mendicabulum, obambulo, praeco, proconsulis, et, ipse, tribunal, ascendo, et, ipse, togatus, illic, uideo, et, quidem, perdiu, sto, aut, ambulo, aut, plerusque, contendo, clamito, enimuero, proconsul, ipse, modero, uox, rarenter, et, sedeo, loquor, et, plerusque, de, tabella, lego, quippe, praeco, uox, garrulus, ministerium, sum, proconsulis, autem, tabella, sententia, sum, qui, semel, lego, neque, augeo, littera, unus, neque, autem, minuo, possum, sed, utcumque, recito, sum, ita, prouincia, instrumentum, refero, patior, et, ipse, in, meus, studium, aliqui, pro, meus, capio, similitudo, nam, quicumque, ad, tu, profero, excerpo, ilico, et, lectus, sum, neque, reuoco, ille, neque, autem, muto, neque, emendo, ego, inde, quisquam, licet, quo, magnus, religio, dico, habeo, sum, et, quidem, non, in, unus, genus, studium, multus, enim, meus, extant, in, camenis, quam, hippiae, in, opificium, opus, quis, iste, sum, si, animus, attendo, diligo, et, accuro, disputo, et, hippias, e, numerus, sophistaris, sum, ars, multitudo, prior, omnis, eloquentia, nullus, secundus, aetas, ille, cum, socrate, patria, elis, genus, ignoro, gloria, uerus, magnus, fortuna, modicus, sed, ingenium, nobilis, memoria, excello, studium, uarius, aemulis, multus, uenio, hippias, iste, quondam, certamen, olympio, pisa, non, paruus, cultus, uiso, quam, elaboro, miro, omnis, cum, sui, qui, habeo, nihil, is, memerat, sed, suus, sui, manus, confacio, et, indumentum, qui, induo, et, calceamentum, qui, sum, induco, et, gestamen, qui, sum, conspicor, habeo, indutus, ad, corpus, tunica, interula, tenuis, textus, triplex, licium, purpura, duplex, ipse, is, sui, solus, domus, texuerat, habeo, cinctus, balteus, qui, genus, pingo, babylonica, mirus, color, uariego, neque, in, hic, is, opus, quisquam, adiuuo, habeo, amictus, pallium, candidus, qui, supernus, circumiacio, is, quoque, pallium, comperioris, ipse, labor, sum, etiam, pes, tegumentum, crepida, sui, compingo, etiam, anulus, in, laeuus, aureus, faberrimo, signaculum, qui, ostento, ipse, is, anulis, et, orbiculis, circulo, et, palam, claudo, et, gemma, insculpo, nondum, omnis, is, commemoro, enim, non, pigeo, ego, commemoraris, qui, ille, non, pudeo, sum, ostentaris, qui, magnus, in, coeptu, praedico, fabrico, sui, sui, ampulla, quoque, olearius, quam, gesto, lenticularis, forma, teres, ambitus, pressulus, rutunditas, iuxta, honestus, strigilecula, recta, fastigatio, cymula, flecto, tubulatio, ligula, ut, et, ipse, in, manus, capulus, moror, et, sudor, ex, is, riuulus, labor, quis, autem, non, laudo, homo, tam, numerosus, ars, multiscius, totiugus, scientia, magnificus, tot, utensilia, peritia, daedal, quin, et, ipse, hippia, -ne, laudo, sed, ingenium, is, fecunditas, malus, doctrina, quam, supellectilis, multiformis, instrumentum, aemularis, fateor, ego, sellularius, quidem, ars, paruus, calleo, uestis, de, textrinum, emo, baxea, iste, de, sutrina, praestinaris, enimuero, anulus, neque, gestaris, gemma, et, aurum, iuxta, plumbum, et, lapillus, nullus, aestimaris, strigilis, et, ampulla, ceter, balneum, utensilia, nundo, mercor, prorsus, enim, non, is, infititias, neque, radio, neque, subula, neque, limo, neque, torno, neque, is, genus, ferramentum, uti, nosco, sed, pro, hic, praeoptaris, ego, fateor, unus, chartarius, calamus, ego, reficio, poema, omnigenus, apto, uirga, lyra, soccus, coturno, item, satiras, atque, griphus, item, historia, uario, res, neque, non, oratio, laudo, dissero, neque, non, dialogus, laudo, philosophus, atque, hic, et, alius, et, idem, modus, tam, graeca, quam, latina, geminus, uotum, par, studium, similis, stilus, qui, utinam, possum, equidem, non, singillatim, atque, discretim, sed, cunctim, et, coaceruatim, tu, proconsul, ut, optume, offero, atque, praedicabilis, testimonium, tuus, ad, omnis, noster, camenam, fruor, non, herculis, penuria, laus, qui, ego, dudum, integer, et, floreo, per, omnis, antecessor, tuus, ad, tu, reseruata, sum, sed, quoniam, nullus, ego, probo, uolo, quam, qui, ipse, ante, omnis, mereo, probo, enim, sic, natura, comparo, sum, ut, is, qui, laus, etiam, amo, porro, qui, amo, etiam, laudo, tu, ab, ille, uelum, atque, ego, ego, dilector, tuus, profiteor, nullus, tu, priuatim, sed, omnis, publicitus, gratia, obstringo, nihil, quippe, ab, tu, impetro, quia, neque, postulo, sed, philosophia, ego, doceo, non, tantus, beneficium, amo, sed, etiam, maleficium, nego, magus, iudicium, impertio, quam, commodum, inseruio, et, qui, in, communis, expedio, malo, quam, qui, ego, igitur, bonitas, tuus, diligo, plerusque, fructus, ego, studium, is, facio, adorior, sum, dum, mododeratio, tuus, in, prouincialis, negotium, contemplo, qui, efficio, ut, tu, amo, debeo, experior, propter, beneficium, expers, propter, exemplum, nam, et, beneficium, multus, commodo, et, exemplum, omnis, prosum, quis, enim, ab, tu, non, amo, disco, quisnam, moderatio, obtineo, queo, tuus, iste, grauitas, iucundus, mitis, austeritas, placidus, constantia, blandus, uigor, sum, nemo, proconsulis, qui, scio, prouincia, africa, magis, reuerendus, sum, paruus, uereor, nullus, nisi, tuus, annus, ad, coerceo, pecco, multus, pudor, quam, timor, ualuit, nemo, tu, alius, par, potestas, saepis, prosum, rarus, terreo, nemo, similis, uirtus, filius, adduco, igitur, nemo, carthago, proconsulis, diu, sum, nam, etiam, is, tempus, quo, prouincia, circumeo, maneo, nos, honorino, paruus, sentio, absentia, tuus, quamquam, tu, magis, desidero, paternus, in, filius, aequitas, senilis, in, iuuenis, auctoritas, prudentia, consularis, in, legatus, auctoritas, prorsus, omnis, uirtus, tuus, ita, effingo, atque, repraesento, ut, medius, fidus, admirabilis, sum, in, iuuenis, quam, in, tu, pario, laus, nisi, is, tu, talis, do, qui, utinam, perpetuus, licet, fruor, quis, nos, cum, iste, proconsulis, uicicibus, quis, cum, annus, breuis, et, festino, mensis, o, celer, bonus, homo, dies, o, praesidum, bonus, cito, curriculum, iam, tu, seueriane, totus, prouincia, desidero, enimuero, honorinum, et, honor, suus, ad, praetorqueo, uoco, et, fauor, caesar, ad, consulatus, formo, et, amor, noster, inpraesentiaris, teneo, et, spes, carthago, in, sum, spondeo, unus, solacium, fretus, exemplum, tuus, qui, qui, legatus, mitto, proconsul, ad, nos, cito, reuorto, sum",1057,"NaN, NaN, 0.0, NaN, NaN, 1.0, NaN, NaN, NaN, NaN, 0.0, -1.0, NaN, NaN, NaN, NaN, 0.0, 0.5, NaN, NaN, 0.0, NaN, NaN, 1.0, NaN, NaN, NaN, NaN, NaN, NaN, 0.0, NaN, NaN, NaN, -1.0, NaN, NaN, NaN, NaN, 0.0, NaN, NaN, 0.0, NaN, NaN, NaN, NaN, NaN, NaN, NaN, 1.0, NaN, 0.0, NaN, NaN, NaN, NaN, NaN, NaN, NaN, NaN, 0.0, NaN, NaN, -0.5, NaN, NaN, NaN, NaN, NaN, NaN, NaN, NaN, NaN, 0.0, 0.0, NaN, NaN, NaN, NaN, NaN, 0.5, NaN, NaN, -1.0, NaN, NaN, NaN, NaN, NaN, NaN, NaN, NaN, NaN, NaN, NaN, NaN, NaN, -0.5, NaN, 0.0, 0.0, 0.0, NaN, NaN, NaN, NaN, NaN, NaN, NaN, NaN, NaN, NaN, NaN, NaN, 1.0, NaN, NaN, NaN, NaN, NaN, NaN, NaN, NaN, NaN, NaN, NaN, NaN, NaN, NaN, NaN, NaN, NaN, NaN, NaN, NaN, NaN, NaN, NaN, NaN, NaN, NaN, NaN, NaN, NaN, 0.0, NaN, NaN, NaN, NaN, NaN, NaN, NaN, NaN, NaN, 0.5, NaN, 1.0, NaN, NaN, 0.0, 0.5, NaN, NaN, NaN, NaN, NaN, NaN, NaN, NaN, NaN, NaN, 0.5, NaN, NaN, NaN, NaN, NaN, 0.5, NaN, NaN, NaN, 1.0, 0.5, 1.0, -0.5, NaN, NaN, -0.5, 0.0, NaN, NaN, NaN, NaN, NaN, NaN, NaN, NaN, 0.0, NaN, NaN, -1.0, 0.0, -1.0, 0.5, NaN, NaN, NaN, NaN, NaN, NaN, NaN, NaN, NaN, NaN, NaN, NaN, NaN, 0.0, NaN, NaN, NaN, NaN, NaN, NaN, NaN, NaN, NaN, NaN, NaN, NaN, NaN, NaN, NaN, NaN, NaN, NaN, NaN, NaN, 0.0, NaN, NaN, NaN, NaN, NaN, NaN, NaN, 0.0, NaN, NaN, NaN, 0.0, NaN, 0.0, NaN, NaN, NaN, 0.0, 0.0, NaN, NaN, NaN, NaN, NaN, NaN, 0.0, NaN, NaN, NaN, NaN, NaN, NaN, NaN, NaN, NaN, NaN, 0.0, NaN, NaN, NaN, NaN, NaN, NaN, 0.0, 0.5, NaN, NaN, 0.0, NaN, 0.0, NaN, NaN, NaN, NaN, NaN, NaN, NaN, NaN, 0.0, NaN, NaN, NaN, NaN, NaN, NaN, NaN, NaN, NaN, NaN, NaN, NaN, NaN, NaN, 0.0, 1.0, NaN, NaN, NaN, NaN, NaN, NaN, NaN, NaN, 0.0, 0.5, 0.0, NaN, 0.0, NaN, NaN, NaN, NaN, NaN, NaN, NaN, 0.5, NaN, NaN, NaN, NaN, 0.5, NaN, NaN, NaN, NaN, NaN, NaN, NaN, NaN, NaN, NaN, NaN, 0.0, 0.0, 0.5, NaN, NaN, NaN, 0.0, 0.0, NaN, NaN, NaN, NaN, NaN, 0.0, NaN, 0.0, 0.5, 0.0, 0.0, 0.0, NaN, 0.5, 1.0, 1.0, NaN, 0.5, 0.0, NaN, 0.0, NaN, NaN, NaN, NaN, 0.5, NaN, NaN, NaN, 0.0, -0.5, NaN, NaN, NaN, NaN, NaN, NaN, NaN, NaN, NaN, NaN, NaN, NaN, NaN, NaN, NaN, 0.0, NaN, NaN, NaN, NaN, NaN, NaN, NaN, NaN, NaN, NaN, NaN, NaN, NaN, NaN, NaN, NaN, NaN, NaN, 0.0, NaN, NaN, 0.0, NaN, NaN, NaN, NaN, 0.0, NaN, NaN, NaN, -0.5, 0.0, NaN, NaN, NaN, NaN, NaN, 0.0, NaN, NaN, 1.0, 0.0, NaN, NaN, NaN, NaN, NaN, 0.5, NaN, NaN, NaN, 0.5, NaN, NaN, NaN, NaN, NaN, NaN, NaN, NaN, NaN, NaN, -0.5, NaN, NaN, 0.0, NaN, NaN, NaN, NaN, NaN, NaN, NaN, -1.0, 0.5, NaN, NaN, NaN, NaN, NaN, NaN, NaN, NaN, NaN, NaN, NaN, NaN, NaN, NaN, NaN, NaN, NaN, NaN, NaN, NaN, NaN, NaN, NaN, NaN, NaN, NaN, NaN, NaN, NaN, NaN, NaN, NaN, 0.0, NaN, NaN, NaN, NaN, NaN, NaN, NaN, NaN, 0.0, NaN, NaN, NaN, 1.0, NaN, NaN, NaN, NaN, NaN, 1.0, NaN, NaN, NaN, NaN, NaN, NaN, NaN, NaN, NaN, NaN, NaN, 0.0, NaN, NaN, NaN, NaN, NaN, NaN, NaN, -0.5, NaN, NaN, NaN, NaN, 0.0, NaN, NaN, 0.0, NaN, NaN, 0.0, 0.0, NaN, NaN, NaN, NaN, NaN, NaN, NaN, NaN, NaN, NaN, NaN, 0.5, NaN, 1.0, -1.0, 0.0, NaN, NaN, NaN, NaN, NaN, NaN, NaN, NaN, NaN, 0.0, 0.0, NaN, NaN, NaN, NaN, NaN, NaN, NaN, NaN, NaN, NaN, NaN, NaN, NaN, NaN, NaN, NaN, 0.5, NaN, NaN, NaN, NaN, NaN, NaN, NaN, NaN, NaN, NaN, NaN, NaN, NaN, NaN, NaN, NaN, NaN, NaN, NaN, NaN, NaN, NaN, NaN, NaN, NaN, NaN, NaN, NaN, NaN, 0.0, NaN, NaN, NaN, NaN, NaN, NaN, NaN, NaN, NaN, NaN, NaN, NaN, NaN, NaN, 0.0, NaN, NaN, NaN, 0.0, NaN, NaN, NaN, NaN, NaN, NaN, NaN, NaN, NaN, 0.0, NaN, NaN, -0.5, NaN, NaN, NaN, NaN, NaN, NaN, 0.0, NaN, NaN, NaN, NaN, NaN, NaN, 0.5, NaN, NaN, NaN, NaN, NaN, 0.0, 0.5, 0.5, 0.0, NaN, NaN, NaN, NaN, NaN, NaN, NaN, NaN, NaN, NaN, NaN, NaN, NaN, NaN, NaN, NaN, NaN, NaN, NaN, NaN, NaN, 0.0, NaN, NaN, NaN, NaN, NaN, NaN, NaN, NaN, 1.0, NaN, NaN, NaN, 0.5, NaN, NaN, NaN, NaN, NaN, 0.0, NaN, NaN, NaN, NaN, NaN, NaN, NaN, NaN, NaN, NaN, NaN, NaN, NaN, NaN, NaN, NaN, NaN, NaN, NaN, 0.0, NaN, NaN, NaN, NaN, NaN, 1.0, NaN, NaN, NaN, NaN, NaN, NaN, NaN, NaN, NaN, NaN, NaN, NaN, NaN, NaN, NaN, 0.0, NaN, NaN, NaN, NaN, NaN, NaN, NaN, 1.0, NaN, NaN, NaN, NaN, NaN, NaN, NaN, NaN, NaN, NaN, NaN, NaN, NaN, NaN, NaN, 1.0, NaN, NaN, NaN, -1.0, NaN, NaN, 0.5, NaN, NaN, 0.5, NaN, NaN, NaN, NaN, 0.0, NaN, NaN, NaN, NaN, NaN, NaN, 1.0, 0.0, NaN, NaN, 0.5, NaN, 0.5, NaN, NaN, NaN, NaN, NaN, NaN, 0.0, NaN, 0.0, -0.5, NaN, NaN, NaN, NaN, NaN, NaN, NaN, NaN, NaN, 1.0, NaN, NaN, 0.0, NaN, NaN, 1.0, 0.0, NaN, NaN, 0.0, NaN, NaN, NaN, NaN, NaN, NaN, NaN, NaN, NaN, NaN, 0.5, NaN, NaN, 0.0, NaN, -0.5, 1.0, 1.0, NaN, 1.0, 0.5, 0.5, NaN, NaN, -0.5, NaN, NaN, NaN, 0.0, NaN, NaN, 1.0, NaN, 0.0, NaN, NaN, NaN, 0.0, 0.0, NaN, NaN, NaN, 0.0, 0.5, NaN, -0.5, NaN, -0.5, NaN, NaN, 0.5, 0.5, NaN, NaN, NaN, NaN, -0.5, 0.0, 1.0, 0.0, NaN, NaN, -0.5, NaN, NaN, NaN, NaN, NaN, NaN, NaN, 0.0, NaN, 0.0, NaN, NaN, NaN, NaN, 0.0, NaN, -0.5, 0.0, NaN, NaN, NaN, NaN, NaN, NaN, 0.0, 0.5, -0.5, NaN, NaN, NaN, 0.5, 0.5, NaN, 0.0, NaN, NaN, NaN, 1.0, 0.0, NaN, NaN, NaN, NaN, NaN, 0.0, 1.0, 1.0, NaN, NaN, NaN, NaN, NaN, NaN, NaN, 1.0, NaN, NaN, NaN, NaN, NaN, NaN, NaN, 0.0, NaN, NaN, NaN, NaN, NaN, NaN, NaN, NaN, NaN, NaN, 0.0, NaN, NaN, NaN, NaN, NaN, NaN, 1.0, 0.0, 0.0, NaN, NaN, 1.0, NaN, NaN, NaN, NaN, NaN, NaN, 0.0, NaN, NaN, NaN, NaN, 1.0, NaN, NaN, NaN, NaN, NaN, 1.0, 0.5, NaN, NaN, NaN, NaN, 1.0, NaN, NaN, NaN, NaN, 0.5, NaN, NaN, NaN, NaN, NaN, 1.0, 0.5, 0.0, 0.0, NaN, NaN, 0.0, NaN, NaN, NaN, NaN, NaN, NaN, NaN",0.038,-0.016,"hic, hic, hic, macula, hic, hic, barbaris, deliro, tu, prauus, garrulus, tu, hic, pudeo, honestus, supellectilis, uestis, emo, plumbum, mercor, hic, hic, tu, tu, tu, tu, tu, maleficium, tu, tu, coerceo, pudor, tu, tu, tu, tu, tu",0.035
apuleius.florida,10.0,"sol, qui, candeo, feruido, currus, atque, equus, flamma, citas, feruido, ardor, explico, ito, lumen, is, luna, discipula, neque, non, quinque, ceterus, uago, potestas, iuppiter, beneficus, uenio, uoluptificus, pernix, mercuri, perniciosus, saturnus, mars, ignio, sum, et, alius, medius, deus, potestas, qui, licet, sentio, non, do, cerno, ut, amor, ceter, is, genus, qui, forma, inuisitatus, uolo, cognosco, item, in, terra, utcumque, prouidentia, ratio, posco, alibi, mons, arduus, uertex, effero, alibi, campus, supinus, planitiem, coaequo, ito, ubique, distinguo, amnis, fluor, prator, uiror, item, do, uolo, auis, uoluo, serpens, curro, fera, gressus, homo",89,"NaN, NaN, NaN, NaN, NaN, NaN, NaN, NaN, NaN, NaN, NaN, NaN, NaN, NaN, NaN, NaN, NaN, NaN, NaN, NaN, 0.0, NaN, 0.5, NaN, 1.0, NaN, NaN, NaN, NaN, -1.0, NaN, NaN, NaN, NaN, NaN, NaN, 0.0, 0.0, 0.5, NaN, NaN, NaN, NaN, NaN, NaN, NaN, 1.0, NaN, NaN, 0.0, NaN, 1.0, NaN, NaN, NaN, NaN, NaN, 0.0, NaN, 1.0, 0.0, NaN, NaN, NaN, NaN, NaN, NaN, NaN, 0.0, NaN, NaN, NaN, NaN, NaN, NaN, NaN, NaN, NaN, NaN, NaN, NaN, NaN, NaN, NaN, NaN, NaN, NaN, 0.0, 0.0",0.045,-0.011,"perniciosus, serpens, fera",0.034
apuleius.florida,11.0,"patior, enim, qui, qui, herediolum, sterilis, et, ager, scruposus, merus, rupina, et, senticetum, miser, colo, quoniam, nullus, in, tesquis, suus, fructus, sum, neque, ullus, illic, alius, frugis, uideo, sed, infelix, lolium, et, sterilis, dominor, hauenae, suus, frugis, indigeo, alienus, furor, eo, et, uicinus, floreo, decerpo, scilicet, ut, is, floreo, carduis, suus, misceo, ad, idem, modus, qui, suus, uirtus, sterilis, sum",60,"NaN, NaN, NaN, NaN, NaN, -0.5, NaN, 0.0, NaN, NaN, NaN, NaN, NaN, -1.0, NaN, NaN, NaN, NaN, NaN, NaN, 0.5, NaN, NaN, NaN, NaN, NaN, NaN, NaN, NaN, -1.0, NaN, NaN, -0.5, NaN, NaN, NaN, NaN, NaN, -0.5, -1.0, NaN, NaN, 0.0, NaN, NaN, NaN, NaN, NaN, NaN, NaN, NaN, NaN, NaN, NaN, 0.5, NaN, NaN, 1.0, -0.5, NaN",-0.05,-0.083,"herediolum, miser, infelix, furor",0.067
apuleius.florida,12.0,"psittacus, auis, indiae, auis, sum, instar, ille, paruus, paruus, quam, columbaris, sed, color, non, columbaris, non, enim, lacteus, ille, uel, liuidus, uel, uterque, subluteus, aut, spargo, sum, sed, color, psittacus, uiridis, et, intimus, plumulis, et, extimis, palmula, nisi, qui, solus, ceruix, distinguo, enimuero, ceruicula, is, circulus, mineus, uelut, aureus, torqui, par, fulgor, circumago, cingo, et, corono, rostrum, primus, duritia, cum, in, petra, qui, concieo, alo, uolo, praecipito, rostrum, sui, uelut, anchora, excipio, sed, et, capio, idem, duritia, qui, rostrum, cum, sermo, nos, cogo, aemularis, ferreus, clauicula, caput, tundo, imperium, magister, ut, persentisco, hic, disco, ferula, sum, disco, autem, statim, pullus, usque, ad, duo, aetas, suus, annus, dum, facilis, os, uti, conformo, dum, tener, lingua, uti, conuibro, senex, autem, capio, et, indocilis, sum, et, obliuiosus, uerus, ad, disciplina, humanus, sermo, facilis, sum, psittacus, glande, qui, uesco, et, qui, in, pes, ut, homo, quini, digitulis, numero, non, enim, omnis, psittacus, is, insignis, sed, ille, omnis, proprius, qui, is, lingua, latus, quam, ceterus, auis, is, facilis, uerbum, homo, articulo, pateo, plectrum, et, palatum, is, uerus, qui, disco, ita, similis, nos, cano, uel, potis, eloquor, ut, uox, si, audio, homo, puto, nam, coruus, quidem, si, audio, is, sum, crocitaris, non, loquor, uerus, enimuero, et, coruus, et, psittacus, nihil, alius, quam, qui, disco, pronuntio, si, conuicium, doceo, conuicior, dies, atque, nox, perstrepo, maledictum, hic, ille, carmen, sum, hic, puto, cantio, ubi, omnis, qui, disco, maledico, percenseo, denuo, repeto, idem, cantilena, si, careo, conuicium, uelum, lingua, excido, sum, aut, quam, primus, in, silua, suus, remitto, sum",250,"NaN, NaN, NaN, NaN, NaN, NaN, NaN, 0.0, 0.0, NaN, NaN, NaN, 0.0, NaN, NaN, NaN, NaN, NaN, NaN, NaN, NaN, NaN, NaN, NaN, NaN, NaN, NaN, NaN, 0.0, NaN, NaN, NaN, NaN, NaN, NaN, NaN, NaN, NaN, NaN, -0.5, NaN, NaN, NaN, NaN, NaN, NaN, NaN, NaN, 0.5, NaN, 0.5, NaN, NaN, NaN, NaN, NaN, NaN, 0.5, -0.5, NaN, NaN, NaN, NaN, NaN, NaN, NaN, NaN, NaN, NaN, NaN, NaN, NaN, NaN, NaN, NaN, NaN, -0.5, NaN, NaN, NaN, -0.5, NaN, NaN, NaN, NaN, NaN, 0.0, NaN, 0.0, 0.5, NaN, NaN, NaN, NaN, NaN, NaN, NaN, NaN, NaN, NaN, NaN, NaN, NaN, 0.0, NaN, 0.0, NaN, 0.5, 0.0, NaN, NaN, NaN, NaN, -0.5, NaN, NaN, 0.0, NaN, NaN, NaN, NaN, NaN, NaN, NaN, 0.5, NaN, 0.0, 0.0, -0.5, 0.5, NaN, NaN, NaN, NaN, NaN, NaN, NaN, NaN, 0.0, NaN, 0.0, NaN, NaN, NaN, NaN, NaN, NaN, NaN, NaN, 0.0, NaN, NaN, NaN, 0.0, NaN, NaN, -0.5, NaN, NaN, 0.0, NaN, NaN, 0.5, 0.0, 0.0, NaN, NaN, NaN, NaN, NaN, NaN, 0.5, NaN, NaN, NaN, 0.0, NaN, NaN, NaN, 0.0, NaN, NaN, 0.0, NaN, NaN, 0.0, NaN, NaN, NaN, NaN, NaN, NaN, NaN, NaN, NaN, NaN, NaN, 0.5, NaN, NaN, NaN, NaN, NaN, NaN, NaN, NaN, NaN, NaN, NaN, NaN, -1.0, NaN, NaN, 0.0, NaN, 0.0, NaN, -1.0, NaN, NaN, 0.0, NaN, NaN, NaN, NaN, NaN, NaN, NaN, NaN, NaN, NaN, NaN, NaN, NaN, 0.0, NaN, NaN, -1.0, NaN, -0.5, NaN, NaN, NaN, NaN, 0.5, NaN, NaN, NaN, NaN, NaN",-0.006,-0.028,"hic, conuicium, perstrepo, maledictum, hic, hic, maledico, conuicium",0.032
apuleius.florida,13.0,"non, enim, ego, philosophia, is, genus, oratio, largior, sum, ut, natura, quidam, auis, breuis, et, temporarius, cano, commodo, hirundo, matutinus, cicada, meridianus, noctua, serus, ululis, uespertinus, bubo, nocturnus, galli, antelucanus, quippe, hic, animal, inter, sui, uarius, tempus, et, uarius, modo, occino, et, occipio, carmen, scilicet, gallus, expergifico, bubo, gemulus, ulula, querulus, noctua, intorqueo, cicada, obstreperus, hirundo, perargutus, sed, enim, philosophus, ratio, et, oratio, tempus, iugum, sum, et, auditus, uenerabilis, et, intellego, utilis, et, modo, omnicanus",75,"NaN, NaN, NaN, NaN, NaN, 0.0, -0.5, NaN, NaN, NaN, 0.0, NaN, NaN, NaN, NaN, 0.0, NaN, NaN, NaN, NaN, NaN, NaN, NaN, NaN, NaN, NaN, NaN, NaN, NaN, NaN, NaN, NaN, NaN, NaN, NaN, 0.0, 0.0, NaN, 0.0, NaN, NaN, NaN, NaN, 0.0, NaN, NaN, NaN, NaN, NaN, NaN, NaN, NaN, NaN, NaN, NaN, NaN, NaN, NaN, NaN, 0.0, 0.0, NaN, -0.5, 0.0, NaN, NaN, NaN, NaN, NaN, NaN, NaN, 1.0, NaN, NaN, NaN",0.0,-0.013,"hic, animal, gallus, querulus",0.053
apuleius.florida,14.0,"hic, atque, hic, genus, alius, pars, cum, audio, ab, diogene, cratis, alius, ipse, sui, suggero, denique, in, forum, exilit, res, familiaris, abicio, uelut, onus, stercus, magis, labor, quam, usus, deinde, coitus, facio, magnus, exclamo, cratis, inquam, cratestem, manus, mitto, et, exinde, non, modo, solus, uerus, nudus, et, liber, omnis, quoad, uiuo, beatus, uiuo, adeo, is, cupio, ut, uirgo, nobilis, sperno, iunioribus, atque, diues, procus, ultronea, is, sui, opto, cum, interscapulis, cratis, retego, qui, sum, augeo, gibber, pera, cum, baculus, et, pallium, humus, possuisset, eo, suppellectilis, sui, sum, puella, profiteor, eo, forma, quam, uideo, proinde, sedulus, consulo, ne, post, querela, causa, capio, enimuero, hipparche, condicio, accipio, iam, dudum, sui, prouideo, satis, et, satis, consulo, respondeo, neque, diues, maritus, neque, formonsiorem, uspiam, gens, possum, inuenio, proinde, duco, quo, libero, duco, cynicus, in, porticus, ibidem, in, locus, celeber, coram, lux, clarus, accumbo, cora, uirgo, in-minuo, paro, par, constantia, ni, zeno, procingo, palliastrum, circumsto, corona, obtus, magister, in, secretum, defendo",156,"NaN, NaN, NaN, 0.0, NaN, 0.0, NaN, NaN, NaN, NaN, NaN, NaN, NaN, NaN, NaN, NaN, NaN, NaN, NaN, 0.0, 1.0, NaN, NaN, NaN, -0.5, NaN, -0.5, NaN, NaN, NaN, NaN, NaN, 0.0, NaN, NaN, NaN, NaN, 0.0, NaN, NaN, NaN, NaN, NaN, -0.5, 0.5, 0.0, NaN, 0.5, NaN, NaN, NaN, 1.0, NaN, NaN, NaN, NaN, NaN, NaN, 1.0, NaN, NaN, NaN, 0.5, NaN, NaN, NaN, NaN, NaN, NaN, NaN, NaN, NaN, NaN, NaN, NaN, NaN, NaN, NaN, NaN, NaN, NaN, NaN, NaN, NaN, NaN, NaN, NaN, NaN, NaN, NaN, 1.0, NaN, NaN, NaN, NaN, NaN, NaN, NaN, -0.5, 0.0, NaN, NaN, NaN, 0.0, NaN, NaN, NaN, NaN, NaN, 0.5, NaN, 0.5, NaN, NaN, NaN, 0.5, 0.0, NaN, NaN, NaN, 0.0, NaN, NaN, NaN, NaN, NaN, NaN, NaN, NaN, NaN, NaN, NaN, NaN, 0.0, NaN, NaN, NaN, 0.5, NaN, NaN, NaN, NaN, NaN, 0.5, 0.5, NaN, NaN, NaN, NaN, NaN, NaN, NaN, 0.5, NaN, NaN, NaN",0.045,-0.013,"hic, hic, stercus, uirgo, humus, maritus, uirgo",0.045
