Text,Stelle,Inahlt,Wortzahl,Sentiment Rechnung,Sentiment-Score,alternativer Sentiment-Score,Invektiven,Invektivitäts-Score
ausonius.epitaphia,1.0,"ausonius, lector, suus, salus, ad, res, pertineo, existimo, ut, uel, uanus, opusculis, materia, congruo, absoluo, et, libellus, qui, commemoratio, habeo, is, qui, uel, peregrinus, burdigalae, uel, burdigalenses, peregre, doceo, epitaphium, subnecterem, scilicet, titulus, sepulcral, heros, qui, bellum, troico, intersum, qui, antiquus, cum, aput, philologus, quidam, reperio, latino, sermo, conuerto, non, ut, inseruirem, ordo, persequor, studium, sed, ut, cohercerem, libo, neque, aberraris, rex, rex, atrides, fraternus, coniunx, ultor, oppetii, manus, coniunx, ipse, meus, quis, prodo, helenes, rapio, punisse, doleo, uindico, adulterium, cum, clytemestra, neco",83,"NaN, 0.0, NaN, 1.0, NaN, 0.0, NaN, NaN, NaN, NaN, -0.5, NaN, 0.0, NaN, NaN, NaN, 0.0, NaN, 0.0, NaN, NaN, NaN, NaN, NaN, NaN, NaN, NaN, NaN, NaN, NaN, NaN, NaN, NaN, NaN, NaN, NaN, 0.0, NaN, NaN, NaN, 0.0, NaN, NaN, 0.0, NaN, NaN, NaN, -0.5, NaN, NaN, NaN, NaN, 0.5, NaN, 0.5, NaN, NaN, NaN, NaN, NaN, NaN, 0.0, 0.0, NaN, 0.0, -0.5, NaN, NaN, 0.0, -0.5, NaN, 0.0, NaN, NaN, NaN, NaN, NaN, NaN, NaN, -0.5, NaN, NaN, NaN",-0.006,-0.03,"uanus, atrides, fraternus, ultor, adulterium",0.06
ausonius.epitaphia,2.0,"felix, o, menelae, deus, qui, debeo, sedes, decerno, pius, manus, elysium, tyndareo, diligo, gener, diligo, tono, coniugium, uindex, ultor, adulterium, aeternus, polleo, aeuum, aeternus, iuuenta, neque, letum, patior, tempus, neque, senium",31,"1.0, NaN, NaN, 0.0, NaN, NaN, 0.0, NaN, NaN, 0.0, NaN, NaN, NaN, NaN, NaN, NaN, NaN, NaN, NaN, -0.5, 0.5, NaN, NaN, 0.5, NaN, NaN, -1.0, NaN, 0.0, NaN, -0.5",0.0,-0.065,"uindex, ultor, adulterium",0.097
ausonius.epitaphia,3.0,"a-iacio, tumulus, pariter, tego, obruo, uirtus, in-lacrimo, bustum, funus, ipse, meus, incomptas, lacero, como, qui, prauus, atrides, cedo, ego, instruo, compello, insidiae, iam, do, purpureus, clarus, de, sanguis, flos, testo, gemitus, crimen, iudicium",33,"NaN, NaN, NaN, NaN, NaN, 1.0, NaN, NaN, -0.5, NaN, 0.0, NaN, NaN, NaN, NaN, -1.0, NaN, NaN, NaN, NaN, NaN, NaN, NaN, NaN, NaN, 0.5, NaN, NaN, 0.5, NaN, -0.5, -1.0, 0.5",-0.015,-0.091,"bustum, lacero, prauus, atrides, insidiae, crimen",0.182
ausonius.epitaphia,4.0,"non, unus, aeacide, -ne, tellus, habeo, os, tego, litus, sigeo, crinis, larisa, cremo, pars, tumulus, secerno, iaceo, pars, classis, refero, sum, orbis, sed, in, totus, rediuiuus, ostendo, homerus",28,"NaN, NaN, NaN, NaN, NaN, NaN, 0.0, NaN, NaN, NaN, NaN, NaN, NaN, 0.0, NaN, NaN, NaN, 0.0, NaN, NaN, NaN, NaN, NaN, NaN, NaN, NaN, NaN, NaN",0.0,0.0,"iaceo, classis",0.071
ausonius.epitaphia,5.0,"condio, hic, tumulus, laerta, nascor, ulixes, perlego, odyssea, -ne, omnis, nosco, uolo",12,"NaN, NaN, NaN, NaN, NaN, NaN, NaN, NaN, NaN, NaN, NaN, NaN",nan,nan,hic,0.083
ausonius.epitaphia,6.0,"condio, hic, genitor, bonus, bonus, diomedes, crimen, ob, uxor, pello, dotal, argis, argyripam, clarus, uis, qui, condo, arpos, clarus, urbs, nouo, patria, quam, sedes, uetustus",25,"NaN, NaN, NaN, 1.0, 1.0, NaN, -1.0, NaN, 0.0, NaN, NaN, NaN, NaN, 0.5, 1.0, NaN, NaN, NaN, 0.5, 0.5, NaN, NaN, NaN, 0.0, 0.0",0.14,-0.04,"hic, crimen, uxor, dotal",0.16
ausonius.epitaphia,7.0,"consilium, bellus, bonus, qui, copulo, rarus, sum, carus, et, atridis, carus, et, aeacidis, praemium, uirtus, simul, et, pietas, adipiscor, seruo, antilochus, nestor, pater, obeo, non, hic, ordo, sum, sed, iustus, ille, supersto, troia, capio, sine, quo, perfidus, non, possum",39,"0.5, 1.0, 1.0, NaN, NaN, NaN, NaN, 1.0, NaN, NaN, 1.0, NaN, NaN, 1.0, 1.0, NaN, NaN, 1.0, NaN, NaN, NaN, NaN, 0.0, NaN, NaN, NaN, 0.5, NaN, NaN, 1.0, NaN, NaN, NaN, NaN, NaN, NaN, -1.0, NaN, NaN",0.205,-0.026,"hic, perfidus",0.051
ausonius.epitaphia,8.0,"hic, tego, in, tumulus, quartus, iam, prodigus, aeuum, nestor, consilium, clarus, et, eloquium, obiacio, sui, qui, pro, mors, per-emo, filius, et, nascor, uulnus, uiuo, pater, eheu, cur, fatum, dispono, sic, placeo, aeuum, tam, longus, ut, nos, tam, breuis, ut, antilocho",40,"NaN, NaN, NaN, NaN, 0.0, NaN, NaN, NaN, NaN, 0.5, 0.5, NaN, NaN, NaN, NaN, NaN, NaN, -1.0, NaN, 0.0, NaN, NaN, -1.0, NaN, 0.0, NaN, NaN, 0.0, NaN, NaN, NaN, NaN, NaN, 0.0, NaN, NaN, NaN, NaN, NaN, NaN",-0.025,-0.05,"hic, per-emo",0.05
ausonius.epitaphia,9.0,"orbis, tego, medium, magnus, uirtus, paternus, qui, puer, et, rex, pyrrhus, opimus, fero, impius, ante, ara, qui, fraus, per-emo, orestes, quis, mirus, caedo, iam, genetrix, furo",26,"NaN, NaN, NaN, 0.0, 1.0, NaN, NaN, 0.0, NaN, 0.0, NaN, NaN, NaN, -1.0, NaN, NaN, NaN, -1.0, NaN, NaN, NaN, 1.0, NaN, NaN, NaN, NaN",0.0,-0.077,"impius, fraus, per-emo, furo",0.154
ausonius.epitaphia,10.0,"neque, ego, non, dignus, titulus, pleuronia, credo, qui, communis, sum, cum, diomede, domus, euryalo, et, sthenelo, nam, tertius, hic, ego, regnum, possedi, de, quo, nunc, satis, sum, tumulus",28,"NaN, NaN, NaN, 1.0, NaN, NaN, NaN, NaN, 0.0, NaN, NaN, NaN, 0.0, NaN, NaN, NaN, NaN, 0.0, NaN, NaN, 0.0, NaN, NaN, NaN, NaN, 0.5, NaN, NaN",0.054,0.0,hic,0.036
ausonius.epitaphia,11.0,"gunea, pontus, habeo, tumulus, sine, corpus, nomen, fama, homo, inter, caelum, animus, repeto, cunctus, elementum, duco, tantus, communis, sepulcrum, qui, caelum, et, tellus, et, mare, et, os, uir",28,"NaN, 0.0, NaN, NaN, NaN, 0.0, 0.0, 1.0, 0.0, NaN, 0.5, 0.5, NaN, 0.0, 0.5, NaN, NaN, 0.0, NaN, NaN, 0.5, NaN, NaN, NaN, 0.0, NaN, 0.0, 0.5",0.125,0.0,sepulcrum,0.036
ausonius.epitaphia,12.0,"fatalis, ad-scribo, nomen, ego, protesilao, nam, primus, danaum, bellum, obeo, phrygio, audax, ingredior, sigeia, litus, saltus, capio, pellax, lartiadae, insidiae, qui, ne, troianae, premo, pes, litus, terra, ipse, super, proprius, de_-sileo, clipeus, quis, queror, hic, letum, iam, tum, meus, fatum, caneo, talis, ego, nomen, cum, pater, inpono",47,"0.0, NaN, 0.0, NaN, NaN, NaN, 0.5, NaN, 0.0, NaN, NaN, NaN, NaN, NaN, NaN, NaN, NaN, NaN, NaN, NaN, NaN, NaN, NaN, NaN, 0.0, NaN, 0.0, NaN, NaN, 0.0, NaN, NaN, NaN, NaN, NaN, -1.0, NaN, NaN, 0.0, 0.0, NaN, NaN, NaN, 0.0, NaN, 0.0, NaN",-0.011,-0.021,"danaum, audax, insidiae, hic",0.085
ausonius.epitaphia,13.0,"prodeo, ad, poena, scelero, fraus, lacaenae, et, deformo, corpus, deiphobus, non, habeo, tumulus, nisi, qui, ego, uox, uoco, et, pius, aeneas, et, marum, con-pono",24,"NaN, NaN, -1.0, NaN, -1.0, NaN, NaN, NaN, 0.0, NaN, NaN, NaN, NaN, NaN, NaN, NaN, 0.0, NaN, NaN, NaN, NaN, NaN, NaN, NaN",-0.083,-0.083,"poena, scelero, fraus, deformo",0.167
ausonius.epitaphia,14.0,"hector, hic, tumulus, cum, quo, suus, troia, sepelio, sum, condo, pariter, qui, pereo, simul",14,"NaN, NaN, NaN, NaN, NaN, NaN, NaN, NaN, NaN, NaN, NaN, NaN, NaN, NaN",nan,nan,"hic, sepelio",0.143
ausonius.epitaphia,15.0,"flos, asia, tantus, unus, de, gens, supersto, paruulus, argiuis, sed, iam, de, pater, timeo, hic, iaceo, astyanax, scaeis, deicio, ab, altus, pro, dolor, iliacus, neptunia, moenia, murus, uideo, aliquis, crudelis, hector, traho",32,"0.5, NaN, NaN, NaN, NaN, 0.0, NaN, NaN, NaN, NaN, NaN, NaN, 0.0, NaN, NaN, NaN, NaN, NaN, NaN, NaN, 0.5, NaN, -1.0, NaN, NaN, NaN, NaN, NaN, NaN, -1.0, NaN, NaN",-0.031,-0.062,"hic, iaceo, crudelis",0.094
ausonius.epitaphia,16.0,"sarpedo, -ne, lydus, gigno, io, numen, pater, spero, caelum, sed, tego, hic, tumulus, sanguineus, fletus, lacrima, pro, ferreus, fatum, et, patior, luctus, qui, prohibeo, possum",25,"NaN, NaN, NaN, NaN, NaN, NaN, 0.0, NaN, 0.5, NaN, NaN, NaN, NaN, NaN, NaN, NaN, NaN, NaN, 0.0, NaN, NaN, -1.0, NaN, NaN, NaN",-0.02,-0.04,hic,0.04
ausonius.epitaphia,17.0,"nastes, amphimachusque, nomio, inclutus, proles, ductor, quondam, puluis, et, umbra, sum",11,"NaN, NaN, NaN, 0.5, 0.0, NaN, NaN, NaN, NaN, NaN, NaN",0.045,0.0,,0.0
ausonius.epitaphia,18.0,"hector, prosterno, neque, deus, neque, uis, aequus, congredior, saeuus, troilus, aeacides, rapto, biga, frater, coniungo, honor, qui, ob, exemplum, neque, ego, poena, grauis",23,"NaN, NaN, NaN, 0.0, NaN, 1.0, 0.5, NaN, -1.0, NaN, NaN, NaN, NaN, 0.0, NaN, 1.0, NaN, NaN, 0.0, NaN, NaN, -1.0, -0.5",0.0,-0.109,"saeuus, aeacides, poena",0.13
ausonius.epitaphia,19.0,"cedo, procul, myrtum, iste, fugio, nescius, hospes, telum, seges, sum, sanguis, adolesco, meus, configo, iaculis, et, ab, ipse, caedes, sepelio, condo, in, hic, tumulus, bis, polydorus, ego, scio, pius, aeneas, et, tu, rex, impius, qui, ego, thracia, poena, premo, troia, cura, tego",42,"NaN, NaN, NaN, NaN, NaN, -0.5, 0.0, NaN, NaN, NaN, NaN, NaN, 0.0, NaN, NaN, NaN, NaN, NaN, -0.5, NaN, NaN, NaN, NaN, NaN, NaN, NaN, NaN, NaN, NaN, NaN, NaN, NaN, 0.0, -1.0, NaN, NaN, NaN, -1.0, NaN, NaN, -1.0, NaN",-0.095,-0.095,"nescius, caedes, sepelio, hic, tu, impius, poena",0.167
ausonius.epitaphia,20.0,"euphemum, ciconum, ductor, troia, tellus, condo, hastas, mars, ad, effigies, neque, satis, sum, titulis, saxum, incido, sepulcrum, insuper, et, frons, moles, onero, statua, ocior, iste, ruo, qui, sic, cumulo, loco, magnus, ubi, sum, cultus, magnus, ruina, subsum",37,"NaN, NaN, NaN, NaN, NaN, NaN, NaN, NaN, NaN, 0.0, NaN, 0.5, NaN, NaN, 0.0, NaN, NaN, NaN, NaN, 0.0, NaN, NaN, NaN, NaN, NaN, NaN, NaN, NaN, NaN, NaN, 0.0, NaN, NaN, -0.5, 0.0, NaN, NaN",0.0,-0.014,sepulcrum,0.027
ausonius.epitaphia,21.0,"hippothoum, pyleumque, teneo, gremium, infimus, tellus, caulis, et, malua, tergum, supernus, uireo, neque, uexo, cinis, hortus, cultura, quiesco, dum, parco, manus, mollis, holus, excolo",24,"NaN, NaN, NaN, 0.0, 0.0, NaN, NaN, NaN, NaN, NaN, NaN, NaN, NaN, NaN, NaN, NaN, NaN, NaN, NaN, NaN, 0.0, NaN, NaN, NaN",0.0,0.0,uexo,0.042
ausonius.epitaphia,22.0,"ennomus, hic, chromiusque, iaceo, quis, mysia, regnum, quis, pater, alcinous, oceanusque, atauus, nobilitas, quis, tantus, iuuo, quo, clarus, iste, sum, genus, hic, mors, condicio, grauis",25,"NaN, NaN, NaN, NaN, NaN, NaN, 0.0, NaN, 0.0, NaN, NaN, NaN, 1.0, NaN, NaN, NaN, NaN, 0.5, NaN, NaN, 0.0, NaN, -1.0, 0.0, -0.5",0.0,-0.06,"hic, iaceo, hic",0.12
ausonius.epitaphia,23.0,"hic, priami, non, sum, tumulus, neque, condo, in, iste, sedes, caput, danai, deripuere, meus, at, ego, cum, lacer, sine, nomen, funus, habeo, confugio, ad, cinis, hectoreos, genitor, illic, et, nascor, troiamque, asia, sepelio, inuenio, et, nos, quisquis, ubique, iaceo",39,"NaN, NaN, NaN, NaN, NaN, NaN, NaN, NaN, NaN, 0.0, 0.0, NaN, NaN, 0.0, NaN, NaN, NaN, NaN, NaN, 0.0, -0.5, NaN, NaN, NaN, NaN, NaN, NaN, NaN, NaN, NaN, NaN, NaN, NaN, NaN, NaN, NaN, NaN, NaN, NaN",-0.013,-0.013,"hic, danai, sepelio, iaceo",0.103
ausonius.epitaphia,24.0,"qui, tumulus, priami, quaero, lego, hector, ante, ille, meus, natus, qui, prior, ipse, do, xxiu, a.hector, hector, et, patria, simul, sum, communis, sepulcrum, ambo, quoniam, iungo, ruina, sum",28,"NaN, NaN, NaN, NaN, NaN, NaN, NaN, NaN, 0.0, 0.0, NaN, 0.5, NaN, NaN, NaN, NaN, NaN, NaN, NaN, NaN, NaN, 0.0, NaN, NaN, NaN, NaN, NaN, NaN",0.018,0.0,sepulcrum,0.036
ausonius.epitaphia,25.0,"qui, regina, sum, qui, clarus, nata, dymante, qui, priami, coniunx, hector, qui, gigno, hic, hecuba, in-iacio, pereo, superobruta, saxum, sed, rabies, lingua, ego, tamen, ulciscor, prior, fido, ne, regnum, et, proles, et, stirps, parens, quicumque, hic, nos, σῆμα, κυνὸς, lego",40,"NaN, NaN, NaN, NaN, 0.5, NaN, NaN, NaN, NaN, -0.5, NaN, NaN, NaN, NaN, NaN, NaN, NaN, NaN, 0.0, NaN, -1.0, -0.5, NaN, NaN, NaN, 0.5, NaN, NaN, 0.0, NaN, 0.0, NaN, NaN, 0.5, NaN, NaN, NaN, NaN, NaN, NaN",-0.013,-0.05,"hic, rabies, ulciscor, hic",0.1
ausonius.epitaphia,26.0,"troas, achilleos, coniungo, polyxena, bustum, malo, nullus, caespes, fungor, tego, non, bene, discors, tumulus, misceo, achiui, hic, uiolaris, magis, quam, sepelio, sum",22,"NaN, NaN, NaN, NaN, NaN, NaN, NaN, NaN, NaN, NaN, NaN, NaN, NaN, NaN, NaN, NaN, NaN, NaN, NaN, NaN, NaN, NaN",nan,nan,"bustum, hic, uiolaris, sepelio",0.182
ausonius.epitaphia,27.0,"thebaris, regina, sum, sipyleia, cautes, qui, modo, sum, laedo, numen, letoidum, bis, septem, obstino, genetrix, laetus, atque, superbus, tot, duco, mater, funero, quot, gigno, neque, satis, hic, diuus, durus, circumdo, saxum, amitto, humanus, corpus, effigies, sed, dolor, obstruo, quamquam, uital, haereo, perpetuus, rigo, fons, pius, lacrima, pro, facinus, tantus, -ne, animus, caelestis, ira, duro, adhuc, luctus, mater, imago, pereo",59,"NaN, NaN, NaN, NaN, 0.0, NaN, NaN, NaN, NaN, NaN, NaN, NaN, NaN, NaN, NaN, 1.0, NaN, -1.0, NaN, NaN, 0.0, NaN, NaN, NaN, NaN, 0.5, NaN, 0.0, -0.5, NaN, 0.0, NaN, 0.0, 0.0, 0.0, NaN, -1.0, NaN, NaN, NaN, NaN, 0.0, NaN, NaN, NaN, NaN, NaN, -1.0, NaN, NaN, 0.5, NaN, -1.0, NaN, NaN, -1.0, 0.0, NaN, NaN",-0.059,-0.093,"hic, facinus",0.034
ausonius.epitaphia,28.0,"dico, canis, hic, qui, tumulus, canis.at, canis, hic, quis, diogenes.obiit, non, obeo, sed, abeo, diogenes, qui, pera, penus, qui, dolium, sedes, ad, manes, abeo, cerberus, inde, ueto, et, quonam, clarus, flagro, qui, stella, leo, addo, sum, iustus, nunc, canis, erigonae",40,"NaN, NaN, NaN, NaN, NaN, NaN, NaN, NaN, NaN, NaN, NaN, NaN, NaN, NaN, NaN, NaN, NaN, NaN, NaN, NaN, 0.0, NaN, NaN, NaN, NaN, NaN, NaN, NaN, NaN, 0.5, NaN, NaN, NaN, NaN, NaN, NaN, 1.0, NaN, NaN, NaN",0.037,0.0,"hic, hic, dolium, leo",0.1
ausonius.epitaphia,29.0,"pera, polenta, tribo, -ne, baculus, scyphus, artus, supellex, iste, sum, cynici, sed, puto, hic, nimius, namque, caueo, manus, cerno, poto, bubulcus, cur, scyphe, tu, dico, gero, superuacuus",27,"NaN, NaN, NaN, NaN, NaN, NaN, NaN, NaN, NaN, NaN, NaN, NaN, NaN, NaN, NaN, NaN, NaN, 0.0, NaN, NaN, NaN, NaN, NaN, NaN, NaN, NaN, NaN",0.0,0.0,"hic, nimius, tu",0.111
ausonius.epitaphia,30.0,"effigies, rex, croese, tuus, diues, rex, uideo, aput, manes, diogenes, cynicus, nihil, inquam, tu, croese, tuus, supero, ego, cunctus, nudus, sum, sic, sum, nihil, habeo, hic, habeo, rex, aio, haud, egui, cum, tu, mendicus, careo, omnis, et, careo, si, modo, non, egeo",42,"0.0, 0.0, NaN, 0.0, 0.5, 0.0, NaN, NaN, NaN, NaN, NaN, NaN, NaN, NaN, NaN, 0.0, NaN, NaN, 0.0, 0.0, NaN, NaN, NaN, NaN, NaN, NaN, NaN, 0.0, NaN, NaN, NaN, NaN, NaN, -1.0, NaN, NaN, NaN, NaN, NaN, NaN, NaN, NaN",-0.012,-0.024,"tu, hic, tu",0.071
ausonius.epitaphia,31.0,"spargo, merus, cinis, bene, oleo, et, unguis, nardus, hospes, et, addo, rodo, balsamum, puniceus, perpetuus, ego, uer, ago, inlacrimabilis, urna, et, commuto, saeculum, non, obeo, nullus, ego, ueto, pereo, gaudium, uita, seu, memini, puto, omnis, siue, nihil",37,"NaN, NaN, NaN, NaN, NaN, NaN, NaN, NaN, 0.0, NaN, NaN, NaN, NaN, NaN, 0.0, NaN, NaN, NaN, NaN, NaN, NaN, NaN, NaN, NaN, NaN, NaN, NaN, NaN, NaN, 1.0, 0.0, NaN, NaN, NaN, NaN, NaN, NaN",0.027,0.0,puniceus,0.027
ausonius.epitaphia,32.0,"unus, quidem, geminus, fulgeo, sed, dissero, pungo, littera, praenome, -ne, sic, l, nosco, solus, facio, post, .m, irrideo, sum, puto, sic, μ, non, totus, uideo, dis-sileo, saxum, fragmen, laedo, apex, neque, quisquam, marius, seu, marcius, annus, metellus, hic, iaceo, certus, nosco, indicium, trunco, conuulsus, iaceo, elementum, figura, omnis, confundo, interfere, nosco, miro, pereo, homo, monumentum, fatisco, mors, etiam, saxum, nomen, uenio",61,"NaN, NaN, NaN, NaN, NaN, NaN, NaN, 0.0, NaN, NaN, NaN, NaN, NaN, -0.5, NaN, NaN, NaN, NaN, NaN, NaN, NaN, NaN, NaN, NaN, NaN, NaN, 0.0, NaN, NaN, NaN, NaN, NaN, NaN, NaN, NaN, 0.0, NaN, NaN, NaN, 0.5, NaN, NaN, NaN, NaN, NaN, 0.5, NaN, NaN, NaN, NaN, NaN, NaN, NaN, 0.0, NaN, NaN, -1.0, NaN, 0.0, 0.0, NaN",-0.008,-0.025,"hic, iaceo, iaceo",0.049
ausonius.epitaphia,33.0,"phosphore, clamosus, spatiosus, per, aequor, circos, septeni, soleo, uictor, obeo, uia, inproperanter, ago, primus, ab, carcer, curro, fortis, praegressis, ut, potereris, equus, promptus, et, uelox, sum, anticiparis, quadrigae, uictor, etiam, uinco, laus, potis, hic, titulis, uanus, solacium, sumo, sepulcrum, et, gradior, elysios, praepes, ad, alipedes, pegasus, hinc, dexter, curro, tu, laeuus, ario, -ne, funis, eo, quartus, do, tu, castor, equus",60,"NaN, NaN, NaN, NaN, 0.0, NaN, NaN, NaN, NaN, NaN, 0.0, NaN, NaN, 0.5, NaN, NaN, NaN, 0.5, NaN, NaN, NaN, NaN, NaN, NaN, NaN, NaN, NaN, NaN, NaN, NaN, NaN, 1.0, 0.0, NaN, NaN, -0.5, 1.0, NaN, NaN, NaN, NaN, NaN, NaN, NaN, NaN, NaN, NaN, NaN, NaN, NaN, -1.0, NaN, NaN, NaN, NaN, 0.0, NaN, NaN, NaN, NaN",0.025,-0.025,"carcer, hic, uanus, sepulcrum, tu, tu",0.1
ausonius.epitaphia,34.0,"ego, sui, et, uxor, et, obstino, communis, sepulcrum, constituo, serus, carus, ad, exsequiae, iam, diu, monumentum, uaco, sum, iste, querela, longus, et, uenio, ordo, quisque, suus, nascor, qui, lex, do, placidus, per, aeuum, condo, natus, qui, prior, ille, prior",39,"NaN, NaN, NaN, 0.0, NaN, NaN, 0.0, NaN, NaN, NaN, 1.0, NaN, -0.5, NaN, NaN, NaN, NaN, NaN, NaN, -0.5, 0.0, NaN, NaN, 0.5, NaN, NaN, NaN, NaN, 0.5, NaN, 1.0, NaN, NaN, NaN, 0.0, NaN, 0.5, NaN, 0.5",0.077,-0.026,"uxor, sepulcrum",0.051
ausonius.epitaphia,35.0,"omnis, qui, longus, uita, cupio, in, aeuum, ante, quater, plenus, consumo, anicia, lustrum, infer, iacto, pubes, et, uirgo, adolesco, nubo, concipio, pario, iam, mater, obiuit, quis, mors, accuso, quis, non, accuso, in, iste, aetas, meritum, anus, sum, aetas, puella",39,"NaN, NaN, 0.0, 0.0, NaN, NaN, NaN, NaN, NaN, 0.0, NaN, NaN, NaN, NaN, NaN, NaN, NaN, NaN, NaN, NaN, NaN, NaN, NaN, 0.0, NaN, NaN, -1.0, NaN, NaN, NaN, NaN, NaN, NaN, 0.0, 1.0, 0.0, NaN, 0.0, NaN",0.0,-0.026,"uirgo, nubo",0.051
