Text,Stelle,Inahlt,Wortzahl,Sentiment Rechnung,Sentiment-Score,alternativer Sentiment-Score,Invektiven,Invektivitäts-Score
ausonius.eclogarum_liber,1.1,"“cui, donum, lepidus, nouus, libellus",5,"NaN, 0.0, NaN, 1.0, 0.0",0.2,0.0,,0.0
ausonius.eclogarum_liber,1.2,"ueronensis, aio, poeta, quondam",4,"NaN, NaN, 0.0, NaN",0.0,0.0,,0.0
ausonius.eclogarum_liber,1.3,"inuentoque, do, statim, nepos",4,"NaN, NaN, NaN, 0.0",0.0,0.0,,0.0
ausonius.eclogarum_liber,1.4,"at, nos, illepidus, rudis, libellus",5,"NaN, NaN, -1.0, -0.5, 0.0",-0.3,-0.3,,0.0
ausonius.eclogarum_liber,1.5,"burras, quisquiliae, ineptiasque",3,"NaN, NaN, NaN",nan,nan,,0.0
ausonius.eclogarum_liber,1.6,"credo, gremium, qui, foueo",4,"NaN, 0.0, NaN, NaN",0.0,0.0,,0.0
ausonius.eclogarum_liber,1.7,"inuenio, trepidus, sileo, nugae",4,"NaN, -1.0, NaN, -1.0",-0.5,-0.5,,0.0
ausonius.eclogarum_liber,1.8,"neque, doceo, paruus, et, magis, benignus",6,"NaN, NaN, 0.0, NaN, NaN, 1.0",0.167,0.0,,0.0
ausonius.eclogarum_liber,1.9,"quam, qui, gallia, praebeo, catullo",5,"NaN, NaN, NaN, NaN, NaN",nan,nan,,0.0
ausonius.eclogarum_liber,1.1,"hic, nullus, ego, carus, meus",5,"NaN, NaN, NaN, 1.0, 0.0",0.2,0.0,hic,0.2
ausonius.eclogarum_liber,1.11,"qui, multus, facio, nouo, soror",5,"NaN, 0.0, NaN, NaN, NaN",0.0,0.0,,0.0
ausonius.eclogarum_liber,1.12,"quam, cunctus, alius, marum, dempto",5,"NaN, 0.0, NaN, NaN, NaN",0.0,0.0,,0.0
ausonius.eclogarum_liber,1.13,"“, pacatum, haud, dubius, poeta, dico",6,"NaN, NaN, NaN, -0.5, 0.0, NaN",-0.083,-0.083,,0.0
ausonius.eclogarum_liber,1.14,"ipse, sum, intrepidus, uolo, uerro",5,"NaN, NaN, 1.0, NaN, NaN",0.2,0.0,,0.0
ausonius.eclogarum_liber,1.15,"et, nidus, in, gremium, fouete, tueor",6,"NaN, NaN, NaN, 0.0, NaN, NaN",0.0,0.0,,0.0
ausonius.eclogarum_liber,1.16,"hic, tu, diligo, hic, uolo, tueor",6,"NaN, NaN, NaN, NaN, NaN, NaN",nan,nan,"hic, tu, hic",0.5
ausonius.eclogarum_liber,1.17,"ignosco, tego, probo, trado",4,"NaN, NaN, NaN, NaN",nan,nan,,0.0
ausonius.eclogarum_liber,1.18,"post, hic, iudicium, timeo, nullus, ual",6,"NaN, NaN, 0.5, NaN, NaN, NaN",0.083,0.0,hic,0.167
ausonius.eclogarum_liber,2.1,"qui, uita, sectabor, iter, si, plenus, tumultus",7,"NaN, 0.0, NaN, 0.0, NaN, 0.0, NaN",0.0,0.0,,0.0
ausonius.eclogarum_liber,2.2,"sum, foro, si, cura, domus, anxius, si, peregrinus",8,"NaN, NaN, NaN, -1.0, 0.0, -1.0, NaN, NaN",-0.25,-0.25,,0.0
ausonius.eclogarum_liber,2.3,"cura, domus, sequor, mercantem, si, nouo, semper",7,"-1.0, 0.0, NaN, NaN, NaN, NaN, NaN",-0.143,-0.143,,0.0
ausonius.eclogarum_liber,2.4,"damno, maneo, cessaris, ueto, si, turpis, egestas",7,"NaN, NaN, NaN, NaN, NaN, -1.0, -1.0",-0.286,-0.286,"damno, turpis, egestas",0.429
ausonius.eclogarum_liber,2.5,"si, uexo, labor, agricola, mare, naufragus, horror",7,"NaN, NaN, -0.5, NaN, 0.0, -0.5, -1.0",-0.286,-0.286,"uexo, naufragus",0.286
ausonius.eclogarum_liber,2.6,"infamo, poena, grauis, in, caelibe, uito",6,"NaN, -1.0, -0.5, NaN, NaN, NaN",-0.25,-0.25,"infamo, poena",0.333
ausonius.eclogarum_liber,2.7,"et, grauis, caueo, custodia, uanus, maritus",6,"NaN, -0.5, NaN, NaN, -0.5, 0.0",-0.167,-0.167,"uanus, maritus",0.333
ausonius.eclogarum_liber,2.8,"sanguineus, si, mars, opus, si, turpis, lucrum",7,"NaN, NaN, NaN, 0.5, NaN, -1.0, 0.5",0.0,-0.143,turpis,0.143
ausonius.eclogarum_liber,2.9,"faenus, et, uelox, inops, utor, trucido",6,"NaN, NaN, NaN, -1.0, NaN, NaN",-0.167,-0.167,faenus,0.167
ausonius.eclogarum_liber,2.1,"omnis, aeuum, cura, cunctus, suus, displiceo, aetas",7,"NaN, NaN, -1.0, 0.0, NaN, NaN, 0.0",-0.143,-0.143,,0.0
ausonius.eclogarum_liber,2.11,"sensus, absum, paruus, iacto, et, puer",6,"0.5, NaN, 0.0, NaN, NaN, 0.0",0.083,0.0,,0.0
ausonius.eclogarum_liber,2.12,"durus, rudimentum, et, iuuenis, temerarius, pubes",6,"-0.5, 0.0, NaN, NaN, -1.0, NaN",-0.25,-0.25,temerarius,0.167
ausonius.eclogarum_liber,2.13,"afflicto, fortuna, uir, per, bellum, per, aequor",7,"NaN, 0.0, 0.5, NaN, 0.0, NaN, 0.0",0.071,0.0,,0.0
ausonius.eclogarum_liber,2.14,"ira, insidior, catenatosque, labor",4,"-1.0, NaN, NaN, -0.5",-0.375,-0.375,,0.0
ausonius.eclogarum_liber,2.15,"muto, semper, grauis, ipse, senectus",5,"NaN, NaN, -0.5, NaN, 0.0",-0.1,-0.1,,0.0
ausonius.eclogarum_liber,2.16,"expecto, diu, uoueo, opto, malignus",5,"NaN, NaN, NaN, NaN, -1.0",-0.2,-0.2,,0.0
ausonius.eclogarum_liber,2.17,"obicio, innumerus, corpus, lacerabilis, morbus",5,"NaN, NaN, 0.0, NaN, -1.0",-0.2,-0.2,,0.0
ausonius.eclogarum_liber,2.18,"sperno, in, communis, omnis, praesens, quidam",6,"NaN, NaN, 0.0, NaN, 0.0, NaN",0.0,0.0,,0.0
ausonius.eclogarum_liber,2.19,"consto, nolo, deus, fio, iuturna, reclamo",6,"NaN, NaN, 0.0, NaN, NaN, NaN",0.0,0.0,,0.0
ausonius.eclogarum_liber,2.2,"“quo, uita, do, aeternus, cur, mors, adimo, sum",8,"NaN, 0.0, NaN, 0.5, NaN, -1.0, NaN, NaN",-0.062,-0.125,,0.0
ausonius.eclogarum_liber,2.21,"condicio, sic, caucasea, sub, rupes, prometheus",6,"0.0, NaN, NaN, NaN, 0.0, NaN",0.0,0.0,,0.0
ausonius.eclogarum_liber,2.22,"testor, saturnigenam, neque, nomen, cesso",5,"NaN, NaN, NaN, 0.0, NaN",0.0,0.0,,0.0
ausonius.eclogarum_liber,2.23,"incuso, iouem, do, sum, qui, uito, perennis",7,"NaN, NaN, NaN, NaN, NaN, NaN, NaN",nan,nan,,0.0
ausonius.eclogarum_liber,2.24,"respicio, et, ad, cultus, animus, sic, nempe, pudicus",8,"NaN, NaN, NaN, -0.5, 0.5, NaN, NaN, 0.5",0.062,-0.062,pudicus,0.125
ausonius.eclogarum_liber,2.25,"perdo, hippolytum, non, felix, cura, pudor",6,"NaN, NaN, NaN, 1.0, -1.0, 0.5",0.083,-0.167,pudor,0.167
ausonius.eclogarum_liber,2.26,"e, contra, illecebra, maculosam, dego, uita",6,"NaN, NaN, NaN, NaN, NaN, 0.0",0.0,0.0,illecebra,0.167
ausonius.eclogarum_liber,2.27,"qui, iuuo, ad-specio, poena, et, crimen, rex",7,"NaN, NaN, NaN, -1.0, NaN, -1.0, 0.0",-0.286,-0.286,"poena, crimen",0.286
ausonius.eclogarum_liber,2.28,"tereos, incestus, uel, mollio, sardanapalli",5,"NaN, NaN, NaN, NaN, NaN",nan,nan,incestus,0.2
ausonius.eclogarum_liber,2.29,"perfidia, uitaris, moneo, tres, punica, bellum",6,"-1.0, NaN, NaN, NaN, NaN, 0.0",-0.167,-0.167,perfidia,0.167
ausonius.eclogarum_liber,2.3,"sed, prohibeo, seruaris, fides, deleo, saguntos",6,"NaN, NaN, NaN, 1.0, NaN, NaN",0.167,0.0,,0.0
ausonius.eclogarum_liber,2.31,"uiuo, et, amicitia, semper, cole.crime, -ne, ob, iste",8,"NaN, NaN, 1.0, NaN, NaN, NaN, NaN, NaN",0.125,0.0,,0.0
ausonius.eclogarum_liber,2.32,"pythagoreorum, pereo, schola, doceo, sophos, hic",6,"NaN, NaN, NaN, NaN, 1.0, NaN",0.167,0.0,hic,0.167
ausonius.eclogarum_liber,2.33,"metuo, igitur, nullus, cole.crime, -ne, ob, iste",7,"NaN, NaN, NaN, NaN, NaN, NaN, NaN",nan,nan,,0.0
ausonius.eclogarum_liber,2.34,"timo, -ne, palladiis, olim, lapido, athenae",6,"NaN, NaN, NaN, NaN, NaN, NaN",nan,nan,,0.0
ausonius.eclogarum_liber,2.35,"dissideo, ambiguus, semper, mens, obuius, uoueo",6,"NaN, -0.5, NaN, 0.5, -0.5, NaN",-0.083,-0.167,,0.0
ausonius.eclogarum_liber,2.36,"neque, uolo, homo, satis, sum, opto, recuso",7,"NaN, NaN, 0.0, 0.5, NaN, NaN, NaN",0.071,0.0,,0.0
ausonius.eclogarum_liber,2.37,"sum, in, honor, placeo, mox, paeniteo, et, dominaris",8,"NaN, NaN, 1.0, NaN, NaN, NaN, NaN, NaN",0.125,0.0,,0.0
ausonius.eclogarum_liber,2.38,"ut, possum, seruio, uolo, idem, augeo, honor",7,"NaN, NaN, NaN, NaN, NaN, NaN, 1.0",0.143,0.0,,0.0
ausonius.eclogarum_liber,2.39,"inuidia, obicio, pernox, sum, cura, dissero",6,"-1.0, NaN, NaN, NaN, -1.0, NaN",-0.333,-0.333,inuidia,0.167
ausonius.eclogarum_liber,2.4,"sed, rudis, orno, uita, careo, sum, patronus",7,"NaN, -0.5, NaN, 0.0, NaN, NaN, NaN",-0.071,-0.071,,0.0
ausonius.eclogarum_liber,2.41,"et, defendo, reus, sed, gratia, rarus, cliens",7,"NaN, NaN, NaN, NaN, 1.0, NaN, 0.0",0.143,0.0,reus,0.143
ausonius.eclogarum_liber,2.42,"sum, cliens, grauis, imperium, persono, patronus",6,"NaN, 0.0, -0.5, 0.0, NaN, NaN",-0.083,-0.083,,0.0
ausonius.eclogarum_liber,2.43,"xercent, hic, ueto, pater, mox, asper, cura",7,"NaN, NaN, NaN, 0.0, NaN, -0.5, -1.0",-0.214,-0.214,hic,0.143
ausonius.eclogarum_liber,2.44,"sollicitudo, subeo, contemno, orbo, senectus",5,"-0.5, NaN, NaN, NaN, 0.0",-0.1,-0.1,,0.0
ausonius.eclogarum_liber,2.45,"et, captator, praeda, sum, heres, egenus",6,"NaN, NaN, NaN, NaN, NaN, NaN",nan,nan,,0.0
ausonius.eclogarum_liber,2.46,"uita, parcus, ago, auidus, lacerabere, fama",6,"0.0, NaN, NaN, NaN, NaN, 1.0",0.167,0.0,,0.0
ausonius.eclogarum_liber,2.47,"et, largitor, grauis, censeo, noto",5,"NaN, NaN, -0.5, NaN, NaN",-0.1,-0.1,,0.0
ausonius.eclogarum_liber,2.48,"cunctus, tu, aduerro, contrarius, casus, ergo",6,"0.0, NaN, NaN, NaN, 0.0, NaN",0.0,0.0,tu,0.167
ausonius.eclogarum_liber,2.49,"bonus, graiorum, sententia, quippe, homo, aio",6,"1.0, NaN, 0.0, NaN, 0.0, NaN",0.167,0.0,,0.0
ausonius.eclogarum_liber,2.5,"non, nascor, sum, bonus, aut, natus, cito, mors, potior, hic, quidem, pythagorica, sum, apophasis, secundus",15,"NaN, NaN, NaN, 1.0, NaN, 0.0, NaN, -1.0, NaN, NaN, NaN, NaN, NaN, NaN, 0.0",0.0,-0.067,hic,0.067
ausonius.eclogarum_liber,2.51,"talis, qui, subicio, sum, distichus, -ne",6,"NaN, NaN, NaN, NaN, NaN, NaN",nan,nan,,0.0
ausonius.eclogarum_liber,2.52,"πρῶτον, μὲν, μὴ, φῦναι, ἐν, ἀνθρώποισιν, ἄριστον",7,"NaN, NaN, NaN, NaN, NaN, NaN, NaN",nan,nan,,0.0
ausonius.eclogarum_liber,2.53,"δεύτερον, ὅττι, τάχιστα, πύλας, ̓αίδαο, περῆσαι",6,"NaN, NaN, NaN, NaN, NaN, NaN",nan,nan,,0.0
ausonius.eclogarum_liber,2.55,"contra, sed, alter, sectator, dogma, iste",6,"NaN, NaN, NaN, 0.0, NaN, NaN",0.0,0.0,,0.0
ausonius.eclogarum_liber,2.56,"quis, doceo, reprobo, subdo, disco, lego",6,"NaN, NaN, NaN, NaN, NaN, NaN",nan,nan,,0.0
ausonius.eclogarum_liber,2.57,"“, ergo, nihil, quoniam, uito, sum, qui, amo, in, iste",10,"NaN, NaN, NaN, NaN, NaN, NaN, NaN, NaN, NaN, NaN",nan,nan,,0.0
ausonius.eclogarum_liber,2.58,"neque, tamen, incassus, fas, sum, nos, credo, nascor",8,"NaN, NaN, 1.0, NaN, NaN, NaN, NaN, NaN",0.125,0.0,,0.0
ausonius.eclogarum_liber,2.59,"auctor, uita, si, iustus, credo, sum",6,"NaN, 0.0, NaN, 1.0, NaN, NaN",0.167,0.0,,0.0
ausonius.eclogarum_liber,2.6,"uito, alius, sum, nos, ille, uiuo, paro",7,"NaN, NaN, NaN, NaN, NaN, NaN, NaN",nan,nan,,0.0
ausonius.eclogarum_liber,2.61,"cum, quo, post, iste, possum, uiuo, uita",7,"NaN, NaN, NaN, NaN, NaN, NaN, 0.0",0.0,0.0,,0.0
ausonius.eclogarum_liber,2.62,"ille, equidem, stygius, propero, descendo, ad, umbra",7,"NaN, NaN, NaN, NaN, NaN, NaN, NaN",nan,nan,,0.0
ausonius.eclogarum_liber,2.63,"pythagoreorum, stolidus, qui, dogma, sequor",5,"NaN, -1.0, NaN, NaN, NaN",-0.2,-0.2,stolidus,0.2
ausonius.eclogarum_liber,2.64,"non, nascor, sui, quam, nascor, uiuo, malo",7,"NaN, NaN, NaN, NaN, NaN, NaN, NaN",nan,nan,,0.0
ausonius.eclogarum_liber,3.1,"uir, bonus, et, sapio, qual, uix, reperio, unus",8,"0.5, 1.0, NaN, NaN, NaN, NaN, NaN, NaN",0.188,0.0,,0.0
ausonius.eclogarum_liber,3.2,"mille, e, cunctus, homo, consulo, apollo",6,"NaN, NaN, 0.0, 0.0, NaN, NaN",0.0,0.0,,0.0
ausonius.eclogarum_liber,3.3,"iudex, ipse, suus, totus, sui, exploro, ad, unguis",8,"0.5, NaN, NaN, NaN, NaN, NaN, NaN, NaN",0.062,0.0,,0.0
ausonius.eclogarum_liber,3.4,"quis, proceres, uanus, leuis, quis, opinio, uulgus",7,"NaN, NaN, -0.5, 0.0, NaN, 0.0, 0.0",-0.071,-0.071,uanus,0.143
ausonius.eclogarum_liber,3.5,"securus, mundus, instar, habeo, tero, atque, rotundus",7,"1.0, 1.0, NaN, NaN, NaN, NaN, NaN",0.286,0.0,,0.0
ausonius.eclogarum_liber,3.6,"externus, ne, quis, lo, per, leuis, sidat.",7,"0.0, NaN, NaN, NaN, NaN, 0.0, NaN",0.0,0.0,,0.0
ausonius.eclogarum_liber,3.7,"ille, dies, quam, longus, sum, sub, sidus, cancer",8,"NaN, 0.0, NaN, 0.0, NaN, NaN, NaN, -1.0",-0.125,-0.125,,0.0
ausonius.eclogarum_liber,3.8,"quantus, nox, tropicus, sui, porrigo, in, capricornus",7,"NaN, 0.0, NaN, NaN, NaN, NaN, NaN",0.0,0.0,,0.0
ausonius.eclogarum_liber,3.9,"cogito, et, iustus, trutina, sui, examen, pendo",7,"NaN, NaN, 1.0, NaN, NaN, NaN, NaN",0.143,0.0,,0.0
ausonius.eclogarum_liber,3.1,"ne, quis, luo, ne, quis, protubero, angulus, aequus",8,"NaN, NaN, NaN, NaN, NaN, NaN, NaN, 0.5",0.062,0.0,luo,0.125
ausonius.eclogarum_liber,3.11,"pars, ut, coeo, nihil, ut, deliro, amussis",7,"0.0, NaN, NaN, NaN, NaN, NaN, NaN",0.0,0.0,deliro,0.143
ausonius.eclogarum_liber,3.12,"sum, solidus, quicumque, subsum, neque, inanis, subter",7,"NaN, 0.0, NaN, NaN, NaN, NaN, NaN",0.0,0.0,,0.0
ausonius.eclogarum_liber,3.13,"indico, .admotus, digitus, pello, iacio",5,"NaN, NaN, NaN, NaN, NaN",nan,nan,,0.0
ausonius.eclogarum_liber,3.14,"non, prior, in, dulcis, declino, lumen, somnus",7,"NaN, 0.5, NaN, 0.5, NaN, NaN, 0.5",0.214,0.0,,0.0
ausonius.eclogarum_liber,3.15,"omnis, quam, longus, reputauerit, ago, dies",6,"NaN, NaN, 0.0, NaN, NaN, 0.0",0.0,0.0,,0.0
ausonius.eclogarum_liber,3.16,"qui, praetergredior, quis, gero, in, tempus, quis, non.",8,"NaN, NaN, NaN, NaN, NaN, 0.0, NaN, NaN",0.0,0.0,,0.0
ausonius.eclogarum_liber,3.17,"cur, iste, facio, decus, asum, aut, ratio, ille",8,"NaN, NaN, NaN, NaN, NaN, NaN, 0.0, NaN",0.0,0.0,,0.0
ausonius.eclogarum_liber,3.18,"quis, ego, praetereo, cur, hic, sententia, sedeo",7,"NaN, NaN, NaN, NaN, NaN, 0.0, NaN",0.0,0.0,hic,0.143
ausonius.eclogarum_liber,3.19,"quam, bonus, muto, sum, miseror, egeo",6,"NaN, 1.0, NaN, NaN, NaN, NaN",0.167,0.0,,0.0
ausonius.eclogarum_liber,3.2,"cur, aliquis, frango, persentio, mens, dolor",6,"NaN, NaN, NaN, NaN, 0.5, -1.0",-0.083,-0.167,,0.0
ausonius.eclogarum_liber,3.21,"quis, uolo, qui, nolo, bonus, sum, utilis, honestus",8,"NaN, NaN, NaN, NaN, 1.0, NaN, 1.0, 1.0",0.375,0.0,honestus,0.125
ausonius.eclogarum_liber,3.22,"cur, malus, antetulis, num, dico, aut, denique, uultus",8,"NaN, -1.0, NaN, NaN, NaN, NaN, NaN, NaN",-0.125,-0.125,,0.0
ausonius.eclogarum_liber,3.23,"perstringo, quisquam, cur, ego, natura, magis, quam",7,"NaN, NaN, NaN, NaN, 0.0, NaN, NaN",0.0,0.0,,0.0
ausonius.eclogarum_liber,3.24,"disciplina, traho, sic, dictum, et, facio, per, omnis",8,"0.0, NaN, NaN, 0.0, NaN, NaN, NaN, NaN",0.0,0.0,,0.0
ausonius.eclogarum_liber,3.25,"ingredior, orior, ab, uesperus, cunctus, reuoluo",6,"NaN, NaN, NaN, NaN, 0.0, NaN",0.0,0.0,,0.0
ausonius.eclogarum_liber,3.26,"offendo, prauus, do, palma, et, praemium, rectus",7,"NaN, -1.0, NaN, NaN, NaN, 1.0, 1.0",0.143,-0.143,prauus,0.143
ausonius.eclogarum_liber,4.1,"sum, et, non, cunctus, monosyllabus, nosco, frequento",7,"NaN, NaN, NaN, 0.0, NaN, NaN, NaN",0.0,0.0,,0.0
ausonius.eclogarum_liber,4.2,"hic, deemo, nihil, sum, homo, qui, sermo, uoluto",8,"NaN, NaN, NaN, NaN, 0.0, NaN, -0.5, NaN",-0.062,-0.062,hic,0.125
ausonius.eclogarum_liber,4.3,"omnis, in, hic, et, ab, hic, sum, omnis, siue, negotium",10,"NaN, NaN, NaN, NaN, NaN, NaN, NaN, NaN, NaN, -0.5",-0.05,-0.05,"hic, hic",0.2
ausonius.eclogarum_liber,4.4,"siue, otium, quisquam, sum, seu, turbidus, siue, quietus",8,"NaN, 0.5, NaN, NaN, NaN, NaN, NaN, NaN",0.062,0.0,otium,0.125
ausonius.eclogarum_liber,4.5,"alteruter, pariter, nonnumquam, saepe, seorsus",5,"NaN, NaN, NaN, NaN, NaN",nan,nan,,0.0
ausonius.eclogarum_liber,4.6,"obsisto, studium, ut, mos, ingenium",5,"NaN, 0.5, NaN, 0.5, 0.5",0.3,0.0,,0.0
ausonius.eclogarum_liber,4.7,"ut, facilis, uel, difficilis, contentio, nanciscor, sum",7,"NaN, 0.5, NaN, -0.5, NaN, NaN, NaN",0.0,-0.071,,0.0
ausonius.eclogarum_liber,4.8,"si, consentio, mora, nullus, interuenio, “e, sum, sum",8,"NaN, NaN, NaN, NaN, NaN, NaN, NaN, NaN",nan,nan,,0.0
ausonius.eclogarum_liber,4.9,"sin, controuersus, dissensio, subicio, “no, -ne",6,"NaN, NaN, NaN, NaN, NaN, NaN",nan,nan,,0.0
ausonius.eclogarum_liber,4.1,"hinc, foro, dissulto, clamor, hinc, furiosus",6,"NaN, NaN, NaN, NaN, NaN, -1.0",-0.167,-0.167,"dissulto, furiosus",0.333
ausonius.eclogarum_liber,4.11,"iurgium, sum, circos, cuneati, hinc, fero, theatrum",7,"-1.0, NaN, NaN, NaN, NaN, NaN, NaN",-0.143,-0.143,,0.0
ausonius.eclogarum_liber,4.12,"seditio, et, talis, agito, quoque, curia, lis",7,"NaN, NaN, NaN, NaN, NaN, -1.0, -0.5",-0.214,-0.214,seditio,0.143
ausonius.eclogarum_liber,4.13,"coniugium, et, nascor, cum, pater, iste, quiesco",7,"NaN, NaN, NaN, NaN, 0.0, NaN, NaN",0.0,0.0,,0.0
ausonius.eclogarum_liber,4.14,"uerbum, sero, studium, saluo, pietas, loquor",6,"0.0, NaN, 0.5, NaN, 1.0, NaN",0.25,0.0,,0.0
ausonius.eclogarum_liber,4.15,"hinc, etiam, placidus, schola, consono, disciplina",6,"NaN, NaN, 1.0, NaN, NaN, 0.0",0.167,0.0,,0.0
ausonius.eclogarum_liber,4.16,"dogmaticus, agito, placidus, certamen, lis",5,"NaN, NaN, 1.0, 0.5, -0.5",0.2,-0.1,,0.0
ausonius.eclogarum_liber,4.17,"hinc, omnis, certo, dialectica, turba, sophos",6,"NaN, NaN, NaN, NaN, 0.0, 1.0",0.167,0.0,,0.0
ausonius.eclogarum_liber,4.18,"sum, -ne, dies, sum, ergo, dies, non, conuenio, iste",9,"NaN, NaN, 0.0, NaN, NaN, 0.0, NaN, NaN, NaN",0.0,0.0,,0.0
ausonius.eclogarum_liber,4.19,"nam, fax, multus, aut, fulgeribus, quotiens, lux",7,"NaN, NaN, 0.0, NaN, NaN, NaN, NaN",0.0,0.0,fax,0.143
ausonius.eclogarum_liber,4.2,"sum, nocturnus, homo, non, sum, lux, iste, dies",8,"NaN, NaN, 0.0, NaN, NaN, NaN, NaN, 0.0",0.0,0.0,,0.0
ausonius.eclogarum_liber,4.21,"sum, et, non, igitur, quotiens, lux, sum, fateor, sum",9,"NaN, NaN, NaN, NaN, NaN, NaN, NaN, NaN, NaN",nan,nan,,0.0
ausonius.eclogarum_liber,4.22,"sed, non, sum, dies, mille, hinc, certamen, surgo",8,"NaN, NaN, NaN, 0.0, NaN, NaN, 0.5, NaN",0.062,0.0,,0.0
ausonius.eclogarum_liber,4.23,"hinc, raucus, multus, quoque, talis, commeditor",6,"NaN, NaN, 0.0, NaN, NaN, NaN",0.0,0.0,,0.0
ausonius.eclogarum_liber,4.24,"murmur, concludo, rabiosus, silentium, rodo",5,"NaN, NaN, NaN, NaN, NaN",nan,nan,,0.0
ausonius.eclogarum_liber,4.25,"qualis, uito, homo, duo, quam, monosyllabus, uerso",7,"NaN, NaN, 0.0, NaN, NaN, NaN, NaN",0.0,0.0,,0.0
ausonius.eclogarum_liber,5.1,"ter, bini, decies, nouo, super, exeo, in, annus",8,"NaN, NaN, NaN, NaN, NaN, NaN, NaN, 0.0",0.0,0.0,,0.0
ausonius.eclogarum_liber,5.2,"iustus, senescentum, qui, impleo, uito, uir",6,"1.0, NaN, NaN, NaN, NaN, 0.5",0.25,0.0,,0.0
ausonius.eclogarum_liber,5.3,"hic, nouies, supero, uiuo, garrulus, cornix",6,"NaN, NaN, NaN, NaN, NaN, NaN",nan,nan,"hic, garrulus",0.333
ausonius.eclogarum_liber,5.4,"et, quater, egredior, cornix, saeculum, ceruus",6,"NaN, NaN, NaN, NaN, NaN, NaN",nan,nan,,0.0
ausonius.eclogarum_liber,5.5,"alipedem, ceruus, ter, uincio, coruus, et, ille",7,"NaN, NaN, NaN, NaN, NaN, NaN, NaN",nan,nan,,0.0
ausonius.eclogarum_liber,5.6,"multiplico, nouies, phoenix, reparabilis, ales",5,"NaN, NaN, NaN, 1.0, 0.0",0.2,0.0,,0.0
ausonius.eclogarum_liber,5.7,"qui, nos, perpetuus, decies, praeuertimus, aeuum",6,"NaN, NaN, 0.0, NaN, NaN, NaN",0.0,0.0,,0.0
ausonius.eclogarum_liber,5.8,"nympha, hamadryades, qui, longus, uito, sum",6,"NaN, NaN, NaN, 0.0, NaN, NaN",0.0,0.0,,0.0
ausonius.eclogarum_liber,5.9,"hic, cohibeo, finis, uiuacia, fatum, animantum",6,"NaN, NaN, 0.0, NaN, 0.0, NaN",0.0,0.0,hic,0.167
ausonius.eclogarum_liber,5.1,"ceterus, secerno, nosco, deus, arbiter, aeui",6,"0.0, NaN, NaN, 0.0, NaN, NaN",0.0,0.0,,0.0
ausonius.eclogarum_liber,5.11,"tempus, qui, stilbo, -ne, uoluo, qui, saeculum, phaeno, -ne",9,"0.0, NaN, NaN, NaN, NaN, NaN, NaN, NaN, NaN",0.0,0.0,,0.0
ausonius.eclogarum_liber,5.12,"qui, pyrois, habeo, qui, iuppiter, ignis, benignus",7,"NaN, NaN, NaN, NaN, NaN, 0.0, 1.0",0.143,0.0,,0.0
ausonius.eclogarum_liber,5.13,"circumeo, qual, propero, uenus, almus, recursus",6,"NaN, NaN, NaN, 1.0, NaN, NaN",0.167,0.0,,0.0
ausonius.eclogarum_liber,5.14,"qui, phoebus, -ne, quantus, maneo, titana, labor",7,"NaN, NaN, NaN, NaN, NaN, NaN, -0.5",-0.071,-0.071,,0.0
ausonius.eclogarum_liber,5.15,"donec, consumo, magnus, qui, dico, annus",6,"NaN, NaN, 0.0, NaN, NaN, 0.0",0.0,0.0,,0.0
ausonius.eclogarum_liber,5.16,"rursus, in, anticus, uenio, uago, sidus, cursus",7,"NaN, NaN, 0.0, NaN, NaN, NaN, NaN",0.0,0.0,,0.0
ausonius.eclogarum_liber,5.17,"qualis, dispono, sto, ab, origo, mundus",6,"NaN, NaN, NaN, NaN, NaN, 1.0",0.167,0.0,,0.0
ausonius.eclogarum_liber,6.1,"miror, quicumque, maneo, ingens, mundus",5,"NaN, NaN, NaN, -0.5, 1.0",0.1,-0.1,,0.0
ausonius.eclogarum_liber,6.2,"corpus, sublimis, caelum, circumdo, gyrus",5,"0.0, 0.5, 0.5, NaN, NaN",0.2,0.0,,0.0
ausonius.eclogarum_liber,6.3,"et, tantus, nullus, molio, intercedo, labo",6,"NaN, NaN, NaN, NaN, NaN, NaN",nan,nan,,0.0
ausonius.eclogarum_liber,6.4,"accipio, qui, miro, magis, tenuis, tantus",6,"NaN, NaN, NaN, NaN, 0.0, NaN",0.0,0.0,,0.0
ausonius.eclogarum_liber,6.5,"principia, et, noster, non, admitto, uideo",6,"NaN, NaN, NaN, NaN, NaN, NaN",nan,nan,,0.0
ausonius.eclogarum_liber,6.6,"paruaris, series, consto, conecto, atomus",5,"NaN, 0.5, NaN, NaN, NaN",0.1,0.0,,0.0
ausonius.eclogarum_liber,6.7,"sed, solidus, in, paruus, nullus, secabilis, segme, -ne",8,"NaN, 0.0, NaN, 0.0, NaN, NaN, NaN, NaN",0.0,0.0,,0.0
ausonius.eclogarum_liber,6.8,"unde, uigor, uireo, maneo, aeternus, res",6,"NaN, NaN, NaN, NaN, 0.5, 0.0",0.083,0.0,,0.0
ausonius.eclogarum_liber,6.9,"mobilito, nullus, umquam, superabilis, aeuum",5,"NaN, NaN, NaN, NaN, NaN",nan,nan,,0.0
ausonius.eclogarum_liber,6.1,"diuinus, humanus, licet, con-pono, sic, sum",6,"0.5, 0.0, NaN, NaN, NaN, NaN",0.083,0.0,,0.0
ausonius.eclogarum_liber,6.11,"as, solidus, quoniam, bis, sex, de, pars, aequus",8,"0.0, 0.0, NaN, NaN, NaN, NaN, 0.0, 0.5",0.062,0.0,,0.0
ausonius.eclogarum_liber,6.12,"consto, et, in, paruus, par, tamen, unus, maneo, uolo",9,"NaN, NaN, NaN, 0.0, 0.5, NaN, NaN, NaN, NaN",0.056,0.0,,0.0
ausonius.eclogarum_liber,6.13,"nam, si, quis, numerus, minuo, summus, uacillo",7,"NaN, NaN, NaN, NaN, NaN, NaN, NaN",nan,nan,,0.0
ausonius.eclogarum_liber,6.14,"conuulsaeque, ruo, labefacto, corpus, pars",5,"NaN, NaN, NaN, 0.0, 0.0",0.0,0.0,,0.0
ausonius.eclogarum_liber,6.15,"ut, medius, si, quis, uello, de, fornix, saxum",8,"NaN, 0.0, NaN, NaN, NaN, NaN, NaN, 0.0",0.0,0.0,,0.0
ausonius.eclogarum_liber,6.16,"incumbo, qui, cunctus, simul, deuexus, sequor",6,"NaN, NaN, 0.0, NaN, NaN, NaN",0.0,0.0,deuexus,0.167
ausonius.eclogarum_liber,6.17,"ceterus, communis, traho, ab, uertex, labor",6,"0.0, 0.0, NaN, NaN, NaN, -0.5",-0.083,-0.083,,0.0
ausonius.eclogarum_liber,6.18,"non, aliter, liber, sum, si, desum, uncia, totus",8,"NaN, NaN, 0.5, NaN, NaN, NaN, NaN, NaN",0.062,0.0,,0.0
ausonius.eclogarum_liber,6.19,"non, sum, as, nomen, deunx, iam, casus, habeo",8,"NaN, NaN, 0.0, 0.0, NaN, NaN, 0.0, NaN",0.0,0.0,,0.0
ausonius.eclogarum_liber,6.2,"neque, dextans, retineo, nomen, sextante, remoueo",6,"NaN, NaN, NaN, 0.0, NaN, NaN",0.0,0.0,,0.0
ausonius.eclogarum_liber,6.21,"et, dodrans, quadro, sero, auctor, careo",6,"NaN, NaN, NaN, NaN, NaN, NaN",nan,nan,,0.0
ausonius.eclogarum_liber,6.22,"diuulsusque, triens, prohibeo, persisto, bessem",5,"NaN, NaN, NaN, NaN, NaN",nan,nan,,0.0
ausonius.eclogarum_liber,6.23,"iam, quincunx, tu, nullus, sum, si, gramma, reuellas",8,"NaN, NaN, NaN, NaN, NaN, NaN, NaN, NaN",nan,nan,tu,0.125
ausonius.eclogarum_liber,6.24,"et, semis, qui, semis, sum, pereo, adsum",7,"NaN, NaN, NaN, NaN, NaN, NaN, NaN",nan,nan,,0.0
ausonius.eclogarum_liber,6.25,"pars, et, qui, libra, pars, septimus, septunx",7,"0.0, NaN, NaN, NaN, 0.0, NaN, NaN",0.0,0.0,,0.0
ausonius.eclogarum_liber,6.26,"liber, igitur, totus, si, nullus, in, pars, uacillet",8,"0.5, NaN, NaN, NaN, NaN, NaN, 0.0, NaN",0.062,0.0,,0.0
ausonius.eclogarum_liber,6.27,"pondus, et, numerus, morus, opus, et, aqua",7,"NaN, NaN, NaN, -1.0, 0.5, NaN, 0.0",-0.071,-0.143,,0.0
ausonius.eclogarum_liber,6.28,"liber, neque, sum, modulus, qui, non, hic, nomen, signo",9,"0.5, NaN, NaN, NaN, NaN, NaN, NaN, 0.0, NaN",0.056,0.0,hic,0.111
ausonius.eclogarum_liber,6.29,"tellus, medium, qui, pendeo, in, aer, liber, sum",8,"NaN, NaN, NaN, NaN, NaN, 0.0, 0.5, NaN",0.062,0.0,,0.0
ausonius.eclogarum_liber,6.3,"et, sol, luna, uia, suus, liber, cohercet",7,"NaN, NaN, NaN, 0.0, NaN, 0.5, NaN",0.071,0.0,,0.0
ausonius.eclogarum_liber,6.31,"liber, dius, somnus, par, determino, horas, liber, caledonios, sine, litus, contineo, aestus, tu, quoque, certus, mane, mos, ego, liber, meus",20,"0.5, NaN, 0.5, 0.5, NaN, NaN, 0.5, NaN, NaN, NaN, NaN, NaN, NaN, NaN, 0.5, NaN, 0.5, NaN, 0.5, 0.0",0.175,0.0,tu,0.05
ausonius.eclogarum_liber,7.1,"omnis, qui, uario, res, metior, in, actus",7,"NaN, NaN, NaN, 0.0, NaN, NaN, NaN",0.0,0.0,,0.0
ausonius.eclogarum_liber,7.2,"astrum, dominor, ago, terrenus, tantus",5,"NaN, NaN, NaN, NaN, NaN",nan,nan,,0.0
ausonius.eclogarum_liber,7.3,"membrum, homo, e, superi, fortuna, et, spiritus, auris",8,"NaN, 0.0, NaN, NaN, 0.0, NaN, 0.0, NaN",0.0,0.0,,0.0
ausonius.eclogarum_liber,7.4,"septeni, modero, chorus, sed, praesideo, ille",6,"NaN, NaN, NaN, NaN, NaN, NaN",nan,nan,,0.0
ausonius.eclogarum_liber,7.5,"sortior, regime, -ne, nitidus, sol, aureus, aethra",7,"NaN, NaN, NaN, 0.5, NaN, 0.5, NaN",0.143,0.0,,0.0
ausonius.eclogarum_liber,7.6,"neque, solus, in, nos, moderor, tempus, uita",7,"NaN, -0.5, NaN, NaN, NaN, 0.0, 0.0",-0.071,-0.071,,0.0
ausonius.eclogarum_liber,7.7,"dum, breuis, sollicitus, spatium, produco, aeuum",6,"NaN, NaN, -1.0, NaN, NaN, NaN",-0.167,-0.167,,0.0
ausonius.eclogarum_liber,7.8,"credo, occulo, sero, et, tempus, uita",6,"NaN, NaN, NaN, NaN, 0.0, 0.0",0.0,0.0,,0.0
ausonius.eclogarum_liber,7.9,"maternus, duco, uterus, formo, uideo",5,"NaN, NaN, NaN, NaN, NaN",nan,nan,,0.0
ausonius.eclogarum_liber,7.1,"et, nondum, exorior, lex, con-pono, uita",6,"NaN, NaN, NaN, 0.5, NaN, 0.0",0.083,0.0,,0.0
ausonius.eclogarum_liber,7.11,"namque, ubi, concipio, genital, in-sedeo, aruum",6,"NaN, NaN, NaN, NaN, NaN, NaN",nan,nan,,0.0
ausonius.eclogarum_liber,7.12,"haud, dubius, sol, quicumque, insisto, signum",6,"NaN, -0.5, NaN, NaN, NaN, 0.0",-0.083,-0.083,,0.0
ausonius.eclogarum_liber,7.13,"qui, cum, uicinus, statio, capio, astrion",6,"NaN, NaN, 0.0, NaN, NaN, NaN",0.0,0.0,,0.0
ausonius.eclogarum_liber,7.14,"contiguos, nullus, transfundo, lumen, in, ortus",6,"NaN, NaN, NaN, NaN, NaN, NaN",nan,nan,,0.0
ausonius.eclogarum_liber,7.15,"at, ubi, conuerro, post, menstruus, tempus, habena",7,"NaN, NaN, NaN, NaN, NaN, 0.0, NaN",0.0,0.0,,0.0
