Text,Stelle,Inahlt,Wortzahl,Sentiment Rechnung,Sentiment-Score,alternativer Sentiment-Score,Invektiven,Invektivitäts-Score
ausonius.eclogarum_liber,23.34,"decertasse, forum, nunc, sui, harena, suus",6,"NaN, NaN, NaN, NaN, NaN, NaN",nan,nan,,0.0
ausonius.eclogarum_liber,23.35,"uindico, exter, qui, iam, sub, finis, december",7,"NaN, 0.0, NaN, NaN, NaN, 0.0, NaN",0.0,0.0,,0.0
ausonius.eclogarum_liber,23.36,"falcigerum, placo, sanguis, caeligenam",4,"NaN, NaN, NaN, NaN",nan,nan,,0.0
ausonius.eclogarum_liber,24.1,"primus, cleonaei, tolero, aerumna, leo",5,"0.5, NaN, NaN, -0.5, NaN",0.0,-0.1,"cleonaei, leo",0.4
ausonius.eclogarum_liber,24.2,"propior, lernaeam, ferrum, et, fax, contundo, hydram",7,"0.0, NaN, NaN, NaN, NaN, NaN, NaN",0.0,0.0,fax,0.143
ausonius.eclogarum_liber,24.3,"mox, erymantheum, uolo, tertius, percello, aper",6,"NaN, NaN, NaN, 0.0, NaN, NaN",0.0,0.0,,0.0
ausonius.eclogarum_liber,24.4,"aeripedis, quartum, fero, aureus, cornu, ceruus",6,"NaN, NaN, NaN, 0.5, NaN, NaN",0.083,0.0,,0.0
ausonius.eclogarum_liber,24.5,"stymphalidas, pello, uolucris, discrimen, quintus",5,"NaN, NaN, NaN, -1.0, NaN",-0.2,-0.2,,0.0
ausonius.eclogarum_liber,24.6,"thraeiciam, sextus, spolio, amazona, balteus",5,"NaN, NaN, NaN, NaN, NaN",nan,nan,,0.0
ausonius.eclogarum_liber,24.7,"septimus, in, augei, stabulis, impensa, labor",6,"NaN, NaN, NaN, NaN, NaN, -0.5",-0.083,-0.083,,0.0
ausonius.eclogarum_liber,24.8,"octauus, expello, numero, adoria, taurus",5,"NaN, NaN, NaN, NaN, NaN",nan,nan,,0.0
ausonius.eclogarum_liber,24.9,"in, diomedeis, uictoria, nonus, quadrigae",5,"NaN, NaN, NaN, NaN, NaN",nan,nan,,0.0
ausonius.eclogarum_liber,24.1,"geryone, ex-tingo, decimus, do, hiberia, palma",6,"NaN, NaN, NaN, NaN, NaN, NaN",nan,nan,,0.0
ausonius.eclogarum_liber,24.11,"undecimus, malus, hesperidum, destringo, triumphus",5,"NaN, -1.0, NaN, NaN, NaN",-0.2,-0.2,,0.0
ausonius.eclogarum_liber,24.12,"cerberus, extremus, .suprema, sum, meto, labor",6,"NaN, NaN, NaN, NaN, NaN, -0.5",-0.083,-0.083,,0.0
ausonius.eclogarum_liber,25.1,"flamen, uernus, cieo, obscurum, lumen, piscis",6,"NaN, NaN, NaN, NaN, NaN, NaN",nan,nan,,0.0
ausonius.eclogarum_liber,25.2,"curriculum, aries, aequo, nox, dius",5,"NaN, NaN, NaN, 0.0, NaN",0.0,0.0,,0.0
ausonius.eclogarum_liber,25.3,"cornu, qui, condo, florus, praenuntio, taurus",6,"NaN, NaN, NaN, NaN, NaN, NaN",nan,nan,,0.0
ausonius.eclogarum_liber,25.4,"aridus, aestas, geminus, primordius, pando",5,"NaN, NaN, NaN, NaN, NaN",nan,nan,,0.0
ausonius.eclogarum_liber,25.5,"longus, iam, munio, praeclarus, lumen, cancer",6,"0.0, NaN, NaN, NaN, NaN, -1.0",-0.167,-0.167,,0.0
ausonius.eclogarum_liber,25.6,"languificus, leo, proflo, ferus, os, calor",6,"NaN, NaN, NaN, -1.0, 0.0, 0.0",-0.167,-0.167,"leo, ferus",0.333
ausonius.eclogarum_liber,25.7,"post, modius, quatio, uirgo, fugo, orior, uaporo",7,"NaN, NaN, NaN, NaN, NaN, NaN, NaN",nan,nan,uirgo,0.143
ausonius.eclogarum_liber,25.8,"auctumnus, resero, porta, aequo, diurnus",5,"0.0, NaN, NaN, NaN, 0.0",0.0,0.0,,0.0
ausonius.eclogarum_liber,25.9,"tempus, nocturnus, dispenso, sidus, liber",5,"0.0, NaN, NaN, NaN, 0.5",0.1,0.0,,0.0
ausonius.eclogarum_liber,25.1,"ecfetos, ramus, denudo, flamma, nepas",5,"NaN, NaN, NaN, NaN, NaN",nan,nan,,0.0
ausonius.eclogarum_liber,25.11,"piger, sagittipotens, iaculor, frigus, terra",5,"NaN, NaN, NaN, NaN, 0.0",0.0,0.0,,0.0
ausonius.eclogarum_liber,25.12,"bruma, gelus, glacio, iubar, exspiro, capricorni",6,"NaN, NaN, NaN, NaN, NaN, NaN",nan,nan,,0.0
ausonius.eclogarum_liber,25.13,"quam, sequor, nebula, roro, liquo, altus, aquaris",7,"NaN, NaN, NaN, NaN, NaN, 0.5, NaN",0.071,0.0,,0.0
ausonius.eclogarum_liber,25.14,"tantus, supra, circo, uigeo, uolo, flammeus, mundus",7,"NaN, NaN, NaN, NaN, NaN, NaN, 1.0",0.143,0.0,,0.0
ausonius.eclogarum_liber,25.15,"at, dextera, laeua, cieo, rota, fulgidus, sol",7,"NaN, 0.0, NaN, NaN, NaN, NaN, NaN",0.0,0.0,,0.0
ausonius.eclogarum_liber,25.16,"mobilis, curriculis, et, luna, simulacrum, fero",6,"NaN, NaN, NaN, NaN, 0.0, NaN",0.0,0.0,,0.0
ausonius.eclogarum_liber,25.17,"squama, sub, aeternus, conspectus, torqueo, draco",6,"NaN, NaN, 0.5, 0.0, NaN, NaN",0.083,0.0,,0.0
ausonius.eclogarum_liber,25.18,"emineo, hic, infra, fulgeo, arcera, septem",6,"NaN, NaN, NaN, NaN, NaN, NaN",nan,nan,hic,0.167
ausonius.eclogarum_liber,25.19,"magnus, quatio, stella, quam, seruo, serus, in, altus",8,"0.0, NaN, NaN, NaN, NaN, NaN, NaN, 0.5",0.062,0.0,,0.0
ausonius.eclogarum_liber,25.2,"condio, oceani, ripa, cum, lux, bootes.",6,"NaN, NaN, NaN, NaN, NaN, NaN",nan,nan,,0.0
ausonius.eclogarum_liber,26.1,"unguis, mercurius, barba, io, cypride, crinis, mercurius, furtum, probo, unguis, semper, acuo",12,"NaN, NaN, NaN, NaN, NaN, NaN, NaN, -1.0, NaN, NaN, NaN, NaN",-0.083,-0.083,furtum,0.083
ausonius.eclogarum_liber,26.2,"articulus, acies, non, sino, imminuo",5,"NaN, 0.0, NaN, NaN, NaN",0.0,0.0,,0.0
ausonius.eclogarum_liber,26.3,"barba, ioui, crinis, ueneri, decor, ergo, necesse, sum",8,"NaN, NaN, NaN, NaN, NaN, NaN, 0.0, NaN",0.0,0.0,,0.0
ausonius.eclogarum_liber,26.4,"ut, nolo, demo, quo, sui, uterque, placeo",7,"NaN, NaN, NaN, NaN, NaN, NaN, NaN",nan,nan,,0.0
ausonius.eclogarum_liber,26.5,"mauors, imberbos, et, caluus, luna, adamo",6,"NaN, NaN, NaN, NaN, NaN, NaN",nan,nan,mauors,0.167
ausonius.eclogarum_liber,26.6,"non, prohibeo, como, tum, caput, atque, gena",7,"NaN, NaN, NaN, NaN, 0.0, NaN, NaN",0.0,0.0,gena,0.143
ausonius.eclogarum_liber,26.7,"sol, et, saturnus, nihil, obsto, unguis, ergo",7,"NaN, NaN, NaN, NaN, NaN, NaN, NaN",nan,nan,,0.0
ausonius.eclogarum_liber,26.8,"non, placeo, diuus, tollo, monostichium",5,"NaN, NaN, 0.0, NaN, NaN",0.0,0.0,,0.0
