Text,Stelle,Inahlt,Wortzahl,Sentiment Rechnung,Sentiment-Score,alternativer Sentiment-Score,Invektiven,Invektivitäts-Score
boethius.de_fide_catholica,1.0,"christianam, fides, nouus, atque, uetus, testamentum, pando, auctoritas, et, quamuis, nomen, ipse, christus, uetus, intra, sui, contineo, instrumentum, is, semper, signo, affuturumquem, credo, per, pario",25,"NaN, 1.0, 1.0, NaN, 0.0, NaN, NaN, NaN, NaN, NaN, 0.0, NaN, NaN, 0.0, NaN, NaN, NaN, NaN, NaN, NaN, NaN, NaN, NaN, NaN, NaN",0.08,0.0,,0.0
boethius.de_fide_catholica,5.0,"uirgo, iam, uenio, tamen, in, orbis, terra, ab, ipse, noster, saluator, mirabilis, manasse, probo, aduentus, hic, autem, religio, noster, qui, uoco, christiana, atque, catholicus, hic, fundamentum, principalis, nitor, asserens, ex, aeternus, is, sum, ante, mundus, constitutio",36,"NaN, NaN, NaN, NaN, NaN, NaN, 0.0, NaN, NaN, NaN, NaN, NaN, NaN, NaN, NaN, NaN, NaN, 1.0, NaN, NaN, NaN, NaN, NaN, NaN, NaN, NaN, NaN, 1.0, NaN, NaN, 0.5, NaN, NaN, NaN, 1.0, NaN",0.097,0.0,"uirgo, hic, hic",0.083
boethius.de_fide_catholica,10.0,"ante, omnis, uidelicet, qui, tempus, possum, retineo, uocabulis, diuinus, pater, et, filius, atque, spiritus, sanctus, exsisto, substantia, ita, ut, deus, dico, pater, deus, filius, deus, spiritus, sancio, neque, tamen, tres, deus, sed, unus, pater, itaque, habeo",36,"NaN, NaN, NaN, NaN, 0.0, NaN, NaN, NaN, 0.5, 0.0, NaN, 0.0, NaN, 0.0, 1.0, NaN, NaN, NaN, NaN, 0.0, NaN, 0.0, 0.0, 0.0, 0.0, 0.0, NaN, NaN, NaN, NaN, 0.0, NaN, NaN, 0.0, NaN, NaN",0.042,0.0,,0.0
boethius.de_fide_catholica,15.0,"filius, ex, suus, substantia, gigno, et, sui, nosco, ratio, coaeternum, qui, filius, eatenus, confiteor, ut, non, sum, idem, qui, pater, sum, neque, pater, aliquando, sum, filius, ne, rursus, in, infinitus, humanus, animus, diuinus, progenies, cogito, neque, filius, eo, idem",39,"0.0, NaN, NaN, NaN, NaN, NaN, NaN, NaN, 0.0, NaN, NaN, 0.0, NaN, NaN, NaN, NaN, NaN, NaN, NaN, 0.0, NaN, NaN, 0.0, NaN, NaN, 0.0, NaN, NaN, NaN, NaN, 0.0, 0.5, 0.5, 0.0, NaN, NaN, 0.0, NaN, NaN",0.026,0.0,,0.0
boethius.de_fide_catholica,20.0,"natura, qui, pater, coaeternus, sum, aliquando, fio, pater, ne, rursus, in, infinitus, diuinum, progenies, tendo, sancio, uerus, spiritus, neque, pater, sum, neque, filius, atque, ideo, in, ille, natura, neque, gigno, neque, generantem, sed, ab, patior, e, quoque, procedo",38,"0.0, NaN, 0.0, NaN, NaN, NaN, NaN, 0.0, NaN, NaN, NaN, NaN, NaN, 0.0, NaN, NaN, 0.5, 0.0, NaN, 0.0, NaN, NaN, 0.0, NaN, NaN, NaN, NaN, 0.0, NaN, NaN, NaN, NaN, NaN, NaN, NaN, NaN, NaN, NaN",0.013,0.0,,0.0
boethius.de_fide_catholica,25.0,"uel, filius, qui, sum, tamen, processio, iste, modus, ita, non, possum, euidens, dico, quemadmodum, generatio, filius, ex, paternus, substantia, non, possum, humanus, animus, aestimaris, hic, autem, ut, credo, uetus, atque, nouus, in, formo, instructio, de",35,"NaN, 0.0, NaN, NaN, NaN, NaN, NaN, 0.5, NaN, NaN, NaN, NaN, NaN, NaN, NaN, 0.0, NaN, NaN, NaN, NaN, NaN, 0.0, 0.5, NaN, NaN, NaN, NaN, NaN, 0.0, NaN, 1.0, NaN, NaN, NaN, NaN",0.057,0.0,hic,0.029
boethius.de_fide_catholica,30.0,"qui, uelut, arx, religio, noster, multus, diuerto, et, humaniter, atque, ut, ita, dico, carnalis, sentio, aduerso, loquor, sum, ut, arrius, qui, licet, deus, dico, filius, paruus, tamen, pater, multipliciter, et, extra, pater, substantia, confiteor, sabelliani, quoque",36,"NaN, NaN, NaN, 1.0, NaN, 0.0, NaN, NaN, NaN, NaN, NaN, NaN, NaN, 0.0, NaN, NaN, NaN, NaN, NaN, NaN, NaN, NaN, 0.0, NaN, 0.0, 0.0, NaN, 0.0, NaN, NaN, NaN, 0.0, NaN, NaN, NaN, NaN",0.028,0.0,,0.0
boethius.de_fide_catholica,35.0,"non, tres, exsistentes, persono, sed, unus, audeo, sum, affirmaris, idem, dico, pater, sum, qui, filius, sum, idem, filius, qui, pater, sum, atque, spiritus, sancio, idem, sum, qui, pater, et, filius, sum, atque, per, hic, unus, dico, sum, persona, sub, uocabulum",40,"NaN, NaN, NaN, NaN, NaN, NaN, NaN, NaN, NaN, NaN, NaN, 0.0, NaN, NaN, 0.0, NaN, NaN, 0.0, NaN, 0.0, NaN, NaN, 0.0, NaN, NaN, NaN, NaN, 0.0, NaN, 0.0, NaN, NaN, NaN, NaN, NaN, NaN, NaN, 0.0, NaN, NaN",0.0,0.0,hic,0.025
boethius.de_fide_catholica,40.0,"diuersitas, signo, manichaei, quoque, qui, duo, principia, sui, coaeterna, et, aduerso, profiteor, unigenitus, deus, sum, non, credo, indignus, enim, iudico, si, deus, habeo, filius, uideo, nihil, alius, cogito, nisi, carnalis",30,"-0.5, NaN, NaN, NaN, NaN, NaN, NaN, NaN, NaN, NaN, NaN, NaN, NaN, 0.0, NaN, NaN, NaN, -1.0, NaN, NaN, NaN, 0.0, NaN, 0.0, NaN, NaN, NaN, NaN, NaN, 0.0",-0.05,-0.05,,0.0
boethius.de_fide_catholica,45.0,"ut, quia, hic, generatio, duo, corpus, commixtio, procedo, illic, quoque, indignus, sum, intellego, huiusmodi, applicaris, qui, res, is, neque, uetus, facio, recipio, testamentum, neque, in, integer, nonus, nam, sicut, ille, omnino, error, is, non, recipio, ita",36,"NaN, NaN, NaN, NaN, NaN, 0.0, NaN, NaN, NaN, NaN, -1.0, NaN, NaN, NaN, NaN, NaN, 0.0, NaN, NaN, 0.0, NaN, NaN, NaN, NaN, NaN, 0.5, NaN, NaN, NaN, NaN, NaN, -1.0, NaN, NaN, NaN, NaN",-0.042,-0.056,hic,0.028
boethius.de_fide_catholica,50.0,"ex, uirgo, generatio, filius, non, nult, admitto, ne, humanus, corpus, polluo, uideo, deus, sum, natura, sed, de, hic, hactenus, suus, enim, locus, pono, sicut, ordo, necessarius, postulo, ergo, diuinum, ex, aeternus, natura, et, in, aeternus",35,"NaN, NaN, NaN, 0.0, NaN, NaN, NaN, NaN, 0.0, 0.0, NaN, NaN, 0.0, NaN, 0.0, NaN, NaN, NaN, NaN, NaN, NaN, 0.0, NaN, NaN, 0.5, 0.0, NaN, NaN, NaN, NaN, 0.5, 0.0, NaN, NaN, 0.5",0.043,0.0,"uirgo, polluo, hic",0.086
boethius.de_fide_catholica,55.0,"sine, aliqui, mutabilitas, perdurans, sui, tantus, conscius, uoluntas, sponte, mundus, uolo, fabricaris, is, cum, omnino, non, sum, facio, ut, sum, neque, ex, suus, substantia, profero, ne, diuinus, natura, credo, neque, aliunde, molio, sum, ne, iam, exsisto, aliquis",37,"NaN, NaN, NaN, NaN, NaN, NaN, -0.5, 0.0, NaN, 1.0, NaN, NaN, NaN, NaN, NaN, NaN, NaN, NaN, NaN, NaN, NaN, NaN, NaN, NaN, NaN, NaN, 0.5, 0.0, NaN, NaN, NaN, NaN, NaN, NaN, NaN, NaN, NaN",0.027,-0.014,conscius,0.027
boethius.de_fide_catholica,60.0,"qui, is, uoluntas, exsistentia, proprius, natura, iuuo, atque, sum, qui, neque, ab, ipse, facio, sum, et, tamen, sum, sed, uerbum, produco, caelus, terra, creo, ita, ut, caelestis, habitatio, digno, caelum, natura, efficio, atque, terra, terrenus, compono, de",37,"NaN, NaN, 0.0, NaN, 0.0, 0.0, NaN, NaN, NaN, NaN, NaN, NaN, NaN, NaN, NaN, NaN, NaN, NaN, NaN, 0.0, NaN, NaN, 0.0, NaN, NaN, NaN, NaN, NaN, NaN, 0.5, 0.0, NaN, NaN, 0.0, NaN, NaN, NaN",0.014,0.0,,0.0
boethius.de_fide_catholica,65.0,"caelestis, autem, natura, qui, uniuersalis, uoco, angelica, quamuis, illic, distinguo, ordo, pulcher, sum, omnis, pars, tamen, quidam, multus, appeto, quam, is, natura, atque, ipse, auctor, natura, tribuo, de, caelestis, sedes, proiectum, sum, et, quoniam, angelus",35,"NaN, NaN, 0.0, NaN, 0.0, NaN, NaN, NaN, NaN, NaN, 0.5, 1.0, NaN, NaN, 0.0, NaN, NaN, 0.0, NaN, NaN, NaN, 0.0, NaN, NaN, NaN, 0.0, NaN, NaN, NaN, 0.0, NaN, NaN, NaN, NaN, NaN",0.043,0.0,,0.0
boethius.de_fide_catholica,70.0,"numerus, is, sum, supernus, ille, ciuitas, qui, ciuis, angelus, sum, imminuo, nolo, conditor, permaneo, formo, ex, terra, homo, atque, spiritus, uita, animo, ratio, compono, arbitrium, libertas, decoro, is, praefigo, lex, paradisus, deliciae, constituo, ut",34,"NaN, NaN, NaN, NaN, NaN, 0.5, NaN, 0.5, NaN, NaN, NaN, NaN, NaN, NaN, NaN, NaN, 0.0, 0.0, NaN, 0.0, 0.0, NaN, 0.0, NaN, NaN, 0.5, NaN, NaN, NaN, 0.5, NaN, NaN, NaN, NaN",0.059,0.0,deliciae,0.029
boethius.de_fide_catholica,75.0,"si, sine, pecco, maneo, uolo, tam, ipse, quam, is, progenies, angelicis, coitus, socio, ut, quia, superus, natura, per, superbia, malus, imus, peto, inferus, substantia, per, humilitas, bonus, ad, supernus, conscendo, sed, ille, auctor, inuidia, non, fero",36,"NaN, NaN, NaN, NaN, NaN, NaN, NaN, NaN, NaN, 0.0, NaN, NaN, NaN, NaN, NaN, NaN, 0.0, NaN, -1.0, -1.0, NaN, NaN, NaN, NaN, NaN, NaN, 1.0, NaN, NaN, NaN, NaN, NaN, NaN, -1.0, NaN, NaN",-0.056,-0.083,"superbia, inuidia",0.056
boethius.de_fide_catholica,80.0,"homo, illic, ascendo, ubi, ipse, non, mereo, permaneo, temptatio, adhibeo, facio, etiam, ipse, is, comparis, quam, de, is, lateo, genero, causa, formator, produco, inoboedientia, supplicium, subiaceo, is, quoque, diuinitas, affuturam, promitto",31,"0.0, NaN, NaN, NaN, NaN, NaN, NaN, NaN, NaN, NaN, NaN, NaN, NaN, NaN, NaN, NaN, NaN, NaN, NaN, NaN, 0.0, NaN, NaN, NaN, NaN, NaN, NaN, NaN, 0.5, NaN, NaN",0.016,0.0,supplicium,0.032
boethius.de_fide_catholica,85.0,"quam, sui, dum, arroganter, usus, pat, elido, sum, hic, autem, reuelante, deus, moysi, famulo, suus, comperio, sum, qui, etiam, humanus, genus, conditio, atque, origo, uolo, innotesco, sicut, ab, is, liber, profero, testo, omnis, enim, diuinum, auctoritas, hic",37,"NaN, NaN, NaN, NaN, NaN, NaN, NaN, NaN, NaN, NaN, NaN, 0.0, NaN, NaN, NaN, NaN, NaN, NaN, NaN, 0.0, 0.0, 0.0, NaN, NaN, NaN, NaN, NaN, NaN, NaN, 0.5, NaN, NaN, NaN, NaN, NaN, NaN, NaN",0.014,0.0,"hic, hic",0.054
boethius.de_fide_catholica,90.0,"modus, constaris, uideo, ut, aut, historial, modus, sum, qui, nihil, alius, nisi, res, gero, enuntio, aut, allegoricus, ut, non, illic, possum, historia, ordo, consisto, aut, certus, ex, uterque, compono, ut, et, secundus, historia, et, secundus, allegoria, maneo, uideo, hic, autem",40,"0.5, NaN, NaN, NaN, NaN, NaN, 0.5, NaN, NaN, NaN, NaN, NaN, 0.0, NaN, NaN, NaN, NaN, NaN, NaN, NaN, NaN, NaN, 0.5, NaN, NaN, 0.5, NaN, NaN, NaN, NaN, NaN, 0.0, NaN, NaN, 0.0, NaN, NaN, NaN, NaN, NaN",0.05,0.0,hic,0.025
boethius.de_fide_catholica,95.0,"pius, intellego, et, ueraci, cor, teneo, satis, abundus, reluceo, sed, ad, ordo, redeo, primus, itaque, homo, ante, peccatum, cum, suus, coniunx, incola, paradisus, sum, at, ubi, auris, praebeo, suasor, et, conditor, praeceptum, neglego, attendo",34,"NaN, NaN, NaN, NaN, NaN, NaN, 0.5, NaN, NaN, NaN, NaN, 0.5, NaN, 0.5, NaN, 0.0, NaN, -1.0, NaN, NaN, -0.5, NaN, NaN, NaN, NaN, NaN, NaN, NaN, NaN, NaN, NaN, NaN, NaN, NaN",0.0,-0.044,,0.0
boethius.de_fide_catholica,100.0,"exul, efficio, terra, iubeo, excolo, atque, ab, paradisus, sinus, secludo, in, ignosco, pars, suus, genus, posteritas, transpono, atque, poena, quam, ipse, primus, homo, praeuaricatio, reus, excipio, genero, transmitto, in, posterus, hinc, facio, sum, ut, et, corpus",36,"-1.0, NaN, 0.0, NaN, NaN, NaN, NaN, NaN, NaN, NaN, NaN, NaN, 0.0, NaN, 0.0, 0.0, NaN, NaN, -1.0, NaN, NaN, 0.5, 0.0, NaN, NaN, NaN, NaN, NaN, NaN, 0.0, NaN, NaN, NaN, NaN, NaN, 0.0",-0.042,-0.056,"poena, reus",0.056
boethius.de_fide_catholica,105.0,"atque, anima, corruptio, et, mors, prouenio, intereo, primus, mors, in, abel, filius, suus, mereo, experior, ut, quantus, sum, poena, quam, ipse, excipio, probo, in, suboles, qui, si, ipse, primus, morior, nescio, quidam, modo, atque, si, dico, fas, sum, neque, sentio",40,"NaN, 0.5, -1.0, NaN, -1.0, NaN, NaN, 0.5, -1.0, NaN, NaN, 0.0, NaN, NaN, NaN, NaN, NaN, NaN, -1.0, NaN, NaN, NaN, NaN, NaN, 0.5, NaN, NaN, NaN, 0.5, NaN, NaN, NaN, NaN, NaN, NaN, NaN, NaN, NaN, NaN, NaN",-0.05,-0.1,poena,0.025
boethius.de_fide_catholica,110.0,"poena, suus, sed, ideo, experior, in, alter, sum, ut, quis, sui, ius, debeo, contemptor, agnosco, et, dum, poena, mors, sustineo, ipse, exspectatio, fortis, torqueo, hic, autem, praeuaricatio, malus, qui, in, posterus, naturalis, primus, homo",34,"-1.0, NaN, NaN, NaN, NaN, NaN, NaN, NaN, NaN, NaN, NaN, 0.5, NaN, NaN, NaN, NaN, NaN, -1.0, -1.0, NaN, NaN, 0.0, 0.5, NaN, NaN, NaN, NaN, -1.0, NaN, NaN, 0.0, 0.0, 0.5, 0.0",-0.074,-0.118,"poena, poena, hic",0.088
boethius.de_fide_catholica,115.0,"transfuderat, quidam, pelagius, non, admittens, proprius, nomen, haeresim, dedico, quam, catholicus, fides, ab, consortio, suus, mox, repello, probo, ab, ipse, itaque, primus, homo, procedo, humanus, genus, atque, multiplex, numerositas, succresco, erumpo, in, lis",33,"NaN, NaN, 0.0, NaN, NaN, 0.0, 0.0, NaN, NaN, NaN, NaN, 1.0, NaN, NaN, NaN, NaN, NaN, NaN, NaN, NaN, NaN, 0.5, 0.0, NaN, 0.0, 0.0, NaN, NaN, NaN, NaN, NaN, NaN, -0.5",0.03,-0.015,,0.0
boethius.de_fide_catholica,120.0,"commoueo, bellum, occupo, terrenus, miseria, quia, felicitas, paradisus, in, primus, pater, perdo, neque, tamen, ex, hic, desum, qui, sui, conditor, gratia, sequestraret, is, placeo, inseruirent, qui, licet, mereo, natura, damno, sum, tamen, sacramentum",33,"NaN, 0.0, NaN, NaN, -1.0, NaN, 1.0, NaN, NaN, 0.5, 0.0, NaN, NaN, NaN, NaN, NaN, NaN, NaN, NaN, NaN, 1.0, NaN, NaN, NaN, NaN, NaN, NaN, NaN, 0.0, NaN, NaN, NaN, NaN",0.045,-0.03,"hic, damno",0.061
boethius.de_fide_catholica,125.0,"et, longus, postmodum, profero, facio, particeps, perdo, uolo, reparo, natura, impleo, sum, ergo, mundus, humanus, genus, atque, ingredior, sum, homo, uia, suus, qui, malitia, proprius, contumacia, despicio, conditor, hinc, uolo, deus, per",32,"NaN, 0.0, NaN, NaN, NaN, 0.0, NaN, NaN, NaN, 0.0, NaN, NaN, NaN, 1.0, 0.0, 0.0, NaN, NaN, NaN, 0.0, 0.0, NaN, NaN, -1.0, 0.0, -1.0, NaN, NaN, NaN, NaN, 0.0, NaN",-0.031,-0.062,contumacia,0.031
boethius.de_fide_catholica,130.0,"iustus, potis, homo, reparo, genus, humanus, quam, maneo, proteruum, poenal, multitudo, effundo, diluuium, inundatio, excipio, noc, iustus, homo, cum, suus, liber, atque, hic, qui, cum, sui, in, arca, introduco, intereo, permitto, cur, autem, per, arca",35,"1.0, 0.0, 0.0, NaN, 0.0, 0.0, NaN, NaN, NaN, NaN, 0.0, NaN, NaN, NaN, NaN, NaN, 1.0, 0.0, NaN, NaN, 0.5, NaN, NaN, NaN, NaN, NaN, NaN, NaN, NaN, NaN, NaN, NaN, NaN, NaN, NaN",0.071,0.0,"poenal, hic",0.057
boethius.de_fide_catholica,135.0,"lignum, uolo, iustus, eripio, notus, sum, diuinaris, scripturaris, mens, erudio, et, quasi, primus, quidam, mundus, aetas, diluuium, ultor, transigo, sum, reparo, itaque, humanus, genus, atque, proprius, natura, uitium, qui, praeuaricatio, primus, auctor",32,"NaN, NaN, 1.0, NaN, 0.0, NaN, NaN, NaN, 0.5, NaN, NaN, NaN, 0.5, NaN, 1.0, 0.0, NaN, NaN, NaN, NaN, NaN, NaN, 0.0, 0.0, NaN, 0.0, 0.0, -1.0, NaN, NaN, 0.5, NaN",0.078,-0.031,ultor,0.031
boethius.de_fide_catholica,140.0,"infundo, amplector, non, desisto, cerno, contumacia, quam, dudum, diluuium, unda, puniuerat, et, qui, numerosus, annus, series, permitto, sum, uiuo, in, breuitas, annus, humanus, aetas, addico, sum, malo, deus, non, iam, diluuium, punio, genus",33,"NaN, NaN, NaN, NaN, NaN, -1.0, NaN, NaN, NaN, 0.0, NaN, NaN, NaN, NaN, 0.0, 0.5, NaN, NaN, NaN, NaN, NaN, 0.0, 0.0, 0.0, NaN, NaN, NaN, 0.0, NaN, NaN, NaN, NaN, 0.0",-0.015,-0.03,"contumacia, addico, punio",0.091
boethius.de_fide_catholica,145.0,"humanus, sed, idem, permaneo, eligo, uir, per, qui, series, aliqui, generatio, con-meo, ex, qui, nos, filius, proprius, uestio, humanus, corpus, mundus, in, finis, concedo, qui, primus, sum, abraham, qui, cum, sum, aetas, conficio, is",34,"0.0, NaN, NaN, NaN, NaN, 0.5, NaN, NaN, 0.5, NaN, NaN, NaN, NaN, NaN, NaN, 0.0, 0.0, NaN, 0.0, 0.0, 1.0, NaN, 0.0, NaN, NaN, 0.5, NaN, NaN, NaN, NaN, NaN, 0.0, NaN, NaN",0.074,0.0,uestio,0.029
boethius.de_fide_catholica,150.0,"uxor, decrepitus, in, senectus, suus, repromissio, largitio, habeo, filius, mereo, hic, uoco, sum, isaac, atque, ipse, gigno, iacob, idem, quoque, duodecim, patriarcha, non, reputo, deus, in, is, numerus, qui, mos, suus, natura, produco, hic, ergo",35,"0.0, NaN, NaN, 0.0, NaN, NaN, 0.0, NaN, 0.0, NaN, NaN, NaN, NaN, NaN, NaN, NaN, NaN, NaN, NaN, NaN, NaN, NaN, NaN, NaN, 0.0, NaN, NaN, NaN, NaN, 0.5, NaN, 0.0, NaN, NaN, NaN",0.014,0.0,"uxor, largitio, hic, hic",0.114
boethius.de_fide_catholica,155.0,"iacob, cum, filius, atque, domus, suus, transigo, causa, aegyptus, uolo, habito, atque, illic, per, annus, series, multitudo, concresco, coepio, suspicio, sum, aegyptiacis, imperium, is, pharao, magnus, pondus, moles, premo, decerno, et, grauis, onus",33,"NaN, NaN, 0.0, NaN, 0.0, NaN, NaN, 0.0, NaN, NaN, NaN, NaN, NaN, NaN, 0.0, 0.5, 0.0, NaN, NaN, -0.5, NaN, NaN, 0.0, NaN, NaN, 0.0, NaN, NaN, NaN, NaN, NaN, -0.5, NaN",-0.015,-0.03,,0.0
boethius.de_fide_catholica,160.0,"affligo, tandem, deus, aegyptii, rex, dominatio, despicio, diuido, mare, rubrus, qui, numquam, antea, natura, ullus, cognosco, suus, traduco, exercitus, auctor, moyse, et, aaro, -ne, postea, igitur, pro, is, egressio, altus, aegyptus, plaga, uasto, sum",34,"NaN, NaN, 0.0, NaN, 0.0, 0.0, NaN, NaN, 0.0, NaN, NaN, NaN, NaN, 0.0, NaN, NaN, NaN, NaN, 0.0, NaN, NaN, NaN, NaN, NaN, NaN, NaN, NaN, NaN, NaN, 0.5, NaN, 0.0, NaN, NaN",0.015,0.0,uasto,0.029
boethius.de_fide_catholica,165.0,"cum, nolo, dimitto, populus, transmitto, itaque, ut, dico, sum, mare, rubrus, uenio, per, desero, eremi, ad, mons, qui, uoco, sinai, ibi, uniuersus, conditor, deus, uolo, sacramentum, sum, gratia, populus, erudio, per, moyse, -ne, do, lex, constituo, quemadmodum",37,"NaN, NaN, NaN, 0.0, NaN, NaN, NaN, NaN, NaN, 0.0, NaN, NaN, NaN, NaN, NaN, NaN, NaN, NaN, NaN, NaN, NaN, 0.0, NaN, 0.0, NaN, NaN, NaN, 1.0, 0.0, NaN, NaN, NaN, NaN, NaN, 0.5, NaN, NaN",0.041,0.0,,0.0
boethius.de_fide_catholica,170.0,"et, sacrificus, ritus, et, populus, mos, instruo, et, cum, multus, annus, multus, quoque, gens, per, uia, debello, uenio, tandem, ad, fluuius, qui, uoco, iordanis, dux, iam, iesus, nauis, filius, atque, ad, is, transeo, quemadmodum, aqua",35,"NaN, NaN, NaN, NaN, 0.0, 0.5, NaN, NaN, NaN, 0.0, 0.0, 0.0, NaN, 0.0, NaN, 0.0, NaN, NaN, NaN, NaN, NaN, NaN, NaN, NaN, 0.5, NaN, NaN, 0.0, 0.0, NaN, NaN, NaN, NaN, NaN, 0.0",0.029,0.0,iordanis,0.029
boethius.de_fide_catholica,175.0,"mare, rubrus, ita, quoque, iordanis, fluentum, sicco, sum, peruenio, sum, ad, is, ciuitas, qui, nunc, hierosolyma, uoco, atque, dum, ibi, deus, populus, moror, post, iudex, et, propheta, rex, institus, lego, qui, post, saulis, primatus, dauid, de",36,"0.0, NaN, NaN, NaN, NaN, 0.0, NaN, NaN, NaN, NaN, NaN, NaN, 0.5, NaN, NaN, NaN, NaN, NaN, NaN, NaN, 0.0, 0.0, NaN, NaN, 0.5, NaN, NaN, 0.0, NaN, NaN, NaN, NaN, NaN, 0.5, NaN, NaN",0.042,0.0,"iordanis, fluentum",0.056
boethius.de_fide_catholica,180.0,"tribus, iuda, lego, adipiscor, sum, descendo, itaque, ab, is, per, singulus, successio, regius, stemma, perduco, sum, usque, ad, herodis, tempus, qui, primus, ex, gentilis, memoro, populus, lego, impero, sub, quo, ex-sisto, beatus, uirgo, mare, qui",35,"-0.5, NaN, NaN, NaN, NaN, NaN, NaN, NaN, NaN, NaN, 0.0, 0.0, 0.0, NaN, NaN, NaN, NaN, NaN, NaN, 0.0, NaN, 0.5, NaN, 0.5, NaN, 0.0, NaN, NaN, NaN, NaN, NaN, 1.0, NaN, 0.0, NaN",0.043,-0.014,uirgo,0.029
boethius.de_fide_catholica,185.0,"de, dauidica, stirps, prouenerat, qui, humanus, genus, gigno, conditor, hic, autem, ideo, quia, multus, inficio, crimen, mundus, iaceo, in, mors, eligo, sum, unus, gens, in, qui, deus, mandatum, clarescerent, ibi, mitto, propheta, sum, et, alius, sanctus, uir, per, qui",39,"NaN, NaN, NaN, NaN, NaN, 0.0, 0.0, NaN, NaN, NaN, NaN, NaN, NaN, 0.0, NaN, -1.0, 1.0, NaN, NaN, -1.0, NaN, NaN, NaN, 0.0, NaN, NaN, 0.0, NaN, NaN, NaN, NaN, NaN, NaN, NaN, NaN, 1.0, 0.5, NaN, NaN",0.013,-0.051,"hic, crimen, iaceo",0.077
boethius.de_fide_catholica,190.0,"admonitio, ipse, certus, populus, ab, tumor, peruicacia, reuoco, ille, uerus, idem, occaedes, in, suus, nequitia, peruersitas, maneo, uolo, atque, iam, in, ulter, tempus, non, propheta, neque, alius, sui, placeo, sed, ipse, unigenitus, suus",33,"-0.5, NaN, 0.5, 0.0, NaN, -0.5, NaN, NaN, NaN, 0.5, NaN, NaN, NaN, NaN, -1.0, NaN, NaN, NaN, NaN, NaN, NaN, NaN, 0.0, NaN, NaN, NaN, NaN, NaN, NaN, NaN, NaN, NaN, NaN",-0.03,-0.061,nequitia,0.03
boethius.de_fide_catholica,195.0,"deus, per, uirgo, nascor, constituo, ut, humanus, salus, qui, per, primus, homo, inoboedientia, depereo, per, homo, deus, rursus, repararetur, et, quia, ex-sisto, mulier, qui, causa, mors, primus, uir, suadeo, sum, hic, secundus, mulier, qui, uita",35,"0.0, NaN, NaN, NaN, NaN, NaN, 0.0, 1.0, NaN, NaN, 0.5, 0.0, NaN, NaN, NaN, 0.0, 0.0, NaN, NaN, NaN, NaN, NaN, 0.0, NaN, 0.0, -1.0, 0.5, 0.5, NaN, NaN, NaN, 0.0, 0.0, NaN, 0.0",0.043,-0.029,"uirgo, mulier, hic, mulier",0.114
boethius.de_fide_catholica,200.0,"causa, humanus, uiscus, apportaret, neque, uilis, uideo, qui, deus, filius, ex, uirgo, nascor, sum, quoniam, praeter, natura, modus, concipio, et, edo, sum, uirgo, itaque, de, spiritus, sancio, incarnatum, deus, filius, concipio, uirgo, pario, post, is, editio, uirgo",37,"0.0, 0.0, NaN, NaN, NaN, -0.5, NaN, NaN, 0.0, 0.0, NaN, NaN, NaN, NaN, NaN, NaN, 0.0, 0.5, NaN, NaN, NaN, NaN, NaN, NaN, NaN, 0.0, NaN, NaN, 0.0, 0.0, NaN, NaN, NaN, NaN, NaN, NaN, NaN",0.0,-0.014,"uilis, uirgo, uirgo, uirgo, uirgo",0.135
boethius.de_fide_catholica,205.0,"permaneo, atque, homo, facio, sum, idem, deus, filius, ita, ut, in, is, et, diuina, natura, radiaret, splendor, et, humanus, fragilitas, appareo, assumptio, sed, hic, tam, sanus, atque, ueracissimae, fides, ex-sisto, multus, qui, diuerto, garrirent, et, praeter, alius, nestorius",38,"NaN, NaN, 0.0, NaN, NaN, NaN, 0.0, 0.0, NaN, NaN, NaN, NaN, NaN, NaN, 0.0, NaN, 1.0, NaN, 0.0, NaN, NaN, NaN, NaN, NaN, NaN, 1.0, NaN, NaN, 1.0, NaN, 0.0, NaN, NaN, NaN, NaN, NaN, NaN, NaN",0.079,0.0,hic,0.026
boethius.de_fide_catholica,210.0,"et, eutyches, repertor, haereseos, ex-sisto, qui, unus, homo, solus, alter, deus, solus, puto, assero, neque, humanus, corpus, qui, christus, induo, de, humanus, substantia, participatio, uenio, sed, hic, hactenus",28,"NaN, NaN, 0.0, NaN, NaN, NaN, NaN, 0.0, -0.5, NaN, 0.0, -0.5, NaN, NaN, NaN, 0.0, 0.0, NaN, NaN, NaN, NaN, 0.0, NaN, NaN, NaN, NaN, NaN, NaN",-0.036,-0.036,hic,0.036
boethius.de_fide_catholica,215.0,"cerno, itaque, secundus, caro, christus, baptizo, sum, ut, qui, baptizandi, forma, sum, ceterus, tributurus, ipse, prmius, qui, doceo, excipio, post, baptismum, uerus, eligo, duodecim, discipulus, qui, unus, traditor, is, sum, et, quia, sanus, doctrina, iudaeorum",35,"NaN, NaN, 0.0, 0.0, NaN, NaN, NaN, NaN, NaN, NaN, 1.0, NaN, 0.0, NaN, NaN, NaN, NaN, NaN, NaN, NaN, NaN, 0.5, NaN, NaN, NaN, NaN, NaN, NaN, NaN, NaN, NaN, NaN, 1.0, 0.0, NaN",0.071,0.0,,0.0
boethius.de_fide_catholica,220.0,"populus, non, fero, is, infero, manus, crux, supplicium, per-emo, occaedes, ergo, christus, iaceo, tres, dies, atque, nox, in, sepulcrum, resurgo, ab, morior, sicut, ante, constitutio, mundus, ipse, cum, pater, decerno, ascendo, in, caelus, ubi, in, is, qui",37,"0.0, NaN, NaN, NaN, NaN, 0.0, NaN, NaN, NaN, NaN, NaN, NaN, NaN, NaN, 0.0, NaN, 0.0, NaN, NaN, NaN, NaN, NaN, NaN, NaN, NaN, 1.0, NaN, NaN, 0.0, NaN, NaN, NaN, NaN, NaN, NaN, NaN, NaN",0.027,0.0,"crux, supplicium, per-emo, iaceo, sepulcrum",0.135
boethius.de_fide_catholica,225.0,"deus, filius, sum, numquam, desum, cognosco, ut, assumo, homo, qui, diabolus, non, permitto, ad, supernus, conscendo, cum, sui, deus, filius, caelestis, habitatio, sustolleret, do, ergo, forma, discipulis, suus, baptizandi, doceo, salutare, efficientia, quoque",33,"0.0, 0.0, NaN, NaN, NaN, NaN, NaN, NaN, 0.0, NaN, NaN, NaN, NaN, NaN, NaN, NaN, NaN, NaN, 0.0, 0.0, NaN, NaN, NaN, NaN, NaN, 1.0, NaN, NaN, NaN, NaN, NaN, NaN, NaN",0.03,0.0,,0.0
boethius.de_fide_catholica,230.0,"miraculum, atque, in, uniueisum, mundus, ad, uita, praecipio, introeo, ut, praedicatio, salutaris, non, iam, in, unus, tantus, gens, sed, orbus, terra, praedico, et, quoniam, humanus, genus, natura, mereo, quam, ex, primus, praeuaricator, contraho, aeternus, poena",35,"NaN, NaN, NaN, NaN, 1.0, NaN, 0.0, NaN, NaN, NaN, 0.0, 1.0, NaN, NaN, NaN, NaN, NaN, 0.0, NaN, -0.5, 0.0, NaN, NaN, NaN, 0.0, 0.0, 0.0, NaN, NaN, NaN, 0.5, NaN, NaN, 0.5, -1.0",0.043,-0.043,poena,0.029
boethius.de_fide_catholica,235.0,"iaculis, sum, uulnero, neque, salus, suus, sum, idoneus, qui, is, in, pareo, perdo, medicinalis, quidam, tribuo, sacramentum, ut, agnosco, alius, sui, debeo, per, natura, mereo, alius, per, gratia, donum, ut, natura, nihil, alius, nisi, poena",35,"NaN, NaN, NaN, NaN, 1.0, NaN, NaN, NaN, NaN, NaN, NaN, NaN, NaN, NaN, NaN, NaN, NaN, NaN, NaN, NaN, NaN, NaN, NaN, 0.0, NaN, NaN, NaN, 1.0, 0.0, NaN, 0.0, NaN, NaN, NaN, -1.0",0.029,-0.029,poena,0.029
boethius.de_fide_catholica,240.0,"summitto, gratia, uerus, qui, nullus, meritum, attribuo, sum, quia, neque, gratia, dico, si, meritum, tribuo, totus, qui, sum, salus, affero, diffundo, ergo, per, mundus, caelestis, ille, doctrina, adunantur, populus, instituo, ecclesia",31,"NaN, 1.0, 0.5, NaN, NaN, 1.0, NaN, NaN, NaN, NaN, 1.0, NaN, NaN, 1.0, NaN, NaN, NaN, NaN, 1.0, NaN, NaN, NaN, NaN, 1.0, NaN, NaN, 0.0, NaN, 0.0, NaN, NaN",0.21,0.0,,0.0
boethius.de_fide_catholica,245.0,"fio, unus, corpus, qui, mundus, latitudo, occupo, qui, caput, christus, ascendo, in, caelus, ut, necessarius, caput, suus, membrum, sequor, hic, itaque, doctrina, et, praesens, uita, bonus, informo, opus, et, post, consummatio, saeculis, resurrectura, corpus",34,"NaN, NaN, 0.0, NaN, 1.0, NaN, NaN, NaN, 0.0, NaN, NaN, NaN, NaN, NaN, 0.0, 0.0, NaN, NaN, NaN, NaN, NaN, 0.0, NaN, 0.0, 0.0, 1.0, NaN, 0.5, NaN, NaN, NaN, NaN, NaN, 0.0",0.074,0.0,hic,0.029
boethius.de_fide_catholica,250.0,"noster, praeter, corruptio, ad, regnum, caelestis, polliceor, ita, ut, qui, hic, bene, ipse, dono, uiuo, sum, in, ille, resurrectio, beatus, qui, uerus, malus, miser, post, munus, resurrectio, adsum, et, hic, sum, principalis, religio, noster, ut, credo, non, solus",38,"NaN, NaN, -1.0, NaN, 0.0, NaN, NaN, NaN, NaN, NaN, NaN, NaN, NaN, NaN, NaN, NaN, NaN, NaN, NaN, 1.0, NaN, 0.5, -1.0, -1.0, NaN, 0.5, NaN, NaN, NaN, NaN, NaN, NaN, 1.0, NaN, NaN, NaN, NaN, -0.5",-0.013,-0.092,"hic, miser, hic",0.079
boethius.de_fide_catholica,255.0,"anima, non, pereo, sed, ipse, quoque, corpus, qui, mors, aduenio, resoluo, in, status, pristinus, sum, de, beatitudo, repararis, hic, ergo, ecclesia, catholicus, per, orbis, diffundo, tres, modus, probo, exsisto, eo, quisquis, in, is, teneo, aut, auctoritas, sum",37,"0.5, NaN, NaN, NaN, NaN, NaN, 0.0, NaN, -1.0, NaN, NaN, NaN, 0.0, 0.0, NaN, NaN, NaN, NaN, NaN, NaN, NaN, NaN, NaN, NaN, NaN, NaN, 0.5, NaN, NaN, NaN, NaN, NaN, NaN, NaN, NaN, NaN, NaN",0.0,-0.027,hic,0.027
