Text,Stelle,Inahlt,Wortzahl,Sentiment Rechnung,Sentiment-Score,alternativer Sentiment-Score,Invektiven,Invektivitäts-Score
cicero.pro_caelio,20.0,"neque, tamen, ille, genus, alter, nocturnus, testis, perhorresco, sum, enim, dico, ab, ille, sum, qui, dico, uxor, suus, ab, cena, redeo, attrectatas, sum, ab, caelio, grauis, sum, homo, qui, hic, iuro, dico, audeo, cum, sum, is, confiteor, numquam, sui, ne, congredior, quidem, et, constituo, coepio, de, tantus, iniuria, experior, sed, totus, genus, oppugnatio, hic, iudex, et, iam, prospicio, animus, et, cum, infero, propulsaris, debeo, non, enim, ab, idem, accuso, marcus, caelius, ab, qui, oppugno, palam, in, is, telum, iacio, clam, sub-ministro",81,"NaN, NaN, NaN, 0.0, NaN, NaN, NaN, NaN, NaN, NaN, NaN, NaN, NaN, NaN, NaN, NaN, 0.0, NaN, NaN, NaN, NaN, NaN, NaN, NaN, NaN, -0.5, NaN, 0.0, NaN, NaN, NaN, NaN, NaN, NaN, NaN, NaN, NaN, NaN, NaN, NaN, NaN, NaN, NaN, NaN, NaN, NaN, NaN, -1.0, NaN, NaN, NaN, 0.0, NaN, NaN, 0.5, NaN, NaN, NaN, 0.5, NaN, NaN, NaN, NaN, NaN, NaN, NaN, NaN, NaN, NaN, NaN, NaN, NaN, NaN, NaN, NaN, NaN, NaN, NaN, NaN, NaN, NaN",-0.006,-0.019,"perhorresco, uxor, hic, hic",0.049
cicero.pro_caelio,21.0,"neque, ego, is, dico, ut, inuidiosus, sum, in, is, qui, gloriosus, etiam, hic, sum, debeo, fungor, officium, defendo, suus, facio, qui, uir, fortis, soleo, laedo, doleo, irascor, effero, pugno, lacesso, sed, uester, sapientia, tamen, sum, iudex, non, si, causa, iustus, sum, uis, fortis, oppugno, marcus, caelium, ideo, tu, quoque, causa, puto, sum, iustus, alienus, dolor, potis, quam, uester, fides, consulo, iam, qui, sum, multitudo, in, forum, qui, genus, qui, studium, qui, uarietas, homo, uideo, ex, hic, copia, quam, multus, sum, arbitror, qui, homo, possum, gratiosus, dissero, cum, aliquis, is, uolo, arbitror, ultro, sui, offero, soleo, opera, nauaris, testimonium, polliceor",99,"NaN, NaN, NaN, NaN, NaN, -1.0, NaN, NaN, NaN, NaN, NaN, NaN, NaN, NaN, NaN, NaN, 0.5, NaN, NaN, NaN, NaN, 0.5, 0.5, NaN, NaN, NaN, NaN, NaN, NaN, NaN, NaN, NaN, 1.0, NaN, NaN, 0.5, NaN, NaN, 0.0, 1.0, NaN, 1.0, 0.5, NaN, NaN, NaN, NaN, NaN, NaN, 0.0, NaN, NaN, 1.0, -0.5, -1.0, 0.0, NaN, NaN, 1.0, NaN, NaN, NaN, NaN, 0.0, NaN, NaN, NaN, 0.0, NaN, 0.5, NaN, 0.0, 0.0, NaN, NaN, NaN, 0.5, NaN, 0.0, NaN, NaN, NaN, 0.0, NaN, 1.0, NaN, NaN, NaN, NaN, NaN, NaN, NaN, NaN, NaN, NaN, -0.5, NaN, NaN, NaN",0.066,-0.03,"inuidiosus, hic, tu, hic",0.04
cicero.pro_caelio,22.0,"hic, ex, genus, si, qui, sui, in, hic, iudicium, fors, pro-iacio, excludo, is, cupiditas, iudex, sapientia, uester, ut, idem, tempus, et, hic, salus, et, religio, uester, et, contra, periculosus, homo, potentia, condicio, omnis, ciuis, prouideo, uideo, equidem, tu, abduco, ab, testis, neque, hic, iudicium, ueritas, qui, muto, nullus, modo, possum, in, uoluntas, testis, conlocaris, sino, qui, facilis, fingo, nullus, negotium, flecto, atque, detorqueo, possum, argumentum, ago, signum, lux, omnis, clarus, crimen, refello, res, cum, res, causa, cum, causa, ratio, cum, ratio, pugno",82,"NaN, NaN, 0.0, NaN, NaN, NaN, NaN, NaN, 0.5, 0.0, NaN, NaN, NaN, -0.5, 0.5, 1.0, NaN, NaN, NaN, 0.0, NaN, NaN, 1.0, NaN, 1.0, NaN, NaN, NaN, -1.0, 0.0, 0.5, 0.0, NaN, 0.5, NaN, NaN, NaN, NaN, NaN, NaN, NaN, NaN, NaN, 0.5, 0.5, NaN, NaN, NaN, NaN, NaN, NaN, 0.0, NaN, NaN, NaN, NaN, 0.5, NaN, NaN, -0.5, NaN, NaN, NaN, NaN, 0.0, NaN, 0.0, NaN, NaN, 0.5, -1.0, NaN, 0.0, NaN, 0.0, 0.0, NaN, 0.0, 0.0, NaN, 0.0, NaN",0.049,-0.037,"hic, hic, hic, periculosus, tu, hic, fingo, crimen",0.098
cicero.pro_caelio,23.0,"itaque, ille, pars, causa, facilis, patior, grauis, et, orno, ab, marcus, crassus, peroro, de, seditio, neapolitanis, de, alexandrinorum, pulsatio, puteolana, de, bonus, palla, uolo, dico, sum, ab, idem, etiam, de, dio, de, quo, ipse, tamen, quis, sum, qui, exspecto, qui, is, qui, facio, aut, non, timeo, aut, etiam, fateor, sum, enim, rex, qui, autem, dico, sum, adiuto, sum, et, conscius, publicus, asicius, iudicium, sum, libero, qui, igitur, sum, is, modus, crimen, ut, qui, committo, non, nego, qui, nego, absoluo, sum, is, hic, pertimesco, qui, non, modo, ab, facio, uerus, etiam, ab, conscientia, suspicio, asum, et, si, asicio, causa, multus, prosum, quam, noceo, inuidia, hic, obsum, maledico, tuus, qui, iste, facio, non, modo, suspicio, sed, ne, infamia, quidem, sum, aspersus",119,"NaN, NaN, 0.0, 0.0, 0.5, NaN, -0.5, NaN, NaN, NaN, NaN, NaN, NaN, NaN, NaN, NaN, NaN, NaN, NaN, NaN, NaN, 1.0, NaN, NaN, NaN, NaN, NaN, NaN, NaN, NaN, NaN, NaN, NaN, NaN, NaN, NaN, NaN, NaN, NaN, NaN, NaN, NaN, NaN, NaN, NaN, NaN, NaN, NaN, NaN, NaN, NaN, 0.0, NaN, NaN, NaN, NaN, NaN, NaN, NaN, -0.5, 0.0, NaN, 0.5, NaN, NaN, NaN, NaN, NaN, NaN, 0.5, -1.0, NaN, NaN, NaN, NaN, NaN, NaN, NaN, NaN, NaN, NaN, NaN, NaN, NaN, NaN, NaN, NaN, NaN, 0.5, NaN, NaN, 0.0, -0.5, NaN, NaN, NaN, NaN, 0.0, 0.0, NaN, NaN, NaN, -1.0, NaN, NaN, NaN, 0.0, NaN, NaN, NaN, NaN, NaN, -0.5, NaN, NaN, -1.0, NaN, NaN, NaN",-0.017,-0.042,"seditio, conscius, crimen, hic, conscientia, noceo, inuidia, hic, maledico, infamia",0.084
cicero.pro_caelio,24.0,"at, praeuaricatio, sum, asicius, libero, perfacilis, sum, iste, locus, respondeo, ego, praesertim, ab, quo, ille, causa, defendo, sum, sed, caelius, bonus, causa, asici, sum, arbitror, cuicuimodi, autem, sum, ab, suus, puto, sum, seiungo, neque, solus, caelius, sed, etiam, adulescens, humanus, et, doceo, recingo, studium, atque, bonus, ars, praeditus, titus, gaiusque, coponii, qui, ex, omnis, magnus, dio, mors, doleo, qui, cum, doctrina, studium, atque, humanitas, tum, etiam, hospitium, dio, teneo, habito, apud, titus, ut, audio, dius, sum, is, cognosco, alexandriae, quis, aut, hic, aut, superus, splendor, praeditus, frater, is, de, marcus, caelio, existimo, ex, ipse, si, produco, sum, audio",98,"NaN, NaN, NaN, NaN, NaN, NaN, NaN, NaN, 0.0, NaN, NaN, NaN, NaN, NaN, NaN, 0.0, NaN, NaN, NaN, NaN, 1.0, 0.0, NaN, NaN, NaN, NaN, NaN, NaN, NaN, NaN, NaN, NaN, NaN, NaN, -0.5, NaN, NaN, NaN, NaN, 0.0, NaN, NaN, NaN, 0.5, NaN, 1.0, 0.0, 0.5, NaN, NaN, NaN, NaN, NaN, NaN, 0.0, NaN, -1.0, NaN, NaN, NaN, 0.0, 0.5, NaN, 0.0, NaN, NaN, 0.0, NaN, NaN, NaN, NaN, NaN, NaN, NaN, NaN, NaN, NaN, NaN, NaN, NaN, NaN, NaN, NaN, NaN, 1.0, 0.5, 0.0, NaN, NaN, NaN, NaN, NaN, NaN, NaN, NaN, NaN, NaN, NaN",0.036,-0.015,"adulescens, hic",0.02
cicero.pro_caelio,25.0,"ergo, hic, remoueo, ut, aliquando, in, qui, causa, nitor, ad, is, uenio, animaduerto, enim, iudex, audio, ab, tu, meus, familiaris, lucius, herennium, perattentus, in, quo, etsi, magnus, ex, pars, ingenium, is, et, dico, genus, quidam, teneo, tamen, non, numquam, uereor, ne, ille, subtilis, ad, crimino, induco, oratio, ad, animus, uester, sensim, atque, lenis, accedo, dico, enim, multus, de, luxuries, multus, de, libido, multus, de, uitium, iuuentus, multus, de, mos, et, qui, in, reliquus, uito, mitis, sum, et, in, hic, suauitas, humanitas, qui, prope, iam, delecto, omnis, uersaris, periucundus, soleo, sum, in, hic, causa, pertristis, quidam, patruus, censor, magister, obiurgo, marcus, caelium, sicut, nemo, umquam, parens, multus, de, incontinentia, intemperantia, disseruio, quis, quaero, iudex, ignosco, tu, attendo, audio, propterea, qui, nos, tam, tristis, ille, tam, asperum, genus, oratio, horreo",128,"NaN, NaN, NaN, NaN, NaN, NaN, NaN, 0.0, 1.0, NaN, NaN, NaN, NaN, NaN, 0.5, NaN, NaN, NaN, 0.0, 1.0, NaN, NaN, NaN, NaN, NaN, NaN, 0.0, NaN, 0.0, 0.5, NaN, NaN, NaN, 0.0, NaN, NaN, NaN, NaN, NaN, NaN, NaN, NaN, NaN, NaN, NaN, NaN, -0.5, NaN, 0.5, NaN, NaN, NaN, 1.0, NaN, NaN, NaN, 0.0, NaN, NaN, 0.0, NaN, -0.5, 0.0, NaN, -1.0, NaN, 0.0, NaN, 0.5, NaN, NaN, NaN, 0.0, NaN, 1.0, NaN, NaN, NaN, NaN, NaN, 0.0, NaN, NaN, NaN, NaN, NaN, NaN, NaN, NaN, NaN, NaN, NaN, 0.0, NaN, NaN, NaN, NaN, 0.5, NaN, NaN, NaN, NaN, -0.5, NaN, 0.5, 0.0, NaN, NaN, -1.0, NaN, NaN, NaN, 0.5, NaN, NaN, NaN, NaN, NaN, NaN, NaN, NaN, -1.0, NaN, NaN, -1.0, 0.0, -0.5, NaN",0.012,-0.047,"hic, tu, libido, hic, hic, obiurgo, intemperantia, tu",0.062
cicero.pro_caelio,26.0,"atque, primus, pars, sum, ille, qui, ego, paruus, moueo, sum, meus, necessarius, bestia, caelium, familiaris, ceno, apud, is, uentito, domus, studeo, praetura, non, ego, hic, moueo, qui, perspicuus, fallo, sum, etenim, is, unus, ceno, dico, qui, aut, absum, aut, qui, necesse, sum, idem, dico, neque, uerus, ille, ego, commoueo, qui, sui, in, lupercis, sodalis, sum, caelium, dico, ferus, quidam, sodalitas, et, planus, pastoricius, atque, agrestis, germani, lupercorum, qui, coitio, ille, siluestris, ante, sum, institutum, quam, humanitas, atque, lex, si, quidem, non, modo, nomen, defero, inter, sui, sodal, sed, etiam, commemoro, sodalitas, in, accuso, ut, ne, quis, is, fors, nescio, timeo, uideo",101,"NaN, 0.5, 0.0, NaN, NaN, NaN, NaN, 0.0, NaN, NaN, 0.0, 0.0, NaN, NaN, 1.0, NaN, NaN, NaN, NaN, 0.0, NaN, NaN, NaN, NaN, NaN, NaN, NaN, NaN, NaN, NaN, NaN, NaN, NaN, NaN, NaN, NaN, NaN, NaN, NaN, NaN, 0.0, NaN, NaN, NaN, NaN, 0.5, NaN, NaN, NaN, NaN, NaN, NaN, NaN, 1.0, NaN, NaN, NaN, -1.0, NaN, NaN, NaN, 0.0, NaN, NaN, NaN, NaN, NaN, NaN, NaN, NaN, NaN, NaN, NaN, NaN, NaN, 0.0, NaN, 0.5, NaN, NaN, NaN, NaN, 0.0, NaN, NaN, NaN, NaN, NaN, NaN, NaN, NaN, NaN, NaN, NaN, NaN, NaN, NaN, 0.0, NaN, NaN, NaN",0.025,-0.01,"bestia, hic, fallo, ferus, germani",0.05
cicero.pro_caelio,27.0,"sed, hic, omitto, ad, ille, qui, ego, magis, moueo, respondeo, deliciae, obiurgatio, sum, longus, etiam, lenio, multus, disputatio, habeo, quam, atrocitas, quo, etiam, audio, sum, attendo, nam, publicus, claudus, amicus, meus, cum, sui, grauis, uehemens, iacto, et, omnis, inflammo, ago, tristis, uerbum, uox, maximus, tametsi, probo, is, eloquentia, tamen, non, pertimesco, aliquot, enim, in, causa, is, uideo, frustra, litigo, tu, autem, balbus, respondeo, primus, precarius, si, licet, si, fas, sum, defendo, ab, ego, is, qui, nullus, conuiuium, renuerit, qui, in, hortus, sum, qui, unguentum, sumo, qui, baiae, uideo",88,"NaN, NaN, NaN, NaN, NaN, NaN, NaN, NaN, NaN, NaN, NaN, -1.0, NaN, 0.0, NaN, NaN, 0.0, NaN, NaN, NaN, -1.0, NaN, NaN, NaN, NaN, NaN, NaN, 0.0, -0.5, 1.0, 0.0, NaN, NaN, -0.5, NaN, NaN, NaN, NaN, NaN, NaN, -1.0, 0.0, 0.0, NaN, NaN, NaN, NaN, NaN, NaN, NaN, NaN, NaN, NaN, NaN, 0.0, NaN, NaN, NaN, NaN, NaN, NaN, NaN, NaN, 0.5, 0.0, NaN, NaN, NaN, NaN, NaN, NaN, NaN, NaN, NaN, NaN, NaN, NaN, NaN, NaN, NaN, NaN, NaN, NaN, NaN, NaN, NaN, NaN, NaN",-0.028,-0.045,"hic, deliciae, inflammo, tu, conuiuium, unguentum",0.068
cicero.pro_caelio,28.0,"equidem, multus, et, uideo, in, hic, ciuitas, et, audio, non, modo, qui, primoris, labrum, gusto, genus, hic, uita, et, exter, ut, dico, digitus, attingo, sed, qui, totus, adulescentia, uoluptas, dedo, emergo, aliquando, et, sui, ad, frugis, bonus, ut, dico, recipio, grauis, homo, atque, illustris, sum, do, enim, concedo, omnis, hic, aliqui, ludus, aetas, et, ipse, natura, profundo, adulescentia, cupiditas, qui, si, ita, erumpo, ut, nullus, uita, labefacto, nullus, domus, euerto, facilis, et, tolerabilis, habeo, soleo",75,"NaN, 0.0, NaN, NaN, NaN, NaN, 0.5, NaN, NaN, NaN, NaN, NaN, NaN, NaN, NaN, 0.0, NaN, 0.0, NaN, 0.0, NaN, NaN, NaN, NaN, NaN, NaN, NaN, NaN, 1.0, NaN, NaN, NaN, NaN, NaN, NaN, NaN, 1.0, NaN, NaN, NaN, -0.5, 0.0, NaN, NaN, NaN, NaN, NaN, NaN, NaN, NaN, NaN, NaN, 0.0, NaN, NaN, 0.0, NaN, NaN, -0.5, NaN, NaN, NaN, NaN, NaN, NaN, 0.0, NaN, NaN, 0.0, NaN, 0.5, NaN, 0.5, NaN, NaN",0.033,-0.013,"hic, hic, hic",0.04
cicero.pro_caelio,29.0,"sed, tu, ego, uidebaris, ex, communis, infamia, iuuentus, aliqui, inuidia, caelio, uolo, conflaris, itaque, omnis, ille, silentium, qui, sum, oratio, tribuo, tuus, sum, ob, is, causa, qui, unus, reor, propono, de, multus, uitium, cogito, facilis, sum, accuso, luxurio, dies, iam, ego, deficio, si, qui, dico, in, is, sententia, possum, conor, expromo, de, corruptelis, de, adulterium, de, proteruitas, de, sumptus, immensus, oratio, sum, ut, tu, reus, nemo, sed, uitio, iste, propono, res, tamen, ipse, et, copiosus, et, grauis, accusaris, possum, sed, uester, sapientia, iudex, sum, non, abduco, ab, reor, neque, qui, aculeus, habeo, seueritas, grauitas, uester, cum, is, accusator, erigo, in, res, in, uitio, in, mos, in, tempus, emitto, in, homo, et, in, reus, cum, is, non, suus, crimen, sed, multus, uitio, sum, in, quidam, odium, iniustus, uoco",127,"NaN, NaN, NaN, NaN, NaN, 0.0, -1.0, NaN, NaN, -1.0, NaN, NaN, NaN, NaN, NaN, NaN, NaN, NaN, NaN, -0.5, NaN, 0.0, NaN, NaN, NaN, 0.0, NaN, NaN, NaN, NaN, NaN, 0.0, -1.0, NaN, 0.5, NaN, NaN, NaN, 0.0, NaN, NaN, NaN, NaN, NaN, NaN, NaN, NaN, 0.0, NaN, NaN, NaN, NaN, NaN, NaN, -0.5, NaN, -0.5, NaN, NaN, 0.0, -0.5, NaN, NaN, NaN, NaN, -0.5, NaN, NaN, NaN, NaN, 0.0, NaN, NaN, NaN, 1.0, NaN, -0.5, NaN, NaN, NaN, NaN, 1.0, 0.5, NaN, NaN, NaN, NaN, NaN, NaN, NaN, NaN, NaN, NaN, -0.5, NaN, NaN, NaN, 0.0, NaN, NaN, 0.0, NaN, NaN, NaN, 0.5, NaN, 0.0, NaN, NaN, 0.0, NaN, NaN, NaN, NaN, NaN, NaN, NaN, -1.0, NaN, 0.0, NaN, NaN, NaN, NaN, -1.0, -1.0, NaN",-0.047,-0.075,"tu, infamia, inuidia, luxurio, corruptelis, adulterium, tu, reus, seueritas, reus, crimen, iniustus",0.094
cicero.pro_caelio,30.0,"itaque, ego, seueritas, tuus, ita, ut, oportet, respondeo, non, audeo, sum, enim, meus, deprecor, uacatio, adulescentia, uenio, peto, non, inquam, audeo, perfugium, nihil, uto, aetas, concedo, omnis, ius, dimitto, tantus, peto, ut, si, qui, sum, inuidia, communis, hic, tempus, aer, alienus, petulantia, libido, iuuentus, quam, uideo, sum, magnus, tamen, ne, hic, alienus, pecco, ne, aetas, atque, tempus, uitio, noceo, atque, ego, idem, qui, hic, postulo, quin, crimen, qui, in, hic, proprius, confero, diligens, respondeo, non, recuso, sum, autem, duo, crimen, aurum, et, uenenum, in, qui, unus, atque, idem, persono, uerso, aurum, sumo, ab, clodia, uenenum, quaero, qui, clodiae, do, ut, dico, omnis, sum, alius, non, crimen, sed, maledico, iurgi, petulans, magis, quam, publicus, quaestio, adulter, impudicus, sequester, conuicium, sum, non, accusatio, nullus, sum, enim, fundamentum, hic, crimen, nullus, sedes, uoco, sum, contumeliosus, temere, ab, irascor, accusator, nullus, auctor, emitto, hic, duo, crimen, uideo, auctor",144,"NaN, NaN, NaN, 0.0, NaN, NaN, NaN, NaN, NaN, NaN, NaN, NaN, 0.0, NaN, NaN, NaN, NaN, NaN, NaN, NaN, NaN, -1.0, NaN, NaN, 0.0, NaN, NaN, 0.5, NaN, NaN, NaN, NaN, NaN, NaN, NaN, -1.0, 0.0, NaN, 0.0, 0.0, -0.5, -0.5, -0.5, NaN, NaN, NaN, NaN, 0.0, NaN, NaN, NaN, -0.5, NaN, NaN, 0.0, NaN, 0.0, NaN, NaN, NaN, NaN, NaN, NaN, NaN, NaN, NaN, -1.0, NaN, NaN, NaN, 0.0, NaN, 1.0, NaN, NaN, NaN, NaN, NaN, NaN, -1.0, 0.5, NaN, -0.5, NaN, NaN, NaN, NaN, NaN, NaN, NaN, 0.5, NaN, NaN, NaN, -0.5, NaN, NaN, NaN, NaN, NaN, NaN, NaN, NaN, NaN, NaN, -1.0, NaN, NaN, NaN, -0.5, NaN, NaN, 0.0, NaN, NaN, -1.0, NaN, -1.0, NaN, NaN, NaN, NaN, NaN, NaN, NaN, NaN, -1.0, NaN, 0.0, NaN, NaN, NaN, NaN, NaN, NaN, 0.0, NaN, NaN, NaN, NaN, NaN, -1.0, NaN, NaN",-0.069,-0.087,"seueritas, inuidia, hic, petulantia, libido, hic, noceo, hic, crimen, hic, crimen, crimen, maledico, petulans, adulter, impudicus, conuicium, hic, crimen, hic, crimen",0.146
cicero.pro_caelio,31.0,"uideo, fons, uideo, certus, nomen, et, caput, aurum, opus, sum, sumo, ab, clodia, sumo, sine, testis, habeo, quamdiu, uolo, magnus, uideo, signum, quidam, egregius, familiaritas, neco, idem, uolo, quaero, uenenum, sollicito, seruus, potio, paro, locus, constituo, clam, affero, magnus, rursus, odium, uideo, cum, crudelis, discidium, exsisto, res, sum, omnis, in, hic, causa, nos, iudex, cum, clodia, mulier, non, solus, nobilis, uerus, etiam, nosco, de, qui, ego, nihil, dico, nisi, depello, crimen, causa",72,"NaN, NaN, NaN, 0.5, 0.0, NaN, 0.0, 0.5, 0.5, NaN, NaN, NaN, NaN, NaN, NaN, NaN, NaN, NaN, NaN, 0.0, NaN, 0.0, NaN, 0.0, 0.5, NaN, NaN, NaN, NaN, -0.5, NaN, -0.5, NaN, NaN, 0.0, NaN, NaN, NaN, 0.0, NaN, -1.0, NaN, NaN, -1.0, NaN, NaN, 0.0, NaN, NaN, NaN, NaN, 0.0, NaN, 0.5, NaN, NaN, 0.0, NaN, -0.5, 1.0, 0.5, NaN, NaN, NaN, NaN, NaN, NaN, NaN, NaN, NaN, -1.0, 0.0",-0.007,-0.062,"crudelis, hic, mulier, crimen",0.056
cicero.pro_caelio,32.0,"sed, intellego, pro, tuus, praesto, prudentia, gnaeus, domo, cum, hic, solus, res, sum, nos, qui, si, sui, aurum, caelio, commodo, non, dico, si, uenenum, ab, hic, sui, paro, sum, non, arguo, petulanter, facio, si, mater, familia, secus, quam, matronaris, sanctitas, postulo, nomino, sin, iste, mulier, remoueo, neque, crimen, ullus, neque, ops, ad, oppugno, marcus, caelium, ille, relinquo, quis, sum, alius, qui, nos, patronus, facio, debeo, nisi, ut, is, qui, insecto, repello, qui, quidem, facio, uehemens, nisi, intercedo, ego, inimicitia, cum, iste, mulier, uir, frater, uolo, dico, semper, hic, erro, nunc, ago, modicus, neque, longus, progredio, quam, ego, meus, fides, et, causa, ipse, cogo, neque, enim, muliebris, umquam, inimicitia, ego, gero, puto, praesertim, cum, is, quam, omnis, semper, amica, omnis, potis, quam, quisquam, inimica, puto",124,"NaN, NaN, NaN, 0.0, NaN, 0.5, NaN, NaN, NaN, NaN, -0.5, 0.0, NaN, NaN, NaN, NaN, NaN, 0.5, NaN, NaN, NaN, NaN, NaN, -0.5, NaN, NaN, NaN, NaN, NaN, NaN, NaN, NaN, NaN, NaN, 0.0, 0.5, NaN, NaN, NaN, NaN, NaN, NaN, NaN, NaN, 0.0, NaN, NaN, -1.0, NaN, NaN, 0.0, NaN, NaN, NaN, NaN, NaN, NaN, NaN, NaN, NaN, NaN, NaN, NaN, NaN, NaN, NaN, NaN, NaN, NaN, NaN, NaN, NaN, NaN, NaN, NaN, NaN, NaN, NaN, -1.0, NaN, NaN, 0.0, 0.5, 0.0, NaN, NaN, NaN, NaN, 0.0, NaN, NaN, 0.0, NaN, 0.0, NaN, NaN, NaN, 0.0, 1.0, NaN, 0.0, NaN, NaN, NaN, NaN, NaN, NaN, -1.0, NaN, NaN, NaN, NaN, NaN, NaN, NaN, NaN, NaN, NaN, NaN, 0.0, NaN, NaN, NaN, NaN",-0.008,-0.032,"hic, hic, petulanter, matronaris, mulier, crimen, mulier, hic, muliebris",0.073
cicero.pro_caelio,33.0,"sed, tamen, ex, ipse, quaero, prior, utrum, ego, cum, sui, sero, et, grauis, et, priscus, ago, malo, an, remitto, et, lenis, et, urbanus, si, ille, austerus, mos, atque, modo, aliquis, ego, ab, inferi, excito, sum, ex, barbatus, ille, non, hic, barbula, qui, iste, delecto, sed, ille, horridus, quam, in, statuo, antiquus, atque, imago, uideo, qui, obiurgo, mulier, et, qui, pro, ego, loquor, ne, ego, iste, fors, suscenseo, exsisto, igitur, ex, hic, ipse, familia, aliquis, atque, potis, caecus, ille, paruus, enim, dolor, capio, qui, iste, non, uideo, qui, profecto, si, ex-sisto, sic, ago, atque, sic, loquor, mulier, quis, tu, cum, caelio, quis, cum, homo, adulescentulus, quis, cum, alienus, cur, aut, tam, familiaris, sum, ut, aurum, commodaris, aut, tam, inimicus, ut, uenenum, timeo, non, pater, tuus, uideo, non, patruus, non, auus, non, proauus, non, abauus, non, atauus, audio, consul, sum",138,"NaN, NaN, NaN, NaN, NaN, 0.5, NaN, NaN, NaN, NaN, NaN, NaN, -0.5, NaN, 0.0, NaN, NaN, NaN, NaN, NaN, 1.0, NaN, 0.5, NaN, NaN, -0.5, 0.5, NaN, NaN, NaN, NaN, NaN, 0.0, NaN, NaN, NaN, NaN, NaN, NaN, NaN, NaN, NaN, NaN, NaN, NaN, NaN, -1.0, NaN, NaN, NaN, 0.0, NaN, NaN, NaN, NaN, NaN, 0.0, NaN, NaN, NaN, NaN, NaN, NaN, NaN, NaN, 0.0, NaN, NaN, NaN, NaN, NaN, NaN, 0.5, NaN, NaN, 0.0, -1.0, NaN, 0.0, NaN, -1.0, NaN, NaN, NaN, NaN, NaN, NaN, NaN, NaN, NaN, NaN, NaN, NaN, NaN, NaN, 0.0, NaN, NaN, NaN, NaN, NaN, NaN, 0.0, NaN, NaN, NaN, -0.5, NaN, NaN, NaN, 1.0, NaN, NaN, 0.5, NaN, NaN, NaN, -1.0, NaN, -0.5, NaN, NaN, 0.0, 0.0, NaN, NaN, NaN, NaN, NaN, NaN, NaN, NaN, NaN, NaN, NaN, NaN, 0.5, NaN",-0.007,-0.043,"hic, obiurgo, mulier, hic, mulier, tu",0.043
cicero.pro_caelio,34.0,"non, denique, modo, tu, quintus, metelli, matrimonium, teneo, scio, clarus, atque, fortis, uir, patria, amo, qui, simul, atque, pedis, limen, effero, omnis, prope, ciuis, uirtus, gloria, dignitas, supero, cum, ex, amplus, genus, in, familia, clarus, nubo, cur, tu, caelius, tam, coniungo, sum, cognatus, affinis, uir, tuus, familiaris, nihil, is, quis, igitur, sum, nisi, quidam, temeritas, atque, libido, nonne, tu, si, noster, imago, uirilis, non, commoueo, ne, progenies, quidem, meus, quintus, ille, claudia, aemulus, domesticus, laus, in, gloria, muliebris, sum, admoneo, non, uirgo, ille, uestal, claudia, qui, pater, complector, triumpho, ab, inimicus, tribunus, plebes, de, currus, detraho, patior, non, sum, cur, tu, fraternus, uitio, potis, quam, bonus, paternus, et, auitus, et, usque, ab, nos, cum, in, uis, tum, etiam, in, femina, repeto, moueo, ideo, -ne, ego, pax, pyrrhi, dis-redimo, ut, tu, amor, turpis, cottidie, foedero, ferio, ideo, aqua, adduco, ut, is, tu, incestus, uto, ideo, uia, munio, ut, is, tu, alienus, uis, comito, celebraris",153,"NaN, NaN, NaN, NaN, NaN, NaN, NaN, NaN, NaN, 0.5, NaN, 0.5, 0.5, NaN, NaN, NaN, NaN, NaN, 0.0, NaN, NaN, NaN, NaN, 0.5, 1.0, 0.0, 1.0, NaN, NaN, NaN, 0.0, 0.0, NaN, 0.5, 0.5, NaN, NaN, NaN, NaN, NaN, NaN, NaN, NaN, 0.0, 0.5, 0.0, 1.0, NaN, NaN, NaN, NaN, NaN, NaN, NaN, -0.5, NaN, -0.5, NaN, NaN, NaN, NaN, NaN, 0.5, NaN, NaN, NaN, 0.0, NaN, 0.0, NaN, NaN, NaN, NaN, 0.0, 1.0, NaN, 0.0, NaN, NaN, NaN, NaN, NaN, NaN, NaN, NaN, NaN, 0.0, NaN, NaN, NaN, -1.0, -0.5, NaN, NaN, NaN, NaN, NaN, NaN, NaN, NaN, NaN, 0.0, NaN, 0.0, NaN, 1.0, NaN, NaN, NaN, NaN, NaN, NaN, NaN, NaN, NaN, 1.0, NaN, NaN, NaN, 0.0, NaN, NaN, NaN, NaN, NaN, 0.5, NaN, NaN, NaN, NaN, 1.0, -1.0, NaN, NaN, NaN, NaN, 0.0, NaN, NaN, NaN, NaN, NaN, NaN, NaN, 0.0, NaN, NaN, NaN, NaN, -0.5, 1.0, NaN, NaN",0.056,-0.026,"tu, matrimonium, nubo, tu, temeritas, libido, tu, muliebris, uirgo, tu, fraternus, tu, turpis, foedero, tu, incestus, tu",0.111
cicero.pro_caelio,35.0,"sed, quis, ego, iudex, ita, grauis, persona, induco, ut, uereor, ne, sui, idem, appius, repens, conuerto, et, caelium, incipio, accuso, ille, suus, grauitas, censorius, sed, uideo, hic, posterus, atque, ita, iudex, ut, uel, seuerus, disceptator, marcus, caelum, uita, ego, probo, sum, confido, tu, uerus, mulier, iam, enim, ipse, cum, tu, nullus, persono, introduco, loquor, si, is, qui, facio, qui, dico, qui, insimulo, qui, molior, qui, arguo, probaris, cogito, ratio, tantus, familiaritas, tantus, consuetudo, tantus, coniunctio, reddo, atque, expono, necesse, sum, accusator, quidem, libido, amor, adulterium, baiae, ago, conuiuium, comissatio, cantus, symphonia, nauigium, iacto, idem, significo, nihil, sui, tu, inuito, dico, qui, tu, quoniam, mens, nescio, qui, effreno, atque, praeceps, in, forum, defero, iudicium, uolo, aut, diluo, oportet, atque, fallo, sum, doceo, aut, nihil, neque, crimen, tuus, neque, testimonium, credo, sum, fatearis",131,"NaN, NaN, NaN, 0.5, NaN, -0.5, 0.0, NaN, NaN, NaN, NaN, NaN, NaN, NaN, 0.0, NaN, NaN, NaN, NaN, NaN, NaN, NaN, -0.5, NaN, NaN, NaN, NaN, 0.0, NaN, NaN, 0.5, NaN, NaN, NaN, NaN, NaN, 0.5, 0.0, NaN, NaN, NaN, NaN, NaN, 0.5, 0.0, NaN, NaN, NaN, NaN, NaN, NaN, NaN, NaN, NaN, NaN, NaN, NaN, NaN, NaN, NaN, NaN, NaN, NaN, NaN, NaN, NaN, NaN, NaN, 0.0, NaN, 0.5, NaN, NaN, NaN, NaN, NaN, NaN, NaN, 0.0, NaN, 0.0, NaN, -0.5, 1.0, -0.5, NaN, NaN, NaN, NaN, 0.0, NaN, NaN, NaN, NaN, NaN, NaN, NaN, NaN, NaN, NaN, NaN, NaN, NaN, 0.5, NaN, NaN, NaN, NaN, NaN, NaN, NaN, NaN, 0.5, NaN, NaN, NaN, NaN, NaN, NaN, NaN, NaN, NaN, NaN, NaN, -1.0, 0.0, NaN, NaN, NaN, NaN, NaN",0.011,-0.023,"hic, tu, mulier, tu, insimulo, libido, adulterium, conuiuium, nauigium, tu, tu, effreno, fallo, crimen",0.107
cicero.pro_caelio,36.0,"sin, autem, urbanus, ego, ago, malo, sic, ago, cum, tu, remoueo, ille, senex, durus, atque, paene, agrestis, ex, hic, igitur, sumo, aliquis, atque, potis, paruus, frater, qui, sum, in, iste, genus, urbanus, qui, tu, amo, multus, qui, propter, nescio, quam, credo, timiditas, et, nocturnus, quidam, inanis, metus, cum, tu, semper, pusio, cum, magnus, soror, cubito, is, puto, cum, tu, loquor, quis, tumultuaris, soror, quis, insanus, quis, clamor, exordior, uerbum, paruus, res, magnus, facio, uicinus, adulescentulus, aspicio, candor, hic, tu, et, proceritas, uultus, oculus, pello, saepis, uideo, uolo, sum, non, numquam, in, idem, hortus, uolo, nobilis, mulier, ille, filius, familia, pater, parco, atque, tenax, habeo, tuus, copia, deuincio, non, possum, calcitro, respuo, repello, non, puto, tuus, donum, sum, tantus, confero, tu, alius, habeo, hortus, ad, tiberis, atque, diligenter, is, locus, paro, quo, omnis, iuuentus, nato, causa, uenio, hinc, licet, condicio, cottidie, lego, cur, hic, qui, tu, sperno, molestus, sum",148,"NaN, NaN, 0.5, NaN, NaN, NaN, NaN, NaN, NaN, NaN, NaN, NaN, 0.0, -0.5, NaN, NaN, NaN, NaN, NaN, NaN, NaN, NaN, NaN, 0.0, 0.0, 0.0, NaN, NaN, NaN, NaN, 0.0, 0.5, NaN, NaN, NaN, 0.0, NaN, NaN, NaN, NaN, NaN, -1.0, NaN, NaN, NaN, NaN, -1.0, NaN, NaN, NaN, NaN, NaN, 0.0, NaN, NaN, NaN, NaN, NaN, NaN, NaN, NaN, NaN, NaN, NaN, -1.0, NaN, NaN, NaN, 0.0, 0.0, 0.0, 0.0, NaN, 0.0, NaN, NaN, 0.5, NaN, NaN, NaN, NaN, NaN, 0.0, NaN, NaN, NaN, NaN, NaN, NaN, NaN, NaN, NaN, NaN, NaN, 1.0, 0.0, NaN, 0.0, 0.5, 0.0, NaN, NaN, NaN, NaN, 0.0, 0.5, NaN, NaN, NaN, NaN, NaN, NaN, NaN, NaN, 0.0, 0.0, NaN, NaN, NaN, NaN, NaN, NaN, NaN, NaN, NaN, NaN, NaN, NaN, 0.0, NaN, NaN, NaN, NaN, NaN, 0.0, NaN, NaN, NaN, 0.0, NaN, NaN, NaN, NaN, NaN, NaN, NaN, -1.0, NaN",-0.007,-0.03,"tu, hic, tu, tu, cubito, tu, insanus, hic, tu, mulier, tu, hic, tu",0.088
