Text,Stelle,Inahlt,Wortzahl,Sentiment Rechnung,Sentiment-Score,alternativer Sentiment-Score,Invektiven,Invektivitäts-Score
cicero.de_fato,1.0,"quia, pertineo, ad, mos, qui, ἦθος, ille, uoco, nos, is, pars, philosophia, de, mos, appello, solo, sed, decet, augeo, lingua, latinus, nominaris, moral, explico, uolo, sum, ratio, enuntiatio, qui, graecus, ἀξιώματα, uoco, qui, de, res, sum, cum, aliquis, dico, de, is, qui, possum, fio, aut, non, possum, quam, uis, habeo, obscurus, quaestio, sum, quam, περὶ, δυνατῶν, philosophus, appello, totus, sum, λογική, quam, ratio, dissero, uoco, qui, autem, in, alius, liber, facio, qui, sum, de, natura, deus, ito, in, is, qui, de, diuinatio, edo, ut, in, uter, pars, perpetuus, explico, oratio, quo, facilis, is, ab, quoque, probo, qui, quisque, magnus, probabilis, uideo, is, in, hic, disputatio, de, fatum, casus, quidam, ne, facio, inpediuit",112,"NaN, NaN, NaN, 0.5, NaN, NaN, NaN, NaN, NaN, NaN, 0.0, NaN, NaN, 0.5, NaN, NaN, NaN, NaN, NaN, -0.5, NaN, NaN, NaN, NaN, NaN, NaN, 0.0, NaN, NaN, NaN, NaN, NaN, NaN, NaN, 0.0, NaN, NaN, NaN, NaN, NaN, NaN, NaN, NaN, NaN, NaN, NaN, NaN, NaN, 1.0, NaN, NaN, NaN, NaN, NaN, NaN, NaN, 0.0, NaN, NaN, NaN, NaN, NaN, 0.0, NaN, NaN, NaN, NaN, NaN, NaN, 0.5, NaN, NaN, NaN, NaN, 0.0, 0.0, NaN, NaN, NaN, NaN, NaN, NaN, NaN, NaN, NaN, NaN, 0.0, 0.0, NaN, -0.5, NaN, 0.5, NaN, NaN, NaN, NaN, NaN, NaN, 0.0, 0.5, NaN, NaN, NaN, NaN, NaN, NaN, 0.0, 0.0, NaN, NaN, NaN, NaN",0.022,-0.009,hic,0.009
cicero.de_fato,2.0,"nam, cum, sum, in, puteolano, hirtus, noster, consul, designo, idem, in, locus, uir, nos, amicus, et, hic, studium, in, qui, nos, ab, pueritia, uiuo, dedo, multus, unus, sum, magnus, nos, quidem, exquiro, is, consilium, qui, ad, pax, et, ad, concordia, ciuis, pertineo, cum, enim, omnis, post, interitus, caesar, nouaris, perturbatio, causa, quaero, uideo, is, sum, occurro, puto, omnis, fere, noster, in, hic, deliberatio, consumo, oratio, is, et, saepe, alius, et, quidam, liber, quam, soleo, et, magis, uacuus, ab, interuentor, dies, cum, ad, ego, ille, uenio, primus, is, qui, sum, cottidianus, et, quasi, legitimus, nos, de, pax, et, de, otium",99,"NaN, NaN, NaN, NaN, NaN, -0.5, NaN, 0.5, NaN, NaN, NaN, 0.0, 0.5, NaN, 1.0, NaN, NaN, 0.5, NaN, NaN, NaN, NaN, 0.0, NaN, NaN, 0.0, NaN, NaN, 0.0, NaN, NaN, NaN, NaN, 0.5, NaN, NaN, 0.5, NaN, NaN, 1.0, 0.5, NaN, NaN, NaN, NaN, NaN, -1.0, 0.5, NaN, -0.5, 0.0, NaN, NaN, NaN, NaN, NaN, NaN, NaN, NaN, NaN, NaN, NaN, NaN, NaN, -0.5, NaN, NaN, NaN, NaN, NaN, NaN, 0.5, NaN, NaN, NaN, NaN, NaN, NaN, NaN, 0.0, NaN, NaN, NaN, NaN, NaN, 0.5, NaN, NaN, NaN, NaN, NaN, NaN, NaN, NaN, NaN, 0.5, NaN, NaN, 0.5",0.051,-0.025,"hic, hic, otium",0.03
cicero.de_fato,3.0,"qui, ago, quis, ergo, inquam, ille, quoniam, oratoria, exercitatio, non, tu, quidem, ut, spero, relinquo, sed, certus, philosophia, ille, antepono, possum, aliquis, audio, tu, uerus, inquam, uel, audio, uel, dico, neque, enim, is, qui, rectus, existimo, oratorium, ille, studium, desero, qui, etiam, tu, incendo, quamquam, flagro, accipio, neque, is, qui, nunc, traho, minuo, sed, augeo, potis, ille, facultas, nam, cum, hic, genus, philosophia, qui, nos, sequor, magnus, habeo, orator, societas, subtilitas, enim, ab, academia, mutuo, et, is, uicissim, reddo, ubertas, oratio, et, ornamentum, dico, quam, ob, res, inquam, quoniam, uterque, studium, noster, possessio, sum, hodie, uter, fruor, malus, optio, sum, tuus, tum, hirtius, gratus, inquam, et, tuus, omnis, similis, nihil, enim, umquam, abnuo, meus, studium, uoluntas, tuus",117,"NaN, NaN, NaN, NaN, NaN, NaN, NaN, NaN, NaN, NaN, NaN, NaN, NaN, NaN, NaN, NaN, 0.5, NaN, NaN, NaN, NaN, NaN, NaN, NaN, 0.5, NaN, NaN, NaN, NaN, NaN, NaN, NaN, NaN, NaN, 1.0, NaN, NaN, NaN, 0.5, NaN, NaN, NaN, NaN, NaN, NaN, NaN, NaN, NaN, NaN, NaN, NaN, NaN, NaN, NaN, NaN, 0.0, NaN, 0.5, NaN, NaN, NaN, 0.0, NaN, NaN, NaN, NaN, 0.0, NaN, NaN, 1.0, NaN, NaN, NaN, NaN, NaN, NaN, NaN, NaN, NaN, NaN, -0.5, NaN, NaN, NaN, NaN, NaN, 0.0, NaN, NaN, NaN, 0.5, NaN, NaN, NaN, NaN, NaN, NaN, -1.0, NaN, NaN, 0.0, NaN, NaN, 1.0, NaN, NaN, 0.0, NaN, 0.0, NaN, NaN, NaN, NaN, 0.0, 0.5, 0.0, 0.0",0.038,-0.013,"tu, tu, tu, hic, societas",0.043
cicero.de_fato,4.0,"sed, quoniam, rhetorica, ego, uester, sum, nosco, tu, in, is, et, audio, saepe, et, audio, atque, hic, academicus, contra, propono, disputo, consuetudo, indico, tu, suscipio, tusculanae, disputatio, pono, aliquis, ad, qui, audio, si, tu, non, sum, molestus, uolo, an, ego, inquam, possum, quisquam, sum, molestus, qui, tu, gratus, sum, sum, sed, ita, audio, ut, romanus, homo, ut, timidus, ingredior, ad, hic, genus, disputo, ut, longus, interuallum, hic, studium, repeto, ita, inquam, audio, tu, disputo, ut, is, lego, qui, scribo, proinde, ordior, consido, hic",83,"NaN, NaN, NaN, NaN, NaN, NaN, NaN, NaN, NaN, NaN, NaN, NaN, NaN, NaN, NaN, NaN, NaN, NaN, NaN, NaN, NaN, NaN, NaN, NaN, NaN, NaN, NaN, NaN, NaN, NaN, NaN, NaN, NaN, NaN, NaN, NaN, -1.0, NaN, NaN, NaN, NaN, NaN, NaN, NaN, -1.0, NaN, NaN, 1.0, NaN, NaN, NaN, NaN, NaN, NaN, NaN, 0.0, NaN, -0.5, NaN, NaN, NaN, 0.0, NaN, NaN, 0.0, NaN, NaN, 0.5, NaN, NaN, NaN, NaN, NaN, NaN, NaN, NaN, NaN, NaN, NaN, NaN, NaN, NaN, NaN",-0.012,-0.03,"tu, hic, tu, tu, tu, timidus, hic, hic, tu, hic",0.12
cicero.de_fato,5.0,"qui, in, alius, ut, in, antipatro, poe+ta, ut, in, brumalis, dies, obstino, ut, in, simul, aegroto, frater, ut, in, urina, ut, in, unguis, ut, in, reliquus, is, modus, natura, contagio, ualeo, quam, ego, non, tollo, uolo, sum, nullus, fatal, in, alius, autem, fortuitus, quidam, sum, possum, ut, in, ille, naufragus, ut, in, icadio, ut, in, daphita, quidam, etiam, posidonius, pax, magister, dico, comminisci, uideo, sum, quidem, absurdus, quis, enim, si, daphitae, fatum, sum, ex, equus, cado, atque, ita, pereo, ex, hic, equus, qui, cum, equus, non, sum, nomen, habeo, alienus, aut, philippus, hic, in, capulus, quadrigulae, uitaris, moneo, quasi, uerus, capulus, sum, occido, quis, autem, magnus, aut, naufragus, ille, sine, nomen, in, riuus, sum, labor, quamquam, hic, quidem, hic, scribo, praedico, in, aqua, sum, pereo, ne, herculis, icadii, quidem, praedo, uideo, fatum, ullus",133,"NaN, NaN, NaN, NaN, NaN, NaN, NaN, NaN, NaN, NaN, 0.0, NaN, NaN, NaN, NaN, NaN, 0.0, NaN, NaN, NaN, NaN, NaN, NaN, NaN, NaN, 0.0, NaN, 0.5, 0.0, NaN, NaN, NaN, NaN, NaN, NaN, NaN, NaN, NaN, NaN, NaN, NaN, NaN, NaN, NaN, NaN, NaN, NaN, NaN, NaN, -0.5, NaN, NaN, NaN, NaN, NaN, NaN, NaN, NaN, NaN, 0.5, 0.5, NaN, NaN, NaN, NaN, NaN, -1.0, NaN, NaN, NaN, NaN, 0.0, NaN, NaN, NaN, NaN, NaN, NaN, NaN, NaN, NaN, NaN, NaN, NaN, NaN, NaN, NaN, 0.0, NaN, -0.5, NaN, NaN, NaN, NaN, NaN, NaN, NaN, NaN, NaN, 0.5, NaN, NaN, NaN, NaN, NaN, 0.0, NaN, -0.5, NaN, NaN, 0.0, NaN, NaN, NaN, -0.5, NaN, NaN, NaN, NaN, NaN, NaN, NaN, 0.0, NaN, NaN, NaN, NaN, NaN, NaN, NaN, NaN, 0.0, NaN",-0.008,-0.023,"naufragus, hic, philippus, hic, occido, naufragus, hic, hic",0.06
cicero.de_fato,6.0,"nihil, enim, scribo, is, praedico, quis, mirus, igitur, ex, spelunca, saxum, in, crus, is, incido, puto, enim, etiamsi, icadius, tum, in, spelunca, non, sum, saxum, tamen, ille, cado, sum, nam, aut, nihil, omnino, sum, fortuitus, aut, hic, ipse, possum, euenio, fortuna, quaero, igitur, atque, hic, latus, pateo, si, fatum, omnino, nullus, nomen, nullus, natura, nullus, uolo, sum, et, fors, temere, casus, aut, plerusque, fio, aut, omnis, num, aliter, atque, nunc, euenio, euenio, quis, ergo, ad-teneo, inculcaris, fatum, cum, sine, fatum, ratio, omnis, res, ad, natura, fortuna, refero",87,"NaN, NaN, NaN, NaN, NaN, NaN, 1.0, NaN, NaN, 0.0, 0.0, NaN, NaN, NaN, NaN, NaN, NaN, NaN, NaN, NaN, NaN, 0.0, NaN, NaN, 0.0, NaN, NaN, NaN, NaN, NaN, NaN, NaN, NaN, NaN, NaN, NaN, NaN, NaN, NaN, NaN, 0.0, NaN, NaN, NaN, NaN, NaN, NaN, NaN, 0.0, NaN, NaN, 0.0, NaN, 0.0, NaN, NaN, NaN, NaN, 0.0, NaN, 0.0, NaN, NaN, NaN, NaN, NaN, NaN, NaN, NaN, NaN, NaN, NaN, NaN, NaN, NaN, NaN, 0.0, NaN, NaN, 0.0, 0.0, NaN, 0.0, NaN, 0.0, 0.0, NaN",0.011,0.0,"hic, hic",0.023
cicero.de_fato,7.0,"sed, posidonium, sicut, aequus, sum, cum, bonus, gratia, dimitto, ad, chrysippi, laqueus, reuorto, qui, quidem, primus, de, ipse, contagio, res, respondeo, reliquus, postea, persequor, inter, locus, natura, quantus, intersum, uideo, alius, sum, salubris, alius, pestilens, in, alius, sum, pituitosus, et, quasi, redundo, in, alius, exsicco, atque, aridus, multo, sum, alius, qui, inter, locus, et, locus, multus, differo, athenae, tenue, caelum, ex, quo, etiam, acuo, puto, atticus, crassus, thebis, itaque, pinguis, thebani, et, ualeo, tamen, neque, ille, tenue, caelum, efficio, ut, aut, zenonem, quis, aut, arcesilam, aut, theophrastum, audio, neque, crassus, ut, nemea, potis, quam, isthmo, uictoria, peto, diiunge, longus",99,"NaN, NaN, NaN, 0.5, NaN, NaN, 1.0, 1.0, NaN, NaN, NaN, NaN, NaN, NaN, NaN, 0.5, NaN, NaN, NaN, 0.0, NaN, 0.0, NaN, NaN, NaN, 0.0, 0.0, NaN, NaN, NaN, NaN, NaN, 1.0, NaN, NaN, NaN, NaN, NaN, NaN, NaN, NaN, NaN, NaN, NaN, NaN, NaN, NaN, NaN, NaN, NaN, NaN, NaN, 0.0, NaN, 0.0, 0.0, NaN, NaN, NaN, 0.5, NaN, NaN, NaN, NaN, NaN, NaN, NaN, NaN, NaN, NaN, NaN, NaN, NaN, NaN, NaN, NaN, NaN, 0.5, NaN, NaN, NaN, NaN, NaN, NaN, NaN, NaN, NaN, NaN, NaN, NaN, NaN, NaN, 0.0, NaN, NaN, NaN, NaN, NaN, 0.0",0.051,0.0,,0.0
cicero.de_fato,8.0,"quis, enim, locus, natura, affero, possum, ut, in, porticus, pompeii, potis, quam, in, campus, ambulo, cum, tu, quam, cum, alius, idus, potis, quam, kalendae, ut, igitur, ad, quidam, res, natura, locus, pertineo, aliquis, ad, quidam, autem, nihil, sic, astrum, affectio, ualeo, si, uolo, ad, quidam, res, ad, omnis, certus, non, ualeo, at, enim, quoniam, in, natura, homo, dissimilitudo, sum, ut, alius, dulcis, alius, subamarus, delecto, alius, libidinosus, alius, iracundus, aut, crudelis, aut, superbus, sum, alius, ab, talis, uitium, abhorreo, quoniam, igitur, inquam, tantus, natura, ab, natura, disto, quis, mirus, sum, hic, dissimilitudo, ex, differo, causa, sum, facio",97,"NaN, NaN, 0.0, 0.0, NaN, NaN, NaN, NaN, NaN, NaN, 0.0, NaN, NaN, 0.0, NaN, NaN, NaN, NaN, NaN, NaN, NaN, 0.0, NaN, NaN, NaN, NaN, NaN, NaN, 0.0, 0.0, 0.0, NaN, NaN, NaN, NaN, NaN, NaN, NaN, NaN, 0.0, NaN, NaN, NaN, NaN, NaN, 0.0, NaN, NaN, 0.5, NaN, NaN, NaN, NaN, NaN, NaN, 0.0, 0.0, NaN, NaN, NaN, NaN, 0.5, NaN, NaN, NaN, NaN, -1.0, NaN, -1.0, NaN, -1.0, NaN, -1.0, NaN, NaN, NaN, NaN, -1.0, NaN, NaN, NaN, NaN, NaN, 0.0, NaN, 0.0, NaN, NaN, 1.0, NaN, NaN, NaN, NaN, NaN, 0.0, NaN, NaN",-0.031,-0.052,"tu, libidinosus, iracundus, crudelis, hic",0.052
cicero.de_fato,9.0,"hic, dissero, qui, de, res, ago, et, in, quo, causa, consisto, non, uideo, non, enim, si, alius, ad, alius, propendeo, sum, propter, causa, natural, et, antecedo, idcirco, etiam, nostraris, uoluntas, atque, adpetitio, sum, causa, natural, et, antecedo, nam, nihil, sum, in, noster, potestas, si, ita, sui, res, habeo, nunc, uerus, fateor, acuo, hebeto, ualeo, imbecillis, sum, non, sum, is, in, nos, qui, autem, ex, is, cogo, puto, ne, ut, sedeo, quidem, aut, ambulo, uoluntas, sum, is, non, uideo, qui, quisque, res, res, consequor, ut, enim, et, ingeniosus, et, tardus, ita, nasco, antecedo, causa, ito, ualeo, et, imbecillis, non, sequor, tamen, ut, etiam, sedeo, is, et, ambulo, et, res, ago, aliqui, principal, causa, definio, et, constituo, sum",116,"NaN, NaN, NaN, NaN, 0.0, NaN, NaN, NaN, NaN, 0.0, NaN, NaN, NaN, NaN, NaN, NaN, NaN, NaN, NaN, NaN, NaN, NaN, 0.0, NaN, NaN, NaN, NaN, NaN, NaN, 0.0, NaN, NaN, NaN, 0.0, NaN, NaN, NaN, NaN, NaN, NaN, NaN, NaN, 0.5, NaN, NaN, NaN, 0.0, NaN, NaN, 0.5, NaN, NaN, NaN, NaN, NaN, NaN, NaN, NaN, NaN, NaN, NaN, NaN, NaN, NaN, NaN, NaN, NaN, NaN, NaN, NaN, NaN, NaN, NaN, 0.0, NaN, NaN, NaN, NaN, NaN, NaN, 0.0, 0.0, NaN, NaN, NaN, NaN, 1.0, NaN, NaN, NaN, NaN, NaN, 0.0, NaN, NaN, NaN, NaN, NaN, NaN, NaN, NaN, NaN, NaN, NaN, NaN, NaN, NaN, 0.0, NaN, NaN, NaN, 0.0, NaN, NaN, NaN, NaN",0.017,0.0,hic,0.009
cicero.de_fato,10.0,"stilponem, megaricum, philosophus, acutus, sanus, homo, et, probo, tempus, ille, accipio, hic, scribo, ipse, familiaris, et, ebriosus, et, mulierosus, sum, neque, hic, scribo, uitupero, sed, potis, ad, laus, uitiosus, enim, natura, ab, is, sic, edomo, et, con-premo, sum, doctrina, ut, nemo, umquam, uinulentum, ille, nemo, in, is, libido, uestigium, uideo, quis, socrate, -ne, nonne, lego, qui, ad, modus, noto, zopyrus, physiognomo, -ne, qui, sui, profiteor, homo, mos, natura, ex, corpus, oculus, uultus, frons, pernosco, stupidus, sum, socrate, -ne, dico, et, bardus, qui, iugulo, concauus, non, habeo, obstruo, is, pars, et, obturo, sum, dico, addo, etiam, mulierosus, in, quo, alcibiades, cachinnus, dico, tollo",102,"NaN, NaN, 0.0, NaN, 1.0, 0.0, NaN, NaN, 0.0, NaN, NaN, NaN, NaN, NaN, 1.0, NaN, -0.5, NaN, NaN, NaN, NaN, NaN, NaN, NaN, NaN, 0.0, NaN, 1.0, NaN, NaN, 0.0, NaN, NaN, NaN, NaN, NaN, NaN, NaN, 0.0, NaN, -0.5, NaN, NaN, NaN, -0.5, NaN, NaN, -0.5, NaN, NaN, NaN, NaN, NaN, NaN, NaN, NaN, NaN, 0.5, NaN, NaN, NaN, NaN, NaN, NaN, NaN, 0.0, 0.5, 0.0, NaN, 0.0, 0.0, NaN, 0.0, NaN, -1.0, NaN, NaN, NaN, NaN, NaN, -1.0, NaN, NaN, NaN, NaN, NaN, NaN, NaN, 0.0, NaN, NaN, NaN, NaN, NaN, NaN, NaN, NaN, NaN, NaN, NaN, NaN, NaN",0.0,-0.039,"hic, ebriosus, hic, libido, iugulo",0.049
cicero.de_fato,11.0,"sed, hic, ex, natural, causa, uitio, nascor, possum, extirparis, autem, et, fundus, tollo, ut, is, ipse, qui, ad, is, propendeo, sum, ab, tantus, uitium, auoco, non, sum, is, pono, in, natural, causa, sed, in, uoluntas, studium, disciplina, qui, tollo, omnis, si, uolo, et, natura, fatum, ex, diuinatio, ratio, firmo, etenim, si, sum, diuinatio, qualibusnam, ab, percipio, ars, proficisco, percipio, appello, qui, dico, graeca, θεωρήματα, non, enim, credo, nullus, percipio, aut, ceterus, artifex, uersaris, in, suus, munus, aut, is, qui, diuinatio, utor, sum, praedico",83,"NaN, NaN, NaN, NaN, 0.0, NaN, NaN, NaN, NaN, NaN, NaN, 0.0, NaN, NaN, NaN, NaN, NaN, NaN, NaN, NaN, NaN, NaN, NaN, -1.0, NaN, NaN, NaN, NaN, NaN, NaN, NaN, 0.0, NaN, NaN, 0.0, 0.5, 0.0, NaN, NaN, NaN, NaN, NaN, NaN, 0.0, 0.0, NaN, NaN, 0.0, NaN, NaN, NaN, NaN, NaN, NaN, NaN, NaN, 0.0, NaN, NaN, NaN, NaN, NaN, NaN, NaN, NaN, NaN, NaN, NaN, NaN, NaN, 0.0, 0.0, NaN, NaN, NaN, 0.5, NaN, NaN, NaN, NaN, NaN, NaN, NaN",0.0,-0.012,hic,0.012
cicero.de_fato,12.0,"sum, igitur, astrologus, percipio, hic, modus, si, quis, uerbum, causa, orior, canicula, nascor, sum, is, in, mare, non, morior, uigilo, chrysippe, ne, tuus, causa, in, qui, tu, cum, diodoro, ualeo, dialecticus, magnus, luctatio, sum, desero, si, enim, sum, uerus, qui, ita, conecto, si, quis, orior, canicula, nascor, sum, in, mare, non, morior, ille, quoque, uerus, sum, si, fabius, orior, canicula, nascor, sum, fabius, in, mare, non, morior, pugno, igitur, hic, inter, sui, fabium, orior, canicula, natus, sum, et, fabium, in, mare, morior, et, quoniam, certus, in, fabius, pono, natus, sum, is, canicula, orior, hic, quoque, pugno, et, sum, fabium, et, in, mare, sum, morior, ergo, hic, quoque, coniunctio, sum, ex, repugno, et, sum, fabius, et, in, mare, fabius, morior, qui, ut, propono, sum, ne, fio, quidem, possum, ergo, ille, morior, in, mare, fabius, ex, is, genus, sum, qui, fio, non, possum, omnis, ergo, qui, falsus, dico, in, sum, is, fio, non, possum",152,"NaN, NaN, 0.0, NaN, NaN, 0.5, NaN, NaN, 0.0, 0.0, NaN, NaN, NaN, NaN, NaN, NaN, 0.0, NaN, NaN, NaN, NaN, NaN, 0.0, 0.0, NaN, NaN, NaN, NaN, NaN, NaN, NaN, 0.0, NaN, NaN, NaN, NaN, NaN, NaN, 0.5, NaN, NaN, NaN, NaN, NaN, NaN, NaN, NaN, NaN, NaN, 0.0, NaN, NaN, NaN, NaN, 0.5, NaN, NaN, NaN, NaN, NaN, NaN, NaN, NaN, NaN, 0.0, NaN, NaN, NaN, NaN, NaN, NaN, NaN, NaN, NaN, NaN, 0.0, NaN, NaN, NaN, NaN, 0.0, NaN, NaN, NaN, 0.5, NaN, NaN, NaN, 0.0, NaN, NaN, NaN, NaN, NaN, NaN, NaN, NaN, NaN, NaN, NaN, NaN, 0.0, NaN, NaN, NaN, NaN, NaN, NaN, NaN, NaN, NaN, NaN, NaN, NaN, NaN, NaN, 0.0, NaN, NaN, NaN, NaN, NaN, NaN, NaN, NaN, NaN, NaN, NaN, NaN, NaN, NaN, 0.0, NaN, NaN, NaN, 0.0, NaN, NaN, NaN, NaN, NaN, NaN, NaN, NaN, -1.0, NaN, NaN, NaN, NaN, NaN, NaN, NaN",0.007,-0.007,"hic, tu, hic, hic, hic",0.033
cicero.de_fato,13.0,"at, hic, chrysippe, paruus, uolo, magnus, tu, de, hic, ipse, cum, diodoro, certamen, sum, ille, enim, is, solus, fio, possum, dico, qui, aut, sum, uerus, aut, sum, sum, uerus, et, quisquis, sum, sum, is, dico, fio, necesse, sum, et, quisquis, non, sum, sum, is, nego, fio, possum, tu, et, qui, non, sum, sum, possum, fio, dico, ut, frango, hic, gemma, etiamsi, is, numquam, sum, sum, neque, necesse, sum, cypselis, regno, corinthi, quamquam, is, millensimo, ante, annus, apollo, oraculum, edo, sum, at, si, iste, conprobo, diuino, praedico, et, qui, fallo, in, sum, dico, in, is, habeo, ut, is, fio, non, possum, ut, si, dico, africanum, karthago, potior, et, si, uerus, dico, de, sum, is, ita, sum, sum, dico, sum, necessarius, qui, sum, totus, diodori, tu, inimicus, sententia",126,"NaN, NaN, NaN, 0.0, NaN, 0.0, NaN, NaN, NaN, NaN, NaN, NaN, 0.5, NaN, NaN, NaN, NaN, -0.5, NaN, NaN, NaN, NaN, NaN, NaN, 0.5, NaN, NaN, NaN, 0.5, NaN, NaN, NaN, NaN, NaN, NaN, NaN, 0.0, NaN, NaN, NaN, NaN, NaN, NaN, NaN, NaN, NaN, NaN, NaN, NaN, NaN, NaN, NaN, NaN, NaN, NaN, NaN, NaN, NaN, NaN, NaN, NaN, NaN, NaN, NaN, NaN, NaN, 0.0, NaN, NaN, NaN, NaN, NaN, NaN, NaN, NaN, 0.0, NaN, NaN, NaN, NaN, NaN, NaN, NaN, NaN, NaN, NaN, NaN, NaN, NaN, NaN, NaN, NaN, NaN, NaN, NaN, NaN, NaN, NaN, NaN, NaN, NaN, NaN, NaN, NaN, NaN, NaN, NaN, NaN, 0.5, NaN, NaN, NaN, NaN, NaN, NaN, NaN, NaN, NaN, 0.0, NaN, NaN, NaN, NaN, NaN, -1.0, 0.0",0.004,-0.012,"hic, tu, hic, tu, hic, fallo, tu",0.056
cicero.de_fato,14.0,"etenim, si, ille, uerus, conecto, si, orior, canicula, nascor, sum, in, mare, non, morior, primus, qui, sum, in, conecto, nascor, sum, orior, canicula, necessarius, sum, omnis, enim, uerus, in, praetereo, necessarius, sum, ut, chrysippo, placeo, dissentio, ab, magister, cleanthe, quia, sum, immutabilis, neque, in, falsus, e, uerus, praetereo, possum, conuerto, si, igitur, qui, primus, in, conecto, sum, necessarius, sum, fio, etiam, qui, consequor, necessarius, quamquam, hic, chrysippo, non, uideo, ualeo, in, omnis, sed, tamen, si, natural, sum, causa, cur, in, mare, fabius, non, morior, in, mare, fabius, morior, non, possum",90,"NaN, NaN, NaN, 0.5, NaN, NaN, NaN, NaN, NaN, NaN, NaN, 0.0, NaN, NaN, 0.5, NaN, NaN, NaN, NaN, NaN, NaN, NaN, NaN, 0.0, NaN, NaN, NaN, 0.5, NaN, NaN, 0.0, NaN, NaN, NaN, NaN, NaN, NaN, 0.5, NaN, NaN, NaN, NaN, NaN, NaN, -1.0, NaN, 0.5, NaN, NaN, NaN, NaN, NaN, NaN, 0.5, NaN, NaN, NaN, 0.0, NaN, NaN, NaN, NaN, NaN, 0.0, NaN, NaN, NaN, NaN, NaN, NaN, NaN, NaN, NaN, NaN, NaN, NaN, NaN, 0.0, NaN, NaN, 0.0, NaN, NaN, NaN, NaN, 0.0, NaN, NaN, NaN, NaN",0.022,-0.011,hic,0.011
cicero.de_fato,15.0,"hic, locus, chrysippus, aestuo, fallo, spero, chaldaeos, ceter, diuinus, neque, is, utor, sum, coniunctio, ut, ita, suus, percipio, pronuntio, si, quis, nascor, sum, orior, canicula, is, in, mare, non, morior, sed, potis, ita, dico, non, et, nascor, sum, quis, orior, canicula, et, is, in, mare, morior, o, licentia, iocularis, ne, ipse, incido, in, diodorum, doceo, chaldaeos, quo, pacisco, is, expono, percipio, oportet, quaero, enim, si, chaldaei, ita, loquor, ut, negatio, infinitaris, coniunctio, potis, quam, infinitus, conecto, pono, cur, idem, medicus, cur, geometres, cur, reliquus, facio, non, possum, medicus, in, primus, qui, sum, is, perspicio, in, ars, non, ita, propono, si, qui, uena, sic, moueo, is, habeo, febris, sed, potis, ille, modo, non, et, uena, sic, qui, moueo, et, is, febris, non, habeo, ito, geometres, non, ita, dico, in, sphaera, magnus, orbo, medius, inter, sui, diuido, sed, potis, ille, modo, non, et, sum, in, sphaera, magnus, orbo, et, is, non, medius, inter, sui, diuido",153,"NaN, 0.0, NaN, NaN, NaN, NaN, NaN, NaN, 0.5, NaN, NaN, NaN, NaN, NaN, NaN, NaN, NaN, NaN, NaN, NaN, NaN, NaN, NaN, NaN, NaN, NaN, NaN, 0.0, NaN, NaN, NaN, 0.0, NaN, NaN, NaN, NaN, NaN, NaN, NaN, NaN, NaN, NaN, NaN, NaN, 0.0, NaN, NaN, -0.5, NaN, NaN, NaN, NaN, NaN, NaN, NaN, NaN, NaN, NaN, NaN, NaN, NaN, NaN, NaN, NaN, NaN, NaN, NaN, NaN, NaN, NaN, NaN, NaN, 0.0, NaN, NaN, NaN, NaN, NaN, NaN, NaN, NaN, 0.0, NaN, 0.0, NaN, NaN, NaN, NaN, NaN, 0.5, NaN, NaN, NaN, NaN, NaN, 0.0, NaN, NaN, NaN, NaN, NaN, 0.0, NaN, NaN, NaN, NaN, NaN, NaN, 0.0, NaN, NaN, NaN, NaN, 0.0, NaN, NaN, NaN, NaN, NaN, NaN, NaN, NaN, NaN, 0.0, NaN, NaN, NaN, NaN, NaN, 0.0, NaN, 0.0, NaN, NaN, NaN, NaN, 0.0, NaN, NaN, NaN, NaN, NaN, NaN, NaN, 0.0, NaN, NaN, NaN, NaN, 0.0, NaN, NaN, NaN",0.003,-0.003,"hic, aestuo, fallo, licentia",0.026
cicero.de_fato,16.0,"quis, sum, qui, non, possum, iste, modo, ex, conecto, transfero, ad, coniunctio, negatio, et, quidem, alius, modus, idem, res, effero, possum, modo, dico, in, sphaera, magnus, orbo, medius, inter, sui, diuido, possum, dico, si, in, sphaera, magnus, orbo, sum, possum, dico, quia, in, sphaera, magnus, orbo, sum, multus, genus, sum, enuntio, neque, ullus, distorqueo, quam, hic, quo, chrysippus, spero, chaldaeos, contendo, stoicorum, causa, sum",64,"NaN, NaN, NaN, NaN, NaN, NaN, NaN, NaN, NaN, NaN, NaN, NaN, NaN, NaN, NaN, NaN, 0.5, NaN, 0.0, NaN, NaN, NaN, NaN, NaN, NaN, 0.0, NaN, 0.0, NaN, NaN, NaN, NaN, NaN, NaN, NaN, NaN, 0.0, NaN, NaN, NaN, NaN, NaN, NaN, NaN, 0.0, NaN, NaN, 0.0, 0.0, NaN, NaN, NaN, NaN, NaN, NaN, NaN, NaN, NaN, NaN, NaN, NaN, NaN, 0.0, NaN",0.008,0.0,hic,0.016
cicero.de_fato,17.0,"ille, tamen, nemo, ita, loquor, magnus, sum, enim, hic, contortio, oratio, quam, signum, ortus, obeo, perdisco, sed, ad, ille, diodori, contentio, quam, περὶ, δυνατῶν, appello, reuorto, in, qui, quis, ualeo, is, qui, fio, possum, anquiro, placeo, igitur, diodoro, is, solus, fio, possum, qui, aut, uerus, sum, aut, uerus, sum, sum, qui, locus, attingo, hic, quaestio, nihil, fio, qui, non, necesse, sum, et, quisquis, fio, possum, is, aut, sum, iam, aut, sum, sum, neque, magis, commutaris, ex, uerus, in, fallo, possum, is, qui, sum, quam, is, qui, facio, sum, sed, in, facio, inmutabilitas, appareo, in, sum, quidam, quia, non, appareo, ne, insum, quidem, uideo, ut, in, is, qui, mortifero, morbus, urgeo, uerus, sum, hic, morior, hic, morbus, at, hic, idem, si, uerus, dico, in, is, in, quo, uolo, morbus, tantus, non, appareo, nihilum, paruus, sum, sum, ita, fio, ut, commutatio, ex, uerus, in, falsus, ne, in, sum, quidem, ullus, fio, possum, nam, morior, scipio, talis, uis, habeo, ut, quamquam, de, sum, dico, tamen, ut, is, non, possum, conuerto, in, falsus, de, homo, enim, dico, qui, necesse, sum, morior",177,"NaN, NaN, -0.5, NaN, NaN, 0.0, NaN, NaN, NaN, NaN, -0.5, NaN, 0.0, NaN, NaN, NaN, NaN, NaN, NaN, NaN, NaN, NaN, NaN, NaN, NaN, NaN, NaN, NaN, NaN, NaN, NaN, NaN, NaN, NaN, NaN, NaN, NaN, NaN, NaN, -0.5, NaN, NaN, NaN, NaN, 0.5, NaN, NaN, 0.5, NaN, NaN, NaN, 0.0, NaN, NaN, NaN, NaN, NaN, NaN, NaN, 0.0, NaN, NaN, NaN, NaN, NaN, NaN, NaN, NaN, NaN, NaN, NaN, NaN, NaN, NaN, NaN, NaN, 0.5, NaN, NaN, NaN, NaN, NaN, NaN, NaN, NaN, NaN, NaN, NaN, NaN, NaN, NaN, NaN, NaN, NaN, NaN, NaN, NaN, NaN, NaN, NaN, NaN, NaN, NaN, NaN, NaN, NaN, NaN, NaN, -1.0, NaN, 0.5, NaN, NaN, NaN, NaN, -1.0, NaN, NaN, NaN, NaN, 0.5, NaN, NaN, NaN, NaN, NaN, NaN, -1.0, NaN, NaN, NaN, NaN, 0.0, NaN, NaN, NaN, NaN, NaN, NaN, NaN, 0.5, NaN, -1.0, NaN, NaN, NaN, NaN, NaN, NaN, NaN, NaN, NaN, NaN, NaN, 1.0, NaN, NaN, NaN, NaN, NaN, NaN, NaN, NaN, NaN, NaN, NaN, NaN, NaN, -1.0, NaN, 0.0, NaN, NaN, NaN, 0.0, NaN, NaN",-0.014,-0.037,"hic, hic, fallo, hic, hic, hic",0.034
cicero.de_fato,18.0,"sic, si, dico, morior, nox, in, cubiculum, suus, uis, opprimo, scipio, uerus, dico, is, enim, sum, dico, qui, sum, sum, sum, autem, sum, ex, is, quia, facio, sum, intellego, debeo, neque, magis, sum, uerus, morior, scipio, quam, morior, ille, modo, neque, magis, necesse, morior, scipio, quam, ille, modo, morior, neque, magis, inmutabilis, ex, uerus, in, falsus, neco, sum, scipio, quam, neco, scipio, neque, cum, hic, ita, sum, sum, causa, cur, epicurus, fatum, extimesco, et, ab, atomus, peto, praesidium, eo, de, uia, deduco, et, unus, tempus, suscipio, res, duo, inenodabilis, unus, ut, sine, causa, fio, aliquis, ex, quo, existet, ut, de, nihilum, quispiam, fio, qui, neque, ipse, neque, quisquam, physicus, placeo, alter, ut, cum, duo, indiuiduus, per, inanitas, fero, alter, e, regio, moueo, alter, declino",124,"NaN, NaN, NaN, NaN, 0.0, NaN, NaN, NaN, 1.0, NaN, NaN, 0.5, NaN, NaN, NaN, NaN, NaN, NaN, NaN, NaN, NaN, NaN, NaN, NaN, NaN, NaN, NaN, NaN, NaN, NaN, NaN, NaN, NaN, 0.5, NaN, NaN, NaN, NaN, NaN, NaN, NaN, NaN, 0.0, NaN, NaN, NaN, NaN, NaN, NaN, NaN, NaN, NaN, NaN, 0.5, NaN, -1.0, NaN, NaN, NaN, NaN, NaN, NaN, NaN, NaN, NaN, NaN, NaN, NaN, 0.0, NaN, NaN, 0.0, NaN, NaN, NaN, NaN, NaN, NaN, NaN, NaN, 0.0, NaN, NaN, NaN, 0.0, NaN, 0.0, NaN, NaN, NaN, NaN, NaN, 0.0, NaN, NaN, NaN, NaN, NaN, NaN, NaN, NaN, NaN, NaN, NaN, NaN, NaN, NaN, NaN, NaN, NaN, NaN, NaN, NaN, NaN, NaN, NaN, NaN, NaN, NaN, NaN, 0.0, NaN, NaN, NaN",0.012,-0.008,"hic, extimesco",0.016
