Text,Stelle,Inahlt,Wortzahl,Sentiment Rechnung,Sentiment-Score,alternativer Sentiment-Score,Invektiven,Invektivitäts-Score
cicero.pro_caelio,37.0,"redeo, nunc, ad, tu, caelum, uicissim, atque, ego, auctoritas, patria, seueritas, suscipio, sed, dubito, qui, pater, potis, sumo, caecilianumne, aliquis, uehemens, atque, durus, nunc, enim, demum, ego, animus, ardeo, nunc, meus, cor, cumulo, ira, aut, ille, o, infelix, o, scelestus, ferreus, sum, iste, pater, ego, quis, dico, quis, uolo, qui, tu, omnis, tuus, foedus, facio, facio, ut, nequiquam, uolo, uix, fero, dico, talis, pater, cur, tu, in, iste, uicinitas, meretricius, confero, cur, illecebra, cognosco, non, refugio, cur, alienus, ullus, mulier, nosco, dide, atque, dissice, per, ego, tu, licet, si, egeo, tu, doleo, non, ego, ego, satis, sum, qui, aetas, qui, relicuom, sum, oblecto, meus",104,"NaN, NaN, NaN, NaN, 0.5, NaN, NaN, NaN, NaN, NaN, NaN, NaN, NaN, NaN, NaN, 0.0, 0.0, NaN, NaN, NaN, NaN, NaN, -0.5, NaN, NaN, NaN, NaN, 0.5, NaN, NaN, 0.0, NaN, NaN, -1.0, NaN, NaN, NaN, -1.0, NaN, -1.0, NaN, NaN, NaN, 0.0, NaN, NaN, NaN, NaN, NaN, NaN, NaN, NaN, 0.0, -1.0, NaN, NaN, NaN, NaN, NaN, NaN, NaN, NaN, NaN, 0.0, NaN, NaN, NaN, NaN, 0.0, NaN, NaN, NaN, NaN, NaN, NaN, NaN, NaN, -0.5, NaN, 0.0, NaN, NaN, NaN, NaN, NaN, NaN, NaN, NaN, NaN, NaN, NaN, NaN, NaN, NaN, NaN, 0.5, NaN, NaN, 0.0, NaN, NaN, NaN, NaN, 0.0",-0.034,-0.048,"tu, seueritas, infelix, scelestus, tu, tu, meretricius, illecebra, mulier, tu, tu",0.106
cicero.pro_caelio,38.0,"hic, tristis, atque, de_-recingo, senex, respondeo, caelius, sui, nullus, cupiditas, induco, de, uia, decedo, quis, signum, nullus, sumptus, nullus, iactura, nullus, uerro, at, sum, fama, quotus, quisque, iste, effugio, possum, praesertim, in, tam, maledicus, ciuitas, uicinus, is, mulier, miror, malus, audio, qui, frater, germanus, sermo, iniquus, effugio, non, possum, lenis, uerus, et, clemens, pater, qui, modus, ille, sum, foris, ecfregit, restituo, discindo, uestis, resarcio, caelum, causa, sum, expedio, quis, enim, sum, in, quo, sui, non, facilis, defendo, nihil, iam, in, iste, mulier, dico, sed, si, sum, aliqui, dissimilis, iste, qui, sui, omnis, per-uulgo, qui, habeo, palam, decretum, semper, aliquis, qui, in, hortus, domus, baiae, ius, suus, libido, omnis, con-meo, qui, etiam, alo, adulescens, et, parsimonia, pater, suus, sumptus, sustineo, si, uiduo, libo, proteruus, petulanter, diues, effuse, libidinosus, meretricius, mos, uiuo, adulter, ego, puto, si, quis, hic, paulus, liber, saluto",139,"NaN, -1.0, NaN, NaN, 0.0, NaN, NaN, NaN, NaN, -0.5, NaN, NaN, 0.0, NaN, NaN, 0.0, NaN, NaN, NaN, -0.5, NaN, NaN, NaN, NaN, 1.0, NaN, NaN, NaN, NaN, NaN, NaN, NaN, NaN, -1.0, 0.5, 0.0, NaN, 0.0, NaN, -1.0, NaN, NaN, 0.0, NaN, -0.5, -1.0, NaN, NaN, NaN, 1.0, 0.5, NaN, 1.0, 0.0, NaN, 0.5, NaN, NaN, NaN, NaN, NaN, NaN, NaN, NaN, 0.5, 0.0, NaN, NaN, NaN, NaN, NaN, NaN, NaN, NaN, NaN, 0.5, NaN, NaN, NaN, NaN, NaN, 0.0, NaN, NaN, NaN, NaN, NaN, NaN, NaN, NaN, NaN, NaN, NaN, NaN, NaN, NaN, NaN, NaN, NaN, NaN, NaN, NaN, 0.0, NaN, 0.5, NaN, -0.5, NaN, NaN, NaN, NaN, NaN, NaN, NaN, NaN, 0.0, NaN, NaN, NaN, NaN, NaN, NaN, -0.5, NaN, 0.5, NaN, -1.0, NaN, 0.5, NaN, NaN, NaN, NaN, NaN, NaN, NaN, NaN, 0.5, NaN",0.0,-0.054,"hic, mulier, iniquus, uestis, mulier, libido, adulescens, parsimonia, proteruus, petulanter, libidinosus, meretricius, adulter, hic",0.101
cicero.pro_caelio,39.0,"dico, aliquis, hic, igitur, sum, tuus, disciplina, sic, tu, instituo, adulescens, ob, hic, causa, tu, hic, puer, parens, commendo, et, trado, ut, in, amor, atque, in, uoluptas, adulescentia, suus, con-loco, et, ut, hic, tu, uita, atque, hic, studium, defendo, ego, si, quis, iudex, hic, robur, animus, atque, hic, indoles, uirtus, atque, continentia, sum, ut, respuo, omnis, uoluptas, omnis, uita, suus, cursus, in, labor, corpus, atque, in, animus, contentio, confacio, qui, non, quies, non, remissio, non, aequalis, studium, non, ludo, non, conuiuium, delecto, nihil, in, uito, expeto, puto, nisi, qui, sum, cum, laus, et, cum, dignitas, coniungo, hic, meus, sententia, diuinus, quidam, bonus, instruo, atque, orno, puto, ex, hic, genus, ille, sum, arbitror, camillus, fabricios, curios, omne, is, qui, hic, ex, paruus, tantus, facio",123,"NaN, NaN, NaN, NaN, NaN, 0.0, 0.0, NaN, NaN, NaN, NaN, NaN, NaN, 0.0, NaN, NaN, 0.0, 0.5, NaN, NaN, NaN, NaN, NaN, 1.0, NaN, NaN, 1.0, NaN, NaN, NaN, NaN, NaN, NaN, NaN, 0.0, NaN, NaN, 0.5, NaN, NaN, NaN, NaN, 0.5, NaN, 0.5, 0.5, NaN, NaN, 0.0, 1.0, NaN, 0.5, NaN, NaN, NaN, NaN, 1.0, NaN, 0.0, NaN, NaN, NaN, -0.5, 0.0, NaN, NaN, 0.5, NaN, NaN, NaN, NaN, NaN, NaN, NaN, NaN, 0.5, 0.5, NaN, NaN, NaN, NaN, NaN, NaN, NaN, NaN, NaN, NaN, NaN, NaN, NaN, NaN, 1.0, NaN, NaN, 1.0, NaN, NaN, 0.0, 0.0, 0.5, NaN, 1.0, NaN, NaN, NaN, NaN, NaN, NaN, 0.0, NaN, NaN, NaN, NaN, NaN, NaN, NaN, NaN, NaN, NaN, NaN, 0.0, NaN, NaN",0.093,-0.004,"hic, tu, adulescens, hic, tu, hic, hic, tu, hic, hic, hic, conuiuium, hic, hic, hic",0.122
cicero.pro_caelio,40.0,"uerus, hic, genus, uirtus, non, solus, in, mos, noster, sed, uix, iam, in, liber, reperio, charta, quoque, qui, ille, pristinus, seueritas, contineo, obsolesco, neque, solus, apud, nos, qui, hic, seco, ratio, uita, res, magis, quam, uerbum, sequor, sum, sed, etiam, apud, graecus, doceo, homo, qui, cum, facio, non, possum, loquor, tamen, et, scribo, honestus, et, magnificus, licet, alius, quidam, mutas, graecia, tempus, praecipio, ex-sisto",64,"0.5, NaN, 0.0, 1.0, NaN, -0.5, NaN, 0.5, NaN, NaN, NaN, NaN, NaN, 0.5, NaN, NaN, NaN, NaN, NaN, 0.0, NaN, NaN, NaN, NaN, -0.5, NaN, NaN, NaN, NaN, NaN, 0.0, 0.0, 0.0, NaN, NaN, 0.0, NaN, NaN, NaN, NaN, NaN, NaN, NaN, 0.0, NaN, NaN, NaN, NaN, NaN, NaN, NaN, NaN, NaN, 1.0, NaN, 0.0, NaN, NaN, NaN, NaN, NaN, 0.0, NaN, NaN",0.039,-0.016,"hic, seueritas, obsolesco, hic, honestus",0.078
cicero.pro_caelio,41.0,"itaque, alius, uoluptas, causa, omnis, sapio, facio, dico, neque, ab, hic, oratio, turpitudo, erudio, homo, refugio, alius, cum, uoluptas, dignitas, coniungo, puto, ut, res, magnus, inter, sui, repugno, dico, facultas, coniungo, ille, unus, derectus, iter, ad, laus, cum, labor, qui, probo, prope, solus, iam, in, schola, sum, relinquo, multus, enim, nos, blandimentum, natura, ipse, gigno, qui, sopio, uirtus, co-niuit, interdum, multus, uia, adulescentia, lubricus, ostendo, qui, ille, insisto, aut, ingredior, sine, casus, aliquis, atque, prolapsio, uix, possum, multus, res, iucundissimaris, uarietas, do, qui, non, modo, hic, aetas, sed, etiam, iam, con-roboro, capio",92,"NaN, NaN, 1.0, 0.0, NaN, NaN, NaN, NaN, NaN, NaN, NaN, -0.5, -1.0, NaN, 0.0, NaN, NaN, NaN, 1.0, 1.0, NaN, NaN, NaN, 0.0, 0.0, NaN, NaN, NaN, NaN, 0.5, NaN, NaN, NaN, NaN, 0.0, NaN, 1.0, NaN, -0.5, NaN, NaN, NaN, -0.5, NaN, NaN, NaN, NaN, NaN, 0.0, NaN, NaN, NaN, 0.0, NaN, NaN, NaN, NaN, 1.0, NaN, NaN, 0.0, 0.0, NaN, NaN, NaN, NaN, NaN, NaN, NaN, NaN, NaN, 0.0, NaN, NaN, NaN, NaN, NaN, 0.0, 0.0, NaN, 0.0, NaN, NaN, NaN, NaN, NaN, 0.0, NaN, NaN, NaN, NaN, NaN",0.033,-0.027,"hic, turpitudo, hic",0.033
cicero.pro_caelio,42.0,"quam, ob, res, si, qui, fors, inuenio, qui, aspernor, oculus, pulchritudo, res, non, odor, ullus, non, tango, non, sapor, capio, excludo, auris, omnis, suauitas, hic, homo, ego, fortasse, et, paucus, deus, propitius, plerusque, autem, irascor, puto, ergo, hic, desero, uia, et, incultus, atque, intercludo, iam, frons, et, uirgultus, relinquo, do, aliqui, ludus, aetas, sum, adulescentia, liber, non, omnis, uoluptas, denego, non, semper, supero, uerus, ille, et, de_-recingo, ratio, uinco, aliquando, cupiditas, uoluptas, ratio, dum, modo, ille, in, hic, genus, praescriptio, moderatio, teneo, parco, iuuentus, pudicitia, suus, ne, spolio, alienus, ne, effundo, patrimonium, ne, faenus, trucido, ne, incurro, in, alter, domus, atque, familia, ne, probrum, caueo, labo, integer, infamia, bonus, infero, ne, qui, uis, terreo, ne, intersum, insidiae, scelus, careo, postremo, cum, pareo, uoluptas, do, aliquis, tempus, ad, ludus, aetas, atque, ad, inanis, hic, adulescentia, cupiditas, reuoco, sui, aliquando, ad, cura, res, domesticus, res, forensis, redeo, publicus, ut, is, qui, ratio, antea, non, perspicio, satietas, abicio, et, experior, contemno, uideo",159,"NaN, NaN, 0.0, NaN, NaN, 0.0, NaN, NaN, NaN, 0.0, 1.0, 0.0, NaN, 0.0, NaN, NaN, NaN, NaN, NaN, NaN, NaN, NaN, NaN, NaN, NaN, 0.0, NaN, NaN, NaN, 0.0, 0.0, 1.0, NaN, NaN, NaN, NaN, NaN, NaN, NaN, 0.0, NaN, -0.5, NaN, NaN, NaN, 0.0, NaN, NaN, NaN, NaN, NaN, NaN, 0.0, NaN, NaN, 0.5, NaN, NaN, 1.0, NaN, NaN, NaN, NaN, 0.5, NaN, NaN, NaN, 0.0, NaN, NaN, -0.5, 1.0, 0.0, NaN, NaN, NaN, NaN, NaN, 0.0, NaN, 0.5, NaN, NaN, NaN, 0.5, NaN, NaN, NaN, -0.5, NaN, NaN, NaN, NaN, NaN, NaN, NaN, NaN, NaN, NaN, 0.0, NaN, 0.5, NaN, -1.0, NaN, NaN, 0.5, -1.0, 1.0, NaN, NaN, NaN, 1.0, NaN, NaN, NaN, NaN, -1.0, NaN, NaN, NaN, NaN, 1.0, NaN, NaN, 0.0, NaN, NaN, 0.0, NaN, NaN, NaN, NaN, NaN, -0.5, NaN, NaN, NaN, NaN, -1.0, 0.0, 0.0, 0.0, NaN, NaN, 0.0, NaN, NaN, NaN, 0.0, NaN, NaN, NaN, NaN, NaN, NaN, NaN, NaN, NaN",0.025,-0.038,"aspernor, hic, hic, hic, pudicitia, faenus, probrum, infamia, insidiae, scelus, hic",0.069
cicero.pro_caelio,43.0,"atque, multus, quidem, et, noster, et, pater, magnus, memoria, iudex, superus, homo, et, clarus, ciuis, sum, qui, cum, adulescentia, cupiditas, deferuesco, eximius, uirtus, firmo, iam, aetas, ex-sisto, ex, qui, nemo, ego, libet, nominaris, tu, cum, tu, recordor, nolo, enim, quisquam, fortis, atque, illustris, uir, ne, paruus, quidem, erro, cum, maximus, laus, coniungo, qui, si, facio, uolo, multus, ab, ego, superus, atque, orno, uir, praedico, qui, pars, nimius, libertas, in, adulescentia, pars, profundo, luxurio, magnitudo, aer, alienus, sumptus, libido, nomino, qui, multus, postea, uirtus, obtego, adulescentia, qui, uolo, excusatio, defendo",89,"NaN, 0.0, NaN, NaN, NaN, NaN, 0.0, 0.0, 1.0, 0.5, NaN, 0.0, NaN, 0.5, 0.5, NaN, NaN, NaN, NaN, -0.5, NaN, 1.0, 1.0, NaN, NaN, 0.0, NaN, NaN, NaN, -0.5, NaN, NaN, NaN, NaN, NaN, NaN, NaN, NaN, NaN, NaN, 0.5, NaN, NaN, 0.5, NaN, 0.0, NaN, 0.0, NaN, NaN, 1.0, NaN, NaN, NaN, NaN, NaN, 0.0, NaN, NaN, NaN, NaN, NaN, 0.5, NaN, NaN, 0.0, NaN, 0.5, NaN, NaN, 0.0, NaN, NaN, 0.0, 0.0, -0.5, NaN, -0.5, NaN, NaN, 0.0, NaN, 1.0, NaN, NaN, NaN, NaN, 0.5, NaN",0.079,-0.022,"tu, tu, nimius, luxurio, libido",0.056
cicero.pro_caelio,44.0,"at, uerus, in, marcus, caelio, dico, enim, iam, confido, de, studium, is, honestus, quoniam, audeo, quidam, fretus, uester, sapientia, libo, confiteor, nullus, luxurio, reperio, nullus, sumptus, nullus, aes, alienus, nullus, conuiuium, atque, lustrum, libido, qui, quidem, uitium, uenter, et, gurges, non, modo, non, minuo, aetas, homo, sed, etiam, augeo, amor, autem, et, deliciae, qui, uoco, qui, firmus, animus, praeditus, diu, molestus, non, soleo, sum, maturus, enim, et, celer, defloresco, numquam, hic, occupo, impedio, teneo",74,"NaN, 0.5, NaN, NaN, NaN, NaN, NaN, NaN, NaN, NaN, 0.5, NaN, 1.0, NaN, NaN, NaN, 0.5, NaN, 1.0, NaN, NaN, NaN, NaN, NaN, NaN, NaN, NaN, NaN, -0.5, NaN, NaN, NaN, NaN, -0.5, NaN, NaN, -1.0, NaN, NaN, NaN, NaN, NaN, NaN, NaN, 0.0, 0.0, NaN, NaN, NaN, 1.0, NaN, NaN, NaN, NaN, NaN, NaN, 1.0, 0.5, 0.5, NaN, -1.0, NaN, NaN, NaN, NaN, NaN, NaN, NaN, NaN, NaN, NaN, NaN, NaN, NaN",0.047,-0.041,"honestus, luxurio, conuiuium, libido, gurges, deliciae, hic",0.095
cicero.pro_caelio,45.0,"audio, cum, pro, sui, dico, audio, antea, cum, accuso, defendo, hic, causa, non, glorior, loquor, genus, oratio, facultas, copia, sententiaris, atque, uerbum, qui, uester, prudentia, sum, perspicio, atque, in, is, non, solus, ingenium, eluceo, is, uideo, qui, saepe, etiam, si, industria, non, alo, ualeo, tamen, ipse, suus, uis, sed, insum, nisi, ego, propter, beneuolentia, fors, fallo, ratio, et, bonus, ars, institutum, et, cura, et, uigilia, elaboro, atqui, scio, iudex, is, cupiditas, qui, obicio, caelio, atque, hic, studium, de, qui, disputo, non, facilis, in, idem, homo, sum, possum, fio, enim, non, possum, ut, animus, libido, dedo, amor, desiderium, cupiditas, saepe, nimius, copia, inopia, etiam, non, numquam, impedio, hic, quisquis, sum, qui, nos, facio, in, dico, quisquis, modo, facio, non, modo, ago, uerus, etiam, cogito, possum, sustineo",125,"NaN, NaN, NaN, NaN, NaN, NaN, NaN, NaN, NaN, NaN, NaN, 0.0, NaN, NaN, NaN, 0.0, -0.5, 0.5, 0.5, NaN, NaN, 0.0, NaN, NaN, 0.5, NaN, NaN, NaN, NaN, NaN, NaN, -0.5, 0.5, NaN, NaN, NaN, NaN, NaN, NaN, NaN, 0.5, NaN, NaN, NaN, NaN, NaN, NaN, 1.0, NaN, NaN, NaN, NaN, NaN, 1.0, 0.0, NaN, 0.0, NaN, 1.0, 0.0, NaN, NaN, -1.0, NaN, NaN, NaN, NaN, NaN, 0.5, NaN, -0.5, NaN, NaN, NaN, NaN, NaN, 0.5, NaN, NaN, NaN, NaN, 0.5, NaN, NaN, 0.0, NaN, NaN, NaN, NaN, NaN, NaN, NaN, 0.5, -0.5, NaN, 1.0, NaN, -0.5, NaN, NaN, 0.5, -1.0, NaN, NaN, NaN, NaN, NaN, NaN, NaN, NaN, NaN, NaN, NaN, NaN, NaN, NaN, NaN, NaN, NaN, NaN, 0.5, NaN, NaN, NaN, NaN",0.04,-0.036,"hic, fallo, hic, libido, nimius, hic",0.048
cicero.pro_caelio,46.0,"an, tu, alius, causa, sum, ullus, puto, cur, in, tantus, praemium, eloquentia, tantus, uoluptas, dico, tantus, laus, tantus, gratia, tantus, honor, tam, sum, paucus, semper, sum, qui, in, hic, labor, uerso, obtero, sum, omnis, uoluptas, relinquo, studium, delectatio, ludus, iocus, conuiuium, sermo, paene, sum, familiaris, desero, qui, res, in, hic, genus, labor, offendo, homo, ab, studium, deterreo, non, quo, aut, ingenium, deficio, aut, doctrina, puerilis",65,"NaN, NaN, NaN, 0.0, NaN, NaN, NaN, NaN, NaN, NaN, 1.0, NaN, NaN, 1.0, NaN, NaN, 1.0, NaN, 1.0, NaN, 1.0, NaN, NaN, 0.0, NaN, NaN, NaN, NaN, NaN, -0.5, NaN, NaN, NaN, NaN, 1.0, NaN, 0.5, NaN, NaN, -0.5, NaN, -0.5, NaN, NaN, 1.0, NaN, NaN, 0.0, NaN, NaN, 0.0, -0.5, NaN, 0.0, NaN, 0.5, NaN, NaN, NaN, NaN, 0.5, NaN, NaN, 0.0, 0.0",0.1,-0.031,"tu, hic, conuiuium, hic",0.062
cicero.pro_caelio,47.0,"an, hic, si, sui, iste, uita, dedo, consularis, homo, admodum, adulescens, in, iudicium, uoco, hic, si, labor, fugio, si, obstringo, uoluptas, teneo, hic, in, acies, cottidie, uerso, appeto, inimicitia, in, iudicium, uoco, subeo, periculum, capio, ipse, inspecto, populus, romanus, tot, iam, mensis, aut, de, salus, aut, de, gloria, dimicaret.nihilne, igitur, ille, uicinitas, redoleo, nihil, homo, fama, nihil, baius, denique, ipse, loquor, ille, uerus, non, loquor, solus, uerus, etiam, persono, huc, unus, mulier, libido, sum, prolabor, ut, is, non, modo, solitudo, atque, tenebrae, atque, hic, flagitium, integumentum, non, quaero, sed, in, turpis, res, frequens, celebritas, et, clarus, lux, laeto",98,"NaN, NaN, NaN, NaN, NaN, 0.0, NaN, 0.5, 0.0, NaN, NaN, NaN, 0.5, NaN, NaN, NaN, -0.5, NaN, NaN, NaN, 1.0, NaN, NaN, NaN, 0.0, NaN, NaN, NaN, -1.0, NaN, 0.5, NaN, NaN, -1.0, NaN, NaN, NaN, 0.0, NaN, NaN, NaN, NaN, NaN, NaN, 1.0, NaN, NaN, 0.0, NaN, NaN, NaN, 0.0, NaN, NaN, 0.0, 1.0, NaN, NaN, NaN, NaN, NaN, NaN, 0.5, NaN, NaN, -0.5, 0.5, NaN, NaN, NaN, NaN, 0.0, -0.5, NaN, NaN, NaN, NaN, NaN, NaN, -0.5, NaN, NaN, NaN, NaN, -1.0, NaN, NaN, NaN, NaN, NaN, -1.0, 0.0, NaN, NaN, NaN, 0.5, NaN, NaN",0.0,-0.061,"hic, adulescens, hic, hic, mulier, libido, hic, flagitium, turpis",0.092
cicero.pro_caelio,48.0,"uerus, si, quis, sum, qui, etiam, meretricius, amor, interdictum, iuuentus, puto, sum, ille, quidem, ualidus, seuerus, nego, non, possum, sed, abhorreo, non, modo, ab, hic, saeculis, licentia, uerus, etiam, ab, magnus, consuetudo, atque, concedo, quando, enim, hic, non, factitas, sum, quando, reprehendo, quando, non, permitto, quando, denique, sum, ut, qui, licet, non, licet, hic, ego, ipse, res, definio, mulier, nullus, nomino, tantus, in, medium, relinquo",65,"0.5, NaN, NaN, NaN, NaN, NaN, NaN, 1.0, NaN, NaN, NaN, NaN, NaN, NaN, 1.0, NaN, NaN, NaN, NaN, NaN, NaN, NaN, NaN, NaN, NaN, NaN, -0.5, 0.5, NaN, NaN, 0.0, NaN, NaN, NaN, NaN, NaN, NaN, NaN, NaN, NaN, NaN, NaN, NaN, NaN, NaN, NaN, NaN, NaN, NaN, NaN, NaN, NaN, NaN, NaN, NaN, NaN, 0.0, NaN, 0.0, NaN, NaN, NaN, NaN, NaN, NaN",0.038,-0.008,"meretricius, hic, licentia, hic, hic, mulier",0.092
cicero.pro_caelio,49.0,"si, qui, non, nubo, mulier, domus, suus, patefacio, omnis, cupiditas, pala, sui, in, meretricius, uito, con-loco, uir, alienus, conuiuium, uti, instituo, si, hic, in, urbs, si, in, hortus, si, in, baiaris, ille, celebritas, facio, si, denique, ita, sui, gero, non, incedo, solus, sed, orno, atque, comito, non, flagro, oculus, non, libertas, sermo, sed, etiam, complexus, osculatio, ago, nauigatio, conuiuium, ut, non, solus, meretrix, sed, etiam, proteruus, meretrix, procax, uideo, cum, hic, si, qui, adulescens, fors, sum, utrum, hic, tu, lucius, herenni, adulter, an, amator, expugnaris, pudicitia, an, expleo, libido, uolo, uideo",91,"NaN, NaN, NaN, NaN, 0.0, 0.0, NaN, NaN, NaN, -0.5, NaN, NaN, NaN, NaN, NaN, NaN, 0.5, -0.5, NaN, NaN, NaN, NaN, NaN, NaN, 0.5, NaN, NaN, NaN, NaN, NaN, NaN, NaN, NaN, NaN, NaN, NaN, NaN, NaN, NaN, NaN, NaN, -0.5, NaN, NaN, NaN, NaN, NaN, NaN, 0.0, NaN, 0.5, -0.5, NaN, NaN, 0.0, NaN, NaN, NaN, NaN, NaN, NaN, -0.5, NaN, NaN, NaN, -0.5, NaN, -1.0, NaN, NaN, NaN, NaN, NaN, NaN, 0.0, NaN, NaN, NaN, NaN, NaN, NaN, NaN, NaN, NaN, NaN, 0.5, NaN, NaN, -0.5, NaN, NaN",-0.027,-0.049,"nubo, mulier, meretricius, conuiuium, hic, conuiuium, meretrix, proteruus, meretrix, procax, hic, adulescens, hic, tu, adulter, amator, pudicitia, libido",0.198
cicero.pro_caelio,50.0,"obliuiscor, iam, iniuria, tuus, clodia, depono, memoria, dolor, meus, qui, abs, tu, crudeliter, in, meus, ego, absum, facio, sum, neglego, ne, sum, hic, in, tu, dictum, qui, dico, sed, ex, tu, ipse, requiro, quoniam, et, crimen, accusator, abs, tu, et, testo, is, crimen, tu, ipse, dico, sui, habeo, si, qui, mulier, sum, is, modus, qual, ego, paulus, ante, describo, tuus, dissimilis, uito, instituo, meretricius, cum, hic, aliquis, adulescens, homo, habeo, ratio, num, tu, perturpis, aut, perflagitiosus, sum, uideo, is, si, tu, non, sum, sicut, ego, malus, quis, sum, qui, obicio, caelio, sin, is, tu, uolo, sum, quis, sum, cur, nos, crimen, hic, si, tu, contemno, pertimesco, qui, res, nos, do, uia, ratio, defensio, aut, enim, pudor, tuus, defendo, nihil, ab, marcus, caelio, petulans, sum, facio, aut, impudens, et, hic, et, ceterus, magnus, ad, sui, defendo, facultas, do",137,"NaN, NaN, -1.0, 0.0, NaN, NaN, 1.0, -1.0, 0.0, NaN, NaN, NaN, NaN, NaN, 0.0, NaN, NaN, NaN, NaN, NaN, NaN, NaN, NaN, NaN, NaN, 0.0, NaN, NaN, NaN, NaN, NaN, NaN, NaN, NaN, NaN, -1.0, 0.0, NaN, NaN, NaN, NaN, NaN, -1.0, NaN, NaN, NaN, NaN, NaN, NaN, NaN, 0.0, NaN, NaN, 0.5, NaN, NaN, NaN, NaN, NaN, 0.0, NaN, NaN, NaN, NaN, NaN, NaN, NaN, NaN, 0.0, NaN, 0.0, NaN, NaN, -1.0, NaN, NaN, NaN, NaN, NaN, NaN, NaN, NaN, NaN, NaN, NaN, -1.0, NaN, NaN, NaN, NaN, NaN, NaN, NaN, NaN, NaN, NaN, NaN, NaN, NaN, NaN, -1.0, NaN, NaN, NaN, NaN, NaN, NaN, 0.0, NaN, NaN, 0.0, 0.0, NaN, NaN, NaN, 0.5, 0.0, NaN, NaN, NaN, NaN, NaN, -0.5, NaN, NaN, NaN, -1.0, NaN, NaN, NaN, 0.0, 0.0, NaN, NaN, NaN, 0.5, NaN",-0.044,-0.062,"tu, crudeliter, hic, tu, tu, crimen, tu, crimen, tu, mulier, meretricius, hic, adulescens, tu, tu, tu, crimen, hic, tu, pudor, petulans, impudens, hic",0.168
cicero.pro_caelio,51.0,"sed, quoniam, emergo, iam, e, uado, et, scopulus, praeteruehor, uideo, sum, oratio, meus, perfacilis, ego, reliquus, curro, ostendo, duo, sum, enim, crimen, unus, in, mulier, summus, facinus, aurum, qui, sumo, ab, clodia, dico, et, uenenum, qui, idem, clodiae, neco, causa, paro, caelium, criminor, aurum, sumo, ut, dico, qui, lucius, luccei, seruio, do, per, qui, alexandrinus, dius, qui, tum, apud, lucceium, habito, neco, magnus, crimen, uel, in, legatus, insidior, uel, in, seruio, ad, hospes, dominus, neco, sollicito, plenus, scelus, consilium, plenus, audacia",81,"NaN, NaN, NaN, NaN, NaN, NaN, NaN, 0.0, NaN, NaN, NaN, -0.5, 0.0, NaN, NaN, 0.0, NaN, NaN, NaN, NaN, NaN, -1.0, NaN, NaN, 0.0, NaN, -1.0, 0.5, NaN, NaN, NaN, NaN, NaN, NaN, -0.5, NaN, NaN, NaN, NaN, 0.0, NaN, NaN, NaN, 0.5, NaN, NaN, NaN, NaN, NaN, NaN, NaN, NaN, NaN, NaN, NaN, NaN, NaN, NaN, NaN, NaN, NaN, NaN, 0.0, -1.0, NaN, NaN, 0.0, NaN, NaN, NaN, NaN, NaN, 0.0, NaN, NaN, NaN, 0.0, -1.0, 0.5, 0.0, 1.0",-0.031,-0.062,"crimen, mulier, facinus, crimen, scelus, audacia",0.074
cicero.pro_caelio,52.0,"quo, quidem, in, crimen, primus, ille, requiro, dico, clodiae, quam, ob, res, aurum, sumo, an, non, dico, si, non, dico, cur, do, si, dico, idem, sui, conscientia, scelus, deuincio, tu, -ne, aurum, ex, armarium, tuus, promo, audeo, sum, tu, uenerem, ille, tuus, spolio, ornamentum, spoliatrix, ceterus, cum, scio, quantus, ad, facinus, aurum, hic, quaero, ad, nex, legatus, ad, lucius, luccei, sancio, homo, atque, integer, labo, scelus, sempiternus, hic, facinus, tantus, tuus, mens, liberalis, conscius, tuus, domus, popularis, ministro, tuus, denique, hospital, ille, uenus, adiutrix, sum, non, debeo",87,"NaN, NaN, NaN, -1.0, 0.5, NaN, NaN, NaN, NaN, NaN, NaN, 0.0, 0.5, NaN, NaN, NaN, NaN, NaN, NaN, NaN, NaN, NaN, NaN, NaN, NaN, NaN, 0.0, -1.0, NaN, NaN, NaN, 0.5, NaN, 0.0, 0.0, NaN, NaN, NaN, NaN, NaN, NaN, 0.0, NaN, NaN, NaN, 0.0, NaN, NaN, NaN, NaN, -1.0, 0.5, NaN, NaN, NaN, -1.0, 0.0, NaN, NaN, NaN, NaN, 0.0, NaN, 0.5, NaN, -1.0, NaN, NaN, -1.0, NaN, 0.0, 0.5, 1.0, -0.5, 0.0, 0.0, 0.0, NaN, 0.0, NaN, NaN, NaN, 1.0, -0.5, NaN, NaN, NaN",-0.023,-0.08,"crimen, conscientia, scelus, tu, tu, facinus, hic, nex, scelus, hic, facinus, conscius, popularis",0.149
cicero.pro_caelio,53.0,"uideo, hic, balbus, celo, sum, clodiam, dico, atque, ita, caelium, ad, ille, affero, sui, ad, orno, ludus, aurum, quaero, si, tam, familiaris, sum, clodiae, quam, tu, sum, uolo, cum, de, libido, is, tam, multus, dico, dico, profecto, quo, uolo, aurum, si, tam, familiaris, non, sum, non, do, ita, si, uerus, tu, caelius, dico, o, immoderatus, mulier, scio, tu, aurum, ad, facinus, do, si, non, sum, audeo, dico, non, do, quis, ego, nunc, argumentum, hic, crimen, qui, sum, innumerabilis, resisto, possum, dico, mos, marcus, caelum, longus, ab, tantus, scelus, atrocitas, sum, disiungo, paruus, sum, credo, homo, tam, ingeniosus, tam, prudens, non, uenio, in, mens, res, tantus, scelus, ignosco, alienus, seruio, non, sum, credo, possum, etiam, alius, et, ceterus, patronus, et, meus, consuetudo, ab, accusator, perquiro, ubi, sum, congredior, cum, seruio, luccei, caelius, qui, is, sum, aditus, si, per, sui, qui, temeritas, si, per, alius, per, qui, possum, omnis, latebra, suspicio, peragraris, dico, non, causa, non, locus, non, facultas, non, conscius, non, perficio, non, occulto, maleficus, spes, non, ratio, ullus, non, uestigium, magnus, facinus, reperio",173,"NaN, NaN, NaN, NaN, NaN, NaN, NaN, NaN, NaN, NaN, NaN, NaN, NaN, NaN, NaN, NaN, NaN, 0.5, NaN, NaN, NaN, 1.0, NaN, NaN, NaN, NaN, NaN, NaN, NaN, NaN, -0.5, NaN, NaN, 0.0, NaN, NaN, NaN, NaN, NaN, 0.5, NaN, NaN, 1.0, NaN, NaN, NaN, NaN, NaN, NaN, 0.5, NaN, NaN, NaN, NaN, -1.0, 0.0, NaN, NaN, 0.5, NaN, -1.0, NaN, NaN, NaN, NaN, NaN, NaN, NaN, NaN, NaN, NaN, NaN, 0.0, NaN, -1.0, NaN, NaN, NaN, NaN, NaN, NaN, 0.5, NaN, 0.5, 0.0, NaN, NaN, -1.0, -1.0, NaN, NaN, 0.0, NaN, NaN, 0.0, NaN, 1.0, NaN, 1.0, NaN, NaN, NaN, 0.5, 0.0, NaN, -1.0, NaN, -0.5, NaN, NaN, NaN, NaN, NaN, NaN, NaN, NaN, 0.0, NaN, NaN, 0.0, NaN, NaN, 0.0, NaN, NaN, NaN, NaN, NaN, NaN, NaN, NaN, NaN, NaN, NaN, NaN, NaN, NaN, NaN, NaN, -0.5, NaN, NaN, NaN, NaN, NaN, NaN, NaN, -0.5, -0.5, NaN, NaN, NaN, 0.0, NaN, 0.0, NaN, 0.5, NaN, -0.5, NaN, NaN, NaN, NaN, -1.0, 0.5, NaN, 0.0, NaN, NaN, NaN, 0.0, -1.0, NaN",-0.014,-0.064,"hic, tu, libido, tu, immoderatus, mulier, tu, facinus, hic, crimen, scelus, scelus, temeritas, conscius, maleficus, facinus",0.092
cicero.pro_caelio,54.0,"sed, hic, qui, sum, orator, proprius, qui, ego, non, propter, ingenium, meus, sed, propter, hic, exercitatio, utor, dico, fructus, aliquis, fero, possum, cum, ab, ego, ipse, elaboro, profero, uideo, breuitas, causa, relinquo, omnis, habeo, enim, iudex, qui, tu, socius, uester, religio, ius, iuro, facilis, sum, patior, lucius, lucceium, sancio, homo, et, grauis, testo, qui, tantus, facinus, in, fama, atque, in, fortuna, suus, neque, non, audio, infero, ab, marcus, caelio, neque, neglego, neque, fero, an, ille, uir, ille, humanitas, praeditus, ille, studium, ille, ars, atque, doctrina, ille, ipse, periculum, qui, propter, hic, ipse, studium, diligo, neglego, possum, et, qui, facinus, in, alienus, homo, intentus, sero, accipio, is, omitto, curo, in, hospes, qui, per, ignotus, ago, si, comperio, doleo, is, ab, suus, seruio, temptas, sum, neglego, qui, in, ager, locus, publicus, facio, reprehendo, is, in, urbs, atque, domus, suus, coepio, sum, lenis, fero, qui, in, aliquis, agrestis, periculum, non, praetermitto, is, homo, erudio, in, insidiae, doceo, homo, dissimulo, puto",157,"NaN, NaN, NaN, NaN, NaN, 0.0, NaN, NaN, NaN, NaN, 0.5, 0.0, NaN, NaN, NaN, NaN, NaN, NaN, 0.5, NaN, NaN, NaN, NaN, NaN, NaN, NaN, NaN, NaN, NaN, NaN, 0.0, NaN, NaN, NaN, NaN, 0.5, NaN, NaN, 1.0, NaN, 1.0, 0.5, NaN, 0.5, NaN, NaN, NaN, NaN, NaN, 0.0, NaN, -0.5, NaN, NaN, NaN, -1.0, NaN, 1.0, NaN, NaN, 0.0, NaN, NaN, NaN, NaN, NaN, NaN, NaN, NaN, NaN, NaN, NaN, NaN, NaN, NaN, 0.5, NaN, 0.0, 0.5, NaN, 0.5, NaN, 0.0, NaN, 0.0, NaN, NaN, -1.0, NaN, NaN, NaN, NaN, 0.5, NaN, NaN, NaN, NaN, NaN, -1.0, NaN, -0.5, 0.0, NaN, NaN, NaN, NaN, NaN, NaN, NaN, 0.0, NaN, NaN, -0.5, NaN, NaN, NaN, NaN, NaN, NaN, NaN, NaN, NaN, NaN, NaN, NaN, NaN, 0.0, 0.0, 0.0, NaN, NaN, NaN, NaN, 0.5, NaN, 0.0, NaN, NaN, NaN, 1.0, NaN, NaN, NaN, NaN, NaN, -1.0, NaN, NaN, NaN, 0.0, NaN, NaN, NaN, NaN, 0.0, NaN, NaN",0.022,-0.035,"hic, hic, tu, facinus, hic, facinus, insidiae",0.045
