Text,Stelle,Inahlt,Wortzahl,Sentiment Rechnung,Sentiment-Score,alternativer Sentiment-Score,Invektiven,Invektivitäts-Score
cicero.pro_caelio,55.0,"sed, cur, diu, tu, iudex, teneo, ipse, iuro, religio, auctoritas, percipio, atque, omnis, diligenter, testimonium, uerbum, cognosco, recito, lucius, luccei, testimonium, quis, exspectas, amplus, an, aliqui, uoco, puto, ipse, pro, sui, causa, et, ueritas, possum, mitto, hic, sum, innocentia, defensio, hic, ipse, causa, oratio, hic, unus, uox, ueritas, in, crimen, ipse, nullus, suspicio, sum, in, res, nihil, sum, argumentum, in, negotium, qui, ago, sum, dico, nullus, uestigium, sermo, locus, tempus, nemo, testis, nemo, conscius, nomino, totus, crimen, profero, ex, inimicus, ex, infamis, ex, crudelis, ex, facinerosa, ex, libidinosus, domus, domus, autem, ille, qui, tento, sum, scelus, iste, nefarius, dico, plenus, sum, integritas, dignitas, officio, religio, ex, qui, domus, recito, tu, ius, iuro, deuincio, auctoritas, ut, res, paruus, dubito, in, contentio, pono, utrum, temerarius, procax, irascor, mulier, fingo, crimen, an, grauis, sapio, modero, uir, religiosus, testimonium, dico, uideo",137,"NaN, NaN, NaN, NaN, 0.5, NaN, NaN, NaN, 1.0, NaN, NaN, NaN, NaN, NaN, NaN, 0.0, NaN, NaN, NaN, NaN, NaN, NaN, NaN, 0.0, NaN, NaN, NaN, NaN, NaN, NaN, NaN, 0.0, NaN, 0.5, NaN, NaN, NaN, NaN, 0.5, NaN, NaN, NaN, 0.0, -0.5, NaN, NaN, 0.0, 0.5, NaN, -1.0, NaN, NaN, -0.5, NaN, NaN, 0.0, NaN, NaN, 0.0, NaN, -0.5, NaN, NaN, NaN, NaN, NaN, NaN, -0.5, 0.0, 0.0, -0.5, NaN, -0.5, -0.5, NaN, NaN, -1.0, NaN, NaN, -1.0, NaN, -1.0, NaN, -1.0, NaN, NaN, NaN, -1.0, 0.0, 0.0, NaN, NaN, NaN, NaN, NaN, -1.0, NaN, -1.0, NaN, 0.0, NaN, 0.5, 1.0, NaN, 1.0, NaN, NaN, 0.0, NaN, NaN, 0.5, NaN, NaN, NaN, NaN, 0.0, 0.0, NaN, NaN, NaN, NaN, NaN, -1.0, -1.0, NaN, 0.0, NaN, -1.0, NaN, -0.5, NaN, NaN, 0.5, NaN, NaN, NaN, NaN",-0.062,-0.109,"tu, hic, hic, hic, crimen, conscius, crimen, infamis, crudelis, libidinosus, scelus, nefarius, tu, temerarius, procax, mulier, fingo, crimen",0.131
cicero.pro_caelio,56.0,"reliquus, sum, igitur, crimen, de, ueneno, qui, ego, neque, principium, inuenio, neque, euoluo, exitus, possum, qui, sum, enim, causa, quam, ob, res, iste, mulier, uenenum, do, uolo, caelius, ne, aurum, reddo, num, peto, ne, crimen, haereo, num, quis, obiacio, num, quis, denique, facio, mentio, si, hic, nullus, nomen, defero, quin, etiam, lucius, herennium, dico, audio, uerbum, sui, molestus, non, sum, sum, caelio, nisi, iterum, idem, de, res, suus, familiaris, absoluo, nomen, hic, defero, credibilis, sum, igitur, tantus, facinus, nullus, ob, causa, sum, committo, et, tu, non, uideo, fingo, scelus, magnus, crimen, ut, alter, scelus, suscipio, sum, causa, uideo",98,"0.0, NaN, NaN, -1.0, NaN, NaN, NaN, NaN, NaN, NaN, NaN, NaN, NaN, NaN, NaN, NaN, NaN, NaN, 0.0, NaN, NaN, 0.0, NaN, 0.0, -0.5, NaN, NaN, NaN, NaN, 0.5, NaN, NaN, NaN, NaN, -1.0, NaN, NaN, NaN, NaN, NaN, NaN, NaN, NaN, NaN, NaN, NaN, NaN, 0.0, NaN, NaN, NaN, NaN, NaN, NaN, NaN, 0.0, NaN, -1.0, NaN, NaN, NaN, NaN, NaN, NaN, NaN, NaN, 0.0, NaN, 1.0, NaN, 0.0, NaN, NaN, 0.5, NaN, NaN, NaN, -1.0, NaN, NaN, 0.0, NaN, NaN, NaN, NaN, NaN, NaN, NaN, -1.0, 0.0, -1.0, NaN, NaN, -1.0, NaN, NaN, 0.0, NaN",-0.056,-0.077,"crimen, mulier, crimen, hic, hic, facinus, tu, fingo, scelus, crimen, scelus",0.112
cicero.pro_caelio,57.0,"qui, denique, committo, quo, adiutor, utor, sum, quo, socius, quo, conscio, qui, tantus, facinus, qui, sui, qui, salus, suus, credo, seruio, -ne, mulier, sic, enim, sum, obicio, et, sum, tam, demens, is, qui, tu, ingenium, certus, tribuo, etiam, si, ceterus, inimicus, oratio, detraho, ut, omnis, suus, fortuna, alienus, seruio, committo, at, qui, seruio, refero, enim, magnus, opus, is, ipse, is, qui, intellego, non, communis, condicio, seruitus, uti, sed, licet, liber, familiaris, cum, domina, uiuo, quis, enim, hic, non, uideo, iudex, aut, quis, ignoro, in, is, modus, domus, in, qui, mater, familia, meretricius, mos, uiuo, in, qui, nihil, gero, qui, foras, profero, sum, in, qui, inusitatus, libido, luxurio, omnis, denique, inaudio, uitio, atque, flagitium, uerso, hic, seruus, non, sum, seruus, qui, omnis, committo, per, qui, gero, qui, uerso, idem, in, uoluptas, qui, occulo, credo, ad, qui, aliquantus, etiam, ex, cottidianus, sumptus, atque, luxuries, redundo, is, igitur, caelius, non, uideo",148,"NaN, NaN, NaN, NaN, 0.0, NaN, NaN, NaN, 1.0, NaN, NaN, NaN, NaN, -1.0, NaN, NaN, NaN, 1.0, NaN, NaN, NaN, NaN, 0.0, NaN, NaN, NaN, NaN, NaN, NaN, NaN, -1.0, NaN, NaN, NaN, 0.5, 0.5, NaN, NaN, NaN, 0.0, -1.0, -0.5, NaN, NaN, NaN, NaN, 0.0, -0.5, NaN, NaN, NaN, NaN, NaN, NaN, NaN, 0.0, 0.5, NaN, NaN, NaN, NaN, NaN, NaN, 0.0, 0.0, -0.5, NaN, NaN, NaN, 0.5, 1.0, NaN, NaN, NaN, NaN, NaN, NaN, NaN, NaN, 0.5, NaN, NaN, NaN, NaN, NaN, 0.5, 0.0, NaN, NaN, 0.0, 0.5, NaN, 0.5, NaN, NaN, NaN, NaN, NaN, NaN, NaN, NaN, NaN, NaN, NaN, -0.5, -0.5, NaN, NaN, NaN, NaN, NaN, NaN, -1.0, NaN, NaN, -0.5, NaN, NaN, -0.5, NaN, NaN, NaN, NaN, NaN, NaN, NaN, NaN, NaN, NaN, 1.0, NaN, NaN, NaN, NaN, NaN, NaN, NaN, NaN, NaN, NaN, NaN, NaN, NaN, NaN, NaN, NaN, NaN, NaN",0.003,-0.051,"facinus, mulier, demens, tu, seruitus, hic, meretricius, libido, luxurio, flagitium, hic",0.074
cicero.pro_caelio,58.0,"si, enim, tam, familiaris, sum, mulier, quam, tu, uolo, iste, quoque, seruus, familiaris, domina, sum, scio, sin, is, tantus, consuetudo, quantus, ab, tu, induco, non, sum, qui, cum, seruio, is, possum, familiaritas, sum, tantus, ipse, autem, uenenum, qui, ratio, fingo, ubi, quaero, sum, qui, ad, modus, paro, quo, pacisco, qui, quo, in, locus, trado, habeo, aio, domus, uis, is, sum, experior, in, seruo, quidam, ad, is, res, ipse, paro, qui, perceleri, interitus, sum, ab, hic, comprobo, uenenum",77,"NaN, NaN, NaN, 1.0, NaN, 0.0, NaN, NaN, NaN, NaN, NaN, -0.5, 1.0, NaN, NaN, NaN, NaN, NaN, NaN, NaN, NaN, NaN, NaN, NaN, NaN, NaN, NaN, NaN, NaN, NaN, NaN, 0.5, NaN, NaN, NaN, NaN, -0.5, NaN, 0.0, NaN, NaN, NaN, NaN, NaN, NaN, 0.5, NaN, NaN, NaN, NaN, NaN, NaN, 0.0, NaN, NaN, NaN, 0.0, 1.0, NaN, NaN, NaN, NaN, NaN, NaN, NaN, NaN, 0.0, NaN, NaN, NaN, NaN, -1.0, NaN, NaN, NaN, NaN, -0.5",0.019,-0.032,"mulier, tu, tu, fingo, hic",0.065
cicero.pro_caelio,59.0,"pro, deus, immortalis, cur, interdum, in, homo, scelus, magnus, aut, co-niuit, aut, praesum, fraus, poena, in, dies, reseruo, uideo, enim, uideo, et, ille, haurio, dolor, uel, acerbus, in, uito, cum, quintus, metellus, abstraho, e, sinus, gremium, patria, cum, ille, uir, qui, sui, natus, hic, imperium, puto, tertius, dies, post, quam, in, curia, quam, in, rostrum, quam, in, res, publicus, floreo, integer, aetas, bonus, habitus, magnus, uis, eripio, indignus, bonus, omnis, atque, uniuersus, ciuitas, quo, quidem, tempus, ille, morior, cum, iam, ceterus, ex, pars, opprimo, mens, sum, exter, sensus, ad, memoria, res, publicus, reseruo, cum, ego, intueor, fleo, significo, interrumpo, atque, morior, uox, quantus, in-pendeo, procella, ego, quantus, tempestas, ciuitas, et, cum, paries, saepe, ferio, is, qui, cum, quintus, catulus, sum, is, communis, creber, catulis, saepe, ego, saepis, res, publicus, nomino, ut, non, tam, sui, morior, quam, spolio, suus, praesidium, cum, patria, tum, etiam, ego, doleo",145,"NaN, 0.0, 0.5, NaN, NaN, NaN, 0.0, -1.0, 0.0, NaN, NaN, NaN, NaN, -1.0, -1.0, NaN, 0.0, NaN, NaN, NaN, NaN, NaN, NaN, NaN, -1.0, NaN, -1.0, NaN, NaN, NaN, NaN, NaN, NaN, NaN, NaN, 0.0, NaN, NaN, NaN, 0.5, NaN, NaN, 0.0, NaN, 0.0, NaN, 0.0, 0.0, NaN, NaN, NaN, -1.0, NaN, NaN, NaN, NaN, NaN, 0.0, 0.0, NaN, 0.5, 0.0, 1.0, NaN, 0.0, 1.0, NaN, -1.0, 1.0, NaN, NaN, 0.0, 0.5, NaN, NaN, 0.0, NaN, NaN, NaN, NaN, 0.0, NaN, 0.0, NaN, 0.5, NaN, 0.0, 0.5, NaN, 1.0, 0.0, 0.0, NaN, NaN, NaN, NaN, NaN, NaN, NaN, NaN, NaN, 0.0, NaN, NaN, NaN, NaN, NaN, 0.0, 0.5, NaN, NaN, NaN, NaN, NaN, NaN, NaN, NaN, NaN, 0.0, NaN, NaN, 0.0, NaN, NaN, NaN, NaN, NaN, 0.0, 0.0, NaN, NaN, NaN, NaN, NaN, NaN, NaN, NaN, NaN, NaN, NaN, NaN, NaN, NaN, NaN, NaN",0.003,-0.048,"scelus, fraus, poena, acerbus, hic",0.034
cicero.pro_caelio,60.0,"qui, quidem, uir, si, nullus, uolo, repentinus, scelus, tollo, quonam, modo, ille, furo, frater, suus, consularis, resto, qui, consul, incipio, furo, atque, tono, suus, sui, manus, interfacio, audio, senatus, dico, ex, hic, igitur, domus, progredior, iste, mulier, de, uenenum, celeritas, dico, audeo, nonne, ipse, domus, metuo, ne, quam, uoco, eicio, non, paries, conscius, non, nox, ille, funestus, atque, luctuosus, perhorresco, sed, reuorto, ad, crimen, etenim, hic, facio, ille, clarus, atque, fortis, uir, mentior, et, uoco, meus, fleo, debilito, et, mens, dolor, impedio",82,"NaN, NaN, 0.5, NaN, NaN, NaN, -0.5, -1.0, NaN, NaN, NaN, NaN, NaN, 0.0, NaN, 0.5, NaN, NaN, 0.5, NaN, NaN, NaN, NaN, NaN, NaN, 0.0, NaN, NaN, 0.5, NaN, NaN, NaN, NaN, 0.0, NaN, NaN, 0.0, NaN, -0.5, NaN, NaN, NaN, NaN, NaN, 0.0, NaN, NaN, NaN, NaN, NaN, NaN, NaN, -0.5, NaN, 0.0, NaN, -1.0, NaN, -1.0, NaN, NaN, NaN, NaN, -1.0, NaN, NaN, NaN, NaN, 0.5, NaN, 0.5, 0.5, NaN, NaN, NaN, 0.0, NaN, NaN, NaN, 0.5, -1.0, NaN",-0.03,-0.079,"scelus, furo, furo, interfacio, hic, mulier, conscius, funestus, luctuosus, perhorresco, crimen, hic",0.146
cicero.pro_caelio,61.0,"sed, tamen, uenenum, unde, sum, qui, ad, modus, paro, sum, non, dico, do, sum, aio, hic, publicus, licinium, pudeo, adulescens, et, bonus, caelum, familiaris, constituo, sum, cum, seruio, ut, uenio, ad, balneae, senias, idem, licinius, sum, uenio, atque, is, uenenum, pyxis, trado, hic, primus, ille, requiro, quis, attineo, fero, in, is, locus, constituo, cur, ille, seruio, non, ad, caelium, domus, uenio, si, maneo, tantus, ille, consuetudo, caelum, tantus, familiaritas, cum, clodia, quis, suspicio, sum, si, apud, caelium, mulier, seruus, uideo, sum, sin, autem, iam, subsum, simultas, exstinguo, sum, consuetudo, discidium, ex-sisto, hinc, ille, lacrima, nimirum, et, hic, causa, sum, omnis, hic, scelus, atque, crimen",104,"NaN, NaN, -0.5, NaN, NaN, NaN, NaN, 0.5, NaN, NaN, NaN, NaN, NaN, NaN, NaN, NaN, 0.0, NaN, NaN, NaN, NaN, 1.0, 0.5, 1.0, NaN, NaN, NaN, NaN, NaN, NaN, NaN, NaN, NaN, NaN, NaN, NaN, NaN, NaN, NaN, -0.5, NaN, NaN, NaN, 0.5, NaN, NaN, NaN, NaN, NaN, NaN, NaN, 0.0, NaN, NaN, NaN, NaN, NaN, NaN, NaN, 0.0, NaN, NaN, NaN, NaN, NaN, NaN, 0.5, NaN, 0.5, NaN, NaN, NaN, -0.5, NaN, NaN, NaN, NaN, 0.0, -0.5, NaN, NaN, NaN, NaN, NaN, NaN, -1.0, NaN, NaN, NaN, NaN, NaN, NaN, NaN, NaN, NaN, NaN, NaN, 0.0, NaN, NaN, NaN, -1.0, NaN, -1.0",-0.005,-0.048,"hic, pudeo, adulescens, hic, mulier, exstinguo, hic, hic, scelus, crimen",0.096
cicero.pro_caelio,62.0,"immo, inquam, cum, seruio, ad, domina, res, totus, et, maleficium, caelum, defero, mulier, ingeniosus, praecipio, hic, ut, omnis, caelio, polliceor, sed, ut, uenenum, cum, ab, licinium, trado, manifesto, comprehendo, possum, constituo, locus, iubeo, balneae, senias, ut, is, mitto, amicus, qui, delitiscerent, deinde, repens, cum, uenio, licinius, uenenum, trado, prosilirent, homo, comprehendo, qui, quidem, omnis, iudex, perfacilis, ratio, habeo, re-prehendo, cur, enim, potis, balneae, publicus, constituo, in, qui, non, inuenio, qui, latebra, togatus, homo, sum, possum, nam, si, sum, in, uestibulum, balnearis, non, lateo, sin, sui, in, intimus, conicio, uolo, neque, satis, commodus, calceatus, et, uestio, is, facio, possum, et, fortasse, non, recipio, nisi, fors, mulier, possum, quadrantarius, ille, permutatio, familiaris, facio, sum, balneator",113,"NaN, NaN, NaN, NaN, NaN, NaN, 0.0, NaN, NaN, -1.0, 0.5, NaN, 0.0, 1.0, NaN, NaN, NaN, NaN, NaN, NaN, NaN, NaN, -0.5, NaN, NaN, NaN, NaN, NaN, NaN, NaN, NaN, 0.0, NaN, NaN, NaN, NaN, NaN, NaN, 1.0, NaN, NaN, NaN, 0.0, NaN, NaN, NaN, -0.5, NaN, NaN, 0.0, NaN, NaN, NaN, NaN, 0.5, NaN, 0.0, NaN, NaN, NaN, NaN, 0.0, NaN, 0.0, NaN, NaN, NaN, NaN, NaN, NaN, -0.5, NaN, 0.0, NaN, NaN, NaN, NaN, NaN, NaN, 0.0, NaN, NaN, NaN, NaN, NaN, NaN, NaN, NaN, NaN, NaN, 0.5, 0.5, NaN, NaN, NaN, NaN, NaN, NaN, NaN, NaN, NaN, NaN, NaN, 0.0, 0.0, NaN, NaN, NaN, NaN, 1.0, NaN, NaN, NaN",0.022,-0.022,"maleficium, mulier, hic, uestio, mulier",0.044
cicero.pro_caelio,63.0,"atque, equidem, uehemens, exspecto, quisnam, iste, uir, bonus, testis, hic, manifesto, deprehendo, uenenum, dico, nullus, enim, sum, adhuc, nomino, sed, non, dubito, quin, sum, pergrauis, qui, primus, sum, talis, femina, familiaris, deinde, is, prouincia, suscipio, ut, in, balneae, contrudo, qui, ille, nisi, ab, uis, honestus, atque, plenus, dignitas, quam, uolo, sum, possum, numquam, impetro, sed, quis, ego, de, dignitas, iste, testis, loquor, uirtus, is, diligentia, cognosco, in, balnea, delitesco, testis, egregius, deinde, temere, prosilio, homo, tempero, sic, enim, fingo, cum, licinius, uenio, pyxis, teneo, in, manus, conor, trado, nondum, trado, tum, repens, euolo, iste, praeclarus, testis, sine, nomen, licinius, autem, cum, iam, manus, ad, trado, pyxis, porrigo, retraho, atque, ex, ille, repentinus, homo, impetus, sui, in, fuga, conicio, o, magnus, uis, ueritas, qui, contra, homo, ingenium, calliditas, sollertia, contra, fingo, omnis, insidiae, facilis, sui, per, sui, ipse, defendo",138,"NaN, NaN, NaN, NaN, NaN, NaN, 0.5, 1.0, NaN, NaN, NaN, NaN, -0.5, NaN, NaN, NaN, NaN, NaN, NaN, NaN, NaN, NaN, NaN, NaN, NaN, NaN, 0.5, NaN, NaN, 0.0, 1.0, NaN, NaN, 0.0, NaN, NaN, NaN, NaN, NaN, NaN, NaN, NaN, NaN, 1.0, 1.0, NaN, 0.0, 1.0, NaN, NaN, NaN, NaN, NaN, NaN, NaN, NaN, NaN, NaN, 1.0, NaN, NaN, NaN, 1.0, NaN, 0.5, NaN, NaN, NaN, NaN, NaN, 0.0, NaN, NaN, NaN, 0.0, NaN, NaN, NaN, NaN, NaN, NaN, NaN, NaN, NaN, NaN, 0.0, NaN, NaN, NaN, NaN, NaN, 0.0, NaN, NaN, NaN, NaN, NaN, 0.0, NaN, NaN, NaN, NaN, 0.0, NaN, NaN, NaN, NaN, NaN, NaN, NaN, NaN, -0.5, 0.0, NaN, NaN, NaN, -0.5, NaN, NaN, 0.0, 1.0, 0.5, NaN, NaN, 0.0, 0.5, 0.5, 1.0, NaN, NaN, NaN, NaN, 0.5, NaN, NaN, NaN, NaN, NaN",0.08,-0.011,"hic, honestus, fingo, fingo, insidiae",0.036
cicero.pro_caelio,64.0,"uelut, hic, totus, fabella, ueto, et, plurimaris, fabula, poetria, quam, sum, sine, argumentum, quam, nullus, inuenio, exitus, possum, quis, enim, iste, tot, uir, nam, necesse, sum, sum, non, paucus, ut, et, comprehendo, licinius, facilis, possum, et, res, multus, oculus, sum, testatus, cur, licinius, de, manus, amitto, qui, paruus, enim, licinius, comprehendo, possum, cum, sui, retraho, ne, pyxis, trado, quam, si, trado, sum, enim, ille, pono, ut, comprehendo, licinius, ut, manifesto, licinius, teneo, aut, cum, retineo, uenenum, aut, cum, trado, hic, sum, totus, consilium, mulier, hic, iste, prouincia, qui, rogo, sum, qui, quidem, tu, quam, ob, res, temere, prosilio, dico, atque, ante, tempus, non, reperio, sum, ad, hic, rogo, sum, ad, hic, res, con-loco, ut, uenenum, ut, insidiae, facinus, denique, ipse, ut, manifesto, comprehendo",123,"NaN, NaN, NaN, NaN, NaN, NaN, NaN, 0.0, NaN, NaN, NaN, NaN, 0.0, NaN, NaN, NaN, NaN, NaN, NaN, NaN, NaN, NaN, 0.5, NaN, 0.0, NaN, NaN, NaN, 0.0, NaN, NaN, NaN, NaN, 0.5, NaN, NaN, 0.0, 0.0, 0.0, NaN, 0.5, NaN, NaN, NaN, 0.0, NaN, NaN, 0.0, NaN, NaN, NaN, NaN, NaN, NaN, NaN, NaN, NaN, NaN, NaN, NaN, NaN, NaN, NaN, NaN, NaN, NaN, NaN, NaN, NaN, NaN, NaN, NaN, NaN, NaN, NaN, -0.5, NaN, NaN, NaN, NaN, NaN, NaN, 0.5, 0.0, NaN, NaN, 0.0, NaN, NaN, NaN, NaN, NaN, NaN, NaN, NaN, 0.0, NaN, NaN, NaN, NaN, NaN, 0.0, NaN, NaN, NaN, NaN, NaN, NaN, NaN, NaN, NaN, 0.0, NaN, NaN, -0.5, NaN, NaN, -1.0, NaN, NaN, NaN, NaN, NaN",0.0,-0.016,"hic, hic, mulier, hic, tu, hic, hic, insidiae, facinus",0.073
cicero.pro_caelio,65.0,"possum, -ne, magis, tempus, prosilire, quam, cum, licinius, uenio, cum, in, manus, teneo, uenenum, pyxis, qui, cum, iam, sum, trado, seruio, si, euado, subeo, ex, balnea, mulier, amicus, licinium, comprehendo, imploro, homo, fides, atque, ab, sui, ille, pyxis, trado, pernego, qui, quo, modo, ille, reprehendo, uideo, sui, dico, primus, ad, sui, uoco, magnus, facinus, crimen, deinde, is, sui, uideo, dico, qui, quo, locus, con-loco, sum, non, possum, uideo, tempus, igitur, ipse, sui, ostendo, cum, licinius, uenio, pyxis, expedio, manus, porrigo, uenenum, trado, mimus, ergo, iam, exitus, non, fabula, in, quo, cum, clausula, non, inuenio, fugio, aliquis, e, manus, deinde, scabilla, concrepo, aulaeum, tollo",103,"NaN, NaN, NaN, 0.0, NaN, NaN, NaN, NaN, NaN, NaN, NaN, 0.0, NaN, -0.5, NaN, NaN, NaN, NaN, NaN, NaN, NaN, NaN, NaN, NaN, NaN, NaN, 0.0, 1.0, NaN, NaN, NaN, 0.0, 1.0, NaN, NaN, NaN, NaN, NaN, NaN, NaN, NaN, NaN, NaN, NaN, NaN, NaN, NaN, NaN, 0.5, NaN, NaN, NaN, 0.0, -1.0, -1.0, NaN, NaN, NaN, NaN, NaN, NaN, NaN, 0.0, NaN, NaN, NaN, NaN, NaN, 0.0, NaN, NaN, NaN, NaN, NaN, NaN, NaN, NaN, NaN, 0.0, NaN, -0.5, NaN, -0.5, NaN, NaN, NaN, NaN, 0.0, NaN, NaN, NaN, NaN, NaN, NaN, NaN, NaN, NaN, 0.0, NaN, NaN, NaN, NaN, NaN",-0.01,-0.034,"mulier, facinus, crimen, mimus",0.039
cicero.pro_caelio,66.0,"quaero, enim, cur, licinius, titubo, haesito, cedo, fugio, conor, mulierarius, manus, iste, de, manus, emitto, cur, non, comprenderint, cur, non, ipse, confessio, multus, oculus, facinus, denique, uox, tantus, scelus, crimen, exprimo, an, timeo, ne, tot, unus, ualeo, imbecillus, alacer, perterreo, supero, non, possum, nullus, argumentum, in, res, nullus, suspicio, in, causa, nullus, exitus, crimen, reperio, itaque, hic, causa, ab, argumentum, ab, conicio, ab, is, signum, qui, uereor, inlustraris, soleo, ad, testis, totus, traduco, sum, qui, quidem, ego, iudex, testis, non, modo, sine, ullus, timor, sed, etiam, cum, aliqui, spes, delectatio, exspecto",91,"NaN, NaN, NaN, NaN, NaN, NaN, NaN, NaN, NaN, 0.0, 0.0, NaN, NaN, 0.0, NaN, NaN, NaN, NaN, NaN, NaN, NaN, 0.0, 0.0, 0.0, -1.0, NaN, 0.0, NaN, -1.0, -1.0, NaN, NaN, NaN, NaN, NaN, NaN, NaN, -1.0, 1.0, NaN, NaN, NaN, NaN, NaN, 0.0, NaN, 0.0, NaN, -0.5, NaN, 0.0, NaN, NaN, -1.0, NaN, NaN, NaN, 0.0, NaN, 0.0, NaN, NaN, NaN, NaN, 0.0, NaN, NaN, NaN, NaN, NaN, NaN, NaN, NaN, NaN, NaN, NaN, NaN, 0.5, NaN, NaN, NaN, NaN, NaN, -0.5, NaN, NaN, NaN, NaN, 0.5, NaN, NaN",-0.044,-0.066,"facinus, scelus, crimen, crimen, hic",0.055
cicero.pro_caelio,67.0,"praegestio, animus, iam, uideo, primus, lauo, iuuenis, mulier, beatus, atque, nobilis, familiaris, deinde, fortis, uir, ab, imperatrix, in, insidiae, atque, in, praesidium, balnearis, con-loco, ex, qui, requiro, qui, ad, modus, lateo, aut, ubi, alueus, ille, an, equus, troianus, sum, qui, tot, inuictus, uir, muliebris, bellum, gero, fero, atque, tego, ille, uerus, respondeo, cogo, cur, tot, uir, atque, talis, hic, et, unus, et, tam, imbecillus, qui, uideo, non, aut, sto, comprehendo, aut, fugio, con-sequor, sum, qui, sui, numquam, profecto, si, in, iste, locus, procedo, explico, quam, uolo, in, conuiuium, facetus, dicax, non, numquam, etiam, ad, uinum, dissero, sum, alius, forum, uolo, sum, alius, triclinium, alius, subsellium, ratio, alius, lector, non, idem, iudex, comissor, conspicio, lux, denique, longus, alius, sum, sol, alius, lychnus, quam, ob, res, excutio, omnis, iste, deliquia, omnis, ineptia, si, prodeo, sed, ego, audio, nauo, alius, opera, alius, ineo, gratia, in, alius, sui, res, ostento, uigeo, apud, iste, mulier, uenustas, dominor, sumptus, haereo, iaceo, deseruio, caput, uerus, innocens, fortuna, parco",161,"NaN, 0.5, NaN, NaN, 0.5, NaN, NaN, 0.0, 1.0, NaN, 1.0, 1.0, NaN, 0.5, 0.5, NaN, NaN, NaN, NaN, NaN, NaN, NaN, NaN, NaN, NaN, NaN, NaN, NaN, NaN, 0.5, NaN, NaN, NaN, NaN, NaN, NaN, NaN, NaN, NaN, NaN, NaN, 1.0, 0.5, NaN, 0.0, NaN, NaN, NaN, NaN, NaN, 0.5, NaN, NaN, NaN, NaN, 0.5, NaN, NaN, NaN, NaN, NaN, NaN, NaN, -1.0, NaN, NaN, NaN, NaN, NaN, NaN, NaN, NaN, NaN, NaN, NaN, NaN, NaN, NaN, NaN, NaN, NaN, 0.0, NaN, NaN, NaN, NaN, NaN, NaN, 0.0, NaN, NaN, NaN, NaN, NaN, NaN, NaN, NaN, NaN, NaN, NaN, NaN, NaN, NaN, NaN, NaN, 0.0, NaN, 0.0, NaN, NaN, 0.5, NaN, NaN, NaN, NaN, 0.0, NaN, NaN, NaN, NaN, NaN, NaN, NaN, 0.0, NaN, NaN, NaN, 0.5, NaN, -1.0, NaN, NaN, NaN, NaN, NaN, NaN, NaN, -0.5, NaN, NaN, 1.0, NaN, NaN, NaN, 0.0, NaN, NaN, NaN, NaN, 0.0, 1.0, NaN, NaN, NaN, NaN, NaN, 0.0, 0.5, 0.5, 0.0, NaN",0.059,-0.016,"mulier, insidiae, muliebris, hic, conuiuium, facetus, mulier, iaceo, innocens",0.056
cicero.pro_caelio,68.0,"at, sum, seruio, ille, de, cognator, sententia, nobilis, et, clarus, homo, manus, mitto, tandem, aliquis, inuenio, qui, iste, mulier, de, suus, propinquus, fortis, uir, sententia, atque, auctoritas, facio, dico, sed, scio, cupio, quis, habeo, argumentum, iste, manumissio, in, qui, aut, crimen, sum, caelio, quaero, aut, quaestio, tollo, aut, multus, res, conscius, seruio, cum, causa, praemium, persoluo, at, propinquus, inquam, placeo, cur, non, placeo, cum, res, tueor, ad, is, non, ab, alius, tu, affero, sed, ab, tu, ipse, comperio, defero, dico",80,"NaN, NaN, NaN, NaN, NaN, NaN, 0.0, 1.0, NaN, 0.5, 0.0, 0.0, NaN, NaN, NaN, NaN, NaN, NaN, 0.0, NaN, NaN, 0.0, 0.5, 0.5, 0.0, NaN, NaN, NaN, NaN, NaN, NaN, NaN, NaN, NaN, 0.0, NaN, NaN, NaN, NaN, NaN, -1.0, NaN, NaN, NaN, NaN, NaN, NaN, NaN, 0.0, 0.0, -0.5, NaN, NaN, 0.0, 1.0, NaN, NaN, 0.0, NaN, NaN, NaN, NaN, NaN, NaN, 0.0, NaN, NaN, NaN, NaN, NaN, NaN, NaN, NaN, NaN, NaN, NaN, NaN, NaN, NaN, NaN",0.025,-0.019,"mulier, crimen, conscius, tu, tu",0.062
cicero.pro_caelio,69.0,"hic, etiam, miror, si, ille, commenticius, pyxis, obscenus, sum, fabula, con-sequor, nihil, sum, qui, in, is, modus, mulier, non, cado, uideo, audio, et, percelebro, sermo, res, sum, percipio, animus, iudex, iam, dudum, quis, uolo, uel, potis, quis, nolo, dico, qui, etiam, si, sum, facio, certus, ab, caelio, quidem, non, sum, facio, quis, enim, attineo, sum, enim, ab, aliquis, adulescens, fortasse, non, tam, insulsus, quam, inuerecundus, sin, autem, sum, fingo, non, ille, quidem, modestus, sed, tamen, sum, non, infacetus, mendacium, qui, profecto, numquam, homo, sermo, atque, opinio, comprobo, nisi, omnis, qui, cum, turpitudo, aliqui, dico, in, iste, quadraris, aptus, uideo",99,"NaN, NaN, NaN, NaN, NaN, NaN, NaN, -1.0, NaN, 0.0, NaN, NaN, NaN, NaN, NaN, NaN, 0.5, 0.0, NaN, NaN, NaN, NaN, NaN, NaN, -0.5, 0.0, NaN, NaN, 0.5, 0.5, NaN, NaN, NaN, NaN, NaN, 0.0, NaN, NaN, NaN, NaN, NaN, NaN, NaN, NaN, 0.5, NaN, NaN, NaN, NaN, NaN, NaN, NaN, NaN, NaN, NaN, NaN, NaN, NaN, NaN, NaN, NaN, NaN, NaN, NaN, -1.0, NaN, NaN, NaN, NaN, NaN, NaN, NaN, 1.0, NaN, NaN, NaN, NaN, -1.0, -1.0, NaN, NaN, NaN, 0.0, -0.5, NaN, 0.0, NaN, NaN, NaN, NaN, NaN, -1.0, NaN, NaN, NaN, NaN, NaN, NaN, NaN",-0.03,-0.061,"hic, mulier, adulescens, insulsus, fingo, modestus, mendacium, turpitudo",0.081
cicero.pro_caelio,70.0,"dictum, sum, ab, ego, causa, iudex, et, peroro, iam, intellego, quantus, iudicium, sustineo, quantus, res, sum, committo, tu, de, uis, quaero, qui, lex, ad, imperium, ad, maiestas, ad, status, patria, ad, salus, omnis, pertineo, quam, lex, quintus, catulus, armo, dissensio, ciuis, res, publicus, paene, exter, tempus, fero, quisque, lex, sedo, ille, flamma, consulatus, meus, fumo, reliquiae, coniuratio, exstinguo, hic, nunc, lex, caelum, adulescentia, non, ad, res, publicus, poena, sed, ad, mulier, libido, et, deliquia, deposco",75,"0.0, NaN, NaN, NaN, 0.0, 0.5, NaN, NaN, NaN, NaN, NaN, 0.5, NaN, NaN, 0.0, NaN, NaN, NaN, NaN, 1.0, NaN, NaN, 0.5, NaN, 0.0, NaN, NaN, NaN, 0.0, NaN, NaN, 1.0, NaN, NaN, NaN, 0.5, NaN, 0.0, NaN, NaN, 0.5, 0.0, 0.0, NaN, 0.0, 0.0, NaN, NaN, 0.5, NaN, NaN, NaN, NaN, 0.0, NaN, NaN, -0.5, NaN, NaN, NaN, 0.5, 0.5, NaN, NaN, NaN, 0.0, 0.0, -1.0, NaN, NaN, 0.0, -0.5, NaN, 0.5, NaN",0.06,-0.027,"tu, coniuratio, exstinguo, hic, poena, mulier, libido",0.093
cicero.pro_caelio,71.0,"atque, hic, etiam, locus, marcus, camurti, et, caius, caeserni, damnatio, praedico, o, stultitia, stultitia, -ne, dico, an, impudentia, singularis, audeo, -ne, cum, ab, is, mulier, uenio, facio, iste, homo, mentio, audeo, excitaris, tantus, flagitium, memoria, non, exstinguo, ille, quidem, sed, reprimo, uetustas, quo, enim, ille, crimen, pecco, pereo, nempe, qui, idem, mulier, dolor, et, iniuria, uettiano, nefarius, sum, stuprum, per-sequor, ergo, ut, audio, uetti, nomen, in, causa, ut, ille, uetus, aerarium, fabula, refero, idcirco, camurti, et, caeserni, sum, causa, renouo, qui, quamquam, lex, de, uis, certus, non, teneo, is, maleficium, tamen, sum, implicati, ut, ex, nullus, lex, laqueus, eximo, uideo",100,"NaN, NaN, NaN, 0.0, NaN, NaN, NaN, NaN, NaN, -1.0, NaN, NaN, -1.0, -1.0, NaN, NaN, NaN, -1.0, 0.0, NaN, NaN, NaN, NaN, NaN, 0.0, NaN, NaN, NaN, 0.0, NaN, NaN, NaN, NaN, -1.0, 1.0, NaN, NaN, NaN, NaN, NaN, NaN, -0.5, NaN, NaN, NaN, -1.0, NaN, NaN, NaN, NaN, NaN, 0.0, -1.0, NaN, -1.0, NaN, -1.0, NaN, -1.0, NaN, NaN, NaN, NaN, NaN, 0.0, NaN, 0.0, NaN, NaN, 0.0, NaN, 0.0, NaN, NaN, NaN, NaN, NaN, NaN, 0.0, NaN, NaN, NaN, 0.5, NaN, 1.0, 0.5, NaN, NaN, NaN, -1.0, NaN, NaN, NaN, NaN, NaN, NaN, 0.5, NaN, NaN, NaN",-0.08,-0.115,"hic, damnatio, stultitia, stultitia, mulier, flagitium, exstinguo, crimen, mulier, nefarius, stuprum, maleficium",0.12
cicero.pro_caelio,72.0,"marcus, uerus, caelius, cur, in, hic, iudicium, uoco, qui, neque, proprius, quaestio, crimen, obicio, neque, uerus, aliqui, is, modus, qui, sum, ab, lex, seiungo, cum, uester, seueritas, coniungo, qui, primus, aetas, disciplina, dedo, sum, is, ars, qui, instruo, ad, hic, usus, forensis, ad, capesso, res, publicus, ad, honor, gloria, dignitas, is, autem, sum, amicitia, magnus, natus, qui, imitor, industria, continentia, magnus, uolo, is, studium, aequalis, ut, idem, qui, bonus, atque, nobilis, peto, cursus, laus, uideo",75,"NaN, 0.5, NaN, NaN, NaN, NaN, 0.5, NaN, NaN, NaN, 0.0, NaN, -1.0, NaN, NaN, 0.5, NaN, NaN, 0.5, NaN, NaN, NaN, 0.5, NaN, NaN, NaN, NaN, NaN, NaN, 0.5, 0.0, 0.0, NaN, NaN, NaN, 0.0, NaN, NaN, NaN, NaN, NaN, NaN, NaN, NaN, 0.0, 0.0, NaN, 1.0, 0.0, 1.0, NaN, NaN, NaN, 1.0, 0.0, 0.0, NaN, NaN, 0.5, 0.5, 0.0, NaN, NaN, 0.5, 0.5, NaN, NaN, NaN, 1.0, NaN, 1.0, NaN, NaN, 1.0, NaN",0.133,-0.013,"hic, crimen, seueritas, hic",0.053
