Text,Stelle,Inahlt,Wortzahl,Sentiment Rechnung,Sentiment-Score,alternativer Sentiment-Score,Invektiven,Invektivitäts-Score
cicero.pro_rege_deiotaro,23.0,"at, mitto, ad, nescio, qui, caecilium, sed, is, qui, mitto, qui, eo, nolo, in, uinclum, conicio, non, quaero, quam, uerus, similis, sum, aut, non, habeo, rex, qui, mitto, aut, is, qui, mitto, sum, non, pareo, aut, qui, dico, audio, in, tantus, res, non, sum, is, uincio, potis, quam, neco, sed, tamen, cum, ad, caecilium, mitto, utrum, causa, ille, uinco, sum, nescio, an, caecilium, iste, magnus, homo, puto, qui, profecto, is, qui, optume, noster, homo, nosco, uel, quia, non, nosco, uel, si, nosco, contemno",83,"NaN, NaN, NaN, NaN, NaN, NaN, NaN, NaN, NaN, NaN, NaN, NaN, NaN, NaN, NaN, NaN, NaN, NaN, NaN, 0.5, 0.0, NaN, NaN, NaN, NaN, 0.0, NaN, NaN, NaN, NaN, NaN, NaN, NaN, NaN, NaN, NaN, NaN, NaN, NaN, NaN, NaN, 0.0, NaN, NaN, NaN, NaN, 0.0, NaN, NaN, NaN, NaN, NaN, NaN, NaN, NaN, NaN, 0.0, NaN, NaN, NaN, NaN, NaN, NaN, NaN, 0.0, 0.0, NaN, NaN, NaN, NaN, NaN, NaN, NaN, 0.0, NaN, NaN, NaN, NaN, NaN, NaN, NaN, NaN, NaN",0.006,0.0,uinclum,0.012
cicero.pro_rege_deiotaro,24.0,"addo, etiam, ille, eques, non, bonus, mitto, credo, caesar, nihil, ad, tuus, equitas, sed, mitto, ex, is, qui, habeo, eligo, aio, nescio, qui, ex, is, numerus, seruus, iudico, non, arbitror, non, audio, sed, in, is, etiam, si, accido, culpa, rex, nullus, sum, arbitror, alienus, autem, ab, tu, animus, quo, modo, spero, credo, difficilis, tu, alexandreae, sum, exitus, propter, regio, natura, et, flumen, at, is, tempus, ipse, pecunia, do, exercitus, alo, is, qui, asia, praeficio, nullus, in, res, desum, tu, uictor, non, solus, ad, hospitium, sed, ad, periculum, etiam, atque, ad, acies, praesto, sum",93,"NaN, NaN, NaN, 0.0, NaN, 1.0, NaN, NaN, 0.5, NaN, NaN, 0.0, NaN, NaN, NaN, NaN, NaN, NaN, NaN, NaN, NaN, NaN, NaN, NaN, NaN, NaN, -0.5, NaN, NaN, NaN, NaN, NaN, NaN, NaN, NaN, NaN, NaN, NaN, -1.0, 0.0, NaN, NaN, NaN, -0.5, NaN, NaN, NaN, 0.5, NaN, NaN, NaN, NaN, -0.5, NaN, NaN, NaN, NaN, NaN, 0.0, 0.0, NaN, NaN, NaN, NaN, 0.0, NaN, 0.0, NaN, 0.0, NaN, NaN, NaN, NaN, NaN, NaN, NaN, 0.0, NaN, NaN, NaN, NaN, -0.5, NaN, 0.0, NaN, NaN, -1.0, NaN, NaN, NaN, 0.0, NaN, NaN",-0.022,-0.043,"culpa, tu, tu, pecunia, tu",0.054
cicero.pro_rege_deiotaro,25.0,"sequor, bellum, sum, africanum, grauis, de, tu, rumor, qui, etiam, furiosus, ille, caecilium, excito, quo, tum, rex, animus, qui, auctionor, sum, se-sequor, spolio, malo, quam, tu, pecunia, non, subministraris, at, is, inquam, tempus, ipse, nicaeam, ephesumque, mitto, qui, rumor, africanos, excipio, et, celer, ad, sui, refero, itaque, cum, sum, is, nuntio, domitius, naufragium, pereo, tu, in, castellum, circumsedeo, de, domitius, dico, uerro, graecus, idem, sententia, qui, etiam, nos, habeo, latinum, pereo, amicus, dum, inimicus, unus, intercisi, qui, ille, si, tu, sum, inimicus, numquam, tamen, dico, ipse, enim, mansuetus, uerro, immanis, qui, autem, domitius, possum, sum, amicus, qui, tu, sum, inimicus, tu, porro, inimicus, cur, sum, ab, quo, cum, uel, interficio, bellum, lex, possum, rex, et, sui, et, filius, suus, constituo, sum, memini",122,"NaN, 0.0, NaN, NaN, -0.5, NaN, NaN, NaN, NaN, NaN, -1.0, NaN, NaN, NaN, NaN, NaN, 0.0, 0.5, NaN, NaN, NaN, NaN, NaN, NaN, NaN, NaN, 0.0, NaN, NaN, NaN, NaN, NaN, 0.0, NaN, NaN, NaN, NaN, NaN, NaN, NaN, NaN, NaN, NaN, NaN, NaN, NaN, NaN, NaN, NaN, NaN, NaN, NaN, NaN, NaN, NaN, NaN, NaN, NaN, NaN, NaN, NaN, NaN, NaN, NaN, 0.0, NaN, NaN, NaN, NaN, NaN, NaN, 1.0, NaN, -1.0, NaN, NaN, NaN, NaN, NaN, NaN, NaN, -1.0, NaN, NaN, NaN, NaN, NaN, 0.5, NaN, 0.0, NaN, NaN, NaN, NaN, NaN, 1.0, NaN, NaN, NaN, -1.0, NaN, NaN, -1.0, NaN, NaN, NaN, NaN, NaN, NaN, NaN, 0.0, 0.5, NaN, 0.0, NaN, NaN, NaN, 0.0, NaN, NaN, NaN, NaN",-0.016,-0.045,"tu, furiosus, tu, pecunia, naufragium, tu, tu, immanis, tu, tu, interficio",0.09
cicero.pro_rege_deiotaro,26.0,"quis, deinde, furcifer, quo, progredio, aio, hic, laetitia, deiotaris, effero, uinum, sui, obruo, in, conuiuium, nudus, saltauisse, qui, crux, hic, fugitiuus, possum, satis, supplicium, affero, deiotaris, saltantem, quisquam, aut, ebrius, uideo, umquam, omnis, sum, in, ille, rex, uirtus, qui, tu, caesar, ignoro, non, arbitror, sed, praecipuus, singularis, et, admiror, frugalitas, etsi, hic, uerbum, scio, laudo, rex, non, soleo, frugi, homo, dico, non, multus, habeo, laus, in, rex, fortis, iustus, seuerus, grauis, magnus, animus, largus, beneficus, liberal, hic, sum, regia, laus, ille, priuo, sum, ut, uolo, quisque, accipio, ego, tamen, frugalitas, is, sum, modestia, et, temperantia, uirtus, maximus, iudico, hic, in, ille, sum, ab, ineo, aetas, cum, ab, cunctus, asia, cum, ab, magistratus, lego, noster, tum, ab, eques, romanus, qui, in, asia, negotior, sum, perspicio, et, cognosco",126,"NaN, NaN, -1.0, NaN, NaN, NaN, NaN, 1.0, NaN, NaN, NaN, NaN, NaN, NaN, NaN, 0.0, NaN, NaN, NaN, NaN, NaN, NaN, 0.5, NaN, NaN, NaN, NaN, NaN, NaN, -0.5, NaN, NaN, NaN, NaN, NaN, NaN, 0.0, 1.0, NaN, NaN, 0.5, NaN, NaN, NaN, NaN, 0.0, 0.0, NaN, NaN, 0.5, NaN, NaN, 0.0, NaN, NaN, 0.0, NaN, NaN, 1.0, 0.0, NaN, NaN, 0.0, NaN, 1.0, NaN, 0.0, 0.5, 1.0, NaN, -0.5, 0.0, 0.5, NaN, 1.0, NaN, NaN, NaN, NaN, 1.0, NaN, NaN, NaN, NaN, NaN, NaN, NaN, NaN, NaN, 0.5, NaN, NaN, 0.5, NaN, 1.0, 1.0, NaN, NaN, NaN, NaN, NaN, NaN, NaN, NaN, 0.0, NaN, NaN, 0.0, NaN, NaN, NaN, 0.5, NaN, NaN, NaN, NaN, 0.0, NaN, NaN, NaN, NaN, NaN, NaN, NaN, NaN, NaN",0.087,-0.016,"hic, conuiuium, crux, hic, fugitiuus, supplicium, ebrius, tu, frugalitas, hic, frugi, hic, frugalitas, modestia, hic, negotior",0.127
cicero.pro_rege_deiotaro,27.0,"multus, ille, quidem, gradus, officium, erga, res, publicus, noster, ad, hic, regius, nomen, ascendo, sed, tamen, quisquis, ab, bellum, populus, romanus, uaco, cum, homo, noster, consuetudo, amicitia, res, ratio, iungo, ut, non, solus, tetrarches, nobilis, sed, etiam, bonus, pater, familia, et, diligens, agricola, et, pecuarius, habeo, qui, igitur, adulescens, nondum, tantus, gloria, praeditus, nihil, umquam, nisi, seuerus, et, grauis, facio, is, is, existimatio, is, aetas, saltauit",66,"0.0, NaN, NaN, 0.0, 0.5, NaN, 0.0, 0.0, NaN, NaN, NaN, 0.0, 0.0, NaN, NaN, NaN, NaN, NaN, 0.0, 0.0, NaN, NaN, NaN, 0.0, NaN, NaN, 1.0, 0.0, 0.0, NaN, NaN, NaN, -0.5, NaN, 1.0, NaN, NaN, 1.0, 0.0, 0.5, NaN, 1.0, NaN, NaN, NaN, NaN, NaN, NaN, NaN, NaN, NaN, 0.0, 0.5, NaN, NaN, NaN, NaN, NaN, -0.5, NaN, NaN, NaN, NaN, NaN, 0.0, NaN",0.068,-0.015,"hic, adulescens",0.03
cicero.pro_rege_deiotaro,28.0,"imitor, castor, potis, auus, mos, disciplina, debeo, quam, bonus, et, clarus, uir, fugitiuus, os, malus, dico, qui, si, saltator, auus, habeo, neque, is, uir, unde, pudor, pudicitia, exemplum, peto, tamen, hic, maledico, paruus, in, ille, aetas, conuenio, qui, ille, studium, ab, ineo, aetas, sui, imbuo, non, saltandi, sed, bene, ut, arma, optume, ut, equus, uto, is, tamen, ille, cunctus, iam, aetas, deficio, itaque, deiotaris, cum, multus, in, equus, tollo, qui, haereo, in, is, senex, possum, admiraris, soleo, hic, uerus, adulescens, qui, meus, in, cilicium, miles, in, graecia, commilito, sum, cum, in, ille, noster, exercitus, equito, cum, suus, deligo, eques, qui, unus, cum, is, ad, pompeius, pater, mitto, qui, concursus, facio, soleo, quam, sui, iactaris, quam, ostentaris, quam, nemo, in, ille, causa, studium, et, cupiditas, concedo",125,"NaN, NaN, 0.0, NaN, 0.5, 0.0, NaN, NaN, 1.0, NaN, 0.5, 0.5, NaN, 0.0, -1.0, NaN, NaN, NaN, NaN, NaN, NaN, NaN, NaN, 0.5, NaN, 0.5, 0.5, 0.0, NaN, NaN, NaN, NaN, 0.0, NaN, NaN, 0.0, NaN, NaN, NaN, 0.5, NaN, NaN, 0.0, NaN, NaN, NaN, NaN, NaN, NaN, NaN, 0.0, NaN, NaN, NaN, NaN, NaN, NaN, NaN, 0.0, NaN, 0.0, NaN, NaN, NaN, NaN, 0.0, NaN, NaN, NaN, NaN, NaN, NaN, NaN, 0.0, NaN, NaN, NaN, NaN, 0.5, NaN, NaN, 0.0, NaN, NaN, 0.0, NaN, NaN, NaN, NaN, NaN, NaN, NaN, NaN, 0.0, NaN, NaN, NaN, NaN, 0.0, NaN, NaN, NaN, NaN, NaN, NaN, 0.0, NaN, NaN, NaN, NaN, NaN, NaN, NaN, NaN, NaN, NaN, NaN, -0.5, NaN, NaN, 0.0, 0.5, NaN, -0.5, NaN",0.028,-0.016,"fugitiuus, saltator, pudor, pudicitia, hic, maledico, hic, adulescens",0.064
cicero.pro_rege_deiotaro,29.0,"tum, uerus, exercitus, amitto, ego, qui, pax, semper, auctor, post, pharsalicum, autem, proelium, suasor, sum, armus, non, pono, sed, abicio, hic, ad, meus, auctoritas, non, possum, duco, qui, et, ipse, ardeo, studium, ille, bellum, et, pater, satis, facio, arbitror, felix, iste, domus, qui, non, impunitas, solus, adipiscor, sum, sed, etiam, accuso, licentia, calamitosus, deiotarus, qui, et, ab, is, qui, in, idem, castrum, sum, et, non, modo, apud, tu, sed, etiam, ab, suus, accuso, tu, uester, secundus, fortuna, castor, non, possum, sine, propinquus, calamitas, sum, contendo",85,"NaN, 0.5, 0.0, NaN, NaN, NaN, 0.5, NaN, NaN, NaN, NaN, NaN, -1.0, NaN, NaN, NaN, NaN, NaN, NaN, NaN, NaN, NaN, 0.0, NaN, NaN, NaN, NaN, NaN, NaN, NaN, NaN, 0.5, NaN, 0.0, NaN, 0.0, 0.5, NaN, NaN, 1.0, NaN, 0.0, NaN, NaN, -0.5, -0.5, NaN, NaN, NaN, NaN, NaN, -0.5, -1.0, NaN, NaN, NaN, NaN, NaN, NaN, NaN, NaN, NaN, NaN, NaN, NaN, NaN, NaN, NaN, NaN, NaN, NaN, NaN, NaN, NaN, NaN, 0.0, 0.0, NaN, NaN, NaN, NaN, 0.0, -1.0, NaN, NaN",-0.018,-0.053,"proelium, hic, impunitas, licentia, calamitosus, tu, tu, calamitas",0.094
cicero.pro_rege_deiotaro,30.0,"sum, sanus, inimicitia, qui, sum, non, debeo, rex, enim, deiotarus, uester, familia, abicio, et, obscurus, e, tenebrae, in, lux, euoco, quis, tuus, pater, ante, quis, sum, quam, qui, gener, sum, audio, sed, quiuis, ingratus, et, impius, necessitudo, nomen, repudio, tamen, inimicitia, homo, mos, gero, possum, non, fingo, crimen, insectaris, non, expeto, uita, non, capio, arcesso, sum, concedo, hic, quoque, acerbitas, et, odi, magnitudo, adeo, ut, omnis, uita, salus, communis, atque, etiam, humanitas, ius, uiolo, seruus, sollicito, uerbum, spes, promitto, corrumpo, abduco, domus, contra, dominus, armaris, hic, sum, non, unus, propinquo, sed, omnis, familia, nefarius, bellum, indico, nam, iste, corruptela, seruio, si, non, modo, impunitus, sum, sed, etiam, ab, tantus, auctoritas, approbo, nullus, paries, noster, salus, nullus, lex, nullus, ius, custodio, ubi, enim, is, qui, intus, sum, atque, nos, impunis, euolaris, possum, contra, nos, pugno, fio, in, dominor, seruio, in, seruitus, dominor",141,"NaN, 1.0, -1.0, NaN, NaN, NaN, NaN, 0.0, NaN, NaN, NaN, 0.5, NaN, NaN, NaN, NaN, NaN, NaN, NaN, NaN, NaN, 0.0, 0.0, NaN, NaN, NaN, NaN, NaN, NaN, NaN, NaN, NaN, NaN, -1.0, NaN, -1.0, NaN, 0.0, NaN, NaN, -1.0, 0.0, 0.5, NaN, NaN, NaN, NaN, -1.0, NaN, NaN, NaN, 0.0, NaN, NaN, NaN, NaN, NaN, NaN, NaN, -0.5, NaN, NaN, 0.0, NaN, NaN, NaN, 0.0, 1.0, 0.0, NaN, NaN, 0.0, 0.5, NaN, -0.5, NaN, 0.0, 0.5, NaN, NaN, NaN, 0.0, NaN, NaN, NaN, NaN, NaN, NaN, NaN, NaN, NaN, NaN, 0.5, -1.0, 0.0, NaN, NaN, NaN, -1.0, NaN, NaN, NaN, NaN, -1.0, NaN, NaN, NaN, NaN, NaN, NaN, NaN, NaN, NaN, NaN, 1.0, NaN, 0.5, NaN, 0.5, NaN, NaN, NaN, NaN, NaN, NaN, NaN, NaN, NaN, -0.5, NaN, NaN, NaN, NaN, NaN, NaN, NaN, NaN, NaN, NaN, -0.5, NaN",-0.025,-0.071,"ingratus, impius, fingo, crimen, hic, acerbitas, uiolo, hic, nefarius, corruptela, impunis, seruitus",0.085
cicero.pro_rege_deiotaro,31.0,"o, tempus, o, mos, gnaeus, domo, ille, qui, nos, puer, consul, censor, pontifex, magnus, uideo, cum, tribunus, plebs, marcus, scaurus, princeps, ciuitas, in, iudicium, populus, uoco, scaurus, seruus, ad, is, clam, domus, uenio, et, crimen, in, dominus, defero, sui, sum, dico, prehendo, homo, iubeo, ad, scaurus, deduco, uideo, quis, intersum, etsi, iniquus, castor, cum, domitius, comparo, sed, tamen, ille, inimicus, seruus, remitto, tu, ab, auus, abduco, ille, incorruptus, audio, nolo, tu, con-rumpo, ille, adiutor, seruus, contra, dominus, repudio, tu, etiam, accusator, adhibeo, at, semel, iste, sum, corrumpo, ab, tu",89,"NaN, 0.0, NaN, 0.5, NaN, NaN, NaN, NaN, NaN, 0.0, 0.5, NaN, NaN, 0.0, NaN, NaN, -0.5, 0.0, NaN, NaN, 0.5, 0.5, NaN, 0.5, 0.0, NaN, NaN, -0.5, NaN, NaN, NaN, 0.0, NaN, NaN, -1.0, NaN, NaN, NaN, NaN, NaN, NaN, NaN, 0.0, NaN, NaN, NaN, NaN, NaN, NaN, NaN, NaN, -1.0, NaN, NaN, NaN, NaN, NaN, NaN, NaN, -1.0, -0.5, NaN, NaN, NaN, NaN, NaN, NaN, 1.0, NaN, NaN, NaN, NaN, NaN, 0.0, -0.5, NaN, NaN, NaN, NaN, NaN, 0.0, NaN, NaN, NaN, NaN, NaN, NaN, NaN, NaN",-0.017,-0.056,"crimen, iniquus, tu, tu, tu, tu",0.067
cicero.pro_rege_deiotaro,32.0,"nonne, cum, sum, perduco, et, cum, cum, tu, sum, refugio, ad, legatus, nonne, ad, hic, gnaeus, domitius, uenio, nonne, audio, hic, ser., sulpicius, clarus, uir, qui, tum, casus, apud, domitius, ceno, et, hic, titus, torquatus, bonus, adulescens, sui, ab, tu, corrumpo, tuus, promitto, in, fraudo, impello, sum, confiteor, sum, qui, sum, iste, tam, impotens, tam, crudelis, tam, immoderatus, inhumanitas, idcirco, in, hic, urbs, uenio, ut, hic, urbs, ius, et, exemplum, corrumpo, domesticus, immanitas, noster, ciuitas, humanitas, inquinaris",77,"NaN, NaN, NaN, NaN, NaN, NaN, NaN, NaN, NaN, NaN, NaN, 0.0, NaN, NaN, NaN, NaN, NaN, NaN, NaN, NaN, NaN, NaN, NaN, 0.5, 0.5, NaN, NaN, 0.0, NaN, NaN, NaN, NaN, NaN, NaN, NaN, 1.0, NaN, NaN, NaN, NaN, NaN, 0.0, NaN, NaN, NaN, NaN, NaN, NaN, NaN, NaN, NaN, NaN, NaN, -1.0, NaN, -1.0, NaN, -1.0, 0.0, NaN, NaN, NaN, 0.5, NaN, NaN, NaN, 0.5, 0.5, NaN, 0.0, NaN, 0.0, -1.0, NaN, 0.5, 0.0, NaN",0.0,-0.052,"tu, hic, hic, hic, adulescens, tu, fraudo, impotens, crudelis, immoderatus, hic, hic, immanitas",0.169
cicero.pro_rege_deiotaro,33.0,"at, quam, acuo, collecta, crimen, blesamius, inquam, is, enim, nomen, bonus, uir, neque, tu, ignosco, malus, dico, tu, ad, rex, inquam, scribo, soleo, tu, in, inuidia, sum, tyrannus, existimo, statua, inter, rex, pono, animus, homo, uehemens, offendo, plaudo, tu, non, soleo, nonne, intellego, caesar, ex, urbanus, maleuolus, sermunculis, hic, ab, iste, sum, collecta, blesamius, tyrannus, caesar, scribo, multus, enim, caput, ciuis, uideo, multus, iussus, caesar, uexo, uerbero, neco, multus, affligo, et, euerro, domus, armo, miles, refercio, forum, qui, semper, in, ciuilis, uictoria, sentio, is, tu, uictor, non, uideo",88,"NaN, NaN, NaN, NaN, -1.0, NaN, NaN, NaN, NaN, 0.0, 1.0, 0.5, NaN, NaN, NaN, -1.0, NaN, NaN, NaN, 0.0, NaN, NaN, NaN, NaN, NaN, -1.0, NaN, NaN, NaN, NaN, NaN, 0.0, NaN, 0.5, 0.0, NaN, NaN, NaN, NaN, NaN, NaN, NaN, NaN, 0.5, NaN, 0.5, -1.0, NaN, NaN, NaN, NaN, NaN, NaN, NaN, NaN, 0.5, NaN, 0.0, NaN, 0.0, 0.5, NaN, 0.0, NaN, 0.5, NaN, NaN, NaN, 0.0, NaN, NaN, NaN, 0.0, NaN, 0.0, NaN, NaN, NaN, NaN, NaN, 0.5, NaN, NaN, NaN, NaN, NaN, NaN, NaN",0.011,-0.045,"crimen, tu, tu, tu, inuidia, tyrannus, tu, maleuolus, hic, tyrannus, uexo, uerbero, tu",0.148
cicero.pro_rege_deiotaro,34.0,"solus, inquam, sum, caius, caesar, qui, in, uictoria, caedo, nemo, nisi, armo, et, qui, nos, liber, in, summus, populus, romanus, libertas, nascor, non, modo, non, tyrannus, sed, etiam, clemens, in, uictoria, duco, is, blesamio, qui, uiuo, in, regnum, tyrannus, uideo, possum, nam, de, statua, quis, queror, unus, praesertim, cum, tam, multus, uideo, ualidus, enim, inuideo, sum, is, statuo, qui, tropaeum, non, inuideo, nam, si, locus, affero, inuidia, nullus, sum, ad, statua, quidem, rostrum, clarus, de, plaudo, autem, quis, respondeo, qui, neque, desidero, umquam, in, tu, sum, et, non, numquam, obstupefacio, homo, ipse, admiratio, comprimo, sum, et, fortasse, is, praetermitto, quia, nihil, uolgaris, tu, dignus, uideo, possum",106,"-0.5, NaN, NaN, NaN, 0.5, NaN, NaN, NaN, NaN, -0.5, NaN, NaN, NaN, NaN, NaN, 0.5, NaN, NaN, 0.0, NaN, 0.5, NaN, NaN, NaN, NaN, NaN, NaN, NaN, 1.0, NaN, NaN, NaN, NaN, NaN, NaN, NaN, NaN, 0.0, NaN, NaN, NaN, NaN, NaN, NaN, NaN, NaN, NaN, NaN, NaN, NaN, 0.0, NaN, 1.0, NaN, NaN, NaN, NaN, NaN, NaN, NaN, NaN, NaN, NaN, NaN, 0.0, NaN, -1.0, NaN, NaN, NaN, NaN, NaN, NaN, 0.5, NaN, NaN, NaN, NaN, NaN, NaN, NaN, NaN, NaN, NaN, NaN, NaN, NaN, NaN, NaN, NaN, 0.0, NaN, 0.5, NaN, NaN, NaN, NaN, NaN, NaN, NaN, NaN, -0.5, NaN, 1.0, NaN, NaN",0.028,-0.024,"tyrannus, tyrannus, inuidia, tu, tu",0.047
cicero.pro_rege_deiotaro,35.0,"nihil, ab, ego, arbitror, praetereo, sed, aliquis, ad, extremus, pars, causa, reseruo, is, autem, aliquis, quis, sum, tu, ut, planus, deiotaro, reconcilio, oratio, meus, non, enim, iam, metuo, ne, ille, tu, suscenseo, ille, uereor, ne, tu, ille, suscenseo, aliquis, suspicio, qui, absum, longus, ego, credo, caesar, quis, enim, retineo, per, tu, memini, non, quis, amitto, neque, sui, ab, tu, multas, arbitror, sed, cum, existimaris, multus, tu, multus, sum, tribuo, quo, paruus, ab, sui, qui, in, alter, pars, sum, is, sumo, non, recuso",82,"NaN, NaN, NaN, NaN, NaN, NaN, NaN, NaN, NaN, 0.0, 0.0, NaN, NaN, NaN, NaN, NaN, NaN, NaN, NaN, 0.0, NaN, NaN, -0.5, 0.0, NaN, NaN, NaN, NaN, NaN, NaN, NaN, NaN, NaN, NaN, NaN, NaN, NaN, NaN, NaN, -0.5, NaN, NaN, 0.0, NaN, NaN, 0.5, NaN, NaN, NaN, NaN, NaN, NaN, NaN, NaN, NaN, NaN, NaN, NaN, NaN, NaN, NaN, NaN, NaN, NaN, 0.0, NaN, 0.0, NaN, NaN, NaN, 0.0, NaN, NaN, NaN, NaN, NaN, 0.0, NaN, NaN, NaN, NaN, NaN",-0.006,-0.012,"tu, tu, tu, tu, tu, tu",0.073
cicero.pro_rege_deiotaro,36.0,"etenim, si, antiochus, magnus, ille, rex, asia, cum, postea, quam, ab, lucius, scipio, deuinco, taurus, tenus, regno, iubeo, sum, omnis, hic, asia, qui, sum, nunc, noster, prouincia, amitto, dico, sum, soleo, benignus, sui, ab, populus, romanus, sum, facio, qui, nimis, magnus, procuratio, libero, modicus, regnum, terminus, uto, possum, multus, facilis, hic, sui, deiotarus, consolaris, ille, enim, furor, multa, tollo, hic, error, omnis, tu, deiotaro, caesar, tribuo, cum, et, ipse, et, filius, nomen, regius, concedo, hic, nomen, retendo, atque, seruo, nullus, beneficium, populus, romanus, nullus, iudicium, de, sui, senatus, imminuo, puto, magnus, animus, et, erigo, sum, neque, umquam, succumbo, inimicus, ne, fortuna, quidem",102,"NaN, NaN, NaN, 0.0, NaN, 0.0, NaN, NaN, NaN, NaN, NaN, NaN, NaN, NaN, NaN, NaN, NaN, NaN, NaN, NaN, NaN, NaN, NaN, NaN, NaN, NaN, 0.0, NaN, NaN, NaN, NaN, 1.0, NaN, NaN, 0.0, NaN, NaN, NaN, NaN, NaN, 0.0, NaN, NaN, 0.0, 0.0, 0.0, NaN, NaN, 0.0, 0.5, NaN, NaN, NaN, NaN, NaN, NaN, -1.0, NaN, NaN, NaN, -1.0, NaN, NaN, NaN, 0.5, NaN, NaN, NaN, NaN, NaN, 0.0, 0.0, 0.0, NaN, NaN, 0.0, NaN, NaN, NaN, NaN, 1.0, 0.0, NaN, NaN, 0.5, NaN, NaN, 0.5, NaN, NaN, 0.0, 0.5, NaN, NaN, NaN, NaN, NaN, NaN, -1.0, NaN, 0.0, NaN",0.015,-0.029,"hic, hic, furor, hic, tu, hic",0.059
cicero.pro_rege_deiotaro,37.0,"multus, sui, arbitror, et, pario, ante, facio, et, habeo, in, animus, atque, uirtus, qui, nullus, modo, possum, amitto, qui, enim, fortuna, aut, quis, casus, aut, qui, tantus, possum, iniuria, omnis, imperator, de, deiotaro, decretum, deleo, ab, omnis, sum, enim, is, orno, qui, postea, quam, in, castrum, sum, possum, per, aetas, in, asia, cappadocia, pontus, cilicium, syria, bellum, gero, senatus, uerus, iudicium, de, ille, tam, multus, tam, honorifico, qui, publicus, populus, romanus, littera, monumentum, consigno, sum, qui, umquam, uetustus, obruo, aut, qui, tantus, deleo, obliuio, quis, de, uirtus, is, dico, de, magnitudo, animus, grauitas, constantia, qui, omnis, doceo, atque, sapio, summus, quidam, etiam, bonus, solus, sum, dico, is, non, modo, ad, bene, sed, etiam, ad, beatus, uiuo, contendo, sum, uirtus",119,"0.0, NaN, NaN, NaN, NaN, NaN, NaN, NaN, NaN, NaN, 0.5, NaN, 1.0, NaN, NaN, NaN, NaN, NaN, NaN, NaN, 0.0, NaN, NaN, 0.0, NaN, NaN, NaN, NaN, -1.0, NaN, 0.5, NaN, NaN, NaN, NaN, NaN, NaN, NaN, NaN, NaN, NaN, NaN, NaN, NaN, NaN, NaN, NaN, NaN, NaN, 0.0, NaN, NaN, NaN, 0.0, NaN, NaN, 0.0, NaN, 0.5, 0.5, 0.5, NaN, NaN, NaN, 0.0, NaN, NaN, NaN, 0.0, 0.0, NaN, 0.0, NaN, NaN, NaN, NaN, NaN, 0.0, NaN, NaN, NaN, NaN, NaN, -0.5, NaN, NaN, 1.0, NaN, NaN, NaN, 0.0, 0.5, -0.5, 0.5, NaN, NaN, NaN, NaN, NaN, NaN, NaN, NaN, 1.0, -0.5, NaN, NaN, NaN, NaN, NaN, NaN, NaN, NaN, NaN, NaN, 1.0, NaN, NaN, NaN, 1.0",0.05,-0.021,,0.0
cicero.pro_rege_deiotaro,38.0,"hic, ille, reputo, et, dies, nox, cogito, non, modo, tu, non, suscenseo, sum, enim, non, solus, ingratus, sed, etiam, amens, uerus, omnis, tranquillitas, et, quies, senectus, refero, accipio, clementia, tuus, quo, quidem, animus, cum, antea, sum, tum, non, dubito, quin, tuus, littera, qui, exemplum, lego, qui, ad, is, tarraco, hic, blesamio, do, sui, magis, etiam, erigo, ab, omne, sollicitudo, abstraho, iubeo, enim, is, bene, spero, et, bonus, sum, animus, qui, scio, tu, non, frustra, scribo, soleo, memini, enim, idem, fere, uerbum, ad, ego, tu, scribo, ego, tuus, littera, bene, spero, non, frustra, sum, iubeo",94,"NaN, NaN, NaN, NaN, 0.0, 0.0, NaN, NaN, NaN, NaN, NaN, NaN, NaN, NaN, NaN, -0.5, -1.0, NaN, NaN, -1.0, 0.5, NaN, NaN, NaN, NaN, 0.0, NaN, NaN, 1.0, 0.0, NaN, NaN, 0.5, NaN, NaN, NaN, NaN, NaN, NaN, NaN, 0.0, 0.0, NaN, 0.0, NaN, NaN, NaN, NaN, NaN, NaN, NaN, NaN, NaN, NaN, NaN, NaN, NaN, NaN, -0.5, NaN, NaN, NaN, NaN, NaN, NaN, NaN, 1.0, NaN, 0.5, NaN, NaN, NaN, NaN, NaN, NaN, NaN, NaN, NaN, NaN, NaN, 0.0, NaN, NaN, NaN, NaN, NaN, 0.0, 0.0, NaN, NaN, NaN, NaN, NaN, NaN",0.005,-0.032,"hic, tu, ingratus, amens, hic, tu, tu",0.074
cicero.pro_rege_deiotaro,39.0,"laboro, equidem, rex, deiotaris, causa, cum, quo, ego, amicitia, res, publicus, concilio, hospitium, uoluntas, uterque, coniungo, familiaritas, consuetudo, affero, summa, uerus, necessitudo, magnus, is, officium, in, ego, et, in, exercitus, meus, efficio, sed, cum, de, ille, laboro, tum, de, multus, amplus, uis, qui, semel, ignotus, ab, tu, sum, oportet, neque, tuus, beneficium, in, dubius, uocaris, neque, haereo, in, animus, homo, sollicitudo, sempiternus, neque, accido, ut, quisquam, tu, timeo, incipio, is, qui, sum, semel, ab, tu, libero, timor, non, debeo",79,"NaN, NaN, 0.0, NaN, 0.0, NaN, NaN, NaN, 1.0, 0.0, 0.0, NaN, 0.0, 0.0, NaN, NaN, 0.5, NaN, NaN, NaN, 0.5, NaN, 0.0, NaN, 0.5, NaN, NaN, NaN, NaN, 0.0, 0.0, NaN, NaN, NaN, NaN, NaN, NaN, NaN, NaN, 0.0, 0.0, 1.0, NaN, NaN, -0.5, NaN, NaN, NaN, NaN, NaN, 0.0, 1.0, NaN, -0.5, NaN, NaN, NaN, NaN, 0.5, 0.0, -0.5, NaN, NaN, NaN, NaN, NaN, NaN, NaN, NaN, NaN, NaN, NaN, NaN, NaN, NaN, NaN, -0.5, NaN, NaN",0.038,-0.025,"tu, tu, tu",0.038
cicero.pro_rege_deiotaro,40.0,"caesar, qui, fio, soleo, in, tantus, periculum, tento, ecquonam, modo, dico, misericordia, tuus, commoueo, possum, nihil, opus, sum, occurro, soleo, ipse, supplex, et, calamitosus, nullus, oratio, euoco, propono, tu, duo, rex, et, is, animus, contemplaris, qui, oculus, non, possum, do, profecto, is, misericordia, qui, iracundia, denego, multus, sum, monumentum, clementia, tuus, sed, magnus, is, incolumitas, qui, salus, do, qui, si, in, priuo, gloriosus, sum, multus, magis, commemoro, in, rex, semper, regius, nomen, in, hic, ciuitas, sancio, sum, socius, uerus, rex, et, amicus, sancio, qui, nomen, hic, rex, ne, amitto, tu, uictor, timeo",92,"0.5, NaN, NaN, NaN, NaN, NaN, -1.0, NaN, NaN, NaN, NaN, 1.0, 0.0, NaN, NaN, NaN, 0.5, NaN, NaN, NaN, NaN, 0.0, NaN, -1.0, NaN, -0.5, NaN, NaN, NaN, NaN, 0.0, NaN, NaN, 0.5, NaN, NaN, 0.0, NaN, NaN, NaN, NaN, NaN, 1.0, NaN, -1.0, NaN, 0.0, NaN, NaN, 1.0, 0.0, NaN, 0.0, NaN, -0.5, NaN, 1.0, NaN, NaN, NaN, NaN, NaN, NaN, NaN, 0.0, NaN, NaN, NaN, 0.0, NaN, 0.0, 0.0, NaN, NaN, 0.5, NaN, NaN, 1.0, 0.5, 0.0, NaN, 1.0, NaN, NaN, 0.0, NaN, 0.0, NaN, NaN, NaN, NaN, NaN",0.049,-0.043,"calamitosus, tu, hic, hic, tu",0.054
cicero.pro_rege_deiotaro,41.0,"retendo, uerus, et, ab, tu, confirmo, posterus, etiam, suus, trado, sui, sum, confido, corpus, suus, pro, salus, rex, suus, hic, legatus, regius, trado, hiera, et, blesamius, et, antigonus, tu, nos, omnis, iam, diu, nosco, idem, fides, et, uirtus, praeditus, dorylaus, qui, nuper, cum, hiera, legatus, sum, ad, tu, mitto, cum, rex, amicus, tum, tu, etiam, ut, spero, probo",58,"NaN, 0.5, NaN, NaN, NaN, NaN, 0.0, NaN, NaN, NaN, NaN, NaN, NaN, 0.0, NaN, NaN, 1.0, 0.0, NaN, NaN, 0.0, 0.0, NaN, NaN, NaN, NaN, NaN, NaN, NaN, NaN, NaN, NaN, NaN, NaN, NaN, 1.0, NaN, 1.0, 0.5, NaN, NaN, NaN, NaN, NaN, 0.0, NaN, NaN, NaN, NaN, NaN, 0.0, 1.0, NaN, NaN, NaN, NaN, NaN, NaN",0.086,0.0,"tu, hic, tu, tu, tu",0.086
cicero.pro_rege_deiotaro,42.0,"exquiro, de, blesamio, num, quis, ad, rex, contra, dignitas, tuus, scribo, hiera, quidem, causa, omnis, suscipio, et, crimen, ille, pro, rex, sui, suppono, reus, memoria, tuus, imploro, qui, ual, multus, nego, umquam, sui, ab, tu, in, deiotaris, tetrarchia, pedis, discedo, in, primus, finis, tu, praesto, sui, sum, dico, usque, ad, ulter, prosequor, cum, e, balneum, exeo, cum, tu, sui, sum, cum, ille, munus, inspicio, ceno, cum, in, cubiculum, recumbo, idem, adsiduitas, tu, sui, praebeo, postridie",75,"NaN, NaN, NaN, NaN, NaN, NaN, 0.0, NaN, 1.0, 0.0, NaN, NaN, NaN, 0.0, NaN, NaN, NaN, -1.0, NaN, NaN, 0.0, NaN, NaN, NaN, 1.0, 0.0, NaN, NaN, NaN, 0.0, NaN, NaN, NaN, NaN, NaN, NaN, NaN, NaN, 0.0, NaN, NaN, 0.5, 0.0, NaN, NaN, NaN, NaN, NaN, NaN, NaN, NaN, NaN, NaN, NaN, NaN, NaN, NaN, NaN, NaN, NaN, NaN, NaN, 0.5, NaN, NaN, NaN, NaN, NaN, NaN, NaN, 0.5, NaN, NaN, NaN, NaN",0.033,-0.013,"crimen, reus, tu, tu, tu, tu",0.08
cicero.pro_rege_deiotaro,43.0,"quam, ob, res, si, quis, is, qui, obiecto, sum, cogitas, sum, non, recuso, quin, is, suus, facinus, iudex, quocirca, caius, caesar, uolo, existimo, hodiernus, dies, sententia, tuus, aut, cum, superus, dedecor, miser, pestis, importo, sum, rex, aut, incolumis, fama, cum, salus, qui, alter, optaris, ille, crudelitas, sum, alter, conseruaris, clementia, tuus",51,"NaN, NaN, 0.0, NaN, NaN, NaN, NaN, NaN, NaN, NaN, NaN, NaN, NaN, NaN, NaN, NaN, -1.0, 0.5, NaN, NaN, 0.5, NaN, NaN, NaN, 0.0, 0.0, 0.0, NaN, NaN, NaN, NaN, -1.0, -1.0, NaN, NaN, 0.0, NaN, -0.5, 1.0, NaN, 1.0, NaN, NaN, NaN, NaN, -1.0, NaN, NaN, NaN, 1.0, 0.0",-0.01,-0.088,"facinus, dedecor, miser, pestis, crudelitas",0.098
