Text,Stelle,Inahlt,Wortzahl,Sentiment Rechnung,Sentiment-Score,alternativer Sentiment-Score,Invektiven,Invektivitäts-Score
cicero.topica,60.0,"qui, res, cum, in, disputatio, incido, causa, efficio, aliquis, necessarius, sine, dubitatio, liceo, qui, efficio, ab, is, caiisa, concludo, cum, autem, sum, talis, causa, ut, in, is, non, sum, efficio, necessitas, necessarius, conclusio, non, sequor, atque, ille, quidem, genus, causaris, qui, habeo, uis, efficio, necessaria, error, affero, non, fere, soleo, hic, autem, sine, quo, non, efficio, saepe, conturbo, non, enim, si, sine, parens, filius, sum, non, possum, propterea, in, parens, causa, sum, gigno, necessarius",74,"NaN, 0.0, NaN, NaN, NaN, NaN, 0.0, NaN, NaN, 0.0, NaN, NaN, NaN, NaN, NaN, NaN, NaN, NaN, NaN, NaN, NaN, NaN, NaN, 0.0, NaN, NaN, NaN, NaN, NaN, NaN, NaN, 0.0, 0.0, NaN, NaN, NaN, NaN, NaN, 0.0, NaN, NaN, NaN, 1.0, NaN, NaN, -1.0, NaN, NaN, NaN, NaN, NaN, NaN, NaN, NaN, NaN, NaN, NaN, NaN, NaN, NaN, NaN, NaN, 0.5, 0.0, NaN, NaN, NaN, NaN, NaN, 0.5, 0.0, NaN, NaN, 0.0",0.014,-0.014,hic,0.014
cicero.topica,61.0,"hic, igitur, sine, quo, non, fio, ab, is, in, quo, certus, fio, diligenter, sum, separo, ille, enim, sum, tamquam, utinam, ne, in, nemus, pelio, nisi, enim, accido, abiegnus, ad, terra, trabs, argus, ille, facio, non, sum, neque, tamen, sum, in, hic, trabs, efficio, uolo, necessarius, at, cum, in, a-iacio, nauis, crispisulcans, igneus, fulmen, iniectus, sum, inflammo, nauus, necessarius",58,"NaN, NaN, NaN, NaN, NaN, NaN, NaN, NaN, NaN, NaN, 0.5, NaN, NaN, NaN, NaN, NaN, NaN, NaN, NaN, NaN, NaN, NaN, NaN, NaN, NaN, NaN, NaN, NaN, NaN, 0.0, 0.0, NaN, NaN, NaN, NaN, NaN, NaN, NaN, NaN, NaN, NaN, 0.0, NaN, NaN, 0.0, NaN, NaN, NaN, NaN, 0.0, NaN, 0.0, NaN, NaN, NaN, NaN, NaN, 0.0",0.009,0.0,"hic, hic, inflammo",0.052
cicero.topica,62.0,"atque, etiam, sum, causaris, dissimilitudo, qui, alius, sum, ut, sine, ullus, appetitio, animus, sine, uoluntas, sine, opinio, suus, quasi, opus, efficio, uel, ut, omnis, intereo, qui, orior, sum, alius, autem, aut, uoluntas, efficio, aut, perturbatio, animus, aut, habitus, aut, natura, aut, ars, aut, casus, uoluntas, ut, tu, cum, hic, libellus, lex, perturbatio, -ne, ut, si, quis, euenio, hic, tempus, timeo, habitus, ut, qui, facilis, et, cito, irascor, natura, ut, uitium, in, dies, cresco, ars, ut, bene, pingo, casus, ut, prosperus, nauigo, nihil, hic, sine, causa, neque, quisquam, omnino, sed, hic, modus, causa, non, necessaria",94,"NaN, NaN, NaN, NaN, NaN, NaN, NaN, NaN, NaN, NaN, NaN, NaN, 0.5, NaN, 0.0, NaN, 0.0, NaN, NaN, 0.5, NaN, NaN, NaN, NaN, NaN, NaN, NaN, NaN, NaN, NaN, NaN, 0.0, NaN, NaN, -0.5, 0.5, NaN, NaN, NaN, 0.0, NaN, 0.0, NaN, 0.0, 0.0, NaN, NaN, NaN, NaN, 0.0, 0.5, -0.5, NaN, NaN, NaN, NaN, NaN, NaN, 0.0, NaN, NaN, NaN, NaN, 0.5, NaN, NaN, NaN, 0.0, NaN, -1.0, NaN, 0.0, NaN, 0.0, NaN, NaN, NaN, 0.0, NaN, 1.0, NaN, NaN, NaN, NaN, 0.0, NaN, NaN, NaN, NaN, NaN, 0.5, 0.0, NaN, NaN",0.021,-0.021,"tu, hic, hic, hic, hic",0.053
cicero.topica,63.0,"omnis, autem, causaris, in, alius, insum, co, -ne, sto, in, alius, non, insum, in, natura, et, in, ars, constantia, sum, in, ceterus, nullus, sed, tamen, is, causaris, qui, non, sum, consto, alius, sum, perspicuus, alius, lateo, perspicuus, sum, qui, appetitio, animus, iudicium, tango, lateo, qui, sub-iacio, sum, fortuna, cum, enim, nihil, sine, causa, fio, hic, ipse, sum, fortuna, euenio, obscurus, causa, et, latenter, efficio, etiam, is, qui, fio, pars, sum, ignoro, pars, uoluntarius, ignoro, qui, necessitas, efficio, sum, uoluntarius, qui, consilium",81,"NaN, NaN, NaN, NaN, NaN, NaN, NaN, NaN, NaN, NaN, NaN, NaN, NaN, NaN, 0.0, NaN, NaN, 0.0, 0.5, NaN, NaN, 0.0, NaN, NaN, NaN, NaN, NaN, NaN, NaN, NaN, NaN, NaN, NaN, NaN, NaN, NaN, NaN, NaN, NaN, NaN, 0.5, 0.5, NaN, NaN, NaN, NaN, NaN, 0.0, NaN, NaN, NaN, NaN, 0.0, NaN, NaN, NaN, NaN, 0.0, NaN, NaN, 0.0, NaN, NaN, NaN, NaN, NaN, NaN, NaN, 0.0, NaN, NaN, 0.0, 0.0, NaN, NaN, NaN, NaN, NaN, 0.0, NaN, 0.5",0.025,0.0,hic,0.012
cicero.topica,64.0,"qui, autem, fortuna, uel, ignoro, uel, uoluntarius, nam, iacio, telis, uoluntas, sum, ferio, qui, nolo, fortuna, ex, quo, aries, subicitur, ille, in, uester, actio, si, telum, manu, fugit, magis, quam, iacio, cado, etiam, in, ignoro, tio, atque, imprudentia, perturbatio, animus, qui, quamquam, sum, uoluntarius, obiurgatio, enim, et, admeo, -ne, itio, deicio, tamen, habeo, tantbs, moueo, ut, is, qui, uoluntarius, sum, aut, necessarius, interdum, aut, certus, ignoro, uideo",67,"NaN, NaN, 0.0, NaN, NaN, NaN, 0.0, NaN, NaN, NaN, 0.0, NaN, NaN, NaN, NaN, 0.0, NaN, NaN, NaN, NaN, NaN, NaN, NaN, NaN, NaN, NaN, NaN, NaN, NaN, NaN, NaN, NaN, NaN, NaN, NaN, NaN, NaN, -0.5, -0.5, 0.5, NaN, NaN, NaN, 0.0, -1.0, NaN, NaN, NaN, NaN, NaN, NaN, NaN, NaN, NaN, NaN, NaN, NaN, NaN, 0.0, NaN, NaN, 0.0, NaN, NaN, 0.5, NaN, NaN",-0.015,-0.03,,0.0
cicero.topica,65.0,"totus, igitur, locus, causaris, explico, ex, is, differentia, in, magnus, quidem, causa, uel, orator, uel, philosophus, magnus, argumentor, suppeto, copia, in, uester, autem, si, non, uber, at, fortasse, subtilis, priuo, enim, iudicium, maximaris, quidem, res, in, ius, consultor, ego, uideo, sum, prudentia, nam, et, adsum, multus, et, adhibeo, in, consilium, et, patronus, diligo, ad, is, prudentia, confugio, hasta, ministro",59,"NaN, NaN, 0.0, NaN, NaN, NaN, NaN, NaN, NaN, 0.0, NaN, 0.0, NaN, NaN, NaN, 0.0, 0.0, NaN, NaN, 0.5, NaN, NaN, NaN, NaN, NaN, 1.0, NaN, NaN, NaN, NaN, NaN, 0.5, NaN, NaN, 0.0, NaN, 0.5, NaN, NaN, NaN, NaN, 0.5, NaN, NaN, NaN, 0.0, NaN, NaN, NaN, 0.5, NaN, NaN, NaN, NaN, NaN, 0.5, NaN, NaN, NaN",0.068,0.0,,0.0
cicero.topica,66.0,"in, omnis, igitur, is, iudicium, in, qui, ex, fides, bonus, sum, addo, ubi, uerus, etiam, ut, inter, bonus, bene, ago, oportet, in, primus, in, arbitrium, res, uxorius, in, quo, sum, quod, eius, aequius, melius, paro, is, sum, debeo, ille, dolus, malus, ille, fides, bonus, ille, aequus, bonus, ille, quis, socius, socius, quis, is, qui, negotium, alienus, curo, is, qui, is, negotium, sum, quis, is, qui, mando, is, qui, mando, sum, alter, alter, praesto, oportet, quis, uir, uxor, quis, uxor, uir, trado, liceo, igitur, diligenter, argumentor, cognosco, locus, non, modo, orator, et, philosophus, sed, ius, etiam, peritus, copiosus, de, consultatio, suus, disputaris",101,"NaN, NaN, NaN, NaN, 0.5, NaN, NaN, NaN, 1.0, 1.0, NaN, NaN, NaN, 0.5, NaN, NaN, NaN, 1.0, NaN, NaN, NaN, NaN, 0.5, NaN, NaN, 0.0, NaN, NaN, NaN, NaN, NaN, NaN, NaN, NaN, NaN, NaN, NaN, NaN, NaN, NaN, -1.0, NaN, 1.0, 1.0, NaN, 0.5, 1.0, NaN, NaN, 1.0, 1.0, NaN, NaN, NaN, -0.5, -0.5, NaN, NaN, NaN, NaN, -0.5, NaN, NaN, NaN, NaN, NaN, NaN, NaN, NaN, NaN, NaN, NaN, NaN, NaN, NaN, 0.5, 0.0, NaN, 0.0, 0.5, NaN, NaN, NaN, NaN, NaN, NaN, 0.0, NaN, NaN, NaN, NaN, 0.0, NaN, 0.5, NaN, NaN, 1.0, NaN, NaN, NaN, NaN",0.099,-0.025,"dolus, uxor, uxor",0.03
cicero.topica,67.0,"coniungo, hic, causaris, locus, ille, locus, sum, qui, efficio, ex, causa, ut, enim, causa, quis, sum, efficio, indico, sic, qui, efficio, sum, qui, sum, causa, demonstro, hic, locus, suppeditaris, soleo, orator, et, poeta, saepe, etiam, philosophus, sed, is, qui, orno, et, copiosus, loquor, possum, mirabilis, copia, dico, cum, denuntio, quis, ex, quisque, res, sum, sum, causaris, enim, cognitio, cognitio, ex, -ne, torus, facio",63,"NaN, NaN, NaN, 0.0, NaN, 0.0, NaN, NaN, NaN, NaN, 0.0, NaN, NaN, 0.0, NaN, NaN, NaN, NaN, NaN, NaN, NaN, NaN, NaN, NaN, 0.0, NaN, NaN, 0.0, NaN, NaN, NaN, NaN, 0.0, NaN, NaN, 0.0, NaN, NaN, NaN, NaN, NaN, 1.0, NaN, NaN, NaN, 0.5, NaN, NaN, NaN, NaN, NaN, NaN, 0.0, NaN, NaN, NaN, NaN, 0.5, 0.5, NaN, NaN, NaN, NaN",0.04,0.0,"hic, hic",0.032
cicero.topica,68.0,"reliquus, sum, comparatio, locus, qui, genus, et, ex, emplum, supra, pono, sum, ut, ceterus, nunc, explico, tractatio, sum, comparo, igitur, is, qui, aut, magnus, aut, paruus, aut, par, dico, in, qui, specto, hic, numerus, species, uolo, quidam, etiam, ad, res, aliqui, affectio",42,"0.0, NaN, 0.0, 0.0, NaN, 0.0, NaN, NaN, NaN, NaN, NaN, NaN, NaN, 0.0, NaN, NaN, NaN, NaN, NaN, NaN, NaN, NaN, NaN, 0.0, NaN, 0.0, NaN, 0.5, NaN, NaN, NaN, NaN, NaN, NaN, NaN, NaN, NaN, NaN, NaN, 0.0, NaN, 0.0",0.012,0.0,hic,0.024
cicero.topica,69.0,"numerus, sic, comparo, multus, bonus, ut, paucus, bonus, antepono, paucus, malus, malus, multus, diuturnus, bonus, breuis, longus, et, latus, peruagor, angustus, ex, qui, multus, bonus, propago, quisque, multus, imito, et, facio, species, autem, comparo, ut, antepono, qui, propter, sui, expeto, sum, is, qui, propter, alius, et, ut, innato, atque, inquiro, ad-sumo, atque, aduenticius, integer, contamino, iucundus, paruus, iucundus, honestus, ipse, etiam, utilis, pro, cliuia, laboriosus, necessarius, non, necessarius, suus, alienus, rarus, uulgaris, desiderabilis, is, qui, facilis, careo, possum, perficio, incoho, totus, pars, ratio, uto, ratio, experior, bus, uoluntarius, necessarius, animo, inanimus, naturale, non, natural, artificiosus, non, artificiosus",97,"NaN, NaN, NaN, 0.0, 1.0, NaN, 0.0, 1.0, NaN, 0.0, -1.0, -1.0, 0.0, 0.5, 1.0, NaN, 0.0, NaN, NaN, NaN, NaN, NaN, NaN, 0.0, 1.0, 0.0, NaN, 0.0, NaN, NaN, NaN, NaN, NaN, NaN, NaN, NaN, NaN, NaN, NaN, NaN, NaN, NaN, NaN, NaN, NaN, NaN, NaN, NaN, NaN, NaN, NaN, NaN, NaN, 0.5, NaN, 1.0, 0.0, 1.0, 1.0, NaN, NaN, 1.0, NaN, NaN, NaN, 0.0, NaN, 0.0, NaN, -0.5, NaN, -0.5, 0.5, NaN, NaN, 0.5, NaN, NaN, NaN, NaN, NaN, 0.0, 0.0, NaN, 0.0, NaN, NaN, 0.0, 0.0, NaN, -0.5, 0.0, NaN, NaN, NaN, NaN, NaN",0.067,-0.036,"honestus, laboriosus, inanimus",0.031
cicero.topica,70.0,"uolo, autem, in, com, paratio, sic, cemitur, efficio, causa, grauis, quam, non, efficio, qui, sui, ipse, contineo, sum, bonus, quam, qui, egeo, alius, qui, in, noster, quam, qui, in, alius, potestas, sum, stabilis, incertus, qui, eripio, non, possum, is, qui, possum, affectio, autem, ad, res, aliqui, sum, hic, modus, princeps, commodus, magnus, quam, reliquus, ito, qui, iucundus, os, qui, multus, probo, qui, ab, bonus, quoque, laudo, atque, ut, hic, in, comparatio, bonus, sic, deterior, qui, is, sum, contrarius",78,"NaN, NaN, NaN, NaN, NaN, NaN, NaN, NaN, 0.0, -0.5, NaN, NaN, NaN, NaN, NaN, NaN, NaN, NaN, 1.0, NaN, NaN, NaN, NaN, NaN, NaN, NaN, NaN, NaN, NaN, NaN, 0.5, NaN, 0.5, -0.5, NaN, NaN, NaN, NaN, NaN, NaN, NaN, 0.0, NaN, NaN, 0.0, NaN, NaN, NaN, 0.5, 0.5, 0.5, 0.0, NaN, 0.0, NaN, NaN, 1.0, 0.0, NaN, 0.0, NaN, NaN, NaN, 1.0, NaN, NaN, NaN, NaN, NaN, NaN, 0.0, 1.0, NaN, -1.0, NaN, NaN, NaN, NaN",0.058,-0.026,"hic, hic",0.026
cicero.topica,71.0,"par, autem, comparatio, neque, elatio, habeo, neque, summissio, sum, enim, aequalis, multus, autem, sum, qui, aequalitas, ipse, comparo, qui, ita, fere, co, -ne, cluduntur, si, consilium, iuuaris, ciuis, et, auxilium, aequus, in, laus, pono, sum, par, gloria, debeo, sum, is, qui, consu, lunt, et, is, qui, defendo, at, qui, primus, sum, qui, sequor, igitur, perficio, sum, omnis, argumentor, inuenie, -ne, doron, praeceptio, ut, cum, proficiscor, sum, ab, definitio, ab, partitio, ab, notatio, ab, coniugo, ab, genus, ab, forma, ab, similitudo, ab, differentia, ab, contrarius, ab, adiungo, ab, consequor, ab, antecedo, ab, repugno, ab, causa, ab, efficio, ab, comparatio, magnus, paruus, par, nullus, praeterea, sedes, argumentum, quaero, sum",107,"0.5, NaN, 0.0, NaN, NaN, NaN, NaN, NaN, NaN, NaN, 0.5, 0.0, NaN, NaN, NaN, 0.5, NaN, NaN, NaN, NaN, NaN, NaN, NaN, NaN, NaN, 0.5, NaN, 0.5, NaN, 0.0, 0.5, NaN, 1.0, NaN, NaN, 0.5, 0.0, NaN, NaN, NaN, NaN, NaN, NaN, NaN, NaN, NaN, NaN, NaN, NaN, 0.5, NaN, NaN, NaN, NaN, NaN, NaN, NaN, NaN, NaN, NaN, NaN, NaN, NaN, NaN, NaN, NaN, NaN, NaN, NaN, NaN, NaN, 0.0, NaN, NaN, NaN, 0.0, NaN, 1.0, NaN, 0.0, NaN, NaN, NaN, NaN, NaN, NaN, NaN, NaN, NaN, NaN, NaN, NaN, NaN, 0.0, NaN, NaN, NaN, 0.0, 0.0, 0.0, 0.5, NaN, NaN, 0.0, 0.0, NaN, NaN",0.061,0.0,,0.0
cicero.topica,72.0,"sed, quoniam, ita, ab, principium, diuido, ut, alius, locus, dico, in, is, ipse, de, quo, ambago, haereo, de, qui, satis, sum, dico, alius, ad-sumo, extrinsecus, de, is, paucus, dico, etsi, is, nihil, omnino, ad, uester, disputatio, pertineo, sed, tamen, totus, res, efficio, quandoquidem, coepio, neque, enim, tu, is, sum, qui, nihil, nisi, ius, ciuilis, delecto, et, quoniam, hic, ita, ad, tu, scribo, ut, etiam, in, alius, manus, sum, uenio, do, opus, ut, quam, multus, is, qui, recta, studium, delecto, prosum, possum",81,"NaN, NaN, NaN, NaN, NaN, NaN, NaN, NaN, 0.0, NaN, NaN, NaN, NaN, NaN, NaN, NaN, NaN, NaN, NaN, 0.5, NaN, NaN, NaN, NaN, NaN, NaN, NaN, 0.0, NaN, NaN, NaN, NaN, NaN, NaN, NaN, NaN, NaN, NaN, NaN, NaN, 0.0, NaN, NaN, NaN, NaN, NaN, NaN, NaN, NaN, NaN, NaN, NaN, 0.5, 0.5, NaN, NaN, NaN, NaN, NaN, NaN, NaN, NaN, NaN, NaN, NaN, NaN, 0.0, NaN, NaN, NaN, 0.5, NaN, NaN, 0.0, NaN, NaN, NaN, 0.5, NaN, NaN, NaN",0.031,0.0,"tu, hic, tu",0.037
cicero.topica,73.0,"hic, ergo, argumentatio, qui, dico, ars, expers, in, testimonium, pono, sum, testimonium, autem, nunc, dico, omnis, qui, ab, aliqui, res, externus, sumo, ad, facio, fides, persono, autem, non, qualiscumque, sum, testimonium, pondus, habeo, ad, fides, enim, facio, auctoritas, quaero, sed, auctoritas, aut, natura, aut, tempus, affero, natura, auctoritas, in, uirtus, insum, maximus, in, tempus, autem, multus, sum, qui, affero, auctoritas, ingenium, ops, aetas, fortuna, ars, utor, necessitas, concursio, etiam, non, numquam, res, fortuitaris, nam, et, ingeniosus, et, opulentus, et, aetas, spatium, probo, dignus, qui, credo, puto, non, rectus, fortasse, sed, uulgus, opinio, muto, uix, possum, ad, eo, omnis, dirigo, et, qui, iudico, et, qui, existimo, qui, enim, res, hic, qui, dico, excello, ipse, uirtus, uideo, excello",116,"NaN, NaN, NaN, NaN, NaN, 0.0, NaN, NaN, NaN, NaN, NaN, NaN, NaN, NaN, NaN, NaN, NaN, NaN, NaN, 0.0, 0.0, NaN, NaN, NaN, 1.0, NaN, NaN, NaN, NaN, NaN, NaN, NaN, NaN, NaN, 1.0, NaN, NaN, NaN, NaN, NaN, NaN, NaN, 0.0, NaN, 0.0, NaN, 0.0, NaN, NaN, 1.0, NaN, NaN, NaN, 0.0, NaN, 0.0, NaN, NaN, NaN, NaN, 0.5, 0.0, 0.0, 0.0, 0.0, NaN, NaN, NaN, NaN, NaN, NaN, 0.0, NaN, NaN, NaN, 1.0, NaN, NaN, NaN, 0.0, NaN, NaN, 1.0, NaN, NaN, NaN, NaN, 1.0, NaN, NaN, 0.0, 0.0, NaN, NaN, NaN, NaN, NaN, NaN, NaN, NaN, NaN, NaN, NaN, NaN, NaN, NaN, NaN, 0.0, NaN, NaN, NaN, NaN, NaN, 1.0, NaN, NaN",0.065,0.0,"hic, hic",0.017
cicero.topica,74.0,"sed, reliquus, quoque, res, qui, modo, enumero, quam, quam, in, hic, nullus, species, uirtus, sum, tamen, interdum, confirmo, fides, si, aut, ars, quidam, adhibeo, magnus, sum, enim, uolo, ad, persuadeo, scientia, aut, utor, plerus, que, enim, credo, is, qui, experior, sunt.facit, etiam, necessitas, fides, qui, tum, ab, corpus, tur, -ne, ab, animus, nascor, nam, et, uerber, tormentum, ignis, fatigo, qui, dico, is, uideo, uereor, ipse, dico, et, qui, perturbatio, bus, animus, dolor, cupiditas, iracundia, metus, quia, nex, sitas, uis, habeo, affero, auctoritas, et, fides",84,"NaN, 0.0, NaN, 0.0, NaN, NaN, NaN, NaN, NaN, NaN, NaN, NaN, NaN, 1.0, NaN, NaN, NaN, NaN, 1.0, NaN, NaN, 0.0, NaN, NaN, 0.0, NaN, NaN, NaN, NaN, NaN, 0.0, NaN, NaN, NaN, NaN, NaN, NaN, NaN, NaN, NaN, NaN, NaN, NaN, 1.0, NaN, NaN, NaN, 0.0, NaN, NaN, NaN, 0.5, NaN, NaN, NaN, NaN, -0.5, 0.0, NaN, NaN, NaN, NaN, NaN, NaN, NaN, NaN, NaN, NaN, -0.5, NaN, 0.5, -1.0, -0.5, -1.0, -1.0, NaN, -1.0, NaN, 1.0, NaN, NaN, NaN, NaN, 1.0",0.006,-0.065,"hic, uerber, nex",0.036
cicero.topica,75.0,"qui, genus, etiam, ille, sum, ex, qui, uerus, non, numquam, inuenio, pueritia, somnus, imprudens, uinolentia, insania, nam, et, paruus, saepe, indico, aliquis, quo, is, pertineo, ignaris, et, per, somnus, uinum, insanio, multus, saepe, patefacio, sum, multus, etiam, in, res, odiosus, imprudens, incido, ut, staieno, nuper, accido, qui, is, loquor, sum, bonus, uis, subausculto, paries, interpono, qui, patefacio, in, iudicium, profero, ille, res, capital, ius, damno, sum, hic, similis, quidam, de, lacedaemonio, pausania, accipio, mus",74,"NaN, 0.0, NaN, NaN, NaN, NaN, NaN, 0.5, NaN, NaN, NaN, 0.0, 0.5, -0.5, NaN, -1.0, NaN, NaN, 0.0, NaN, NaN, NaN, NaN, NaN, NaN, NaN, NaN, NaN, 0.5, NaN, NaN, 0.0, NaN, NaN, NaN, 0.0, NaN, NaN, 0.0, NaN, -0.5, NaN, NaN, NaN, NaN, NaN, NaN, NaN, NaN, NaN, 1.0, 1.0, NaN, NaN, NaN, NaN, NaN, NaN, 0.5, NaN, NaN, 0.0, -1.0, 0.5, NaN, NaN, NaN, 0.0, NaN, NaN, NaN, NaN, NaN, NaN",0.02,-0.041,"insanio, damno, hic",0.041
cicero.topica,76.0,"concursio, autem, fortuitus, talis, sum, ut, si, interue, -ne, tum, sum, casus, cum, aut, ago, aliquis, qui, profero, non, sum, aut, dico, in, hic, genus, etiam, ille, sum, in, palamedem, conicio, suspicio, proditio, multitudo, qui, genus, refutaris, interdum, uereor, uix, possum, hic, etiam, sum, genus, fama, uulgus, quidam, multitudo, testis, monium, qui, autem, uirtus, fides, facio, is, bipertita, sum, ex, qui, alter, natura, ualeo, alter, industria, deus, enim, uirtus, natura, excello, homo, autem, industria",74,"NaN, NaN, NaN, NaN, NaN, NaN, NaN, NaN, NaN, NaN, NaN, 0.0, NaN, NaN, NaN, NaN, NaN, NaN, NaN, NaN, NaN, NaN, NaN, NaN, 0.0, NaN, NaN, NaN, NaN, NaN, NaN, -0.5, -0.5, 0.0, NaN, 0.0, NaN, NaN, NaN, NaN, NaN, NaN, NaN, NaN, 0.0, 1.0, 0.0, NaN, 0.0, NaN, NaN, NaN, NaN, 1.0, 1.0, NaN, NaN, NaN, NaN, NaN, NaN, NaN, 0.0, NaN, NaN, 0.5, 0.0, NaN, 1.0, 0.0, NaN, 0.0, NaN, 0.5",0.054,-0.014,"hic, proditio, hic",0.041
cicero.topica,77.0,"diuino, hic, fere, sum, testimonium, primus, oratio, oraculum, enim, ex, is, ipse, appello, sum, qui, insum, in, hic, deus, oratio, deinde, res, in, qui, insum, quasi, quidam, opus, diuino, primus, ipse, mundus, is, omnis, ordo, et, orno, deinceps, aerius, uolo, auis, atque, cantus, deinde, idem, aer, sono, et, ardor, multa, res, in, terra, portentum, atque, etiam, per, exta, inuenio, praesensio, ab, dormio, quoque, multus, significo, uideo, qui, ex, locus, sumo, interdum, soleo, ad, fides, facio, testimonium, deus",77,"NaN, NaN, NaN, NaN, NaN, 0.5, -0.5, NaN, NaN, NaN, NaN, NaN, NaN, NaN, NaN, NaN, NaN, NaN, 0.0, -0.5, NaN, 0.0, NaN, NaN, NaN, NaN, NaN, 0.5, NaN, 0.5, NaN, 1.0, NaN, NaN, 0.5, NaN, NaN, NaN, NaN, NaN, NaN, NaN, 0.0, NaN, NaN, 0.0, NaN, NaN, NaN, NaN, 0.0, NaN, 0.0, 0.0, NaN, NaN, NaN, NaN, NaN, NaN, NaN, NaN, NaN, 0.0, NaN, NaN, NaN, NaN, 0.0, NaN, NaN, NaN, NaN, 1.0, NaN, NaN, 0.0",0.039,-0.013,"hic, hic, portentum",0.039
cicero.topica,78.0,"in, homo, uirtus, opinio, ualeo, multus, opinio, sum, autem, non, modo, is, uirtus, habeo, qui, habeo, sed, is, etiam, qui, habeo, uideo, itaque, qui, ingenium, qui, studium, qui, doctrina, praeditus, uideo, quisque, uita, consto, et, probo, ut, cato, laelis, scipio, alius, multus, reor, is, sum, qualis, sui, ipse, uolo, neque, solus, is, censeo, sum, talis, qui, in, honor, populus, reor, publicus, uerso, sed, et, orator, et, philosophus, et, poeta, et, historicus, ex, qui, et, dictum, et, scribo, saepe, auctoritas, peto, ad, facio, fides",83,"NaN, 0.0, 1.0, 0.0, NaN, 0.0, 0.0, NaN, NaN, NaN, NaN, NaN, 1.0, NaN, NaN, NaN, NaN, NaN, NaN, NaN, NaN, NaN, NaN, NaN, 0.5, NaN, 0.5, NaN, 0.0, 0.5, NaN, NaN, 0.0, NaN, NaN, NaN, NaN, NaN, NaN, NaN, NaN, 0.0, NaN, NaN, NaN, NaN, NaN, NaN, NaN, NaN, -0.5, NaN, NaN, NaN, NaN, NaN, NaN, 1.0, 0.0, NaN, 0.0, NaN, NaN, NaN, NaN, NaN, 0.0, NaN, 0.0, NaN, NaN, NaN, NaN, NaN, 0.0, NaN, NaN, NaN, NaN, NaN, NaN, NaN, 1.0",0.06,-0.006,,0.0
cicero.topica,79.0,"expono, omnis, argumentor, locus, ille, primus, intellego, sum, neque, ullus, sum, disputatio, in, qui, non, aliquis, locus, incurro, neque, fere, omnis, locus, incido, in, omnis, quaestio, et, quidam, quaestio, alius, qui, busdam, alius, sum, aptus, locus, quaestio, duo, genus, alter, infinitus, definitul, alter, definio, sum, qui, ὑπόθεσιν, graecus, nos, causa, infinitus, qui, θέσιν, ille, appello, nos, propono, possum, nominaris",59,"NaN, NaN, NaN, 0.0, NaN, 0.5, NaN, NaN, NaN, NaN, NaN, NaN, NaN, NaN, NaN, NaN, 0.0, NaN, NaN, NaN, NaN, 0.0, NaN, NaN, NaN, NaN, NaN, NaN, NaN, NaN, NaN, NaN, NaN, NaN, NaN, 0.0, NaN, NaN, 0.0, NaN, NaN, NaN, NaN, NaN, NaN, NaN, NaN, NaN, NaN, 0.0, NaN, NaN, NaN, NaN, NaN, NaN, NaN, NaN, NaN",0.008,0.0,,0.0
cicero.topica,80.0,"causa, certus, persona, locus, tempus, actio, negotium, cerno, aut, in, omnis, aut, in, plerusque, is, propono, autem, aut, in, aliquis, is, aut, in, multus, neque, tamen, in, magnus, itaque, propono, pars, sum, causa, sed, omnis, quaestio, is, aliqui, de, res, sum, qui, causa, contineo, aut, unus, aut, multus, aut, non, numquam, omnis",52,"0.0, 0.5, 0.0, 0.0, 0.0, NaN, -0.5, NaN, NaN, NaN, NaN, NaN, NaN, NaN, NaN, NaN, NaN, NaN, NaN, NaN, NaN, NaN, NaN, 0.0, NaN, NaN, NaN, 0.0, NaN, NaN, 0.0, NaN, 0.0, NaN, NaN, NaN, NaN, NaN, NaN, 0.0, NaN, NaN, 0.0, NaN, NaN, NaN, NaN, 0.0, NaN, NaN, NaN, NaN",0.0,-0.01,,0.0
cicero.topica,81.0,"quaestio, autem, quicumque, de, res, sum, duo, genus, unus, cognitio, alter, actio",12,"NaN, NaN, NaN, NaN, 0.0, NaN, NaN, 0.0, NaN, 0.5, NaN, NaN",0.042,0.0,,0.0
cicero.topica,82.0,"cognitio, sum, is, qui, sum, finis, scientia, ut, si, quaero, ab, natura, ius, proficiscor, sum, an, ab, aliqui, quasi, condicio, homo, et, pactio, actio, autem, hic, modus, exemplum, sum, sum, sapio, ad, res, publicus, accedo, cognitio, quaestio, tripertitae, sum, aut, sum, aut, quis, sum, aut, qualis, sum, quaero, hic, primus, conicio, secundus, definitio, tertius, ius, et, iniuria, distinctio, explico, conicio, ratio, in, quattuor, pars, distribuo, sum, qui, unus, sum, cum, quaero, sum, aliquis, alter, unde, orior, sum, tertius, qui, is, causa, efficio, quartus, in, qui, de, commutatio, res, quaero, sum, -ne, sic, ecquidnam, sum, honestus, ecquis, aequus, res, uerus, an, hic, tantus, in, opinio, sum, unde, autem, sum, orior, ut, cum, quaero, natura, an, doctrina, possum, efficio, uirtus, causa, autem, efficio, sic, quaero, qui, res, eloquentia, efficio, de, commutatio, sic, possum, eloquentia, commutatio, aliqui, conuerto, in, infantia",137,"0.5, NaN, NaN, NaN, NaN, 0.0, 0.0, NaN, NaN, NaN, NaN, 0.0, 0.5, NaN, NaN, NaN, NaN, NaN, NaN, 0.0, 0.0, NaN, NaN, NaN, NaN, NaN, 0.5, 0.0, NaN, NaN, NaN, NaN, 0.0, 0.0, NaN, 0.5, NaN, NaN, NaN, NaN, NaN, NaN, NaN, NaN, NaN, NaN, NaN, NaN, NaN, 0.5, NaN, 0.0, NaN, 0.0, 0.5, NaN, -1.0, NaN, NaN, NaN, 0.0, NaN, NaN, 0.0, NaN, NaN, NaN, NaN, NaN, NaN, NaN, NaN, NaN, NaN, NaN, NaN, NaN, 0.0, NaN, NaN, 0.0, NaN, 0.0, NaN, NaN, NaN, NaN, 0.0, NaN, NaN, NaN, NaN, NaN, NaN, 1.0, NaN, 0.5, 0.0, 0.5, NaN, NaN, NaN, NaN, 0.0, NaN, NaN, NaN, NaN, NaN, NaN, NaN, NaN, 0.0, NaN, 0.0, NaN, NaN, 1.0, 0.0, NaN, NaN, NaN, NaN, NaN, 0.0, NaN, NaN, NaN, NaN, NaN, NaN, NaN, NaN, NaN, NaN, NaN, NaN",0.036,-0.007,"pactio, hic, hic, honestus, hic",0.036
cicero.topica,83.0,"cum, autem, quis, sum, quaero, notio, explico, sum, et, proprietas, et, diuisio, et, partitio, hic, enim, sum, definitio, attribuo, addo, etiam, descriptio, quam, χαρακτῆρα, graecus, uoco, notio, sic, quaero, sum, is, aequus, qui, is, qui, multus, possum, utilis, sum, proprietas, sic, in, homo, solus, cado, an, etiam, in, belua, aegritudo, diuisio, et, idem, pacisco, partitio, sic, tres, genus, bonus, sum, descriptio, qualis, sum, auarus, qualis, assentator, ceter, idem, genus, in, qui, et, natura, et, uito, describo",76,"NaN, NaN, NaN, NaN, NaN, NaN, NaN, NaN, NaN, 0.0, NaN, NaN, NaN, NaN, NaN, NaN, NaN, NaN, NaN, NaN, NaN, NaN, NaN, NaN, NaN, NaN, NaN, NaN, NaN, NaN, NaN, 0.5, NaN, NaN, NaN, 0.0, NaN, 1.0, NaN, 0.0, NaN, NaN, 0.0, -0.5, NaN, NaN, NaN, NaN, NaN, -1.0, NaN, NaN, NaN, NaN, NaN, NaN, NaN, 0.0, 1.0, NaN, NaN, NaN, NaN, -1.0, NaN, -1.0, NaN, NaN, 0.0, NaN, NaN, NaN, 0.0, NaN, NaN, NaN",-0.013,-0.046,"hic, auarus",0.026
cicero.topica,84.0,"cum, autem, quaero, qualis, quis, sum, aut, simplex, quaero, aut, comparo, simplex, expeto, sum, gloria, com, paro, praepono, sum, diuitiae, gloria, simplicium, tres, genus, sum, de, expeto, fugio, de, aequus, et, iniquus, de, honestus, et, turpis, comparatio, autem, duo, unus, de, idem, et, alius, alter, de, magnus, et, paruus, de, ex, peto, et, fugio, hic, modus, si, expeto, diuitiae, si, fugio, paupertas, de, aequus, et, iniquus, aequus, sum, ulciscor, ab, quicumque, iniuria, accipio, de, honestus, et, turpis, honestus, sum, pro, patria, morior",82,"NaN, NaN, NaN, NaN, NaN, NaN, NaN, 0.5, NaN, NaN, NaN, 0.5, NaN, NaN, 0.0, NaN, NaN, NaN, NaN, 0.5, 0.0, NaN, NaN, 0.0, NaN, NaN, NaN, NaN, NaN, 0.5, NaN, -1.0, NaN, 1.0, NaN, -1.0, 0.0, NaN, NaN, NaN, NaN, NaN, NaN, NaN, NaN, NaN, 0.0, NaN, 0.0, NaN, NaN, NaN, NaN, NaN, NaN, 0.5, NaN, NaN, 0.5, NaN, NaN, -1.0, NaN, 0.5, NaN, -1.0, 0.5, NaN, NaN, NaN, NaN, -1.0, NaN, NaN, 1.0, NaN, -1.0, 1.0, NaN, NaN, NaN, NaN",0.012,-0.073,"iniquus, honestus, turpis, hic, iniquus, ulciscor, honestus, turpis, honestus",0.11
cicero.topica,85.0,"ex, alter, autem, genus, qui, sum, bipertitum, unus, sum, de, idem, et, alius, quis, intersum, inter, amicus, et, adsentator, rex, et, tyrannus, alter, de, magnus, et, paruus, ut, si, quaero, eloquor, multus, sum, an, ius, ciuilis, scientia, de, cognitio, quaestio, hactenus",41,"NaN, NaN, NaN, 0.0, NaN, NaN, NaN, NaN, NaN, NaN, NaN, NaN, NaN, NaN, NaN, NaN, 1.0, NaN, -1.0, 0.0, NaN, NaN, NaN, NaN, 0.0, NaN, 0.0, NaN, NaN, NaN, NaN, 0.0, NaN, NaN, 0.5, 0.5, 0.0, NaN, 0.5, NaN, NaN",0.037,-0.024,tyrannus,0.024
