Text,Stelle,Inahlt,Wortzahl,Sentiment Rechnung,Sentiment-Score,alternativer Sentiment-Score,Invektiven,Invektivitäts-Score
cicero.topica,32.0,"saepe, etiam, definio, et, orator, et, poeta, per, translatio, uerbum, ex, similitudo, cum, aliqui, suauitas, sed, ego, ab, uester, exemplum, nisi, necessarius, non, recedo, soleo, igitur, aquilius, collega, et, familiaris, meus, cum, de, litus, ago, qui, omnis, publicus, sum, uolo, quaero, is, qui, ad, is, pertineo, quis, sum, litus, ita, definio, qui, fluctus, eludo, hic, sum, quasi, qui, adulescentia, flos, aetas, senectus, occasus, uita, uolo, definio, translatio, -ne, enim, uto, discedo, ab, uerbum, proprius, res, atque, suus, qui, ad, definitio, attineo, hactenus, reliquus, uideo",84,"NaN, NaN, NaN, NaN, NaN, NaN, 0.0, NaN, 0.0, 0.0, NaN, 0.0, NaN, NaN, NaN, NaN, NaN, NaN, NaN, 0.0, NaN, 0.0, NaN, NaN, NaN, NaN, NaN, NaN, NaN, 1.0, 0.0, NaN, NaN, NaN, NaN, NaN, NaN, 0.0, NaN, NaN, NaN, NaN, NaN, NaN, NaN, NaN, NaN, NaN, NaN, NaN, NaN, NaN, 0.0, NaN, NaN, NaN, NaN, NaN, NaN, 0.5, 0.0, 0.0, NaN, 0.0, NaN, NaN, 0.0, NaN, NaN, NaN, NaN, NaN, 0.0, 0.0, 0.0, NaN, NaN, NaN, NaN, NaN, NaN, NaN, 0.0, NaN",0.018,0.0,hic,0.012
cicero.topica,33.0,"partitio, -ne, tum, sic, utor, sum, nullus, ut, pars, res, linquas, ut, si, partio, uelis, tutela, insciens, facio, si, ullus, praetermitto, at, si, stipulatio, aut, iudicium, formula, partiaris, non, sum, uitiosus, in, res, infinitus, praeter, mitto, aliquis, qui, idem, in, diuisio, uitiosus, sum, formaris, enim, certus, sum, numerus, qui, quisque, gener, subicio, pars, distributio, saepe, sum, infinitus, tam, quam, riuus, ab, fons, diductio",63,"NaN, NaN, NaN, NaN, NaN, NaN, NaN, NaN, 0.0, 0.0, NaN, NaN, NaN, NaN, NaN, NaN, 0.0, NaN, NaN, NaN, NaN, NaN, NaN, NaN, NaN, 0.5, 0.0, NaN, NaN, NaN, NaN, NaN, 0.0, NaN, NaN, NaN, NaN, NaN, NaN, NaN, NaN, NaN, NaN, NaN, NaN, 0.5, NaN, NaN, NaN, NaN, NaN, NaN, 0.0, NaN, NaN, NaN, NaN, NaN, NaN, NaN, NaN, NaN, NaN",0.016,0.0,,0.0
cicero.topica,34.0,"itaque, in, oratorius, ars, quaestio, genus, propono, quot, is, forma, sum, subiungo, absoluo, at, cum, de, ornamentum, uerbum, sententia, praecipio, qui, uoco, σχήματα, non, fio, idem, res, sum, enim, infinitus, ut, ex, hic, quoque, intellego, quis, uolo, inter, partitio, et, diuisio, intersum, quam, quam, enim, uocabulum, prope, idem, ualeo, uideo, tamen, quia, res, differo, nomen, res, distaris, uolo",58,"NaN, NaN, 0.0, 0.0, NaN, 0.0, NaN, NaN, NaN, 1.0, NaN, NaN, NaN, NaN, NaN, NaN, NaN, 0.0, 0.0, NaN, NaN, NaN, NaN, NaN, NaN, NaN, 0.0, NaN, NaN, NaN, NaN, NaN, NaN, NaN, NaN, NaN, NaN, NaN, NaN, NaN, NaN, NaN, NaN, NaN, NaN, NaN, NaN, NaN, NaN, NaN, NaN, NaN, 0.0, NaN, 0.0, 0.0, NaN, NaN",0.017,0.0,hic,0.017
cicero.topica,35.0,"multus, etiam, ex, notatio, sumo, .., is, sum, autem, cum, ex, uis, nomen, argumentum, elicio, quam, graecus, ἐτυμολογίαν, appello, is, sum, uerbum, ex, uerbum, ueriloquium, nos, autem, nouitas, uerbum, non, satis, aptus, fugio, genus, hic, notatio, appello, quia, sum, uerbum, res, nosco, itaque, hic, quidem, aristotelis, σύμβολον, appello, qui, latina, sum, nosco, sed, cum, intellego, quis, significo, paruus, laboro, sum, de, nomen",62,"0.0, NaN, NaN, 0.0, NaN, NaN, NaN, NaN, NaN, NaN, NaN, 1.0, 0.0, 0.0, NaN, NaN, NaN, NaN, NaN, NaN, NaN, 0.0, NaN, 0.0, NaN, NaN, NaN, 0.0, 0.0, NaN, 0.5, NaN, NaN, 0.0, NaN, 0.0, NaN, NaN, NaN, 0.0, 0.0, NaN, NaN, NaN, NaN, NaN, NaN, NaN, NaN, NaN, NaN, NaN, NaN, NaN, NaN, NaN, NaN, 0.0, NaN, NaN, NaN, 0.0",0.024,0.0,"hic, hic",0.032
cicero.topica,36.0,"multus, igitur, in, disputo, notatio, elicio, ex, uerbum, ut, cum, quaero, postliminium, quis, sum, non, dico, qui, sum, postliminium, nam, is, cado, in, diuisio, qui, talis, sum, postliminium, redeo, hic, homo, nauus, mulus, clitellarius, equus, equa, qui, freni, recipio, soleo, sed, cum, ipse, postliminium, uolo, quaero, et, uerbum, ipse, noto, in, quo, seruus, noster, ut, opinor, nihil, puto, sum, noto, nisi, post, et, liminium, ille, productio, sum, uerbum, uolo, ut, in, finitimus, legitimus, aedes, timo, non, multus, insum, timum, quam, in, meditullium, tullium, scaeuola, autem",85,"0.0, NaN, NaN, NaN, 0.0, NaN, NaN, 0.0, NaN, NaN, NaN, NaN, NaN, NaN, NaN, NaN, NaN, NaN, NaN, NaN, NaN, NaN, NaN, NaN, NaN, NaN, NaN, NaN, NaN, NaN, 0.0, NaN, NaN, NaN, NaN, NaN, NaN, NaN, NaN, NaN, NaN, NaN, NaN, NaN, NaN, NaN, NaN, 0.0, NaN, NaN, NaN, NaN, -0.5, NaN, NaN, NaN, NaN, NaN, NaN, NaN, NaN, NaN, NaN, NaN, NaN, NaN, NaN, 0.0, NaN, NaN, NaN, NaN, NaN, 0.0, NaN, NaN, 0.0, NaN, NaN, NaN, NaN, NaN, NaN, NaN, NaN",-0.006,-0.006,"hic, finitimus",0.024
cicero.topica,37.0,"publicus, filius, iungo, puto, sum, uerbum, ut, sum, in, is, et, post, et, limen, ut, qui, ab, nos, alieno, cum, ad, hostis, peruenio, ex, suus, tamquam, limen, exeo, hinc, is, cum, redeo, post, ad, idem, limen, postliminium, redeo, uideo, quo, genus, etiam, mancini, causa, defendo, possum, postliminium, redeo, dedo, non, sum, quoniam, non, sum, recipio, nam, neque, deditio, neque, donatio, sine, acceptio, intellego, possum",64,"0.0, 0.0, NaN, NaN, NaN, 0.0, NaN, NaN, NaN, NaN, NaN, NaN, NaN, NaN, NaN, NaN, NaN, NaN, NaN, NaN, NaN, -1.0, NaN, NaN, NaN, NaN, NaN, NaN, NaN, NaN, NaN, NaN, NaN, NaN, NaN, NaN, NaN, NaN, NaN, NaN, 0.0, NaN, NaN, 0.0, NaN, NaN, NaN, NaN, NaN, NaN, NaN, NaN, NaN, NaN, NaN, NaN, NaN, NaN, NaN, 0.0, NaN, NaN, NaN, NaN",-0.016,-0.016,donatio,0.016
cicero.topica,38.0,"sequor, is, locus, qui, consto, ex, is, res, qui, quidam, modo, afficio, sum, ad, is, de, quo, ambago, qui, modo, dico, in, multus, pars, distribuo, qui, sum, primus, locus, ex, coniugatio, quam, graecus, συζυγίαν, uoco, finitimus, notatio, de, qui, modo, dico, sum, ut, si, aqua, pluuia, is, modo, intellego, quam, imber, collecta, uideo, uenio, mucius, qui, quia, coniugo, uerbum, sum, pluuia, et, pluo, dico, omnis, aqua, oportet, arceo, qui, pluo, cerno",71,"NaN, NaN, 0.0, NaN, NaN, NaN, NaN, 0.0, NaN, NaN, NaN, NaN, NaN, NaN, NaN, NaN, NaN, NaN, NaN, NaN, NaN, NaN, 0.0, 0.0, NaN, NaN, NaN, 0.5, 0.0, NaN, NaN, NaN, NaN, NaN, NaN, NaN, 0.0, NaN, NaN, NaN, NaN, NaN, NaN, NaN, 0.0, NaN, NaN, NaN, NaN, NaN, NaN, NaN, NaN, NaN, NaN, NaN, NaN, NaN, 0.0, NaN, NaN, NaN, NaN, NaN, NaN, 0.0, NaN, NaN, NaN, NaN, NaN",0.007,0.0,finitimus,0.014
cicero.topica,39.0,"cum, autem, ab, genus, duco, argu, mentum, non, sum, necesse, is, usque, ab, caput, arcesso, saepe, etiam, citer, licet, dum, modo, supra, sum, qui, sumo, quam, is, ad, qui, sumo, ut, aqua, pluuia, ultimo, genus, is, sum, qui, de, caelum, uenio, cresco, imber, sed, propior, in, quo, quasi, ius, arceo, contineo, genus, sum, aqua, pluuia, noceo, is, genus, forma, locus, uitio, et, manus, noceo, qui, alter, iubeo, ab, arbiter, coerceo, alter, non, iubeo, tur",74,"NaN, NaN, NaN, 0.0, NaN, NaN, NaN, NaN, NaN, 0.0, NaN, NaN, NaN, 0.0, NaN, NaN, NaN, NaN, NaN, NaN, NaN, NaN, NaN, NaN, NaN, NaN, NaN, NaN, NaN, NaN, NaN, 0.0, NaN, NaN, 0.0, NaN, NaN, NaN, NaN, 0.5, NaN, NaN, NaN, NaN, 0.0, NaN, NaN, NaN, 0.5, NaN, NaN, 0.0, NaN, 0.0, NaN, NaN, NaN, 0.0, 1.0, 0.0, NaN, NaN, 0.0, NaN, NaN, NaN, NaN, NaN, NaN, NaN, NaN, NaN, NaN, NaN",0.027,0.0,"noceo, noceo, coerceo",0.041
cicero.topica,40.0,"commodus, etiam, tracto, hic, argumentatio, qui, ex, genus, sumo, cum, ex, totus, pars, persequor, hic, modo, si, dolus, malus, sum, cum, alius, ago, alius, simulo, enumero, licet, qui, is, modus, fio, deinde, in, is, aliquis, is, qui, arguo, dolus, malus, facio, includo, qui, genus, argumentum, in, primus, firmum, uideo, soleo",50,"0.5, NaN, NaN, NaN, NaN, NaN, NaN, 0.0, NaN, NaN, NaN, NaN, 0.0, NaN, NaN, NaN, NaN, NaN, -1.0, NaN, NaN, NaN, NaN, NaN, NaN, NaN, NaN, NaN, NaN, 0.5, NaN, NaN, NaN, NaN, NaN, NaN, NaN, NaN, NaN, -1.0, NaN, NaN, NaN, 0.0, 0.0, NaN, 0.5, NaN, NaN, NaN",-0.01,-0.04,"hic, hic, dolus, dolus",0.08
cicero.topica,41.0,"similitudo, sequor, qui, latus, pateo, sed, orator, et, philosophus, magis, quam, tu, etsi, enim, omnis, locus, sum, omnis, disputatio, ad, argumentum, suppedito, tamen, alius, disputatio, abundo, occurro, alius, angustus, itaque, genus, tu, nosco, sum, ubi, autem, is, utaris, qui, stio, ipse, tu, admoneo",43,"0.0, NaN, NaN, NaN, NaN, NaN, NaN, NaN, 0.0, NaN, NaN, NaN, NaN, NaN, NaN, 0.0, NaN, NaN, NaN, NaN, 0.0, NaN, NaN, NaN, NaN, NaN, NaN, NaN, NaN, NaN, 0.0, NaN, NaN, NaN, NaN, NaN, NaN, NaN, NaN, NaN, NaN, NaN, NaN",0.0,0.0,"tu, tu, tu",0.07
cicero.topica,42.0,"sum, enim, similitudo, qui, ex, multus, conlatio, peruenio, quo, uolo, hic, modo, si, tuto, fides, praesto, debeo, si, socius, si, qui, mandaris, si, qui, fiducia, accipio, debeo, etiam, procuro, tor, hic, ex, multus, peruenio, quo, uolo, appello, inductio, qui, graeca, ἐπαγωγὴ, nomino, qui, multus, sum, utor, in, sermo, socrates",49,"NaN, NaN, 0.0, NaN, NaN, 0.0, NaN, NaN, NaN, NaN, NaN, NaN, NaN, NaN, 1.0, NaN, NaN, NaN, 1.0, NaN, NaN, NaN, NaN, NaN, 0.5, NaN, NaN, NaN, NaN, NaN, NaN, NaN, 0.0, NaN, NaN, NaN, NaN, NaN, NaN, NaN, NaN, NaN, NaN, 0.0, NaN, NaN, NaN, -0.5, NaN",0.041,-0.01,"hic, hic",0.041
cicero.topica,43.0,"alter, similitudo, genus, conlatio, sumo, cum, unus, res, unus, par, par, com, paro, hic, modo, qui, ad, modus, si, in, urbs, de, finis, controuersia, sum, quia, finis, magis, ager, uideo, sum, quam, urbs, finis, rego, adigo, arbiter, non, possum, sic, si, aqua, pluuia, in, urbs, noceo, quoniam, res, totus, magis, ager, sum, aqua, pluuia, arceo, adigo, arbiter, non, possum",59,"NaN, 0.0, 0.0, NaN, NaN, NaN, NaN, 0.0, NaN, 0.5, 0.5, NaN, NaN, NaN, NaN, NaN, NaN, 0.5, NaN, NaN, 0.5, NaN, 0.0, NaN, NaN, NaN, 0.0, NaN, 0.0, NaN, NaN, NaN, 0.5, 0.0, NaN, NaN, NaN, NaN, NaN, NaN, NaN, 0.0, NaN, NaN, 0.5, NaN, NaN, 0.0, NaN, NaN, 0.0, NaN, 0.0, NaN, NaN, NaN, NaN, NaN, NaN",0.051,0.0,"hic, noceo",0.034
cicero.topica,44.0,"ex, idem, similitudo, locus, etiam, exemplum, sumu, -ne, tur, ut, crassus, in, causa, curiana, exemplum, multus, utor, sum, qui, testamentum, sic, heres, instituo, ut, si, filius, nascor, sum, in, decem, mensis, eo, mortuus, prior, quam, in, suus, tutela, uenio, hereditas, obtineo, qui, com, memoratio, exemplum, ualeo, is, tu, in, respondeo, uti, multus, solo",53,"NaN, NaN, 0.0, 0.0, NaN, 0.0, NaN, NaN, NaN, NaN, NaN, NaN, 0.0, NaN, 0.0, 0.0, NaN, NaN, NaN, NaN, NaN, NaN, NaN, NaN, NaN, 0.0, NaN, NaN, NaN, NaN, NaN, NaN, NaN, 0.5, NaN, NaN, NaN, NaN, NaN, NaN, NaN, NaN, NaN, NaN, 0.0, NaN, NaN, NaN, NaN, NaN, NaN, 0.0, NaN",0.009,0.0,tu,0.019
cicero.topica,45.0,"fictum, enim, exemplum, similitudo, habeo, uis, sed, is, oratorium, magis, sum, quam, uester, quamnquam, uti, etiam, tu, solo, sed, hic, modo, fingo, mancipium, aliquis, do, is, qui, mancipium, do, non, possum, num, idcirco, is, is, facio, sum, qui, accipio, aut, num, is, qui, mancipium, do, ob, is, res, sui, ullus, res, obligo, in, hic, genus, orator, et, philosophus, concedo, sum, ut, muto, etiam, loquor, ut, mortuus, ab, inferi, excio, -ne, tur, ut, aliquis, qui, fio, nullus, modo, possum, augeo, res, gratia, dico, aut, minuo, qui, ὑπερβολὴ, dico, multus, alius, mirabile, sed, latus, sum, campus, ille, idem, tamen, ex, locus, ut, ante, dico, et, in, magnus, et, paruus, in, quaestio, argumentum, duco",111,"NaN, NaN, 0.0, 0.0, NaN, 1.0, NaN, NaN, NaN, NaN, NaN, NaN, NaN, NaN, NaN, NaN, NaN, NaN, NaN, NaN, NaN, NaN, 0.0, NaN, NaN, NaN, NaN, 0.0, NaN, NaN, NaN, NaN, NaN, NaN, NaN, NaN, NaN, NaN, NaN, NaN, NaN, NaN, NaN, 0.0, NaN, NaN, NaN, 0.0, NaN, NaN, 0.0, NaN, NaN, NaN, 0.0, NaN, NaN, 0.0, NaN, NaN, NaN, NaN, NaN, NaN, NaN, NaN, NaN, 0.0, NaN, NaN, NaN, NaN, NaN, NaN, NaN, NaN, NaN, NaN, NaN, 0.0, 1.0, NaN, NaN, NaN, NaN, NaN, NaN, 0.0, NaN, NaN, NaN, NaN, NaN, 0.0, NaN, NaN, NaN, NaN, 0.0, NaN, NaN, NaN, NaN, NaN, 0.0, NaN, 0.0, NaN, NaN, 0.0, NaN",0.018,0.0,"fictum, tu, hic, fingo, mancipium, mancipium, mancipium, hic",0.072
cicero.topica,46.0,"sequor, similitudo, differentia, res, magnus, contrarius, superus, sed, sum, idem, dissimilis, et, similis, inuenio, is, genus, hic, sum, non, qui, ad, modus, qui, mulier, debeo, rectus, ipse, mulier, sine, tutor, auctor, soluo, item, qui, pupillus, aut, pupilla, debeo, rectus, possum, idem, modo, soluo",43,"NaN, 0.0, NaN, 0.0, 0.0, NaN, NaN, NaN, NaN, NaN, NaN, NaN, 0.0, NaN, NaN, 0.0, NaN, NaN, NaN, NaN, NaN, 0.5, NaN, 0.0, NaN, 1.0, NaN, 0.0, NaN, NaN, NaN, NaN, NaN, NaN, NaN, NaN, NaN, NaN, 1.0, NaN, NaN, NaN, NaN",0.058,0.0,"hic, mulier, mulier, pupillus",0.093
cicero.topica,47.0,"deinceps, locus, sum, qui, e, contrarius, dico, contrarius, autem, genus, multus, unus, is, qui, in, idem, genus, multus, differo, ut, sapientia, stultitia, idem, autem, genus, dico, qui, propono, occurro, tamquam, e, regio, quidam, contrarius, ut, celeritas, tarditas, non, debilito, ex, qui, contrarius, argumentum, talis, existunt, si, stultitia, fugio, sapientia, sequor, et, bonitas, si, malitia, hic, qui, ex, idem, genus, contrarius, sum, appello, aduerso",63,"NaN, 0.0, NaN, NaN, NaN, NaN, NaN, NaN, NaN, 0.0, 0.0, NaN, NaN, NaN, NaN, NaN, 0.0, 0.0, NaN, NaN, 1.0, -1.0, NaN, NaN, 0.0, NaN, NaN, NaN, NaN, NaN, NaN, 0.0, NaN, NaN, NaN, NaN, NaN, NaN, NaN, NaN, NaN, NaN, 0.0, NaN, NaN, NaN, -1.0, NaN, 1.0, NaN, NaN, 1.0, NaN, -1.0, NaN, NaN, NaN, NaN, 0.0, NaN, NaN, NaN, NaN",0.0,-0.048,"stultitia, stultitia, hic",0.048
cicero.topica,48.0,"sum, enim, alius, co, -ne, traria, qui, priuo, licet, appello, latina, graecus, appello, στερητικά, praepono, enim, in, priuo, uerbum, is, uis, quam, habeo, si, in, praepono, non, sum, dignitas, indignitas, humanitas, inhumanitas, et, ceterus, genus, idem, qui, tractactio, sum, idem, qui, superus, qui, aduerso, dico",45,"NaN, NaN, NaN, NaN, NaN, NaN, NaN, NaN, NaN, NaN, NaN, NaN, NaN, NaN, NaN, NaN, NaN, NaN, 0.0, NaN, 1.0, NaN, NaN, NaN, NaN, NaN, NaN, NaN, 1.0, -1.0, 0.0, 0.0, NaN, 0.0, 0.0, NaN, NaN, NaN, NaN, NaN, NaN, NaN, NaN, NaN, NaN",0.022,-0.022,,0.0
cicero.topica,49.0,"nam, alius, quoque, sum, contrarius, genus, uelut, is, qui, cum, aliquis, confero, ut, duplus, simplum, multus, paucus, longus, breuis, magnus, paruus, sum, etiam, ille, ualidus, contrarius, qui, appello, nego, is, ἀποφατικὰ, graeca, contrarius, aientibus, si, hic, sum, ille, non, sum, quis, enim, opus, exemplum, sum, tantus, intellego, in, argumentum, quaero, contrarius, omnis, contrarius, non, conuenio",55,"NaN, NaN, NaN, NaN, NaN, 0.0, NaN, NaN, NaN, NaN, NaN, NaN, NaN, NaN, NaN, 0.0, 0.0, 0.0, NaN, 0.0, 0.0, NaN, NaN, NaN, 1.0, NaN, NaN, NaN, NaN, NaN, NaN, NaN, NaN, NaN, NaN, NaN, NaN, NaN, NaN, NaN, NaN, NaN, 0.5, 0.0, NaN, NaN, NaN, NaN, 0.0, NaN, NaN, NaN, NaN, NaN, NaN",0.027,0.0,hic,0.018
cicero.topica,50.0,"ab, adiungo, autem, pono, equidem, exemplum, paulus, ante, multus, adiungo, qui, suscipio, sum, si, statuo, ex, edictum, secundus, is, tabula, possessio, do, qui, is, instituo, qui, testamentum, factio, nullus, sum, sed, locus, hic, magis, ad, coniectural, causa, qui, uerso, in, iudicium, ualeo, cum, quaero, quis, aut, sum, aut, euenio, aut, sum, sum, aut, quis, omnino, fio, possum",57,"NaN, NaN, NaN, NaN, NaN, 0.0, NaN, NaN, 0.0, NaN, NaN, NaN, NaN, NaN, NaN, NaN, NaN, 0.0, NaN, NaN, NaN, NaN, NaN, NaN, NaN, NaN, NaN, 0.5, NaN, NaN, NaN, 0.0, NaN, NaN, NaN, NaN, 0.0, NaN, NaN, NaN, 0.5, NaN, NaN, NaN, NaN, NaN, NaN, NaN, NaN, NaN, NaN, NaN, NaN, NaN, NaN, NaN, NaN",0.018,0.0,"factio, hic",0.035
cicero.topica,51.0,"atque, locus, quidem, ipse, forma, talis, sum, admoneo, autem, hic, locus, ut, quaero, quis, ante, res, quis, cum, res, quis, post, res, euenio, nihil, hic, ad, ius, ad, cicero, inquam, gallus, noster, si, quis, ad, is, quis, talis, refero, ut, de, facio, quaero, tu, tamen, patior, nullus, ab, ego, ars, instituo, locus, prae, teriri, ne, si, nihil, nisi, qui, ad, tu, pertineo, scribo, puto, nimium, tu, amo, uidearis, sum, igitur, magnus, ex, pars, locus, hic, oratorius, non, modo, non, ius, consultor, sed, ne, philosophus, quidem",85,"NaN, 0.0, NaN, NaN, 1.0, NaN, NaN, NaN, NaN, NaN, 0.0, NaN, NaN, NaN, NaN, 0.0, NaN, NaN, 0.0, NaN, NaN, 0.0, NaN, NaN, NaN, NaN, 0.5, NaN, NaN, NaN, NaN, NaN, NaN, NaN, NaN, NaN, NaN, NaN, NaN, NaN, NaN, NaN, NaN, NaN, NaN, NaN, NaN, NaN, NaN, 0.0, NaN, 0.0, NaN, NaN, NaN, NaN, NaN, NaN, NaN, NaN, NaN, NaN, NaN, NaN, 0.0, NaN, NaN, NaN, NaN, NaN, 0.0, NaN, 0.0, 0.0, NaN, 0.0, NaN, NaN, NaN, 0.5, NaN, NaN, NaN, 0.0, NaN",0.024,0.0,"hic, hic, gallus, tu, tu, tu, hic",0.082
cicero.topica,52.0,"ante, res, enim, quaero, qui, talis, sum, apparatus, colloquium, locus, constituo, conuiuium, cum, res, autem, pes, crepo, strepitus, homo, corpus, umbra, et, si, quis, is, modus, at, post, res, pallor, rubor, titubatio, si, qui, alius, signum, conturbatio, et, conscientia, praeterea, restinguo, ignis, gladius, cruentus, ceter, qui, suspicio, facio, possum, moueo",50,"NaN, 0.0, NaN, NaN, NaN, NaN, NaN, 1.0, -0.5, 0.0, NaN, NaN, NaN, 0.0, NaN, 0.0, NaN, NaN, 0.0, 0.0, NaN, NaN, NaN, NaN, NaN, 0.5, NaN, NaN, 0.0, NaN, NaN, NaN, NaN, NaN, NaN, 0.0, NaN, NaN, 0.0, NaN, NaN, 0.0, NaN, NaN, NaN, NaN, -0.5, NaN, NaN, NaN",0.01,-0.02,"conuiuium, pallor, rubor, conscientia, cruentus",0.1
cicero.topica,53.0,"deinceps, sum, locus, dialectica, proprius, ex, consequor, -ne, tibus, et, antecedo, et, repugno, nam, coniungo, de, qui, paulus, ante, dico, sum, non, semper, euenio, consequor, autem, semper, is, enim, dico, consequor, qui, res, necessarius, consequor, ito, et, antecedo, et, repugno, quisquis, enim, sequor, quisque, res, is, cohaereo, cum, res, necessarius, et, quisquis, repugno, is, is, modus, sum, ut, cohaereo, numquam, possum, cum, tripertito, igitur, distribuo, locus, hic, in, consecutio, antecessio, repugnantia, reperio, argumentum, locus, simplex, sum, tracto, triplex, nam, quis, intersum, cum, hic, sumo, pecunia, numero, mulier, debeo, qui, sum, argentum, omnis, legatus, utrum, hic, modo, concludo, argumentum, si, pecunia, signo, argentum, sum, lego, sum, mulier, sum, autem, pecunia, signo, argentum, lego, igitur, sum, an, ille, modo, si, numero, pecunia, non, sum, lego, non, sum, numero, pecunia, argentum, sum, autem, numero, pecunia, argentum, lego, igitur, sum, an, ille, modo, non, et, legatus, argentum, sum, et, non, sum, lego, numero, pecunia, legatus, autem, argentum, sum, lego, igitur, numero, pecunia, sum",159,"NaN, NaN, 0.0, NaN, 0.0, NaN, NaN, NaN, NaN, NaN, NaN, NaN, NaN, NaN, NaN, NaN, NaN, NaN, NaN, NaN, NaN, NaN, NaN, NaN, NaN, NaN, NaN, NaN, NaN, NaN, NaN, NaN, 0.0, 0.0, NaN, NaN, NaN, NaN, NaN, NaN, NaN, NaN, NaN, NaN, 0.0, NaN, NaN, NaN, 0.0, 0.0, NaN, NaN, NaN, NaN, NaN, 0.5, NaN, NaN, NaN, NaN, NaN, NaN, NaN, NaN, NaN, 0.0, NaN, NaN, NaN, NaN, NaN, NaN, 0.0, 0.0, 0.5, NaN, NaN, NaN, NaN, NaN, NaN, NaN, NaN, NaN, 0.0, NaN, 0.0, NaN, NaN, NaN, NaN, NaN, 0.0, NaN, NaN, NaN, NaN, 0.0, NaN, 0.0, NaN, NaN, NaN, NaN, NaN, 0.0, NaN, NaN, 0.0, NaN, NaN, NaN, NaN, NaN, NaN, NaN, NaN, NaN, NaN, 0.0, NaN, NaN, NaN, NaN, NaN, NaN, 0.0, NaN, NaN, NaN, NaN, 0.0, NaN, NaN, NaN, NaN, NaN, NaN, NaN, NaN, NaN, 0.0, NaN, NaN, NaN, NaN, NaN, NaN, NaN, 0.0, 0.0, NaN, NaN, NaN, NaN, NaN, NaN, 0.0, NaN",0.006,0.0,"hic, hic, pecunia, mulier, hic, pecunia, mulier, pecunia, pecunia, pecunia, pecunia, pecunia, pecunia",0.082
cicero.topica,54.0,"appello, autem, dialecticus, is, conclusio, argumentum, in, qui, cum, primus, adsumpseris, consequor, is, qui, adnecto, sum, primus, conclusio, modus, cum, is, qui, adnecto, sum, nego, ut, is, quoque, qui, sum, adnecto, nego, sum, secundus, is, appello, concludo, modus, cum, autem, aliqui, coniungo, nego, et, ex, is, unus, aut, multus, sumo, ut, qui, relinquo, tollo, sum, is, tertius, appello, conclusio, modus",60,"NaN, NaN, NaN, NaN, 0.0, 0.0, NaN, NaN, NaN, 0.5, NaN, NaN, NaN, NaN, NaN, NaN, 0.5, 0.0, 0.5, NaN, NaN, NaN, NaN, NaN, NaN, NaN, NaN, NaN, NaN, NaN, NaN, NaN, NaN, 0.0, NaN, NaN, NaN, 0.5, NaN, NaN, NaN, NaN, NaN, NaN, NaN, NaN, NaN, NaN, 0.0, NaN, NaN, NaN, NaN, NaN, NaN, NaN, 0.0, NaN, 0.0, 0.5",0.042,0.0,,0.0
cicero.topica,55.0,"ex, hic, ille, rhetor, ex, contrarius, concludo, qui, ipse, ἐνθυμήματα, appello, non, qui, omnis, sententia, proprius, nomen, ἐνθύμημα, non, dico, sed, ut, homerus, propter, excellentiam, communis, poetaris, nomen, efficio, apud, graecus, suus, sic, cum, omnis, sententia, ἐνθύμημα, dico, quia, uideo, is, qui, ex, contrarius, co, -ne, ficitur, acutus, solus, proprius, nomen, communis, possedo, is, genus, hic, sum, hic, metuo, alter, in, metus, non, pono, is, quam, nihil, accuso, damno, bene, quam, mereo, sum, autumo, malus, mereo, is, qui, scio, prodo, nihil, is, qui, nescio, obe, sum",86,"NaN, NaN, NaN, NaN, NaN, NaN, NaN, NaN, NaN, NaN, NaN, NaN, NaN, NaN, 0.0, 0.0, 0.0, NaN, NaN, NaN, NaN, NaN, NaN, NaN, NaN, 0.0, NaN, 0.0, NaN, NaN, NaN, NaN, NaN, NaN, NaN, 0.0, NaN, NaN, NaN, NaN, NaN, NaN, NaN, NaN, NaN, NaN, NaN, NaN, -0.5, 0.0, 0.0, 0.0, NaN, NaN, 0.0, NaN, NaN, NaN, NaN, NaN, NaN, -1.0, NaN, NaN, NaN, NaN, NaN, NaN, NaN, NaN, NaN, NaN, NaN, NaN, -1.0, NaN, NaN, NaN, NaN, NaN, NaN, NaN, NaN, NaN, NaN, NaN",-0.029,-0.029,"hic, hic, hic, damno",0.047
cicero.topica,56.0,"hic, dissero, genus, attingo, omnino, uester, quoque, in, respondeo, disputatio, sed, philosophus, magis, qui, sum, cum, orator, ille, ex, repugno, sententia, communis, conclusio, qui, ab, dialectica, tertius, modus, ab, rhe, tores, ἐνθύμημα, dico, reliquus, dialectica, modus, multus, sum, qui, ex, disiunctio, consto, aut, hic, aut, ille, hic, autem, non, igitur, ille, ito, aut, hic, aut, ille, non, autem, hic, ille, igitur, qui, conclusio, idcirco, reor, sum, qui, in, disiunctio, multus, unus, uerus, sum, non, possum",75,"NaN, NaN, 0.0, NaN, NaN, NaN, NaN, NaN, NaN, NaN, NaN, 0.0, NaN, NaN, NaN, NaN, NaN, NaN, NaN, NaN, 0.0, 0.0, 0.0, NaN, NaN, NaN, 0.0, 0.5, NaN, NaN, NaN, NaN, NaN, 0.0, NaN, 0.5, 0.0, NaN, NaN, NaN, NaN, NaN, NaN, NaN, NaN, NaN, NaN, NaN, NaN, NaN, NaN, NaN, NaN, NaN, NaN, NaN, NaN, NaN, NaN, NaN, NaN, NaN, 0.0, NaN, NaN, NaN, NaN, NaN, NaN, 0.0, NaN, 0.5, NaN, NaN, NaN",0.02,0.0,"hic, hic, hic, hic, hic",0.067
cicero.topica,57.0,"atque, ex, is, conclusio, qui, supra, scribo, prior, quartus, posterus, quintus, ab, dialectica, modus, appello, deinde, addo, coniunctio, negantia, sic, non, et, hic, et, ille, hic, autem, non, igitur, ille, hic, modus, sum, sextus, septimus, autem, non, et, hic, et, ille, non, autem, hic, ille, igitur, ex, is, modus, conclusio, innumerabilis, nascor, in, quo, sum, totus, fere, διαλεκτική, sed, ne, hic, quidem, qui, expono, ad, hic, institutio, necessaria",68,"NaN, NaN, NaN, 0.0, NaN, NaN, NaN, 0.5, 0.0, 0.0, NaN, NaN, NaN, 0.5, NaN, NaN, NaN, NaN, NaN, NaN, NaN, NaN, NaN, NaN, NaN, NaN, NaN, NaN, NaN, NaN, NaN, 0.5, NaN, NaN, NaN, NaN, NaN, NaN, NaN, NaN, NaN, NaN, NaN, NaN, NaN, NaN, NaN, NaN, 0.5, 0.0, NaN, NaN, NaN, NaN, NaN, NaN, NaN, NaN, NaN, NaN, NaN, NaN, NaN, NaN, NaN, NaN, NaN, NaN",0.029,0.0,"hic, hic, hic, hic, hic, hic, hic",0.103
cicero.topica,58.0,"proximus, sum, locus, res, efficio, qui, causa, appello, deinde, res, effectaris, ab, efficio, causa, haris, exemplum, ut, reliquus, locus, paulus, ante, pono, equidem, ex, ius, ciuilis, sed, hic, pateo, latius.causaris, enim, genus, duo, sum, unus, qui, uis, suus, is, qui, sub, ear, -ne, uis, subicio, sum, certus, efficio, ut, ignis, accendo, alter, qui, natura, efficio, non, habeo, sed, sine.quo, efficio, non, possum, ut, si, quis, aes, statuo, causa, uolo, dico, qui, sine, is, non, possum, efficio",76,"NaN, NaN, 0.0, 0.0, NaN, NaN, 0.0, NaN, NaN, 0.0, NaN, NaN, NaN, 0.0, NaN, 0.0, NaN, 0.0, 0.0, NaN, NaN, NaN, NaN, NaN, 0.5, 0.5, NaN, NaN, NaN, NaN, NaN, 0.0, NaN, NaN, NaN, NaN, 1.0, NaN, NaN, NaN, NaN, NaN, NaN, 1.0, NaN, NaN, 0.5, NaN, NaN, 0.0, NaN, NaN, NaN, 0.0, NaN, NaN, NaN, NaN, NaN, NaN, NaN, NaN, NaN, NaN, NaN, NaN, NaN, 0.0, NaN, NaN, NaN, NaN, NaN, NaN, NaN, NaN",0.046,0.0,hic,0.013
cicero.topica,59.0,"hic, genus, causaris, sine, quo, non, efficio, alius, sum, quietus, nihil, ago, stolidus, quidam, modo, ut, locus, tempus, materia, ferramentum, et, ceterus, genus, idem, alius, autem, praecur, sio, quidam, adhibeo, ad, efficio, et, quidam, affero, per, sui, adiuuo, etsi, non, necessarius, ut, amor, congressio, causa, affero, amor, flagitium, ex, hic, genus, causaris, ex, aeternitas, pendeo, fatum, ab, stoicis, necto, atque, ut, is, causaris, sine, qui, efficio, non, possum, genus, diuido, sic, etiam, efficio, diuido, possum, sum, enim, alius, causa, qui, planus, efficio, nullus, res, adiuuo, alius, qui, adiuuaris, uolo, ut, sapientia, efficio, sapio, solus, per, sui, beatus, efficio, necne, solus, per, sui, quaestio, sum",104,"NaN, 0.0, NaN, NaN, NaN, NaN, NaN, NaN, NaN, NaN, NaN, NaN, -1.0, NaN, NaN, NaN, 0.0, 0.0, 0.0, NaN, NaN, 0.0, 0.0, NaN, NaN, NaN, NaN, NaN, NaN, NaN, NaN, NaN, NaN, NaN, NaN, NaN, NaN, NaN, NaN, NaN, 0.0, NaN, 1.0, NaN, 0.0, NaN, 1.0, -1.0, NaN, NaN, 0.0, NaN, NaN, 0.5, NaN, 0.0, NaN, NaN, NaN, NaN, NaN, NaN, NaN, NaN, NaN, NaN, NaN, NaN, 0.0, NaN, NaN, NaN, NaN, NaN, NaN, NaN, NaN, NaN, 0.0, NaN, 0.0, NaN, NaN, 0.0, NaN, NaN, NaN, NaN, NaN, NaN, 1.0, NaN, NaN, -0.5, NaN, NaN, 1.0, NaN, NaN, -0.5, NaN, NaN, NaN, NaN",0.014,-0.029,"hic, stolidus, flagitium, hic",0.038
