Text,Stelle,Inahlt,Wortzahl,Sentiment Rechnung,Sentiment-Score,alternativer Sentiment-Score,Invektiven,Invektivitäts-Score
cicero.de_fato,40.0,"atque, hic, si, placeo, qualis, sum, uideo, in, adsensio, qui, primus, oratio, tracto, is, enim, uetus, ille, qui, omnis, fatum, fio, uideo, uis, efficio, et, necessitas, dico, qui, autem, ab, is, dissentio, fatum, adsensio, libero, nego, fatum, adsensio, adhibeo, necessitas, ab, hic, possum, remoueo, eo, ita, dissero, si, omnis, fatum, fio, omnis, fio, causa, antecedo, et, si, appetitus, ille, etiam, qui, appetitus, sequor, ergo, etiam, adsensio, at, si, causa, appetitus, non, sum, sino, in, nos, ne, ipse, quidem, appetitus, sum, in, noster, potestas, qui, si, ita, sum, ne, ille, quidem, qui, appetitus, efficio, sum, sino, in, nos, non, sum, igitur, neque, adsensio, neque, actio, in, noster, potestas, ex, quo, efficio, ut, neque, laudatio, iustus, sum, neque, uituperatio, neque, honor, neque, supplicium, qui, cum, uitiosus, sum, probabilis, concludo, puto, non, omnis, fatum, fio, quicumque, fio",134,"NaN, NaN, NaN, NaN, NaN, NaN, NaN, NaN, 1.0, NaN, 0.5, -0.5, NaN, NaN, NaN, 0.0, NaN, NaN, NaN, 0.0, NaN, NaN, 1.0, NaN, NaN, NaN, NaN, NaN, NaN, NaN, NaN, NaN, 0.0, 1.0, NaN, NaN, 0.0, 1.0, NaN, NaN, NaN, NaN, NaN, NaN, NaN, NaN, NaN, NaN, NaN, 0.0, NaN, NaN, NaN, 0.0, NaN, NaN, NaN, NaN, NaN, NaN, NaN, NaN, NaN, NaN, NaN, 1.0, NaN, NaN, 0.0, NaN, NaN, NaN, NaN, NaN, NaN, NaN, NaN, NaN, NaN, NaN, NaN, NaN, 0.5, NaN, NaN, NaN, NaN, NaN, NaN, NaN, NaN, NaN, NaN, NaN, NaN, NaN, NaN, NaN, NaN, NaN, NaN, 1.0, NaN, NaN, NaN, NaN, 0.5, NaN, NaN, NaN, NaN, NaN, NaN, 1.0, NaN, NaN, -1.0, NaN, 1.0, NaN, NaN, NaN, NaN, NaN, NaN, 0.5, NaN, NaN, NaN, NaN, 0.0, NaN, NaN, NaN",0.063,-0.011,"hic, hic, supplicium",0.022
cicero.de_fato,41.0,"chrysippus, autem, cum, et, necessitas, in-probo, et, nihil, uolo, sine, praepono, causa, euenio, causaris, genus, distinguo, ut, et, necessitas, effugio, et, retineo, fatum, causaris, enim, inquam, alius, sum, perficio, et, principal, alius, adiuuo, et, proximus, quam, ob, res, cum, dico, omnis, fatum, fio, causa, antecedo, non, hic, intellego, uolo, causa, perficio, et, principal, sed, causa, adiuuo, antecedo, et, propior, itaque, ille, ratio, quam, paulus, ante, concludo, sic, occurro, si, omnis, fatum, fio, sequor, ille, quidem, ut, omnis, causa, fio, antepono, uerus, non, principal, causa, et, perficio, sed, adiuuo, et, propior, qui, si, ipse, non, sum, in, noster, potestas, non, sequor, ut, ne, appetitus, quidem, sum, in, noster, potestas, at, hic, sequor, si, omnis, perficio, et, principal, causa, fio, dico, ut, cum, is, causa, non, sum, in, noster, potestas, ne, ille, quidem, sum, in, noster, potestas",135,"NaN, NaN, NaN, NaN, NaN, NaN, NaN, NaN, NaN, NaN, NaN, 0.0, NaN, NaN, 0.0, NaN, NaN, NaN, NaN, NaN, NaN, NaN, 0.0, NaN, NaN, NaN, NaN, NaN, NaN, NaN, NaN, NaN, NaN, NaN, NaN, NaN, NaN, 0.0, NaN, NaN, NaN, 0.0, NaN, 0.0, NaN, NaN, NaN, NaN, NaN, 0.0, NaN, NaN, NaN, NaN, 0.0, NaN, NaN, NaN, 0.0, NaN, NaN, 0.0, NaN, NaN, NaN, NaN, NaN, NaN, NaN, NaN, 0.0, NaN, NaN, NaN, NaN, NaN, NaN, 0.0, NaN, NaN, 0.5, NaN, NaN, 0.0, NaN, NaN, NaN, NaN, NaN, 0.0, NaN, NaN, NaN, NaN, NaN, NaN, NaN, 0.5, NaN, NaN, NaN, NaN, NaN, NaN, NaN, NaN, NaN, 0.5, NaN, NaN, NaN, NaN, NaN, NaN, NaN, NaN, 0.0, NaN, NaN, NaN, NaN, NaN, 0.0, NaN, NaN, NaN, NaN, 0.5, NaN, NaN, NaN, NaN, NaN, NaN, 0.5",0.019,0.0,"hic, hic",0.015
cicero.de_fato,42.0,"quam, ob, res, qui, ita, fatum, introduco, ut, necessitas, adiungo, in, is, ualeo, ille, conclusio, qui, autem, causa, antecedo, non, dico, perficio, neque, principal, in, is, nihil, ualeo, qui, enim, dico, adsensio, fio, causa, antepono, is, qualis, sum, facilis, ab, sui, explicaris, puto, nam, quamquam, assensio, non, possum, fio, nisi, commoueo, uideo, tamen, cum, is, uideo, propior, causa, habeo, non, principal, hic, habeo, ratio, ut, chrysippus, uolo, quam, dudum, dico, non, ut, ille, quidem, fio, possum, nullus, uis, extrinsecus, excito, necesse, sum, enim, adsensio, uideo, commoueo, sed, reuorto, ad, cylindrum, et, ad, turbo, suus, qui, moueo, incipio, nisi, pello, non, possum, is, autem, cum, accido, suapte, natura, qui, supersum, et, cylindrum, uoluo, et, uersaris, turbo, puto",116,"NaN, NaN, 0.0, NaN, NaN, 0.0, NaN, NaN, NaN, NaN, NaN, NaN, NaN, NaN, 0.0, NaN, NaN, 0.0, NaN, NaN, NaN, NaN, NaN, NaN, NaN, NaN, NaN, NaN, NaN, NaN, NaN, 1.0, NaN, 0.0, NaN, NaN, NaN, NaN, 0.5, NaN, NaN, NaN, NaN, NaN, NaN, 1.0, NaN, NaN, NaN, NaN, NaN, NaN, NaN, NaN, NaN, NaN, 0.0, 0.0, NaN, NaN, NaN, NaN, NaN, 0.0, NaN, NaN, NaN, NaN, NaN, NaN, NaN, NaN, NaN, NaN, NaN, NaN, NaN, 1.0, NaN, NaN, 0.0, NaN, NaN, 1.0, NaN, NaN, NaN, NaN, NaN, NaN, NaN, NaN, NaN, NaN, NaN, NaN, NaN, NaN, NaN, NaN, NaN, NaN, NaN, NaN, NaN, NaN, 0.0, NaN, NaN, NaN, NaN, NaN, NaN, NaN, NaN, NaN",0.039,0.0,hic,0.009
cicero.de_fato,43.0,"ut, igitur, inquam, qui, protrudo, cylindrum, do, is, principium, motio, uolubilitas, autem, non, do, sic, uideo, obicio, inprimet, ille, quidem, et, quasi, signo, in, animus, suus, species, sed, assensio, noster, sum, in, potestas, is, qui, ad, modus, in, cylindro, dico, sum, extrinsecus, pello, qui, reliquus, sum, suapte, uis, et, natura, moueo, quodsi, aliqui, res, efficio, sine, causa, antecedo, falsus, sum, omnis, fatum, fio, sin, omnis, quicumque, fio, uerus, similis, sum, causa, antecedo, quis, affero, possum, cur, non, omnis, fatum, fio, fateor, sum, modo, intellego, qui, sum, causaris, distinctio, atque, dissimilitudo",90,"NaN, NaN, NaN, NaN, NaN, NaN, NaN, NaN, NaN, NaN, NaN, NaN, NaN, NaN, NaN, NaN, NaN, NaN, NaN, NaN, NaN, NaN, NaN, NaN, 0.5, NaN, NaN, NaN, 1.0, NaN, NaN, NaN, 0.5, NaN, NaN, NaN, 0.5, NaN, NaN, NaN, NaN, NaN, NaN, NaN, 0.0, NaN, NaN, 1.0, NaN, 0.0, NaN, NaN, NaN, 0.0, NaN, NaN, 0.0, NaN, -1.0, NaN, NaN, 0.0, NaN, NaN, NaN, NaN, NaN, 0.5, 0.0, NaN, 0.0, NaN, NaN, NaN, NaN, NaN, NaN, NaN, 0.0, NaN, NaN, NaN, NaN, NaN, NaN, NaN, NaN, NaN, NaN, NaN",0.033,-0.011,,0.0
cicero.de_fato,44.0,"hic, cum, ita, sum, ab, chrysippo, explicata, si, ille, qui, nego, adsensio, fatum, fio, fateor, tamen, is, non, sine, uideo, antecedo, fio, alius, ratio, sum, sed, si, concedo, anteeo, uideo, neque, tamen, fatum, fio, adsensio, qui, propior, ille, et, contineo, causa, non, moueo, adsensio, uideo, ne, idem, dico, neque, enim, chrysippus, concedo, adsensio, propior, et, contineo, causa, sum, in, uideo, pono, neque, is, causa, sum, ad, assentior, necessaria, concedo, ut, si, omnis, fatum, fio, omnis, causa, fio, antecedo, et, necessarius, ito, ille, qui, ab, hic, dissentio, confiteor, non, fio, adsensio, sine, praecursio, uisor, dico, si, omnis, fatum, fio, is, modus, ut, nihil, fio, nisi, praegressio, causa, confiteor, sum, fatum, fio, omnis, ex, quo, facilis, intellego, sum, quoniam, uterque, patefacio, atque, explicata, sententia, suus, ad, idem, exitus, uenio, uerbum, is, non, res, dis-sido",132,"NaN, NaN, NaN, NaN, NaN, NaN, NaN, NaN, NaN, NaN, NaN, 1.0, 0.0, NaN, NaN, NaN, NaN, NaN, NaN, NaN, NaN, NaN, NaN, 0.0, NaN, NaN, NaN, NaN, NaN, NaN, NaN, NaN, 0.0, NaN, 1.0, NaN, 0.0, NaN, NaN, NaN, 0.0, NaN, NaN, 1.0, NaN, NaN, NaN, NaN, NaN, NaN, NaN, NaN, 1.0, 0.0, NaN, NaN, 0.0, NaN, NaN, NaN, NaN, NaN, NaN, 0.0, NaN, NaN, NaN, NaN, NaN, NaN, NaN, NaN, 0.0, NaN, NaN, 0.0, NaN, NaN, NaN, 0.0, NaN, NaN, NaN, NaN, NaN, NaN, NaN, NaN, NaN, 1.0, NaN, NaN, NaN, NaN, NaN, NaN, 0.0, NaN, NaN, 0.5, NaN, NaN, NaN, NaN, NaN, 0.0, NaN, NaN, 0.0, NaN, NaN, NaN, NaN, 0.5, NaN, NaN, NaN, NaN, NaN, NaN, NaN, 0.0, NaN, NaN, NaN, NaN, NaN, 0.0, NaN, NaN, 0.0, NaN",0.045,0.0,"hic, hic",0.015
cicero.de_fato,45.0,"omnino, cum, hic, sum, distinctio, ut, quidam, in, res, uerus, dico, possum, cum, hic, causa, antegredior, sum, non, sum, in, noster, potestas, quin, ille, euenio, qui, causa, sum, quidam, autem, in, res, causa, antegredior, in, noster, tamen, sum, potestas, ut, ille, aliter, euenio, hic, distinctio, uterque, ad-probo, sed, alter, censeo, qui, in, res, cum, causa, antecedo, non, sum, in, noster, potestas, ut, aliter, ille, euenio, is, fatum, fio, qui, autem, in, noster, potestas, sum, ab, is, fatum, absum",78,"NaN, NaN, NaN, NaN, NaN, NaN, NaN, NaN, 0.0, 0.5, NaN, NaN, NaN, NaN, 0.0, NaN, NaN, NaN, NaN, NaN, NaN, 0.5, NaN, NaN, NaN, NaN, 0.0, NaN, NaN, NaN, NaN, 0.0, 0.0, NaN, NaN, NaN, NaN, NaN, 0.5, NaN, NaN, NaN, NaN, NaN, NaN, NaN, NaN, NaN, NaN, NaN, NaN, NaN, 0.0, NaN, 0.0, NaN, NaN, NaN, NaN, NaN, 0.5, NaN, NaN, NaN, NaN, NaN, 0.0, NaN, NaN, NaN, NaN, NaN, 0.5, NaN, NaN, NaN, 0.0, NaN",0.032,0.0,"hic, hic, hic",0.038
cicero.de_fato,46.0,"hic, modo, hic, causa, disceptaris, oportet, non, ab, atomus, erro, et, de, uia, declino, peto, praesidium, declino, inquam, atomus, primus, cur, alius, enim, quidam, uis, moueo, habeo, ab, democrito, inpulsio, quam, plaga, ille, appello, ab, tu, epicure, grauitas, et, pondus, qui, ergo, nouo, causa, in, natura, sum, qui, declino, atomus, aut, num, sortio, inter, sui, qui, declino, qui, non., aut, cur, paruus, declino, interuallum, magnus, non., aut, cur, declino, unus, paruus, non, declino, duo, aut, tres",76,"NaN, NaN, NaN, 0.0, NaN, NaN, NaN, NaN, NaN, 0.0, NaN, NaN, 0.0, NaN, NaN, NaN, NaN, NaN, NaN, 0.5, NaN, NaN, NaN, NaN, 1.0, NaN, NaN, NaN, NaN, NaN, NaN, 0.0, NaN, NaN, NaN, NaN, NaN, -0.5, NaN, NaN, NaN, NaN, NaN, 0.0, NaN, 0.0, NaN, NaN, NaN, NaN, NaN, NaN, NaN, NaN, NaN, NaN, NaN, NaN, NaN, NaN, NaN, 0.0, NaN, NaN, 0.0, NaN, NaN, NaN, NaN, NaN, 0.0, NaN, NaN, NaN, NaN, NaN",0.013,-0.007,"hic, hic, tu",0.039
cicero.de_fato,47.0,"optaris, hic, quidem, sum, non, disputaris, nam, neque, extrinsecus, in-pello, atomus, locus, moueo, et, declinaris, dico, neque, in, ille, inanis, per, qui, fero, atomus, quisquam, sum, causa, cur, is, non, e, regio, fero, neque, in, ipse, atomus, mutatio, aliquis, facio, sum, quam, ob, res, natural, motus, suus, pondus, non, teneo, ita, cum, affero, nullus, causa, qui, iste, declinatio, efficio, tamen, aliquis, sui, dico, uideo, cum, is, dico, qui, omnis, mens, aspernor, atque, respuo",73,"NaN, NaN, NaN, NaN, NaN, NaN, NaN, NaN, NaN, NaN, NaN, 0.0, NaN, NaN, NaN, NaN, NaN, NaN, NaN, NaN, NaN, NaN, NaN, NaN, NaN, NaN, 0.0, NaN, NaN, NaN, NaN, 0.0, NaN, NaN, NaN, NaN, NaN, NaN, NaN, NaN, NaN, NaN, NaN, 0.0, NaN, NaN, NaN, NaN, NaN, NaN, NaN, NaN, NaN, NaN, 0.0, NaN, NaN, NaN, NaN, NaN, NaN, NaN, NaN, NaN, NaN, NaN, NaN, NaN, NaN, 0.5, NaN, NaN, NaN",0.007,0.0,"hic, aspernor",0.027
cicero.de_fato,48.0,"neque, uerus, quisquam, magis, confirmo, ego, uideo, non, modo, fatum, uerus, etiam, necessitas, et, uis, omnis, res, tollo, moueo, animus, uoluntarii, quam, hic, qui, aliter, obsisto, fatum, fateor, sui, non, possum, nisi, ad, hic, commenticius, declinatio, confugio, nam, ut, sum, atomus, qui, quidem, sum, ego, probaris, nullus, modo, possum, tamen, declinatio, iste, numquam, explico, nam, si, atomus, ut, grauitas, fero, tribuo, sum, necessitas, natura, qui, omnis, pondus, nullus, res, inpediente, moueo, et, fero, necesse, sum, ille, quoque, necesse, sum, declinaris, quidam, atomus, uel, si, uolo, omnis, naturalis",87,"NaN, 0.5, NaN, NaN, NaN, NaN, NaN, NaN, NaN, 0.0, 0.5, NaN, NaN, NaN, 1.0, NaN, 0.0, NaN, NaN, 0.5, NaN, NaN, NaN, NaN, NaN, NaN, 0.0, NaN, NaN, NaN, NaN, NaN, NaN, NaN, NaN, NaN, NaN, NaN, NaN, NaN, NaN, NaN, NaN, NaN, NaN, NaN, NaN, NaN, NaN, NaN, NaN, NaN, NaN, NaN, NaN, NaN, NaN, NaN, -0.5, NaN, NaN, NaN, NaN, 0.0, NaN, NaN, NaN, NaN, 0.0, NaN, NaN, NaN, NaN, 0.0, NaN, NaN, NaN, 0.0, NaN, NaN, NaN, NaN, NaN, NaN, NaN, NaN, 0.0",0.023,-0.006,"hic, hic",0.023
