Text,Stelle,Inahlt,Wortzahl,Sentiment Rechnung,Sentiment-Score,alternativer Sentiment-Score,Invektiven,Invektivitäts-Score
claudian.in_consulatum,205.0,"ut, sceptrum, gero, manus, membrum, rigeo",6,"NaN, NaN, NaN, 0.0, NaN, NaN",0.0,0.0,,0.0
claudian.in_consulatum,206.0,"apto, toga, signum, do, summus, hiulcus",6,"NaN, NaN, 0.0, NaN, NaN, -0.5",-0.083,-0.083,,0.0
claudian.in_consulatum,207.0,"nubes, pater, gratus, fax, per, inanis, roto",7,"NaN, 0.0, 1.0, NaN, NaN, NaN, NaN",0.143,0.0,fax,0.143
claudian.in_consulatum,208.0,"prosper, uibrati, tonuerunt, omen, nimbus",5,"1.0, NaN, NaN, NaN, NaN",0.2,0.0,,0.0
claudian.in_consulatum,209.0,"accipio, sono, curuus, tiberinus, in, antrum",6,"NaN, NaN, NaN, NaN, NaN, 0.0",0.0,0.0,,0.0
claudian.in_consulatum,210.0,"imus, ualles, sedeo, ad-recingo, auris, haereo",6,"NaN, NaN, NaN, NaN, NaN, NaN",nan,nan,,0.0
claudian.in_consulatum,211.0,"unde, repentinus, populus, fragor, ilicet, herba",6,"NaN, -0.5, 0.0, NaN, NaN, NaN",-0.083,-0.083,,0.0
claudian.in_consulatum,212.0,"palleo, thalamus, et, struo, cubile, muscus",6,"NaN, NaN, NaN, NaN, NaN, NaN",nan,nan,,0.0
claudian.in_consulatum,213.0,"desero, atque, nympha, urna, commendo, erilis",6,"NaN, NaN, NaN, NaN, NaN, NaN",nan,nan,,0.0
claudian.in_consulatum,214.0,"ille, glaucus, niteo, hirsute, lumen, uultus",6,"NaN, NaN, NaN, NaN, NaN, NaN",nan,nan,glaucus,0.167
claudian.in_consulatum,215.0,"caeruleus, inficio, nosco, reddo, pater",5,"NaN, NaN, NaN, NaN, 0.0",0.0,0.0,,0.0
claudian.in_consulatum,216.0,"oceanus, crispus, densantur, gramen, collum",5,"NaN, NaN, NaN, NaN, NaN",nan,nan,,0.0
claudian.in_consulatum,217.0,"uertex, luxurio, totus, crinal, harundo",5,"NaN, NaN, NaN, NaN, NaN",nan,nan,"luxurio, crinal",0.4
claudian.in_consulatum,218.0,"quam, neque, fas, zephyris, frango, neque, sol, peruro",8,"NaN, NaN, NaN, NaN, NaN, NaN, NaN, NaN",nan,nan,,0.0
claudian.in_consulatum,219.0,"aestiuus, candor, morior, sed, uiuidus, frondeo",6,"NaN, 0.5, NaN, NaN, NaN, NaN",0.083,0.0,,0.0
claudian.in_consulatum,220.0,"aequaeuus, complector, caput, taurinus, leuo",5,"NaN, NaN, 0.0, NaN, NaN",0.0,0.0,,0.0
claudian.in_consulatum,221.0,"cornu, tempus, raucus, sudo, riuus",5,"NaN, 0.0, NaN, NaN, NaN",0.0,0.0,,0.0
claudian.in_consulatum,222.0,"distillant, per, pectus, aqua, frons, hispidus, mano",7,"NaN, NaN, NaN, 0.0, 0.0, -0.5, NaN",-0.071,-0.071,hispidus,0.143
claudian.in_consulatum,223.0,"imber, in, liquidus, fons, sui, barba, repecto",7,"NaN, NaN, NaN, NaN, NaN, NaN, NaN",nan,nan,,0.0
claudian.in_consulatum,224.0,"palla, grauis, umerus, uelo, quam, neuerat, uxor",7,"NaN, -0.5, NaN, NaN, NaN, NaN, 0.0",-0.071,-0.071,uxor,0.143
claudian.in_consulatum,225.0,"ilia, percurro, uitreus, sub, gurges, tela",6,"NaN, NaN, NaN, NaN, NaN, NaN",nan,nan,gurges,0.167
claudian.in_consulatum,226.0,"sum, in, romuleo, procumbo, insula, thybri",6,"NaN, NaN, NaN, NaN, NaN, NaN",nan,nan,,0.0
claudian.in_consulatum,227.0,"qui, medius, gemino, interfluo, alueus, urbs",6,"NaN, 0.0, NaN, NaN, NaN, 0.5",0.083,0.0,,0.0
claudian.in_consulatum,228.0,"discerno, subeo, fretus, parito, mino",5,"NaN, NaN, 0.5, NaN, NaN",0.1,0.0,,0.0
claudian.in_consulatum,229.0,"arduus, turrigerae, surgo, in, culmen, ripa",6,"NaN, NaN, NaN, NaN, NaN, NaN",nan,nan,,0.0
claudian.in_consulatum,230.0,"hic, sto, et, subeo, prospicio, ab, aggero, uoueo",8,"NaN, NaN, NaN, NaN, NaN, NaN, NaN, NaN",nan,nan,hic,0.125
claudian.in_consulatum,231.0,"unanimus, frater, iungo, stipo, senatus",5,"NaN, 0.0, NaN, NaN, 0.5",0.1,0.0,,0.0
claudian.in_consulatum,232.0,"eo, forum, strictasque, procul, radiaris, securis",6,"NaN, NaN, NaN, NaN, NaN, NaN",nan,nan,,0.0
claudian.in_consulatum,233.0,"atque, unus, biiugis, tollo, de, limen, fascis",7,"NaN, NaN, NaN, NaN, NaN, NaN, NaN",nan,nan,biiugis,0.143
claudian.in_consulatum,234.0,"obstupendus, uideo, suspendo, gaudium, uoco",5,"NaN, NaN, NaN, 1.0, NaN",0.2,0.0,,0.0
claudian.in_consulatum,235.0,"opprimo, teneo, diu, mox, incoho, os",6,"NaN, NaN, NaN, NaN, NaN, 0.0",0.0,0.0,,0.0
claudian.in_consulatum,236.0,"no, -ne",2,"NaN, NaN",nan,nan,,0.0
claudian.in_consulatum,237.0,"eurota, spartane, tuus, quis, profero, aequus",6,"NaN, NaN, 0.0, NaN, NaN, 0.5",0.083,0.0,,0.0
claudian.in_consulatum,238.0,"falsus, olor, ualidus, quiuis, decerno, caestus",6,"-1.0, NaN, 1.0, NaN, NaN, NaN",0.0,-0.167,olor,0.167
claudian.in_consulatum,239.0,"nosco, et, ratis, saeuus, arceo, procella",6,"NaN, NaN, NaN, -1.0, NaN, NaN",-0.167,-0.167,saeuus,0.167
claudian.in_consulatum,240.0,"en, nouo, ledaeis, suboles, fulgeo, astrum",6,"NaN, NaN, NaN, 0.5, NaN, NaN",0.083,0.0,,0.0
claudian.in_consulatum,241.0,"ecce, meus, ciuis, qui, iam, signifer, opto",7,"NaN, 0.0, 0.5, NaN, NaN, NaN, NaN",0.071,0.0,,0.0
claudian.in_consulatum,242.0,"aduenio, stella, paro, conuexus, sum",5,"NaN, NaN, NaN, NaN, NaN",nan,nan,,0.0
claudian.in_consulatum,243.0,"iam, per, noctiuagos, dominor, olybrius, axis",6,"NaN, NaN, NaN, NaN, NaN, 0.0",0.0,0.0,,0.0
claudian.in_consulatum,244.0,"pro, polluce, rubeo, pro, castor, flamma, probini",7,"NaN, NaN, NaN, NaN, NaN, NaN, NaN",nan,nan,,0.0
claudian.in_consulatum,245.0,"ipse, uelo, rego, ipse, dono, aura",6,"NaN, NaN, NaN, NaN, NaN, 1.0",0.167,0.0,,0.0
claudian.in_consulatum,246.0,"nauta, tranquillus, moderor, aequor, pinus",5,"NaN, NaN, NaN, 0.0, 0.0",0.0,0.0,,0.0
claudian.in_consulatum,247.0,"nunc, patera, libaris, deus, nunc, soluo, multus",7,"NaN, NaN, NaN, 0.0, NaN, NaN, 0.0",0.0,0.0,,0.0
claudian.in_consulatum,248.0,"nectaris, cor, libet, niueus, iam, pando, coitus",7,"NaN, NaN, NaN, NaN, NaN, NaN, NaN",nan,nan,niueus,0.143
claudian.in_consulatum,249.0,"naides, et, totus, uiola, praetexo, fons",6,"NaN, NaN, NaN, NaN, NaN, NaN",nan,nan,,0.0
claudian.in_consulatum,250.0,"mel, fero, silua, iam, profluo, ebrius, amnis",7,"NaN, NaN, NaN, NaN, NaN, -0.5, NaN",-0.071,-0.071,ebrius,0.143
claudian.in_consulatum,251.0,"mutas, in, uinum, uado, iam, sponte, per, ager",8,"NaN, NaN, NaN, NaN, NaN, NaN, NaN, 0.0",0.0,0.0,,0.0
claudian.in_consulatum,252.0,"sudo, irriguus, spiro, balsamum, uena",5,"NaN, NaN, NaN, NaN, 0.0",0.0,0.0,,0.0
claudian.in_consulatum,253.0,"curro, qui, socia, rogo, in, conuiuium, metior",7,"NaN, NaN, NaN, NaN, NaN, NaN, NaN",nan,nan,conuiuium,0.143
claudian.in_consulatum,254.0,"indigena, fluuius, ital, quicumque, suberrant",5,"0.0, NaN, NaN, NaN, NaN",0.0,0.0,,0.0
claudian.in_consulatum,255.0,"mons, alpinasque, bibo, de, mos, pruina",6,"NaN, NaN, NaN, NaN, 0.5, NaN",0.083,0.0,,0.0
claudian.in_consulatum,256.0,"uulturnusque, rapax, et, nar, uitio, odoro",6,"NaN, NaN, NaN, NaN, NaN, NaN",nan,nan,,0.0
claudian.in_consulatum,257.0,"sulphur, tardatusque, suus, error, ufens",5,"NaN, NaN, NaN, -1.0, NaN",-0.2,-0.2,sulphur,0.2
claudian.in_consulatum,258.0,"et, phaethonteae, perpetior, damno, ruina",5,"NaN, NaN, NaN, NaN, NaN",nan,nan,damno,0.2
claudian.in_consulatum,259.0,"eridanus, flauaeque, tero, quercetum, maricae",5,"NaN, NaN, NaN, NaN, NaN",nan,nan,,0.0
claudian.in_consulatum,260.0,"lira, et, oebaliae, qui, tempero, aruum, galaesus",7,"NaN, NaN, NaN, NaN, NaN, NaN, NaN",nan,nan,,0.0
claudian.in_consulatum,261.0,"semper, honoro, noster, celebro, unda",5,"NaN, NaN, NaN, NaN, 0.0",0.0,0.0,,0.0
claudian.in_consulatum,262.0,"iste, dies, semper, daps, recoletur, opimus",6,"NaN, 0.0, NaN, NaN, NaN, NaN",0.0,0.0,,0.0
claudian.in_consulatum,263.0,"sic, aio, et, nympha, pater, praecipio, sequor",7,"NaN, NaN, NaN, NaN, 0.0, NaN, NaN",0.0,0.0,,0.0
claudian.in_consulatum,264.0,"tectum, paro, epulis, ostrum, inficio, corusco",6,"NaN, NaN, NaN, NaN, NaN, NaN",nan,nan,epulis,0.167
claudian.in_consulatum,265.0,"umidus, gemmiferis, in-luceo, regius, mensis",5,"NaN, NaN, NaN, 0.0, NaN",0.0,0.0,,0.0
claudian.in_consulatum,266.0,"o, bene, signo, fraternus, nomen, tempus",6,"NaN, NaN, NaN, 0.0, 0.0, 0.0",0.0,0.0,fraternus,0.167
claudian.in_consulatum,267.0,"o, consanguineus, felix, auctor, annus",5,"NaN, 0.0, 1.0, NaN, 0.0",0.2,0.0,,0.0
claudian.in_consulatum,268.0,"incipio, quadrifidum, phoebus, torqueo, labor",5,"NaN, NaN, NaN, NaN, -0.5",-0.1,-0.1,,0.0
claudian.in_consulatum,269.0,"primus, tu, procedo, hiems, non, frigor, torpeo",7,"0.5, NaN, NaN, NaN, NaN, NaN, NaN",0.071,0.0,tu,0.143
claudian.in_consulatum,270.0,"non, cano, uestio, nix, non, asper, uenio",7,"NaN, NaN, NaN, NaN, NaN, -0.5, NaN",-0.071,-0.071,uestio,0.143
claudian.in_consulatum,271.0,"sed, tepidus, calefacio, nosco, uer, inde, serenus",7,"NaN, NaN, NaN, NaN, NaN, NaN, NaN",nan,nan,,0.0
claudian.in_consulatum,272.0,"protinus, et, liquidus, clemens, aura, fauoni",6,"NaN, NaN, NaN, 1.0, 1.0, NaN",0.333,0.0,,0.0
claudian.in_consulatum,273.0,"pratum, tu, croceus, pingo, tu, messis, aestas",7,"NaN, NaN, NaN, NaN, NaN, NaN, NaN",nan,nan,"tu, tu",0.286
claudian.in_consulatum,274.0,"induo, auctumnus, madeo, ambiat, labrusca",5,"NaN, 0.0, NaN, NaN, NaN",0.0,0.0,,0.0
claudian.in_consulatum,275.0,"omnis, nobilior, lustrum, tu, gloria, solus",6,"NaN, NaN, NaN, NaN, 0.0, -0.5",-0.083,-0.083,tu,0.167
claudian.in_consulatum,276.0,"contingo, exigo, numquam, memoro, per, aeuum",6,"NaN, NaN, NaN, NaN, NaN, NaN",nan,nan,,0.0
claudian.in_consulatum,277.0,"germani, habeo, dux, tu, cunctus, loquor",6,"NaN, NaN, 0.5, NaN, 0.0, NaN",0.083,0.0,"germani, tu",0.333
claudian.in_consulatum,278.0,"tellus, tu, uarius, scribo, in, flos, hora",7,"NaN, NaN, 0.0, NaN, NaN, 0.5, NaN",0.071,0.0,tu,0.143
claudian.in_consulatum,279.0,"longus, perpetuus, duco, in, saeculum, faueo",6,"0.0, 0.0, NaN, NaN, NaN, NaN",0.0,0.0,,0.0
