Text,Stelle,Inahlt,Wortzahl,Sentiment Rechnung,Sentiment-Score,alternativer Sentiment-Score,Invektiven,Invektivitäts-Score
horace.epodes,1.1,"eo, liburnis, inter, altus, nauis",5,"NaN, NaN, NaN, 0.5, 0.0",0.1,0.0,,0.0
horace.epodes,1.2,"amicus, propugnaculum",2,"1.0, NaN",0.5,0.0,,0.0
horace.epodes,1.3,"paro, omnis, caesar, periculum",4,"NaN, NaN, 0.5, -1.0",-0.125,-0.25,,0.0
horace.epodes,1.4,"subeo, maecenas, tuus",3,"NaN, NaN, 0.0",0.0,0.0,,0.0
horace.epodes,1.5,"quis, nos, qui, tu, uito, sum, super-sto",7,"NaN, NaN, NaN, NaN, NaN, NaN, NaN",nan,nan,tu,0.143
horace.epodes,1.6,"iucundus, si, contra, grauis",4,"1.0, NaN, NaN, -0.5",0.125,-0.125,,0.0
horace.epodes,1.7,"utrum, -ne, iubeo, persequor, otium",5,"NaN, NaN, NaN, NaN, 0.5",0.1,0.0,otium,0.2
horace.epodes,1.8,"non, dulcis, ni, cum, tu, simul",6,"NaN, 0.5, NaN, NaN, NaN, NaN",0.083,0.0,tu,0.167
horace.epodes,1.9,"an, hic, labor, mens, fero, decet",6,"NaN, NaN, -0.5, 0.5, NaN, NaN",0.0,-0.083,hic,0.167
horace.epodes,1.1,"qui, fero, non, mollio, uir",5,"NaN, NaN, NaN, NaN, 0.5",0.1,0.0,,0.0
horace.epodes,1.11,"fero, et, tu, uel, per, alpium, iugum",7,"NaN, NaN, NaN, NaN, NaN, NaN, NaN",nan,nan,tu,0.143
horace.epodes,1.12,"inhospital, et, caucasum",3,"NaN, NaN, NaN",nan,nan,,0.0
horace.epodes,1.13,"uel, occaedes, usque, ad, ulter, sinum",6,"NaN, NaN, NaN, NaN, NaN, NaN",nan,nan,,0.0
horace.epodes,1.14,"fortis, sequor, pectus",3,"0.5, NaN, NaN",0.167,0.0,,0.0
horace.epodes,1.15,"rogo, tuus, labor, quis, iuuo, meus",6,"NaN, 0.0, -0.5, NaN, NaN, 0.0",-0.083,-0.083,,0.0
horace.epodes,1.16,"imbellis, atque, firmus, parum",4,"-1.0, NaN, 1.0, 0.0",0.0,-0.25,,0.0
horace.epodes,1.17,"comes, paruus, sum, sum, in, metus",6,"NaN, 0.0, NaN, NaN, NaN, -1.0",-0.167,-0.167,,0.0
horace.epodes,1.18,"qui, magnus, absum, habeo",4,"NaN, 0.0, NaN, NaN",0.0,0.0,,0.0
horace.epodes,1.19,"ut, assideo, implumis, pullus, auus",5,"NaN, NaN, NaN, NaN, NaN",nan,nan,,0.0
horace.epodes,1.2,"serpo, allabor, timeo",3,"NaN, NaN, NaN",nan,nan,serpo,0.333
horace.epodes,1.21,"magis, relinquo, non, ut, adsum, auxilium",6,"NaN, NaN, NaN, NaN, NaN, 0.0",0.0,0.0,,0.0
horace.epodes,1.22,"fero, multus, praesens",3,"NaN, 0.0, 0.0",0.0,0.0,,0.0
horace.epodes,1.23,"libet, hic, et, omnis, milito",5,"NaN, NaN, NaN, NaN, 0.0",0.0,0.0,hic,0.2
horace.epodes,1.24,"bellum, in, tuus, spes, gratia",5,"0.0, NaN, 0.0, 0.5, 1.0",0.3,0.0,,0.0
horace.epodes,1.25,"non, ut, iuuencus, in-ligo, multus",5,"NaN, NaN, NaN, NaN, 0.0",0.0,0.0,,0.0
horace.epodes,1.26,"aratrum, nitor, meus",3,"NaN, 1.0, 0.0",0.333,0.0,,0.0
horace.epodes,1.27,"pecus, calabris, ante, sidus, feruidus",5,"NaN, NaN, NaN, NaN, -0.5",-0.1,-0.1,calabris,0.2
horace.epodes,1.28,"lucana, muto, pascuum",3,"NaN, NaN, NaN",nan,nan,,0.0
horace.epodes,1.29,"neque, ut, supernus, uilla, candeo, tusculis",6,"NaN, NaN, NaN, NaN, NaN, NaN",nan,nan,,0.0
horace.epodes,1.3,"circaeum, tango, moenia",3,"NaN, NaN, NaN",nan,nan,circaeum,0.333
horace.epodes,1.31,"satis, supo, ego, benignitas, tuus",5,"0.5, NaN, NaN, 1.0, 0.0",0.3,0.0,,0.0
horace.epodes,1.32,"dito, haud, paro",3,"NaN, NaN, NaN",nan,nan,,0.0
horace.epodes,1.33,"qui, aut, auarus, ut, chremes, terra, premo",7,"NaN, NaN, -1.0, NaN, NaN, 0.0, NaN",-0.143,-0.143,auarus,0.143
horace.epodes,1.34,"discingo, aut, perdo, nepos",4,"NaN, NaN, NaN, 0.0",0.0,0.0,,0.0
horace.epodes,2.1,"beatus, ille, qui, procul, negotium",5,"1.0, NaN, NaN, NaN, -0.5",0.1,-0.1,,0.0
horace.epodes,2.2,"ut, priscus, gens, mortalis",4,"NaN, 0.0, 0.0, -1.0",-0.25,-0.25,,0.0
horace.epodes,2.3,"paternus, rus, bos, exerceo, suus",5,"NaN, 0.0, NaN, NaN, NaN",0.0,0.0,,0.0
horace.epodes,2.4,"soluo, omnis, faenus",3,"NaN, NaN, NaN",nan,nan,faenus,0.333
horace.epodes,2.5,"neque, excito, classicus, miles, trux",5,"NaN, NaN, NaN, 0.0, NaN",0.0,0.0,trux,0.2
horace.epodes,2.6,"neque, horreo, irascor, mare",4,"NaN, NaN, NaN, 0.0",0.0,0.0,,0.0
horace.epodes,2.7,"forum, uito, et, superbus, ciuis",5,"NaN, NaN, NaN, -1.0, 0.5",-0.1,-0.2,,0.0
horace.epodes,2.8,"potens, limen",2,"1.0, NaN",0.5,0.0,,0.0
horace.epodes,2.9,"ergo, aut, adolesco, uitium, propago",5,"NaN, NaN, NaN, -1.0, 0.0",-0.2,-0.2,,0.0
horace.epodes,2.1,"alo, marito, populus",3,"NaN, NaN, 0.0",0.0,0.0,marito,0.333
horace.epodes,2.11,"aut, in, reduco, ualles, mugio",5,"NaN, NaN, NaN, NaN, NaN",nan,nan,,0.0
horace.epodes,2.12,"prospecto, erro, grex",3,"NaN, 0.0, NaN",0.0,0.0,,0.0
horace.epodes,2.13,"inutilis, falx, ramus, amputo",4,"-1.0, NaN, NaN, NaN",-0.25,-0.25,inutilis,0.25
horace.epodes,2.14,"felix, insero",2,"1.0, NaN",0.5,0.0,,0.0
horace.epodes,2.15,"aut, premo, purus, mel, condio, amphora",6,"NaN, NaN, 1.0, NaN, NaN, NaN",0.167,0.0,,0.0
horace.epodes,2.16,"aut, tondeo, infirmo, ouum",4,"NaN, NaN, NaN, NaN",nan,nan,,0.0
horace.epodes,2.17,"uel, cum, decorus, mitis, pomum, caput",6,"NaN, NaN, NaN, 1.0, 0.0, 0.0",0.167,0.0,,0.0
horace.epodes,2.18,"auctumnus, ager, effero",3,"0.0, 0.0, NaN",0.0,0.0,,0.0
horace.epodes,2.19,"ut, gaudeo, insitiuus, decerpo, pirum",5,"NaN, NaN, NaN, NaN, NaN",nan,nan,,0.0
horace.epodes,2.2,"certo, et, labrusca, purpura",4,"NaN, NaN, NaN, NaN",nan,nan,,0.0
horace.epodes,2.21,"qui, munero, tu, priape, et, tu, pater",7,"NaN, NaN, NaN, NaN, NaN, NaN, 0.0",0.0,0.0,"tu, tu",0.286
horace.epodes,2.22,"silua, -ne, tuto, finis",4,"NaN, NaN, NaN, 0.0",0.0,0.0,,0.0
horace.epodes,2.23,"libet, iacio, modo, sub, antiquus, ilex",6,"NaN, NaN, NaN, NaN, 0.0, NaN",0.0,0.0,,0.0
horace.epodes,2.24,"modo, in, tenax, gramen",4,"NaN, NaN, NaN, NaN",nan,nan,,0.0
horace.epodes,2.25,"labor, altus, interim, ripa, aqua",5,"-0.5, 0.5, NaN, NaN, 0.0",0.0,-0.1,,0.0
horace.epodes,2.26,"queror, in, silua, aueo",4,"NaN, NaN, NaN, NaN",nan,nan,,0.0
horace.epodes,2.27,"frondeo, lympha, obstrepo, mano",4,"NaN, 0.0, NaN, NaN",0.0,0.0,,0.0
horace.epodes,2.28,"somnus, qui, inuito, leuis",4,"0.5, NaN, NaN, 0.0",0.125,0.0,,0.0
horace.epodes,2.29,"at, cum, tono, annus, hibernus, io",6,"NaN, NaN, NaN, 0.0, NaN, NaN",0.0,0.0,,0.0
horace.epodes,2.3,"imber, nix, con-paro",3,"NaN, NaN, NaN",nan,nan,,0.0
horace.epodes,2.31,"aut, trudo, acer, hinc, et, hinc, multus, canis",8,"NaN, NaN, NaN, NaN, NaN, NaN, 0.0, NaN",0.0,0.0,,0.0
horace.epodes,2.32,"aper, in, obsto, plaga",4,"NaN, NaN, NaN, 0.0",0.0,0.0,,0.0
horace.epodes,2.33,"aut, ames, leuis, rarus, tendo, rete",6,"NaN, NaN, 0.0, NaN, NaN, 0.0",0.0,0.0,,0.0
horace.epodes,2.34,"turdus, edax, dolus",3,"NaN, NaN, NaN",nan,nan,"edax, dolus",0.667
horace.epodes,2.35,"pauidus, lepor, et, aduena, laqueus, gruem",6,"-1.0, 1.0, NaN, NaN, NaN, NaN",0.0,-0.167,,0.0
horace.epodes,2.36,"iucundus, capto, praemium",3,"1.0, NaN, 1.0",0.667,0.0,,0.0
horace.epodes,2.37,"quis, non, malus, qui, amor, cura, habeo",7,"NaN, NaN, -1.0, NaN, 1.0, -1.0, NaN",-0.143,-0.286,,0.0
horace.epodes,2.38,"hic, inter, obliuiscor",3,"NaN, NaN, NaN",nan,nan,hic,0.333
horace.epodes,2.39,"quodsi, pudicus, mulier, in, pars, iuuo",6,"NaN, 0.5, 0.0, NaN, 0.0, NaN",0.083,0.0,"pudicus, mulier",0.333
horace.epodes,2.4,"domus, atque, dulcis, liber",4,"0.0, NaN, 0.5, 0.5",0.25,0.0,,0.0
horace.epodes,2.41,"sabina, qualis, aut, peruro, sol",5,"NaN, NaN, NaN, NaN, NaN",nan,nan,,0.0
horace.epodes,2.42,"pernix, uxor, apulis",3,"NaN, 0.0, NaN",0.0,0.0,uxor,0.333
horace.epodes,2.43,"sacer, uetustus, exstruo, lignum, focus",5,"1.0, 0.0, NaN, NaN, 0.0",0.2,0.0,,0.0
horace.epodes,2.44,"lassus, sub, aduenio, uir",4,"NaN, NaN, NaN, 0.5",0.125,0.0,,0.0
horace.epodes,2.45,"claudeo, textum, cratis, laetus, pecus",5,"NaN, NaN, NaN, 1.0, NaN",0.2,0.0,,0.0
horace.epodes,2.46,"distendo, sicco, uber",3,"NaN, NaN, 1.0",0.333,0.0,,0.0
horace.epodes,2.47,"et, hornus, dulcis, uinum, promo, dolium",6,"NaN, NaN, 0.5, NaN, NaN, NaN",0.083,0.0,dolium,0.167
horace.epodes,2.48,"daps, inemptus, appareo",3,"NaN, NaN, NaN",nan,nan,,0.0
horace.epodes,2.49,"non, ego, lucrinus, iuuo, conchylium",5,"NaN, NaN, NaN, NaN, NaN",nan,nan,,0.0
horace.epodes,2.5,"magus, rhombus, aut, scaris",4,"NaN, NaN, NaN, NaN",nan,nan,rhombus,0.25
horace.epodes,2.51,"siquis, eous, intonata, fluctus",4,"NaN, NaN, NaN, 0.0",0.0,0.0,,0.0
horace.epodes,2.52,"hiems, ad, hic, uerto, mare",5,"NaN, NaN, NaN, NaN, 0.0",0.0,0.0,hic,0.2
horace.epodes,2.53,"non, afra, auus, descendo, in, uenter, meus",7,"NaN, NaN, NaN, NaN, NaN, NaN, 0.0",0.0,0.0,,0.0
horace.epodes,2.54,"non, attage, -ne, ionicus",4,"NaN, NaN, NaN, NaN",nan,nan,,0.0
horace.epodes,2.55,"iucundus, quam, lego, de, pinguis",5,"1.0, NaN, NaN, NaN, NaN",0.2,0.0,,0.0
horace.epodes,2.56,"oliua, ramus, arbor",3,"NaN, NaN, NaN",nan,nan,,0.0
horace.epodes,2.57,"aut, herba, lapathus, pratum, amo, et, grauis",7,"NaN, NaN, NaN, NaN, NaN, NaN, -0.5",-0.071,-0.071,,0.0
horace.epodes,2.58,"malua, salubris, corpus",3,"NaN, 1.0, 0.0",0.333,0.0,,0.0
horace.epodes,2.59,"uel, agna, festus, caedo, terminal",5,"NaN, 0.0, NaN, NaN, NaN",0.0,0.0,agna,0.2
horace.epodes,2.6,"uel, haedus, eripio, lupus",4,"NaN, NaN, NaN, 0.0",0.0,0.0,,0.0
horace.epodes,2.61,"hic, inter, epulae, ut, iuuo, pasco, ouum",7,"NaN, NaN, NaN, NaN, NaN, NaN, NaN",nan,nan,hic,0.143
horace.epodes,2.62,"uideo, propero, domus",3,"NaN, NaN, 0.0",0.0,0.0,,0.0
horace.epodes,2.63,"uideo, fatisco, uomo, inuerto, bos",5,"NaN, NaN, NaN, NaN, NaN",nan,nan,inuerto,0.2
horace.epodes,2.64,"collum, traho, languidus",3,"NaN, NaN, NaN",nan,nan,,0.0
horace.epodes,2.65,"pono, uernus, dis, exame, -ne, domus",6,"NaN, NaN, NaN, NaN, NaN, 0.0",0.0,0.0,,0.0
horace.epodes,2.66,"circum, renideo, laris",3,"NaN, NaN, NaN",nan,nan,,0.0
horace.epodes,2.67,"hic, ubi, loquor, faenerator, alfius",5,"NaN, NaN, NaN, -0.5, NaN",-0.1,-0.1,hic,0.2
horace.epodes,2.68,"iam, iam, sum, rusticus",4,"NaN, NaN, NaN, -0.5",-0.125,-0.125,,0.0
horace.epodes,2.69,"omnis, redigo, idus, pecunia",4,"NaN, NaN, NaN, 0.0",0.0,0.0,pecunia,0.25
horace.epodes,2.7,"quaero, kalendae, pono",3,"NaN, NaN, NaN",nan,nan,,0.0
horace.epodes,3.1,"parens, olim, siquis, impius, manus",5,"0.5, NaN, NaN, -1.0, 0.0",-0.1,-0.2,impius,0.2
horace.epodes,3.2,"senilis, guttur, frango",3,"-0.5, NaN, NaN",-0.167,-0.167,,0.0
horace.epodes,3.3,"edo, cicuta, alius, noceo",4,"NaN, NaN, NaN, NaN",nan,nan,noceo,0.25
horace.epodes,3.4,"o, durus, messor, ilia",4,"NaN, -0.5, 0.0, NaN",-0.125,-0.125,,0.0
horace.epodes,3.5,"quis, hic, uenenum, saeuio, in, praecordia",6,"NaN, NaN, -0.5, NaN, NaN, NaN",-0.083,-0.083,"hic, saeuio",0.333
horace.epodes,3.6,"num, uiperinus, hic, cruor",4,"NaN, NaN, NaN, NaN",nan,nan,"hic, cruor",0.5
horace.epodes,3.7,"incoquo, herba, ego, fallo, an, mala",6,"NaN, NaN, NaN, NaN, NaN, NaN",nan,nan,fallo,0.167
horace.epodes,3.8,"canidia, tracto, daps",3,"NaN, NaN, NaN",nan,nan,canidia,0.333
horace.epodes,3.9,"ut, argonautas, praeter, omnis, candidus",5,"NaN, NaN, NaN, NaN, NaN",nan,nan,,0.0
horace.epodes,3.1,"medea, miror, sum, dux",4,"NaN, NaN, NaN, 0.5",0.125,0.0,medea,0.25
horace.epodes,3.11,"ignotus, taurus, in-ligo, iugum",4,"-0.5, NaN, NaN, NaN",-0.125,-0.125,,0.0
horace.epodes,3.12,"perungo, hic, iasonem",3,"NaN, NaN, NaN",nan,nan,hic,0.333
horace.epodes,3.13,"hic, delibuo, ulciscor, donum, paelicem",5,"NaN, NaN, NaN, 0.0, NaN",0.0,0.0,"hic, ulciscor",0.4
horace.epodes,3.14,"serpo, fugio, alo",3,"NaN, NaN, NaN",nan,nan,serpo,0.333
horace.epodes,3.15,"neque, tantus, umquam, sidus, in-sedeo, uapor",6,"NaN, NaN, NaN, NaN, NaN, NaN",nan,nan,,0.0
horace.epodes,3.16,"siticulosus, appulia",2,"NaN, NaN",nan,nan,,0.0
horace.epodes,3.17,"neque, munus, umerus, efficax, hercules",5,"NaN, 0.5, NaN, 1.0, NaN",0.3,0.0,,0.0
horace.epodes,3.18,"in-ardeo, aestuosus",2,"NaN, NaN",nan,nan,,0.0
horace.epodes,3.19,"at, siquis, umquam, talis, con-cupio",5,"NaN, NaN, NaN, NaN, NaN",nan,nan,,0.0
horace.epodes,3.2,"iocosus, maecenas, precor",3,"NaN, NaN, NaN",nan,nan,,0.0
horace.epodes,3.21,"manus, puella, sauio, op-pono, tuus",5,"0.0, NaN, NaN, NaN, 0.0",0.0,0.0,,0.0
horace.epodes,3.22,"exter, et, in, sponda, cubo",5,"0.0, NaN, NaN, NaN, NaN",0.0,0.0,,0.0
horace.epodes,4.1,"lupus, et, agnus, quantus, sortior, obtingo",6,"0.0, NaN, NaN, NaN, NaN, NaN",0.0,0.0,,0.0
horace.epodes,4.2,"cum, tu, ego, discordia, sum",5,"NaN, NaN, NaN, NaN, NaN",nan,nan,tu,0.2
horace.epodes,4.3,"hibericis, peruro, funis, latus",4,"NaN, NaN, NaN, NaN",nan,nan,,0.0
horace.epodes,4.4,"et, crus, durus, compedes",4,"NaN, NaN, -0.5, NaN",-0.125,-0.125,,0.0
horace.epodes,4.5,"licet, superbus, ambulis, pecunia",4,"NaN, -1.0, NaN, 0.0",-0.25,-0.25,pecunia,0.25
horace.epodes,4.6,"fortuna, non, muto, genus",4,"0.0, NaN, NaN, 0.0",0.0,0.0,,0.0
horace.epodes,4.7,"uideo, -ne, sacer, metior, tu, uia",6,"NaN, NaN, 1.0, NaN, NaN, 0.0",0.167,0.0,tu,0.167
horace.epodes,4.8,"cum, bis, tres, ulnaris, toga",5,"NaN, NaN, NaN, NaN, NaN",nan,nan,,0.0
horace.epodes,4.9,"ut, os, uerto, huc, et, huc, eo",7,"NaN, 0.0, NaN, NaN, NaN, NaN, NaN",0.0,0.0,,0.0
horace.epodes,4.1,"liber, indignatio",2,"0.5, -1.0",-0.25,-0.5,,0.0
horace.epodes,4.11,"seco, flagellum, hic, triumuiral",4,"NaN, NaN, NaN, NaN",nan,nan,hic,0.25
horace.epodes,4.12,"praeco, ad, fastidium",3,"NaN, NaN, NaN",nan,nan,,0.0
horace.epodes,4.13,"aro, falerni, mille, fundo, iugerum",5,"NaN, NaN, NaN, NaN, NaN",nan,nan,,0.0
horace.epodes,4.14,"et, appiam, mannus, tero",4,"NaN, NaN, NaN, NaN",nan,nan,,0.0
horace.epodes,4.15,"sedile, magnus, in, primus, eques",5,"0.0, 0.0, NaN, 0.5, 0.0",0.1,0.0,,0.0
horace.epodes,4.16,"otho, -ne, contemno, sedeo",4,"NaN, NaN, NaN, NaN",nan,nan,,0.0
horace.epodes,4.17,"quis, attineo, tot, os, nauis, grauis",6,"NaN, NaN, NaN, 0.0, 0.0, -0.5",-0.083,-0.083,,0.0
horace.epodes,4.18,"rostratus, duco, pondus",3,"NaN, NaN, NaN",nan,nan,,0.0
horace.epodes,4.19,"contra, latro, atque, seruilis, manus",5,"NaN, NaN, NaN, -0.5, 0.0",-0.1,-0.1,latro,0.2
horace.epodes,4.2,"hic, hic, tribunus, miles",4,"NaN, NaN, -0.5, 0.0",-0.125,-0.125,"hic, hic",0.5
horace.epodes,5.1,"at, o, deus, quisquis, in, caelum, rego",7,"NaN, NaN, 0.0, NaN, NaN, 0.5, NaN",0.071,0.0,,0.0
horace.epodes,5.2,"terra, et, humanus, genus",4,"0.0, NaN, 0.0, 0.0",0.0,0.0,,0.0
horace.epodes,5.3,"quis, iste, fero, tumultus, aut, quis, omnis",7,"NaN, NaN, NaN, NaN, NaN, NaN, NaN",nan,nan,,0.0
horace.epodes,5.4,"uultus, in, unus, ego, trux",5,"NaN, NaN, NaN, NaN, NaN",nan,nan,trux,0.2
horace.epodes,5.5,"per, liber, tu, si, uoco, partus",6,"NaN, 0.5, NaN, NaN, NaN, NaN",0.083,0.0,tu,0.167
horace.epodes,5.6,"lucinus, uerus, adsum",3,"NaN, 0.5, NaN",0.167,0.0,,0.0
horace.epodes,5.7,"per, hic, inanis, purpura, decus, precor",6,"NaN, NaN, NaN, NaN, NaN, NaN",nan,nan,hic,0.167
horace.epodes,5.8,"per, in-probo, hic, iouem",4,"NaN, NaN, NaN, NaN",nan,nan,hic,0.25
horace.epodes,5.9,"quis, ut, nouerca, ego, intueor, aut, uti",7,"NaN, NaN, NaN, NaN, NaN, NaN, NaN",nan,nan,nouerca,0.143
horace.epodes,5.1,"peto, ferrum, belua",3,"NaN, NaN, NaN",nan,nan,,0.0
horace.epodes,5.11,"ut, hic, tremo, queror, os, consto",6,"NaN, NaN, NaN, NaN, 0.0, NaN",0.0,0.0,hic,0.167
horace.epodes,5.12,"insignis, rapio, puer",3,"0.0, NaN, 0.0",0.0,0.0,,0.0
horace.epodes,5.13,"inpube, corpus, qualis, possum, impius",5,"NaN, 0.0, NaN, NaN, -1.0",-0.2,-0.2,impius,0.2
horace.epodes,5.14,"mollio, thracum, pectus",3,"NaN, NaN, NaN",nan,nan,thracum,0.333
horace.epodes,5.15,"canidia, breuis, illigo, uipera",4,"NaN, NaN, NaN, 0.0",0.0,0.0,canidia,0.25
horace.epodes,5.16,"crinis, et, incomis, caput",4,"NaN, NaN, -1.0, 0.0",-0.25,-0.25,,0.0
horace.epodes,5.17,"iubeo, sepulcrum, caprificus, eruo",4,"NaN, NaN, NaN, NaN",nan,nan,sepulcrum,0.25
horace.epodes,5.18,"iubeo, cupressus, funebris",3,"NaN, NaN, -0.5",-0.167,-0.167,,0.0
horace.epodes,5.19,"et, unctus, turpis, ouo, rana, sanguis",6,"NaN, NaN, -1.0, NaN, NaN, NaN",-0.167,-0.167,turpis,0.167
horace.epodes,5.2,"pluma, nocturnus, striga",3,"NaN, NaN, NaN",nan,nan,striga,0.333
horace.epodes,5.21,"herba, qui, iolcos, atque, hiberia",5,"NaN, NaN, NaN, NaN, NaN",nan,nan,,0.0
horace.epodes,5.22,"mitto, uenenum, ferax",3,"NaN, -0.5, 1.0",0.167,-0.167,,0.0
horace.epodes,5.23,"et, os, ab, os, rapio, ieiunus, canis",7,"NaN, 0.0, NaN, 0.0, NaN, NaN, NaN",0.0,0.0,,0.0
horace.epodes,5.24,"flamma, aduro, colchicum",3,"NaN, NaN, NaN",nan,nan,,0.0
horace.epodes,5.25,"at, expedio, sagana, per, totus, domus",6,"NaN, NaN, NaN, NaN, NaN, 0.0",0.0,0.0,,0.0
horace.epodes,5.26,"spargo, auernal, aqua",3,"NaN, NaN, 0.0",0.0,0.0,,0.0
horace.epodes,5.27,"horreo, capillus, ut, marinus, asper",5,"NaN, NaN, NaN, NaN, -0.5",-0.1,-0.1,capillus,0.2
horace.epodes,5.28,"echinus, aut, laurens, aper",4,"NaN, NaN, NaN, NaN",nan,nan,,0.0
horace.epodes,5.29,"abigo, nullus, ueia, conscientia",4,"NaN, NaN, NaN, 0.0",0.0,0.0,conscientia,0.25
horace.epodes,5.3,"ligo, durus, humus",3,"NaN, -0.5, NaN",-0.167,-0.167,humus,0.333
horace.epodes,5.31,"exhaurio, ingemo, labor",3,"NaN, NaN, -0.5",-0.167,-0.167,,0.0
horace.epodes,5.32,"quo, possum, infodio, puer",4,"NaN, NaN, NaN, 0.0",0.0,0.0,,0.0
horace.epodes,5.33,"longus, dies, bis, ter, muto, daps",6,"0.0, 0.0, NaN, NaN, NaN, NaN",0.0,0.0,,0.0
horace.epodes,5.34,"inemorior, spectaculum",2,"NaN, 0.0",0.0,0.0,spectaculum,0.5
horace.epodes,5.35,"cum, promineo, os, quantus, exsto, aqua",6,"NaN, NaN, 0.0, NaN, NaN, 0.0",0.0,0.0,,0.0
horace.epodes,5.36,"suspendo, mentum, corpus",3,"NaN, NaN, 0.0",0.0,0.0,,0.0
horace.epodes,5.37,"exsugo, uti, medulla, et, aridus, iecur",6,"NaN, NaN, NaN, NaN, NaN, NaN",nan,nan,,0.0
horace.epodes,5.38,"amor, sum, poculum",3,"1.0, NaN, NaN",0.333,0.0,,0.0
horace.epodes,5.39,"intermino, cum, semel, figo, cibus",5,"NaN, NaN, NaN, NaN, NaN",nan,nan,,0.0
horace.epodes,5.4,"intabesco, pupula",2,"NaN, NaN",nan,nan,,0.0
horace.epodes,5.41,"non, desum, masculus, libido",4,"NaN, NaN, NaN, -0.5",-0.125,-0.125,libido,0.25
horace.epodes,5.42,"ariminensem, foliam",2,"NaN, NaN",nan,nan,,0.0
horace.epodes,5.43,"et, otiosus, credo, neapolis",4,"NaN, NaN, NaN, NaN",nan,nan,,0.0
horace.epodes,5.44,"et, omnis, uicinus, oppidum",4,"NaN, NaN, 0.0, NaN",0.0,0.0,,0.0
horace.epodes,5.45,"qui, sidus, excanto, uox, thessala",5,"NaN, NaN, NaN, 0.0, NaN",0.0,0.0,,0.0
horace.epodes,5.46,"luna, caelum, deripio",3,"NaN, 0.5, NaN",0.167,0.0,,0.0
horace.epodes,5.47,"hic, irresectus, saeuus, dens, liuidus",5,"NaN, NaN, -1.0, NaN, NaN",-0.2,-0.2,"hic, saeuus",0.4
horace.epodes,5.48,"canidia, rodo, pollex",3,"NaN, NaN, 0.0",0.0,0.0,canidia,0.333
horace.epodes,5.49,"quis, dico, aut, quis, taceo, o, res, meus",8,"NaN, NaN, NaN, NaN, NaN, NaN, 0.0, 0.0",0.0,0.0,,0.0
horace.epodes,5.5,"non, infidelis, arbitra",3,"NaN, -1.0, NaN",-0.333,-0.333,,0.0
horace.epodes,5.51,"nox, et, diana, qui, silentium, rex",6,"0.0, NaN, NaN, NaN, NaN, 0.0",0.0,0.0,,0.0
horace.epodes,5.52,"arcanus, cum, fio, sacer",4,"NaN, NaN, NaN, 1.0",0.25,0.0,,0.0
horace.epodes,5.53,"nunc, nunc, adsum, nunc, in, hostilis, domus",7,"NaN, NaN, NaN, NaN, NaN, -1.0, 0.0",-0.143,-0.143,hostilis,0.143
horace.epodes,5.54,"ira, atque, numen, uerto",4,"-1.0, NaN, NaN, NaN",-0.25,-0.25,,0.0
horace.epodes,5.55,"formidulosus, cum, lateo, silua, fera",5,"-1.0, NaN, NaN, NaN, NaN",-0.2,-0.2,fera,0.2
horace.epodes,5.56,"dulcis, soporus, languidus",3,"0.5, NaN, NaN",0.167,0.0,,0.0
horace.epodes,5.57,"senex, qui, omnis, rideo, adulter",5,"0.0, NaN, NaN, NaN, NaN",0.0,0.0,adulter,0.2
horace.epodes,5.58,"latro, suburanae, canis",3,"NaN, NaN, NaN",nan,nan,latro,0.333
horace.epodes,5.59,"nardus, perungo, qualis, non, perficio",5,"NaN, NaN, NaN, NaN, NaN",nan,nan,,0.0
horace.epodes,5.6,"meus, laboro, manus",3,"0.0, NaN, 0.0",0.0,0.0,,0.0
horace.epodes,5.61,"quis, accido, cur, dirus, barbara, paruus",6,"NaN, NaN, NaN, -1.0, NaN, 0.0",-0.167,-0.167,"dirus, barbara",0.333
horace.epodes,5.62,"ueneno, medeae, ualeo",3,"NaN, NaN, NaN",nan,nan,,0.0
horace.epodes,5.63,"qui, superbus, fugio, ulciscor, paelicem",5,"NaN, -1.0, NaN, NaN, NaN",-0.2,-0.2,ulciscor,0.2
horace.epodes,5.64,"magnus, creontis, filia",3,"0.0, NaN, NaN",0.0,0.0,creontis,0.333
horace.epodes,5.65,"cum, palla, to, munus, imbuo, nouus",6,"NaN, NaN, NaN, 0.5, NaN, 1.0",0.25,0.0,,0.0
horace.epodes,5.66,"incendium, nupta, aufero",3,"NaN, NaN, NaN",nan,nan,nupta,0.333
horace.epodes,5.67,"atqui, neque, herba, neque, lateo, in, asper",7,"NaN, NaN, NaN, NaN, NaN, NaN, -0.5",-0.071,-0.071,,0.0
horace.epodes,5.68,"radix, fallo, ego, locus",4,"0.0, NaN, NaN, 0.0",0.0,0.0,fallo,0.25
horace.epodes,5.69,"indormio, ungo, omnis, cubilis",4,"NaN, NaN, NaN, NaN",nan,nan,,0.0
horace.epodes,5.7,"obliuio, -ne, paelicum",3,"-0.5, NaN, NaN",-0.167,-0.167,,0.0
horace.epodes,5.71,"ab, ab, soluo, ambulo, uenefica",5,"NaN, NaN, NaN, NaN, NaN",nan,nan,,0.0
horace.epodes,5.72,"scio, carmen",2,"NaN, 0.0",0.0,0.0,,0.0
horace.epodes,5.73,"non, usitas, uaris, potio",4,"NaN, NaN, NaN, NaN",nan,nan,,0.0
horace.epodes,5.74,"o, multus, fleo, caput",4,"NaN, 0.0, NaN, 0.0",0.0,0.0,,0.0
horace.epodes,5.75,"ad, ego, recurro, neque, uoco, mens, tuus",7,"NaN, NaN, NaN, NaN, NaN, 0.5, 0.0",0.071,0.0,,0.0
horace.epodes,5.76,"marsis, redeo, uox",3,"NaN, NaN, 0.0",0.0,0.0,,0.0
horace.epodes,5.77,"magnus, paro, magnus, infundo, tu",5,"0.0, NaN, 0.0, NaN, NaN",0.0,0.0,tu,0.2
horace.epodes,5.78,"fastidio, poculum",2,"NaN, NaN",nan,nan,,0.0
horace.epodes,5.79,"prior, caelum, sido, inferus, mare",5,"0.5, 0.5, NaN, NaN, 0.0",0.2,0.0,,0.0
horace.epodes,5.8,"tellus, porrigo, super",3,"NaN, NaN, NaN",nan,nan,,0.0
horace.epodes,5.81,"quam, non, amor, sic, meus, flagro, uti",7,"NaN, NaN, 1.0, NaN, 0.0, NaN, NaN",0.143,0.0,,0.0
horace.epodes,5.82,"bitume, -ne, ater, ignis",4,"NaN, NaN, NaN, 0.0",0.0,0.0,,0.0
horace.epodes,5.83,"sub, hic, puer, iam, non, ut, ante, mollis",8,"NaN, NaN, 0.0, NaN, NaN, NaN, NaN, NaN",0.0,0.0,hic,0.125
horace.epodes,5.84,"lenio, uerbum, impius",3,"NaN, 0.0, -1.0",-0.333,-0.333,impius,0.333
horace.epodes,5.85,"sed, dubius, unde, rumpo, silentium",5,"NaN, -0.5, NaN, NaN, NaN",-0.1,-0.1,,0.0
horace.epodes,5.86,"mitto, thyesteas, prex",3,"NaN, NaN, 0.0",0.0,0.0,,0.0
horace.epodes,5.87,"ueneno, magus, non, fas, nefas, non, ualeo",7,"NaN, NaN, NaN, NaN, -1.0, NaN, NaN",-0.143,-0.143,nefas,0.143
horace.epodes,5.88,"conuerto, humanus, uicis",3,"NaN, 0.0, NaN",0.0,0.0,,0.0
horace.epodes,5.89,"dirus, ago, tu, dirus, detestatio",5,"-1.0, NaN, NaN, -1.0, NaN",-0.4,-0.4,"dirus, tu, dirus",0.6
horace.epodes,5.9,"nullus, expio, uictima",3,"NaN, NaN, NaN",nan,nan,expio,0.333
horace.epodes,5.91,"quin, ubi, pereo, iubeo, exspiro",5,"NaN, NaN, NaN, NaN, NaN",nan,nan,,0.0
horace.epodes,5.92,"nocturnus, occurro, furor",3,"NaN, NaN, -1.0",-0.333,-0.333,furor,0.333
horace.epodes,5.93,"peto, uultus, umbra, curuus, unguis",5,"NaN, NaN, NaN, NaN, NaN",nan,nan,,0.0
horace.epodes,5.94,"qui, uolo, deus, sum, manium",5,"NaN, NaN, 0.0, NaN, NaN",0.0,0.0,,0.0
horace.epodes,5.95,"et, inquietus, assideo, praecordia",4,"NaN, NaN, NaN, NaN",nan,nan,,0.0
horace.epodes,5.96,"pauor, somnus, aufero",3,"-1.0, 0.5, NaN",-0.167,-0.333,,0.0
horace.epodes,5.97,"tu, turba, uicatim, hinc, et, hinc, saxum, peto",8,"NaN, 0.0, NaN, NaN, NaN, NaN, 0.0, NaN",0.0,0.0,tu,0.125
horace.epodes,5.98,"contundo, obscaenas, anus",3,"NaN, NaN, 0.0",0.0,0.0,,0.0
horace.epodes,5.99,"post, insepultus, membrum, differo, lupus",5,"NaN, -0.5, NaN, NaN, 0.0",-0.1,-0.1,insepultus,0.2
horace.epodes,5.1,"et, esquilinae, aliter",3,"NaN, NaN, NaN",nan,nan,,0.0
horace.epodes,5.101,"neque, hic, parens, heu, ego, superstito",6,"NaN, NaN, 0.5, NaN, NaN, NaN",0.083,0.0,"hic, heu",0.333
horace.epodes,5.102,"effugio, spectaculum",2,"NaN, 0.0",0.0,0.0,spectaculum,0.5
horace.epodes,6.1,"quis, immerens, hospes, uexo, canis",5,"NaN, 1.0, 0.0, NaN, NaN",0.2,0.0,uexo,0.2
horace.epodes,6.2,"ignauus, aduerro, lupus",3,"-1.0, NaN, 0.0",-0.333,-0.333,ignauus,0.333
horace.epodes,6.3,"quin, huc, inanis, si, possum, uerto, minae",7,"NaN, NaN, NaN, NaN, NaN, NaN, -0.5",-0.071,-0.071,,0.0
horace.epodes,6.4,"et, ego, remordeo, peto",4,"NaN, NaN, NaN, NaN",nan,nan,,0.0
horace.epodes,6.5,"nam, qualis, aut, molossus, aut, fuluus, laco, -ne",8,"NaN, NaN, NaN, NaN, NaN, NaN, NaN, NaN",nan,nan,,0.0
horace.epodes,6.6,"amicus, uolo, pastor",3,"1.0, NaN, NaN",0.333,0.0,,0.0
horace.epodes,6.7,"ago, per, alo, auris, tollo, nix",6,"NaN, NaN, NaN, NaN, NaN, NaN",nan,nan,,0.0
horace.epodes,6.8,"quicumque, praecedo, ferus",3,"NaN, NaN, -1.0",-0.333,-0.333,ferus,0.333
horace.epodes,6.9,"tu, cum, timeo, uox, compleo, nemus",6,"NaN, NaN, NaN, 0.0, NaN, NaN",0.0,0.0,tu,0.167
horace.epodes,6.1,"proiectum, odoraris, cibus",3,"NaN, NaN, NaN",nan,nan,,0.0
horace.epodes,6.11,"caueo, caueo, namque, in, malus, asper",6,"NaN, NaN, NaN, NaN, -1.0, -0.5",-0.25,-0.25,,0.0
horace.epodes,6.12,"paro, tollo, cornu",3,"NaN, NaN, NaN",nan,nan,,0.0
horace.epodes,6.13,"qualis, lycambae, sperno, infidus, gener",5,"NaN, NaN, NaN, -1.0, NaN",-0.2,-0.2,,0.0
horace.epodes,6.14,"aut, acer, hostis, bupalo",4,"NaN, NaN, -1.0, NaN",-0.25,-0.25,,0.0
horace.epodes,6.15,"an, si, quis, ater, dens, ego, peto",7,"NaN, NaN, NaN, NaN, NaN, NaN, NaN",nan,nan,,0.0
horace.epodes,6.16,"inultus, ut, fleo, puer",4,"-0.5, NaN, NaN, 0.0",-0.125,-0.125,inultus,0.25
horace.epodes,7.1,"quo, quo, scelestus, ruo, aut, cur, dexter",7,"NaN, NaN, -1.0, NaN, NaN, NaN, NaN",-0.143,-0.143,scelestus,0.143
horace.epodes,7.2,"apto, ensis, condio",3,"NaN, NaN, NaN",nan,nan,,0.0
horace.epodes,7.3,"parum, -ne, campus, atque, neptunus, super",6,"0.0, NaN, 0.0, NaN, NaN, NaN",0.0,0.0,,0.0
horace.epodes,7.4,"fundo, sum, latinus, sanguis",4,"NaN, NaN, NaN, NaN",nan,nan,,0.0
horace.epodes,7.5,"non, ut, superbus, inuidus, karthago",5,"NaN, NaN, -1.0, -1.0, NaN",-0.4,-0.4,inuidus,0.2
horace.epodes,7.6,"romanus, arx, uro",3,"NaN, NaN, NaN",nan,nan,,0.0
horace.epodes,7.7,"intactus, aut, britannus, ut, descendo",5,"NaN, NaN, NaN, NaN, NaN",nan,nan,,0.0
horace.epodes,7.8,"sacer, cateno, uia",3,"1.0, NaN, 0.0",0.333,0.0,cateno,0.333
horace.epodes,7.9,"sed, ut, secundus, ueto, parthi, suus",6,"NaN, NaN, 0.0, NaN, NaN, NaN",0.0,0.0,parthi,0.167
