Text,Stelle,Inahlt,Wortzahl,Sentiment Rechnung,Sentiment-Score,alternativer Sentiment-Score,Invektiven,Invektivitäts-Score
horace.epodes,16.44,"et, imputatus, floreo, usque, uinea",5,"NaN, NaN, NaN, NaN, NaN",nan,nan,,0.0
horace.epodes,16.45,"germino, et, numquam, fallo, termes, oliua",6,"NaN, NaN, NaN, NaN, NaN, NaN",nan,nan,fallo,0.167
horace.epodes,16.46,"suo, pullo, ficus, orno, arbor",5,"NaN, NaN, NaN, NaN, NaN",nan,nan,,0.0
horace.epodes,16.47,"mel, cauo, mano, ex, ilex, mons, altus",7,"NaN, NaN, NaN, NaN, NaN, NaN, 0.5",0.071,0.0,,0.0
horace.epodes,16.48,"leuis, crepo, lympha, desilo, pes",5,"0.0, NaN, 0.0, NaN, 0.0",0.0,0.0,,0.0
horace.epodes,16.49,"illic, iniussus, uenio, ad, mulctra, capella",6,"NaN, NaN, NaN, NaN, NaN, NaN",nan,nan,capella,0.167
horace.epodes,16.5,"refero, tento, grex, amicus, uber",5,"NaN, NaN, NaN, 1.0, 1.0",0.4,0.0,,0.0
horace.epodes,16.51,"neque, uespertinus, circumgemo, ursus, ouilis",5,"NaN, NaN, NaN, NaN, NaN",nan,nan,ursus,0.2
horace.epodes,16.52,"neque, intumesco, altus, uipera, humus",5,"NaN, NaN, 0.5, 0.0, NaN",0.1,0.0,humus,0.2
horace.epodes,16.53,"multus, felix, miro, ut, neque, largior",6,"0.0, 1.0, NaN, NaN, NaN, NaN",0.167,0.0,,0.0
horace.epodes,16.54,"aquosus, eurus, aruum, rado, imber",5,"NaN, NaN, NaN, NaN, NaN",nan,nan,,0.0
horace.epodes,16.55,"pinguis, neque, siccus, uro, semen, glaeba",6,"NaN, NaN, NaN, NaN, NaN, NaN",nan,nan,glaeba,0.167
horace.epodes,16.56,"uterque, rex, tempero, caelitum",4,"NaN, 0.0, NaN, NaN",0.0,0.0,,0.0
horace.epodes,16.57,"non, huc, argoo, contendo, remex, pinus",6,"NaN, NaN, NaN, NaN, NaN, 0.0",0.0,0.0,,0.0
horace.epodes,16.58,"neque, impudicus, colchis, infero, pedis",5,"NaN, -1.0, NaN, NaN, 0.0",-0.2,-0.2,impudicus,0.2
horace.epodes,16.59,"non, huc, sidonii, torqueo, cornu, nauta",6,"NaN, NaN, NaN, NaN, NaN, NaN",nan,nan,,0.0
horace.epodes,16.6,"laboriosus, neque, cohors, ulixei",4,"NaN, NaN, NaN, NaN",nan,nan,laboriosus,0.25
horace.epodes,16.61,"nullus, noceo, pecus, contagium, nullus, astrion",6,"NaN, NaN, NaN, -1.0, NaN, NaN",-0.167,-0.167,noceo,0.167
horace.epodes,16.62,"grex, aestuosus, torreo, impotens",4,"NaN, NaN, NaN, -1.0",-0.25,-0.25,impotens,0.25
horace.epodes,16.63,"iuppiter, ille, pius, secerno, litus, gens",6,"NaN, NaN, NaN, NaN, NaN, 0.0",0.0,0.0,,0.0
horace.epodes,16.64,"ut, inquino, aer, tempus, aureus",5,"NaN, NaN, 0.0, 0.0, 0.5",0.1,0.0,inquino,0.2
horace.epodes,16.65,"aer, dehinc, ferrum, duro, saeculum, qui",6,"0.0, NaN, NaN, NaN, NaN, NaN",0.0,0.0,,0.0
horace.epodes,16.66,"pius, secundus, uates, ego, do, fuga",6,"NaN, 0.0, NaN, NaN, NaN, -0.5",-0.083,-0.083,,0.0
horace.epodes,17.1,"iam, iam, efficax, do, manus, scientia",6,"NaN, NaN, 1.0, NaN, 0.0, 0.0",0.167,0.0,,0.0
horace.epodes,17.2,"supplex, et, oro, regnum, per, proserpinae",6,"0.0, NaN, NaN, 0.0, NaN, NaN",0.0,0.0,,0.0
horace.epodes,17.3,"per, et, diana, non, moueo, numen",6,"NaN, NaN, NaN, NaN, NaN, NaN",nan,nan,,0.0
horace.epodes,17.4,"per, atque, liber, carmen, ualeo",5,"NaN, NaN, 0.5, 0.0, NaN",0.1,0.0,,0.0
horace.epodes,17.5,"refigo, caelum, deuocaris, sidus",4,"NaN, 0.5, NaN, NaN",0.125,0.0,,0.0
horace.epodes,17.6,"canidia, parco, uox, tandem, sacrum",5,"NaN, NaN, 0.0, NaN, NaN",0.0,0.0,canidia,0.2
horace.epodes,17.7,"cieo, retro, soluo, soluo, turbo",5,"NaN, NaN, NaN, NaN, NaN",nan,nan,,0.0
horace.epodes,17.8,"moueo, nepos, telephus, nereium",4,"NaN, 0.0, NaN, NaN",0.0,0.0,,0.0
horace.epodes,17.9,"in, qui, superbus, ordino, agmen",5,"NaN, NaN, -1.0, NaN, -1.0",-0.4,-0.4,,0.0
horace.epodes,17.1,"mysus, et, in, qui, telum, acutus, torqueo",7,"NaN, NaN, NaN, NaN, NaN, NaN, NaN",nan,nan,,0.0
horace.epodes,17.11,"ungo, mater, iliae, addo, fera",5,"NaN, 0.0, NaN, NaN, NaN",0.0,0.0,fera,0.2
horace.epodes,17.12,"alitibus, atque, canis, homicida, hector",5,"NaN, NaN, NaN, -1.0, NaN",-0.2,-0.2,"alitibus, homicida",0.4
horace.epodes,17.13,"postquam, relinquo, moenia, rex, pro-caedo",5,"NaN, NaN, NaN, 0.0, NaN",0.0,0.0,,0.0
horace.epodes,17.14,"heu, peruicax, ad, pes, achilleos",5,"NaN, NaN, NaN, 0.0, NaN",0.0,0.0,"heu, peruicax",0.4
horace.epodes,17.15,"saetosus, durus, exuo, pellis",4,"NaN, -0.5, NaN, 0.0",-0.125,-0.125,pellis,0.25
horace.epodes,17.16,"laboriosus, remex, ulixei",3,"NaN, NaN, NaN",nan,nan,laboriosus,0.333
horace.epodes,17.17,"uolo, circa, membrum, tunc, mens, et, sonus",7,"NaN, NaN, NaN, NaN, 0.5, NaN, NaN",0.071,0.0,,0.0
horace.epodes,17.18,"relabor, atque, notus, in, uultus, honor",6,"NaN, NaN, 0.0, NaN, NaN, 1.0",0.167,0.0,,0.0
horace.epodes,17.19,"do, satis, supo, poena, tu",5,"NaN, 0.5, NaN, -1.0, NaN",-0.1,-0.2,"poena, tu",0.4
horace.epodes,17.2,"amo, nauta, multus, et, institor",5,"NaN, NaN, 0.0, NaN, NaN",0.0,0.0,,0.0
horace.epodes,17.21,"fugio, iuuenta, et, uerecundus, color",5,"NaN, NaN, NaN, 1.0, 0.0",0.2,0.0,,0.0
horace.epodes,17.22,"relinquo, os, pello, amicio, luridus",5,"NaN, 0.0, NaN, NaN, -1.0",-0.2,-0.2,,0.0
horace.epodes,17.23,"tuus, capillus, albus, sum, odor",5,"0.0, NaN, NaN, NaN, 0.0",0.0,0.0,capillus,0.2
horace.epodes,17.24,"nullus, ab, labor, ego, reclino, otium",6,"NaN, NaN, -0.5, NaN, NaN, 0.5",0.0,-0.083,otium,0.167
horace.epodes,17.25,"urgeo, dies, nox, et, dies, nox, neque, sum",8,"NaN, 0.0, 0.0, NaN, 0.0, 0.0, NaN, NaN",0.0,0.0,,0.0
horace.epodes,17.26,"leuaris, tento, spiritus, praecordia",4,"NaN, NaN, 0.0, NaN",0.0,0.0,,0.0
horace.epodes,17.27,"ergo, nego, uinco, ut, credo, miser",6,"NaN, NaN, NaN, NaN, NaN, -1.0",-0.167,-0.167,miser,0.167
horace.epodes,17.28,"sabella, pectus, increparis, carmen",4,"NaN, NaN, NaN, 0.0",0.0,0.0,,0.0
horace.epodes,17.29,"caput, marsa, dissilire, nenia",4,"0.0, NaN, NaN, NaN",0.0,0.0,,0.0
horace.epodes,17.3,"quis, amplus, uolo, o, mare, et, terra, ardeo",8,"NaN, 0.0, NaN, NaN, 0.0, NaN, 0.0, NaN",0.0,0.0,,0.0
horace.epodes,17.31,"quantus, neque, ater, delibuo, herculis",5,"NaN, NaN, NaN, NaN, NaN",nan,nan,,0.0
horace.epodes,17.32,"nession, cruor, neque, sicana, feruidus",5,"NaN, NaN, NaN, NaN, -0.5",-0.1,-0.1,"nession, cruor, sicana",0.6
horace.epodes,17.33,"uireo, in, aetna, flamma, tu, donec, cinis",7,"NaN, NaN, NaN, NaN, NaN, NaN, NaN",nan,nan,tu,0.143
horace.epodes,17.34,"iniuriosus, aridus, uenio, fero",4,"-1.0, NaN, NaN, NaN",-0.25,-0.25,,0.0
horace.epodes,17.35,"cal, uenenum, officina, colchicum",4,"NaN, -0.5, NaN, NaN",-0.125,-0.125,,0.0
horace.epodes,17.36,"qui, finis, aut, qui, ego, maneo, stipendium",7,"NaN, 0.0, NaN, NaN, NaN, NaN, NaN",0.0,0.0,,0.0
horace.epodes,17.37,"effaris, iubeo, cum, fides, poena, luo",6,"NaN, NaN, NaN, 1.0, -1.0, NaN",0.0,-0.167,"poena, luo",0.333
horace.epodes,17.38,"paro, expiaris, seu, posco",4,"NaN, NaN, NaN, NaN",nan,nan,,0.0
horace.epodes,17.39,"centum, iuuencus, siue, mendacium, lyra",5,"NaN, NaN, NaN, -1.0, 0.0",-0.2,-0.2,mendacium,0.2
horace.epodes,17.4,"uolo, sono, tu, pudicus, tu, probus",6,"NaN, NaN, NaN, 0.5, NaN, 1.0",0.25,0.0,"tu, pudicus, tu, probus",0.667
horace.epodes,17.41,"perambulo, astrum, sidus, aureus",4,"NaN, NaN, NaN, 0.5",0.125,0.0,,0.0
horace.epodes,17.42,"infamis, helenae, castor, offendo, uicus",5,"-1.0, NaN, NaN, NaN, NaN",-0.2,-0.2,infamis,0.2
horace.epodes,17.43,"frater, magnus, castor, uinco, prex",5,"0.0, 0.0, NaN, NaN, 0.0",0.0,0.0,,0.0
horace.epodes,17.44,"adimo, uates, reddo, lumen",4,"NaN, NaN, NaN, NaN",nan,nan,,0.0
horace.epodes,17.45,"et, tu, possum, nam, soluo, ego, dementia",7,"NaN, NaN, NaN, NaN, NaN, NaN, -1.0",-0.143,-0.143,tu,0.143
horace.epodes,17.46,"o, neque, paternus, obsolesco, sordes",5,"NaN, NaN, NaN, NaN, -1.0",-0.2,-0.2,"obsolesco, sordes",0.4
horace.epodes,17.47,"neque, in, sepulcrum, pauper, prudens, anus",6,"NaN, NaN, NaN, -1.0, 1.0, 0.0",0.0,-0.167,sepulcrum,0.167
horace.epodes,17.48,"nouendial, dissiparis, puluis",3,"NaN, NaN, NaN",nan,nan,,0.0
horace.epodes,17.49,"tu, hospital, pectus, et, purus, manus",6,"NaN, NaN, NaN, NaN, 1.0, 0.0",0.167,0.0,tu,0.167
horace.epodes,17.5,"tuus, uenter, pactumeius, et, tuus",5,"0.0, NaN, NaN, NaN, 0.0",0.0,0.0,,0.0
horace.epodes,17.51,"cruor, rubrus, obstetrix, pannus, lauo",5,"NaN, NaN, NaN, -0.5, NaN",-0.1,-0.1,cruor,0.2
horace.epodes,17.52,"utcumque, fortis, exsilis, puerpera",4,"NaN, 0.5, NaN, NaN",0.125,0.0,,0.0
horace.epodes,17.53,"quis, obsero, auris, fundo, prex",5,"NaN, NaN, NaN, NaN, 0.0",0.0,0.0,,0.0
horace.epodes,17.54,"non, saxum, nudus, surdus, nauta",5,"NaN, 0.0, 0.0, NaN, NaN",0.0,0.0,,0.0
horace.epodes,17.55,"neptunus, altus, tundo, hibernus, salum",5,"NaN, 0.5, NaN, NaN, NaN",0.1,0.0,,0.0
horace.epodes,17.56,"inultus, ut, tu, rideo, cotytia",5,"-0.5, NaN, NaN, NaN, NaN",-0.1,-0.1,"inultus, tu",0.4
horace.epodes,17.57,"uulgo, sacer, liber, cupido",4,"NaN, 1.0, 0.5, -0.5",0.25,-0.125,,0.0
horace.epodes,17.58,"et, esquilini, pontifex, ueneficus",4,"NaN, NaN, NaN, -0.5",-0.125,-0.125,ueneficus,0.25
horace.epodes,17.59,"impunis, ut, urbem, nomen, in-pleo, meus",6,"-0.5, NaN, NaN, 0.0, NaN, 0.0",-0.083,-0.083,impunis,0.167
horace.epodes,17.6,"quis, prosum, dito, paelignas, anus",5,"NaN, NaN, NaN, NaN, 0.0",0.0,0.0,,0.0
horace.epodes,17.61,"uelox, misceo, toxicum",3,"NaN, NaN, NaN",nan,nan,,0.0
horace.epodes,17.62,"sed, tardus, fatum, tu, uoueo, maneo",6,"NaN, NaN, 0.0, NaN, NaN, NaN",0.0,0.0,tu,0.167
horace.epodes,17.63,"ingratus, mitto, uito, duco, sum, in, hic",7,"-1.0, NaN, NaN, NaN, NaN, NaN, NaN",-0.143,-0.143,"ingratus, hic",0.286
horace.epodes,17.64,"nouus, ut, usque, suppeto, labor",5,"1.0, NaN, NaN, NaN, -0.5",0.1,-0.1,,0.0
horace.epodes,17.65,"opto, quies, pelopis, infidus, pater",5,"NaN, NaN, NaN, -1.0, 0.0",-0.2,-0.2,,0.0
horace.epodes,17.66,"egeo, benignus, tantalus, semper, daps",5,"NaN, 1.0, NaN, NaN, NaN",0.2,0.0,,0.0
horace.epodes,17.67,"opto, prometheus, obligo, alo",4,"NaN, NaN, NaN, NaN",nan,nan,,0.0
horace.epodes,17.68,"opto, superus, collocaris, sisyphus",4,"NaN, NaN, NaN, NaN",nan,nan,,0.0
horace.epodes,17.69,"in, mons, saxum, sed, ueto, lex, io",7,"NaN, NaN, 0.0, NaN, NaN, 0.5, NaN",0.071,0.0,,0.0
horace.epodes,17.7,"uolo, modo, altus, desilire, turris",5,"NaN, NaN, 0.5, NaN, NaN",0.1,0.0,,0.0
horace.epodes,17.71,"frustro, uinclum, guttur, innectes, tuus",5,"NaN, NaN, NaN, NaN, 0.0",0.0,0.0,uinclum,0.2
horace.epodes,17.72,"modo, ensis, pectus, noricum, recludo",5,"NaN, NaN, NaN, NaN, NaN",nan,nan,,0.0
horace.epodes,17.73,"fastidiosus, tristis, aegrimonia",3,"-1.0, -1.0, NaN",-0.667,-0.667,,0.0
horace.epodes,17.74,"uecto, umerus, tunc, ego, inimicus, eques",6,"NaN, NaN, NaN, NaN, -1.0, 0.0",-0.167,-0.167,,0.0
horace.epodes,17.75,"meus, terra, cedo, insolentia",4,"0.0, 0.0, NaN, -1.0",-0.25,-0.25,,0.0
horace.epodes,17.76,"an, qui, moueo, cereus, imago",5,"NaN, NaN, NaN, NaN, NaN",nan,nan,,0.0
horace.epodes,17.77,"ut, ipse, nosco, curiosus, et, polus",6,"NaN, NaN, NaN, NaN, NaN, NaN",nan,nan,,0.0
horace.epodes,17.78,"deripio, luna, uox, possum, meus",5,"NaN, NaN, 0.0, NaN, 0.0",0.0,0.0,,0.0
horace.epodes,17.79,"possum, cremo, excitaris, mortuus",4,"NaN, NaN, NaN, NaN",nan,nan,,0.0
horace.epodes,17.8,"desideo, temperaris, poculum",3,"NaN, NaN, NaN",nan,nan,,0.0
horace.epodes,17.81,"ploro, ars, in, tu, nihil, ago, exitus",7,"NaN, 0.0, NaN, NaN, NaN, NaN, NaN",0.0,0.0,tu,0.143
