Text,Stelle,Inahlt,Wortzahl,Sentiment Rechnung,Sentiment-Score,alternativer Sentiment-Score,Invektiven,Invektivitäts-Score
horace.epodes,7.1,"urbs, hic, pereo, dextera",4,"0.5, NaN, NaN, 0.0",0.125,0.0,hic,0.25
horace.epodes,7.11,"neque, hic, lupus, mos, neque, sum, leo",7,"NaN, NaN, 0.0, 0.5, NaN, NaN, NaN",0.071,0.0,"hic, leo",0.286
horace.epodes,7.12,"umquam, nisi, in, dispar, fera",5,"NaN, NaN, NaN, 0.5, NaN",0.1,0.0,fera,0.2
horace.epodes,7.13,"furor, -ne, caecus, an, rapio, uolo, acer",7,"-1.0, NaN, -1.0, NaN, NaN, NaN, NaN",-0.286,-0.286,furor,0.143
horace.epodes,7.14,"an, culpa, responsum, do",4,"NaN, -1.0, NaN, NaN",-0.25,-0.25,culpa,0.25
horace.epodes,7.15,"taceo, et, albus, os, pallor, inficio",6,"NaN, NaN, NaN, 0.0, NaN, NaN",0.0,0.0,pallor,0.167
horace.epodes,7.16,"mens, percello, stupeo",3,"0.5, NaN, NaN",0.167,0.0,,0.0
horace.epodes,7.17,"sic, sum, acerbus, fatum, romanus, ago",6,"NaN, NaN, -1.0, 0.0, NaN, NaN",-0.167,-0.167,acerbus,0.167
horace.epodes,7.18,"scelus, fraternus, nex",3,"-1.0, 0.0, -1.0",-0.667,-0.667,"scelus, fraternus, nex",1.0
horace.epodes,7.19,"ut, immerens, fluo, in, terra, remi",6,"NaN, 1.0, NaN, NaN, 0.0, NaN",0.167,0.0,,0.0
horace.epodes,7.2,"sacer, nepos, cruor",3,"1.0, 0.0, NaN",0.333,0.0,cruor,0.333
horace.epodes,8.1,"rogo, longus, putidus, tu, saeculum",5,"NaN, 0.0, NaN, NaN, NaN",0.0,0.0,tu,0.2
horace.epodes,8.2,"uis, quis, eneruo, meus",4,"1.0, NaN, NaN, 0.0",0.25,0.0,,0.0
horace.epodes,8.3,"cum, sum, tu, dens, ater, et, rugio, uetus",8,"NaN, NaN, NaN, NaN, NaN, NaN, NaN, 0.0",0.0,0.0,tu,0.125
horace.epodes,8.4,"frons, senectus, exaro",3,"0.0, 0.0, NaN",0.0,0.0,,0.0
horace.epodes,8.5,"hio, turpis, inter, aridus, obstino",5,"NaN, -1.0, NaN, NaN, NaN",-0.2,-0.2,"hio, turpis",0.4
horace.epodes,8.6,"podex, uelut, crudus, bos",4,"NaN, NaN, -1.0, NaN",-0.25,-0.25,,0.0
horace.epodes,8.7,"sed, incito, ego, pectus, et, mamma, putreo",7,"NaN, NaN, NaN, NaN, NaN, NaN, NaN",nan,nan,,0.0
horace.epodes,8.8,"equinus, qualis, uber",3,"NaN, NaN, 1.0",0.333,0.0,,0.0
horace.epodes,8.9,"uenter, mollio, et, femur, tumeo",5,"NaN, NaN, NaN, NaN, NaN",nan,nan,,0.0
horace.epodes,8.1,"exilis, surus, addo",3,"0.0, NaN, NaN",0.0,0.0,,0.0
horace.epodes,8.11,"sum, beatus, funus, atque, imago",5,"NaN, 1.0, -0.5, NaN, NaN",0.1,-0.1,,0.0
horace.epodes,8.12,"duco, triumphalis, tuus",3,"NaN, NaN, 0.0",0.0,0.0,,0.0
horace.epodes,8.13,"neque, sum, marito, qui, rotundus",5,"NaN, NaN, NaN, NaN, NaN",nan,nan,marito,0.2
horace.epodes,8.14,"onustus, baca, ambulo",3,"-0.5, NaN, NaN",-0.167,-0.167,,0.0
horace.epodes,8.15,"quis, qui, libellus, stoici, inter, sericos",6,"NaN, NaN, 0.0, NaN, NaN, NaN",0.0,0.0,,0.0
horace.epodes,8.16,"iacio, puluillus, amo",3,"NaN, NaN, NaN",nan,nan,,0.0
horace.epodes,8.17,"illitteratus, num, paruus, neruus, rigo",5,"-0.5, NaN, 0.0, NaN, NaN",-0.1,-0.1,,0.0
horace.epodes,8.18,"paruus, langueo, fascinum",3,"0.0, NaN, NaN",0.0,0.0,,0.0
horace.epodes,8.19,"qui, ut, superbus, pouoces, ab, inguine",6,"NaN, NaN, -1.0, NaN, NaN, NaN",-0.167,-0.167,,0.0
horace.epodes,8.2,"os, ad-laboro, sum, tu",4,"0.0, NaN, NaN, NaN",0.0,0.0,tu,0.25
horace.epodes,9.1,"quando, repono, caecubum, ad, festus, daps",6,"NaN, NaN, NaN, NaN, NaN, NaN",nan,nan,,0.0
horace.epodes,9.2,"uictor, laetus, caesar",3,"NaN, 1.0, 0.5",0.5,0.0,,0.0
horace.epodes,9.3,"cum, tu, sub, altasic, ioui, gratumdomo",6,"NaN, NaN, NaN, NaN, NaN, NaN",nan,nan,tu,0.167
horace.epodes,9.4,"beatus, maecenas, bibo",3,"1.0, NaN, NaN",0.333,0.0,,0.0
horace.epodes,9.5,"sono, misceo, tibia, carmen, lyra",5,"NaN, NaN, NaN, 0.0, 0.0",0.0,0.0,,0.0
horace.epodes,9.6,"hic, dorium, ille, barbaris",4,"NaN, NaN, NaN, NaN",nan,nan,"hic, barbaris",0.5
horace.epodes,9.7,"ut, nuper, ago, cum, fretus, neptunius",6,"NaN, NaN, NaN, NaN, 0.5, NaN",0.083,0.0,,0.0
horace.epodes,9.8,"dux, fugio, uro, nauis",4,"0.5, NaN, NaN, 0.0",0.125,0.0,,0.0
horace.epodes,9.9,"mino, urbi, uinclum, qui, detraho",5,"NaN, NaN, NaN, NaN, NaN",nan,nan,uinclum,0.2
horace.epodes,9.1,"seruio, amicus, perfidus",3,"NaN, 1.0, -1.0",0.0,-0.333,perfidus,0.333
horace.epodes,9.11,"romanus, eheuposteri, nego",3,"NaN, NaN, NaN",nan,nan,,0.0
horace.epodes,9.12,"emancipo, femina",2,"NaN, 0.0",0.0,0.0,,0.0
horace.epodes,9.13,"fero, ualles, et, arma, miles, et, spado",7,"NaN, NaN, NaN, 0.0, 0.0, NaN, NaN",0.0,0.0,spado,0.143
horace.epodes,9.14,"seruio, rugosus, possum",3,"NaN, NaN, NaN",nan,nan,,0.0
horace.epodes,9.15,"inter, signum, turpis, militaris",4,"NaN, 0.0, -1.0, 0.0",-0.25,-0.25,turpis,0.25
horace.epodes,9.16,"sol, ad-specio, conopium",3,"NaN, NaN, NaN",nan,nan,,0.0
horace.epodes,9.17,"ad, hic, fremo, uerto, bis, mille, equus",7,"NaN, NaN, NaN, NaN, NaN, NaN, NaN",nan,nan,hic,0.143
horace.epodes,9.18,"gallus, caneo, caesar",3,"NaN, NaN, 0.5",0.167,0.0,gallus,0.333
horace.epodes,9.19,"hostilis, nauis, portus, lateo",4,"-1.0, 0.0, NaN, NaN",-0.25,-0.25,hostilis,0.25
horace.epodes,9.2,"puppis, sinistrorsum, cieo",3,"NaN, NaN, NaN",nan,nan,,0.0
horace.epodes,9.21,"io, triumphus, tu, moraris, aureus",5,"NaN, NaN, NaN, NaN, 0.5",0.1,0.0,tu,0.2
horace.epodes,9.22,"currus, et, intactus, bos",4,"NaN, NaN, NaN, NaN",nan,nan,,0.0
horace.epodes,9.23,"io, triumphus, neque, iugurthino, par",5,"NaN, NaN, NaN, NaN, 0.5",0.1,0.0,,0.0
horace.epodes,9.24,"bellum, reporto, dux",3,"0.0, NaN, 0.5",0.167,0.0,,0.0
horace.epodes,9.25,"neque, africanum, qui, super, karthago",5,"NaN, NaN, NaN, NaN, NaN",nan,nan,,0.0
horace.epodes,9.26,"uirtus, sepulcrum, condo",3,"1.0, NaN, NaN",0.333,0.0,sepulcrum,0.333
horace.epodes,9.27,"terra, mare, uinco, hostis, punicus",5,"0.0, 0.0, NaN, -1.0, NaN",-0.2,-0.2,,0.0
horace.epodes,9.28,"lugubris, muto, sagum",3,"NaN, NaN, NaN",nan,nan,,0.0
horace.epodes,9.29,"aut, ille, centum, nobilis, cerno, urbs",6,"NaN, NaN, NaN, 1.0, NaN, 0.5",0.25,0.0,,0.0
horace.epodes,9.3,"uenio, eo, non, suus",4,"NaN, NaN, NaN, NaN",nan,nan,,0.0
horace.epodes,9.31,"exercito, aut, peto, syrtis, nosco",5,"NaN, NaN, NaN, NaN, NaN",nan,nan,,0.0
horace.epodes,9.32,"aut, fero, incertum, mare",4,"NaN, NaN, NaN, 0.0",0.0,0.0,,0.0
horace.epodes,9.33,"capax, affero, huc, puer, scyphus",5,"0.0, NaN, NaN, 0.0, NaN",0.0,0.0,,0.0
horace.epodes,9.34,"et, chia, uinum, aut, lesbius",5,"NaN, NaN, NaN, NaN, NaN",nan,nan,lesbius,0.2
horace.epodes,9.35,"uel, qui, fluo, nausea, coerceo",5,"NaN, NaN, NaN, NaN, NaN",nan,nan,coerceo,0.2
horace.epodes,9.36,"metior, nos, caecubum",3,"NaN, NaN, NaN",nan,nan,,0.0
horace.epodes,9.37,"cura, metus, caesar, res, iuuo",5,"-1.0, -1.0, 0.5, 0.0, NaN",-0.3,-0.4,,0.0
horace.epodes,9.38,"dulcis, lyaeo, soluo",3,"0.5, NaN, NaN",0.167,0.0,,0.0
horace.epodes,10.1,"malus, soluo, nauus, exeo, alo",5,"-1.0, NaN, NaN, NaN, NaN",-0.2,-0.2,,0.0
horace.epodes,10.2,"fero, oleo, meuium",3,"NaN, NaN, NaN",nan,nan,,0.0
horace.epodes,10.3,"ut, horridus, uterque, uerbero, latus",5,"NaN, -1.0, NaN, NaN, NaN",-0.2,-0.2,uerbero,0.2
horace.epodes,10.4,"auster, memento, fluctus",3,"NaN, NaN, 0.0",0.0,0.0,,0.0
horace.epodes,10.5,"niger, rudo, eurus, inuerto, mare",5,"NaN, NaN, NaN, NaN, 0.0",0.0,0.0,inuerto,0.2
horace.epodes,10.6,"frango, remus, differo",3,"NaN, NaN, NaN",nan,nan,,0.0
horace.epodes,10.7,"insurgo, aquilus, quantus, altus, mons",5,"NaN, 0.0, NaN, 0.5, NaN",0.1,0.0,,0.0
horace.epodes,10.8,"frango, tremo, ilics",3,"NaN, NaN, NaN",nan,nan,,0.0
horace.epodes,10.9,"neque, sidus, ater, nox, amicus, appareo",6,"NaN, NaN, NaN, 0.0, 1.0, NaN",0.167,0.0,,0.0
horace.epodes,10.1,"qui, tristis, oreon, cado",4,"NaN, -1.0, NaN, NaN",-0.25,-0.25,,0.0
horace.epodes,10.11,"quiesco, neque, fero, aequor",4,"NaN, NaN, NaN, 0.0",0.0,0.0,,0.0
horace.epodes,10.12,"quam, graius, uictor, manus",4,"NaN, NaN, NaN, 0.0",0.0,0.0,,0.0
horace.epodes,10.13,"cum, pallas, uro, uerto, ira, ab, ilium",7,"NaN, NaN, NaN, NaN, -1.0, NaN, NaN",-0.143,-0.143,,0.0
horace.epodes,10.14,"in, impius, a-iacio, ratis",4,"NaN, -1.0, NaN, NaN",-0.25,-0.25,impius,0.25
horace.epodes,10.15,"o, quantus, insto, nauta, sudor, tuus",6,"NaN, NaN, NaN, NaN, NaN, 0.0",0.0,0.0,,0.0
horace.epodes,10.16,"tu, pallor, luteus",3,"NaN, NaN, NaN",nan,nan,"tu, pallor",0.667
horace.epodes,10.17,"et, ille, non, uirilis, heiulatio",5,"NaN, NaN, NaN, 0.5, NaN",0.1,0.0,,0.0
horace.epodes,10.18,"prex, et, auerto, ad, iouem",5,"0.0, NaN, NaN, NaN, NaN",0.0,0.0,,0.0
horace.epodes,10.19,"ionius, udus, cum, remugio, sinus",5,"NaN, NaN, NaN, NaN, NaN",nan,nan,udus,0.2
horace.epodes,10.2,"nosco, carina, rumpo",3,"NaN, NaN, NaN",nan,nan,,0.0
horace.epodes,10.21,"opimus, quodsi, praeda, curuo, litus",5,"NaN, NaN, NaN, NaN, NaN",nan,nan,,0.0
horace.epodes,10.22,"porrigo, mergus, iuuo",3,"NaN, NaN, NaN",nan,nan,,0.0
horace.epodes,10.23,"libidinosus, immolo, caper",3,"-1.0, NaN, NaN",-0.333,-0.333,libidinosus,0.333
horace.epodes,10.24,"et, agna, tempestas",3,"NaN, 0.0, 0.0",0.0,0.0,agna,0.333
horace.epodes,11.1,"petti, nihil, ego, sicut, antea, iuuo",6,"NaN, NaN, NaN, NaN, NaN, NaN",nan,nan,,0.0
horace.epodes,11.2,"scribo, uersiculus, amor, percutio, grauis",5,"NaN, NaN, 1.0, NaN, -0.5",0.1,-0.1,,0.0
horace.epodes,11.3,"amor, qui, ego, praeter, omnis, expeto",6,"1.0, NaN, NaN, NaN, NaN, NaN",0.167,0.0,,0.0
horace.epodes,11.4,"mollis, in, puer, aut, in, puella, uro",7,"NaN, NaN, 0.0, NaN, NaN, NaN, NaN",0.0,0.0,,0.0
horace.epodes,11.5,"hic, tertius, december, ex, quo, desisto, ",7,"NaN, 0.0, NaN, NaN, NaN, NaN, NaN",0.0,0.0,hic,0.143
horace.epodes,11.6,"inachia, furo, silua, honor, decutio",5,"NaN, NaN, NaN, 1.0, NaN",0.2,0.0,furo,0.2
horace.epodes,11.7,"heu, ego, per, urbem, nam, pudeo, tantus, malus",8,"NaN, NaN, NaN, NaN, NaN, NaN, NaN, -1.0",-0.125,-0.125,"heu, pudeo",0.25
horace.epodes,11.8,"fabula, quantus, sum, conuiuium, et, paeniteo",6,"0.0, NaN, NaN, NaN, NaN, NaN",0.0,0.0,conuiuium,0.167
horace.epodes,11.9,"in, quis, amo, languor, et, silentium",6,"NaN, NaN, NaN, -1.0, NaN, NaN",-0.167,-0.167,,0.0
horace.epodes,11.1,"arguo, et, lateo, peto, imus, spiritus",6,"NaN, NaN, NaN, NaN, NaN, 0.0",0.0,0.0,,0.0
horace.epodes,11.11,"contra, -ne, lucrum, nihil, ualeo, candidus",6,"NaN, NaN, 0.5, NaN, NaN, NaN",0.083,0.0,,0.0
horace.epodes,11.12,"pauper, ingenium, queror, ad-ploro, tu",5,"-1.0, 0.5, NaN, NaN, NaN",-0.1,-0.2,tu,0.2
horace.epodes,11.13,"simul, caleo, inuerecundus, deus",4,"NaN, NaN, -1.0, 0.0",-0.25,-0.25,,0.0
horace.epodes,11.14,"feruidus, merus, arcanus, promorat, locus",5,"-0.5, NaN, NaN, NaN, 0.0",-0.1,-0.1,,0.0
horace.epodes,11.15,"quodsi, meus, inaestuo, praecordia",4,"NaN, 0.0, NaN, NaN",0.0,0.0,,0.0
horace.epodes,11.16,"liber, bilis, ut, hic, ingratus, uenio, diuido",7,"0.5, NaN, NaN, NaN, -1.0, NaN, NaN",-0.071,-0.143,"hic, ingratus",0.286
horace.epodes,11.17,"fomentum, uulnus, nihil, malus, leuo",5,"NaN, -1.0, NaN, -1.0, NaN",-0.4,-0.4,,0.0
horace.epodes,11.18,"desino, inparis, certo, sub-moueo, pudor",5,"NaN, NaN, NaN, NaN, 0.5",0.1,0.0,pudor,0.2
horace.epodes,11.19,"ubi, hic, seuerus, tu, palam, laudo",6,"NaN, NaN, NaN, NaN, NaN, NaN",nan,nan,"hic, tu",0.333
horace.epodes,11.2,"iubeo, abeo, domus, fero, incertum, pes",6,"NaN, NaN, 0.0, NaN, NaN, 0.0",0.0,0.0,,0.0
horace.epodes,11.21,"ad, non, amicus, heu, ego, postis, et, heu",8,"NaN, NaN, 1.0, NaN, NaN, NaN, NaN, NaN",0.125,0.0,"heu, heu",0.25
horace.epodes,11.22,"limen, durus, qui, lumbus, et, infringo, latus",7,"NaN, -0.5, NaN, NaN, NaN, NaN, NaN",-0.071,-0.071,,0.0
horace.epodes,11.23,"nunc, glorior, quamlibet, muliercula",4,"NaN, NaN, NaN, -0.5",-0.125,-0.125,muliercula,0.25
horace.epodes,11.24,"uinco, mollitia, amor, lyciscus, ego, teneo",6,"NaN, NaN, 1.0, NaN, NaN, NaN",0.167,0.0,,0.0
horace.epodes,11.25,"unde, expedio, non, amicus, queo",5,"NaN, NaN, NaN, 1.0, NaN",0.2,0.0,,0.0
horace.epodes,11.26,"liber, consilium, neque, contumelia, grauis",5,"0.5, 0.5, NaN, -1.0, -0.5",-0.1,-0.3,contumelia,0.2
horace.epodes,11.27,"sed, alius, ardor, aut, puella, candida",6,"NaN, NaN, NaN, NaN, NaN, NaN",nan,nan,,0.0
horace.epodes,11.28,"aut, teres, puer, longus, renodo, como",6,"NaN, NaN, 0.0, 0.0, NaN, NaN",0.0,0.0,,0.0
horace.epodes,12.1,"quis, tu, uolo, mulier, niger, dignus, barritus",7,"NaN, NaN, NaN, 0.0, NaN, 1.0, NaN",0.143,0.0,"tu, mulier",0.286
horace.epodes,12.2,"munus, quis, ego, quis, tabella",5,"0.5, NaN, NaN, NaN, 0.0",0.1,0.0,,0.0
horace.epodes,12.3,"mitto, neque, firmus, iuuenis, neque, naris, obesus",7,"NaN, NaN, 1.0, NaN, NaN, NaN, -0.5",0.071,-0.071,,0.0
horace.epodes,12.4,"namque, sagax, unus, odoro",4,"NaN, NaN, NaN, NaN",nan,nan,,0.0
horace.epodes,12.5,"polypus, an, grauis, hirsutus, cubo, hircus, in, ala",8,"NaN, NaN, -0.5, -0.5, NaN, NaN, NaN, NaN",-0.125,-0.125,,0.0
horace.epodes,12.6,"quam, canis, acer, ubi, lateo, sus",6,"NaN, NaN, NaN, NaN, NaN, NaN",nan,nan,,0.0
horace.epodes,12.7,"qui, sudor, uio, et, quam, malus, undique, membrum",8,"NaN, NaN, NaN, NaN, NaN, -1.0, NaN, NaN",-0.125,-0.125,,0.0
horace.epodes,12.8,"cresco, odor, cum, penis, soluo",5,"NaN, 0.0, NaN, NaN, NaN",0.0,0.0,,0.0
horace.epodes,12.9,"indomitus, propero, rabies, sedaris, neque, ille",6,"NaN, NaN, -1.0, NaN, NaN, NaN",-0.167,-0.167,"indomitus, rabies",0.333
horace.epodes,12.1,"iam, maneo, umidus, cerno, colo",5,"NaN, NaN, NaN, NaN, NaN",nan,nan,,0.0
horace.epodes,12.11,"stercus, fuco, crocodilis, iam, subo",5,"-0.5, NaN, NaN, NaN, NaN",-0.1,-0.1,"stercus, fuco",0.4
horace.epodes,12.12,"tento, cubile, tego, rumpo",4,"NaN, NaN, NaN, NaN",nan,nan,,0.0
horace.epodes,12.13,"uel, meus, cum, saeuus, agito, fastidium, uerbum",7,"NaN, 0.0, NaN, -1.0, NaN, NaN, 0.0",-0.143,-0.143,saeuus,0.143
horace.epodes,12.14,"inachia, langueo, paruus, atque, ego",5,"NaN, NaN, 0.0, NaN, NaN",0.0,0.0,,0.0
horace.epodes,12.15,"inachiam, ter, nox, possum, ego, semper, ad, unus",8,"NaN, NaN, 0.0, NaN, NaN, NaN, NaN, NaN",0.0,0.0,,0.0
horace.epodes,12.16,"mollio, opus, pereo, malus, qui, tu",6,"NaN, 0.5, NaN, -1.0, NaN, NaN",-0.083,-0.167,tu,0.167
horace.epodes,12.17,"lesbius, quaero, taurus, monstro, iners",5,"NaN, NaN, NaN, NaN, 0.0",0.0,0.0,"lesbius, iners",0.4
horace.epodes,12.18,"cum, ego, cous, adsum, amyntas",5,"NaN, NaN, NaN, NaN, NaN",nan,nan,,0.0
horace.epodes,12.19,"qui, in, indomitus, consto, inguine, neruus",6,"NaN, NaN, NaN, NaN, NaN, NaN",nan,nan,indomitus,0.167
horace.epodes,12.2,"quam, nouo, collis, arbor, inhaereo",5,"NaN, NaN, NaN, NaN, NaN",nan,nan,,0.0
horace.epodes,12.21,"murex, tyriis, itero, uellus, lana",5,"NaN, NaN, NaN, NaN, NaN",nan,nan,lana,0.2
horace.epodes,12.22,"qui, propero, tu, nempe",4,"NaN, NaN, NaN, NaN",nan,nan,tu,0.25
horace.epodes,12.23,"ne, sum, aequalis, inter, conuiua, magis, qui",7,"NaN, NaN, 0.5, NaN, NaN, NaN, NaN",0.071,0.0,,0.0
horace.epodes,12.24,"diligo, mulier, suus, quam, tu",5,"NaN, 0.0, NaN, NaN, NaN",0.0,0.0,"mulier, tu",0.4
horace.epodes,12.25,"o, ego, non, felix, quam, tu, fugio, ut, paueo, acer",10,"NaN, NaN, NaN, 1.0, NaN, NaN, NaN, NaN, NaN, NaN",0.1,0.0,tu,0.1
horace.epodes,12.26,"agna, lupus, caprea, leo",4,"0.0, 0.0, NaN, NaN",0.0,0.0,"agna, leo",0.5
horace.epodes,13.1,"horridus, tempestas, caelum, contraho, et, imber",6,"-1.0, 0.0, 0.5, NaN, NaN, NaN",-0.083,-0.167,,0.0
horace.epodes,13.2,"nix, deduco, iouem, nunc, mare, nunc, silua",7,"NaN, NaN, NaN, NaN, 0.0, NaN, NaN",0.0,0.0,,0.0
horace.epodes,13.3,"threicio, aquilo, sono, rapio, amicus",5,"NaN, NaN, NaN, NaN, 1.0",0.2,0.0,,0.0
horace.epodes,13.4,"occasio, de, dies, dum, uireo, genu",6,"0.5, NaN, 0.0, NaN, NaN, NaN",0.083,0.0,,0.0
horace.epodes,13.5,"et, decet, obduco, soluo, frons, senectus",6,"NaN, NaN, NaN, NaN, 0.0, 0.0",0.0,0.0,,0.0
horace.epodes,13.6,"tu, uinum, torquatus, moueo, consul, premo, meus",7,"NaN, NaN, NaN, NaN, 0.5, NaN, 0.0",0.071,0.0,tu,0.143
horace.epodes,13.7,"ceterus, mitto, loquor, deus, hic, fortasse, benignus",7,"0.0, NaN, NaN, 0.0, NaN, NaN, 1.0",0.143,0.0,hic,0.143
horace.epodes,13.8,"reduco, in, sedes, uicus, nunc, et, achaemenio",7,"NaN, NaN, 0.0, NaN, NaN, NaN, NaN",0.0,0.0,,0.0
horace.epodes,13.9,"perfundo, nardus, iuuo, et, fides, cyllenea",6,"NaN, NaN, NaN, NaN, 1.0, NaN",0.167,0.0,,0.0
horace.epodes,13.1,"leuaris, dirus, pectus, sollicitudo",4,"NaN, -1.0, NaN, -0.5",-0.375,-0.375,dirus,0.25
horace.epodes,13.11,"nobilis, ut, grandis, cano, centaurus, alumnus",6,"1.0, NaN, 0.0, NaN, NaN, NaN",0.167,0.0,,0.0
horace.epodes,13.12,"inuictus, mortalis, dea, natus, puer, thetide",6,"1.0, -1.0, NaN, 0.0, 0.0, NaN",0.0,-0.167,,0.0
horace.epodes,13.13,"tu, maneo, assaraci, tellus, quam, frigidus, paruus",7,"NaN, NaN, NaN, NaN, NaN, NaN, 0.0",0.0,0.0,tu,0.143
horace.epodes,13.14,"findo, scamandri, flumen, lubricus, et, simois",6,"NaN, NaN, NaN, NaN, NaN, NaN",nan,nan,scamandri,0.167
horace.epodes,13.15,"unde, tu, redeo, certus, subtemen, parca",6,"NaN, NaN, NaN, 0.5, NaN, NaN",0.083,0.0,tu,0.167
horace.epodes,13.16,"rumpo, neque, mater, domus, caerulus, tu, reueho",7,"NaN, NaN, 0.0, 0.0, NaN, NaN, NaN",0.0,0.0,"caerulus, tu",0.286
horace.epodes,13.17,"illic, omnis, malus, uinum, cano, leuo",6,"NaN, NaN, -1.0, NaN, NaN, NaN",-0.167,-0.167,,0.0
horace.epodes,13.18,"deformis, aegrimonia, dulcis, alloquium",4,"-1.0, NaN, 0.5, NaN",-0.125,-0.25,deformis,0.25
horace.epodes,14.1,"mollio, inertia, cur, tantus, diffundo, imus",6,"NaN, 0.0, NaN, NaN, NaN, NaN",0.0,0.0,inertia,0.167
horace.epodes,14.2,"obliuio, sensus",2,"-0.5, 0.5",0.0,-0.25,,0.0
horace.epodes,14.3,"poculum, lethaeos, ut, si, duco, somnus",6,"NaN, NaN, NaN, NaN, NaN, 0.5",0.083,0.0,,0.0
horace.epodes,14.4,"areo, fauces, traho",3,"NaN, NaN, NaN",nan,nan,,0.0
horace.epodes,14.5,"candidus, maecenas, occaedes, saepe, rogo",5,"NaN, NaN, NaN, NaN, NaN",nan,nan,,0.0
horace.epodes,14.6,"deus, deus, nam, ego, ueto",5,"0.0, 0.0, NaN, NaN, NaN",0.0,0.0,,0.0
horace.epodes,14.7,"incipio, olim, promitto, carmen, iambus",5,"NaN, NaN, NaN, 0.0, NaN",0.0,0.0,,0.0
horace.epodes,14.8,"ad, umbilicus, duco",3,"NaN, NaN, NaN",nan,nan,,0.0
horace.epodes,14.9,"non, aliter, samio, dico, ardeo, bathyllo",6,"NaN, NaN, NaN, NaN, NaN, NaN",nan,nan,,0.0
horace.epodes,14.1,"anacreonta, teium",2,"NaN, NaN",nan,nan,,0.0
horace.epodes,14.11,"qui, persaepe, cauo, testudo, fleo, amor",6,"NaN, NaN, NaN, NaN, NaN, 1.0",0.167,0.0,,0.0
horace.epodes,14.12,"non, elaboro, ad, pedis",4,"NaN, NaN, NaN, 0.0",0.0,0.0,,0.0
horace.epodes,14.13,"uro, ipse, miser, quodsi, non, pulcher, ignis",7,"NaN, NaN, -1.0, NaN, NaN, 1.0, 0.0",0.0,-0.143,miser,0.143
horace.epodes,14.14,"accendo, ob-sedeo, ilium, -ne",4,"NaN, NaN, NaN, NaN",nan,nan,,0.0
horace.epodes,14.15,"gaudeo, sors, tuus, ego, libertina, neque, unus",7,"NaN, -1.0, 0.0, NaN, NaN, NaN, NaN",-0.143,-0.143,,0.0
horace.epodes,14.16,"contineo, phrynos, macero",3,"NaN, NaN, NaN",nan,nan,,0.0
horace.epodes,15.1,"nox, sum, et, caelum, fulgeo, luna, serenus",7,"0.0, NaN, NaN, 0.5, NaN, NaN, NaN",0.071,0.0,,0.0
horace.epodes,15.2,"inter, paruus, sidus",3,"NaN, 0.0, NaN",0.0,0.0,,0.0
horace.epodes,15.3,"cum, tu, magnus, numen, laesura, deus",6,"NaN, NaN, 0.0, NaN, NaN, 0.0",0.0,0.0,tu,0.167
horace.epodes,15.4,"in, uerbum, iuro, meus",4,"NaN, 0.0, NaN, 0.0",0.0,0.0,,0.0
horace.epodes,15.5,"artus, atque, hedera, procerus, ad-stringo, ilex",6,"NaN, NaN, 0.0, 0.5, NaN, NaN",0.083,0.0,,0.0
horace.epodes,15.6,"lentus, adhaereo, bracchium",3,"NaN, NaN, NaN",nan,nan,,0.0
horace.epodes,15.7,"dum, pecus, lupus, et, nauta, infestus, oreon",7,"NaN, NaN, 0.0, NaN, NaN, -1.0, NaN",-0.143,-0.143,,0.0
horace.epodes,15.8,"turbo, hibernus, mare",3,"NaN, NaN, 0.0",0.0,0.0,,0.0
horace.epodes,15.9,"intondeo, agito, apollo, aura, capillus",5,"NaN, NaN, NaN, 1.0, NaN",0.2,0.0,capillus,0.2
horace.epodes,15.1,"sum, hic, amor, mutuus",4,"NaN, NaN, 1.0, 0.0",0.25,0.0,hic,0.25
horace.epodes,15.11,"o, doleo, meus, multus, uirtus, neaera",6,"NaN, NaN, 0.0, 0.0, 1.0, NaN",0.167,0.0,neaera,0.167
horace.epodes,15.12,"nam, siquis, in, flaccus, uir, sum",6,"NaN, NaN, NaN, NaN, 0.5, NaN",0.083,0.0,,0.0
horace.epodes,15.13,"non, fero, assiduus, potis, tu, do, nox",7,"NaN, NaN, 0.5, 0.0, NaN, NaN, 0.0",0.071,0.0,tu,0.143
horace.epodes,15.14,"et, quaero, irascor, par",4,"NaN, NaN, NaN, 0.5",0.125,0.0,,0.0
horace.epodes,15.15,"neque, semel, offendo, cedo, constantia, forma",6,"NaN, NaN, NaN, NaN, 0.5, 1.0",0.25,0.0,,0.0
horace.epodes,15.16,"si, certus, intro, dolor",4,"NaN, 0.5, NaN, -1.0",-0.125,-0.25,,0.0
horace.epodes,15.17,"et, tu, quicumque, sum, felix, atque, meus, nunc",8,"NaN, NaN, NaN, NaN, 1.0, NaN, 0.0, NaN",0.125,0.0,tu,0.125
horace.epodes,15.18,"superbus, incedo, malus",3,"-1.0, NaN, -1.0",-0.667,-0.667,,0.0
horace.epodes,15.19,"sum, pecus, et, multus, diues, tellus, liceo",7,"NaN, NaN, NaN, 0.0, 0.5, NaN, NaN",0.071,0.0,,0.0
horace.epodes,15.2,"tu, pactolus, fluo",3,"NaN, NaN, NaN",nan,nan,tu,0.333
horace.epodes,15.21,"neque, tu, pythagorae, fallo, arcanus, reno",6,"NaN, NaN, NaN, NaN, NaN, NaN",nan,nan,"tu, fallo",0.333
horace.epodes,15.22,"formo, uinco, nirea",3,"NaN, NaN, NaN",nan,nan,,0.0
horace.epodes,15.23,"heu, heu, transfero, alius, maereo, amor",6,"NaN, NaN, NaN, NaN, NaN, 1.0",0.167,0.0,"heu, heu",0.333
horace.epodes,15.24,"at, ego, uicissim, rideo",4,"NaN, NaN, NaN, NaN",nan,nan,,0.0
horace.epodes,16.1,"alter, iam, tero, bellum, ciuilis, aetas",6,"NaN, NaN, NaN, 0.0, 0.5, 0.0",0.083,0.0,,0.0
horace.epodes,16.2,"suus, et, ipse, roma, uis, ruo",6,"NaN, NaN, NaN, NaN, 1.0, NaN",0.167,0.0,,0.0
horace.epodes,16.3,"quam, neque, finitimus, ualeo, perdo, marsi",6,"NaN, NaN, NaN, NaN, NaN, NaN",nan,nan,finitimus,0.167
horace.epodes,16.4,"minax, aut, etrusca, porsenae, manus",5,"NaN, NaN, NaN, NaN, 0.0",0.0,0.0,,0.0
horace.epodes,16.5,"aemulo, neque, uirtus, capua, neque, spartacus, acer",7,"NaN, NaN, 1.0, NaN, NaN, NaN, NaN",0.143,0.0,,0.0
horace.epodes,16.6,"nouus, res, infidelis, allobrox",4,"1.0, 0.0, -1.0, NaN",0.0,-0.25,,0.0
horace.epodes,16.7,"neque, ferus, caeruleus, domo, germania, pubes",6,"NaN, -1.0, NaN, NaN, NaN, NaN",-0.167,-0.167,ferus,0.167
horace.epodes,16.8,"pareo, abominor, hannibal",3,"NaN, NaN, NaN",nan,nan,abominor,0.333
horace.epodes,16.9,"impius, perdo, de_-uoueo, sanguis, aetas",5,"-1.0, NaN, NaN, NaN, 0.0",-0.2,-0.2,impius,0.2
horace.epodes,16.1,"ferio, rursus, occupo, solus",4,"NaN, NaN, NaN, -0.5",-0.125,-0.125,,0.0
horace.epodes,16.11,"barbarus, heu, cinis, insisto, uictor, et, urbem",7,"NaN, NaN, NaN, NaN, NaN, NaN, NaN",nan,nan,heu,0.143
horace.epodes,16.12,"eques, sono, uerbero, ungula",4,"0.0, NaN, NaN, NaN",0.0,0.0,uerbero,0.25
horace.epodes,16.13,"quisque, careo, uenio, et, sol, os, quirinus",7,"NaN, NaN, NaN, NaN, NaN, 0.0, NaN",0.0,0.0,,0.0
horace.epodes,16.14,"nefas, uideo, dissipo, insoleo",4,"-1.0, NaN, NaN, NaN",-0.25,-0.25,nefas,0.25
horace.epodes,16.15,"fors, quis, expedio, communis, aut, bonus, pars",7,"0.0, NaN, NaN, 0.0, NaN, 1.0, 0.0",0.143,0.0,,0.0
horace.epodes,16.16,"malus, careo, quaero, labor",4,"-1.0, NaN, NaN, -0.5",-0.375,-0.375,,0.0
horace.epodes,16.17,"nullus, sum, hic, potis, sententia, phocaeorum",6,"NaN, NaN, NaN, 0.0, 0.0, NaN",0.0,0.0,hic,0.167
horace.epodes,16.18,"uelut, profugio, exsecror, ciuitas",4,"NaN, NaN, NaN, 0.5",0.125,0.0,profugio,0.25
horace.epodes,16.19,"ager, atque, lar, patrius, habito, fanum",6,"0.0, NaN, NaN, 0.0, NaN, NaN",0.0,0.0,,0.0
horace.epodes,16.2,"aper, relinquo, et, rapax, lupus",5,"NaN, NaN, NaN, NaN, 0.0",0.0,0.0,,0.0
horace.epodes,16.21,"eo, pes, quicumque, fero, quicumque, per, unda",7,"NaN, 0.0, NaN, NaN, NaN, NaN, 0.0",0.0,0.0,,0.0
horace.epodes,16.22,"notus, uoco, aut, proteruus, africus",5,"0.0, NaN, NaN, -0.5, NaN",-0.1,-0.1,proteruus,0.2
horace.epodes,16.23,"sic, placeo, an, bonus, quis, habeo, suadeo, secundus",8,"NaN, NaN, NaN, 1.0, NaN, NaN, NaN, 0.0",0.125,0.0,,0.0
horace.epodes,16.24,"ratis, occuparis, quis, moror, alo",5,"NaN, NaN, NaN, NaN, NaN",nan,nan,,0.0
horace.epodes,16.25,"sed, iuro, in, hic, simul, imus, saxum, reno",8,"NaN, NaN, NaN, NaN, NaN, NaN, 0.0, NaN",0.0,0.0,hic,0.125
horace.epodes,16.26,"uado, leuo, ne, redeo, sum, nefas",6,"NaN, NaN, NaN, NaN, NaN, -1.0",-0.167,-0.167,nefas,0.167
horace.epodes,16.27,"neu, conuerro, domus, pigeo, do, linteus, quando",7,"NaN, NaN, 0.0, NaN, NaN, NaN, NaN",0.0,0.0,,0.0
horace.epodes,16.28,"padus, matina, lauo, cacumen",4,"NaN, NaN, NaN, -1.0",-0.25,-0.25,,0.0
horace.epodes,16.29,"in, mare, seu, celsus, pro-curro, appenninus",6,"NaN, 0.0, NaN, NaN, NaN, NaN",0.0,0.0,,0.0
horace.epodes,16.3,"nouo, monstrum, iungo, libido",4,"NaN, 0.5, NaN, -0.5",0.0,-0.125,"monstrum, libido",0.5
horace.epodes,16.31,"mirus, amor, iuuo, ut, tigris, subsido, ceruus",7,"1.0, 1.0, NaN, NaN, NaN, NaN, NaN",0.286,0.0,,0.0
horace.epodes,16.32,"adultero, et, columba, miluus",4,"NaN, NaN, 0.0, NaN",0.0,0.0,,0.0
horace.epodes,16.33,"credulus, neque, rauus, timeo, armentum, leo",6,"-0.5, NaN, NaN, NaN, NaN, NaN",-0.083,-0.083,"credulus, leo",0.333
horace.epodes,16.34,"amo, salio, leuis, hircus, aequor",5,"NaN, NaN, 0.0, NaN, 0.0",0.0,0.0,,0.0
horace.epodes,16.35,"hic, et, qui, possum, redeo, abscindo, dulcis",7,"NaN, NaN, NaN, NaN, NaN, NaN, 0.5",0.071,0.0,hic,0.143
horace.epodes,16.36,"eo, omnis, exsecror, ciuitas",4,"NaN, NaN, NaN, 0.5",0.125,0.0,,0.0
horace.epodes,16.37,"aut, pars, indocilis, bonus, grex, mollio, et, exspes",8,"NaN, 0.0, NaN, 1.0, NaN, NaN, NaN, -1.0",0.0,-0.125,exspes,0.125
horace.epodes,16.38,"inominatus, per-premo, cubile",3,"NaN, NaN, NaN",nan,nan,,0.0
horace.epodes,16.39,"tu, qui, sum, uirtus, muliebris, tollo, luctus",7,"NaN, NaN, NaN, 1.0, NaN, NaN, -1.0",0.0,-0.143,"tu, muliebris",0.286
horace.epodes,16.4,"etrusca, praeter, et, uolo, litus",5,"NaN, NaN, NaN, NaN, NaN",nan,nan,,0.0
horace.epodes,16.41,"nos, maneo, oceanus, circum, uagus, aruum, beatus",7,"NaN, NaN, NaN, NaN, NaN, NaN, 1.0",0.143,0.0,,0.0
horace.epodes,16.42,"peto, aruum, diues, et, insula",5,"NaN, NaN, 0.5, NaN, NaN",0.1,0.0,,0.0
horace.epodes,16.43,"reddo, ubi, cererem, tellus, inaro, quot",6,"NaN, NaN, NaN, NaN, NaN, NaN",nan,nan,,0.0
