Text,Stelle,Inahlt,Wortzahl,Sentiment Rechnung,Sentiment-Score,alternativer Sentiment-Score,Invektiven,Invektivitäts-Score
rutilius.de_reditu,1.1,"uelox, potis, redeo, miror, lector",5,"NaN, 0.0, NaN, NaN, 0.0",0.0,0.0,,0.0
rutilius.de_reditu,1.2,"tam, cito, romuleis, possum, careo, bonus",6,"NaN, NaN, NaN, NaN, NaN, 1.0",0.167,0.0,,0.0
rutilius.de_reditu,1.3,"quis, longus, totus, roma, ueneror, aeuum",6,"NaN, 0.0, NaN, NaN, NaN, NaN",0.0,0.0,,0.0
rutilius.de_reditu,1.4,"nihil, umquam, longus, sum, qui, sine, finis, placeo",8,"NaN, NaN, 0.0, NaN, NaN, NaN, 0.0, NaN",0.0,0.0,,0.0
rutilius.de_reditu,1.5,"o, quantus, et, quotiens, possum, numeraris, beatus",7,"NaN, NaN, NaN, NaN, NaN, NaN, 1.0",0.143,0.0,,0.0
rutilius.de_reditu,1.6,"nascor, felix, qui, mereo, solum",5,"NaN, 1.0, NaN, NaN, 0.0",0.2,0.0,,0.0
rutilius.de_reditu,1.7,"qui, romanus, procerus, generosus, propago",5,"NaN, NaN, 0.5, 1.0, 0.0",0.3,0.0,,0.0
rutilius.de_reditu,1.8,"ingenitus, cumulo, urbs, honor, decus",5,"NaN, NaN, 0.5, 1.0, NaN",0.3,0.0,,0.0
rutilius.de_reditu,1.9,"semen, uirtus, demitto, et, trado, caelum",6,"NaN, 1.0, NaN, NaN, NaN, 0.5",0.25,0.0,,0.0
rutilius.de_reditu,1.1,"non, possum, alius, dignus, sum, locus",6,"NaN, NaN, NaN, 1.0, NaN, 0.0",0.167,0.0,,0.0
rutilius.de_reditu,1.11,"felix, etiam, qui, propior, munus, primus",6,"1.0, NaN, NaN, 0.0, 0.5, 0.5",0.333,0.0,,0.0
rutilius.de_reditu,1.12,"sortio, latias, obtineo, domus",4,"NaN, NaN, NaN, 0.0",0.0,0.0,,0.0
rutilius.de_reditu,1.13,"religiosus, pateo, peregrina, curia, laus",5,"NaN, NaN, NaN, -1.0, 1.0",0.0,-0.2,,0.0
rutilius.de_reditu,1.14,"neque, puto, externus, qui, decet, sum, suus",7,"NaN, NaN, 0.0, NaN, NaN, NaN, NaN",0.0,0.0,,0.0
rutilius.de_reditu,1.15,"ordo, imperium, collega, fruor",4,"0.5, 0.0, NaN, NaN",0.125,0.0,,0.0
rutilius.de_reditu,1.16,"et, pars, genius, qui, ueneror, habeo",6,"NaN, 0.0, NaN, NaN, NaN, NaN",0.0,0.0,,0.0
rutilius.de_reditu,1.17,"qualis, per, aetherius, mundanus, uertex, axis",6,"NaN, NaN, NaN, NaN, NaN, 0.0",0.0,0.0,,0.0
rutilius.de_reditu,1.18,"concilium, superus, credo, sum, deus",5,"NaN, NaN, NaN, NaN, 0.0",0.0,0.0,,0.0
rutilius.de_reditu,1.19,"at, meus, diligo, fortuna, reuellitur, ora",6,"NaN, 0.0, NaN, 0.0, NaN, NaN",0.0,0.0,,0.0
rutilius.de_reditu,1.2,"indigena, suus, gallica, rus, uoco",5,"0.0, NaN, NaN, 0.0, NaN",0.0,0.0,,0.0
rutilius.de_reditu,1.21,"ille, quidem, longus, nimium, deformis, bellum",6,"NaN, NaN, 0.0, 0.0, -1.0, 0.0",-0.167,-0.167,deformis,0.167
rutilius.de_reditu,1.22,"sed, quam, gratus, paruus, tam, misero, magis",7,"NaN, NaN, 1.0, 0.0, NaN, NaN, NaN",0.143,0.0,misero,0.143
rutilius.de_reditu,1.23,"securus, leuis, crimen, contemno, ciuis",5,"1.0, 0.0, -1.0, NaN, 0.5",0.1,-0.2,crimen,0.2
rutilius.de_reditu,1.24,"priuo, repeto, publicus, damno, fides",5,"NaN, NaN, 0.0, NaN, 1.0",0.2,0.0,damno,0.2
rutilius.de_reditu,1.25,"praesens, lacrima, tectum, debeo, auitus",5,"0.0, NaN, NaN, NaN, NaN",0.0,0.0,,0.0
rutilius.de_reditu,1.26,"prodo, admonitus, saepe, dolor, labor",5,"NaN, NaN, NaN, -1.0, -0.5",-0.3,-0.3,,0.0
rutilius.de_reditu,1.27,"neque, fas, ultra, longus, nescio, ruina",6,"NaN, NaN, NaN, 0.0, NaN, NaN",0.0,0.0,,0.0
rutilius.de_reditu,1.28,"qui, mora, suspendo, multiplico, ops",5,"NaN, NaN, NaN, NaN, 0.0",0.0,0.0,,0.0
rutilius.de_reditu,1.29,"iam, tempus, lacer, post, saeuus, incendium, fundo",7,"NaN, 0.0, NaN, NaN, -1.0, NaN, NaN",-0.143,-0.143,saeuus,0.143
rutilius.de_reditu,1.3,"uel, pastoral, aedificaris, cado",4,"NaN, NaN, NaN, NaN",nan,nan,,0.0
rutilius.de_reditu,1.31,"ipse, quin, etiam, fons, si, mitto, uoco",7,"NaN, NaN, NaN, NaN, NaN, NaN, NaN",nan,nan,,0.0
rutilius.de_reditu,1.32,"ipse, si, possum, arbutum, noster, loquor",6,"NaN, NaN, NaN, NaN, NaN, NaN",nan,nan,,0.0
rutilius.de_reditu,1.33,"cesso, iustus, possum, urgeo, querela",5,"NaN, 1.0, NaN, NaN, -0.5",0.1,-0.1,,0.0
rutilius.de_reditu,1.34,"et, desiderium, addo, uelo, meus",5,"NaN, NaN, NaN, NaN, 0.0",0.0,0.0,,0.0
rutilius.de_reditu,1.35,"iamiam, laxo, carus, complexus, urbs",5,"NaN, NaN, 1.0, 0.0, 0.5",0.3,0.0,,0.0
rutilius.de_reditu,1.36,"uincio, et, serus, uix, tolero, iter",6,"NaN, NaN, NaN, NaN, NaN, 0.0",0.0,0.0,,0.0
rutilius.de_reditu,1.37,"eligo, pelagus, quoniam, terrenus, uiaris",5,"NaN, NaN, NaN, NaN, NaN",nan,nan,,0.0
rutilius.de_reditu,1.38,"planum, madeo, fluuius, cautes, altus, rigo",6,"NaN, NaN, NaN, 0.0, 0.5, NaN",0.083,0.0,planum,0.167
rutilius.de_reditu,1.39,"postquam, tuscus, ager, postquamque, aurelius, agger",6,"NaN, NaN, 0.0, NaN, NaN, NaN",0.0,0.0,,0.0
rutilius.de_reditu,1.4,"perpetior, geticas, ensis, uel, ignis, manus",6,"NaN, NaN, NaN, NaN, 0.0, 0.0",0.0,0.0,geticas,0.167
rutilius.de_reditu,1.41,"non, silua, domus, non, flumen, pons, cohercet",7,"NaN, NaN, 0.0, NaN, NaN, NaN, NaN",0.0,0.0,,0.0
rutilius.de_reditu,1.42,"incertum, sero, credo, uelo, mare",5,"NaN, NaN, NaN, NaN, 0.0",0.0,0.0,,0.0
rutilius.de_reditu,1.43,"creber, reliquendis, infigo, osculum, porta",5,"NaN, NaN, NaN, 0.0, NaN",0.0,0.0,,0.0
rutilius.de_reditu,1.44,"inuitus, supero, limen, sacer, pes",5,"-0.5, NaN, NaN, 1.0, 0.0",0.1,-0.1,,0.0
rutilius.de_reditu,1.45,"oro, uenio, lacrima, et, laus, lito",6,"NaN, NaN, NaN, NaN, 1.0, NaN",0.167,0.0,,0.0
rutilius.de_reditu,1.46,"in, quantus, fletus, curro, uerbum, sino",6,"NaN, NaN, NaN, NaN, 0.0, NaN",0.0,0.0,,0.0
rutilius.de_reditu,1.47,"•exaudi, regina, tuus, pulcher, mundus",5,"NaN, NaN, 0.0, 1.0, 1.0",0.4,0.0,,0.0
rutilius.de_reditu,1.48,"inter, sidereus, roma, recipio, polus",5,"NaN, NaN, NaN, NaN, NaN",nan,nan,,0.0
rutilius.de_reditu,1.49,"exaudio, genetrix, homo, genetrix, deus",5,"NaN, NaN, 0.0, NaN, 0.0",0.0,0.0,,0.0
rutilius.de_reditu,1.5,"non, procul, ab, caelum, per, tuus, templum, sum",8,"NaN, NaN, NaN, 0.5, NaN, 0.0, NaN, NaN",0.062,0.0,,0.0
rutilius.de_reditu,1.51,"tu, cano, semper, sino, dum, fatum, cano",7,"NaN, NaN, NaN, NaN, NaN, 0.0, NaN",0.0,0.0,tu,0.143
rutilius.de_reditu,1.52,"sospes, nemo, possum, immemor, sum, tuus",6,"1.0, -0.5, NaN, -1.0, NaN, 0.0",-0.083,-0.25,,0.0
rutilius.de_reditu,1.53,"obruerint, cieo, scelero, obliuius, sol",5,"NaN, NaN, NaN, NaN, NaN",nan,nan,scelero,0.2
rutilius.de_reditu,1.54,"quam, tuus, e, noster, cor, recedo, honor",7,"NaN, 0.0, NaN, NaN, NaN, NaN, 1.0",0.143,0.0,,0.0
rutilius.de_reditu,1.55,"nam, sol, radius, aequalis, munus, tendo",6,"NaN, NaN, NaN, 0.5, 0.5, NaN",0.167,0.0,,0.0
rutilius.de_reditu,1.56,"qui, circumfundo, fluctuo, oceanus",4,"NaN, NaN, NaN, NaN",nan,nan,,0.0
rutilius.de_reditu,1.57,"uoluo, ipse, tu, qui, contineo, omnis, phoebus",7,"NaN, NaN, NaN, NaN, NaN, NaN, NaN",nan,nan,tu,0.143
rutilius.de_reditu,1.58,"equus, tuus, orior, in, tuus, condio, equus",7,"NaN, 0.0, NaN, NaN, 0.0, NaN, NaN",0.0,0.0,,0.0
rutilius.de_reditu,1.59,"tu, non, flammigeris, libye, tardo, harena",6,"NaN, NaN, NaN, NaN, NaN, NaN",nan,nan,tu,0.167
rutilius.de_reditu,1.6,"non, armo, suus, repello, ursa, gelus",6,"NaN, NaN, NaN, NaN, NaN, NaN",nan,nan,ursa,0.167
rutilius.de_reditu,1.61,"quantus, uital, natura, tendo, in, axis",6,"NaN, NaN, 0.0, NaN, NaN, 0.0",0.0,0.0,,0.0
rutilius.de_reditu,1.62,"tantus, uirtus, peruius, terra, tuus",5,"NaN, 1.0, NaN, 0.0, 0.0",0.2,0.0,,0.0
rutilius.de_reditu,1.63,"facio, patria, diuerto, gens, unus",5,"NaN, NaN, NaN, 0.0, NaN",0.0,0.0,,0.0
rutilius.de_reditu,1.64,"prosum, iniustus, tu, dominor, capio",5,"NaN, -1.0, NaN, NaN, NaN",-0.2,-0.2,"iniustus, tu",0.4
rutilius.de_reditu,1.65,"dum, offertor, uinco, proprius, consortium, ius",6,"NaN, NaN, NaN, 0.0, 0.0, 0.5",0.083,0.0,,0.0
rutilius.de_reditu,1.66,"urbs, facio, qui, prior, orbis, sum",6,"0.5, NaN, NaN, 0.5, NaN, NaN",0.167,0.0,,0.0
rutilius.de_reditu,1.67,"auctor, genus, uenerem, martes, fateor",5,"NaN, 0.0, NaN, NaN, NaN",0.0,0.0,,0.0
rutilius.de_reditu,1.68,"aeneadum, mater, romulidumque, pater",4,"NaN, 0.0, NaN, 0.0",0.0,0.0,,0.0
rutilius.de_reditu,1.69,"mitigo, armo, uictrix, clemens, uireo",5,"NaN, NaN, NaN, 1.0, NaN",0.2,0.0,,0.0
rutilius.de_reditu,1.7,"conuenio, in, mos, nomen, uterque, tuus",6,"NaN, NaN, 0.5, 0.0, NaN, 0.0",0.083,0.0,,0.0
rutilius.de_reditu,1.71,"hinc, tu, certo, bonus, parcendique, uoluptas",6,"NaN, NaN, NaN, 1.0, NaN, 1.0",0.333,0.0,tu,0.167
rutilius.de_reditu,1.72,"qui, timeo, supero, qui, supero, amo",6,"NaN, NaN, NaN, NaN, NaN, NaN",nan,nan,,0.0
rutilius.de_reditu,1.73,"inuentrix, olea, colo, uinum, repertor",5,"NaN, NaN, NaN, NaN, 0.0",0.0,0.0,,0.0
rutilius.de_reditu,1.74,"et, qui, primus, humo, premo, aratrum, puer",7,"NaN, NaN, 0.5, NaN, NaN, NaN, 0.0",0.071,0.0,,0.0
rutilius.de_reditu,1.75,"ara, paeonia, mereo, medicina, per, ars",6,"NaN, NaN, NaN, 0.0, NaN, 0.0",0.0,0.0,,0.0
rutilius.de_reditu,1.76,"facio, et, alcides, nobilitas, deus",5,"NaN, NaN, NaN, 1.0, 0.0",0.2,0.0,alcides,0.2
rutilius.de_reditu,1.77,"tu, quoque, legiferis, mundus, complector, triumphus",6,"NaN, NaN, NaN, 1.0, NaN, NaN",0.167,0.0,tu,0.167
rutilius.de_reditu,1.78,"foedus, communis, uiuo, cunctus, facio",5,"-1.0, 0.0, NaN, 0.0, NaN",-0.2,-0.2,,0.0
rutilius.de_reditu,1.79,"tu, dea, tu, celebro, romanus, ubique, recedo",7,"NaN, NaN, NaN, NaN, NaN, NaN, NaN",nan,nan,"tu, tu",0.286
rutilius.de_reditu,1.8,"pacificoque, gero, liber, collum, iugum",5,"NaN, NaN, 0.5, NaN, NaN",0.1,0.0,,0.0
rutilius.de_reditu,1.81,"omnis, perpetuus, qui, seruo, sidus, moueo",6,"NaN, 0.0, NaN, NaN, NaN, NaN",0.0,0.0,,0.0
rutilius.de_reditu,1.82,"nullus, uideo, pulcher, imperium",4,"NaN, NaN, 1.0, 0.0",0.25,0.0,,0.0
rutilius.de_reditu,1.83,"quis, similis, assyriis, conecto, contingo, arma",6,"NaN, 0.0, NaN, NaN, NaN, 0.0",0.0,0.0,,0.0
rutilius.de_reditu,1.84,"medus, finitimi, condomuere, suus",4,"NaN, NaN, NaN, NaN",nan,nan,,0.0
rutilius.de_reditu,1.85,"magnus, parthi, rex, macetumque, tyrannus",5,"0.0, NaN, 0.0, NaN, NaN",0.0,0.0,"parthi, tyrannus",0.4
rutilius.de_reditu,1.86,"mutuus, per, uario, ius, do, uicis",6,"0.0, NaN, NaN, 0.5, NaN, NaN",0.083,0.0,,0.0
rutilius.de_reditu,1.87,"neque, tu, nasco, multus, animaequus, manus",6,"NaN, NaN, NaN, 0.0, NaN, 0.0",0.0,0.0,tu,0.167
rutilius.de_reditu,1.88,"sed, multus, consilium, iudicium, sum",5,"NaN, 0.0, 0.5, 0.5, NaN",0.2,0.0,,0.0
rutilius.de_reditu,1.89,"iustus, bellum, causa, neque, pax, superbus",6,"1.0, 0.0, 0.0, NaN, 0.5, -1.0",0.083,-0.167,,0.0
rutilius.de_reditu,1.9,"nobilis, ad, superus, gloria, uenio, ops",6,"1.0, NaN, NaN, 0.0, NaN, 0.0",0.167,0.0,,0.0
rutilius.de_reditu,1.91,"qui, regno, paruus, sum, quam, qui, regno, mereo",8,"NaN, NaN, 0.0, NaN, NaN, NaN, NaN, NaN",0.0,0.0,,0.0
rutilius.de_reditu,1.92,"excedo, facio, grandis, fatum, tuus",5,"NaN, NaN, 0.0, 0.0, 0.0",0.0,0.0,,0.0
rutilius.de_reditu,1.93,"percenseo, labor, densus, decus, altus, tropaeum",6,"NaN, -0.5, NaN, NaN, 0.5, NaN",0.0,-0.083,,0.0
rutilius.de_reditu,1.94,"ut, si, quis, stella, pernumeraris, uolo",6,"NaN, NaN, NaN, NaN, NaN, NaN",nan,nan,,0.0
rutilius.de_reditu,1.95,"confundo, uagus, delubrum, mico, uideo",5,"NaN, NaN, NaN, NaN, NaN",nan,nan,,0.0
rutilius.de_reditu,1.96,"ipse, credo, sic, habito, deus",5,"NaN, NaN, NaN, NaN, 0.0",0.0,0.0,,0.0
rutilius.de_reditu,1.97,"quis, loquor, aerius, pendeo, fornix, riuus",6,"NaN, NaN, NaN, NaN, NaN, NaN",nan,nan,,0.0
rutilius.de_reditu,1.98,"qui, uix, imbrifer, tollo, iris, aqua",6,"NaN, NaN, NaN, NaN, NaN, 0.0",0.0,0.0,,0.0
rutilius.de_reditu,1.99,"hic, potis, dico, cerno, in, sidus, mons",7,"NaN, 0.0, NaN, NaN, NaN, NaN, NaN",0.0,0.0,hic,0.143
rutilius.de_reditu,1.1,"talis, giganteum, graecia, laudo, opus",5,"NaN, NaN, NaN, NaN, 0.5",0.1,0.0,,0.0
rutilius.de_reditu,1.101,"intercipio, tuus, condo, flumen, murus",5,"NaN, 0.0, NaN, NaN, NaN",0.0,0.0,,0.0
rutilius.de_reditu,1.102,"consumo, totus, celsus, lauacrum, lacus",5,"NaN, NaN, NaN, NaN, 0.0",0.0,0.0,,0.0
rutilius.de_reditu,1.103,"neque, paruus, et, proprius, celebro, roscidus, uenio",7,"NaN, 0.0, NaN, 0.0, NaN, NaN, NaN",0.0,0.0,,0.0
rutilius.de_reditu,1.104,"totus, natiuus, moenia, fons, sono",5,"NaN, NaN, NaN, NaN, NaN",nan,nan,,0.0
rutilius.de_reditu,1.105,"frigidus, aestiuus, hinc, tempero, halitus, aura",6,"NaN, NaN, NaN, NaN, NaN, 1.0",0.167,0.0,,0.0
rutilius.de_reditu,1.106,"innocuamque, leuo, purus, unda, sitis",5,"NaN, NaN, 1.0, 0.0, -0.5",0.1,-0.1,,0.0
rutilius.de_reditu,1.107,"nempe, tu, subeo, calidaris, gurges, aqua",6,"NaN, NaN, NaN, NaN, NaN, 0.0",0.0,0.0,"tu, gurges",0.333
rutilius.de_reditu,1.108,"rumpo, tarpeias, hostis, premo, uia",5,"NaN, NaN, -1.0, NaN, 0.0",-0.2,-0.2,,0.0
rutilius.de_reditu,1.109,"si, sum, aeternus, casus, fortasse, puto",6,"NaN, NaN, 0.5, 0.0, NaN, NaN",0.083,0.0,,0.0
rutilius.de_reditu,1.11,"auxilium, fluo, qui, redeo, sum",5,"0.0, NaN, NaN, NaN, NaN",0.0,0.0,,0.0
rutilius.de_reditu,1.111,"quis, loquor, includo, inter, laquearia, silua",6,"NaN, NaN, NaN, NaN, NaN, NaN",nan,nan,,0.0
rutilius.de_reditu,1.112,"uernula, qui, uario, carmen, ludo, auus",6,"NaN, NaN, NaN, 0.0, NaN, NaN",0.0,0.0,,0.0
rutilius.de_reditu,1.113,"uerus, tuus, numquam, mulceo, desino, annus",6,"0.5, 0.0, NaN, NaN, NaN, 0.0",0.083,0.0,,0.0
rutilius.de_reditu,1.114,"delicia, tuus, uinco, tueor, hiems",5,"0.5, 0.0, NaN, NaN, NaN",0.1,0.0,,0.0
rutilius.de_reditu,1.115,"erigo, crinal, laurus, senium, sacro",5,"NaN, NaN, NaN, -0.5, NaN",-0.1,-0.1,crinal,0.2
rutilius.de_reditu,1.116,"uertex, in, uiridis, roma, refinge, como",6,"NaN, NaN, NaN, NaN, NaN, NaN",nan,nan,,0.0
rutilius.de_reditu,1.117,"aureus, turrigero, radio, diadema, conus",5,"0.5, NaN, NaN, NaN, NaN",0.1,0.0,,0.0
rutilius.de_reditu,1.118,"perpetuus, ignis, aureus, umbo, uomo",5,"0.0, 0.0, 0.5, NaN, NaN",0.1,0.0,,0.0
rutilius.de_reditu,1.119,"abscondo, tristis, deleo, iniuria, casus",5,"NaN, -1.0, NaN, -1.0, 0.0",-0.4,-0.4,,0.0
rutilius.de_reditu,1.12,"contemno, solidet, uulnero, claudo, dolor",5,"NaN, NaN, NaN, NaN, -1.0",-0.2,-0.2,,0.0
rutilius.de_reditu,1.121,"aduerro, solo, tuus, spero, secundus",5,"NaN, NaN, 0.0, NaN, 0.0",0.0,0.0,,0.0
rutilius.de_reditu,1.122,"exemplum, caelum, diues, damno, subeo",5,"0.0, 0.5, 0.5, NaN, NaN",0.2,0.0,damno,0.2
rutilius.de_reditu,1.123,"astrum, flamma, renouo, occasus, ortus",5,"NaN, NaN, NaN, NaN, NaN",nan,nan,,0.0
rutilius.de_reditu,1.124,"luna, finio, cerno, ut, incipio",5,"NaN, NaN, NaN, NaN, NaN",nan,nan,,0.0
rutilius.de_reditu,1.125,"uictor, brenni, non, differo, allium, poena",6,"NaN, NaN, NaN, NaN, NaN, -1.0",-0.167,-0.167,poena,0.167
rutilius.de_reditu,1.126,"samnis, seruitium, foedero, saeuus, luo",5,"NaN, -1.0, NaN, -1.0, NaN",-0.4,-0.4,"foedero, saeuus, luo",0.6
rutilius.de_reditu,1.127,"post, multus, pyrrhum, clades, supero, fugo",6,"NaN, 0.0, NaN, -1.0, NaN, NaN",-0.167,-0.167,,0.0
rutilius.de_reditu,1.128,"fleo, successus, hannibal, ipse, suus",5,"NaN, 0.5, NaN, NaN, NaN",0.1,0.0,,0.0
rutilius.de_reditu,1.129,"qui, mergo, nequeo, nisus, magnus, resurgo",6,"NaN, NaN, NaN, NaN, 0.0, NaN",0.0,0.0,,0.0
rutilius.de_reditu,1.13,"exiliuntque, imus, altus, ago, uado",5,"NaN, NaN, 0.5, NaN, NaN",0.1,0.0,,0.0
rutilius.de_reditu,1.131,"ut, nouo, uireo, fax, inclino, resumo",6,"NaN, NaN, NaN, NaN, NaN, NaN",nan,nan,fax,0.167
rutilius.de_reditu,1.132,"clarus, ex, humilis, sors, supernus, peto",6,"0.5, NaN, NaN, -1.0, NaN, NaN",-0.083,-0.167,humilis,0.167
rutilius.de_reditu,1.133,"porrigo, uinco, romana, in, saeculum, lex",6,"NaN, NaN, NaN, NaN, NaN, 0.5",0.083,0.0,,0.0
rutilius.de_reditu,1.134,"solo, fatal, non, uerearis, color",5,"NaN, NaN, NaN, NaN, 0.0",0.0,0.0,,0.0
rutilius.de_reditu,1.135,"quiuis, sedecies, deni, et, mille, perago",6,"NaN, NaN, NaN, NaN, NaN, NaN",nan,nan,,0.0
rutilius.de_reditu,1.136,"annus, praeterea, iam, tu, nonus, eo",6,"0.0, NaN, NaN, NaN, NaN, NaN",0.0,0.0,tu,0.167
rutilius.de_reditu,1.137,"qui, resto, nullus, obnoxius, tempus, metior",6,"NaN, NaN, NaN, -0.5, 0.0, NaN",-0.083,-0.083,,0.0
rutilius.de_reditu,1.138,"dum, sto, terra, dum, polus, astrum, fero",7,"NaN, NaN, 0.0, NaN, NaN, NaN, NaN",0.0,0.0,,0.0
rutilius.de_reditu,1.139,"ille, tu, reparo, qui, ceterus, regnum, resoluo",7,"NaN, NaN, NaN, NaN, 0.0, 0.0, NaN",0.0,0.0,tu,0.143
rutilius.de_reditu,1.14,"ordo, renascor, sum, cresco, possum, malus",6,"0.5, NaN, NaN, NaN, NaN, -1.0",-0.083,-0.167,,0.0
rutilius.de_reditu,1.141,"ergo, ago, sacrilega, tandem, cado, hostia, gens",7,"NaN, NaN, NaN, NaN, NaN, NaN, 0.0",0.0,0.0,hostia,0.143
rutilius.de_reditu,1.142,"submittant, trepidus, perfidus, collum, getae",5,"NaN, -1.0, -1.0, NaN, NaN",-0.4,-0.4,perfidus,0.2
rutilius.de_reditu,1.143,"diues, pacatae, do, uectigalis, terra",5,"0.5, NaN, NaN, NaN, 0.0",0.1,0.0,,0.0
rutilius.de_reditu,1.144,"impleo, augustus, barbarum, praeda, sinus",5,"NaN, 1.0, NaN, NaN, NaN",0.2,0.0,barbarum,0.2
rutilius.de_reditu,1.145,"aeternus, tu, rhenus, aro, tu, nilus, inundo",7,"0.5, NaN, NaN, NaN, NaN, NaN, NaN",0.071,0.0,"tu, tu, inundo",0.429
rutilius.de_reditu,1.146,"altrix, suus, fertilis, orbis, alo",5,"NaN, NaN, 1.0, NaN, NaN",0.2,0.0,altrix,0.2
rutilius.de_reditu,1.147,"quin, et, fecundus, tu, confero, africa, messis",7,"NaN, NaN, 1.0, NaN, NaN, NaN, NaN",0.143,0.0,tu,0.143
rutilius.de_reditu,1.148,"sol, suus, diues, sed, magis, imber, tuus",7,"NaN, NaN, 0.5, NaN, NaN, NaN, 0.0",0.071,0.0,,0.0
rutilius.de_reditu,1.149,"interea, et, latius, consurgo, horreum, sulcus",6,"NaN, NaN, NaN, NaN, NaN, NaN",nan,nan,,0.0
rutilius.de_reditu,1.15,"pingue, hesperio, nectaris, prelum, fluo",5,"NaN, NaN, NaN, NaN, NaN",nan,nan,,0.0
rutilius.de_reditu,1.151,"ipse, triumphal, redimio, arundo, thybris",5,"NaN, NaN, NaN, NaN, NaN",nan,nan,,0.0
rutilius.de_reditu,1.152,"romuleis, famulo, usus, apto, aqua",5,"NaN, NaN, NaN, NaN, 0.0",0.0,0.0,,0.0
rutilius.de_reditu,1.153,"atque, opulentus, tu, placidus, commercium, ripa",6,"NaN, NaN, NaN, 1.0, NaN, NaN",0.167,0.0,tu,0.167
rutilius.de_reditu,1.154,"deuehat, hinc, rus, subueho, inde, mare",6,"NaN, NaN, 0.0, NaN, NaN, 0.0",0.0,0.0,,0.0
rutilius.de_reditu,1.155,"pando, precor, geminus, pacatum, castor, pontus",6,"NaN, NaN, NaN, NaN, NaN, 0.0",0.0,0.0,,0.0
rutilius.de_reditu,1.156,"tempero, aequoreus, dux, cytherea, uia",5,"NaN, NaN, 0.5, NaN, 0.0",0.1,0.0,,0.0
rutilius.de_reditu,1.157,"si, non, displiceo, rego, cum, ius, quirinus",7,"NaN, NaN, NaN, NaN, NaN, 0.5, NaN",0.071,0.0,,0.0
rutilius.de_reditu,1.158,"si, colo, sancio, consuluique, pater",5,"NaN, NaN, NaN, NaN, 0.0",0.0,0.0,,0.0
rutilius.de_reditu,1.159,"nam, qui, nullus, meus, stringo, crimen, ferrum",7,"NaN, NaN, NaN, 0.0, NaN, -1.0, NaN",-0.143,-0.143,crimen,0.143
rutilius.de_reditu,1.16,"non, sum, praefectus, gloria, sed, populus",6,"NaN, NaN, NaN, 0.0, NaN, 0.0",0.0,0.0,,0.0
rutilius.de_reditu,1.161,"siue, do, patrius, uita, compono, terra",6,"NaN, NaN, 0.0, 0.0, NaN, 0.0",0.0,0.0,,0.0
rutilius.de_reditu,1.162,"siue, oculus, umquam, restituo, meus",5,"NaN, 0.0, NaN, NaN, 0.0",0.0,0.0,,0.0
rutilius.de_reditu,1.163,"fortuno, ago, ueto, beo, omnis",5,"NaN, NaN, NaN, NaN, NaN",nan,nan,,0.0
rutilius.de_reditu,1.164,"semper, digno, si, memini, mei.•",5,"NaN, NaN, NaN, NaN, NaN",nan,nan,,0.0
rutilius.de_reditu,1.165,"hic, dictum, iter, arripio, comito, amicus",6,"NaN, 0.0, 0.0, NaN, NaN, 1.0",0.167,0.0,hic,0.167
rutilius.de_reditu,1.166,"dico, non, possum, lumen, sicco, •uale•",6,"NaN, NaN, NaN, NaN, NaN, NaN",nan,nan,,0.0
rutilius.de_reditu,1.167,"iam, alius, roma, redeo, haereo, eo",6,"NaN, NaN, NaN, NaN, NaN, NaN",nan,nan,,0.0
rutilius.de_reditu,1.168,"rufus, albinus, gloria, uiuus, pater",5,"NaN, NaN, 0.0, 0.0, 0.0",0.0,0.0,uiuus,0.2
rutilius.de_reditu,1.169,"qui, uolusi, antiquus, deriuo, stemma, nomen",6,"NaN, NaN, 0.0, NaN, NaN, 0.0",0.0,0.0,,0.0
rutilius.de_reditu,1.17,"et, rex, rutulos, testis, marum, refero",6,"NaN, 0.0, NaN, NaN, NaN, NaN",0.0,0.0,,0.0
rutilius.de_reditu,1.171,"hic, facundus, committo, palatium, lingua",5,"NaN, 1.0, NaN, NaN, -0.5",0.1,-0.1,hic,0.2
rutilius.de_reditu,1.172,"primaeuus, mereo, princeps, os, loquor",5,"NaN, NaN, 0.5, 0.0, NaN",0.1,0.0,,0.0
rutilius.de_reditu,1.173,"rego, ante, puer, populus, pro, consul, poenos",7,"NaN, NaN, 0.0, 0.0, NaN, 0.5, NaN",0.071,0.0,,0.0
rutilius.de_reditu,1.174,"aequalis, tyriis, terror, amo, sum",5,"0.5, NaN, -1.0, NaN, NaN",-0.1,-0.2,,0.0
rutilius.de_reditu,1.175,"sedulus, promitto, summus, insto, fascis",5,"NaN, NaN, NaN, NaN, NaN",nan,nan,,0.0
rutilius.de_reditu,1.176,"si, fas, sum, meritum, findo, consul, sum",7,"NaN, NaN, NaN, 1.0, NaN, 0.5, NaN",0.214,0.0,,0.0
rutilius.de_reditu,1.177,"inuitus, tristis, tandem, remearis, cogo",5,"-0.5, -1.0, NaN, NaN, NaN",-0.3,-0.3,,0.0
rutilius.de_reditu,1.178,"corpus, diuido, mens, tamen, unus, teneo",6,"0.0, NaN, 0.5, NaN, NaN, NaN",0.083,0.0,,0.0
rutilius.de_reditu,1.179,"tum, demum, ad, nauo, gradior, qui, frons, bicornis",8,"NaN, NaN, NaN, NaN, NaN, NaN, 0.0, NaN",0.0,0.0,,0.0
rutilius.de_reditu,1.18,"diuiduus, tiberis, dexter, seco",4,"NaN, NaN, NaN, NaN",nan,nan,,0.0
rutilius.de_reditu,1.181,"laeuus, inaccessus, fluuius, uito, harena",5,"-1.0, NaN, NaN, NaN, NaN",-0.2,-0.2,,0.0
rutilius.de_reditu,1.182,"hospes, aeneus, gloria, solus, maneo",5,"0.0, 0.0, 0.0, -0.5, NaN",-0.1,-0.1,,0.0
rutilius.de_reditu,1.183,"et, iam, nocturnus, spatium, laxo, hora",6,"NaN, NaN, NaN, NaN, NaN, NaN",nan,nan,,0.0
rutilius.de_reditu,1.184,"phoebus, chelaris, palliodore, polus",4,"NaN, NaN, NaN, NaN",nan,nan,,0.0
rutilius.de_reditu,1.185,"cuncto, tentaris, sal, portus, sedeo",5,"NaN, NaN, NaN, NaN, NaN",nan,nan,,0.0
rutilius.de_reditu,1.186,"neque, pigeo, oppono, otium, fero, mos",6,"NaN, NaN, NaN, 0.5, NaN, 0.5",0.167,0.0,otium,0.167
rutilius.de_reditu,1.187,"occiduus, infidus, dum, saeuio, gurges, plias",6,"NaN, -1.0, NaN, NaN, NaN, NaN",-0.167,-0.167,"saeuio, gurges",0.333
rutilius.de_reditu,1.188,"dum, procellosus, tempus, ira, cado",5,"NaN, NaN, 0.0, -1.0, NaN",-0.2,-0.2,,0.0
rutilius.de_reditu,1.189,"respectaris, iuuo, uicina, saepis, urbs",5,"NaN, NaN, NaN, NaN, 0.5",0.1,0.0,,0.0
rutilius.de_reditu,1.19,"et, mons, uideo, deficio, sequor",5,"NaN, NaN, NaN, NaN, NaN",nan,nan,,0.0
rutilius.de_reditu,1.191,"quisque, dux, oculus, gratus, regio, fruor",6,"NaN, 0.5, 0.0, 1.0, 0.0, NaN",0.25,0.0,,0.0
rutilius.de_reditu,1.192,"dum, sui, qui, cupio, cerno, possum, puto",7,"NaN, NaN, NaN, NaN, NaN, NaN, NaN",nan,nan,,0.0
rutilius.de_reditu,1.193,"neque, locus, ille, ego, cognosco, indico, fumus",7,"NaN, 0.0, NaN, NaN, NaN, NaN, NaN",0.0,0.0,,0.0
rutilius.de_reditu,1.194,"qui, domina, arx, et, caput, orbis, habeo",7,"NaN, NaN, NaN, NaN, 0.0, NaN, NaN",0.0,0.0,,0.0
rutilius.de_reditu,1.195,"quamquam, signum, leuis, fumus, commendo, homerus",6,"NaN, 0.0, 0.0, NaN, NaN, NaN",0.0,0.0,,0.0
rutilius.de_reditu,1.196,"diligo, quotiens, surgo, in, astrum, solum",6,"NaN, NaN, NaN, NaN, NaN, 0.0",0.0,0.0,,0.0
rutilius.de_reditu,1.197,"sed, caelum, plaga, candidus, traho, serenus",6,"NaN, 0.5, 0.0, NaN, NaN, NaN",0.083,0.0,,0.0
rutilius.de_reditu,1.198,"signo, septeni, culmen, clarus, iugum",5,"NaN, NaN, NaN, 0.5, NaN",0.1,0.0,,0.0
rutilius.de_reditu,1.199,"illic, perpetuus, soleo, atque, ipse, uideo",6,"NaN, 0.0, NaN, NaN, NaN, NaN",0.0,0.0,,0.0
rutilius.de_reditu,1.2,"qui, sui, roma, facio, purus, sum, dies",7,"NaN, NaN, NaN, NaN, 1.0, NaN, 0.0",0.143,0.0,,0.0
rutilius.de_reditu,1.201,"saepis, attono, resono, circensis, auris",5,"NaN, NaN, NaN, NaN, NaN",nan,nan,,0.0
rutilius.de_reditu,1.202,"nuntio, accendo, plenus, theatrum, fauor",5,"NaN, NaN, 0.0, NaN, 1.0",0.2,0.0,,0.0
rutilius.de_reditu,1.203,"pulso, nosco, reddo, ab, aether, uoco",6,"NaN, NaN, NaN, NaN, NaN, NaN",nan,nan,,0.0
rutilius.de_reditu,1.204,"uel, quia, peruenio, uel, quia, fingo, amor",7,"NaN, NaN, NaN, NaN, NaN, NaN, 1.0",0.143,0.0,fingo,0.143
rutilius.de_reditu,1.205,"exploro, fides, pelagus, ter, quinque, dies",6,"NaN, 1.0, NaN, NaN, NaN, 0.0",0.167,0.0,,0.0
rutilius.de_reditu,1.206,"dum, bonus, luna, fido, aura, nouus",6,"NaN, 1.0, NaN, NaN, 1.0, 1.0",0.5,0.0,,0.0
rutilius.de_reditu,1.207,"tum, discedo, studium, urbs, remitto",5,"NaN, NaN, 0.5, 0.5, NaN",0.2,0.0,,0.0
rutilius.de_reditu,1.208,"palladium, genus, spes, decus, meus",5,"NaN, 0.0, 0.5, NaN, 0.0",0.1,0.0,,0.0
rutilius.de_reditu,1.209,"facundus, iuuenis, gallus, nuper, ab, aruum",6,"1.0, NaN, NaN, NaN, NaN, NaN",0.167,0.0,gallus,0.167
rutilius.de_reditu,1.21,"mitto, romanus, disco, ius, forum",5,"NaN, NaN, NaN, 0.5, NaN",0.1,0.0,,0.0
rutilius.de_reditu,1.211,"ille, meus, cum, sui, dulcis, uinculum, cura",7,"NaN, 0.0, NaN, NaN, 0.5, NaN, -1.0",-0.071,-0.143,,0.0
rutilius.de_reditu,1.212,"filius, afficio, stirps, propinquus, habeo",5,"0.0, NaN, NaN, 0.0, NaN",0.0,0.0,,0.0
rutilius.de_reditu,1.213,"qui, aremoricas, pater, exuperantius, ora",5,"NaN, NaN, 0.0, NaN, NaN",0.0,0.0,,0.0
rutilius.de_reditu,1.214,"nunc, postliminium, pax, amo, doceo",5,"NaN, NaN, 0.5, NaN, NaN",0.1,0.0,,0.0
rutilius.de_reditu,1.215,"lex, restituo, libertas, reduco",4,"0.5, NaN, 0.5, NaN",0.25,0.0,,0.0
rutilius.de_reditu,1.216,"et, seruus, famulis, non, sino, sum, suus",7,"NaN, -0.5, NaN, NaN, NaN, NaN, NaN",-0.071,-0.071,,0.0
rutilius.de_reditu,1.217,"soluo, aurora, dubius, quo, tempus, primus",6,"NaN, NaN, -0.5, NaN, 0.0, 0.5",0.0,-0.083,,0.0
rutilius.de_reditu,1.218,"agnosco, patior, reddo, aruum, color",5,"NaN, NaN, NaN, NaN, 0.0",0.0,0.0,,0.0
rutilius.de_reditu,1.219,"progredio, paruus, per, litus, propior, cymbis",6,"NaN, 0.0, NaN, NaN, 0.0, NaN",0.0,0.0,,0.0
rutilius.de_reditu,1.22,"qui, perfugio, creber, pateo, humus",5,"NaN, NaN, NaN, NaN, NaN",nan,nan,"perfugio, humus",0.4
rutilius.de_reditu,1.221,"aestiuus, penetro, oneraria, carbasus, fluctus",5,"NaN, NaN, NaN, NaN, 0.0",0.0,0.0,,0.0
rutilius.de_reditu,1.222,"tueor, auctumnus, mobilitas, fuga",4,"NaN, 0.0, NaN, -0.5",-0.125,-0.125,,0.0
rutilius.de_reditu,1.223,"alsius, praelegitur, tellus, pyrgique, recedo",5,"NaN, NaN, NaN, NaN, NaN",nan,nan,,0.0
rutilius.de_reditu,1.224,"nunc, uilla, grandis, oppidum, paruus, prior",6,"NaN, NaN, 0.0, NaN, 0.0, 0.5",0.083,0.0,,0.0
