Text,Stelle,Inahlt,Wortzahl,Sentiment Rechnung,Sentiment-Score,alternativer Sentiment-Score,Invektiven,Invektivitäts-Score
sallust.catilina,26.0,"hic, res, conparo, catilina, nihilum, paruus, in, proximus, annus, consulatus, peto, spero, si, designo, sum, facilis, sui, ex, uoluntas, antonius, utor, neque, interea, quiesco, sum, sed, omnis, modus, insidiae, paro, cicero, neque, ille, tamen, ad, caueo, dolus, aut, astutia, desum, namque, ab, principium, consulatus, suus, multus, polliceor, per, fuluiam, efficio, ut, quintus, curius, de, quo, paulus, ante, memoro, consilium, catilina, sui, prodo, ad, hic, collega, suus, antonius, pactio, prouincia, perpello, ne, contra, res, publicus, sentio, circum, sui, praesidium, amicus, atque, cliens, occulte, habeo, postquam, dies, comitium, uenio, et, catilina, neque, petitio, neque, insidiae, qui, consul, in, campus, facio, prosperus, cedo, constituo, bellum, facio, et, exter, omnis, experior, quoniam, qui, occulte, tento, asper, foedo, euenio",114,"NaN, 0.0, NaN, NaN, NaN, 0.0, NaN, NaN, 0.0, NaN, NaN, NaN, NaN, NaN, NaN, 0.5, NaN, NaN, 0.0, NaN, NaN, NaN, NaN, NaN, NaN, NaN, NaN, 0.5, NaN, NaN, NaN, NaN, NaN, NaN, NaN, NaN, NaN, NaN, NaN, NaN, NaN, NaN, NaN, NaN, NaN, 0.0, NaN, NaN, NaN, NaN, NaN, NaN, NaN, NaN, NaN, NaN, NaN, NaN, 0.5, NaN, NaN, NaN, NaN, NaN, NaN, NaN, NaN, NaN, 0.0, NaN, NaN, NaN, 0.0, 0.0, NaN, NaN, NaN, NaN, 1.0, NaN, 0.0, NaN, NaN, NaN, 0.0, 0.5, NaN, NaN, NaN, NaN, NaN, NaN, NaN, NaN, 0.5, NaN, 0.0, NaN, 1.0, NaN, NaN, 0.0, NaN, NaN, 0.0, NaN, NaN, NaN, NaN, NaN, NaN, -0.5, NaN, NaN",0.035,-0.004,"hic, catilina, insidiae, dolus, catilina, hic, pactio, catilina, insidiae, foedo",0.088
sallust.catilina,27.0,"igitur, caius, manlius, faesulae, atque, in, is, pars, etruria, septimius, quidam, camers, in, ager, picenus, caius, iulius, in, appulia, dimitto, praeterea, alius, alius, qui, ubique, opportunus, sui, sum, credo, interea, roma, multus, simul, molior, consul, insidiae, tendo, paro, incendium, opportunus, locum, armo, homo, obsido, ipse, cum, telum, sum, item, alius, iubeo, hortor, uti, semper, intendo, paro, sum, dies, nox, festino, uigilaris, neque, insomnia, neque, labor, fatigo, postremo, ubi, multus, agito, nihil, procedo, rursus, intempestus, nox, coniuratio, princeps, conuoco, per, marcus, porcius, laeca, ibi, multus, de, ignauia, is, queror, doceo, sui, manlius, praemitto, ad, is, multitudo, quam, ad, capio, arma, paro, item, alius, in, alius, locum, opportunus, qui, initium, bellum, facio, sequor, ad, exercitus, proficisco, cupio, si, prior, cicero, opprimo, is, suus, consilium, multus, officio",124,"NaN, NaN, NaN, NaN, NaN, NaN, NaN, 0.0, NaN, NaN, NaN, NaN, NaN, 0.0, NaN, NaN, NaN, NaN, NaN, NaN, NaN, NaN, NaN, NaN, NaN, NaN, NaN, NaN, NaN, NaN, NaN, 0.0, NaN, NaN, 0.5, NaN, NaN, NaN, NaN, NaN, NaN, NaN, 0.0, NaN, NaN, NaN, NaN, NaN, NaN, NaN, NaN, NaN, NaN, NaN, NaN, NaN, NaN, 0.0, 0.0, NaN, NaN, NaN, -0.5, NaN, -0.5, NaN, NaN, NaN, 0.0, NaN, NaN, NaN, NaN, NaN, 0.0, -0.5, 0.5, NaN, NaN, NaN, 0.0, NaN, NaN, 0.0, NaN, -1.0, NaN, NaN, NaN, NaN, NaN, NaN, NaN, NaN, 0.0, NaN, NaN, NaN, 0.0, NaN, NaN, NaN, NaN, NaN, NaN, NaN, NaN, NaN, 0.0, NaN, NaN, NaN, 0.0, NaN, NaN, NaN, 0.5, NaN, NaN, NaN, NaN, 0.5, 0.0, NaN",-0.004,-0.02,"insidiae, coniuratio, ignauia",0.024
sallust.catilina,28.0,"igitur, perterreo, atque, dubito, ceterus, caius, cornelius, eques, romanus, opera, suus, polliceor, et, cum, is, lucius, uargunteius, senator, constituo, is, nox, paulus, post, cum, armo, homo, sicut, saluto, introeo, ad, cicero, atque, de, improuide, domus, suus, imparatus, confodio, curius, ubi, intellego, quantus, periculum, consul, inpendeo, properus, per, fuluiam, cicero, dolus, qui, paro, enuntio, ita, ille, ianua, prohibeo, tantus, facinus, frustra, suscipio, interea, manlius, in, etruria, plebs, sollicito, egestas, simul, atque, dolor, iniuria, nouaris, res, cupidus, qui, sulla, dominatio, ager, bonus, omnis, amitto, praeterea, latro, cuius, genus, qui, in, is, regio, magnus, copia, sum, nonnulli, ex, sullanis, colonia, qui, libido, atque, luxuria, ex, magnus, rapina, nihil, reliquus, facio",107,"NaN, NaN, NaN, NaN, 0.0, NaN, NaN, 0.0, NaN, -0.5, NaN, NaN, NaN, NaN, NaN, NaN, NaN, NaN, NaN, NaN, 0.0, NaN, NaN, NaN, NaN, 0.0, NaN, NaN, NaN, NaN, NaN, NaN, NaN, NaN, 0.0, NaN, NaN, NaN, NaN, NaN, NaN, NaN, -1.0, 0.5, NaN, NaN, NaN, NaN, NaN, NaN, NaN, NaN, NaN, NaN, NaN, NaN, NaN, NaN, -1.0, NaN, NaN, NaN, NaN, NaN, NaN, 0.0, NaN, -1.0, NaN, NaN, -1.0, -1.0, NaN, 0.0, -0.5, NaN, NaN, 0.0, 0.0, 1.0, NaN, NaN, NaN, NaN, NaN, 0.0, NaN, NaN, NaN, 0.0, 0.0, 0.5, NaN, NaN, NaN, NaN, NaN, NaN, -0.5, NaN, -0.5, NaN, 0.0, NaN, NaN, 0.0, NaN",-0.047,-0.065,"dolus, facinus, egestas, latro, libido, luxuria, rapina",0.065
sallust.catilina,29.0,"is, cum, cicero, nuntio, anceps, malus, permoueo, qui, neque, urbs, ab, insidiae, priuo, consilium, longus, tueor, possum, neque, exercitus, manlius, quantus, aut, quo, consilium, sum, satis, comperio, habeo, res, ad, senatus, refero, iam, antea, uulgus, rumor, exagito, itaque, qui, plerusque, in, atrox, negotium, soleo, senatus, decerno, do, opera, consul, ne, quis, res, publicus, detrimentum, capio, is, potestas, per, senatus, mos, romanus, magistratus, magnus, permitto, exercitus, paro, bellum, gero, coerceo, omnis, modus, socius, atque, ciuis, domus, militia, imperium, atque, iudicium, superus, habeo, aliter, sine, populus, iussus, nullus, is, res, consul, ius, sum",91,"NaN, NaN, NaN, NaN, -0.5, -1.0, NaN, NaN, NaN, 0.5, NaN, NaN, NaN, 0.5, 0.0, NaN, NaN, NaN, 0.0, NaN, NaN, NaN, NaN, 0.5, NaN, 0.5, NaN, NaN, 0.0, NaN, 0.5, NaN, NaN, NaN, 0.0, NaN, NaN, NaN, NaN, NaN, NaN, -1.0, -0.5, NaN, 0.5, NaN, NaN, -0.5, 0.5, NaN, NaN, 0.0, 0.0, -0.5, NaN, NaN, 0.5, NaN, 0.5, 0.5, NaN, 0.5, 0.0, NaN, 0.0, NaN, 0.0, NaN, NaN, NaN, 0.5, 1.0, NaN, 0.5, 0.0, 0.0, 0.0, NaN, 0.5, NaN, NaN, NaN, NaN, 0.0, NaN, NaN, NaN, 0.0, 0.5, 0.5, NaN",0.055,-0.044,"insidiae, exagito, coerceo",0.033
sallust.catilina,30.0,"post, paucus, dies, lucius, saenius, senator, in, senatus, littera, recito, qui, faesulae, affero, sui, dico, in, qui, scribo, sum, caius, manlius, arma, capio, cum, magnus, multitudo, ante, dies, uis, kalendae, nouembris, simul, is, qui, in, talis, res, soleo, alius, portentum, atque, prodigium, nuntio, alius, conuenio, fio, arma, porto, capua, atque, in, appulia, seruilis, bellum, moueo, igitur, senatus, decretum, quintus, marcius, rex, faesulae, quintus, metellus, creticus, in, appulia, circum, is, locum, mitto, hic, uterque, ad, urbs, imperator, sum, impedio, ne, triumpho, calumnia, paucus, qui, omnis, honestus, atque, inhonestus, uendo, mos, sum, sed, praetor, quintus, pompeius, rufus, capua, quintus, metellus, celer, in, ager, picenus, is, permitto, uti, pro, tempus, atque, periculum, exercitus, conparo, ad, hic, si, quis, indico, de, coniuratio, qui, contra, res, publicus, facio, sum, praemium, seruo, libertas, et, sestertium, centum, liber, impunitas, is, res, et, sestertium, ducenti, mille, ito, decerno, uti, gladiatorius, familia, capua, et, in, ceterus, municipium, distribuo, pro, cuius, ops, roma, per, totus, urbs, uigilia, habeo, is, paruus, magistratus, praesum",162,"NaN, 0.0, 0.0, NaN, NaN, NaN, NaN, 0.5, 0.0, NaN, NaN, NaN, NaN, NaN, NaN, NaN, NaN, NaN, NaN, NaN, NaN, 0.0, NaN, NaN, 0.0, 0.0, NaN, 0.0, 1.0, NaN, NaN, NaN, NaN, NaN, NaN, NaN, 0.0, NaN, NaN, 0.0, NaN, 0.0, NaN, NaN, NaN, NaN, 0.0, NaN, NaN, NaN, NaN, NaN, -0.5, 0.0, NaN, NaN, 0.5, NaN, NaN, NaN, 0.0, NaN, NaN, NaN, NaN, NaN, NaN, NaN, NaN, NaN, NaN, NaN, NaN, NaN, 0.5, 0.5, NaN, NaN, NaN, NaN, -1.0, 0.0, NaN, NaN, 1.0, NaN, -1.0, NaN, 0.5, NaN, NaN, 0.5, NaN, NaN, NaN, NaN, NaN, NaN, NaN, NaN, 0.0, NaN, NaN, NaN, NaN, NaN, 0.0, NaN, -1.0, 0.0, NaN, NaN, NaN, NaN, NaN, NaN, NaN, -0.5, NaN, NaN, 0.0, 0.0, NaN, NaN, 1.0, NaN, 0.5, NaN, 0.0, NaN, 0.5, -0.5, NaN, 0.0, NaN, 0.0, NaN, NaN, NaN, NaN, NaN, NaN, 0.5, NaN, NaN, NaN, 0.0, 0.0, NaN, NaN, NaN, 0.0, NaN, NaN, NaN, 0.5, NaN, NaN, NaN, 0.0, 0.5, NaN",0.025,-0.028,"portentum, prodigium, hic, honestus, inhonestus, uendo, hic, coniuratio, impunitas, gladiatorius",0.062
sallust.catilina,31.0,"quis, res, permoueo, ciuitas, atque, immutatus, urbs, facies, sum, ex, summus, laetitia, atque, lasciuia, qui, diuturnus, quies, pario, repens, omnis, tristitia, inuado, festino, trepido, neque, locus, neque, homo, quisquam, satis, credo, neque, bellum, gero, neque, pax, habeo, suus, quisque, metus, periculum, metior, ad, hic, mulier, qui, res, publicus, magnitudo, bellum, timor, insolitus, incedo, afflicto, sui, manus, supplex, ad, caelum, tendo, miseror, paruus, liber, rogito, omnis, lt.omni, rumore&gt, pasco, lt.adripere, omnia&gt, superbia, atque, deliciae, omitto, sui, patria, diffido, at, catilina, crudelis, animus, idem, ille, moueo, tametsi, praesidium, paro, et, ipse, lex, plautius, interrogo, sum, ab, lucius, paulus, postremo, dissimulo, causa, aut, suus, expurgo, sicut, iurgium, lacesso, sum, in, senatus, uenio, tum, marcus, tullius, consul, siue, praesentia, is, timeo, siue, ira, conmoueo, oratio, habeo, luculentus, atque, utilis, res, publicus, quam, postea, scribo, edo, sed, ubi, ille, adsedeo, catilina, ut, sum, paro, ad, dissimulo, omnis, demitto, uultus, uox, supplicium, postulo, lt.a&gt, pater, coepio, ne, quis, de, sui, temere, credo, is, familia, orior, ita, sui, ab, adulescentia, uita, instituo, ut, omnis, bonus, in, spes, habeo, ne, existimo, sui, patricius, homo, qui, ipse, atque, magnus, plurimus, beneficium, in, plebs, romanus, sum, perdo, res, publicus, opus, sum, cum, is, seruo, marcus, tullius, inquilinus, ciuis, urbs, roma, ad, hic, malus, dictum, alius, cum, addo, obstrepo, omnis, hostis, atque, parricida, uocaris, tum, ille, furibundus, quoniam, quidem, circumuenio, inquam, ab, inimicus, praeceps, ago",224,"NaN, 0.0, NaN, 0.5, NaN, NaN, 0.5, 0.0, NaN, NaN, NaN, 1.0, NaN, NaN, NaN, 0.5, NaN, NaN, 0.0, NaN, -1.0, NaN, NaN, NaN, NaN, 0.0, NaN, 0.0, NaN, 0.5, NaN, NaN, 0.0, NaN, NaN, 0.5, NaN, NaN, NaN, -1.0, -1.0, NaN, NaN, NaN, 0.0, NaN, 0.0, 0.0, 0.0, 0.0, -0.5, -0.5, NaN, NaN, NaN, 0.0, 0.0, NaN, 0.5, NaN, NaN, 0.0, 0.5, NaN, NaN, NaN, NaN, NaN, NaN, NaN, -1.0, NaN, NaN, NaN, NaN, NaN, NaN, NaN, NaN, -1.0, 0.5, NaN, NaN, NaN, NaN, NaN, NaN, NaN, NaN, 0.5, NaN, NaN, NaN, NaN, NaN, NaN, NaN, NaN, 0.0, NaN, NaN, NaN, NaN, -1.0, NaN, NaN, NaN, 0.5, NaN, NaN, NaN, NaN, 0.5, NaN, NaN, NaN, NaN, NaN, -1.0, NaN, -0.5, NaN, 1.0, NaN, 1.0, 0.0, 0.0, NaN, NaN, NaN, NaN, NaN, NaN, NaN, NaN, NaN, NaN, NaN, NaN, NaN, NaN, NaN, NaN, NaN, 0.0, NaN, NaN, NaN, 0.0, NaN, NaN, NaN, NaN, NaN, NaN, NaN, NaN, 0.5, NaN, NaN, NaN, NaN, NaN, 0.0, NaN, NaN, NaN, 1.0, NaN, 0.5, NaN, NaN, NaN, NaN, 0.0, 0.0, NaN, NaN, NaN, 0.0, NaN, 1.0, NaN, 0.0, NaN, NaN, NaN, 0.0, 0.0, 0.5, NaN, NaN, NaN, NaN, NaN, NaN, NaN, 0.5, 0.5, NaN, NaN, NaN, -1.0, 0.0, NaN, NaN, NaN, NaN, NaN, -1.0, NaN, -1.0, NaN, NaN, NaN, NaN, NaN, NaN, NaN, NaN, NaN, -1.0, NaN, NaN",0.002,-0.056,"lasciuia, hic, mulier, superbia, deliciae, catilina, crudelis, catilina, supplicium, hic, parricida, furibundus",0.054
sallust.catilina,32.0,"incendium, meus, ruina, restinguo, deinde, sui, ex, curia, domus, proripio, ibi, multus, ipse, cum, sui, uoluo, qui, neque, insidiae, consul, procedo, et, ab, incendium, intellego, urbs, uigilia, munio, bonus, factus, credo, exercitus, augeo, atque, prior, quam, legio, scribo, multus, antecapio, qui, bellum, usus, sum, nox, intempestus, cum, paucus, in, manlianus, castrum, proficiscor, sum, sed, cethegus, atque, lentulus, ceter, qui, cognosco, promptus, audacia, mando, qui, res, possum, ops, factio, confirmo, insidiae, consul, maturo, caedes, incendium, alius, bellum, facinus, pareo, sui, propediem, cum, magnus, exercitus, ad, urbs, accedo, dum, hic, roma, gero, caius, manlius, ex, suus, numerus, legatus, ad, marcius, rex, mitto, cum, mandatum, hic, modus",104,"NaN, 0.0, NaN, NaN, NaN, NaN, NaN, -1.0, 0.0, NaN, NaN, 0.0, NaN, NaN, NaN, NaN, NaN, NaN, NaN, 0.5, NaN, NaN, NaN, NaN, NaN, 0.5, NaN, NaN, 1.0, NaN, NaN, 0.0, NaN, NaN, 0.5, NaN, 0.0, NaN, 0.0, NaN, NaN, 0.0, NaN, NaN, 0.0, NaN, NaN, 0.0, NaN, NaN, NaN, NaN, NaN, NaN, NaN, NaN, NaN, NaN, NaN, NaN, NaN, 1.0, NaN, NaN, 0.0, NaN, 0.0, 0.5, NaN, NaN, 0.5, NaN, -0.5, NaN, NaN, 0.0, -1.0, NaN, NaN, NaN, NaN, 0.0, 0.0, NaN, 0.5, NaN, NaN, NaN, NaN, NaN, NaN, NaN, NaN, NaN, NaN, 0.0, NaN, NaN, 0.0, NaN, NaN, NaN, NaN, 0.5",0.029,-0.024,"insidiae, audacia, factio, insidiae, caedes, facinus, hic, hic",0.077
sallust.catilina,33.0,"deus, homo, testor, imperator, nos, arma, neque, contra, patria, capio, neque, quo, periculum, alius, facio, sed, uti, corpus, noster, ab, iniuria, tueor, sum, qui, miser, egeo, uiolens, atque, crudelitas, faenerator, plerusque, patria, sed, omnis, fama, atque, fortuna, expers, sum, neque, quisquam, nos, licet, mos, magnus, lex, uti, neque, amitto, patrimonium, liber, corpus, habeo, tantus, saeuitia, faenerator, atque, praetor, sum, saepe, magnus, uester, misereor, plebs, romanus, decretum, suus, inopia, is, opitulor, sum, atque, nouus, memoria, noster, propter, magnitudo, aer, alienus, uolo, omnis, bonus, argentum, aer, soluo, sum, saepe, ipse, plebs, aut, dominor, studium, permoueo, aut, superbia, magistratus, armo, ab, pater, secedo, at, nos, non, imperium, neque, diuitiae, peto, qui, res, causa, bellum, atque, certamen, omnis, inter, mortalis, sum, sed, libertas, quam, nemo, bonus, nisi, cum, anima, simul, amitto, tu, atque, senatus, obtestor, consulo, miser, ciuis, lex, praesidium, qui, iniquitas, praetor, eripio, restituo, neue, nos, is, neccessitudino, inpono, ut, quaero, quonam, modo, magnus, ulciscor, sanguis, nos, pereo",155,"0.0, 0.0, NaN, 0.5, NaN, 0.0, NaN, NaN, NaN, NaN, NaN, NaN, -1.0, NaN, NaN, NaN, NaN, 0.0, NaN, NaN, -1.0, NaN, NaN, NaN, -1.0, NaN, NaN, NaN, -1.0, -0.5, NaN, NaN, NaN, NaN, 1.0, NaN, 0.0, NaN, NaN, NaN, NaN, NaN, NaN, 0.5, 0.0, 0.5, NaN, NaN, NaN, NaN, 0.5, 0.0, NaN, NaN, -1.0, -0.5, NaN, 0.5, NaN, NaN, 0.0, NaN, NaN, 0.0, NaN, NaN, NaN, -1.0, NaN, NaN, NaN, NaN, 1.0, 1.0, NaN, NaN, 0.0, 0.0, -0.5, NaN, NaN, 1.0, NaN, 0.0, NaN, NaN, NaN, NaN, 0.0, NaN, NaN, 0.5, NaN, NaN, -1.0, 0.5, NaN, NaN, 0.0, NaN, NaN, NaN, NaN, 0.0, NaN, 0.5, NaN, NaN, 0.0, 0.0, 0.0, NaN, 0.5, NaN, NaN, -1.0, NaN, NaN, 0.5, NaN, -0.5, 1.0, NaN, NaN, 0.5, NaN, NaN, NaN, NaN, 0.5, NaN, NaN, -1.0, 0.5, 0.5, NaN, NaN, -1.0, 0.5, NaN, NaN, NaN, NaN, NaN, NaN, NaN, NaN, NaN, NaN, NaN, 0.0, NaN, NaN, NaN, NaN",0.003,-0.077,"miser, crudelitas, saeuitia, superbia, tu, miser, iniquitas, ulciscor",0.052
sallust.catilina,34.0,"ad, hic, quintus, marcius, respondeo, si, quis, ab, senatus, peto, uolo, ab, arma, discedo, roma, supplex, proficiscor, is, mansuetudo, atque, misericordia, senatus, populus, romanus, semper, sum, ut, nemo, umquam, ab, is, frustra, auxilium, peto, at, catilina, ex, iter, plerusque, consularis, praeterea, bonus, qui, littera, mitto, sui, falsum, crimen, circumuenio, quoniam, factio, inimicus, resisto, nequeo, fortuna, cedo, massilia, in, exsilium, proficisco, non, quo, sui, tantus, scelus, conscius, sum, sed, uti, res, publicus, quietus, sum, neue, ex, suus, contentio, seditio, orior, ab, hic, longus, diuorto, littera, quintus, catulus, in, senatus, recito, qui, sui, nomen, catilina, reddo, dico, is, exemplum, infra, scribo, sum",100,"NaN, NaN, NaN, NaN, NaN, NaN, NaN, NaN, 0.5, NaN, NaN, NaN, 0.0, NaN, NaN, 0.0, NaN, NaN, 1.0, NaN, 1.0, 0.5, 0.0, NaN, NaN, NaN, NaN, -0.5, NaN, NaN, NaN, NaN, 0.0, NaN, NaN, NaN, NaN, 0.0, NaN, 0.5, NaN, 1.0, NaN, 0.0, NaN, NaN, NaN, -1.0, NaN, NaN, 0.5, -1.0, NaN, NaN, 0.0, NaN, NaN, NaN, -1.0, NaN, NaN, NaN, NaN, NaN, -1.0, -0.5, NaN, NaN, NaN, 0.0, 0.0, NaN, NaN, NaN, NaN, NaN, NaN, NaN, NaN, NaN, NaN, 0.0, NaN, 0.0, NaN, 0.0, NaN, 0.5, NaN, NaN, NaN, 0.0, NaN, NaN, NaN, NaN, 0.0, NaN, NaN, NaN",0.005,-0.05,"hic, catilina, crimen, factio, scelus, conscius, seditio, hic, catilina",0.09
sallust.catilina,35.0,"lucius, catilina, quintus, catulus, egregius, tuus, fides, res, cognosco, gratus, ego, magnus, in, meus, periculum, fiducia, commendatio, meus, tribuo, quam, ob, res, defensio, in, nouo, consilium, non, statuo, paro, satisfactio, ex, nullus, conscientia, de, culpa, propono, decerno, quam, ego, dius, fidus, uerus, licet, cognosco, iniuria, contumelia, concito, qui, fructus, labor, industria, meus, priuo, status, dignitas, non, obtineo, publicus, miserum, causa, pro, meus, consuetudo, suscipio, non, quin, aes, alienus, meus, nomen, ex, possessio, soluo, non, possum, et, alienus, nomen, liberalitas, orestilla, suus, filia, copia, persoluo, sed, qui, non, dignus, homo, honor, honesto, uideo, ego, fallo, suspicio, alieno, sum, sentio, hic, nomen, satis, honestus, pro, meus, casus, spes, reliquus, dignitas, conseruo, sum, sequor, multus, cum, scribo, uolo, nuntio, sum, uis, ego, paro, nunc, orestilla, commendo, tuus, fides, trado, is, ab, iniuria, defendo, per, liber, tuus, rogo, haueto",135,"NaN, NaN, NaN, 0.0, 0.0, 0.0, 1.0, 0.0, NaN, 1.0, NaN, 0.0, NaN, 0.0, -1.0, 0.5, 0.5, 0.0, NaN, NaN, NaN, 0.0, NaN, NaN, NaN, 0.5, NaN, NaN, NaN, NaN, NaN, NaN, 0.0, NaN, -1.0, NaN, NaN, NaN, NaN, NaN, 1.0, 0.5, NaN, NaN, -1.0, -1.0, NaN, NaN, 0.5, -0.5, 0.5, 0.0, NaN, 0.0, 1.0, NaN, NaN, 0.0, NaN, 0.0, NaN, 0.0, NaN, NaN, NaN, NaN, NaN, -0.5, 0.0, 0.0, NaN, NaN, NaN, NaN, NaN, NaN, -0.5, 0.0, 1.0, NaN, NaN, NaN, 0.5, NaN, NaN, NaN, NaN, 1.0, 0.0, 1.0, NaN, NaN, NaN, NaN, -0.5, NaN, NaN, NaN, NaN, 0.0, 0.5, 1.0, NaN, 0.0, 0.0, 0.5, 0.0, 1.0, NaN, NaN, NaN, 0.0, NaN, NaN, NaN, NaN, NaN, 1.0, NaN, NaN, NaN, NaN, NaN, 0.0, 1.0, NaN, NaN, NaN, -1.0, NaN, NaN, 0.5, 0.0, NaN, NaN",0.067,-0.052,"catilina, conscientia, culpa, contumelia, fallo, hic, honestus",0.052
sallust.catilina,36.0,"sed, ipse, paucus, dies, conmoror, apud, caius, flaminius, in, ager, aretinus, dum, uicinitas, antea, sollicito, arma, exorno, cum, fascis, atque, alius, imperium, insignis, in, castrum, ad, manlius, contendo, hic, ubi, roma, comperio, sum, senatus, catilina, et, manlius, hostis, iudico, ceterus, multitudo, dies, statuo, ante, quam, sine, fraus, licet, ab, arma, discedo, praeter, res, capitalis, condemno, praeterea, decerno, uti, consul, dilectus, habeo, antonius, cum, exercitus, catilina, persequor, maturo, cicero, urbs, praesidium, sum, is, tempestas, ego, imperium, populus, romanus, multus, magnus, miserabilis, uideo, sum, qui, cum, ad, occasus, ab, ortus, sol, omnis, domo, arma, pario, domus, otium, atque, diuitiae, qui, primus, mortalis, puto, affluo, sum, tamen, ciuis, qui, sequor, res, publicus, obstinatus, animus, perdo, eo, namque, duo, senatus, decretum, ex, tantus, multitudo, neque, praemium, induco, coniuratio, patefacio, neque, ex, castrum, catilina, quisquam, omnis, discedo, tantus, uolo, morbus, atque, uti, tabes, plerus, ciuis, animus, inuado",142,"NaN, NaN, 0.0, 0.0, NaN, NaN, NaN, NaN, NaN, 0.0, NaN, NaN, 0.0, NaN, NaN, 0.0, NaN, NaN, NaN, NaN, NaN, 0.0, 0.0, NaN, NaN, NaN, NaN, NaN, NaN, NaN, NaN, NaN, NaN, 0.5, NaN, NaN, NaN, -1.0, NaN, 0.0, 0.0, 0.0, NaN, NaN, NaN, NaN, -1.0, NaN, NaN, 0.0, NaN, NaN, 0.0, -1.0, NaN, NaN, NaN, NaN, 0.5, NaN, NaN, NaN, NaN, 0.0, NaN, NaN, NaN, NaN, 0.5, NaN, NaN, NaN, 0.0, NaN, 0.0, 0.0, NaN, 0.0, 0.0, -1.0, NaN, NaN, NaN, NaN, NaN, NaN, NaN, NaN, NaN, NaN, NaN, 0.0, NaN, 0.0, 0.5, NaN, 0.5, NaN, 0.5, -1.0, NaN, NaN, NaN, NaN, 0.5, NaN, NaN, 0.0, 0.0, NaN, 0.5, NaN, NaN, NaN, NaN, 0.5, NaN, NaN, NaN, 0.0, NaN, 1.0, NaN, -0.5, NaN, NaN, NaN, NaN, NaN, NaN, NaN, NaN, NaN, NaN, -1.0, NaN, NaN, NaN, NaN, 0.5, 0.5, NaN",0.0,-0.046,"hic, catilina, fraus, capitalis, catilina, miserabilis, otium, coniuratio, catilina",0.063
sallust.catilina,37.0,"neque, solus, ille, alienus, mens, sum, qui, conscius, coniuratio, sum, sed, omnino, cunctus, plebs, nouaris, res, studium, catilina, inceptum, probo, is, adeo, mos, suus, uideo, facio, nam, semper, in, ciuitas, qui, ops, nullus, sum, bonus, inuideo, malus, extollo, uetero, odi, nouo, exopto, odium, suus, res, muto, omnis, studeo, turba, atque, seditio, sine, cura, alo, quoniam, egestas, facilis, habeo, sine, damnum, sed, urbanus, plebs, is, uerus, praeceps, sum, de, multus, causa, primus, omnis, qui, ubique, probrum, atque, petulantia, magnus, praesto, item, alius, per, dedecus, patrimonium, amitto, postremo, omnis, qui, flagitium, aut, facinus, domus, expello, is, roma, sicut, in, sentina, confluo, deinde, multus, memor, sullanus, uictoria, qui, ex, gregarius, miles, alius, senator, uideo, alius, ita, diues, ut, regius, uinco, atque, cultus, aetas, ago, sui, quisque, si, in, arma, sum, ex, uictoria, talis, spero, praeterea, iuuentus, qui, in, ager, manus, merces, inopia, tolero, priuo, atque, publicus, largitio, excio, urbanus, otium, ingratus, labor, praefero, is, atque, alius, omnis, malus, publicus, alo, quo, paruus, miror, sum, homo, egeo, malus, mos, magnus, spes, res, publicus, iuxta, atque, sui, consulo, praeterea, qui, uictoria, sulla, parens, proscribo, bonus, eripio, ius, libertas, inminuo, sum, haud, sanus, alius, animus, bellum, euenio, exspecto, ad, hic, quicumque, alius, atque, senatus, pars, sum, conturbo, res, publicus, quam, paruus, ualeo, ipse, malo, is, lt.ad&gt.eo, malus, multus, post, annus, in, ciuitas, reuorto",217,"NaN, -0.5, NaN, -0.5, 0.5, NaN, NaN, -0.5, -0.5, NaN, NaN, NaN, 0.0, 0.0, NaN, 0.0, 0.5, NaN, NaN, NaN, NaN, NaN, 0.5, NaN, NaN, NaN, NaN, NaN, NaN, 0.5, NaN, 0.0, NaN, NaN, 1.0, NaN, -1.0, NaN, NaN, NaN, NaN, NaN, -1.0, NaN, 0.0, NaN, NaN, NaN, 0.0, NaN, NaN, NaN, -1.0, NaN, NaN, -1.0, 0.5, NaN, NaN, -1.0, NaN, 0.5, 0.0, NaN, 0.5, NaN, NaN, NaN, 0.0, 0.0, 0.5, NaN, NaN, NaN, -1.0, NaN, -0.5, 0.0, NaN, NaN, NaN, NaN, -1.0, NaN, NaN, NaN, NaN, NaN, -1.0, NaN, -1.0, 0.0, NaN, NaN, NaN, NaN, NaN, NaN, NaN, NaN, 0.0, 1.0, NaN, NaN, NaN, NaN, NaN, 0.0, NaN, NaN, NaN, NaN, NaN, 0.5, NaN, 0.0, NaN, NaN, -0.5, 0.0, NaN, NaN, NaN, NaN, NaN, 0.0, NaN, NaN, NaN, NaN, NaN, NaN, NaN, NaN, NaN, 0.0, 0.0, 1.0, -1.0, NaN, NaN, NaN, 0.0, 0.0, NaN, 0.5, 0.5, -1.0, -0.5, NaN, NaN, NaN, NaN, NaN, -1.0, 0.0, NaN, NaN, 0.0, NaN, NaN, 0.0, NaN, -1.0, 0.5, 0.0, 0.5, 0.0, 0.0, NaN, NaN, NaN, NaN, NaN, NaN, NaN, NaN, 0.5, NaN, 1.0, NaN, 0.5, 0.5, NaN, NaN, NaN, 1.0, NaN, 0.5, 0.0, NaN, NaN, NaN, NaN, NaN, NaN, NaN, 0.5, 0.0, NaN, NaN, 0.0, 0.0, NaN, 0.0, NaN, NaN, NaN, NaN, NaN, -1.0, 0.0, NaN, 0.0, NaN, 0.5, NaN",-0.014,-0.081,"conscius, coniuratio, catilina, seditio, egestas, probrum, petulantia, dedecus, flagitium, facinus, sullanus, largitio, otium, ingratus, hic",0.069
sallust.catilina,38.0,"nam, postquam, gnaeus, pompeius, et, marcus, crassus, consul, tribunicius, potestas, restituo, sum, homo, adulescens, summa, potestas, nanciscor, qui, aetas, animus, ferox, sum, coepio, senatus, criminor, plebs, exagito, deinde, largior, atque, pollicitor, magis, incendo, ita, ipse, clarus, possum, fio, contra, is, summus, ops, nitor, plerusque, nobilitas, senatus, species, pro, suus, magnitudo, namque, uti, paucus, uerus, absoluo, post, ille, tempus, quicumque, res, publicus, agito, honestus, nomen, alius, sicut, populus, ius, defendo, pars, quo, senatus, auctoritas, magnus, sum, bonus, publicus, simulo, pro, suus, quisque, potentia, certo, neque, ille, modestia, neque, modus, contentio, sum, uterque, uictoria, crudeliter, exerceo",94,"NaN, NaN, NaN, NaN, NaN, NaN, NaN, 0.5, 0.0, 0.5, NaN, NaN, 0.0, NaN, NaN, 0.5, NaN, NaN, 0.0, 0.5, -1.0, NaN, NaN, 0.5, NaN, 0.0, NaN, NaN, NaN, NaN, NaN, NaN, NaN, NaN, NaN, 0.5, NaN, NaN, NaN, NaN, NaN, 0.0, 1.0, NaN, 1.0, 0.5, NaN, NaN, NaN, 0.0, NaN, NaN, 0.0, 0.5, NaN, NaN, NaN, 0.0, NaN, 0.0, 0.0, NaN, 1.0, 0.0, NaN, NaN, 0.0, 0.5, NaN, 0.0, NaN, 0.5, NaN, 0.0, NaN, 1.0, 0.0, NaN, NaN, NaN, NaN, 0.5, NaN, NaN, NaN, 0.5, NaN, 0.5, NaN, NaN, NaN, NaN, NaN, NaN",0.101,-0.011,"adulescens, ferox, exagito, honestus, modestia, crudeliter",0.064
sallust.catilina,39.0,"sed, postquam, gnaeus, pompeius, ad, bellum, maritimus, atque, mithridaticus, mitto, sum, plebs, ops, imminutus, paucus, potentia, cerno, is, magistratus, prouincia, alius, omnis, teneo, ipse, innoxius, floreo, sine, metus, aetas, ago, ceter, iudicium, terreo, quo, plebs, in, magistratus, placidus, tracto, sed, ubi, primus, dubius, res, nouo, spes, offertor, sum, uetus, certamen, animus, is, adrego, qui, si, primus, proelium, catilina, superus, aut, aequus, manus, discedo, profecto, magnus, clades, atque, calamitas, res, publicus, opprimo, neque, ille, qui, uictoria, adipiscor, sum, diu, is, uti, licet, quin, defetiscor, et, exsanguis, qui, multus, possum, imperium, atque, libertas, extorqueo, sum, tamen, extra, coniuratio, complures, qui, ad, catilina, initium, proficiscor, sum, in, is, sum, fuluus, senator, filius, qui, retraho, ex, iter, parens, neco, iubeo, idem, tempus, roma, lentulus, sicut, catilina, praecipio, quicumque, mos, aut, fortuna, nouus, res, idoneus, credo, aut, per, sui, aut, per, alius, sollicito, neque, solus, ciuis, sed, cuius, modus, genus, homo, qui, modo, bellum, usus, sum",151,"NaN, NaN, NaN, NaN, NaN, 0.0, NaN, NaN, NaN, NaN, NaN, 0.0, 0.0, NaN, 0.0, 0.5, NaN, NaN, 0.5, 0.0, NaN, NaN, NaN, NaN, 0.5, NaN, NaN, -1.0, 0.0, NaN, NaN, 0.5, NaN, NaN, 0.0, NaN, 0.5, 1.0, NaN, NaN, NaN, 0.5, -0.5, 0.0, NaN, 0.5, NaN, NaN, 0.0, 0.5, 0.5, NaN, NaN, NaN, NaN, 0.5, -1.0, NaN, NaN, NaN, 0.5, 0.0, NaN, NaN, 0.0, -1.0, NaN, -1.0, 0.0, 0.0, NaN, NaN, NaN, NaN, NaN, NaN, NaN, NaN, NaN, NaN, NaN, NaN, NaN, NaN, NaN, NaN, 0.0, NaN, 0.0, NaN, 0.5, NaN, NaN, NaN, NaN, -0.5, NaN, NaN, NaN, NaN, NaN, NaN, NaN, NaN, NaN, NaN, NaN, NaN, 0.0, NaN, NaN, NaN, 0.0, 0.5, NaN, NaN, NaN, 0.0, NaN, NaN, NaN, NaN, NaN, NaN, 0.5, NaN, 0.0, 1.0, 0.0, NaN, NaN, NaN, NaN, NaN, NaN, NaN, NaN, NaN, NaN, -0.5, 0.5, NaN, NaN, 0.5, 0.0, 0.0, NaN, NaN, 0.0, NaN, NaN",0.03,-0.036,"proelium, catilina, calamitas, exsanguis, coniuratio, catilina, catilina",0.046
