Text,Stelle,Inahlt,Wortzahl,Sentiment Rechnung,Sentiment-Score,alternativer Sentiment-Score,Invektiven,Invektivitäts-Score
sallust.catilina,14.0,"in, tantus, tam, corrumpo, ciuitas, catilina, is, qui, factus, facilis, sum, omnis, flagitium, atque, facinus, circum, sui, tamquam, stipator, caterua, habeo, nam, quicumque, impudicus, adulter, ganeo, manus, uenter, penis, bonus, patria, lacero, quisque, alienus, aes, grandis, conflo, quo, flagitium, aut, facinus, redimo, praeterea, omnis, undique, parricida, sacrilegus, conuinco, iudicium, aut, pro, facio, iudicium, timeo, ad, hic, qui, manus, atque, lingua, periurium, aut, sanguis, ciuilis, alo, postremo, omnis, qui, flagitium, egestas, conscius, animus, exagito, is, catilina, proximus, familiaris, sum, qui, si, quis, etiam, ab, culpa, uacuus, in, amicitia, is, incido, cottidianus, usus, atque, illecebra, facilis, par, similis, ceterus, efficio, sed, magnus, adulescens, familiaritas, adpeto, is, animus, mollis, et, aetas, fluo, dolus, haud, difficilis, capio, nam, ut, cuius, studium, ex, aetas, flagro, alius, scortum, praebeo, alius, canis, atque, equus, mercor, postremo, neque, sumptus, neque, modestia, suus, parco, dum, ille, obnoxius, fidus, sui, facio, scio, sum, nonnulli, qui, ita, existimo, iuuentus, qui, domus, catilina, frequento, parum, honestus, pudicitia, habeo, sed, ex, alius, res, magis, quam, qui, quisquam, is, comperio, sum, hic, fama, ualeo",170,"NaN, NaN, NaN, NaN, 0.5, NaN, NaN, NaN, NaN, 0.5, NaN, NaN, -1.0, NaN, -1.0, NaN, NaN, NaN, NaN, NaN, NaN, NaN, NaN, -1.0, NaN, NaN, 0.0, NaN, NaN, 1.0, NaN, NaN, NaN, -0.5, NaN, 0.0, NaN, NaN, -1.0, NaN, -1.0, NaN, NaN, NaN, NaN, -1.0, -1.0, NaN, 0.5, NaN, NaN, NaN, 0.5, NaN, NaN, NaN, NaN, 0.0, NaN, -0.5, -1.0, NaN, NaN, 0.5, NaN, NaN, NaN, NaN, -1.0, -1.0, -0.5, 0.5, NaN, NaN, NaN, NaN, 1.0, NaN, NaN, NaN, NaN, NaN, NaN, -1.0, NaN, NaN, 1.0, NaN, NaN, NaN, NaN, NaN, NaN, 0.5, 0.5, 0.0, 0.0, NaN, NaN, 0.0, NaN, 0.5, NaN, NaN, 0.5, NaN, NaN, 0.0, NaN, NaN, NaN, -0.5, NaN, NaN, NaN, NaN, 0.5, NaN, 0.0, NaN, NaN, NaN, NaN, NaN, NaN, NaN, NaN, NaN, NaN, NaN, NaN, NaN, 0.5, NaN, NaN, NaN, NaN, -0.5, 1.0, NaN, NaN, NaN, NaN, NaN, NaN, NaN, NaN, NaN, NaN, 0.0, NaN, NaN, 0.0, 1.0, 0.5, NaN, NaN, NaN, NaN, 0.0, NaN, NaN, NaN, NaN, NaN, NaN, NaN, NaN, 1.0, NaN",-0.006,-0.079,"catilina, flagitium, facinus, impudicus, adulter, ganeo, lacero, flagitium, facinus, parricida, sacrilegus, conuinco, hic, periurium, flagitium, egestas, conscius, exagito, catilina, culpa, illecebra, adulescens, dolus, scortum, mercor, modestia, catilina, honestus, pudicitia, hic",0.176
sallust.catilina,15.0,"iam, primus, adulescens, catilina, multus, nefandus, stuprum, facio, cum, uirgo, nobilis, cum, sacerdos, uestae, alius, hic, modus, contra, ius, for, postremo, capio, amor, aurelius, orestilla, qui, praeter, forma, nihil, umquam, bonus, laudo, qui, is, nubo, ille, dubito, timeo, priuignus, adolesco, aetas, pro, certus, credo, neco, filius, uacuus, domus, scelestus, nuptiae, facio, qui, quidem, res, ego, in, primus, uideo, causa, sum, facinus, maturo, namque, animus, impurus, deus, homo, infestus, neque, uigilia, neque, quies, sedo, possum, ita, conscientia, mens, excio, uasto, igitur, color, is, exsanguis, foedus, oculus, cieo, modo, modo, tardus, incessus, prorsus, in, facies, uultus, uecordia, insum",96,"NaN, 0.5, NaN, NaN, 0.0, -1.0, -1.0, NaN, NaN, NaN, 1.0, NaN, NaN, NaN, NaN, NaN, 0.5, NaN, 0.5, NaN, NaN, NaN, 1.0, NaN, NaN, NaN, NaN, 1.0, NaN, NaN, 1.0, NaN, NaN, NaN, NaN, NaN, NaN, NaN, NaN, NaN, 0.0, NaN, 0.5, NaN, NaN, 0.0, NaN, 0.0, -1.0, NaN, NaN, NaN, NaN, 0.0, NaN, NaN, 0.5, NaN, 0.0, NaN, -1.0, NaN, NaN, 0.5, -1.0, 0.0, 0.0, -1.0, NaN, NaN, NaN, NaN, NaN, NaN, NaN, 0.0, 0.5, NaN, NaN, NaN, 0.0, NaN, NaN, -1.0, 0.0, NaN, NaN, NaN, NaN, NaN, NaN, NaN, 0.0, NaN, -1.0, NaN",-0.005,-0.083,"adulescens, catilina, nefandus, stuprum, uirgo, hic, nubo, priuignus, scelestus, nuptiae, facinus, impurus, conscientia, uasto, exsanguis, uecordia",0.167
sallust.catilina,16.0,"sed, iuuentus, quam, ut, supra, dico, illicio, multus, modus, malus, facinus, edoceo, ex, ille, testis, signator, falsus, commodo, fides, fortuna, periculum, uilis, habeo, post, ubi, is, fama, atque, pudor, ad-tero, magnus, alius, impero, si, causa, pecco, in, praesens, paruus, suppeto, nihilum, paruus, insons, sicut, sons, circumuenio, iugulo, scilicet, ne, per, otium, torpesco, manus, aut, animus, gratuitus, potis, malus, atque, crudelis, sum, hic, amicus, socius, confido, catilina, simul, qui, aes, alienus, per, omnis, terra, ingens, sum, et, qui, plerusque, sullanus, miles, largus, suus, utor, rapina, et, uictoria, ueto, memor, ciuilis, bellum, exopto, opprimo, res, publicus, consilium, capio, in, italia, nullus, exercitus, gnaeus, pompeius, in, exter, terra, bellum, gero, ipse, consulatus, peto, magnus, spes, senatus, nihil, sanus, intendo, tueor, tranquillus, res, omnis, sed, is, prorsus, opportunus, catilina",125,"NaN, NaN, NaN, NaN, NaN, NaN, NaN, 0.0, 0.5, -1.0, -1.0, NaN, NaN, NaN, NaN, NaN, -1.0, NaN, 1.0, 0.0, -1.0, -0.5, NaN, NaN, NaN, NaN, 1.0, NaN, 0.5, NaN, 0.0, NaN, NaN, NaN, 0.0, NaN, NaN, 0.0, 0.0, NaN, NaN, 0.0, 1.0, NaN, -1.0, NaN, NaN, NaN, NaN, NaN, 0.5, NaN, 0.0, NaN, 0.5, 0.5, 0.0, -1.0, NaN, -1.0, NaN, NaN, 1.0, 1.0, NaN, NaN, NaN, NaN, NaN, -0.5, NaN, NaN, 0.0, -0.5, NaN, NaN, NaN, NaN, NaN, 0.0, NaN, NaN, NaN, NaN, NaN, NaN, NaN, 1.0, 0.5, 0.0, NaN, NaN, 0.0, 0.0, 0.5, NaN, NaN, NaN, NaN, 0.0, NaN, NaN, NaN, 0.0, 0.0, 0.0, NaN, NaN, NaN, NaN, 0.0, 0.5, 0.5, NaN, 1.0, NaN, NaN, NaN, 0.0, NaN, NaN, NaN, NaN, NaN, NaN",0.024,-0.068,"facinus, uilis, pudor, insons, sons, iugulo, otium, gratuitus, crudelis, hic, catilina, sullanus, rapina, catilina",0.112
sallust.catilina,17.0,"igitur, circiter, kalendae, iunius, lucius, caesar, et, caius, figulus, consul, primus, singuli, appello, hortor, alius, alius, tento, ops, suus, imparatus, res, publicus, magnus, praemium, coniuratio, doceo, ubi, satis, exploro, sum, qui, uolo, in, unus, omnis, conuoco, qui, magnus, necessitudo, et, plurimus, audacia, insum, is, conuenio, senatorius, ordo, publicus, lentulus, sura, publicus, autronius, lucius, cassius, longinus, caius, cethegus, publicus, et, ser., sulla, ser., filius, lucius, uargunteius, quintus, annius, marcus, porcius, laeca, lucius, bestia, quintus, curius, praeterea, ex, equester, ordo, marcus, fuluus, nobilior, lucius, statilius, publicus, gabinius, capito, caius, cornelius, ad, hic, multus, ex, colonia, et, municipium, domus, nobilis, sum, praeterea, complures, paulus, occulo, consilium, hic, particeps, nobilis, qui, magis, dominatio, spes, hortor, quam, inopia, aut, alius, necessitudo, ceterum, iuuentus, plerusque, sed, magnus, nobilis, catilina, inceptum, faueo, qui, in, otium, uel, magnificus, uel, mollis, uiuo, copia, sum, incertus, pro, certus, bellum, quam, pax, malo, sum, item, is, tempestas, qui, credo, marcus, licinius, crassus, non, ignarus, is, consilium, sum, quia, gnaeus, pompeius, inuideo, ipse, magnus, exercitus, ducto, cuius, ops, uolo, contra, ille, potentia, cresco, simul, confido, si, coniuratio, ualeo, facilis, apud, ille, princeps, sui, sum",182,"NaN, NaN, NaN, NaN, NaN, 0.5, NaN, NaN, NaN, 0.5, 0.5, NaN, NaN, NaN, NaN, NaN, NaN, 0.0, NaN, NaN, 0.0, 0.0, 0.0, 1.0, -0.5, NaN, NaN, 0.5, NaN, NaN, NaN, NaN, NaN, NaN, NaN, NaN, NaN, 0.0, NaN, NaN, NaN, 1.0, NaN, NaN, NaN, NaN, 0.5, 0.0, NaN, NaN, 0.0, NaN, NaN, NaN, NaN, NaN, NaN, 0.0, NaN, NaN, NaN, NaN, 0.0, NaN, NaN, NaN, NaN, NaN, 0.0, NaN, NaN, NaN, NaN, NaN, NaN, NaN, NaN, 0.5, NaN, NaN, NaN, NaN, NaN, 0.0, NaN, 0.0, NaN, NaN, NaN, NaN, 0.0, NaN, NaN, NaN, 0.0, 0.0, 1.0, NaN, NaN, NaN, NaN, NaN, 0.5, NaN, 0.0, 1.0, NaN, NaN, 0.0, 0.5, NaN, NaN, -1.0, NaN, NaN, NaN, NaN, NaN, NaN, NaN, 0.0, 1.0, NaN, NaN, NaN, NaN, NaN, 0.5, NaN, 0.0, NaN, NaN, NaN, 0.5, NaN, -0.5, NaN, 0.5, 0.0, NaN, 0.5, NaN, NaN, NaN, NaN, 0.0, NaN, NaN, NaN, NaN, NaN, NaN, -1.0, NaN, 0.5, NaN, NaN, NaN, NaN, NaN, NaN, 0.0, 0.0, NaN, NaN, 0.0, NaN, NaN, NaN, 0.5, NaN, NaN, NaN, NaN, -0.5, NaN, 0.5, NaN, NaN, 0.5, NaN, NaN",0.052,-0.019,"coniuratio, audacia, longinus, bestia, hic, hic, catilina, otium, coniuratio",0.049
sallust.catilina,18.0,"sed, antea, item, coniuro, paucus, contra, res, publicus, in, qui, catilina, sum, de, qui, quam, uerus, possum, dico, lucius, tullus, et, marcus, lepidus, consul, publicus, autronius, et, publicus, sulla, designo, consul, lex, ambitus, interrogo, poena, do, post, paulus, catilina, pecunia, repeto, reus, prohibeo, sum, consulatus, peto, qui, intra, legitimus, dies, profiteor, nequeo, sum, idem, tempus, gnaeus, piso, adulescens, nobilis, summa, audacia, egeo, factiosus, qui, ad, perturbo, res, publicus, inopia, atque, malus, mos, stimulo, cum, hic, catilina, et, autronius, circiter, nona, december, consilium, communico, paro, in, capitolium, kalendae, ianuarius, lucius, cotta, et, lucius, torquatus, consul, interficio, ipse, fascis, corripio, piso, cum, exercitus, ad, optineo, duo, hispania, mitto, is, res, cognosco, rursus, in, nona, februarius, consilium, caedes, transfero, iam, tum, non, consul, modo, sed, plerusque, senator, pernicies, machinor, qui, ni, catilina, maturo, pro, curia, signum, socius, do, is, dies, post, condo, urbs, roma, malus, facinus, patro, sum, quia, nondum, frequens, armatus, conuenio, is, res, consilium, disredimo",154,"NaN, NaN, NaN, NaN, 0.0, NaN, 0.0, 0.0, NaN, NaN, NaN, NaN, NaN, NaN, NaN, 0.5, NaN, NaN, NaN, NaN, NaN, NaN, NaN, 0.5, 0.0, NaN, NaN, 0.0, NaN, NaN, 0.5, 0.5, NaN, NaN, -1.0, NaN, NaN, NaN, NaN, 0.0, NaN, NaN, NaN, NaN, NaN, NaN, NaN, NaN, NaN, 0.0, NaN, NaN, NaN, NaN, 0.0, NaN, NaN, NaN, 1.0, NaN, 1.0, NaN, NaN, NaN, NaN, NaN, 0.0, 0.0, -1.0, NaN, -1.0, 0.5, NaN, NaN, NaN, NaN, NaN, NaN, NaN, NaN, NaN, 0.5, NaN, NaN, NaN, NaN, NaN, NaN, NaN, NaN, NaN, NaN, NaN, 0.5, NaN, NaN, NaN, NaN, NaN, NaN, 0.0, NaN, NaN, NaN, NaN, NaN, NaN, 0.0, NaN, NaN, NaN, NaN, NaN, 0.5, -0.5, NaN, NaN, NaN, NaN, 0.5, NaN, NaN, NaN, NaN, -1.0, NaN, NaN, NaN, NaN, NaN, NaN, -1.0, 0.0, 1.0, NaN, NaN, 0.0, NaN, NaN, 0.5, NaN, -1.0, -1.0, NaN, NaN, NaN, NaN, NaN, 0.0, NaN, NaN, 0.0, 0.5, NaN",0.006,-0.049,"coniuro, catilina, poena, catilina, pecunia, reus, adulescens, audacia, stimulo, hic, catilina, interficio, caedes, catilina, facinus",0.097
sallust.catilina,19.0,"postea, piso, in, citer, hispania, quaestor, pro, praetor, mitto, sum, annitor, crassus, qui, is, infestus, inimicus, gnaeus, pompeius, cognosco, neque, tamen, senatus, prouincia, inuitus, do, quippe, foedus, homo, ab, res, publicus, procul, sum, uolo, simul, quia, bonus, complures, praesidium, in, is, puto, et, iam, tum, potentia, pompeius, formidulosus, sum, sed, is, piso, in, prouincia, ab, eques, hispanus, qui, in, exercitus, ducto, iter, facio, occido, sum, sum, qui, ita, dico, imperium, is, iniustus, superbus, crudelis, barbarus, nequeo, patior, alius, autem, eques, ille, gnaeus, pompeius, uetus, fidus, cliens, uoluntas, is, piso, aggredior, numquam, hispani, praeterea, talis, facinus, facio, sed, imperium, saeuus, multus, antea, perpetior, nos, is, res, in, medium, relinquo, de, superus, coniuratio, satis, dico",113,"NaN, NaN, NaN, NaN, NaN, NaN, NaN, 0.5, NaN, NaN, NaN, NaN, NaN, NaN, -1.0, -1.0, NaN, NaN, NaN, NaN, NaN, 0.5, 0.0, -0.5, NaN, NaN, -1.0, 0.0, NaN, 0.0, 0.0, NaN, NaN, NaN, NaN, NaN, 1.0, NaN, NaN, NaN, NaN, NaN, NaN, NaN, NaN, 0.5, NaN, -1.0, NaN, NaN, NaN, NaN, NaN, 0.0, NaN, 0.0, NaN, NaN, NaN, 0.0, NaN, 0.0, NaN, NaN, NaN, NaN, NaN, NaN, NaN, 0.0, NaN, -1.0, -1.0, -1.0, NaN, NaN, NaN, NaN, NaN, 0.0, NaN, NaN, NaN, 0.0, 1.0, 0.0, 0.0, NaN, NaN, NaN, NaN, NaN, NaN, NaN, -1.0, NaN, NaN, 0.0, -1.0, 0.0, NaN, NaN, NaN, NaN, 0.0, NaN, NaN, NaN, NaN, NaN, -0.5, 0.5, NaN",-0.053,-0.088,"occido, iniustus, crudelis, facinus, saeuus, coniuratio",0.053
sallust.catilina,20.0,"catilina, ubi, is, qui, paulus, ante, memoro, conuenio, uideo, tametsi, cum, singuli, multus, saepe, ago, tamen, in, res, sum, credo, uniuorsos, appello, et, cohortor, in, abditus, pars, aedes, secedo, atque, ibi, omnis, arbiter, procul, amoueo, oratio, hic, modus, habeo, ni, uirtus, fido, uester, specto, ego, sum, nequiquam, opportunus, res, cado, spes, magnus, dominatio, in, manus, frustra, sum, neque, ego, per, ignauio, aut, uanus, ingenium, incertus, pro, certus, capto, sed, quia, multus, et, magnus, tempestas, tu, cognosco, fortis, fidus, ego, is, animus, audeo, sum, magnus, atque, pulcher, facinus, incipio, simul, quia, tu, idem, qui, ego, bonus, malum, sum, intellego, nam, idem, uolo, atque, idem, nolo, is, demum, firmo, amicitia, sum, sed, ego, qui, mens, agito, omnis, iam, antea, diuorto, audio, ceterum, ego, in, dies, magis, animus, accendo, cum, considero, qui, condicio, uita, sum, sum, nisi, nos, ipse, uindico, in, libertas, nam, postquam, res, publicus, in, paucus, potens, ius, atque, dicio, concedo, semper, ille, rex, tetrarches, uectigal, sum, populus, natio, stipendium, pendeo, ceterus, omnis, strenuus, bonus, nobilis, atque, ignobilis, uulgus, sum, sine, gratia, sine, auctoritas, is, obnoxius, qui, si, res, publicus, ualeo, formido, sum, itaque, omnis, gratia, potentia, honor, diuitiae, apud, ille, sum, aut, ubi, ille, uolo, nos, relinquo, periculum, repello, iudicium, egestas, qui, quo, usque, tandem, patior, o, fortis, uir, nonne, emorior, per, uirtus, praesto, quam, uita, miser, atque, inhonestus, ubi, alienus, superbia, ludibrium, sum, per, dedecus, amitto, uerus, enim, uerus, pro, deus, atque, homo, fides, uictoria, in, manus, nos, sum, uigeo, aetas, animus, ualeo, contra, ille, annus, atque, diuitiae, omnis, consenesco, tantummodo, inceptum, opus, sum, ceterus, res, expedio, etenim, quis, mortalis, qui, uirilis, ingenium, sum, tolero, possum, ille, diuitiae, supero, qui, profundo, in, extruendo, mare, et, mons, coaequo, nos, res, familiaris, etiam, ad, necessarius, desum, ille, bini, aut, amplus, domus, continuo, nos, lar, familiaris, nusquam, ullus, sum, cum, tabula, signum, toreuma, emo, nouo, diruo, alius, aedifico, postremo, omnis, modus, pecunia, traho, uexo, tamen, summus, libido, diuitiae, suus, uinco, nequeo, at, nos, sum, domus, inopia, foris, aes, alienus, malus, res, spes, multus, asper, denique, quis, reliquus, habeo, praeter, miser, anima, quin, igitur, expergiscor, en, ille, ille, quam, saepe, opto, libertas, praeterea, diuitiae, decus, gloria, in, oculus, sino, sum, fortuna, omnis, is, uictor, praemium, pono, res, tempus, periculum, egestas, bellum, spolium, magnificus, magis, quam, oratio, meus, tu, hortor, uel, imperator, uel, miles, ego, utor, neque, animus, neque, corpus, ab, tu, absum, hic, ipse, ut, spero, cum, tu, unus, consul, ago, nisi, fors, ego, animus, fallo, et, tu, seruio, magis, quam, impero, paro, sum",411,"NaN, NaN, NaN, NaN, NaN, NaN, NaN, NaN, NaN, NaN, NaN, NaN, 0.0, NaN, NaN, NaN, NaN, 0.0, NaN, NaN, NaN, NaN, NaN, NaN, NaN, NaN, 0.0, 0.0, NaN, NaN, NaN, NaN, NaN, NaN, NaN, -0.5, NaN, 0.5, NaN, NaN, 1.0, NaN, NaN, NaN, NaN, NaN, NaN, NaN, 0.0, NaN, 0.5, 0.0, 0.0, NaN, 0.0, NaN, NaN, NaN, NaN, NaN, NaN, NaN, -0.5, 0.5, -0.5, NaN, 0.5, NaN, NaN, NaN, 0.0, NaN, 0.0, 0.0, NaN, NaN, 0.5, 1.0, NaN, NaN, 0.5, NaN, NaN, 0.0, NaN, 1.0, -1.0, NaN, NaN, NaN, NaN, NaN, NaN, NaN, 1.0, -1.0, NaN, NaN, NaN, NaN, NaN, NaN, NaN, NaN, NaN, NaN, NaN, 1.0, NaN, NaN, NaN, NaN, 0.5, NaN, NaN, NaN, NaN, NaN, NaN, NaN, NaN, NaN, 0.0, NaN, 0.5, NaN, NaN, NaN, NaN, 0.0, 0.0, NaN, NaN, NaN, NaN, NaN, NaN, NaN, 0.5, NaN, NaN, 0.0, 0.0, NaN, 0.0, 1.0, 0.5, NaN, NaN, NaN, NaN, NaN, 0.0, NaN, NaN, NaN, 0.0, 0.0, NaN, NaN, 0.0, NaN, 1.0, 1.0, 1.0, NaN, -1.0, 0.0, NaN, NaN, 1.0, NaN, NaN, NaN, -0.5, NaN, NaN, 0.0, 0.0, NaN, -1.0, NaN, NaN, NaN, 1.0, 0.5, 1.0, 0.5, NaN, NaN, NaN, NaN, NaN, NaN, NaN, NaN, NaN, -1.0, NaN, 0.5, -1.0, NaN, NaN, NaN, NaN, NaN, NaN, 0.5, 0.5, NaN, NaN, NaN, 1.0, NaN, NaN, 0.0, -1.0, NaN, -1.0, NaN, -0.5, -1.0, -1.0, NaN, NaN, -1.0, NaN, 0.5, NaN, 0.5, NaN, 0.0, NaN, 0.0, 1.0, NaN, NaN, 0.0, NaN, NaN, NaN, 0.0, 0.5, NaN, NaN, NaN, 0.0, NaN, 0.5, NaN, NaN, NaN, NaN, 0.5, NaN, 0.0, 0.0, NaN, NaN, NaN, -1.0, NaN, 0.5, 0.5, NaN, NaN, NaN, NaN, 0.5, NaN, NaN, NaN, NaN, NaN, 0.0, NaN, NaN, NaN, NaN, 0.0, 1.0, NaN, NaN, 0.0, NaN, NaN, NaN, NaN, 0.0, 0.0, NaN, NaN, NaN, 1.0, NaN, NaN, NaN, NaN, NaN, 0.0, NaN, NaN, NaN, NaN, NaN, NaN, NaN, NaN, 0.5, 0.0, NaN, NaN, NaN, NaN, -0.5, 0.5, NaN, NaN, NaN, NaN, NaN, NaN, 0.0, -1.0, NaN, NaN, -0.5, -1.0, 0.0, 0.5, 0.0, -0.5, NaN, NaN, 0.0, NaN, NaN, -1.0, 0.5, NaN, NaN, NaN, NaN, NaN, NaN, NaN, NaN, NaN, 0.5, NaN, 0.5, NaN, 0.0, NaN, 0.0, NaN, NaN, 0.0, NaN, NaN, NaN, 1.0, NaN, 0.0, 0.0, -1.0, -1.0, 0.0, NaN, 0.0, NaN, NaN, -0.5, 0.0, NaN, NaN, NaN, 0.5, NaN, 0.0, NaN, NaN, NaN, 0.5, NaN, 0.0, NaN, NaN, NaN, NaN, NaN, NaN, NaN, NaN, NaN, NaN, 0.5, NaN, NaN, 0.0, NaN, 0.5, NaN, NaN, NaN, NaN, NaN, NaN, NaN, NaN, NaN",0.029,-0.052,"catilina, hic, uanus, tu, facinus, tu, natio, egestas, miser, inhonestus, superbia, ludibrium, dedecus, emo, pecunia, uexo, libido, miser, egestas, tu, tu, hic, tu, fallo, tu",0.061
sallust.catilina,21.0,"postquam, accipio, is, homo, qui, malus, abunde, omnis, sum, sed, neque, res, neque, spes, bonus, ullus, tametsi, ille, quietus, moueo, magnus, merces, uideo, tamen, postulo, plerusque, ut, propono, qui, condicio, bellum, sum, qui, praemium, arma, peto, quis, ubique, ops, aut, spes, habeo, tum, catilina, polliceor, tabula, nouo, proscriptio, locuples, magistratus, sacerdotium, rapina, alius, omnis, qui, bellum, atque, libido, uictor, fero, praeterea, sum, in, hispania, citer, piso, in, mauretania, cum, exercitus, publicus, sittius, nucerinus, consilium, suus, particeps, peto, consulatus, caius, antonius, qui, sui, collega, sum, spero, homo, et, familiaris, et, omnis, necessitudo, circumuenio, cum, is, sui, consul, initium, ago, facio, ad, hic, maledictum, increpo, omnis, bonus, suus, unus, quisque, nomino, laudo, admoneo, alius, egestas, alius, cupiditas, suus, complures, periculum, aut, ignominia, multus, uictoria, sullanus, qui, is, praeda, sum, postquam, omnis, animus, alacer, uideo, cohortor, ut, petitio, suus, cura, habeo, conuenio, dimitto",140,"NaN, NaN, NaN, 0.0, NaN, -1.0, NaN, NaN, NaN, NaN, NaN, 0.0, NaN, 0.5, 1.0, NaN, NaN, NaN, NaN, NaN, 0.0, 1.0, NaN, NaN, NaN, NaN, NaN, NaN, NaN, 0.0, 0.0, NaN, NaN, 1.0, 0.0, NaN, NaN, NaN, 0.0, NaN, 0.5, NaN, NaN, NaN, NaN, NaN, NaN, NaN, 1.0, 0.5, NaN, NaN, NaN, NaN, NaN, 0.0, NaN, -0.5, NaN, NaN, NaN, NaN, NaN, NaN, NaN, NaN, NaN, NaN, NaN, 0.0, 0.0, NaN, NaN, 0.5, NaN, 0.0, NaN, NaN, NaN, NaN, NaN, NaN, NaN, NaN, NaN, 0.0, NaN, 1.0, NaN, NaN, NaN, NaN, NaN, NaN, NaN, 0.5, NaN, NaN, NaN, NaN, NaN, -1.0, NaN, NaN, 1.0, NaN, NaN, NaN, NaN, NaN, NaN, NaN, -1.0, NaN, -0.5, NaN, NaN, -1.0, NaN, 0.0, 0.0, NaN, NaN, NaN, NaN, NaN, NaN, NaN, NaN, 0.5, 1.0, NaN, NaN, NaN, NaN, NaN, -1.0, NaN, NaN, NaN",0.029,-0.043,"catilina, proscriptio, locuples, rapina, libido, hic, maledictum, increpo, egestas, ignominia, sullanus",0.079
sallust.catilina,22.0,"sum, is, tempestas, qui, dico, catilina, oratio, habeo, cum, ad, ius, iuro, popularis, scelus, suus, adigo, humanus, corpus, sanguis, uinum, permisceo, in, patera, circumfero, inde, cum, post, exsecratio, omnis, degusto, sicut, in, sollemne, sacrum, fio, con-suesco, aperio, consilium, suus, atque, is, dictitaris, facio, quo, inter, sui, fidus, magis, sum, alius, alius, tantus, facinus, conscius, nonnullus, fictum, et, hic, et, multus, praeterea, existimo, ab, is, qui, cicero, inuidia, qui, postea, orior, sum, lenio, credo, atrocitas, scelus, is, qui, poena, do, nos, is, res, pro, magnitudo, parum, comperio, sum",87,"NaN, NaN, 0.0, NaN, NaN, NaN, -0.5, NaN, NaN, NaN, 0.5, NaN, 0.0, -1.0, NaN, NaN, 0.0, 0.0, NaN, NaN, NaN, NaN, NaN, NaN, NaN, NaN, NaN, NaN, NaN, NaN, NaN, NaN, NaN, NaN, NaN, NaN, NaN, 0.5, NaN, NaN, NaN, NaN, NaN, NaN, NaN, NaN, 1.0, NaN, NaN, NaN, NaN, NaN, -1.0, -0.5, NaN, NaN, NaN, NaN, NaN, 0.0, NaN, NaN, NaN, NaN, NaN, NaN, -1.0, NaN, NaN, NaN, NaN, NaN, NaN, -1.0, -1.0, NaN, NaN, -1.0, NaN, NaN, NaN, 0.0, NaN, 0.0, 0.0, NaN, NaN",-0.057,-0.08,"catilina, popularis, scelus, exsecratio, facinus, conscius, fictum, hic, inuidia, scelus, poena",0.126
sallust.catilina,23.0,"sed, in, is, coniuratio, sum, quintus, curius, nascor, haud, obscurum, locus, flagitium, atque, facinus, cooperio, qui, censor, senatus, probrum, gratia, moueo, hic, homo, non, paruus, uanitas, insum, quam, audacia, neque, reticeo, qui, audio, neque, suus, ipse, scelus, occulto, prorsus, neque, dico, neque, facio, quisquam, pensum, habeo, sum, is, cum, fuluia, mulier, nobilis, stuprum, uetus, consuetudo, qui, cum, paruus, gratus, sum, quia, inopia, paruus, largior, possum, repens, glorior, mare, mons, polliceor, coepio, et, mino, interdum, ferrum, ni, sui, obnoxius, sum, postremo, ferox, agito, quam, soleo, sum, at, fuluia, insolentia&lt.e&gt, curius, causa, cognosco, talis, periculum, res, publicus, haud, occulo, habeo, sed, tollo, auctor, de, catilina, coniuratio, qui, quoque, modo, audio, complures, narro, is, res, in, primus, studium, homo, accendo, ad, consulatus, mando, marcus, tullius, cicero, namque, antea, plerusque, nobilitas, inuidia, aestuo, et, quasi, polluo, consulatus, credo, si, is, quiuis, egregius, homo, noui, adipiscor, sum, sed, ubi, periculum, aduenio, inuidia, atque, superbia, post, sum",151,"NaN, NaN, NaN, -0.5, NaN, NaN, NaN, NaN, NaN, NaN, 0.0, -1.0, NaN, -1.0, NaN, NaN, NaN, 0.5, -1.0, 1.0, NaN, NaN, 0.0, NaN, 0.0, -1.0, NaN, NaN, 1.0, NaN, NaN, NaN, NaN, NaN, NaN, NaN, -1.0, NaN, NaN, NaN, NaN, NaN, NaN, NaN, NaN, NaN, NaN, NaN, NaN, NaN, 0.0, 1.0, -1.0, 0.0, NaN, NaN, NaN, 0.0, 1.0, NaN, NaN, -1.0, 0.0, NaN, NaN, 0.0, NaN, 0.0, NaN, NaN, NaN, NaN, NaN, NaN, NaN, NaN, NaN, -0.5, NaN, NaN, -1.0, NaN, NaN, NaN, NaN, NaN, NaN, NaN, NaN, 0.0, NaN, NaN, -1.0, 0.0, 0.0, NaN, NaN, NaN, NaN, NaN, NaN, NaN, NaN, -0.5, NaN, NaN, NaN, NaN, NaN, NaN, NaN, 0.0, NaN, 0.5, 0.5, 0.0, NaN, NaN, NaN, NaN, NaN, NaN, NaN, NaN, NaN, NaN, 1.0, -1.0, NaN, NaN, NaN, NaN, NaN, NaN, NaN, NaN, NaN, 0.0, 0.0, NaN, NaN, NaN, NaN, NaN, -1.0, NaN, -1.0, NaN, -1.0, NaN, NaN",-0.053,-0.096,"coniuratio, flagitium, facinus, probrum, hic, audacia, scelus, mulier, stuprum, ferox, catilina, coniuratio, inuidia, aestuo, polluo, inuidia, superbia",0.113
sallust.catilina,24.0,"igitur, comitium, habeo, consul, declaro, marcus, tullius, et, caius, antonius, qui, facio, primus, popularis, coniuratio, concutio, neque, tamen, catilina, furor, minuo, sed, in, dies, multus, agito, arma, per, italia, locus, opportunus, paro, pecunia, suus, aut, amicus, fides, sumo, mutuus, faesulae, ad, manlius, quidam, porto, qui, postea, princeps, sum, bellum, facio, is, tempestas, adi, cuius, genus, homo, ad-scio, sui, dico, mulier, etiam, aliquot, qui, primus, ingens, sumptus, stuprum, corpus, tolero, post, ubi, aetas, tantummodo, quaestus, neque, luxuria, modus, facio, aes, alienus, grandis, conflo, per, is, sui, catilina, credo, possum, seruitium, urbanus, sollicito, urbs, incendo, uir, is, uel, adiungo, sui, uel, interficio",100,"NaN, 0.5, NaN, 0.5, NaN, NaN, NaN, NaN, NaN, NaN, NaN, NaN, 0.5, 0.0, -0.5, NaN, NaN, NaN, NaN, -1.0, NaN, NaN, NaN, 0.0, 0.0, NaN, 0.0, NaN, NaN, 0.0, NaN, NaN, 0.0, NaN, NaN, 1.0, 1.0, NaN, 0.0, NaN, NaN, NaN, NaN, NaN, NaN, NaN, 0.5, NaN, 0.0, NaN, NaN, 0.0, NaN, NaN, 0.0, 0.0, NaN, NaN, NaN, 0.0, NaN, NaN, NaN, 0.5, -0.5, NaN, -1.0, 0.0, NaN, NaN, NaN, 0.0, NaN, 0.5, NaN, -0.5, 0.5, NaN, NaN, -0.5, 0.0, NaN, NaN, NaN, NaN, NaN, NaN, NaN, -1.0, 0.5, NaN, 0.5, NaN, 0.5, NaN, NaN, NaN, NaN, NaN, NaN",0.02,-0.05,"popularis, coniuratio, catilina, furor, pecunia, mulier, stuprum, quaestus, luxuria, catilina, interficio",0.11
sallust.catilina,25.0,"sed, in, is, sum, sempronia, qui, multus, saepe, uirilis, audacia, facinus, committo, hic, mulier, genus, atque, forma, praeterea, uir, liber, satis, fortunata, sum, littera, graecus, latinae, doceo, psallo, et, salto, elego, quam, necesse, sum, proba, multus, alius, qui, instrumentum, luxuria, sum, sed, is, carus, semper, omnis, quam, decus, atque, pudicitia, sum, pecunia, an, fama, paruus, parco, haud, facilis, discerno, libido, sic, accendo, ut, saepis, peto, uir, quam, peto, sed, is, saepe, antehac, fides, prodo, credo, abiuro, caedes, conscius, sum, luxuria, atque, inopia, praeceps, abeo, uerus, ingenium, is, haud, absurdus, possum, uerro, facio, iocus, moueo, sermo, uti, uel, modestus, uel, mollis, uel, procax, prorsus, multus, facetia, multus, lepos, insum",108,"NaN, NaN, NaN, NaN, NaN, NaN, 0.0, NaN, 0.5, 1.0, -1.0, NaN, NaN, 0.0, 0.0, NaN, 1.0, NaN, 0.5, 0.5, 0.5, NaN, NaN, 0.0, NaN, NaN, NaN, NaN, NaN, NaN, NaN, NaN, 0.0, NaN, NaN, 0.0, NaN, NaN, NaN, -0.5, NaN, NaN, NaN, 1.0, NaN, NaN, NaN, NaN, NaN, 0.5, NaN, 0.0, NaN, 1.0, 0.0, NaN, NaN, 0.5, NaN, -0.5, NaN, NaN, NaN, NaN, NaN, 0.5, NaN, NaN, NaN, NaN, NaN, NaN, 1.0, NaN, NaN, NaN, -0.5, -0.5, NaN, -0.5, NaN, -1.0, NaN, NaN, 0.5, 0.5, NaN, NaN, -1.0, NaN, NaN, NaN, -0.5, NaN, -0.5, NaN, NaN, 1.0, NaN, NaN, NaN, -1.0, NaN, 0.0, 0.0, 0.0, 1.0, NaN",0.037,-0.069,"audacia, facinus, hic, mulier, salto, luxuria, pudicitia, pecunia, libido, caedes, conscius, luxuria, modestus, procax",0.13
