Text,Stelle,Inahlt,Wortzahl,Sentiment Rechnung,Sentiment-Score,alternativer Sentiment-Score,Invektiven,Invektivitäts-Score
seneca.de_otio,8.29,"cit, nos, magnus, consensus, uitio, commendo, licet, nihil, alius, qui, sum, salutaris, tento, pro-sum, tamen, per, sui, ipse, secedo, bonus, sum, singuli, quis, qui, secedo, ad, bonus, uir, et, aliqui, exemplum, eligo, ad, qui, uita, de_-rego, licet, qui, nisi, in, otium, non, fio, tunc, possum, obtineo, qui, semel, placeo, ubi, nemo, interuenio, qui, iudicium, adhuc, imbecillus, populus, adiutor, detorqueo, tunc, possum, uito, aequal, et, unus, tenor, procedo, quam, propono, diuerto, scindo, nam, inter, ceterus, malus, ille, malus, sum, qui, uitio, ipse, muto, sic, ne, hic, quidem, nos, contingo, permaneo, in, malus, iam, familiaris, alius, ex, alius, placeo, uexatque, nos, hic, quoque, qui, iudicium, noster, non, tantus, prauus, sed, etiam, leuis, sum, fluctuo, alius, ex, alius, com, prehendo, peto, relinquo, relinquo, repeto, alternus, inter, cupiditas, noster, et, paenitentia, uicis, sum, pendeo, enim, totus, ex, alienus, iudicium, et, is, bonus, nos, uideo, qui, petitor, laudator, multus, habeo, non, is, qui, laudo, peto, sum, neque, uia, bonus, atque, malus, per, sui, aestimo, sed, turba, uestigium, in, qui, nullus, sum, redeo, dico, ego, quis, ago, se-neco, desero, pars, certus, stoici, uester, dico, usque, ad, ulter, uita, finis, in, actus, sum, non, desino, communis, bonus, opera, do, adiuuaris, singuli, ops, fero, etiam, inimicus, senilis, manus, nos, sum, qui, nullus, annus, uacatio, do, et, qui, aio, ille, uir, dissero, canities, galea, premo, nos, sum, apud, qui, usque, is, nihil, ante, mors, otiosus, sum, ut, si, res, patior, non, sum, ipse, mors, otiosus, quis, nos, epicuri, praecipio, in, ipse, zenonis, principia, loquor, quin, tu, bene, gnauiter, si, pars, pigeo, transfugio, potis, quam, prodeo, hic, tu, in, praesens, respondeo, numquid, uolo, amplus, quam, ut, ego, similis, dux, meus, praesto, quis, ergo, sum, non, quo, mitto, ego, ille, sed, quo, duco, eo, nunc, probo, tu, non, descisco, ego, ab, praecipio, stoicorum, nam, ne, ipse, quidem, ab, suus, de_-scio, et, tamen, excuso, sum, etiam, si, non, praecipio, ille, sequor, sed, exemplum, hic, qui, dico, in, duo, diuido, pars, primus, ut, possum, aliquis, uel, ab, primus, aetas, contemplatio, ueritas, totus, sui, trado, ratio, uiuo, quaero, atque, exerceo, secretum, deinde, ut, possum, hic, aliquis, emereo, iam, stipendium, profligo, aetas, ius, bonus, facio, et, ad, alius, ago, animus, refero, uirgo, uestalium, mos, qui, annus, inter, officium, diuido, disco, facio, sacer, et, cum, disco, doceo",371,"NaN, NaN, 0.0, NaN, NaN, NaN, NaN, NaN, NaN, NaN, NaN, 1.0, NaN, NaN, NaN, NaN, NaN, NaN, NaN, 1.0, NaN, NaN, NaN, NaN, NaN, NaN, 1.0, 0.5, NaN, NaN, 0.0, NaN, NaN, NaN, 0.0, NaN, NaN, NaN, NaN, NaN, 0.5, NaN, NaN, NaN, NaN, NaN, NaN, NaN, NaN, NaN, -0.5, NaN, NaN, 0.5, NaN, -1.0, 0.0, 0.0, NaN, NaN, NaN, NaN, NaN, NaN, NaN, NaN, NaN, NaN, NaN, NaN, NaN, NaN, NaN, 0.0, -1.0, NaN, -1.0, NaN, NaN, NaN, NaN, NaN, NaN, NaN, NaN, NaN, NaN, NaN, NaN, NaN, -1.0, NaN, 1.0, NaN, NaN, NaN, NaN, NaN, NaN, NaN, NaN, NaN, 0.5, NaN, NaN, NaN, -1.0, NaN, NaN, 0.0, NaN, NaN, NaN, NaN, NaN, NaN, NaN, NaN, NaN, NaN, NaN, NaN, NaN, -0.5, NaN, NaN, NaN, NaN, NaN, NaN, NaN, NaN, NaN, -0.5, 0.5, NaN, NaN, 1.0, NaN, NaN, NaN, NaN, NaN, 0.0, NaN, NaN, NaN, NaN, NaN, NaN, NaN, NaN, 0.0, 1.0, NaN, -1.0, NaN, NaN, NaN, NaN, 0.0, NaN, NaN, NaN, NaN, NaN, NaN, NaN, NaN, NaN, NaN, NaN, NaN, 0.0, 0.5, NaN, NaN, NaN, NaN, NaN, NaN, 0.0, 0.0, NaN, NaN, NaN, NaN, NaN, 0.0, 1.0, -0.5, NaN, NaN, NaN, 0.0, NaN, NaN, -1.0, -0.5, 0.0, NaN, NaN, NaN, NaN, 0.0, NaN, NaN, NaN, NaN, NaN, NaN, 0.5, NaN, NaN, NaN, NaN, NaN, NaN, NaN, NaN, NaN, NaN, NaN, NaN, -1.0, NaN, NaN, NaN, NaN, 0.0, NaN, NaN, NaN, NaN, -1.0, NaN, NaN, NaN, NaN, NaN, NaN, NaN, NaN, NaN, NaN, NaN, NaN, NaN, NaN, NaN, 0.0, NaN, NaN, 0.0, NaN, NaN, NaN, NaN, NaN, 0.0, NaN, NaN, NaN, 0.0, NaN, NaN, NaN, 0.0, 0.5, 0.0, NaN, NaN, NaN, NaN, NaN, NaN, NaN, NaN, NaN, NaN, NaN, NaN, NaN, NaN, NaN, NaN, NaN, NaN, NaN, NaN, NaN, NaN, NaN, NaN, NaN, NaN, NaN, NaN, NaN, NaN, NaN, NaN, NaN, NaN, NaN, NaN, NaN, NaN, NaN, NaN, 0.0, NaN, NaN, NaN, NaN, NaN, NaN, 0.0, 0.5, NaN, NaN, NaN, NaN, NaN, 0.5, 0.0, NaN, 0.5, NaN, NaN, NaN, 0.0, NaN, NaN, NaN, NaN, NaN, NaN, NaN, NaN, NaN, NaN, NaN, NaN, NaN, NaN, 0.0, 0.5, 1.0, NaN, NaN, NaN, NaN, NaN, 0.5, NaN, NaN, NaN, 0.5, NaN, 0.0, NaN, 0.5, NaN, NaN, NaN, 1.0, NaN, NaN, NaN, NaN",0.013,-0.031,"otium, hic, hic, prauus, canities, tu, transfugio, hic, tu, tu, hic, hic, uirgo",0.035
seneca.de_otio,8.3,"hic, stoicis, quoque, placeo, ostendo, non, quia, ego, lex, dico, nihil, contra, dico, zenonis, chrysippiue, committo, sed, quia, res, ipse, patior, ego, eo, in, ille, sententia, quoniam, si, quis, semper, unus, sequor, non, in, curia, sed, in, factio, sum, utinam, quidem, iam, teneo, omnis, et, in, aperio, confiteor, uereor, sum, nihil, ex, decretum, muto, nunc, ueritas, cum, is, ipse, qui, doceo, quaero, duo, magnus, et, in, hic, res, dis-sideo, secta, epicureorum, et, stoicorum, sed, uter, ad, otium, diuerto, uia, mitto, epicurus, aio, non, accedo, ad, res, publicus, sapio, nisi, si, quis, interuenio, zeno, -ne, aio, accedo, ad, res, publicus, nisi, si, quis, impedio, alter, otium, ex, propono, peto, alter, ex, causa, causa, autem, ille, latus, pateo, si, res, publicus, corrumpo, sum, quam, ut, adiuuaris, possum, si, occupo, sum, malus, non, nitor, sapio, in, superuacuus, neque, sui, nihil, possum, impendo, si, parum, habeo, auctoritas, aut, uis, neque, ille, sum, admitto, res, publicus, si, ualetudo, ille, impedio, quomodo, nauo, quatio, non, deduco, in, mare, quomodo, nomen, in, militia, non, do, debilis, sic, ad, iter, qui, inhabilis, scio, non, accedo, possum, ergo, et, ille, qui, omnis, adhuc, in, integer, sum, antequam, ullus, experior, tempestas, in, tueor, subsisto, et, protinus, commendaris, sui, bonus, ars, et, illibatus, otium, exigo, uirtus, cultor, qui, exerceo, etiam, quiesco, possum, hic, nempe, ab, homo, exigo, ut, prosum, homo, si, fio, possum, multus, si, paruus, paucus, si, paruus, propior, si, paruus, sui, nam, cum, sui, utilis, ceterus, efficio, communis, ago, negotium, quomodo, qui, sui, deterior, facio, non, sui, tantummodo, noceo, sed, etiam, omnis, is, qui, bonus, facio, prosum, possum, sic, quis, quis, bene, de, sui, mereo, hic, ipse, alius, prodo, qui, ille, possum, paro",274,"NaN, NaN, NaN, NaN, NaN, NaN, NaN, NaN, 0.5, NaN, NaN, NaN, NaN, NaN, NaN, NaN, NaN, NaN, 0.0, NaN, NaN, NaN, NaN, NaN, NaN, 0.0, NaN, NaN, NaN, NaN, NaN, NaN, NaN, NaN, -1.0, NaN, NaN, 0.5, NaN, NaN, NaN, NaN, NaN, NaN, NaN, NaN, NaN, NaN, NaN, NaN, NaN, NaN, NaN, NaN, NaN, 0.5, NaN, NaN, NaN, NaN, NaN, NaN, NaN, 0.0, NaN, NaN, NaN, 0.0, NaN, 0.0, NaN, NaN, NaN, NaN, NaN, NaN, 0.5, NaN, 0.0, NaN, NaN, NaN, NaN, NaN, NaN, 0.0, 0.0, NaN, NaN, NaN, NaN, NaN, NaN, NaN, NaN, NaN, NaN, 0.0, 0.0, NaN, NaN, NaN, NaN, NaN, 0.5, NaN, NaN, NaN, NaN, NaN, 0.0, 0.0, NaN, NaN, NaN, NaN, NaN, 0.0, 0.0, NaN, NaN, NaN, NaN, NaN, NaN, NaN, NaN, NaN, -1.0, NaN, 1.0, NaN, NaN, NaN, NaN, NaN, NaN, NaN, NaN, NaN, 0.0, NaN, NaN, NaN, 1.0, NaN, NaN, NaN, NaN, 0.0, 0.0, NaN, NaN, NaN, NaN, NaN, NaN, NaN, NaN, NaN, NaN, 0.0, NaN, 0.0, NaN, 0.0, NaN, NaN, -1.0, NaN, NaN, 0.0, NaN, NaN, NaN, NaN, NaN, NaN, NaN, NaN, NaN, NaN, NaN, NaN, NaN, 0.5, NaN, NaN, NaN, NaN, 0.0, NaN, NaN, NaN, NaN, NaN, NaN, NaN, 1.0, 0.0, NaN, NaN, 0.5, NaN, 1.0, NaN, NaN, NaN, NaN, NaN, NaN, NaN, NaN, NaN, 0.0, NaN, NaN, NaN, 0.0, NaN, NaN, NaN, 0.0, NaN, 0.0, 0.0, NaN, 0.0, 0.0, NaN, 0.0, NaN, NaN, NaN, NaN, 1.0, 0.0, NaN, 0.0, NaN, -0.5, NaN, NaN, NaN, -1.0, NaN, NaN, NaN, NaN, NaN, NaN, NaN, NaN, NaN, NaN, 1.0, NaN, NaN, NaN, NaN, NaN, NaN, NaN, NaN, NaN, NaN, NaN, NaN, NaN, NaN, NaN, NaN, NaN, NaN",0.018,-0.016,"hic, factio, hic, otium, otium, otium, hic, noceo, hic",0.033
seneca.de_otio,8.31,"duo, res, publicus, animus, complector, alter, magnus, et, uerus, publicus, qui, dius, atque, homo, contineo, in, qui, non, ad, hic, angulis, respicio, aut, ad, ille, sed, terminus, ciuitas, noster, cum, sol, metior, alter, qui, nos, ad-scribo, condicio, nascor, hic, aut, athenienses, sum, aut, carthaginiensiumaut, alter, aliquis, urbs, qui, non, ad, omnis, pertineo, homo, sed, ad, certus, quidam, idem, tempus, uterque, res, publicus, do, opera, magnus, paruus, quidam, tantus, paruus, quidam, tantus, magnus, hic, magnus, res, publicus, et, in, otium, deseruio, possum, immo, uerus, nescio, an, in, otium, bonus, ut, quaero, quis, sum, uirtus, unus, multus, sum, natura, an, ars, bonus, uir, facio, unus, sum, hic, qui, mare, terra, et, mare, atque, terra, insero, complector, an, multus, eiusmodi, corpus, deus, spargo, continuo, sum, omnis, et, plenus, materia, ex, qui, cunctus, gigno, an, diduco, et, solidus, inanis, permisceo, qui, sum, deus, deses, opus, suus, specto, an, tracto, utrum, -ne, extrinsecus, ille, circumfundo, sum, an, totus, indo, immortal, sum, mundus, an, inter, caducus, et, ad, tempus, nata, numero, hic, qui, contemplo, quis, deus, praesto, ne, tantus, is, opus, sine, testis, sum, solo, dico, superus, bonus, sum, secundus, natura, uiuo, natura, nos, ad, uterque, gigno, et, contemplatio, res, et, actio",196,"NaN, 0.0, 0.0, 0.5, NaN, NaN, 0.0, NaN, 0.5, 0.0, NaN, NaN, NaN, 0.0, NaN, NaN, NaN, NaN, NaN, NaN, NaN, NaN, NaN, NaN, NaN, NaN, 0.0, 0.5, NaN, NaN, NaN, NaN, NaN, NaN, NaN, NaN, 0.0, NaN, NaN, NaN, NaN, NaN, NaN, NaN, NaN, NaN, 0.5, NaN, NaN, NaN, NaN, NaN, 0.0, NaN, NaN, 0.5, NaN, NaN, 0.0, NaN, 0.0, 0.0, NaN, -0.5, 0.0, 0.0, NaN, NaN, 0.0, NaN, NaN, 0.0, NaN, 0.0, 0.0, 0.0, NaN, NaN, 0.5, NaN, NaN, NaN, 0.5, NaN, NaN, NaN, 0.5, 1.0, NaN, NaN, NaN, NaN, 1.0, NaN, 0.0, NaN, 0.0, NaN, 0.0, 1.0, 0.5, NaN, NaN, NaN, NaN, NaN, 0.0, 0.0, NaN, 0.0, NaN, 0.0, NaN, NaN, NaN, 0.0, NaN, 0.0, 0.0, NaN, NaN, NaN, NaN, NaN, 0.0, 0.0, NaN, NaN, 0.0, NaN, NaN, NaN, NaN, 0.0, NaN, NaN, NaN, NaN, 0.0, NaN, 0.5, NaN, NaN, NaN, NaN, NaN, NaN, NaN, NaN, NaN, NaN, NaN, NaN, NaN, NaN, NaN, 1.0, NaN, NaN, NaN, NaN, NaN, 0.0, NaN, NaN, NaN, NaN, NaN, NaN, 0.0, NaN, NaN, NaN, NaN, 0.5, NaN, NaN, NaN, NaN, NaN, NaN, 1.0, NaN, 0.0, 0.0, NaN, 0.0, NaN, NaN, NaN, NaN, NaN, NaN, 0.0, NaN, NaN",0.051,-0.003,"hic, hic, hic, otium, otium, hic, hic",0.036
seneca.de_otio,8.32,"nunc, is, probo, qui, prior, dico, quis, porro, hic, non, sum, probo, si, sui, unusquisque, consulo, quantus, cupido, habeo, ignotus, nosco, quam, ad, omnis, fabula, excito, nauigo, quidam, et, labor, peregrinatio, longus, unus, merces, perpetior, cognosco, aliquis, abdo, remoueo, que, hic, res, ad, spectaculum, populus, contraho, hic, cogo, praecludo, rimaris, secerno, exquiro, antiquitas, euoluo, mos, barbararis, audio, gens, curiosus, nos, natura, ingenium, do, et, ars, sui, atque, pulchritudo, suus, conscius, spectator, nos, tantus, res, spectaculis, gigno, perdo, fructus, suus, si, tam, magnus, tam, clarus, tam, subtilis, duco, tam, nitidus, et, non, unus, genus, formosus, solus, tudo, ostendo, ut, scio, ille, specto, uolo, non, tantus, aspicio, uideo, qui, nos, locus, do, in, medius, nos, suus, pars, constituo, et, circumspicio, omnis, nos, do, neque, erigo, tantummodo, homo, sed, etiam, habilis, contemplatio, facio, ut, ab, ortus, sidus, in, occasus, labor, prosequor, possum, et, uultus, suus, circumfero, cum, totus, sublimis, facio, ille, caput, et, collum, flexilis, impono, deinde, seni, per, dies, seni, per, nox, signum, perduco, nullus, non, pars, suus, explico, ut, per, hic, qui, optulerat, oculus, is, cupiditas, facio, etiam, ceterus, neque, enim, omnis, neque, tantus, uiso, quantus, sum, sed, acies, noster, aperio, sui, inuestigo, uia, et, fundamentum, uerus, iacio, ut, inquisitio, transeo, ex, apertus, in, obscurus, et, aliquis, ipse, mundus, inuenio, antiquus, unde, iste, sidus, exeo, quis, sum, uniuersus, status, antequam, singulus, in, pars, discedo, qui, ratio, mergo, et, confundo, diduco, quis, locum, res, ad-signo, suapte, natura, grauis, descendo, euolauerint, leuis, an, praeter, nitor, pondus, corpus, alo, aliqui, uolo, lex, singuli, dico, an, ille, uerus, sum, quo, magnus, probo, homo, diuinus, sum, spiritus, pars, atque, uelut, scintillo, quidam, astrum, in, terra, de_-sileo, atque, alienus, locus, haereo, cogitatio, noster, caelum, munimentum, perrumpo, neque, contineo, sum, is, qui, ostendo, scio, ille, inquam, scrutor, qui, ultra, mundus, iaceo, uter, profundus, uastitas, sum, an, et, hic, ipse, terminus, suus, cludatur, qualis, sum, habitus, excludo, informis, et, confundo, sum, in, omnis, pars, tantus, locus, obtineo, an, et, ille, in, aliquis, cultus, discribo, sum, hic, cohaereo, mundus, an, longus, ab, hic, secedo, et, hic, uacuus, uoluto, indiuiduus, sum, per, qui, struo, omnis, qui, natus, sum, sum, an, continuo, is, materia, sum, et, per, totus, mutabilis, utrum, contrarius, inter, sui, elementum, sum, an, non, pugno, sed, per, diuerto, co, -ne, spiro, ad, hic, quaero, nascor, aestimo, quam, non, multus, accipio, tempus, etiam, si, ille, totus, sui, uindico, qui, licet, nihil, facilitas, eripio, nihil, neglegentia, patior, excido, licet, hora, suus, auarus, seruo, et, usque, in, ulter, aetas, humanus, terminus, procedo, neque, quisquam, ille, ex, is, qui, natura, constituo, fortuna, concutio, tamen, homo, ad, immortalis, cognitio, nimis, mortalis, sum, ergo, secundus, natura, uiuo, si, totus, ego, ille, do, si, ille, admirator, cultor, sum, natura, autem, uterque, facio, ego, uolo, et, ago, et, contemplatio, uacaris, uterque, facio, quoniam, ne, contemplatio, quidem, sine, actio, sum, sed, refero, inquam, an, ad, ille, uoluptas, causa, accedo, nihil, alius, ex, ille, peto, quam, assiduus, contemplatio, sine, exeo, sum, enim, dulcis, et, habeo, illecebra, suus, aduerro, hic, tu, respondeo, aequus, refero, quo, animus, ciuilis, ago, uita, an, semper, inquietus, sum, neque, tu, umquam, sumo, ullus, tempus, quo, ab, humanus, ad, diuino, respicio, quomodo, res, ad-peto, sine, ullus, uirtus, amor, et, sine, cultus, ingenium, atque, nudo, edo, opera, paruus, probabilis, sum, misceo, enim, iste, inter, sui, et, consero, debeo, sic, imperfectus, atque, languidus, bonus, sum, in, otium, sine, actus, proiectum, uirtus, num, quam, is, qui, disco, ostendo, quis, nego, ille, debeo, proficiscor, suus, in, opus, tento, neque, tantus, quis, facio, sum, cogito, sed, etiam, aliquando, manus, exerceo, et, is, qui, meditor, sum, ad, uerus, perduco, quodsi, per, ipse, sapio, non, sum, mora, si, non, actor, desum, sed, ago, desum, ecquis, ille, cum, sui, sum, permitto, quo, animus, ad, otium, sapio, secedo, ut, scio, sui, tum, quoque, is, ago, per, qui, posterus, prosum, nos, certus, sum, qui, dico, et, zenonem, et, chrysippum, magnus, ago, quam, si, duco, exercitus, gero, honor, lex, fero, qui, non, unus, ciuitas, sed, totus, humanus, gener, fero, quis, sum, ergo, quare, talis, otium, non, conuenio, uir, bonus, per, qui, sum, saeculum, ordino, neque, apud, paucus, contionor, sed, apud, omnis, omnis, gens, homo, quisque, sum, quisque, sum, ad, summa, quaero, an, ex, praecipio, suus, uiuo, cleanthes, et, chrysippus, et, zeno, -ne, non, dubius, respondeo, sic, ille, uiuo, quemadmodum, dico, sum, uiuo, atqui, nemo, ille, res, publicus, administro, non, sum, inquam, ille, aut, is, fortuna, aut, is, dignitas, qui, admitto, ad, publicaris, res, tractatio, soleo, sed, idem, nihilum, paruus, non, segnis, ago, uita, inuenio, quemadmodum, multus, quies, ipse, homo, prosum, quam, alius, discursus, et, sudor, ergo, nihilum, paruus, hic, multus, ago, uideo, sum, quiuis, nihil, publicus, ago, praeterea, tres, genus, sum, uita, inter, qui, qui, sum, bonus, quaero, soleo, unus, uoluptas, uaco, alter, contemplatio, tertius, actio, primus, depono, contentio, depono, odium, qui, implacabilis, diuerto, sequor, indico, uideo, ut, hic, omnis, ad, idem, sub, alius, atque, alius, titulus, peruenio, neque, ille, qui, uoluptas, probo, sine, contemplatio, sum, neque, ille, qui, contemplatio, inseruio, sine, uoluptas, sum, neque, ille, qui, uito, actio, destino, sum, sine, contemplatio, sum, multus, inquam, discrimen, sum, utrum, aliqui, res, propono, sum, an, propono, alter, accessio, sum, sanus, grandis, discrimen, tamen, alter, sine, alter, non, sum, neque, ille, sine, actio, contemplo, neque, hic, sine, contemplatio, ago, neque, ille, tertius, de, quo, malus, existimaris, consentio, uoluptas, iners, probo, sed, is, quam, ratio, efficio, firmus, sui, ita, et, hic, ipse, uoluptarius, seco, in, actus, sum, quis, in, actus, sum, cum, ipse, dico, epicurus, aliquando, sui, recedo, ab, uoluptas, dolor, etiam, ad-peto, si, aut, uoluptas, immineo, paenitentia, aut, dolor, paruus, pro, grauis, sumo, quo, pertineo, hic, dico, ut, appareo, contemplatio, placeo, omnis, alius, peto, ille, nos, hic, statio, non, portus, sum, adicio, nunc, qui, e, lex, chrysippi, uiuo, otiosus, licet, non, dico, ut, otium, patior, sed, ut, eligo, nego, noster, sapio, ad, quamlibet, res, publicus, accedo, quis, autem, intersum, quo, modo, sapio, ad, otium, uenio, utrum, quia, res, publicus, ille, desum, an, quia, ipse, res, publicus, si, non, ubiuis, sum, res, publicus, sum, semper, autem, desum, fastidiosus, quaero, interrogo, ad, quam, res, publicus, sapio, sum, accedo, ad, athenienses, in, qui, socrates, damno, aristotelis, ne, damno, fugio, in, qui, opprimo, inuidia, uirtus, nego, ego, accedo, ad, hic, res, publicus, sapio, ad, carthaginiensium, ergo, res, publicus, sapio, accedo, in, qui, assiduus, seditio, et, bonus, quisque, infestus, libertas, sum, summus, aequum, atque, bonus, uilito, aduerro, hostis, inhumanus, crudelitas, etiam, aduerro, suus, hostilis, et, hic, fugio, si, percenseo, singulus, uolo, nullus, inuenio, qui, sapio, aut, quam, sapio, patior, possum, quodsi, non, inuenio, ille, res, publicus, quam, nos, fingo, incipio, omnis, sum, otium, necessarius, quia, qui, unus, praefero, possum, otium, nusquam, sum, si, quis, dico, bonus, sum, nauigaris, deinde, nego, nauigo, in, is, mare, in, quo, naufragium, fio, soleo, et, frequens, subeo, tempestas, sum, qui, rector, in, contrarius, rapio, puto, hic, ego, ueto, nauo, soluo, quamquam, laudo, nauigatio",1124,"NaN, NaN, NaN, NaN, 0.5, NaN, NaN, NaN, NaN, NaN, NaN, NaN, NaN, NaN, NaN, NaN, NaN, -0.5, NaN, -0.5, NaN, NaN, NaN, NaN, 0.0, NaN, NaN, NaN, NaN, -0.5, NaN, 0.0, NaN, 1.0, NaN, NaN, NaN, NaN, NaN, NaN, NaN, 0.0, NaN, 0.0, 0.0, NaN, NaN, NaN, NaN, NaN, NaN, NaN, 0.0, NaN, 0.5, NaN, NaN, 0.0, NaN, NaN, 0.0, 0.5, NaN, NaN, 0.0, NaN, NaN, 1.0, NaN, -0.5, NaN, NaN, NaN, 0.0, NaN, NaN, NaN, 0.5, NaN, NaN, NaN, 0.0, NaN, 0.5, NaN, NaN, NaN, NaN, 0.5, NaN, NaN, NaN, 0.0, 1.0, -0.5, NaN, NaN, NaN, NaN, NaN, NaN, NaN, NaN, NaN, NaN, NaN, NaN, NaN, 0.0, NaN, NaN, 0.0, NaN, NaN, 0.0, NaN, NaN, NaN, NaN, NaN, NaN, NaN, NaN, NaN, 0.0, NaN, NaN, NaN, NaN, NaN, NaN, NaN, NaN, NaN, NaN, NaN, -0.5, NaN, NaN, NaN, NaN, NaN, NaN, NaN, NaN, 0.5, NaN, NaN, 0.0, NaN, NaN, NaN, NaN, NaN, NaN, NaN, 0.0, NaN, NaN, 0.0, 0.0, NaN, NaN, NaN, 0.0, NaN, NaN, NaN, NaN, NaN, NaN, NaN, 0.0, NaN, -0.5, NaN, NaN, 0.0, NaN, NaN, NaN, NaN, NaN, NaN, NaN, NaN, NaN, 0.0, NaN, NaN, NaN, NaN, 0.0, NaN, NaN, 0.5, NaN, NaN, NaN, NaN, NaN, NaN, NaN, NaN, NaN, NaN, NaN, 1.0, NaN, 0.0, NaN, NaN, NaN, NaN, NaN, NaN, 0.0, 0.0, NaN, 0.0, NaN, 0.0, NaN, NaN, 0.0, NaN, NaN, NaN, NaN, NaN, NaN, 0.0, NaN, NaN, 0.0, -0.5, NaN, NaN, 0.0, NaN, NaN, 1.0, NaN, 0.0, NaN, NaN, NaN, 0.5, NaN, NaN, NaN, NaN, 0.5, NaN, NaN, 0.0, NaN, 0.0, 0.5, NaN, 0.0, 0.0, NaN, NaN, NaN, NaN, NaN, NaN, 0.0, NaN, NaN, -0.5, 0.0, NaN, NaN, NaN, 0.5, NaN, NaN, NaN, NaN, NaN, NaN, NaN, NaN, NaN, NaN, NaN, NaN, NaN, NaN, 1.0, NaN, NaN, NaN, -1.0, NaN, NaN, NaN, NaN, NaN, 0.0, NaN, NaN, NaN, NaN, NaN, NaN, -1.0, NaN, NaN, NaN, NaN, NaN, 0.0, NaN, 0.0, NaN, NaN, NaN, NaN, NaN, NaN, -0.5, NaN, NaN, NaN, NaN, 1.0, NaN, 0.0, NaN, NaN, NaN, NaN, NaN, NaN, NaN, NaN, NaN, NaN, NaN, NaN, NaN, NaN, 0.0, NaN, NaN, NaN, NaN, NaN, 0.0, NaN, NaN, NaN, NaN, NaN, NaN, NaN, NaN, NaN, 0.5, NaN, NaN, NaN, NaN, NaN, NaN, NaN, NaN, NaN, NaN, NaN, NaN, NaN, NaN, NaN, NaN, NaN, 0.0, NaN, 0.0, NaN, NaN, NaN, NaN, NaN, NaN, NaN, NaN, NaN, 0.5, NaN, NaN, NaN, NaN, NaN, NaN, NaN, NaN, -1.0, NaN, NaN, NaN, NaN, NaN, 0.0, 0.0, 0.0, NaN, NaN, NaN, NaN, NaN, NaN, NaN, 0.0, NaN, 0.0, NaN, NaN, 0.0, NaN, 0.5, 0.5, NaN, -1.0, NaN, NaN, 0.0, 0.0, NaN, NaN, NaN, NaN, NaN, NaN, NaN, NaN, NaN, NaN, NaN, 0.0, NaN, NaN, NaN, NaN, NaN, NaN, NaN, NaN, NaN, NaN, NaN, NaN, NaN, NaN, NaN, NaN, NaN, NaN, NaN, NaN, NaN, NaN, NaN, NaN, NaN, 1.0, 0.0, NaN, NaN, NaN, NaN, NaN, NaN, NaN, 0.5, NaN, NaN, NaN, NaN, NaN, 0.5, NaN, NaN, NaN, NaN, NaN, NaN, NaN, NaN, 0.5, NaN, NaN, 0.5, 0.5, NaN, 0.0, NaN, NaN, NaN, NaN, NaN, NaN, NaN, NaN, NaN, 0.0, NaN, NaN, 0.0, NaN, NaN, NaN, NaN, 0.0, NaN, NaN, NaN, 1.0, 1.0, NaN, NaN, -0.5, 0.5, NaN, NaN, NaN, -0.5, 0.0, 0.5, NaN, NaN, NaN, NaN, NaN, NaN, NaN, NaN, NaN, NaN, NaN, NaN, NaN, 1.0, NaN, NaN, 0.5, NaN, NaN, NaN, 1.0, NaN, NaN, NaN, NaN, NaN, NaN, NaN, NaN, NaN, NaN, NaN, NaN, NaN, 0.5, NaN, NaN, NaN, NaN, NaN, NaN, NaN, NaN, NaN, NaN, 0.0, NaN, NaN, NaN, NaN, NaN, NaN, NaN, 0.5, NaN, NaN, NaN, NaN, NaN, NaN, NaN, NaN, NaN, NaN, 0.0, NaN, NaN, NaN, NaN, NaN, NaN, NaN, NaN, NaN, NaN, NaN, 0.5, NaN, 0.5, NaN, NaN, NaN, NaN, NaN, NaN, NaN, NaN, NaN, NaN, NaN, 0.0, NaN, NaN, 0.5, NaN, NaN, NaN, NaN, NaN, NaN, NaN, 0.0, NaN, NaN, NaN, NaN, 0.0, NaN, 1.0, 0.5, NaN, NaN, NaN, NaN, 0.5, NaN, NaN, 0.0, NaN, NaN, NaN, NaN, NaN, NaN, NaN, 0.5, NaN, NaN, 0.5, 1.0, NaN, NaN, NaN, NaN, NaN, NaN, NaN, 0.0, NaN, NaN, NaN, NaN, NaN, 0.0, 0.0, NaN, NaN, NaN, NaN, NaN, NaN, NaN, NaN, NaN, NaN, NaN, NaN, NaN, NaN, NaN, NaN, NaN, NaN, NaN, -0.5, NaN, NaN, NaN, NaN, NaN, NaN, NaN, NaN, NaN, -0.5, NaN, 0.0, 0.0, NaN, NaN, NaN, NaN, NaN, NaN, NaN, 0.0, NaN, NaN, 1.0, NaN, NaN, NaN, NaN, 0.0, NaN, NaN, NaN, NaN, NaN, 0.0, NaN, NaN, NaN, 0.0, NaN, NaN, 0.0, NaN, NaN, 0.0, NaN, NaN, NaN, NaN, NaN, NaN, NaN, NaN, 0.0, NaN, 0.0, NaN, NaN, NaN, NaN, NaN, 0.0, NaN, NaN, NaN, 0.0, NaN, 0.0, NaN, NaN, NaN, NaN, 1.0, NaN, NaN, NaN, 1.0, NaN, NaN, NaN, 0.0, NaN, 0.5, NaN, NaN, NaN, -1.0, NaN, -1.0, NaN, NaN, NaN, NaN, NaN, NaN, NaN, NaN, NaN, NaN, NaN, NaN, NaN, NaN, NaN, NaN, NaN, NaN, 1.0, NaN, NaN, NaN, NaN, NaN, NaN, NaN, NaN, NaN, NaN, 1.0, NaN, NaN, NaN, NaN, NaN, NaN, NaN, NaN, NaN, NaN, NaN, 0.0, NaN, -1.0, NaN, NaN, NaN, 0.0, NaN, NaN, NaN, NaN, NaN, 0.0, NaN, 1.0, 0.0, -1.0, NaN, NaN, NaN, NaN, NaN, NaN, NaN, NaN, NaN, NaN, NaN, NaN, NaN, NaN, NaN, NaN, NaN, NaN, 0.0, NaN, NaN, -1.0, NaN, NaN, 1.0, 0.0, NaN, NaN, NaN, NaN, 0.0, NaN, 1.0, NaN, NaN, NaN, NaN, NaN, 1.0, NaN, NaN, NaN, NaN, NaN, NaN, NaN, NaN, NaN, NaN, NaN, NaN, NaN, NaN, NaN, NaN, 1.0, -1.0, NaN, NaN, NaN, NaN, 1.0, NaN, NaN, NaN, -1.0, 0.0, NaN, -0.5, NaN, NaN, NaN, NaN, NaN, NaN, NaN, NaN, NaN, NaN, NaN, NaN, NaN, NaN, NaN, NaN, NaN, NaN, NaN, NaN, NaN, NaN, NaN, 0.5, NaN, NaN, NaN, NaN, NaN, NaN, NaN, 0.5, NaN, NaN, NaN, NaN, NaN, NaN, NaN, NaN, NaN, 0.0, 0.0, NaN, NaN, NaN, NaN, NaN, NaN, NaN, NaN, 0.5, NaN, NaN, NaN, 0.0, 0.0, NaN, NaN, NaN, NaN, NaN, 0.0, 0.0, NaN, NaN, NaN, NaN, 0.0, 0.0, NaN, NaN, NaN, NaN, -1.0, NaN, NaN, NaN, NaN, 0.0, 0.0, NaN, NaN, NaN, NaN, NaN, NaN, NaN, NaN, NaN, NaN, NaN, NaN, NaN, NaN, NaN, NaN, -1.0, 1.0, NaN, NaN, NaN, NaN, NaN, 0.0, 0.0, NaN, NaN, NaN, NaN, 0.0, 0.0, NaN, NaN, NaN, NaN, 0.5, NaN, NaN, 1.0, NaN, -1.0, 0.5, NaN, NaN, 0.5, NaN, 1.0, NaN, NaN, -1.0, 0.0, -1.0, NaN, NaN, NaN, -1.0, NaN, NaN, NaN, NaN, NaN, 0.0, NaN, NaN, NaN, NaN, NaN, NaN, NaN, NaN, NaN, NaN, NaN, NaN, NaN, NaN, 0.0, 0.0, NaN, NaN, NaN, NaN, NaN, NaN, 0.5, 0.0, NaN, NaN, NaN, NaN, NaN, 0.5, NaN, NaN, NaN, NaN, NaN, 1.0, NaN, NaN, NaN, NaN, NaN, NaN, NaN, 0.0, NaN, NaN, NaN, NaN, NaN, NaN, NaN, NaN, 0.0, NaN, NaN, NaN, NaN, NaN, NaN, NaN, NaN, NaN, NaN, NaN, NaN, NaN, NaN, NaN",0.023,-0.022,"hic, hic, spectaculum, hic, conscius, hic, iaceo, profundus, hic, hic, hic, hic, hic, neglegentia, auarus, illecebra, hic, tu, tu, otium, otium, otium, hic, hic, hic, iners, hic, hic, hic, otium, otium, damno, damno, inuidia, hic, seditio, inhumanus, crudelitas, hostilis, hic, fingo, otium, otium, naufragium, hic",0.04
