Text,Stelle,Inahlt,Wortzahl,Sentiment Rechnung,Sentiment-Score,alternativer Sentiment-Score,Invektiven,Invektivitäts-Score
statius.achilleid,1.205,"cycladas, hic, sperno, myconosque, humilis, seriphos",6,"NaN, NaN, NaN, NaN, NaN, NaN",nan,nan,"hic, humilis",0.333
statius.achilleid,1.206,"et, lemnos, non, aequus, uis, atque, hospita, delos",8,"NaN, NaN, NaN, 0.5, 1.0, NaN, 0.5, NaN",0.25,0.0,hospita,0.125
statius.achilleid,1.207,"gens, imbellis, nuper, lycomedis, ab, aula",6,"0.0, -1.0, NaN, NaN, NaN, NaN",-0.167,-0.167,,0.0
statius.achilleid,1.208,"uirgineus, coitus, et, litus, persono, ludo",6,"NaN, NaN, NaN, NaN, NaN, NaN",nan,nan,,0.0
statius.achilleid,1.209,"audio, durus, laxo, aegaeona, necto",5,"NaN, -0.5, NaN, NaN, NaN",-0.1,-0.1,,0.0
statius.achilleid,1.21,"mitto, sequor, centum, deus, numeraris, cateno",6,"NaN, NaN, NaN, 0.0, NaN, NaN",0.0,0.0,cateno,0.167
statius.achilleid,1.211,"hic, placeo, hic, timidus, tellus, tueor, mater",7,"NaN, NaN, NaN, -0.5, NaN, NaN, 0.0",-0.071,-0.071,"hic, hic, timidus",0.429
statius.achilleid,1.212,"qualis, uicinus, uolucris, iam, sedulus, partus",6,"NaN, 0.0, NaN, NaN, NaN, NaN",0.0,0.0,,0.0
statius.achilleid,1.213,"iam, timeo, qui, frons, domus, suspendo, inanis",7,"NaN, NaN, NaN, 0.0, 0.0, NaN, NaN",0.0,0.0,,0.0
statius.achilleid,1.214,"prouideo, hic, uenio, hic, anxius, cogito, anguis",7,"NaN, NaN, NaN, NaN, -1.0, NaN, NaN",-0.143,-0.143,"hic, hic",0.286
statius.achilleid,1.215,"hic, homo, tandem, dubius, placeo, umbra, nouus",7,"NaN, 0.0, NaN, -0.5, NaN, NaN, 1.0",0.071,-0.071,hic,0.143
statius.achilleid,1.216,"uix, sto, in, ramus, et, protinus, arbor, amo",8,"NaN, NaN, NaN, NaN, NaN, NaN, NaN, NaN",nan,nan,,0.0
statius.achilleid,1.217,"alter, consilium, supersum, tristis, fatigo",5,"NaN, 0.5, NaN, -1.0, NaN",-0.1,-0.2,,0.0
statius.achilleid,1.218,"cura, dea, natus, ipse, sinus, complector, per, unda",8,"-1.0, NaN, 0.0, NaN, NaN, NaN, NaN, 0.0",-0.125,-0.125,,0.0
statius.achilleid,1.219,"an, magnus, tero, fero, uenio, uolucris",6,"NaN, 0.0, NaN, NaN, NaN, NaN",0.0,0.0,,0.0
statius.achilleid,1.22,"aduoco, an, pelagus, soleo, thaumantida, pascor",6,"NaN, NaN, NaN, NaN, NaN, NaN",nan,nan,,0.0
statius.achilleid,1.221,"elicio, inde, fretus, et, murex, freno, acuo",7,"NaN, NaN, 0.5, NaN, NaN, NaN, NaN",0.071,0.0,,0.0
statius.achilleid,1.222,"delphinas, biiugi, qui, ille, maximus, tethys",6,"NaN, NaN, NaN, NaN, NaN, NaN",nan,nan,,0.0
statius.achilleid,1.223,"gurges, atlanteo, pelagus, sub, ualles, sonorus",6,"NaN, NaN, NaN, NaN, NaN, NaN",nan,nan,gurges,0.167
statius.achilleid,1.224,"nutrio, nullus, uado, per, neptunia, glaucus",6,"NaN, NaN, NaN, NaN, NaN, NaN",nan,nan,glaucus,0.167
statius.achilleid,1.225,"tantus, honor, forma, no, potentia, neque, multus",7,"NaN, 1.0, 1.0, NaN, 0.5, NaN, 0.0",0.357,0.0,,0.0
statius.achilleid,1.226,"pectus, humanus, iubeo, hic, subsisto, plenus",6,"NaN, 0.0, NaN, NaN, NaN, 0.0",0.0,0.0,hic,0.167
statius.achilleid,1.227,"litus, ne, nudus, noceo, contagium, terra",6,"NaN, NaN, 0.0, NaN, -1.0, 0.0",-0.167,-0.167,noceo,0.167
statius.achilleid,1.228,"ipse, dehinc, totus, resoluo, pectus, achille, -ne",7,"NaN, NaN, NaN, NaN, NaN, NaN, NaN",nan,nan,,0.0
statius.achilleid,1.229,"qui, puer, sopor, haemonii, de, rupes, antrum",7,"NaN, 0.0, NaN, NaN, NaN, 0.0, 0.0",0.0,0.0,haemonii,0.143
statius.achilleid,1.23,"ad, placidus, deporto, aqua, et, iubeo, taceo",7,"NaN, 1.0, NaN, 0.0, NaN, NaN, NaN",0.143,0.0,,0.0
statius.achilleid,1.231,"litus, monstro, iter, totus, ex-fulguro, orbis",6,"NaN, NaN, 0.0, NaN, NaN, NaN",0.0,0.0,,0.0
statius.achilleid,1.232,"cynthia, prosequor, diua, celer, recursus",5,"NaN, NaN, NaN, NaN, NaN",nan,nan,,0.0
statius.achilleid,1.233,"securus, pelagus, chiro, -ne, rogo, udus, celo",7,"1.0, NaN, NaN, NaN, NaN, NaN, NaN",0.143,0.0,udus,0.143
statius.achilleid,1.234,"lumen, et, arrepo, subeo, iamiam, lateo",6,"NaN, NaN, NaN, NaN, NaN, NaN",nan,nan,,0.0
statius.achilleid,1.235,"erigo, prospecto, equus, qui, canus, parumper",6,"NaN, NaN, NaN, NaN, NaN, NaN",nan,nan,,0.0
statius.achilleid,1.236,"spumo, signum, fuga, et, liquidus, pereo, orbita, pontus",8,"NaN, 0.0, -0.5, NaN, NaN, NaN, NaN, 0.0",-0.062,-0.062,,0.0
statius.achilleid,1.237,"ille, non, alius, redeo, ad, thessala, tempe",7,"NaN, NaN, NaN, NaN, NaN, NaN, NaN",nan,nan,,0.0
statius.achilleid,1.238,"iam, tristis, pholoe, iam, nubilus, ingemo, othrys",7,"NaN, -1.0, NaN, NaN, NaN, NaN, NaN",-0.143,-0.143,,0.0
statius.achilleid,1.239,"et, tenuis, spercheos, aqua, spelunca, doceo",6,"NaN, 0.0, NaN, 0.0, 0.0, NaN",0.0,0.0,spercheos,0.167
statius.achilleid,1.24,"muto, senex, quaero, puerilis, carmen, fauni",6,"NaN, 0.0, NaN, 0.0, 0.0, NaN",0.0,0.0,,0.0
statius.achilleid,1.241,"et, spero, diu, ploro, conubium, nympha",6,"NaN, NaN, NaN, NaN, NaN, NaN",nan,nan,,0.0
statius.achilleid,1.242,"iam, premo, astrum, dies, humilis, ex, aequor, titan",8,"NaN, NaN, NaN, 0.0, NaN, NaN, 0.0, NaN",0.0,0.0,humilis,0.125
statius.achilleid,1.243,"roro, euoluo, equus, et, ab, aether, magnus",7,"NaN, NaN, NaN, NaN, NaN, NaN, 0.0",0.0,0.0,,0.0
statius.achilleid,1.244,"tollo, currus, pelagus, cado, at, uado, mater",7,"NaN, NaN, NaN, NaN, NaN, NaN, 0.0",0.0,0.0,,0.0
statius.achilleid,1.245,"scyria, iamdudum, fluctus, emetior, teneo",5,"NaN, NaN, 0.0, NaN, NaN",0.0,0.0,,0.0
statius.achilleid,1.246,"exeo, iugum, fatisco, delphin, erilis",5,"NaN, NaN, NaN, NaN, NaN",nan,nan,,0.0
statius.achilleid,1.247,"cum, puer, tremefacio, quies, oculus, pateo",6,"NaN, 0.0, NaN, NaN, 0.0, NaN",0.0,0.0,,0.0
statius.achilleid,1.248,"infundo, sentio, dies, stupeo, aer, primus",6,"NaN, NaN, 0.0, NaN, 0.0, 0.5",0.083,0.0,,0.0
statius.achilleid,1.249,"qui, locum, qui, fluctus, ubi, pelion, omnis, uerso",8,"NaN, NaN, NaN, 0.0, NaN, NaN, NaN, NaN",0.0,0.0,,0.0
statius.achilleid,1.25,"atque, ignotus, uideo, dubito, agnosco, mater",6,"NaN, -0.5, NaN, NaN, NaN, 0.0",-0.083,-0.083,,0.0
statius.achilleid,1.251,"occupo, ille, manus, blandus, affor, paueo",6,"NaN, NaN, 0.0, 0.5, NaN, NaN",0.083,0.0,,0.0
statius.achilleid,1.252,"si, ego, caris, puer, thalamus, sors, aequus, fero",8,"NaN, NaN, NaN, 0.0, NaN, -1.0, 0.5, NaN",-0.062,-0.125,,0.0
statius.achilleid,1.253,"qui, do, aetherius, ego, tu, complector, teneo",7,"NaN, NaN, NaN, NaN, NaN, NaN, NaN",nan,nan,tu,0.143
statius.achilleid,1.254,"sidus, grandis, plaga, magnus, puerpera, caelum",6,"NaN, 0.0, 0.0, 0.0, NaN, 0.5",0.083,0.0,,0.0
statius.achilleid,1.255,"nihil, humilis, parco, terrenus, fatum, uereor",6,"NaN, NaN, NaN, NaN, 0.0, NaN",0.0,0.0,humilis,0.167
statius.achilleid,1.256,"nunc, impar, tu, natus, genus, praecludo, letum",7,"NaN, -0.5, NaN, 0.0, 0.0, NaN, -1.0",-0.214,-0.214,tu,0.143
statius.achilleid,1.257,"tantus, ab, mater, uia, sum, quin, et, metuo, propinquo",9,"NaN, NaN, 0.0, 0.0, NaN, NaN, NaN, NaN, NaN",0.0,0.0,,0.0
statius.achilleid,1.258,"tempus, et, exter, admoueo, periculum, metior",6,"0.0, NaN, 0.0, NaN, -1.0, NaN",-0.167,-0.167,,0.0
statius.achilleid,1.259,"cedo, paulus, animus, summitto, uirilis",5,"NaN, NaN, 0.5, NaN, 0.5",0.2,0.0,,0.0
statius.achilleid,1.26,"atque, habitus, dignaris, meus, si, lydia, durus",7,"NaN, NaN, NaN, 0.0, NaN, NaN, -0.5",-0.071,-0.071,,0.0
statius.achilleid,1.261,"pensum, manus, mollis, fero, tirynthius, hasta",6,"NaN, 0.0, NaN, NaN, NaN, NaN",0.0,0.0,,0.0
statius.achilleid,1.262,"si, decet, auro, bacchum, uestigium, palla",6,"NaN, NaN, NaN, NaN, NaN, NaN",nan,nan,,0.0
statius.achilleid,1.263,"uerro, uirgineus, si, iuppiter, induo, artus",6,"NaN, NaN, NaN, NaN, NaN, NaN",nan,nan,,0.0
statius.achilleid,1.264,"neque, magnus, ambiguus, frango, caenea, sexus",6,"NaN, 0.0, -0.5, NaN, NaN, NaN",-0.083,-0.083,,0.0
statius.achilleid,1.265,"hic, sine, quaeso, minae, nubis, exeo, malignus",7,"NaN, NaN, NaN, -0.5, NaN, NaN, -1.0",-0.214,-0.214,hic,0.143
statius.achilleid,1.266,"mox, iterum, campus, iterum, centaurica, reddo",6,"NaN, NaN, 0.0, NaN, NaN, NaN",0.0,0.0,,0.0
statius.achilleid,1.267,"lustro, tu, per, ego, hic, decus, et, uenio, iuuenta",9,"NaN, NaN, NaN, NaN, NaN, NaN, NaN, NaN, NaN",nan,nan,"tu, hic",0.222
statius.achilleid,1.268,"gaudium, si, terra, humilis, experior, maritus",6,"1.0, NaN, 0.0, NaN, NaN, 0.0",0.167,0.0,"humilis, maritus",0.333
statius.achilleid,1.269,"tu, propter, si, progigno, stygos, amnis, sero",7,"NaN, NaN, NaN, NaN, NaN, NaN, NaN",nan,nan,tu,0.143
statius.achilleid,1.27,"armo, totus, utinam, capio, tueor, parumper",6,"NaN, NaN, NaN, NaN, NaN, NaN",nan,nan,,0.0
statius.achilleid,1.271,"tegimen, nihil, noceo, animus, cur, os, redux",7,"NaN, NaN, NaN, 0.5, NaN, 0.0, NaN",0.071,0.0,noceo,0.143
statius.achilleid,1.272,"quis, paro, oculus, pudeo, hic, mitesco, cultus",7,"NaN, NaN, 0.0, NaN, NaN, NaN, -0.5",-0.071,-0.071,"pudeo, hic",0.286
statius.achilleid,1.273,"per, tu, caris, puer, cognatus, per, aequor, iuro",8,"NaN, NaN, NaN, 0.0, NaN, NaN, 0.0, NaN",0.0,0.0,tu,0.125
statius.achilleid,1.274,"nescio, hic, chiro, -ne, sic, horridus, pectus, tracto",8,"NaN, NaN, NaN, NaN, NaN, -1.0, NaN, NaN",-0.125,-0.125,hic,0.125
statius.achilleid,1.275,"nequiquam, mulceo, obsto, genitor, rogo",5,"NaN, NaN, NaN, NaN, NaN",nan,nan,,0.0
statius.achilleid,1.276,"nutritor, ingens, et, crudus, exordium, magnus",6,"NaN, -0.5, NaN, -1.0, NaN, 0.0",-0.25,-0.25,,0.0
statius.achilleid,1.277,"indoles, effrenus, tumidus, uelut, ignis, iuuenta",6,"0.0, NaN, -0.5, NaN, 0.0, NaN",-0.083,-0.083,,0.0
statius.achilleid,1.278,"si, quis, equus, primus, summitto, tento, habena",7,"NaN, NaN, NaN, 0.5, NaN, NaN, NaN",0.071,0.0,,0.0
statius.achilleid,1.279,"ille, diu, campus, fluuius, et, honor, superbus",7,"NaN, NaN, 0.0, NaN, NaN, 1.0, -1.0",0.0,-0.143,,0.0
statius.achilleid,1.28,"gaudeo, non, collum, iugum, non, asper, praebeo",7,"NaN, NaN, NaN, NaN, NaN, -0.5, NaN",-0.071,-0.071,,0.0
statius.achilleid,1.281,"os, lupus, dominus, fremo, captiuus, ineo",6,"0.0, 0.0, NaN, NaN, -1.0, NaN",-0.167,-0.167,captiuus,0.167
statius.achilleid,1.282,"imperium, atque, alius, miro, disco, curro",6,"0.0, NaN, NaN, NaN, NaN, NaN",0.0,0.0,,0.0
statius.achilleid,1.283,"quis, deus, attono, fraudo, astus, parens",6,"NaN, 0.0, NaN, NaN, -0.5, 0.5",0.0,-0.083,"fraudo, astus",0.333
statius.achilleid,1.284,"confero, indocilis, qui, mens, detraho, achillem",6,"NaN, NaN, NaN, 0.5, NaN, NaN",0.083,0.0,,0.0
statius.achilleid,1.285,"palladi, litoreus, celebro, scyros, honor",5,"NaN, NaN, NaN, NaN, 1.0",0.2,0.0,,0.0
statius.achilleid,1.286,"fors, dies, placidus, sero, lycomede, soror",6,"0.0, 0.0, 1.0, NaN, NaN, NaN",0.167,0.0,,0.0
statius.achilleid,1.287,"lux, sacer, patrius, qui, rarus, licentia, murus",7,"NaN, 1.0, 0.0, NaN, NaN, -0.5, NaN",0.071,-0.071,licentia,0.143
statius.achilleid,1.288,"exeo, do, uerus, ops, diua, sero",6,"NaN, NaN, 0.5, 0.0, NaN, NaN",0.083,0.0,,0.0
statius.achilleid,1.289,"frons, ligaris, como, et, spargo, flos, hasta",7,"0.0, NaN, NaN, NaN, NaN, 0.5, NaN",0.071,0.0,,0.0
statius.achilleid,1.29,"omnis, eximius, forma, decus, omnis, idem",6,"NaN, 1.0, 1.0, NaN, NaN, NaN",0.333,0.0,,0.0
statius.achilleid,1.291,"cultus, et, expleo, teneo, iam, finis, pudor",7,"-0.5, NaN, NaN, NaN, NaN, 0.0, 0.5",0.0,-0.071,pudor,0.143
statius.achilleid,1.292,"uirginitas, maturo, torus, annus, tumeo",5,"NaN, NaN, NaN, 0.0, NaN",0.0,0.0,,0.0
statius.achilleid,1.293,"sed, quantus, uiridis, pelagus, uenus, addo, nympha",7,"NaN, NaN, NaN, NaN, 1.0, NaN, NaN",0.143,0.0,,0.0
statius.achilleid,1.294,"obruo, aut, umerus, quantus, diana, relinquo",6,"NaN, NaN, NaN, NaN, NaN, NaN",nan,nan,,0.0
statius.achilleid,1.295,"naidas, effulgeo, tantus, regina, decorus",5,"NaN, NaN, NaN, NaN, NaN",nan,nan,,0.0
statius.achilleid,1.296,"deidamia, chorus, pulcher, soror, obsto",5,"NaN, NaN, 1.0, NaN, NaN",0.2,0.0,,0.0
statius.achilleid,1.297,"ille, et, roseus, flammo, purpura, uultus",6,"NaN, NaN, NaN, NaN, NaN, NaN",nan,nan,flammo,0.167
statius.achilleid,1.298,"et, gemma, lux, magnus, insum, et, blandus, aurum",8,"NaN, NaN, NaN, 0.0, NaN, NaN, 0.5, 0.5",0.125,0.0,,0.0
statius.achilleid,1.299,"atque, ipse, par, forma, dea, sum, si, pectus, anguis",9,"NaN, NaN, 0.5, 1.0, NaN, NaN, NaN, NaN, NaN",0.167,0.0,,0.0
statius.achilleid,1.3,"pono, et, eximo, pacetur, cassis, uultus",6,"NaN, NaN, NaN, NaN, 0.0, NaN",0.0,0.0,,0.0
statius.achilleid,1.301,"hic, ubi, duco, longus, socio, agmen, uideo",7,"NaN, NaN, NaN, 0.0, NaN, -1.0, NaN",-0.143,-0.143,hic,0.143
statius.achilleid,1.302,"trux, puer, et, nullus, temero, pectus, motus",7,"NaN, 0.0, NaN, NaN, NaN, NaN, NaN",0.0,0.0,"trux, temero",0.286
statius.achilleid,1.303,"derigesco, foris, nouus, bibo, os, ignis",6,"NaN, NaN, 1.0, NaN, 0.0, 0.0",0.167,0.0,,0.0
statius.achilleid,1.304,"neque, lateo, haurio, amor, sed, fax, uibro, medulla",8,"NaN, NaN, NaN, 1.0, NaN, NaN, NaN, NaN",0.125,0.0,fax,0.125
statius.achilleid,1.305,"in, uultus, atque, os, redeo, lux, genaris",7,"NaN, NaN, NaN, 0.0, NaN, NaN, NaN",0.0,0.0,genaris,0.143
statius.achilleid,1.306,"tingo, et, impello, tenuis, sudor, pererro",6,"NaN, NaN, NaN, 0.0, NaN, NaN",0.0,0.0,,0.0
statius.achilleid,1.307,"lacteus, massagetae, uelut, cum, poculum, fusco",6,"NaN, NaN, NaN, NaN, NaN, NaN",nan,nan,,0.0
statius.achilleid,1.308,"sanguis, puniceus, uel, ebur, corrumpo, ostrum",6,"NaN, NaN, NaN, NaN, NaN, NaN",nan,nan,puniceus,0.167
statius.achilleid,1.309,"sic, uarius, manifestus, nosco, palleo, rubeo",6,"NaN, 0.0, -0.5, NaN, NaN, NaN",-0.083,-0.083,,0.0
statius.achilleid,1.31,"flamma, repo, eo, atque, ultro, ferus, hospita, sacer",8,"NaN, NaN, NaN, NaN, NaN, -1.0, 0.5, 1.0",0.062,-0.125,"ferus, hospita",0.25
statius.achilleid,1.311,"dissiciat, turba, securus, et, immemor, aeuum",6,"NaN, 0.0, 1.0, NaN, -1.0, NaN",0.0,-0.167,,0.0
statius.achilleid,1.312,"ni, pudor, et, iungo, teneo, reuerendus, mater",7,"NaN, 0.5, NaN, NaN, NaN, 1.0, 0.0",0.214,0.0,pudor,0.143
statius.achilleid,1.313,"ut, pater, armentum, quondam, ducto, sum",6,"NaN, 0.0, NaN, NaN, NaN, NaN",0.0,0.0,,0.0
statius.achilleid,1.314,"qui, nondum, totus, perago, cornu, gyrus",6,"NaN, NaN, NaN, NaN, NaN, NaN",nan,nan,,0.0
statius.achilleid,1.315,"cum, socia, pasco, niueus, candor, iuuenca",6,"NaN, NaN, NaN, NaN, 0.5, 0.0",0.083,0.0,niueus,0.167
statius.achilleid,1.316,"aspicio, ardescunt, animus, primus, per, os",6,"NaN, NaN, 0.5, 0.5, NaN, 0.0",0.167,0.0,,0.0
statius.achilleid,1.317,"spumo, amor, specto, hilaris, obsto, magister",6,"NaN, 1.0, NaN, 1.0, NaN, 0.5",0.417,0.0,hilaris,0.167
statius.achilleid,1.318,"occupo, arrepo, iam, conscius, tempus, mater",6,"NaN, NaN, NaN, -0.5, 0.0, 0.0",-0.083,-0.083,conscius,0.167
statius.achilleid,1.319,"hic, -ne, inter, simularis, chorus, et, bracchium, ludo",8,"NaN, NaN, NaN, NaN, NaN, NaN, NaN, NaN",nan,nan,hic,0.125
statius.achilleid,1.32,"necto, natus, grauis, sum, gelidus, quis, talis, sub, os",9,"NaN, 0.0, -0.5, NaN, NaN, NaN, NaN, NaN, 0.0",-0.056,-0.056,,0.0
statius.achilleid,1.321,"peliacisque, iugum, o, si, ego, iungo, cura",7,"NaN, NaN, NaN, NaN, NaN, NaN, -1.0",-0.143,-0.143,,0.0
statius.achilleid,1.322,"atque, alius, porto, sinus, contingo, achille, -ne",7,"NaN, NaN, NaN, NaN, NaN, NaN, NaN",nan,nan,,0.0
statius.achilleid,1.323,"mulceo, laetus, rubeo, uideo, proteruus",5,"NaN, 1.0, NaN, NaN, -0.5",0.1,-0.1,proteruus,0.2
statius.achilleid,1.324,"obliquo, uestis, manus, leuis, repello",5,"NaN, NaN, 0.0, 0.0, NaN",0.0,0.0,uestis,0.2
statius.achilleid,1.325,"aspicio, ambiguus, genetrix, cogo, uolo",5,"NaN, -0.5, NaN, NaN, NaN",-0.1,-0.1,,0.0
statius.achilleid,1.326,"in-iacio, sinus, tum, collum, rigeo, mollio",6,"NaN, NaN, NaN, NaN, NaN, NaN",nan,nan,,0.0
statius.achilleid,1.327,"summitto, grauis, umerus, et, fortis, laxo",6,"NaN, -0.5, NaN, NaN, 0.5, NaN",0.0,-0.083,,0.0
statius.achilleid,1.328,"bracchium, et, impexos, certus, domo, ordo, crinis",7,"NaN, NaN, NaN, 0.5, NaN, 0.5, NaN",0.143,0.0,,0.0
statius.achilleid,1.329,"atque, suus, diligo, ceruix, monile, transfero",6,"NaN, NaN, NaN, NaN, 0.0, NaN",0.0,0.0,,0.0
statius.achilleid,1.33,"et, picturatus, cohibeo, uestigium, limbus",5,"NaN, NaN, NaN, NaN, NaN",nan,nan,,0.0
statius.achilleid,1.331,"incedo, moueo, doceo, for, pudor",5,"NaN, NaN, NaN, NaN, 0.5",0.1,0.0,pudor,0.2
statius.achilleid,1.332,"qualis, artifex, uinco, polliceo, cera",5,"NaN, 0.0, NaN, NaN, NaN",0.0,0.0,,0.0
statius.achilleid,1.333,"accipio, forma, ignis, manon, sequor",5,"NaN, 1.0, 0.0, NaN, NaN",0.2,0.0,,0.0
statius.achilleid,1.334,"talis, sum, diua, natus, muto, imago",6,"NaN, NaN, NaN, 0.0, NaN, NaN",0.0,0.0,,0.0
statius.achilleid,1.335,"neque, luctor, diu, supersum, nam, multus, ille",7,"NaN, NaN, NaN, NaN, NaN, 0.0, NaN",0.0,0.0,,0.0
statius.achilleid,1.336,"inuito, uirtus, decor, fallo, tueor",5,"NaN, 1.0, NaN, NaN, NaN",0.2,0.0,fallo,0.2
statius.achilleid,1.337,"ambiguus, teneo, lateo, discrimen, sexus",5,"-0.5, NaN, NaN, -1.0, NaN",-0.3,-0.3,,0.0
statius.achilleid,1.338,"procedo, iterum, moneo, iterum, fatigo",5,"NaN, NaN, NaN, NaN, NaN",nan,nan,,0.0
statius.achilleid,1.339,"blandus, thetis, sic, ergo, gradus, sic, os, manus",8,"0.5, NaN, NaN, NaN, 0.0, NaN, 0.0, 0.0",0.062,0.0,thetis,0.125
statius.achilleid,1.34,"natus, fero, comito, modus, imito, fingo",6,"0.0, NaN, NaN, 0.5, NaN, NaN",0.083,0.0,fingo,0.167
statius.achilleid,1.341,"neo, suspicio, mollis, non, misceo, aula",6,"NaN, -0.5, NaN, NaN, NaN, NaN",-0.083,-0.083,,0.0
statius.achilleid,1.342,"rector, et, incipio, pereo, mendacium, furtum",6,"NaN, NaN, NaN, NaN, -1.0, -1.0",-0.333,-0.333,"mendacium, furtum",0.333
statius.achilleid,1.343,"dico, et, admoueo, non, disto, como, tango",7,"NaN, NaN, NaN, NaN, NaN, NaN, NaN",nan,nan,,0.0
statius.achilleid,1.344,"sic, ubi, uirgineus, hecate, lasso, therapnis",6,"NaN, NaN, NaN, NaN, NaN, NaN",nan,nan,,0.0
statius.achilleid,1.345,"ad, pater, frater, redeo, comes, haereo, eo",7,"NaN, 0.0, 0.0, NaN, NaN, NaN, NaN",0.0,0.0,,0.0
statius.achilleid,1.346,"mater, et, ipse, umerus, exsero, bracchium, uelo",7,"0.0, NaN, NaN, NaN, NaN, NaN, NaN",0.0,0.0,,0.0
statius.achilleid,1.347,"ipse, arcus, pharetra, loco, uestis, lateo",6,"NaN, NaN, NaN, NaN, NaN, NaN",nan,nan,uestis,0.167
statius.achilleid,1.348,"deduco, spargo, tumeo, compono, crinis",5,"NaN, NaN, NaN, NaN, NaN",nan,nan,,0.0
statius.achilleid,1.349,"protinus, aggredior, rex, atque, ibi, testis, ara",7,"NaN, NaN, 0.0, NaN, NaN, NaN, NaN",0.0,0.0,,0.0
statius.achilleid,1.35,"hic, tu, aio, noster, germana, rector, achillis",7,"NaN, NaN, NaN, NaN, NaN, NaN, NaN",nan,nan,"hic, tu",0.286
statius.achilleid,1.351,"nonne, uideo, ut, toruus, gena, aequo, frater",7,"NaN, NaN, NaN, NaN, NaN, NaN, 0.0",0.0,0.0,gena,0.143
statius.achilleid,1.352,"trado, arma, umerus, arx, animosus, peto",6,"NaN, 0.0, NaN, NaN, NaN, NaN",0.0,0.0,,0.0
statius.achilleid,1.353,"fero, et, amazonio, conubium, pello, ritus",6,"NaN, NaN, NaN, NaN, NaN, NaN",nan,nan,,0.0
statius.achilleid,1.354,"sed, ego, cura, satis, sum, pro, stirps, uirilis",8,"NaN, NaN, -1.0, 0.5, NaN, NaN, NaN, 0.5",0.0,-0.125,,0.0
statius.achilleid,1.355,"hic, calathus, et, sacer, fero, tu, frango, rego",8,"NaN, NaN, NaN, 1.0, NaN, NaN, NaN, NaN",0.125,0.0,"hic, tu",0.25
statius.achilleid,1.356,"indocilis, sexuque, teneo, dum, nubilis, aetas",6,"NaN, NaN, NaN, NaN, NaN, 0.0",0.0,0.0,,0.0
statius.achilleid,1.357,"soluo, pudor, neue, exerceo, proteruus",5,"NaN, 0.5, NaN, NaN, -0.5",0.0,-0.1,"pudor, proteruus",0.4
statius.achilleid,1.358,"gymnadas, aut, lustrum, nemus, concedo, uagaris",6,"NaN, NaN, NaN, NaN, NaN, NaN",nan,nan,,0.0
statius.achilleid,1.359,"intus, al, et, similis, inter, secludo, puella",7,"NaN, NaN, NaN, 0.0, NaN, NaN, NaN",0.0,0.0,,0.0
statius.achilleid,1.36,"litus, praecipuus, portus, arceo, memento",5,"NaN, 0.0, NaN, NaN, NaN",0.0,0.0,,0.0
statius.achilleid,1.361,"uideo, modo, uelo, phrygum, iam, mutuus, ius",7,"NaN, NaN, NaN, NaN, NaN, 0.0, 0.5",0.071,0.0,,0.0
statius.achilleid,1.362,"fallo, transmitto, pelagus, disco, carina",5,"NaN, NaN, NaN, NaN, NaN",nan,nan,fallo,0.2
statius.achilleid,1.363,"accedo, dictum, pater, ingenium, parens",5,"NaN, 0.0, 0.0, 0.5, 0.5",0.2,0.0,,0.0
statius.achilleid,1.364,"occulo, aeacide, -ne, quis, diuus, fraus, obsto",7,"NaN, NaN, NaN, NaN, 0.0, -1.0, NaN",-0.143,-0.143,fraus,0.143
statius.achilleid,1.365,"accipio, ultro, etiam, ueneror, supplex, dextera",6,"NaN, NaN, NaN, NaN, 0.0, 0.0",0.0,0.0,,0.0
statius.achilleid,1.366,"et, grates, eligo, ago, neque, turba, piaris",7,"NaN, 1.0, NaN, NaN, NaN, 0.0, NaN",0.143,0.0,,0.0
statius.achilleid,1.367,"scyriadum, cesso, nimius, defigo, uideo",5,"NaN, NaN, NaN, NaN, NaN",nan,nan,nimius,0.2
statius.achilleid,1.368,"uirgo, os, nouus, quantus, ceruix, como",6,"NaN, 0.0, 1.0, NaN, NaN, NaN",0.167,0.0,uirgo,0.167
statius.achilleid,1.369,"emineo, quantus, umerus, atque, pectus, fundo",6,"NaN, NaN, NaN, NaN, NaN, NaN",nan,nan,,0.0
statius.achilleid,1.37,"dehinc, sociaris, chorus, caueo, accedo, sacrum",6,"NaN, NaN, NaN, NaN, NaN, NaN",nan,nan,,0.0
statius.achilleid,1.371,"hortor, cedo, locus, et, contingo, gaudeo",6,"NaN, NaN, 0.0, NaN, NaN, NaN",0.0,0.0,,0.0
statius.achilleid,1.372,"qualis, idaliae, uolucris, ubi, mollis, frango",6,"NaN, NaN, NaN, NaN, NaN, NaN",nan,nan,,0.0
statius.achilleid,1.373,"nubila, iam, longus, caelo, domo, grego",6,"NaN, NaN, 0.0, NaN, NaN, NaN",0.0,0.0,,0.0
statius.achilleid,1.374,"si, iungo, pinnas, diuerto, hospita, traho",6,"NaN, NaN, NaN, NaN, 0.5, NaN",0.083,0.0,hospita,0.167
statius.achilleid,1.375,"uenio, auus, cunctus, primus, miror, et, horreo",7,"NaN, NaN, 0.0, 0.5, NaN, NaN, NaN",0.071,0.0,,0.0
statius.achilleid,1.376,"mox, propius, propius, uolo, atque, aer, in, ipse",8,"NaN, NaN, NaN, NaN, NaN, 0.0, NaN, NaN",0.0,0.0,,0.0
statius.achilleid,1.377,"paulatim, facio, suus, plaudo, secundus",5,"NaN, NaN, NaN, NaN, 0.0",0.0,0.0,,0.0
statius.achilleid,1.378,"circueunt, hilaris, et, ad, altus, cubile, duco",7,"NaN, 1.0, NaN, NaN, 0.5, NaN, NaN",0.214,0.0,hilaris,0.143
statius.achilleid,1.379,"digredior, multus, cuncto, in, limen, mater",6,"NaN, 0.0, NaN, NaN, NaN, 0.0",0.0,0.0,,0.0
statius.achilleid,1.38,"dum, repeto, moneo, arcanus, murmur, figo",6,"NaN, NaN, NaN, NaN, NaN, NaN",nan,nan,,0.0
statius.achilleid,1.381,"auris, et, taceo, do, uerbum, nouus, uultus",7,"NaN, NaN, NaN, NaN, 0.0, 1.0, NaN",0.143,0.0,,0.0
statius.achilleid,1.382,"tunc, excipio, fretus, longus, ceruix, reflecto",6,"NaN, NaN, 0.5, 0.0, NaN, NaN",0.083,0.0,,0.0
statius.achilleid,1.383,"abnato, et, blandus, affor, litus, uoueo",6,"NaN, NaN, 0.5, NaN, NaN, NaN",0.083,0.0,,0.0
statius.achilleid,1.384,"carus, ego, tellus, magnus, qui, pignus, cura",7,"1.0, NaN, NaN, 0.0, NaN, 0.0, -1.0",0.0,-0.143,,0.0
statius.achilleid,1.385,"depono, ingens, timidus, committo, astus",5,"NaN, -0.5, -0.5, NaN, -0.5",-0.3,-0.3,"timidus, astus",0.4
statius.achilleid,1.386,"sum, felix, taceo, precor, quo, mos, taceo",7,"NaN, 1.0, NaN, NaN, NaN, 0.5, NaN",0.214,0.0,,0.0
statius.achilleid,1.387,"cerno, rheae, tu, longus, honor, aeternus, cingo",7,"NaN, NaN, NaN, 0.0, 1.0, 0.5, NaN",0.214,0.0,tu,0.143
statius.achilleid,1.388,"templum, neque, instabilis, fama, supero, delo",6,"NaN, NaN, -0.5, 1.0, NaN, NaN",0.083,-0.083,,0.0
statius.achilleid,1.389,"et, uenio, et, sacer, fretus, inter, uadosus",7,"NaN, NaN, NaN, 1.0, 0.5, NaN, NaN",0.214,0.0,,0.0
statius.achilleid,1.39,"cycladas, aegaeae, frango, ubi, saxum, procella",6,"NaN, NaN, NaN, NaN, 0.0, NaN",0.0,0.0,,0.0
statius.achilleid,1.391,"nereidum, tranquillus, domus, iuro, nauta",5,"NaN, NaN, 0.0, NaN, NaN",0.0,0.0,,0.0
statius.achilleid,1.392,"insula, ne, solus, danaas, admitto, carino",6,"NaN, NaN, -0.5, NaN, NaN, NaN",-0.083,-0.083,,0.0
statius.achilleid,1.393,"ne, precor, hic, thiasus, tantus, et, nihil, utilis, bellum",9,"NaN, NaN, NaN, NaN, NaN, NaN, NaN, 1.0, 0.0",0.111,0.0,hic,0.111
statius.achilleid,1.394,"hic, fama, narro, doceo, dum, arma, paro",7,"NaN, 1.0, NaN, NaN, NaN, 0.0, NaN",0.143,0.0,hic,0.143
statius.achilleid,1.395,"doricus, et, alternus, mauors, interfuro, orbis",6,"NaN, NaN, NaN, NaN, NaN, NaN",nan,nan,mauors,0.167
statius.achilleid,1.396,"cedo, equidem, sum, uirgo, pius, lycomedis, achilles",7,"NaN, NaN, NaN, NaN, NaN, NaN, NaN",nan,nan,"uirgo, achilles",0.286
statius.achilleid,1.397,"interea, mereo, ultrix, europa, dolor",5,"NaN, NaN, NaN, NaN, -1.0",-0.2,-0.2,ultrix,0.2
statius.achilleid,1.398,"dulcis, armus, furia, et, supplex, rex",6,"0.5, NaN, NaN, NaN, 0.0, 0.0",0.083,0.0,furia,0.167
statius.achilleid,1.399,"conqueror, flammo, moueo, quippe, amb-eo, atrides",6,"NaN, NaN, NaN, NaN, NaN, NaN",nan,nan,"flammo, atrides",0.333
statius.achilleid,1.4,"ille, magis, qui, nubo, domus, facinus, refero",7,"NaN, NaN, NaN, NaN, 0.0, -1.0, NaN",-0.143,-0.143,"nubo, facinus",0.286
statius.achilleid,1.401,"aspero, iliacus, capio, sine, martes, sine, arma",7,"NaN, NaN, NaN, NaN, NaN, NaN, 0.0",0.0,0.0,,0.0
statius.achilleid,1.402,"progenies, caelum, spartaeque, possum, alumna",5,"0.0, 0.5, NaN, NaN, 0.0",0.1,0.0,,0.0
statius.achilleid,1.403,"ius, fides, superus, unus, calceo, rapina",6,"0.5, 1.0, NaN, NaN, NaN, NaN",0.25,0.0,rapina,0.167
statius.achilleid,1.404,"hic, foedus, phrygius, hic, geminus, commercium, terra",7,"NaN, -1.0, NaN, NaN, NaN, NaN, 0.0",-0.143,-0.143,"hic, hic",0.286
statius.achilleid,1.405,"quis, maneo, populus, ubi, tantus, iniuria, primus",7,"NaN, NaN, 0.0, NaN, NaN, -1.0, 0.5",-0.071,-0.143,,0.0
statius.achilleid,1.406,"degrassor, dux, coeo, gens, omnis, et, aetas",7,"NaN, 0.5, NaN, 0.0, NaN, NaN, 0.0",0.071,0.0,,0.0
statius.achilleid,1.407,"neque, tantus, excio, bimaris, qui, isthmia, uallo",7,"NaN, NaN, NaN, NaN, NaN, NaN, NaN",nan,nan,,0.0
statius.achilleid,1.408,"claustra, neque, undisonus, qui, circumeo, umbo, maleae",7,"NaN, NaN, NaN, NaN, NaN, NaN, NaN",nan,nan,,0.0
statius.achilleid,1.409,"sed, procul, admoueo, phrixi, qui, semita, iungo",7,"NaN, NaN, NaN, NaN, NaN, NaN, NaN",nan,nan,,0.0
statius.achilleid,1.41,"europamque, asia, ueto, quisque, ordo, gens",6,"NaN, NaN, NaN, NaN, 0.5, 0.0",0.083,0.0,,0.0
