Text,Stelle,Inahlt,Wortzahl,Sentiment Rechnung,Sentiment-Score,alternativer Sentiment-Score,Invektiven,Invektivitäts-Score
statius.achilleid,1.411,"litus, abydeno, mare, alligo, unda, supernus",6,"NaN, NaN, 0.0, NaN, 0.0, NaN",0.0,0.0,,0.0
statius.achilleid,1.412,"ferueo, amor, bellum, concutio, erigo, urbs",6,"NaN, 1.0, 0.0, NaN, NaN, 0.5",0.25,0.0,,0.0
statius.achilleid,1.413,"aes, domo, temese, quatio, naual, os",6,"NaN, NaN, NaN, NaN, NaN, 0.0",0.0,0.0,,0.0
statius.achilleid,1.414,"eubois, innumerus, resono, incudo, mycenae",5,"NaN, NaN, NaN, NaN, NaN",nan,nan,,0.0
statius.achilleid,1.415,"pisa, nouo, currus, nemee, do, tergum, ferus",7,"NaN, NaN, NaN, NaN, NaN, NaN, -1.0",-0.143,-0.143,ferus,0.143
statius.achilleid,1.416,"cirrha, sagittifer, certo, stiparis, pharetra",5,"NaN, NaN, NaN, NaN, NaN",nan,nan,sagittifer,0.2
statius.achilleid,1.417,"lerna, grauis, clipeus, caedo, uestio, iuuencus",6,"NaN, -0.5, NaN, NaN, NaN, NaN",-0.083,-0.083,"lerna, uestio",0.333
statius.achilleid,1.418,"do, bellum, pedito, aetolus, et, asper, acarna, -ne",8,"NaN, 0.0, NaN, NaN, NaN, -0.5, NaN, NaN",-0.062,-0.062,,0.0
statius.achilleid,1.419,"argos, ago, turma, uacuo, pascuus, dis",6,"NaN, NaN, NaN, NaN, NaN, NaN",nan,nan,,0.0
statius.achilleid,1.42,"arcadia, freno, celer, epiros, alumnus",5,"NaN, NaN, NaN, NaN, NaN",nan,nan,,0.0
statius.achilleid,1.421,"phocis, et, aoniae, iaculis, raresco, umbra",6,"NaN, NaN, NaN, NaN, NaN, NaN",nan,nan,,0.0
statius.achilleid,1.422,"murus, tormentum, pylos, messenaque, tendo",5,"NaN, -0.5, NaN, NaN, NaN",-0.1,-0.1,,0.0
statius.achilleid,1.423,"nullus, immunis, humus, uello, postis, altus",6,"NaN, NaN, NaN, NaN, NaN, 0.5",0.083,0.0,humus,0.167
statius.achilleid,1.424,"arma, olim, dimitto, pater, flamma, liquesco",6,"0.0, NaN, NaN, 0.0, NaN, NaN",0.0,0.0,,0.0
statius.achilleid,1.425,"donum, deus, eripio, superi, mars, effero, aurum",7,"0.0, 0.0, NaN, NaN, NaN, NaN, 0.5",0.071,0.0,,0.0
statius.achilleid,1.426,"nusquam, umbra, uetus, paruus, othrys, et, arduus, sido",8,"NaN, NaN, 0.0, 0.0, NaN, NaN, NaN, NaN",0.0,0.0,,0.0
statius.achilleid,1.427,"taygeta, exuo, uideo, aes, mons",5,"NaN, NaN, NaN, NaN, NaN",nan,nan,,0.0
statius.achilleid,1.428,"iam, nato, omnis, nemus, caedo, robur, classis",7,"NaN, NaN, NaN, NaN, NaN, 0.5, NaN",0.071,0.0,classis,0.143
statius.achilleid,1.429,"silua, paruus, remi, ferrum, lasso, in, utor",7,"NaN, 0.0, NaN, NaN, NaN, NaN, NaN",0.0,0.0,,0.0
statius.achilleid,1.43,"innumerus, qui, rostrum, ligo, qui, munio, arma",7,"NaN, NaN, NaN, NaN, NaN, NaN, 0.0",0.0,0.0,,0.0
statius.achilleid,1.431,"belliger, qui, freno, equus, qui, mille, catena",7,"NaN, NaN, NaN, NaN, NaN, NaN, 0.0",0.0,0.0,catena,0.143
statius.achilleid,1.432,"squaleo, necto, tunica, qui, sanguis, fumo",6,"NaN, NaN, NaN, NaN, NaN, NaN",nan,nan,,0.0
statius.achilleid,1.433,"uulnero, altus, bibo, qui, conspiro, ueneno",6,"NaN, 0.5, NaN, NaN, NaN, NaN",0.083,0.0,,0.0
statius.achilleid,1.434,"impello, mors, tenuo, umeo, saxum",5,"NaN, -1.0, NaN, NaN, 0.0",-0.2,-0.2,,0.0
statius.achilleid,1.435,"attero, et, piger, addo, mucro, ira",6,"NaN, NaN, NaN, NaN, -1.0, -1.0",-0.333,-0.333,,0.0
statius.achilleid,1.436,"neque, modus, aut, arcus, lentaris, aut, fundo, glandes",8,"NaN, 0.5, NaN, NaN, NaN, NaN, NaN, NaN",0.062,0.0,,0.0
statius.achilleid,1.437,"aut, torreo, sudo, galea, attollo, coeo",6,"NaN, NaN, NaN, NaN, NaN, NaN",nan,nan,,0.0
statius.achilleid,1.438,"hic, inter, moueo, piger, gemo, unus, quies",7,"NaN, NaN, NaN, NaN, NaN, NaN, NaN",nan,nan,hic,0.143
statius.achilleid,1.439,"thessalia, et, geminus, incuso, fatum, querela",6,"NaN, NaN, NaN, NaN, 0.0, -0.5",-0.083,-0.083,,0.0
statius.achilleid,1.44,"qui, senex, peleus, neque, adhuc, maturus, achilles",7,"NaN, 0.0, NaN, NaN, NaN, NaN, NaN",0.0,0.0,achilles,0.143
statius.achilleid,1.441,"iam, pelopis, terra, graiumque, exhaurio, orbis",6,"NaN, NaN, 0.0, NaN, NaN, NaN",0.0,0.0,,0.0
statius.achilleid,1.442,"praecipito, in, transtrum, uir, insanus, equus",6,"NaN, NaN, NaN, 0.5, -1.0, NaN",-0.083,-0.167,insanus,0.167
statius.achilleid,1.443,"bellipotens, ferueo, portus, et, operio, carina",6,"NaN, NaN, NaN, NaN, NaN, NaN",nan,nan,,0.0
statius.achilleid,1.444,"stagnum, suo, hiemo, classis, promoueo, suus",6,"NaN, NaN, NaN, NaN, NaN, NaN",nan,nan,"stagnum, classis",0.333
statius.achilleid,1.445,"attollo, fluctus, ipse, iam, puppis, aequor",6,"NaN, 0.0, NaN, NaN, NaN, 0.0",0.0,0.0,,0.0
statius.achilleid,1.446,"deficio, et, totus, consumo, carbasus, uenio",6,"NaN, NaN, NaN, NaN, NaN, NaN",nan,nan,,0.0
statius.achilleid,1.447,"primus, ratis, danaas, hecateia, congrego, aulis",6,"0.5, NaN, NaN, NaN, NaN, NaN",0.083,0.0,,0.0
statius.achilleid,1.448,"rupes, expono, longus, crepido, dorsum",5,"0.0, NaN, 0.0, 0.0, NaN",0.0,0.0,,0.0
statius.achilleid,1.449,"euboicum, scando, aulis, mare, litus, multus",6,"NaN, NaN, NaN, 0.0, NaN, 0.0",0.0,0.0,,0.0
statius.achilleid,1.45,"montiuagus, diligo, dea, iuxta, caphereus",5,"NaN, NaN, NaN, NaN, NaN",nan,nan,montiuagus,0.2
statius.achilleid,1.451,"latro, pelagus, tollo, caput, ille, pelasgas",6,"NaN, NaN, NaN, 0.0, NaN, NaN",0.0,0.0,latro,0.167
statius.achilleid,1.452,"ut, uideo, tranaris, ratis, ter, mons, ter, unda",8,"NaN, NaN, NaN, NaN, NaN, NaN, NaN, 0.0",0.0,0.0,,0.0
statius.achilleid,1.453,"intono, saeuus, do, praesagium, nox",5,"NaN, -1.0, NaN, NaN, 0.0",-0.2,-0.2,saeuus,0.2
statius.achilleid,1.454,"coitus, ibi, armus, troia, fatal, ibi, ingens",7,"NaN, NaN, NaN, NaN, NaN, NaN, -0.5",-0.071,-0.071,,0.0
statius.achilleid,1.455,"iuro, bellum, donec, sol, annuus, omnis",6,"NaN, 0.0, NaN, NaN, 0.0, NaN",0.0,0.0,,0.0
statius.achilleid,1.456,"confacio, meto, tunc, primus, graecia, uireo",6,"NaN, NaN, NaN, 0.5, NaN, NaN",0.083,0.0,,0.0
statius.achilleid,1.457,"contemplo, suus, tunc, spargo, atque, dissonus, moles",7,"NaN, NaN, NaN, NaN, NaN, -1.0, NaN",-0.143,-0.143,,0.0
statius.achilleid,1.458,"in, corpus, uultus, coeo, et, rex, sub, unus",8,"NaN, 0.0, NaN, NaN, NaN, 0.0, NaN, NaN",0.0,0.0,,0.0
statius.achilleid,1.459,"dispono, sum, sic, curuo, ferus, indago, lateo",7,"NaN, NaN, NaN, NaN, -1.0, NaN, NaN",-0.143,-0.143,ferus,0.143
statius.achilleid,1.46,"claudo, et, admoueo, paulatim, casses, arto",6,"NaN, NaN, NaN, NaN, NaN, NaN",nan,nan,,0.0
statius.achilleid,1.461,"ille, ignis, sono, paueo, diffundo, linquo",6,"NaN, 0.0, NaN, NaN, NaN, NaN",0.0,0.0,,0.0
statius.achilleid,1.462,"auia, miro, suus, decresco, mons",5,"NaN, NaN, NaN, NaN, NaN",nan,nan,,0.0
statius.achilleid,1.463,"donec, in, angustus, cado, undique, uallo",6,"NaN, NaN, NaN, NaN, NaN, NaN",nan,nan,,0.0
statius.achilleid,1.464,"in, uicis, stupeo, grex, socio, timor",6,"NaN, NaN, NaN, NaN, NaN, -0.5",-0.083,-0.083,,0.0
statius.achilleid,1.465,"mansuesco, simul, hirtus, aper, simul, ursa, lupus",7,"NaN, NaN, -0.5, NaN, NaN, NaN, 0.0",-0.071,-0.071,ursa,0.143
statius.achilleid,1.466,"cogo, et, capio, contemno, cerua, leo",6,"NaN, NaN, NaN, NaN, 0.0, NaN",0.0,0.0,leo,0.167
statius.achilleid,1.467,"sed, quamquam, et, geminus, pariter, suus, bellum, capesso",8,"NaN, NaN, NaN, NaN, NaN, NaN, 0.0, NaN",0.0,0.0,,0.0
statius.achilleid,1.468,"atridae, fama, auidus, uirtus, paternus",5,"NaN, 1.0, NaN, 1.0, NaN",0.4,0.0,,0.0
statius.achilleid,1.469,"tydides, sthenelnsque, premo, neque, cogito, annus",6,"NaN, NaN, NaN, NaN, NaN, 0.0",0.0,0.0,,0.0
statius.achilleid,1.47,"antilochos, septem, aiax, umbo, corusco",5,"NaN, NaN, NaN, NaN, NaN",nan,nan,,0.0
statius.achilleid,1.471,"armentum, rex, atque, aequus, moenia, orbis",6,"NaN, 0.0, NaN, 0.5, NaN, NaN",0.083,0.0,,0.0
statius.achilleid,1.472,"consilium, armus, uigil, contendo, ulixes",5,"0.5, NaN, NaN, NaN, NaN",0.1,0.0,,0.0
statius.achilleid,1.473,"omnis, in, absum, bellum, manus, ardeo, achillem",7,"NaN, NaN, NaN, 0.0, 0.0, NaN, NaN",0.0,0.0,,0.0
statius.achilleid,1.474,"nomen, achillis, amo, et, in, hector, solus, achilles",8,"0.0, NaN, NaN, NaN, NaN, NaN, -0.5, NaN",-0.062,-0.062,achilles,0.125
statius.achilleid,1.475,"posco, ille, unus, teucer, priamoque, loquor",6,"NaN, NaN, NaN, NaN, NaN, NaN",nan,nan,teucer,0.167
statius.achilleid,1.476,"fatal, quis, enim, haemoniis, sub, ualles, alter",7,"NaN, NaN, NaN, NaN, NaN, NaN, NaN",nan,nan,,0.0
statius.achilleid,1.477,"cerno, effodio, repto, niuit, qui, adorior",6,"NaN, NaN, NaN, NaN, NaN, NaN",nan,nan,repto,0.167
statius.achilleid,1.478,"crudus, rudimentum, et, tener, formo, annus",6,"-1.0, 0.0, NaN, NaN, NaN, 0.0",-0.167,-0.167,,0.0
statius.achilleid,1.479,"centaurus, patrius, propior, qui, lineus, caelum",6,"NaN, 0.0, 0.0, NaN, NaN, 0.5",0.083,0.0,,0.0
statius.achilleid,1.48,"qui, alius, stygius, fero, secerno, per, amnis",7,"NaN, NaN, NaN, NaN, NaN, NaN, NaN",nan,nan,,0.0
statius.achilleid,1.481,"nereis, et, pulcher, ferrum, praestruo, artus",6,"NaN, NaN, 1.0, NaN, NaN, NaN",0.167,0.0,,0.0
statius.achilleid,1.482,"hic, graiae, castrum, itero, trado, cohors",6,"NaN, NaN, NaN, NaN, NaN, NaN",nan,nan,hic,0.167
statius.achilleid,1.483,"cedo, turba, dux, uinco, haud, maestus, fateor",7,"NaN, 0.0, 0.5, NaN, NaN, -1.0, NaN",-0.071,-0.143,,0.0
statius.achilleid,1.484,"sic, cum, palleo, phlegraea, in, castrum, coeo",7,"NaN, NaN, NaN, NaN, NaN, NaN, NaN",nan,nan,,0.0
statius.achilleid,1.485,"caelicola, iam, odrysiam, gradiuus, in, hasta",6,"NaN, NaN, NaN, NaN, NaN, NaN",nan,nan,,0.0
statius.achilleid,1.486,"surgo, et, libycos, tritonia, tollo, anguis",6,"NaN, NaN, NaN, NaN, NaN, NaN",nan,nan,"libycos, tritonia",0.333
statius.achilleid,1.487,"ingens, manus, curuo, delius, arcus",5,"-0.5, 0.0, NaN, NaN, NaN",-0.1,-0.1,,0.0
statius.achilleid,1.488,"sto, anhelo, metus, solus, natura, tono",6,"NaN, NaN, -1.0, -0.5, 0.0, NaN",-0.25,-0.25,,0.0
statius.achilleid,1.489,"respicio, quando, ille, hiemo, tonitrus, uoco",6,"NaN, NaN, NaN, NaN, NaN, NaN",nan,nan,,0.0
statius.achilleid,1.49,"nubis, ignifer, quot, fulmen, posco, aetne, -ne",7,"NaN, NaN, NaN, NaN, NaN, NaN, NaN",nan,nan,,0.0
statius.achilleid,1.491,"atque, ibi, dum, misceo, uallo, plebs, suus",7,"NaN, NaN, NaN, NaN, NaN, 0.0, NaN",0.0,0.0,,0.0
statius.achilleid,1.492,"et, mare, et, bellum, consulto, tempus, rex",7,"NaN, 0.0, NaN, 0.0, NaN, 0.0, 0.0",0.0,0.0,,0.0
statius.achilleid,1.493,"increpito, magnus, uates, calchanta, tumultus",5,"NaN, 0.0, NaN, NaN, NaN",0.0,0.0,increpito,0.2
statius.achilleid,1.494,"protesilaus, aio, namque, hic, bellaris, cupido",6,"NaN, NaN, NaN, NaN, NaN, -0.5",-0.083,-0.083,hic,0.167
statius.achilleid,1.495,"praecipuus, et, primus, iam, tunc, do, gloria, mors",8,"0.0, NaN, 0.5, NaN, NaN, NaN, 0.0, -1.0",-0.062,-0.125,,0.0
statius.achilleid,1.496,"o, nimium, phoebus, tripus, obliuiscor, tuus",6,"NaN, 0.0, NaN, 0.0, NaN, 0.0",0.0,0.0,,0.0
statius.achilleid,1.497,"thestoride, quando, os, deus, possessus, moueo",6,"NaN, NaN, 0.0, 0.0, NaN, NaN",0.0,0.0,,0.0
statius.achilleid,1.498,"iustus, aut, quianam, parcaris, occulo, recludo",6,"1.0, NaN, NaN, NaN, NaN, NaN",0.167,0.0,,0.0
statius.achilleid,1.499,"cerno, ut, ignotus, cunctus, stupeo, fremo",6,"NaN, NaN, -0.5, 0.0, NaN, NaN",-0.083,-0.083,,0.0
statius.achilleid,1.5,"aeacide, -ne, sordeo, uulgo, calydonius, heros",6,"NaN, NaN, NaN, NaN, NaN, NaN",nan,nan,sordeo,0.167
statius.achilleid,1.501,"et, magnus, gigno, telamo, aiaxque, secundus",6,"NaN, 0.0, NaN, NaN, NaN, 0.0",0.0,0.0,,0.0
statius.achilleid,1.502,"nos, quoque, sed, mauors, et, troia, arrepo, probo",8,"NaN, NaN, NaN, NaN, NaN, NaN, NaN, NaN",nan,nan,mauors,0.125
statius.achilleid,1.503,"ille, neglego, pudeo, heu, ductor, omnis",6,"NaN, NaN, NaN, NaN, NaN, NaN",nan,nan,"pudeo, heu",0.333
statius.achilleid,1.504,"belliger, ceu, numen, amo, dico, ocior, aut, cur",8,"NaN, NaN, NaN, NaN, NaN, NaN, NaN, NaN",nan,nan,,0.0
statius.achilleid,1.505,"sero, como, et, multus, honor, qui, abdo, ora",8,"NaN, NaN, NaN, 0.0, 1.0, NaN, NaN, NaN",0.125,0.0,,0.0
statius.achilleid,1.506,"qui, iubeo, tellus, peto, nam, fama, neque, antrum",8,"NaN, NaN, NaN, NaN, NaN, 1.0, NaN, 0.0",0.125,0.0,,0.0
statius.achilleid,1.507,"chironis, patria, neque, dego, peleos, aula",6,"NaN, NaN, NaN, NaN, NaN, NaN",nan,nan,,0.0
statius.achilleid,1.508,"heia, irrumpo, deus, et, fatum, lateo, uexo",7,"NaN, NaN, 0.0, NaN, 0.0, NaN, NaN",0.0,0.0,uexo,0.143
statius.achilleid,1.509,"laurigerosque, ignis, si, quando, auidus, haurio",6,"NaN, 0.0, NaN, NaN, NaN, NaN",0.0,0.0,,0.0
statius.achilleid,1.51,"arma, horreo, tu, saeuus, remitto, ensis",6,"0.0, NaN, NaN, -1.0, NaN, NaN",-0.167,-0.167,"tu, saeuus",0.333
statius.achilleid,1.511,"numquam, hic, imbellis, galea, uiolo, uitta",6,"NaN, NaN, -1.0, NaN, NaN, NaN",-0.167,-0.167,"hic, uiolo",0.333
statius.achilleid,1.512,"sed, felix, numero, dux, praesto, omnis",6,"NaN, 1.0, NaN, 0.5, NaN, NaN",0.25,0.0,,0.0
statius.achilleid,1.513,"si, magnus, danais, per, tu, depfendis, achillem",7,"NaN, 0.0, NaN, NaN, NaN, NaN, NaN",0.0,0.0,tu,0.143
statius.achilleid,1.514,"iamdudum, trepido, circumfero, lumen, motus",5,"NaN, NaN, NaN, NaN, NaN",nan,nan,,0.0
statius.achilleid,1.515,"intro, deus, primus, pallor, fateor",5,"NaN, 0.0, 0.5, NaN, NaN",0.1,0.0,pallor,0.2
statius.achilleid,1.516,"thestorides, mox, ignis, gena, et, sanguis, torqueo",7,"NaN, NaN, 0.0, NaN, NaN, NaN, NaN",0.0,0.0,gena,0.143
statius.achilleid,1.517,"neque, socius, neque, castrum, uideo, sed, caecus, et, absum",9,"NaN, 1.0, NaN, NaN, NaN, NaN, -1.0, NaN, NaN",0.0,-0.111,,0.0
statius.achilleid,1.518,"nunc, superi, magnus, deprehendo, in, aether, coitus",7,"NaN, NaN, 0.0, NaN, NaN, NaN, NaN",0.0,0.0,,0.0
statius.achilleid,1.519,"nunc, saga, affor, aueo, nunc, durus, soror",7,"NaN, NaN, NaN, NaN, NaN, -0.5, NaN",-0.071,-0.071,,0.0
statius.achilleid,1.52,"licium, turifer, modo, consulo, anxius, ara",6,"NaN, NaN, NaN, NaN, -1.0, NaN",-0.167,-0.167,,0.0
statius.achilleid,1.521,"flamma, apex, rapio, et, caligo, sacer",6,"NaN, NaN, NaN, NaN, -0.5, 1.0",0.083,-0.083,,0.0
statius.achilleid,1.522,"pascor, exsilio, crinis, rigidus, laboro",5,"NaN, NaN, NaN, NaN, NaN",nan,nan,exsilio,0.2
statius.achilleid,1.523,"uitta, como, neque, collum, locus, neque, in, ordo, gressus",9,"NaN, NaN, NaN, NaN, 0.0, NaN, NaN, 0.5, 0.0",0.056,0.0,,0.0
statius.achilleid,1.524,"tandem, fessus, tremo, longus, mugitus, os",6,"NaN, NaN, NaN, 0.0, NaN, 0.0",0.0,0.0,,0.0
statius.achilleid,1.525,"soluo, et, oppono, uox, eluctor, furor, sum",7,"NaN, NaN, NaN, 0.0, NaN, -1.0, NaN",-0.143,-0.143,furor,0.143
statius.achilleid,1.526,"quo, rapio, ingens, magnus, chironis, alumnus",6,"NaN, NaN, -0.5, 0.0, NaN, NaN",-0.083,-0.083,,0.0
statius.achilleid,1.527,"femineus, nerei, dolus, huc, mitto, quis, aufero",7,"-0.5, NaN, NaN, NaN, NaN, NaN, NaN",-0.071,-0.071,dolus,0.143
statius.achilleid,1.528,"non, patior, meus, iste, meus, tu, diuus, profundo",8,"NaN, NaN, 0.0, NaN, 0.0, NaN, 0.0, NaN",0.0,0.0,tu,0.125
statius.achilleid,1.529,"et, ego, phoebus, ago, latebra, qui, abdo, tento",8,"NaN, NaN, NaN, NaN, -0.5, NaN, NaN, NaN",-0.062,-0.062,,0.0
statius.achilleid,1.53,"euersor, asia, uideo, per, cycladas, alo",6,"NaN, NaN, NaN, NaN, NaN, NaN",nan,nan,,0.0
statius.achilleid,1.531,"attono, et, turpis, quaero, litus, furtum",6,"NaN, NaN, -1.0, NaN, NaN, -1.0",-0.333,-0.333,"turpis, furtum",0.333
statius.achilleid,1.532,"occaedes, placeo, lycomedis, conscius, tellus",5,"NaN, NaN, NaN, -0.5, NaN",-0.1,-0.1,conscius,0.2
statius.achilleid,1.533,"o, scelus, en, fluo, uenio, in, pectus, uestis",8,"NaN, -1.0, NaN, NaN, NaN, NaN, NaN, NaN",-0.125,-0.125,"scelus, uestis",0.25
statius.achilleid,1.534,"scindo, puer, scindo, et, timidus, ne, cedo, parens",8,"NaN, 0.0, NaN, NaN, -0.5, NaN, NaN, 0.5",0.0,-0.062,timidus,0.125
statius.achilleid,1.535,"is, ego, rapio, abeo, quisnam, hic, procul, improbus, uirgo",9,"NaN, NaN, NaN, NaN, NaN, NaN, NaN, -1.0, NaN",-0.111,-0.111,"hic, improbus, uirgo",0.333
statius.achilleid,1.536,"hic, nuto, gradus, sto, amitto, furor",6,"NaN, NaN, 0.0, NaN, NaN, -1.0",-0.167,-0.167,"hic, furor",0.333
statius.achilleid,1.537,"uis, ante, ipse, tremefacio, con-ruo, ara",6,"1.0, NaN, NaN, NaN, NaN, NaN",0.167,0.0,,0.0
statius.achilleid,1.538,"tunc, haereo, ithacum, calydonius, occupo, heros",6,"NaN, NaN, NaN, NaN, NaN, NaN",nan,nan,,0.0
statius.achilleid,1.539,"nos, uoco, iste, labor, neque, enim, comes, eo, recuso",9,"NaN, NaN, NaN, -0.5, NaN, NaN, NaN, NaN, NaN",-0.056,-0.056,,0.0
statius.achilleid,1.54,"si, tuus, cura, traho, licet, ille, sono, antrum",8,"NaN, 0.0, -1.0, NaN, NaN, NaN, NaN, 0.0",-0.125,-0.125,,0.0
statius.achilleid,1.541,"tethyos, auerto, gremium, premo, aquosus",5,"NaN, NaN, 0.0, NaN, NaN",0.0,0.0,,0.0
statius.achilleid,1.542,"nereos, inuenio, tu, tantus, prouidus, astus",6,"NaN, NaN, NaN, NaN, 1.0, -0.5",0.083,-0.083,"tu, astus",0.333
statius.achilleid,1.543,"tendo, animus, uigilis, fecundus, erigo, pectus",6,"NaN, 0.5, NaN, 1.0, NaN, NaN",0.25,0.0,,0.0
statius.achilleid,1.544,"non, ego, quis, uates, dubius, in, casus, audeo",8,"NaN, NaN, NaN, NaN, -0.5, NaN, 0.0, NaN",-0.062,-0.062,,0.0
statius.achilleid,1.545,"fatum, uideo, prior, subicio, gaudeo, ulixes",6,"0.0, NaN, 0.5, NaN, NaN, NaN",0.083,0.0,,0.0
statius.achilleid,1.546,"sic, deus, omnipotens, firmo, sic, annuo, ille",7,"NaN, 0.0, NaN, NaN, NaN, NaN, NaN",0.0,0.0,,0.0
statius.achilleid,1.547,"uirgo, paternus, tu, sed, ego, spes, lubricus, tardo",8,"NaN, NaN, NaN, NaN, NaN, 0.5, NaN, NaN",0.062,0.0,"uirgo, tu",0.25
statius.achilleid,1.548,"grandis, equidem, armo, castrum, induco, achillem",6,"0.0, NaN, NaN, NaN, NaN, NaN",0.0,0.0,,0.0
statius.achilleid,1.549,"sed, si, fatum, nego, quam, foedus, atque, tristis, reuorto",9,"NaN, NaN, 0.0, NaN, NaN, -1.0, NaN, -1.0, NaN",-0.222,-0.222,,0.0
statius.achilleid,1.55,"ueto, tamen, danaum, non, in-tento, relinquo",6,"NaN, NaN, NaN, NaN, NaN, NaN",nan,nan,danaum,0.167
statius.achilleid,1.551,"iam, adeo, aut, adsum, cum, ego, peleius, heros",8,"NaN, NaN, NaN, NaN, NaN, NaN, NaN, NaN",nan,nan,,0.0
statius.achilleid,1.552,"aut, uerus, penitus, lateo, et, sine, apolline, calchas",8,"NaN, 0.5, NaN, NaN, NaN, NaN, NaN, NaN",0.062,0.0,,0.0
statius.achilleid,1.553,"conclamo, danai, stimulo, agamemno, uolo",5,"NaN, NaN, NaN, NaN, NaN",nan,nan,"danai, stimulo, agamemno",0.6
statius.achilleid,1.554,"laxo, coitus, resoluo, murmur, laeto",5,"NaN, NaN, NaN, NaN, NaN",nan,nan,,0.0
statius.achilleid,1.555,"agmen, discedo, qualis, iam, nox, propinquus",6,"-1.0, NaN, NaN, NaN, 0.0, 0.0",-0.167,-0.167,,0.0
statius.achilleid,1.556,"e, pasco, refero, aueo, uel, in, antrum, reuorto",8,"NaN, NaN, NaN, NaN, NaN, NaN, 0.0, NaN",0.0,0.0,,0.0
statius.achilleid,1.557,"mel, nouo, grauida, mitis, uideo, hybla, caterua",7,"NaN, NaN, NaN, 1.0, NaN, NaN, NaN",0.143,0.0,,0.0
statius.achilleid,1.558,"neque, mora, iam, dexter, ithacesia, carbasus, aura, posco",8,"NaN, NaN, NaN, NaN, NaN, NaN, 1.0, NaN",0.125,0.0,,0.0
statius.achilleid,1.559,"et, in, remi, hilaris, sedeo, iuuentus",6,"NaN, NaN, NaN, 1.0, NaN, NaN",0.167,0.0,hilaris,0.167
statius.achilleid,1.56,"at, procul, occulo, fallo, sub, imago, sexus",7,"NaN, NaN, NaN, NaN, NaN, NaN, NaN",nan,nan,fallo,0.143
statius.achilleid,1.561,"aeacide, -ne, furtum, iam, nosco, unus, lateo",7,"NaN, NaN, -1.0, NaN, NaN, NaN, NaN",-0.143,-0.143,furtum,0.143
statius.achilleid,1.562,"deidamia, uir, sed, operio, conscius, culpa",6,"NaN, 0.5, NaN, NaN, -0.5, -1.0",-0.167,-0.25,"conscius, culpa",0.333
statius.achilleid,1.563,"cunctus, paueo, taceo, puto, sentio, soror",6,"0.0, NaN, NaN, NaN, NaN, NaN",0.0,0.0,,0.0
statius.achilleid,1.564,"namque, ut, uirgineus, sto, in, grex, durus, achilles",8,"NaN, NaN, NaN, NaN, NaN, NaN, -0.5, NaN",-0.062,-0.062,achilles,0.125
statius.achilleid,1.565,"exsoluo, rudis, genetrix, digredior, pudor",5,"NaN, -0.5, NaN, NaN, 0.5",0.0,-0.1,pudor,0.2
statius.achilleid,1.566,"protinus, eligo, comes, quamquam, omnis, in, ille",7,"NaN, NaN, NaN, NaN, NaN, NaN, NaN",nan,nan,,0.0
statius.achilleid,1.567,"turba, coeo, blandus, nouo, nihil, talis, timeo",7,"0.0, NaN, 0.5, NaN, NaN, NaN, NaN",0.071,0.0,,0.0
statius.achilleid,1.568,"admoueo, insidiae, ille, sequor, premo",5,"NaN, NaN, NaN, NaN, NaN",nan,nan,insidiae,0.2
statius.achilleid,1.569,"improbus, ille, oculus, iterum, iterum, resumo",6,"-1.0, NaN, 0.0, NaN, NaN, NaN",-0.167,-0.167,improbus,0.167
statius.achilleid,1.57,"nunc, nimius, lateo, non, euito, inhaereo",6,"NaN, NaN, NaN, NaN, NaN, NaN",nan,nan,nimius,0.167
statius.achilleid,1.571,"nunc, leuis, serta, labor, nunc, sponte, canistrum",7,"NaN, 0.0, NaN, -0.5, NaN, NaN, NaN",-0.071,-0.071,,0.0
statius.achilleid,1.572,"nunc, thyrsus, parco, ferio, modo, dulcis, nosco",7,"NaN, NaN, NaN, NaN, NaN, 0.5, NaN",0.071,0.0,,0.0
statius.achilleid,1.573,"filum, lyra, tenuis, modus, et, carmen, monstro",7,"NaN, 0.0, 0.0, 0.5, NaN, 0.0, NaN",0.071,0.0,,0.0
statius.achilleid,1.574,"chironis, duco, manus, digitus, sono",5,"NaN, NaN, 0.0, NaN, NaN",0.0,0.0,,0.0
statius.achilleid,1.575,"infringo, cithara, nunc, occupo, os, caneo",6,"NaN, NaN, NaN, NaN, 0.0, NaN",0.0,0.0,,0.0
statius.achilleid,1.576,"et, ligo, amplector, et, mille, per, osculum, laudo",8,"NaN, NaN, NaN, NaN, NaN, NaN, 0.0, NaN",0.0,0.0,,0.0
statius.achilleid,1.577,"ille, libet, disco, quo, uertex, pelion, et, quis",8,"NaN, NaN, NaN, NaN, NaN, NaN, NaN, NaN",nan,nan,,0.0
statius.achilleid,1.578,"aeacides, puer, audio, nomen, et, ago",6,"NaN, 0.0, NaN, 0.0, NaN, NaN",0.0,0.0,aeacides,0.167
statius.achilleid,1.579,"assiduus, stupeo, et, praesens, canto, achillem",6,"0.5, NaN, NaN, 0.0, 0.0, NaN",0.083,0.0,,0.0
statius.achilleid,1.58,"ipse, quoque, et, ualidus, profero, modestus, artus",7,"NaN, NaN, NaN, 1.0, NaN, 1.0, NaN",0.286,0.0,modestus,0.143
statius.achilleid,1.581,"et, tenuaris, rudo, attero, polliceo, lana",6,"NaN, NaN, NaN, NaN, NaN, NaN",nan,nan,lana,0.167
statius.achilleid,1.582,"demonstro, reficio, color, et, perdo, durus",6,"NaN, NaN, 0.0, NaN, NaN, -0.5",-0.083,-0.083,,0.0
statius.achilleid,1.583,"pensum, manus, uox, sonus, pondus, teneo",6,"NaN, 0.0, 0.0, NaN, NaN, NaN",0.0,0.0,,0.0
statius.achilleid,1.584,"quisque, fugio, comes, nimius, qui, lumen, sui",7,"NaN, NaN, NaN, NaN, NaN, NaN, NaN",nan,nan,nimius,0.143
statius.achilleid,1.585,"ago, et, in, uerbum, intempestiuus, anhelo",6,"NaN, NaN, NaN, 0.0, -1.0, NaN",-0.167,-0.167,,0.0
statius.achilleid,1.586,"miro, iam, iam, dolus, aperio, paro",6,"NaN, NaN, NaN, NaN, NaN, NaN",nan,nan,dolus,0.167
statius.achilleid,1.587,"uirgineus, leuitas, fugio, prohibeo, fateor",5,"NaN, 0.0, NaN, NaN, NaN",0.0,0.0,,0.0
statius.achilleid,1.588,"sic, sub, mater, rhea, iuuenis, regnator, olympi",7,"NaN, NaN, 0.0, NaN, NaN, NaN, NaN",0.0,0.0,,0.0
statius.achilleid,1.589,"osculum, securus, do, insidiosus, soror",5,"0.0, 1.0, NaN, -1.0, NaN",0.0,-0.2,insidiosus,0.2
statius.achilleid,1.59,"frater, adhuc, medius, donec, reuerendus, cedo",6,"0.0, NaN, 0.0, NaN, 1.0, NaN",0.167,0.0,,0.0
statius.achilleid,1.591,"sanguis, et, uerro, germanus, expauesco, amor",6,"NaN, NaN, NaN, NaN, NaN, 1.0",0.167,0.0,,0.0
statius.achilleid,1.592,"tandem, detego, timidus, nereidos, astus",5,"NaN, NaN, -0.5, NaN, -0.5",-0.2,-0.2,"timidus, astus",0.4
statius.achilleid,1.593,"lucus, agenorei, sublimis, ad, Orgia, bacchi",6,"NaN, NaN, 0.5, NaN, NaN, NaN",0.083,0.0,,0.0
statius.achilleid,1.594,"sto, et, admitto, caelum, nemus, hic, in, umbra",8,"NaN, NaN, NaN, 0.5, NaN, NaN, NaN, NaN",0.062,0.0,hic,0.125
statius.achilleid,1.595,"alternus, renouaris, pius, trieterida, mater",5,"NaN, NaN, NaN, NaN, 0.0",0.0,0.0,,0.0
statius.achilleid,1.596,"consuesco, scissus, pecus, terra, reuello",5,"NaN, NaN, NaN, 0.0, NaN",0.0,0.0,,0.0
statius.achilleid,1.597,"fero, trabs, gratus, deus, praesto, furor",6,"NaN, 0.0, 1.0, 0.0, NaN, -1.0",0.0,-0.167,furor,0.167
statius.achilleid,1.598,"lex, procul, eo, maris, itcrat, praecipio, uereor",7,"0.5, NaN, NaN, NaN, NaN, NaN, NaN",0.071,0.0,,0.0
statius.achilleid,1.599,"ducto, inaccessus, uis, edico, antrum",5,"NaN, NaN, 1.0, NaN, 0.0",0.2,0.0,,0.0
statius.achilleid,1.6,"neque, satis, sum, sto, finis, do, metuo, sacerdos",8,"NaN, 0.5, NaN, NaN, 0.0, NaN, NaN, NaN",0.062,0.0,,0.0
statius.achilleid,1.601,"exploro, aditus, ne, quis, temerator, oberro",6,"NaN, NaN, NaN, NaN, NaN, NaN",nan,nan,,0.0
statius.achilleid,1.602,"agmen, femineus, taceo, sui, rideo, achilles",6,"-1.0, -0.5, NaN, NaN, NaN, NaN",-0.25,-0.25,achilles,0.167
statius.achilleid,1.603,"ille, uirgineus, duco, signum, caterua",5,"NaN, NaN, NaN, 0.0, NaN",0.0,0.0,,0.0
statius.achilleid,1.604,"magnus, difficilis, soluo, bracchium, motus",5,"0.0, -0.5, NaN, NaN, NaN",-0.1,-0.1,,0.0
statius.achilleid,1.605,"et, sexus, pariter, decet, et, mendacium, mater",7,"NaN, NaN, NaN, NaN, NaN, -1.0, 0.0",-0.143,-0.143,mendacium,0.143
statius.achilleid,1.606,"miror, comes, neque, iam, pulcher, turba",6,"NaN, NaN, NaN, NaN, 1.0, 0.0",0.167,0.0,,0.0
statius.achilleid,1.607,"deidamia, suus, tantus, admoueo, superbus",5,"NaN, NaN, NaN, NaN, -1.0",-0.2,-0.2,,0.0
statius.achilleid,1.608,"uincio, aeacide, quantus, premo, ipse, soror",6,"NaN, NaN, NaN, NaN, NaN, NaN",nan,nan,,0.0
statius.achilleid,1.609,"ut, uerus, e, teres, demitto, nebrida, collum",7,"NaN, 0.5, NaN, NaN, NaN, NaN, NaN",0.071,0.0,,0.0
statius.achilleid,1.61,"erro, sinus, hedera, colligo, et, altus",6,"0.0, NaN, 0.0, NaN, NaN, 0.5",0.083,0.0,,0.0
statius.achilleid,1.611,"cingo, purpureus, flaueo, tempus, uitta",5,"NaN, NaN, NaN, 0.0, NaN",0.0,0.0,,0.0
statius.achilleid,1.612,"uibro, grauis, redimitus, missilis, dextera",5,"NaN, -0.5, NaN, NaN, 0.0",-0.1,-0.1,,0.0
statius.achilleid,1.613,"attono, sto, turba, metus, sacer, relinquo",6,"NaN, NaN, 0.0, -1.0, 1.0, NaN",0.0,-0.167,,0.0
statius.achilleid,1.614,"ille, amb-eo, libet, pronus, attollo, uultus",6,"NaN, NaN, NaN, NaN, NaN, NaN",nan,nan,,0.0
statius.achilleid,1.615,"talis, ubi, ad, thebas, uultus, animus, remitto",7,"NaN, NaN, NaN, NaN, NaN, 0.5, NaN",0.071,0.0,,0.0
