Text,Stelle,Inahlt,Wortzahl,Sentiment Rechnung,Sentiment-Score,alternativer Sentiment-Score,Invektiven,Invektivitäts-Score
statius.achilleid,1.824,"pelides, qualis, sicula, sub, rupes, aetnae",6,"NaN, NaN, NaN, NaN, 0.0, NaN",0.0,0.0,,0.0
statius.achilleid,1.825,"naidas, ennaeas, inter, diana, ferox",5,"NaN, NaN, NaN, NaN, -1.0",-0.2,-0.2,ferox,0.2
statius.achilleid,1.826,"pallas, et, elysii, luceo, sponsa, tyrannus",6,"NaN, NaN, NaN, NaN, NaN, NaN",nan,nan,tyrannus,0.167
statius.achilleid,1.827,"iam, moueo, gressus, thiasus, ismenia, buxus",6,"NaN, NaN, 0.0, NaN, NaN, NaN",0.0,0.0,,0.0
statius.achilleid,1.828,"signum, do, quater, aes, rheae, quater, entheus, pulso",8,"0.0, NaN, NaN, NaN, NaN, NaN, NaN, NaN",0.0,0.0,entheus,0.125
statius.achilleid,1.829,"tergum, manus, uarius, quater, lego, recursus",6,"NaN, 0.0, 0.0, NaN, NaN, NaN",0.0,0.0,,0.0
statius.achilleid,1.83,"tunc, thyrsus, parito, leuo, parito, repono",6,"NaN, NaN, NaN, NaN, NaN, NaN",nan,nan,,0.0
statius.achilleid,1.831,"multiplico, gradus, modo, quo, curetes, in, actus",7,"NaN, 0.0, NaN, NaN, NaN, NaN, NaN",0.0,0.0,,0.0
statius.achilleid,1.832,"quoque, pius, samothraces, eo, nunc, obuius, uerro",7,"NaN, NaN, NaN, NaN, NaN, -0.5, NaN",-0.071,-0.071,,0.0
statius.achilleid,1.833,"pecto, amazonio, modo, quo, cito, orbis, lacaenas",7,"NaN, NaN, NaN, NaN, NaN, NaN, NaN",nan,nan,pecto,0.143
statius.achilleid,1.834,"de_-lio, plaudo, suus, intorqueo, amyclis",5,"NaN, NaN, NaN, NaN, NaN",nan,nan,de_-lio,0.2
statius.achilleid,1.835,"tunc, uerus, tunc, praecipuus, manifestus, achilles",6,"NaN, 0.5, NaN, 0.0, -0.5, NaN",0.0,-0.083,achilles,0.167
statius.achilleid,1.836,"neque, seruaris, uicis, neque, bracchium, iungo, curo",7,"NaN, NaN, NaN, NaN, NaN, NaN, NaN",nan,nan,,0.0
statius.achilleid,1.837,"tunc, mollis, gressus, tunc, aspernor, amicio",6,"NaN, NaN, 0.0, NaN, NaN, NaN",0.0,0.0,aspernor,0.167
statius.achilleid,1.838,"multus, soleo, rumpo, chorus, et, multus, turbo",7,"0.0, NaN, NaN, NaN, NaN, 0.0, NaN",0.0,0.0,,0.0
statius.achilleid,1.839,"sic, indignor, thyrsus, accipio, mater",5,"NaN, NaN, NaN, NaN, 0.0",0.0,0.0,,0.0
statius.achilleid,1.84,"tympanum, iam, tristis, specto, penthea, thebe",6,"NaN, NaN, -1.0, NaN, NaN, NaN",-0.167,-0.167,penthea,0.167
statius.achilleid,1.841,"soluo, laudo, cohors, repeto, paternus",5,"NaN, NaN, NaN, NaN, NaN",nan,nan,,0.0
statius.achilleid,1.842,"limen, ubi, in, medius, iamdudum, sedes, aula",7,"NaN, NaN, NaN, 0.0, NaN, 0.0, NaN",0.0,0.0,,0.0
statius.achilleid,1.843,"munus, uirgineus, uideo, frango, loco",5,"0.5, NaN, NaN, NaN, NaN",0.1,0.0,,0.0
statius.achilleid,1.844,"tydides, signum, hospitium, pretium, labor",5,"NaN, 0.0, 0.0, 1.0, -0.5",0.1,-0.1,pretium,0.2
statius.achilleid,1.845,"horto, lego, neque, rex, placidus, arceo",6,"NaN, NaN, NaN, 0.0, 1.0, NaN",0.167,0.0,,0.0
statius.achilleid,1.846,"heu, simplex, nimius, rudis, qui, callidus, donum",7,"NaN, 0.5, NaN, -0.5, NaN, 1.0, 0.0",0.143,-0.071,"heu, nimius, callidus",0.429
statius.achilleid,1.847,"graiorumque, dolus, uarius, ignoro, ulixem",5,"NaN, NaN, 0.0, NaN, NaN",0.0,0.0,dolus,0.2
statius.achilleid,1.848,"hic, alius, qui, sexus, iners, natura, duco",7,"NaN, NaN, NaN, NaN, 0.0, 0.0, NaN",0.0,0.0,"hic, iners",0.286
statius.achilleid,1.849,"aut, teres, thyrsus, aut, respondeo, tento",6,"NaN, NaN, NaN, NaN, NaN, NaN",nan,nan,,0.0
statius.achilleid,1.85,"tympanum, gemino, aut, necto, tempus, limbus",6,"NaN, NaN, NaN, NaN, 0.0, NaN",0.0,0.0,,0.0
statius.achilleid,1.851,"arma, uideo, magnus, puto, dono, parens",6,"0.0, NaN, 0.0, NaN, NaN, 0.5",0.083,0.0,,0.0
statius.achilleid,1.852,"at, ferus, aeacides, radio, ut, comminus, orbis",7,"NaN, -1.0, NaN, NaN, NaN, NaN, NaN",-0.143,-0.143,"ferus, aeacides",0.286
statius.achilleid,1.853,"caelo, pugna, saeuus, et, fors, rubeo",6,"NaN, -1.0, -1.0, NaN, 0.0, NaN",-0.333,-0.333,saeuus,0.167
statius.achilleid,1.854,"bellum, maculis, adclinem, conspicio, hasta",5,"0.0, NaN, NaN, NaN, NaN",0.0,0.0,,0.0
statius.achilleid,1.855,"infremo, torqueo, gena, et, frons, relinquo",6,"NaN, NaN, NaN, NaN, 0.0, NaN",0.0,0.0,"infremo, gena",0.333
statius.achilleid,1.856,"surgo, coma, nusquam, mandatum, parens",5,"NaN, NaN, NaN, NaN, 0.5",0.1,0.0,,0.0
statius.achilleid,1.857,"nusquam, occulo, amor, totus, in, pectus, troia, sum",8,"NaN, NaN, 1.0, NaN, NaN, NaN, NaN, NaN",0.125,0.0,,0.0
statius.achilleid,1.858,"ut, leo, maternus, cum, rapio, ab, uber, mos",8,"NaN, NaN, NaN, NaN, NaN, NaN, 1.0, 0.5",0.188,0.0,leo,0.125
statius.achilleid,1.859,"accipio, pecto, iuba, homo, uereor",5,"NaN, NaN, NaN, 0.0, NaN",0.0,0.0,pecto,0.2
statius.achilleid,1.86,"edisco, nullus, rapio, nisi, iubeo, in, ira",7,"NaN, NaN, NaN, NaN, NaN, NaN, -1.0",-0.143,-0.143,,0.0
statius.achilleid,1.861,"si, semel, aduerso, radio, lumen, ferrum",6,"NaN, NaN, NaN, NaN, NaN, NaN",nan,nan,,0.0
statius.achilleid,1.862,"ex-iuro, fides, domito, inimicus, in, ille",6,"NaN, 1.0, NaN, -1.0, NaN, NaN",0.0,-0.167,,0.0
statius.achilleid,1.863,"primus, fames, timidus, pudeo, seruio, magister",6,"0.5, -0.5, -0.5, NaN, NaN, 0.5",0.0,-0.167,"timidus, pudeo",0.333
statius.achilleid,1.864,"ut, uerus, accedo, propius, lux, aemulo, uultus",7,"NaN, 0.5, NaN, NaN, NaN, NaN, NaN",0.071,0.0,,0.0
statius.achilleid,1.865,"reddo, et, similis, talis, sui, uideo, in, aurum",8,"NaN, NaN, 0.0, NaN, NaN, NaN, NaN, 0.5",0.062,0.0,,0.0
statius.achilleid,1.866,"horreo, erubesco, simul, tunc, acer, ulixes",6,"NaN, NaN, NaN, NaN, NaN, NaN",nan,nan,erubesco,0.167
statius.achilleid,1.867,"admoueo, lateo, summitto, uox, quis, haereo",6,"NaN, NaN, NaN, 0.0, NaN, NaN",0.0,0.0,,0.0
statius.achilleid,1.868,"scio, aio, tu, semifer, chironis, alumnus",6,"NaN, NaN, NaN, NaN, NaN, NaN",nan,nan,"tu, semifer",0.333
statius.achilleid,1.869,"tu, caelum, pelagius, nepos, tu, doricus, classis",7,"NaN, 0.5, 0.0, 0.0, NaN, NaN, NaN",0.071,0.0,"tu, tu, classis",0.429
statius.achilleid,1.87,"tu, tuus, suspendo, exspecto, graecia, signum",6,"NaN, 0.0, NaN, NaN, NaN, 0.0",0.0,0.0,tu,0.167
statius.achilleid,1.871,"ipse, iam, dubius, nuto, tu, pergama, murus",7,"NaN, NaN, -0.5, NaN, NaN, NaN, NaN",-0.071,-0.071,"tu, pergama",0.286
statius.achilleid,1.872,"heia, abrumpo, mora, sine, perfidus, palleo, ide",7,"NaN, NaN, NaN, NaN, -1.0, NaN, NaN",-0.143,-0.143,perfidus,0.143
statius.achilleid,1.873,"et, iuuo, hic, audio, pater, pudeo, dolosus",7,"NaN, NaN, NaN, NaN, 0.0, NaN, NaN",0.0,0.0,"hic, pudeo",0.286
statius.achilleid,1.874,"sic, pro, tu, timeo, theti, -ne, iam, pectus, amictus",9,"NaN, NaN, NaN, NaN, NaN, NaN, NaN, NaN, 0.5",0.056,0.0,"tu, theti",0.222
statius.achilleid,1.875,"laxo, cum, grandis, tuba, sic, iubeo, agyrtes",7,"NaN, NaN, 0.0, NaN, NaN, NaN, NaN",0.0,0.0,,0.0
statius.achilleid,1.876,"insono, fugio, dis-iacio, undique, donum",5,"NaN, NaN, NaN, NaN, 0.0",0.0,0.0,,0.0
statius.achilleid,1.877,"imploro, pater, commoueo, proelio, credo",5,"NaN, 0.0, NaN, NaN, NaN",0.0,0.0,,0.0
statius.achilleid,1.878,"ille, intactus, cado, ab, pectus, uestis",6,"NaN, NaN, NaN, NaN, NaN, NaN",nan,nan,uestis,0.167
statius.achilleid,1.879,"iam, clipeus, breuis, manus, consumo, hasta",6,"NaN, NaN, NaN, 0.0, NaN, NaN",0.0,0.0,,0.0
statius.achilleid,1.88,"mirus, fides, ithacumque, umerus, excedo, uideo",6,"1.0, 1.0, NaN, NaN, NaN, NaN",0.333,0.0,,0.0
statius.achilleid,1.881,"aetolumque, dux, tantus, subeo, arma, calo",6,"NaN, 0.5, NaN, NaN, 0.0, NaN",0.083,0.0,,0.0
statius.achilleid,1.882,"martius, horreo, confundo, lux, penates",5,"NaN, NaN, NaN, NaN, NaN",nan,nan,,0.0
statius.achilleid,1.883,"immanis, gradus, ceu, protinus, hector, posco",6,"0.0, 0.0, NaN, NaN, NaN, NaN",0.0,0.0,immanis,0.167
statius.achilleid,1.884,"sto, medius, trepido, domus, peleaque, uirgo",6,"NaN, 0.0, NaN, 0.0, NaN, NaN",0.0,0.0,uirgo,0.167
statius.achilleid,1.885,"quaero, at, alius, plango, pars, retego",6,"NaN, NaN, NaN, NaN, 0.0, NaN",0.0,0.0,,0.0
statius.achilleid,1.886,"deidamia, dolus, qui, cum, grandis, primus",6,"NaN, NaN, NaN, NaN, 0.0, 0.5",0.083,0.0,dolus,0.167
statius.achilleid,1.887,"lamento, et, nosco, accipio, pectus, uoco",6,"NaN, NaN, NaN, NaN, NaN, NaN",nan,nan,,0.0
statius.achilleid,1.888,"haereo, et, occulo, uirtus, infringo, calor, sum",7,"NaN, NaN, NaN, 1.0, NaN, 0.0, NaN",0.143,0.0,,0.0
statius.achilleid,1.889,"demitto, clipeus, rego, ad, lumen, uerro",6,"NaN, NaN, NaN, NaN, NaN, NaN",nan,nan,,0.0
statius.achilleid,1.89,"attono, facio, inopinus, monstrum, paueo",5,"NaN, NaN, NaN, 0.5, NaN",0.1,0.0,monstrum,0.2
statius.achilleid,1.891,"sicut, sum, nudus, lycomedem, affor, in, arma",7,"NaN, NaN, 0.0, NaN, NaN, NaN, 0.0",0.0,0.0,,0.0
statius.achilleid,1.892,"ego, tu, caris, pater, dubius, dimitto, pauor",7,"NaN, NaN, NaN, 0.0, -0.5, NaN, -1.0",-0.214,-0.214,tu,0.143
statius.achilleid,1.893,"ego, do, almus, thetis, tu, pridem, tantus, maneo",8,"NaN, NaN, NaN, NaN, NaN, NaN, NaN, NaN",nan,nan,"thetis, tu",0.25
statius.achilleid,1.894,"gloria, quaero, danais, tu, mitto, achillem",6,"0.0, NaN, NaN, NaN, NaN, NaN",0.0,0.0,tu,0.167
statius.achilleid,1.895,"gratus, et, magnus, si, fas, dico, pareo",7,"1.0, NaN, 0.0, NaN, NaN, NaN, NaN",0.143,0.0,,0.0
statius.achilleid,1.896,"et, dulcis, chirone, ego, sed, cor, parumper",7,"NaN, 0.5, NaN, NaN, NaN, NaN, NaN",0.071,0.0,,0.0
statius.achilleid,1.897,"huc, aduerto, libet, atque, hic, bonus, accipio, uoco",8,"NaN, NaN, NaN, NaN, NaN, 1.0, NaN, NaN",0.125,0.0,hic,0.125
statius.achilleid,1.898,"peleus, tu, natus, socer, et, thetis, hospita, iungo",8,"NaN, NaN, 0.0, NaN, NaN, NaN, 0.5, NaN",0.062,0.0,"tu, thetis, hospita",0.375
statius.achilleid,1.899,"ad-lego, suus, uterque, ab, sanguis, diuus",6,"NaN, NaN, NaN, NaN, NaN, 0.0",0.0,0.0,,0.0
statius.achilleid,1.9,"unus, uirgineus, nataris, ex, agmen, posco",6,"NaN, NaN, NaN, NaN, -1.0, NaN",-0.167,-0.167,nataris,0.167
statius.achilleid,1.901,"do, an, gens, humilis, tu, degenero, uideo",7,"NaN, NaN, 0.0, NaN, NaN, NaN, NaN",0.0,0.0,"humilis, tu",0.286
statius.achilleid,1.902,"non, renuo, iungo, ergo, manus, et, concipio, foedus",8,"NaN, NaN, NaN, NaN, 0.0, NaN, NaN, -1.0",-0.125,-0.125,,0.0
statius.achilleid,1.903,"atque, ignosco, tuus, taceo, iam, cognosco, furtum",7,"NaN, NaN, 0.0, NaN, NaN, NaN, -1.0",-0.143,-0.143,furtum,0.143
statius.achilleid,1.904,"deidamia, ego, quis, enim, hic, obstaris, lacertus",7,"NaN, NaN, NaN, NaN, NaN, NaN, NaN",nan,nan,hic,0.143
statius.achilleid,1.905,"qui, possum, noster, possessus, repello, uires",6,"NaN, NaN, NaN, NaN, NaN, NaN",nan,nan,,0.0
statius.achilleid,1.906,"ego, luo, iste, iubeo, pono, arma, et, reddo, pelasgis",9,"NaN, NaN, NaN, NaN, NaN, 0.0, NaN, NaN, NaN",0.0,0.0,luo,0.111
statius.achilleid,1.907,"et, maneo, quis, tristis, fremo, quis, lumen, muto",8,"NaN, NaN, NaN, -1.0, NaN, NaN, NaN, NaN",-0.125,-0.125,,0.0
statius.achilleid,1.908,"iam, socer, sum, natus, ante, pes, prosterno, et, addo",9,"NaN, NaN, NaN, 0.0, NaN, 0.0, NaN, NaN, NaN",0.0,0.0,,0.0
statius.achilleid,1.909,"iam, auus, immitis, quotiens, itero, ensis",6,"NaN, NaN, -1.0, NaN, NaN, NaN",-0.167,-0.167,immitis,0.167
statius.achilleid,1.91,"turba, sum, tunc, et, danai, per, sacer, fides",8,"0.0, NaN, NaN, NaN, NaN, NaN, 1.0, 1.0",0.25,0.0,danai,0.125
statius.achilleid,1.911,"hospitium, blandus, prex, compello, ulixes",5,"0.0, 0.5, 0.0, NaN, NaN",0.1,0.0,,0.0
statius.achilleid,1.912,"ille, etsi, carus, comperio, iniuria, nascor",6,"NaN, NaN, 1.0, NaN, -1.0, NaN",0.0,-0.167,,0.0
statius.achilleid,1.913,"et, thetidis, mandatum, moueo, prodo, uideo",6,"NaN, NaN, NaN, NaN, NaN, NaN",nan,nan,,0.0
statius.achilleid,1.914,"depono, tam, grandis, dea, tamen, obuius, eo",7,"NaN, NaN, 0.0, NaN, NaN, -0.5, NaN",-0.071,-0.071,,0.0
statius.achilleid,1.915,"tot, metuo, fatum, argiuaque, bellum, moraris",6,"NaN, NaN, 0.0, NaN, 0.0, NaN",0.0,0.0,,0.0
statius.achilleid,1.916,"facio, uolo, ipse, illic, mater, sperno, achilles",7,"NaN, NaN, NaN, NaN, 0.0, NaN, NaN",0.0,0.0,achilles,0.143
statius.achilleid,1.917,"neque, tamen, abnuo, gener, sui, iungo, talis",7,"NaN, NaN, NaN, NaN, NaN, NaN, NaN",nan,nan,,0.0
statius.achilleid,1.918,"uincio, areanis, effero, pudibundus, tenebrae",5,"NaN, NaN, NaN, NaN, NaN",nan,nan,,0.0
statius.achilleid,1.919,"deidamia, gradus, uenia, neque, protinus, amens",6,"NaN, 0.0, 1.0, NaN, NaN, -1.0",0.0,-0.167,amens,0.167
statius.achilleid,1.92,"credo, et, oppono, genitor, placeo, achille",6,"NaN, NaN, NaN, NaN, NaN, NaN",nan,nan,,0.0
statius.achilleid,1.921,"mitto, haemoniam, magnus, qui, pelea, facio",6,"NaN, NaN, 0.0, NaN, NaN, NaN",0.0,0.0,,0.0
statius.achilleid,1.922,"impleo, et, classis, comito, in, proelio, posco",7,"NaN, NaN, NaN, NaN, NaN, NaN, NaN",nan,nan,classis,0.143
statius.achilleid,1.923,"neque, non, et, gemino, regnator, scyrius, alnus",7,"NaN, NaN, NaN, NaN, NaN, NaN, NaN",nan,nan,,0.0
statius.achilleid,1.924,"deduco, gener, uireo, excuso, achiuis",5,"NaN, NaN, NaN, NaN, NaN",nan,nan,,0.0
statius.achilleid,1.925,"tunc, epulis, consumo, dies, tandem, retego",6,"NaN, NaN, NaN, 0.0, NaN, NaN",0.0,0.0,epulis,0.167
statius.achilleid,1.926,"foedus, et, intrepidus, nox, conscius, iungo, amo",7,"-1.0, NaN, 1.0, 0.0, -0.5, NaN, NaN",-0.071,-0.214,conscius,0.143
statius.achilleid,1.927,"ille, ante, oculus, nouo, bellum, et, xanthus, et, ide",9,"NaN, NaN, 0.0, NaN, 0.0, NaN, NaN, NaN, NaN",0.0,0.0,,0.0
statius.achilleid,1.928,"argolicaeque, ratis, atque, ipse, cogito, unda",6,"NaN, NaN, NaN, NaN, NaN, 0.0",0.0,0.0,,0.0
statius.achilleid,1.929,"aurora, timeo, carus, ceruix, maritus",5,"NaN, NaN, 1.0, NaN, 0.0",0.2,0.0,maritus,0.2
statius.achilleid,1.93,"fundo, nosco, lacrima, iam, soluo, et, occupo, artus",8,"NaN, NaN, NaN, NaN, NaN, NaN, NaN, NaN",nan,nan,,0.0
statius.achilleid,1.931,"aspicio, -ne, iterum, ego, hic, in, pectus, pono",8,"NaN, NaN, NaN, NaN, NaN, NaN, NaN, NaN",nan,nan,hic,0.125
statius.achilleid,1.932,"aeacide, rursus, tuus, digno, pario",5,"NaN, NaN, 0.0, NaN, NaN",0.0,0.0,,0.0
statius.achilleid,1.933,"an, tumidus, teucrosque, lar, et, capio, reporto",7,"NaN, -0.5, NaN, NaN, NaN, NaN, NaN",-0.071,-0.071,,0.0
statius.achilleid,1.934,"pergama, uirgineus, nolo, memini, latebra",5,"NaN, NaN, NaN, NaN, -0.5",-0.1,-0.1,pergama,0.2
statius.achilleid,1.935,"quis, preco, heu, timeo, prior, quis, anxius, mando",8,"NaN, NaN, NaN, NaN, 0.5, NaN, -1.0, NaN",-0.062,-0.125,heu,0.125
statius.achilleid,1.936,"qui, uix, fleo, uaco, modo, tu, nox, unus, do",9,"NaN, NaN, NaN, NaN, NaN, NaN, 0.0, NaN, NaN",0.0,0.0,tu,0.111
statius.achilleid,1.937,"inuideo, ego, thalamus, hic, tempus, noster",6,"NaN, NaN, NaN, NaN, 0.0, NaN",0.0,0.0,hic,0.167
statius.achilleid,1.938,"hic, sum, liber, hymen, o, dulcis, furtum, dolus",8,"NaN, NaN, 0.5, NaN, NaN, 0.5, -1.0, NaN",0.0,-0.125,"hic, furtum, dolus",0.375
statius.achilleid,1.939,"o, timor, abripio, miser, permitto, achilles",6,"NaN, -0.5, NaN, -1.0, NaN, NaN",-0.25,-0.25,"miser, achilles",0.333
statius.achilleid,1.94,"eo, neque, enim, tantus, audeo, reuocaris, paro",7,"NaN, NaN, NaN, NaN, NaN, NaN, NaN",nan,nan,,0.0
statius.achilleid,1.941,"eo, caueo, neque, uanus, theti, -ne, timeo, memento",8,"NaN, NaN, NaN, -0.5, NaN, NaN, NaN, NaN",-0.062,-0.062,"uanus, theti",0.25
statius.achilleid,1.942,"eo, felix, noster, redeo, nimis, improbus, posco",7,"NaN, 1.0, NaN, NaN, NaN, -1.0, NaN",0.0,-0.143,improbus,0.143
statius.achilleid,1.943,"iam, tu, spero, lacrima, plango, decorus",6,"NaN, NaN, NaN, NaN, NaN, NaN",nan,nan,tu,0.167
statius.achilleid,1.944,"troades, opto, tuus, do, collum, catena",6,"NaN, NaN, 0.0, NaN, NaN, 0.0",0.0,0.0,catena,0.167
statius.achilleid,1.945,"et, patria, pensaris, torus, aut, ipse, placeo",7,"NaN, NaN, NaN, NaN, NaN, NaN, NaN",nan,nan,,0.0
statius.achilleid,1.946,"tyndaris, incesto, nimium, laudo, rapina",5,"NaN, NaN, 0.0, NaN, NaN",0.0,0.0,"incesto, rapina",0.4
statius.achilleid,1.947,"at, nos, primus, puerilis, fabula, culpa",6,"NaN, NaN, 0.5, 0.0, 0.0, -1.0",-0.083,-0.167,culpa,0.167
statius.achilleid,1.948,"narro, famulis, aut, dissimulo, lateo",5,"NaN, NaN, NaN, NaN, NaN",nan,nan,,0.0
statius.achilleid,1.949,"quin, ago, duco, comes, cur, non, ego, martia, cum, tu",10,"NaN, NaN, NaN, NaN, NaN, NaN, NaN, NaN, NaN, NaN",nan,nan,tu,0.1
statius.achilleid,1.95,"signum, fero, tu, thyrsa, manus, baccheaque, cum, ego",8,"0.0, NaN, NaN, NaN, 0.0, NaN, NaN, NaN",0.0,0.0,"tu, baccheaque",0.25
statius.achilleid,1.951,"sacer, qui, infelix, non, credo, troia, fero",7,"1.0, NaN, -1.0, NaN, NaN, NaN, NaN",0.0,-0.143,infelix,0.143
statius.achilleid,1.952,"attamen, hic, qui, maestus, ego, solacium, linquo",7,"NaN, NaN, NaN, -1.0, NaN, 1.0, NaN",0.0,-0.143,hic,0.143
statius.achilleid,1.953,"hic, saltem, sub, cor, teneo, et, concedo, precor",8,"NaN, NaN, NaN, NaN, NaN, NaN, NaN, NaN",nan,nan,hic,0.125
statius.achilleid,1.954,"hic, solus, pario, ne, quis, tu, barbarum, coniunx",8,"NaN, -0.5, NaN, NaN, NaN, NaN, NaN, -0.5",-0.125,-0.125,"hic, tu, barbarum",0.375
statius.achilleid,1.955,"ne, qui, do, indignus, thetidi, captiuus, nepos",7,"NaN, NaN, NaN, -1.0, NaN, -1.0, 0.0",-0.286,-0.286,"thetidi, captiuus",0.286
statius.achilleid,1.956,"talis, dico, non, ipse, immotus, achilles",6,"NaN, NaN, NaN, NaN, NaN, NaN",nan,nan,achilles,0.167
statius.achilleid,1.957,"solo, iuro, fides, iuro, fleo",5,"NaN, NaN, 1.0, NaN, NaN",0.2,0.0,,0.0
statius.achilleid,1.958,"spondeo, et, ingens, famulo, capio, reuorto",6,"NaN, NaN, -0.5, NaN, NaN, NaN",-0.083,-0.083,,0.0
statius.achilleid,1.959,"ilium, -ne, et, phrygiae, promitto, munus, gaza",7,"NaN, NaN, NaN, NaN, NaN, 0.5, NaN",0.071,0.0,,0.0
statius.achilleid,1.96,"irrito, uentosus, rapio, uerbum, procella",5,"NaN, NaN, NaN, 0.0, NaN",0.0,0.0,,0.0
statius.achilleid,2.1,"exuo, implico, tenebrae, umeo, orbis",5,"NaN, NaN, NaN, NaN, NaN",nan,nan,,0.0
statius.achilleid,2.2,"oceanus, profero, dies, genitor, coruscus",5,"NaN, NaN, 0.0, NaN, NaN",0.0,0.0,,0.0
statius.achilleid,2.3,"lucus, adhuc, hebeto, uicinum, nox, leuo",6,"NaN, NaN, NaN, NaN, 0.0, NaN",0.0,0.0,,0.0
statius.achilleid,2.4,"et, nondum, excutio, roro, lampada, pontus",6,"NaN, NaN, NaN, NaN, NaN, 0.0",0.0,0.0,,0.0
statius.achilleid,2.5,"et, iam, puniceus, nudo, pectus, palla",6,"NaN, NaN, NaN, NaN, NaN, NaN",nan,nan,puniceus,0.167
statius.achilleid,2.6,"insignis, ipse, qui, primus, inuado, arma",6,"0.0, NaN, NaN, 0.5, NaN, 0.0",0.083,0.0,,0.0
statius.achilleid,2.7,"aeacide, -ne, quippe, aura, uoco, cognatus, suadeo",7,"NaN, NaN, NaN, 1.0, NaN, NaN, NaN",0.143,0.0,,0.0
statius.achilleid,2.8,"aequor, prospecto, cunctus, iuuenis, dux",5,"0.0, NaN, 0.0, NaN, 0.5",0.1,0.0,,0.0
statius.achilleid,2.9,"nihil, audeo, memini, paueo, sic, omnis, uideo",7,"NaN, NaN, NaN, NaN, NaN, NaN, NaN",nan,nan,,0.0
statius.achilleid,2.1,"muto, redeo, ceu, numquam, scyria, patior",6,"NaN, NaN, NaN, NaN, NaN, NaN",nan,nan,,0.0
statius.achilleid,2.11,"litus, peliacoque, ratis, escendo, ab, antrum",6,"NaN, NaN, NaN, NaN, NaN, 0.0",0.0,0.0,,0.0
statius.achilleid,2.12,"tunc, ex, mos, deus, ita, namque, moneo, ulixes",8,"NaN, NaN, 0.5, 0.0, NaN, NaN, NaN, NaN",0.062,0.0,,0.0
statius.achilleid,2.13,"aequor, auster, lito, fluctus, sub, ipse",6,"0.0, NaN, NaN, 0.0, NaN, NaN",0.0,0.0,,0.0
statius.achilleid,2.14,"caeruleus, rex, taurus, ueneror, auus",5,"NaN, 0.0, NaN, NaN, NaN",0.0,0.0,,0.0
statius.achilleid,2.15,"nerea, uittatus, genetrix, placo, iuuencus",5,"NaN, NaN, NaN, NaN, NaN",nan,nan,,0.0
statius.achilleid,2.16,"hic, spumo, salum, iacio, tumidus, exta, profor",7,"NaN, NaN, NaN, NaN, -0.5, NaN, NaN",-0.071,-0.071,hic,0.143
statius.achilleid,2.17,"pareo, genetrix, quamquam, haud, tolero, iubeo",6,"NaN, NaN, NaN, NaN, NaN, NaN",nan,nan,,0.0
statius.achilleid,2.18,"pareo, nimium, bellum, ad, troianus, ratis",6,"NaN, 0.0, 0.0, NaN, NaN, NaN",0.0,0.0,,0.0
statius.achilleid,2.19,"argolicas, quaero, is, sic, ordior, et, alnus",7,"NaN, NaN, NaN, NaN, NaN, NaN, NaN",nan,nan,,0.0
statius.achilleid,2.2,"in-sileo, penitus, nosco, strideo, propinquus",5,"NaN, NaN, NaN, NaN, 0.0",0.0,0.0,,0.0
statius.achilleid,2.21,"abripio, terra, et, iam, arduus, duco, nubes",7,"NaN, 0.0, NaN, NaN, NaN, NaN, NaN",0.0,0.0,,0.0
statius.achilleid,2.22,"incipio, et, longus, scyros, discedo, pontus",6,"NaN, NaN, 0.0, NaN, NaN, 0.0",0.0,0.0,,0.0
statius.achilleid,2.23,"turris, procul, summus, lacrima, comito, soror",6,"NaN, NaN, NaN, NaN, NaN, NaN",nan,nan,,0.0
statius.achilleid,2.24,"committo, teneo, et, habeo, nomen, pyrrhum",6,"NaN, NaN, NaN, NaN, 0.0, NaN",0.0,0.0,,0.0
statius.achilleid,2.25,"pendo, coniunx, oculus, in, carbasus, figo",6,"NaN, -0.5, 0.0, NaN, NaN, NaN",-0.083,-0.083,,0.0
statius.achilleid,2.26,"eo, et, ipse, fretus, et, puppis, iam, solus, uideo",9,"NaN, NaN, NaN, 0.5, NaN, NaN, NaN, -0.5, NaN",0.0,-0.056,,0.0
statius.achilleid,2.27,"ille, quoque, obliquus, diligo, ad, moenia, uultus",7,"NaN, NaN, NaN, NaN, NaN, NaN, NaN",nan,nan,,0.0
statius.achilleid,2.28,"declino, uidua, domus, gemo, relinquo",5,"NaN, NaN, 0.0, NaN, NaN",0.0,0.0,uidua,0.2
statius.achilleid,2.29,"cogito, occulo, sub, cor, renascor, ardor",6,"NaN, NaN, NaN, NaN, NaN, NaN",nan,nan,,0.0
statius.achilleid,2.3,"do, locus, uirtus, sentio, laertius, heros",6,"NaN, 0.0, 1.0, NaN, NaN, NaN",0.167,0.0,,0.0
statius.achilleid,2.31,"maereo, et, placidus, aggredior, flecto, dictum",6,"NaN, NaN, 1.0, NaN, NaN, 0.0",0.167,0.0,,0.0
statius.achilleid,2.32,"teneo, inquam, magnus, uastator, debeo, troia",6,"NaN, NaN, 0.0, NaN, NaN, NaN",0.0,0.0,,0.0
statius.achilleid,2.33,"qui, danaae, classis, qui, diuus, oraculum, posco",7,"NaN, NaN, NaN, NaN, 0.0, NaN, NaN",0.0,0.0,classis,0.143
statius.achilleid,2.34,"erigo, maneo, resero, in, limen, bellum",6,"NaN, NaN, NaN, NaN, NaN, 0.0",0.0,0.0,,0.0
statius.achilleid,2.35,"callidus, femineus, genetrix, uiolo, amictus",5,"1.0, -0.5, NaN, NaN, 0.5",0.2,-0.1,"callidus, uiolo",0.4
statius.achilleid,2.36,"committo, ille, tam, grandis, furtum, latebra",6,"NaN, NaN, NaN, 0.0, -1.0, -0.5",-0.25,-0.25,furtum,0.167
statius.achilleid,2.37,"spero, fides, nimis, o, suspendo, nimis",6,"NaN, 1.0, NaN, NaN, NaN, NaN",0.167,0.0,,0.0
statius.achilleid,2.38,"mater, an, hic, taceo, uirtus, torpeo, in, umbra",8,"0.0, NaN, NaN, NaN, 1.0, NaN, NaN, NaN",0.125,0.0,hic,0.125
statius.achilleid,2.39,"qui, uix, audio, litus, clangor, refugio",6,"NaN, NaN, NaN, NaN, NaN, NaN",nan,nan,,0.0
statius.achilleid,2.4,"et, theti, -ne, et, comes, et, qui, supprimo, ignis",9,"NaN, NaN, NaN, NaN, NaN, NaN, NaN, NaN, 0.0",0.0,0.0,theti,0.111
statius.achilleid,2.41,"neque, nos, sum, qui, in, arma, uenio, sequor, preco",9,"NaN, NaN, NaN, NaN, NaN, 0.0, NaN, NaN, NaN",0.0,0.0,,0.0
statius.achilleid,2.42,"uenio, dico, qui, talis, occupo, heros",6,"NaN, NaN, NaN, NaN, NaN, NaN",nan,nan,,0.0
statius.achilleid,2.43,"aeacius, longus, resideo, expono, causa",5,"NaN, 0.0, NaN, NaN, 0.0",0.0,0.0,,0.0
statius.achilleid,2.44,"maternus, nefas, hic, excuso, ensis",5,"NaN, -1.0, NaN, NaN, NaN",-0.2,-0.2,"nefas, hic",0.4
statius.achilleid,2.45,"scyros, et, indecoro, fatum, crimen, cultus",6,"NaN, NaN, NaN, 0.0, -1.0, -0.5",-0.25,-0.25,crimen,0.167
statius.achilleid,2.46,"tu, potis, dum, lenis, fretus, zephyroque, fruor",7,"NaN, 0.0, NaN, 1.0, 0.5, NaN, NaN",0.214,0.0,tu,0.143
statius.achilleid,2.47,"carbasus, qui, danais, tantus, primordius, bellum",6,"NaN, NaN, NaN, NaN, NaN, 0.0",0.0,0.0,,0.0
statius.achilleid,2.48,"edo, libet, iustus, hinc, sumo, protinus, ira",7,"NaN, NaN, 1.0, NaN, NaN, NaN, -1.0",0.0,-0.143,,0.0
statius.achilleid,2.49,"hic, ithacus, paulus, repeto, longus, ordior",6,"NaN, NaN, NaN, NaN, 0.0, NaN",0.0,0.0,hic,0.167
statius.achilleid,2.5,"fero, in, hectorea, si, talis, credo, ida",7,"NaN, NaN, NaN, NaN, NaN, NaN, NaN",nan,nan,,0.0
statius.achilleid,2.51,"eligo, forma, certamen, soluo, pastor",5,"NaN, 1.0, 0.5, NaN, NaN",0.3,0.0,,0.0
statius.achilleid,2.52,"sollicitus, teneo, dea, neque, toruus, mineruae",6,"-1.0, NaN, NaN, NaN, NaN, NaN",-0.167,-0.167,,0.0
statius.achilleid,2.53,"os, neque, aetherius, socia, rector, amicus",6,"0.0, NaN, NaN, NaN, NaN, 1.0",0.167,0.0,,0.0
statius.achilleid,2.54,"lumen, sed, solus, nimium, uideo, dio, -ne",7,"NaN, NaN, -0.5, 0.0, NaN, NaN, NaN",-0.071,-0.071,,0.0
statius.achilleid,2.55,"atque, adeo, lis, ille, tuus, exorior, sub, antrum",8,"NaN, NaN, -0.5, NaN, 0.0, NaN, NaN, 0.0",-0.062,-0.062,,0.0
statius.achilleid,2.56,"concilio, superi, dum, pelea, dulcis, marito",6,"NaN, NaN, NaN, NaN, 0.5, NaN",0.083,0.0,marito,0.167
statius.achilleid,2.57,"pelion, et, noster, iam, tunc, promitto, arma",7,"NaN, NaN, NaN, NaN, NaN, NaN, 0.0",0.0,0.0,,0.0
statius.achilleid,2.58,"ira, quatio, uinco, peto, exitialis, iudex",6,"-1.0, NaN, NaN, NaN, -1.0, 0.5",-0.25,-0.333,,0.0
statius.achilleid,2.59,"praemium, raptor, facilis, monstro, amyclae",5,"1.0, NaN, 0.5, NaN, NaN",0.3,0.0,raptor,0.2
statius.achilleid,2.6,"ille, phrygas, lucus, mater, penetralis, caedo",6,"NaN, NaN, NaN, 0.0, NaN, NaN",0.0,0.0,,0.0
statius.achilleid,2.61,"turrigerae, uereor, solum, procumbo, pinus",5,"NaN, NaN, 0.0, NaN, 0.0",0.0,0.0,,0.0
statius.achilleid,2.62,"praecipio, terra, fretus, defero, achaeas",5,"NaN, 0.0, 0.5, NaN, NaN",0.1,0.0,,0.0
statius.achilleid,2.63,"hospes, atridae, pudeo, heu, misero, possum",6,"0.0, NaN, NaN, NaN, NaN, NaN",0.0,0.0,"pudeo, heu, misero",0.5
statius.achilleid,2.64,"europae, spolio, thalamus, helenaque, superbus",5,"NaN, NaN, NaN, NaN, -1.0",-0.2,-0.2,,0.0
statius.achilleid,2.65,"nauigo, et, capio, ad, pergama, deueho, argos",7,"NaN, NaN, NaN, NaN, NaN, NaN, NaN",nan,nan,pergama,0.143
statius.achilleid,2.66,"inde, do, passim, uario, rumor, per, urbs",7,"NaN, NaN, NaN, NaN, NaN, NaN, 0.5",0.071,0.0,,0.0
statius.achilleid,2.67,"undique, inexcitus, sui, quisque, et, sponte, coeo",7,"NaN, NaN, NaN, NaN, NaN, NaN, NaN",nan,nan,,0.0
statius.achilleid,2.68,"ultor, quis, enim, illicitus, genialia, rumpo",6,"NaN, NaN, NaN, -1.0, NaN, NaN",-0.167,-0.167,"ultor, illicitus",0.333
