Text,Stelle,Inahlt,Wortzahl,Sentiment Rechnung,Sentiment-Score,alternativer Sentiment-Score,Invektiven,Invektivitäts-Score
tibullus.elegies,1.1,"diuitiae, alius, fuluus, sui, congero, aurum, et, teneo, colo, iugerum, multus, solus, qui, labor, assiduus, uicinus, terreo, hostis, martia, qui, somnus, classicus, pello, fugo, ego, meus, paupertas, uito, traduco, iners, dum, meus, assiduus, luceo, ignis, focus, ipse, sero, tener, maturo, tempus, uito, rusticus, et, facilis, grandis, pomum, manus, neque, spes, destituo, sed, frugum, semper, aceruus, praebeo, et, plenus, pinguis, mustus, lacus, nam, ueneror, seu, stipo, habeo, desero, in, ager, seu, uetus, in, triuius, floridus, sero, lapis, et, quicumque, ego, pomum, nouus, educo, annus, libo, agricola, pono, ante, deus, flauus, cero, tu, sum, noster, de, rus, corona, spiceus, qui, templum, pendeo, ante, foris, pomosus, ruber, custos, pono, in, hortus, terreo, ut, saeuus, falx, priapus, aueo, tu, quoque, felix, quondam, nunc, pauper, ager, custos, fero, munus, uester, lar, tunc, uitula, innumerus, lustro, caedo, iuuencus, nunc, agna, exiguus, sum, hostia, paruus, solus, agna, cado, tu, quam, circum, rusticus, pubes, clamo, io, messis, et, bonus, uinum, do, iam, modo, iam, possum, contineo, uiuo, paruus, neque, semper, longus, dedo, sum, uia, sed, canis, aestiuus, ortus, uitaris, sub, umbra, arbor, ad, riuus, praetereo, aqua, neque, tamen, interdum, pudeo, teneo, bidens, aut, stimulo, tardus, increpo, bos, non, agna, sinus, pigeo, fetus, capella, desertum, obliuiscor, mater, refero, domus, at, tu, exiguus, pecus, furo, lupus, parco, de, magnus, sum, praeda, peto, grex, hic, ego, pastor, meus, lustraris, quot, et, placidus, soleo, spargo, lac, pal, adsum, diuus, neu, tu, e, pauper, mensa, donum, neque, e, purus, sperno, fictilis, fictilia, antiquus, primus, sui, facio, agrestis, poculum, de, facilis, con-pono, lutum, non, ego, diuitiae, pater, fruor, requiro, qui, fero, antiquus, condio, messis, auus, paruus, seges, satis, sum, satis, requiesco, lectus, si, licet, et, soleo, membrum, leuaris, torus, quam, iuuo, immitis, uenio, audio, cubo, et, domina, tener, contineo, sinus, aut, gelidus, hibernus, aqua, cum, fundo, auster, securus, somnus, ignis, iuuo, sequor, hic, ego, contingo, sum, diues, ius, furor, qui, mare, et, tristis, fero, possum, pluuia, o, quantus, sum, aurum, pereo, potis, smaragdus, quam, fleo, ob, noster, ullus, puella, uia, tu, bellaris, decet, terra, messalla, mare, ut, domus, hostilis, praefero, exuuiae, ego, retineo, uincio, formosus, uinclum, puella, et, sedeo, duro, ianitor, ante, foris, non, ego, laudo, curo, meus, de_-lio, cum, tu, dum, modo, sum, quaeso, segnis, iners, uoco, tu, specto, superus, ego, cum, uenio, hora, tu, teneo, morior, deficio, manus, fleo, et, ardeo, pono, ego, de_-lio, lectus, tristis, et, lacrima, osculum, misceo, do, fleo, non, tuus, sum, durus, praecordia, ferrum, uincio, neque, in, tener, sto, tu, cor, silex, ille, non, iuuenis, possum, de, funus, quisquam, lumen, non, uirgo, sicco, refero, domus, tu, manes, ne, laedo, meus, sed, parco, soluo, crinis, et, teneo, de_-lio, parco, gena, interea, dum, fatum, sino, iungo, amor, iam, uenio, tenebrae, mors, adoperio, caput, iam, sub-repo, iners, aetas, neque, amo, decet, dico, neque, cano, blanditia, caput, nunc, leuis, sum, tracto, uenus, dum, frango, postis, non, pudeo, et, rixo, insero, iuuo, hic, ego, dux, miles, bonus, tu, signum, tuba, eo, procul, cupidus, uulnero, fero, uis, fero, et, ops, ego, compositum, securus, aceruus, despicio, diues, despicio, fames",494,"0.5, NaN, NaN, NaN, NaN, 0.5, NaN, NaN, NaN, NaN, 0.0, -0.5, NaN, -0.5, 0.5, 0.0, NaN, -1.0, NaN, NaN, 0.5, NaN, NaN, NaN, NaN, 0.0, -1.0, NaN, NaN, 0.0, NaN, 0.0, 0.5, NaN, 0.0, 0.0, NaN, NaN, NaN, NaN, 0.0, NaN, -0.5, NaN, 0.5, 0.0, 0.0, 0.0, NaN, 0.5, NaN, NaN, NaN, NaN, NaN, NaN, NaN, 0.0, NaN, NaN, 0.0, NaN, NaN, NaN, NaN, NaN, NaN, NaN, 0.0, NaN, 0.0, NaN, NaN, NaN, NaN, 0.0, NaN, NaN, NaN, 0.0, 1.0, NaN, 0.0, NaN, NaN, NaN, NaN, 0.0, NaN, NaN, NaN, NaN, NaN, NaN, 0.0, NaN, NaN, NaN, NaN, NaN, NaN, NaN, NaN, NaN, NaN, NaN, NaN, NaN, NaN, NaN, -1.0, NaN, NaN, NaN, NaN, NaN, 1.0, NaN, NaN, -1.0, 0.0, NaN, NaN, 0.5, NaN, NaN, NaN, NaN, NaN, NaN, NaN, NaN, NaN, 0.0, 0.0, NaN, NaN, 0.0, -0.5, 0.0, NaN, NaN, NaN, NaN, -0.5, NaN, NaN, NaN, NaN, NaN, 1.0, NaN, NaN, NaN, NaN, NaN, NaN, NaN, NaN, 0.0, NaN, NaN, 0.0, NaN, NaN, 0.0, NaN, NaN, NaN, NaN, NaN, NaN, NaN, NaN, NaN, NaN, NaN, 0.0, NaN, NaN, NaN, NaN, NaN, NaN, NaN, NaN, NaN, NaN, NaN, NaN, 0.0, NaN, NaN, NaN, NaN, NaN, NaN, 0.0, NaN, 0.0, NaN, NaN, 0.0, NaN, NaN, 0.0, NaN, NaN, 0.0, NaN, NaN, NaN, NaN, NaN, NaN, NaN, 0.0, NaN, NaN, NaN, 1.0, NaN, NaN, NaN, NaN, NaN, 0.0, NaN, NaN, NaN, -1.0, 0.0, 0.0, NaN, NaN, 1.0, NaN, NaN, NaN, 0.0, 0.5, NaN, NaN, NaN, NaN, NaN, 0.5, NaN, -0.5, NaN, NaN, 0.5, 0.0, NaN, NaN, NaN, NaN, 0.0, NaN, NaN, NaN, 0.0, NaN, 0.5, NaN, 0.5, NaN, 0.0, NaN, NaN, NaN, NaN, NaN, NaN, NaN, NaN, NaN, -1.0, NaN, NaN, NaN, NaN, NaN, NaN, NaN, NaN, NaN, NaN, NaN, 0.0, NaN, NaN, NaN, 1.0, 0.5, 0.0, NaN, NaN, NaN, NaN, NaN, NaN, 0.5, 0.5, -1.0, NaN, 0.0, NaN, -1.0, NaN, NaN, NaN, NaN, NaN, NaN, 0.5, NaN, 0.0, NaN, NaN, NaN, NaN, NaN, NaN, NaN, 0.0, NaN, NaN, NaN, 0.0, NaN, 0.0, NaN, 0.0, -1.0, NaN, NaN, NaN, NaN, NaN, 1.0, NaN, NaN, NaN, NaN, NaN, NaN, NaN, NaN, NaN, NaN, NaN, NaN, 0.0, NaN, NaN, NaN, NaN, NaN, NaN, NaN, NaN, 0.0, NaN, NaN, NaN, NaN, NaN, NaN, NaN, NaN, NaN, NaN, NaN, NaN, 0.0, NaN, NaN, NaN, NaN, NaN, NaN, 0.0, -1.0, NaN, NaN, 0.0, NaN, NaN, NaN, NaN, 0.0, NaN, -0.5, NaN, NaN, NaN, NaN, NaN, NaN, NaN, NaN, NaN, NaN, NaN, NaN, NaN, NaN, NaN, -0.5, NaN, NaN, NaN, NaN, NaN, NaN, 0.0, NaN, NaN, NaN, NaN, 0.0, NaN, NaN, NaN, NaN, NaN, NaN, NaN, NaN, NaN, NaN, NaN, 0.0, NaN, NaN, 1.0, NaN, NaN, NaN, -1.0, NaN, 0.0, NaN, NaN, 0.0, 0.0, NaN, NaN, NaN, NaN, NaN, NaN, 0.5, 0.0, NaN, 0.0, NaN, NaN, 1.0, NaN, NaN, NaN, NaN, NaN, NaN, NaN, NaN, NaN, NaN, NaN, 0.5, 0.0, 1.0, NaN, 0.0, NaN, NaN, NaN, -0.5, NaN, NaN, 1.0, NaN, NaN, 0.0, NaN, NaN, 1.0, NaN, NaN, 0.5, NaN, -0.5",0.012,-0.032,"iners, tu, saeuus, tu, agna, hostia, agna, tu, pudeo, stimulo, increpo, agna, capella, tu, furo, hic, tu, fictilis, immitis, hic, furor, tu, hostilis, uinclum, de_-lio, tu, iners, tu, tu, de_-lio, tu, uirgo, tu, de_-lio, gena, iners, blanditia, pudeo, hic, tu",0.081
tibullus.elegies,1.2,"addo, merus, uinum, noui, conpesce, dolor, occupo, ut, fatisco, lumen, uinco, sopor, neu, quisquam, multus, percutio, tempus, baccho, excito, infelix, dum, requiesco, amor, nam, pono, sum, noster, custodia, saeuus, puella, claudo, et, durus, ianua, firmo, serus, ianua, difficilis, dominus, tu, uerbero, imber, tu, io, imperium, fulmen, mitto, peto, ianua, iam, pateo, unus, ego, uinco, querela, neu, furtim, uerso, cardo, apertus, sono, et, malus, siqua, tu, dico, dementia, noster, ignosco, caput, sum, precor, ille, meus, tu, memini, decet, qui, multus, uox, perago, supplex, cum, pono, floridus, sero, do, tu, quoque, ne, timidus, custos, de_-lio, fallo, audeo, sum, fortis, adiuuo, ipse, uenus, ille, faueo, seu, quis, iuuenis, nouo, limen, tento, seu, resero, figo, dens, puella, foris, ille, doceo, mollis, furtim, derepo, lectus, ille, pedis, nullus, pono, possum, sonus, ille, uir, coram, nutus, confero, loquax, blandus, compositum, abdo, uerbum, nosco, neque, doceo, hic, omnis, sed, qui, neque, inertia, tardo, neque, ueto, obscurus, surgo, nox, timor, en, ego, cum, tenebrae, totus, uago, anxius, urbs, neque, sino, occurro, quisquam, qui, corpus, ferrum, uulnero, aut, rapio, praemium, uestis, peto, quisquis, amor, teneo, eo, tueor, sacer, qualibet, insidiae, non, timeo, decet, non, ego, piger, noceo, hibernus, frigus, nox, non, ego, cum, multus, decido, imber, aqua, non, labor, hic, laedo, resero, modo, de_-lio, postis, et, uoco, ad, digitus, ego, taciturnus, sonus, parco, lumen, seu, uir, seu, femina, fio, obuius, celaris, uolo, suus, furtum, uenus, neu, strepitus, terreo, pes, neu, quaero, nomen, neu, prope, fulgeo, lumen, fero, fax, siquis, et, imprudens, ad-specio, occulo, ille, per, deus, omnis, sui, memini, nego, nam, sum, quicumque, loquax, is, sanguis, nata, is, uenerem, e, rapidus, sentio, sum, mare, neque, tamen, hic, credo, coniunx, tuus, ut, ego, uerax, polliceor, sum, magicus, sagum, ministerium, hic, ego, de, caelum, duco, sidus, uideo, flumen, hic, rapidus, carmen, uerto, iter, hic, cantus, findo, solus, maneo, sepulcrum, elicio, et, tepidus, deuoco, os, rogo, iam, teneo, infernus, magicus, stridor, caterua, iam, iubeo, adspersas, lac, refero, pedis, cum, libet, hic, tristis, depello, nubila, caelum, cum, libet, aestiuus, conuoco, orbis, nix, solus, teneo, mala, medeae, dico, herba, solus, ferus, hecates, perdomo, canis, hic, ego, con-pono, cantus, quis, fallo, possum, ter, canis, ter, dictum, despuo, carmen, ille, nihil, possum, de, nos, credo, quisquam, non, sui, si, in, mollis, uideo, ipse, torus, tu, tamen, abstineo, alius, nam, ceterus, cerno, omnis, de, ego, unus, sentio, ipse, nihil, quis, credo, nempe, hic, idem, sui, dico, amor, cantus, aut, herba, soluo, possum, meus, et, ego, lustro, taeda, et, nox, serenus, concido, ad, magicus, hostia, pullo, deus, non, ego, totus, absum, amor, sed, mutuus, sum, oro, neque, tu, possum, careo, uolo, ferreus, ille, sum, qui, tu, cum, possum, habeo, malo, praeda, stultus, et, arma, sequor, ille, licet, cilicum, uinco, ago, ante, caterua, pono, et, in, capio, martia, castrum, solum, totus, et, argentum, contexo, totus, et, aurum, insideo, celer, conspicio, equus, ipse, bos, meus, si, cum, tu, modo, de_-lio, possum, iungo, et, in, soleo, pasco, mons, pecus, et, tu, dum, licet, teneo, retineo, lacertus, mollio, et, incultus, sum, ego, somnus, humo, quis, tyrio, recubaris, torus, sine, amor, secundus, prodo, cum, fleo, nox, uigilo, uenio, nam, neque, tum, pluma, neque, stragula, pingo, sopor, neque, sono, placidus, duco, possum, aqua, num, uenio, magnus, uiolo, numen, uerbum, et, meus, nunc, poena, impius, lingua, luo, num, fero, incestus, sedes, adeo, deus, sero, de, sanctus, deripio, focus, non, ego, si, mereo, dubito, procumbo, templum, et, do, sacro, osculum, limen, non, ego, tellus, genu, perrepo, supplex, et, miser, sancio, tundo, postis, caput, at, tu, qui, laetus, rideo, malus, noster, caueto, mox, tu, non, unus, saeuio, usque, deus, uideo, ego, qui, iuuenis, miser, ludo, amor, post, uenio, uinclum, subdo, collum, senex, et, sui, blanditia, tremulus, con-pono, uox, et, manus, cano, fingo, uolo, como, sto, neque, ante, foris, pudeo, carus, puella, ancilla, medium, detineo, forum, hic, puer, hic, iuuenis, turba, circumtero, artus, despuo, in, mollis, et, sui, quisque, sinus, at, ego, parco, uenus, semper, tu, dedo, seruio, mens, meus, quis, messis, uro, acerbus, tuus",647,"NaN, NaN, NaN, NaN, NaN, -1.0, NaN, NaN, NaN, NaN, NaN, NaN, NaN, NaN, 0.0, NaN, 0.0, NaN, NaN, -1.0, NaN, NaN, 1.0, NaN, NaN, NaN, NaN, NaN, -1.0, NaN, NaN, NaN, -0.5, NaN, NaN, NaN, NaN, -0.5, NaN, NaN, NaN, NaN, NaN, NaN, 0.0, NaN, NaN, NaN, NaN, NaN, NaN, NaN, NaN, NaN, -0.5, NaN, NaN, NaN, NaN, NaN, NaN, NaN, -1.0, NaN, NaN, NaN, -1.0, NaN, NaN, 0.0, NaN, NaN, NaN, 0.0, NaN, NaN, NaN, NaN, 0.0, 0.0, NaN, 0.0, NaN, NaN, NaN, NaN, NaN, NaN, NaN, NaN, -0.5, NaN, NaN, NaN, NaN, NaN, 0.5, NaN, NaN, 1.0, NaN, NaN, NaN, NaN, NaN, NaN, NaN, NaN, NaN, NaN, NaN, NaN, NaN, NaN, NaN, NaN, NaN, NaN, NaN, 0.0, NaN, 0.0, NaN, NaN, NaN, NaN, NaN, 0.5, NaN, NaN, NaN, NaN, 0.5, NaN, NaN, 0.0, NaN, NaN, NaN, NaN, NaN, NaN, NaN, NaN, 0.0, NaN, NaN, NaN, NaN, NaN, 0.0, -0.5, NaN, NaN, NaN, NaN, NaN, NaN, -1.0, 0.5, NaN, NaN, NaN, NaN, NaN, 0.0, NaN, NaN, NaN, NaN, 1.0, NaN, NaN, NaN, 1.0, NaN, NaN, NaN, 1.0, NaN, NaN, NaN, NaN, NaN, NaN, NaN, NaN, NaN, NaN, NaN, 0.0, NaN, NaN, NaN, 0.0, NaN, NaN, 0.0, NaN, -0.5, NaN, NaN, NaN, NaN, NaN, NaN, NaN, NaN, NaN, NaN, NaN, 0.0, NaN, NaN, NaN, NaN, 0.5, NaN, 0.0, NaN, -0.5, NaN, NaN, NaN, -1.0, 1.0, NaN, NaN, NaN, 0.0, NaN, NaN, 0.0, NaN, NaN, NaN, NaN, NaN, NaN, NaN, NaN, -0.5, NaN, NaN, NaN, NaN, 0.0, NaN, NaN, NaN, NaN, NaN, NaN, NaN, NaN, NaN, NaN, NaN, NaN, NaN, NaN, NaN, NaN, NaN, 0.0, NaN, NaN, NaN, NaN, -0.5, 0.0, NaN, NaN, NaN, NaN, NaN, NaN, NaN, 0.0, NaN, NaN, NaN, 0.5, NaN, NaN, NaN, NaN, NaN, NaN, 0.0, NaN, 0.0, NaN, 0.0, NaN, -0.5, NaN, NaN, NaN, NaN, NaN, NaN, 0.0, NaN, NaN, NaN, NaN, NaN, NaN, NaN, NaN, NaN, NaN, NaN, NaN, 0.0, NaN, NaN, NaN, -1.0, NaN, NaN, 0.5, NaN, NaN, NaN, NaN, NaN, NaN, -0.5, NaN, NaN, NaN, NaN, NaN, -0.5, -1.0, NaN, NaN, NaN, NaN, NaN, NaN, 0.0, NaN, NaN, NaN, NaN, NaN, NaN, 0.0, NaN, 0.0, NaN, NaN, NaN, NaN, NaN, NaN, NaN, NaN, NaN, NaN, NaN, NaN, NaN, NaN, NaN, NaN, NaN, NaN, NaN, NaN, 0.0, NaN, NaN, NaN, NaN, NaN, NaN, NaN, NaN, NaN, NaN, NaN, NaN, NaN, NaN, NaN, 1.0, 0.0, NaN, NaN, NaN, NaN, 0.0, NaN, NaN, NaN, NaN, NaN, 0.0, NaN, NaN, NaN, NaN, NaN, NaN, 0.0, NaN, NaN, NaN, NaN, 1.0, NaN, 0.0, NaN, NaN, NaN, NaN, NaN, NaN, NaN, NaN, NaN, NaN, NaN, NaN, NaN, NaN, NaN, NaN, NaN, -1.0, NaN, 0.0, NaN, NaN, NaN, NaN, NaN, NaN, NaN, NaN, NaN, NaN, NaN, NaN, NaN, NaN, 0.0, NaN, NaN, NaN, NaN, NaN, NaN, 0.5, NaN, NaN, NaN, NaN, NaN, NaN, 0.0, NaN, NaN, NaN, NaN, NaN, NaN, NaN, NaN, NaN, NaN, NaN, NaN, NaN, NaN, NaN, NaN, NaN, NaN, NaN, NaN, NaN, NaN, -0.5, NaN, NaN, 0.5, NaN, NaN, NaN, NaN, NaN, NaN, 1.0, 0.0, NaN, NaN, NaN, 0.0, NaN, NaN, NaN, NaN, NaN, NaN, NaN, NaN, NaN, NaN, NaN, NaN, 1.0, NaN, NaN, 0.0, NaN, NaN, 0.0, NaN, NaN, 0.0, NaN, 0.0, NaN, -1.0, -1.0, -0.5, NaN, NaN, NaN, NaN, 0.0, NaN, 0.0, NaN, NaN, 1.0, NaN, 0.0, NaN, NaN, NaN, NaN, NaN, NaN, NaN, NaN, NaN, NaN, 0.0, NaN, NaN, NaN, NaN, NaN, NaN, 0.0, NaN, -1.0, NaN, NaN, NaN, 0.0, NaN, NaN, NaN, 1.0, NaN, -1.0, NaN, NaN, NaN, NaN, NaN, NaN, NaN, NaN, 0.0, NaN, NaN, NaN, NaN, -1.0, NaN, 1.0, NaN, NaN, NaN, NaN, NaN, 0.0, NaN, NaN, 0.5, NaN, NaN, 0.0, NaN, 0.0, NaN, NaN, NaN, NaN, NaN, NaN, NaN, NaN, NaN, 1.0, NaN, 0.0, NaN, NaN, NaN, NaN, 0.0, NaN, NaN, 0.0, NaN, NaN, NaN, NaN, NaN, NaN, NaN, NaN, NaN, NaN, NaN, NaN, 1.0, NaN, NaN, NaN, NaN, 0.5, 0.0, NaN, NaN, NaN, -1.0, 0.0",-0.004,-0.036,"infelix, saeuus, tu, uerbero, tu, tu, tu, tu, timidus, de_-lio, fallo, hic, inertia, uestis, insidiae, noceo, hic, de_-lio, furtum, fax, hic, hic, hic, hic, sepulcrum, hic, ferus, hic, fallo, tu, hic, taeda, hostia, tu, tu, stultus, tu, de_-lio, tu, recubaris, uiolo, poena, impius, luo, incestus, miser, tu, tu, saeuio, miser, uinclum, blanditia, fingo, pudeo, ancilla, hic, hic, tu, acerbus",0.091
tibullus.elegies,1.3,"eo, aegaeas, sine, ego, messalla, per, unda, o, utinam, memor, ipse, cohors, meus, ego, teneo, ignosco, aeger, phaeacia, terra, abstineo, auidus, mors, modo, niger, manus, abstineo, mors, ater, precor, non, hic, ego, mater, qui, lego, in, maestus, os, peruro, sinus, non, soror, assyrios, cinis, qui, dedo, odoro, et, fleo, effundo, ante, sepulcrum, como, de_-lio, non, usquam, qui, ego, cum, mitto, urbs, dico, ante, omnis, consulo, deus, ille, sacer, puer, sors, ter, tollo, ille, refero, e, terni, omen, certus, puer, cunctus, do, redeo, tamen, sum, deterreo, numquam, quin, fleo, noster, respicio, uia, ipse, ego, solator, cum, iam, mandatum, do, quaero, tardus, anxius, usque, mora, aut, ego, sum, causor, aueo, aut, omen, dirus, saturnus, sacer, ego, teneo, dies, o, quotiens, ingredior, iter, ego, tristis, dico, offendo, in, porto, signum, do, pedis, audeo, inuito, ne, quis, discedo, amor, aut, scio, egredior, sui, prohibeo, deus, quis, tuus, nunc, isis, ego, de_-lio, quis, ego, prosum, ille, tuus, totiens, aes, repello, manus, quis, pius, dum, sacer, colo, purus, lauaris, tu, memini, et, purus, secubo, torus, nunc, dea, nunc, succurro, ego, nam, possum, medeor, pingo, doceo, templum, multus, tabella, tuus, ut, meus, uotiuus, persoluo, de_-lio, uoco, ante, sacer, linus, tectum, foris, sedeo, bis, dies, resoluo, como, tu, dico, laus, insignis, turba, debeo, in, pharia, at, ego, contingo, patrius, celebraris, penates, reddo, antiquus, menstruus, tus, laris, quam, bene, saturno, uiuo, rex, priusquam, tellus, in, longus, sum, patefacio, uia, nondum, caeruleus, pinus, contemno, unda, effundo, uenio, praebeo, sinum, neque, uagus, ignosco, repeto, conpendia, terra, premo, externus, nauta, merce, ratis, ille, non, ualidus, subeo, iugum, tempus, taurus, non, domo, freni, os, mordeo, equus, non, domus, ullus, foris, habeo, non, figo, in, ager, qui, rego, certus, finis, aruum, lapis, ipse, mel, do, quercus, ulter, fero, obuius, securis, uber, lac, ouo, non, acies, non, ira, sum, non, bellum, neque, ensis, immitis, saeuus, duco, ars, faber, nunc, io, sub, dominus, caedes, et, uulnero, semper, nunc, mare, nunc, letum, mille, repens, uia, parco, pater, timidus, non, ego, periurium, terreo, non, dictum, in, sancio, impius, uerbum, deus, quodsi, fatal, iam, nunc, ex-pleo, annus, facio, lapis, inscribo, sto, super, os, nosco, hic, iaceo, immitis, consumo, mors, tibullus, messallam, terra, dum, sequor, mare, sed, ego, qui, facilis, tener, sum, semper, amor, ipse, uenus, campus, duco, in, elysios, hic, chorea, cano, uigeo, passim, uago, dulcis, sono, tenuis, guttur, carmen, aueo, fero, casia, non, colo, seges, totus, per, ager, floreo, odoro, terra, benignus, rodo, atque, iuuenis, series, teneo, immixtus, puella, ludo, et, assiduus, proelio, misceo, amor, illic, sum, quicumque, rapax, mors, uenio, amo, et, gero, insignio, myrteus, sero, coma, at, scelero, iaceo, sedes, in, nox, profundus, abdo, quam, circum, flumen, niger, sono, tisiphoneque, impexus, ferus, pro, crinis, anguis, saeuio, et, huc, illic, impius, turba, fugio, tum, niger, in, porto, serpens, cerberus, os, strideo, et, aeratus, excubo, ante, foris, illic, iuno, tento, ixio, audeo, uerso, celer, noxius, membrum, rota, porrigo, nouo, tityos, per, iugerum, terra, assiduus, ater, uisco, pasco, aueo, tantalus, sum, illic, et, circum, stagnum, sed, acer, iam, iam, poturi, desero, unda, sitis, et, danai, proles, uenio, qui, numen, laedo, in, cauo, lethaeas, dolium, porto, aqua, illic, sum, quicumque, meus, uiolo, amor, opto, lentus, et, ego, militia, at, tu, castus, precor, maneo, sancio, pudor, assideo, custos, sedulus, semper, anus, hic, tu, fabella, refero, pono, lucerna, deduco, plenus, stamen, longus, colu, at, circa, grauis, pendo, affigo, puella, paulatim, somnus, fessus, remitto, opus, tum, uenio, subeo, neque, quisquam, nuntio, ante, sed, uideo, caelum, mitto, adsum, tu, tunc, ego, qualis, sum, longus, turbo, capillus, obuius, nudo, de_-lio, curro, pes, hic, precor, hic, ille, nos, aurora, niteo, lucifer, roseus, candidus, porto, equus",589,"NaN, NaN, NaN, NaN, NaN, NaN, 0.0, NaN, NaN, 1.0, NaN, NaN, 0.0, NaN, NaN, NaN, -1.0, NaN, 0.0, NaN, NaN, -1.0, NaN, NaN, 0.0, NaN, -1.0, NaN, NaN, NaN, NaN, NaN, 0.0, NaN, NaN, NaN, -1.0, 0.0, NaN, NaN, NaN, NaN, NaN, NaN, NaN, NaN, NaN, NaN, NaN, NaN, NaN, NaN, NaN, NaN, NaN, NaN, NaN, NaN, NaN, NaN, 0.5, NaN, NaN, NaN, NaN, 0.0, NaN, 1.0, 0.0, -1.0, NaN, NaN, NaN, NaN, NaN, NaN, NaN, 0.5, 0.0, 0.0, NaN, NaN, NaN, NaN, NaN, NaN, NaN, NaN, NaN, NaN, 0.0, NaN, NaN, NaN, NaN, NaN, NaN, NaN, NaN, NaN, -1.0, NaN, NaN, NaN, NaN, NaN, NaN, NaN, NaN, NaN, -1.0, NaN, 1.0, NaN, NaN, 0.0, NaN, NaN, NaN, 0.0, NaN, -1.0, NaN, NaN, NaN, NaN, 0.0, NaN, 0.0, NaN, NaN, NaN, NaN, NaN, 1.0, NaN, NaN, NaN, NaN, NaN, 0.0, NaN, 0.0, NaN, NaN, NaN, NaN, NaN, NaN, NaN, NaN, 0.0, NaN, NaN, NaN, 0.0, NaN, NaN, NaN, 1.0, NaN, 1.0, NaN, NaN, NaN, NaN, 1.0, NaN, NaN, NaN, NaN, NaN, NaN, NaN, NaN, NaN, NaN, NaN, NaN, NaN, 0.0, 0.0, 0.0, NaN, 0.0, 0.0, NaN, NaN, NaN, NaN, 1.0, NaN, NaN, NaN, NaN, NaN, 0.0, NaN, NaN, NaN, NaN, 1.0, 0.0, 0.0, NaN, NaN, NaN, NaN, NaN, NaN, 0.0, NaN, NaN, NaN, 0.0, NaN, NaN, NaN, NaN, NaN, NaN, NaN, 0.0, NaN, NaN, NaN, 0.0, NaN, NaN, 0.0, NaN, NaN, 0.0, NaN, 0.0, NaN, NaN, NaN, NaN, NaN, NaN, NaN, NaN, NaN, 0.0, NaN, 0.0, NaN, NaN, NaN, NaN, NaN, 1.0, NaN, NaN, 0.0, NaN, NaN, NaN, NaN, 0.0, NaN, NaN, NaN, 0.0, NaN, NaN, NaN, NaN, NaN, NaN, 0.0, NaN, NaN, 0.5, 0.0, NaN, 0.0, NaN, NaN, NaN, NaN, NaN, NaN, -0.5, NaN, 1.0, NaN, NaN, NaN, 0.0, NaN, -1.0, NaN, NaN, 0.0, NaN, NaN, -1.0, -1.0, NaN, 0.0, 0.0, NaN, NaN, NaN, NaN, -0.5, NaN, NaN, NaN, NaN, 0.0, NaN, -1.0, NaN, 0.0, 0.0, NaN, 0.0, -0.5, NaN, NaN, -1.0, NaN, NaN, 0.0, NaN, NaN, -1.0, 0.0, 0.0, NaN, NaN, NaN, NaN, NaN, 0.0, NaN, 0.0, NaN, NaN, NaN, 0.0, NaN, NaN, NaN, -1.0, NaN, -1.0, NaN, NaN, 0.0, NaN, NaN, 0.0, NaN, NaN, NaN, 0.5, NaN, NaN, NaN, 1.0, NaN, 1.0, 0.0, NaN, NaN, NaN, NaN, NaN, NaN, NaN, NaN, NaN, 0.5, NaN, 0.0, NaN, 0.0, NaN, NaN, NaN, NaN, NaN, NaN, NaN, NaN, 0.0, NaN, NaN, 0.0, 1.0, NaN, NaN, NaN, 0.5, NaN, NaN, NaN, NaN, NaN, 0.5, NaN, NaN, 1.0, NaN, NaN, NaN, NaN, -1.0, NaN, NaN, NaN, NaN, NaN, NaN, NaN, NaN, NaN, NaN, NaN, 0.0, NaN, 0.0, NaN, NaN, NaN, NaN, NaN, NaN, NaN, NaN, NaN, -1.0, NaN, NaN, NaN, NaN, NaN, NaN, NaN, -1.0, 0.0, NaN, NaN, NaN, NaN, NaN, NaN, NaN, 0.0, NaN, NaN, NaN, NaN, NaN, NaN, NaN, NaN, NaN, NaN, NaN, NaN, NaN, 0.5, NaN, NaN, NaN, NaN, NaN, NaN, NaN, 0.0, 0.5, NaN, NaN, NaN, NaN, NaN, NaN, NaN, NaN, NaN, NaN, NaN, NaN, NaN, NaN, NaN, NaN, 0.0, -0.5, NaN, NaN, 0.0, NaN, NaN, NaN, NaN, NaN, NaN, NaN, NaN, NaN, 0.0, NaN, NaN, NaN, 0.0, NaN, 1.0, NaN, NaN, NaN, NaN, 0.0, NaN, NaN, NaN, NaN, NaN, NaN, 0.5, NaN, NaN, NaN, NaN, 0.0, NaN, NaN, NaN, NaN, NaN, NaN, NaN, 0.0, NaN, 0.0, NaN, NaN, NaN, -0.5, NaN, NaN, NaN, NaN, 0.5, NaN, NaN, 0.5, NaN, NaN, NaN, NaN, NaN, NaN, NaN, NaN, NaN, 0.5, NaN, NaN, NaN, NaN, NaN, NaN, NaN, 0.0, NaN, NaN, -0.5, NaN, NaN, NaN, 0.0, NaN, NaN, NaN, NaN, NaN, NaN, NaN, NaN, NaN, NaN, NaN, NaN",0.001,-0.037,"hic, sepulcrum, de_-lio, dirus, de_-lio, tu, de_-lio, tu, immitis, saeuus, caedes, timidus, periurium, impius, hic, iaceo, immitis, hic, scelero, iaceo, profundus, ferus, saeuio, impius, serpens, noxius, tityos, stagnum, danai, dolium, uiolo, tu, pudor, hic, tu, tu, capillus, de_-lio, hic, hic",0.068
