Text,Stelle,Inahlt,Wortzahl,Sentiment Rechnung,Sentiment-Score,alternativer Sentiment-Score,Invektiven,Invektivitäts-Score
tibullus.elegies,2.6,"castrum, macer, sequor, tener, quis, fio, amor, sum, comes, et, collum, fortis, arma, gero, et, seu, longus, uir, terra, uia, seu, uagus, duco, aequor, cum, telum, ad, latus, eo, uolo, uro, puer, quaeso, tuus, qui, ferus, otium, linquo, atque, iterum, erro, sub, tuus, signum, uoco, qui, si, miles, parco, sum, hic, quoque, miles, ipse, leuis, galea, qui, sui, porto, aqua, castrum, peto, ualeatque, uenus, ualeantque, puella, et, ego, sum, uis, et, ego, laetus, tuba, sum, magnus, loquor, sed, magnificus, ego, magnus, loquor, excutio, claudo, fortis, uerbum, foris, iuro, quotiens, redeo, ad, limen, numquam, cum, bene, iuro, pes, tamen, ipse, redeo, acer, amor, frango, utinam, tuus, telum, sagitto, si, licet, ex-tingo, aspicio, fax, tu, miser, torqueo, tu, ego, ego, dirus, precor, cogo, et, insanus, mens, nefandus, loquor, iam, malus, finio, letum, sed, credulus, uita, spes, foueo, et, sum, creo, semper, aio, bonus, spes, alo, agricola, spes, sulcus, credo, aro, semen, qui, magnus, faenus, reddo, ager, hic, laqueus, uolucris, hic, capto, harundo, piscis, cum, tenuis, hamus, abdo, ante, cibus, spes, etiam, ualidus, solo, compedes, uincio, crus, sono, ferrum, sed, cano, inter, opus, spes, facilis, nemesim, spondeo, ego, sed, nego, ille, is, ego, ne, uinco, durus, puella, dea, parco, per, immaturus, tuus, precor, os, soror, sic, bene, sub, tener, paruus, quiesco, humo, ille, ego, sancio, sum, ille, donum, sepulcrum, et, madefacio, meus, sero, fero, lacrima, ille, ad, tumulus, fugio, supplex, sedeo, et, meus, cum, muto, fatum, queror, cinis, non, fero, usque, suus, tu, propter, fleo, cliens, ille, ut, uerbum, sum, ego, lentus, ueto, ne, tu, neglego, mitto, malus, somnio, manes, maestus, sopio, sto, soror, ante, torus, qualis, ab, excello, praeceps, delabor, fenestra, uenio, ad, inferni, sanguinolentus, lacus, desino, ne, domina, luctus, renouo, acerbus, non, ego, sum, tantus, ploro, ut, ille, semel, neque, lacrima, oculus, dignus, sum, foedaris, loquax, lena, noceo, nos, ipse, puella, bonus, sum, lena, neco, miser, phrynos, furtim, tabella, occulo, porto, eo, redeo, sinus, saepe, ego, cum, domina, dulcis, ab, limen, durus, agnosco, uox, hic, nego, sum, domus, saepe, ubi, nox, ego, promitto, sum, langueo, puella, nuntio, aut, aliqui, extimesco, minae, tunc, morior, cura, tunc, mens, ego, perdo, fingo, queo, meus, teneo, quot, teneatue, modus, tunc, tu, lena, precor, dirae, satis, anxius, uiuo, moueo, e, uotum, pars, quotus, deus",368,"NaN, NaN, NaN, NaN, NaN, NaN, 1.0, NaN, NaN, NaN, NaN, 0.5, 0.0, NaN, NaN, NaN, 0.0, 0.5, 0.0, 0.0, NaN, NaN, NaN, 0.0, NaN, NaN, NaN, NaN, NaN, NaN, NaN, 0.0, NaN, 0.0, NaN, -1.0, 0.5, NaN, NaN, NaN, 0.0, NaN, 0.0, 0.0, NaN, NaN, NaN, 0.0, NaN, NaN, NaN, NaN, 0.0, NaN, 0.0, NaN, NaN, NaN, NaN, 0.0, NaN, NaN, NaN, 1.0, NaN, NaN, NaN, NaN, NaN, 1.0, NaN, NaN, 1.0, NaN, NaN, 0.0, NaN, NaN, 0.0, NaN, 0.0, NaN, NaN, NaN, 0.5, 0.0, NaN, NaN, NaN, NaN, NaN, NaN, NaN, NaN, NaN, NaN, 0.0, NaN, NaN, NaN, NaN, 1.0, NaN, NaN, 0.0, NaN, NaN, NaN, NaN, NaN, NaN, NaN, NaN, -1.0, NaN, NaN, NaN, NaN, -1.0, NaN, NaN, NaN, -1.0, 0.5, -1.0, NaN, NaN, -1.0, NaN, -1.0, NaN, -0.5, 0.0, 0.5, NaN, NaN, NaN, NaN, NaN, NaN, 1.0, 0.5, NaN, NaN, 0.5, NaN, NaN, NaN, NaN, NaN, 0.0, NaN, NaN, 0.0, NaN, NaN, NaN, NaN, NaN, NaN, NaN, NaN, 0.0, NaN, NaN, NaN, NaN, 0.5, NaN, 1.0, NaN, NaN, NaN, NaN, NaN, NaN, NaN, NaN, NaN, 0.5, 0.5, 0.5, NaN, NaN, NaN, NaN, NaN, NaN, NaN, NaN, NaN, NaN, -0.5, NaN, NaN, NaN, NaN, -1.0, 0.0, NaN, 0.0, NaN, NaN, NaN, NaN, NaN, 0.0, NaN, NaN, NaN, NaN, NaN, NaN, NaN, 0.0, NaN, NaN, NaN, 0.0, NaN, NaN, NaN, NaN, NaN, NaN, NaN, 0.0, NaN, NaN, 0.0, NaN, NaN, 0.0, NaN, NaN, NaN, NaN, NaN, NaN, NaN, NaN, NaN, 0.0, NaN, NaN, 0.0, NaN, NaN, NaN, NaN, NaN, NaN, NaN, NaN, -1.0, NaN, NaN, -1.0, NaN, NaN, NaN, NaN, NaN, NaN, NaN, NaN, NaN, NaN, NaN, NaN, NaN, NaN, NaN, 0.0, NaN, NaN, NaN, -1.0, NaN, -1.0, NaN, NaN, NaN, NaN, NaN, NaN, NaN, NaN, NaN, NaN, 0.0, 1.0, NaN, NaN, NaN, NaN, NaN, NaN, NaN, NaN, 1.0, NaN, NaN, NaN, -1.0, NaN, NaN, 0.0, NaN, NaN, NaN, NaN, NaN, NaN, NaN, NaN, NaN, 0.5, NaN, NaN, -0.5, NaN, 0.0, NaN, NaN, NaN, 0.0, NaN, NaN, 0.0, NaN, NaN, NaN, NaN, NaN, NaN, NaN, NaN, NaN, -0.5, NaN, NaN, -1.0, NaN, 0.5, NaN, NaN, NaN, NaN, 0.0, NaN, NaN, NaN, 0.5, NaN, NaN, NaN, NaN, NaN, 0.5, -1.0, NaN, NaN, NaN, 0.0, 0.0, NaN, 0.0",0.0,-0.046,"ferus, otium, hic, fax, tu, miser, tu, dirus, insanus, nefandus, credulus, faenus, hic, hic, sepulcrum, tu, tu, sanguinolentus, acerbus, lena, noceo, lena, miser, hic, extimesco, fingo, tu, lena",0.076
tibullus.elegies,3.1,"mars, romanus, festus, uenio, kalendae, exorior, noster, hic, sum, annus, auis, et, uagus, nunc, certus, discurro, undique, pompa, per, uia, urbs, munus, per, domus, dico, pierides, quonam, dono, honor, seu, meus, seu, fallo, carus, neaera, tamen, carmen, formosus, pretium, capio, auaris, gaudeo, ut, dignus, sum, uersus, ille, meus, luteus, sed, niueus, inuoluo, membrana, libellus, pumex, et, cano, tondeo, ante, como, summum, praetexo, tenuis, fastigium, charta, indico, ut, nomen, littera, facio, tuus, atque, inter, gemino, pingo, cornu, frons, sic, etenim, como, mitto, oportet, opus, per, tu, auctor, hic, ego, carmen, oro, castaliamque, umbra, pieriosque, lacus, eo, domus, colo, ille, dono, libellus, sicut, sum, nullus, defluo, inde, color, ille, ego, refero, si, noster, mutuus, cura, sum, an, paruus, an, totus, pectus, decido, sed, primus, mereo, largus, dono, salus, atque, hic, summitto, dico, uerbum, sonus, hic, tu, uir, quondam, nunc, frater, castus, neaera, mitto, et, accipio, munus, paruus, rogo, tu, suus, iuro, caueo, magis, sum, medulla, siue, sui, coniunx, siue, sum, soror, sed, potis, coniunx, hic, spes, nomen, ille, aufero, ex-tingo, pallidus, dis, aqua",171,"NaN, NaN, NaN, NaN, NaN, NaN, NaN, NaN, NaN, 0.0, NaN, NaN, NaN, NaN, 0.5, NaN, NaN, 0.5, NaN, 0.0, 0.5, 0.5, NaN, 0.0, NaN, NaN, NaN, NaN, 1.0, NaN, 0.0, NaN, NaN, 1.0, NaN, NaN, 0.0, 1.0, 1.0, NaN, NaN, NaN, NaN, 1.0, NaN, NaN, NaN, 0.0, NaN, NaN, NaN, NaN, NaN, 0.0, NaN, NaN, NaN, NaN, NaN, NaN, NaN, NaN, 0.0, NaN, NaN, NaN, NaN, 0.0, 0.0, NaN, 0.0, NaN, NaN, NaN, NaN, NaN, 0.0, NaN, NaN, NaN, NaN, NaN, 0.5, NaN, NaN, NaN, NaN, NaN, 0.0, NaN, NaN, NaN, NaN, 0.0, NaN, 0.0, NaN, NaN, NaN, 0.0, NaN, NaN, NaN, NaN, NaN, 0.0, NaN, NaN, NaN, NaN, NaN, 0.0, -1.0, NaN, NaN, 0.0, NaN, NaN, NaN, NaN, NaN, 0.5, NaN, NaN, NaN, 1.0, NaN, NaN, NaN, NaN, 0.0, NaN, NaN, NaN, 0.5, NaN, NaN, 0.0, NaN, NaN, NaN, NaN, NaN, 0.5, 0.0, NaN, NaN, NaN, NaN, NaN, NaN, NaN, NaN, NaN, NaN, -0.5, NaN, NaN, NaN, NaN, 0.0, -0.5, NaN, 0.5, 0.0, NaN, NaN, NaN, NaN, NaN, 0.0",0.05,-0.012,"hic, fallo, neaera, pretium, auaris, niueus, pumex, tu, hic, hic, hic, tu, neaera, tu, hic",0.088
tibullus.elegies,3.2,"qui, primus, caueo, iuuenis, carus, puella, eripio, iuuenis, ferreus, ille, sum, durus, et, ille, sum, qui, tantus, fero, dolor, uiuo, et, eripio, coniunx, qui, possum, non, ego, firmus, in, hic, non, hic, patientia, noster, ingenium, frango, fortis, cor, dolor, neque, ego, uerus, loquor, pudor, sum, uita, fateor, tot, malus, perpetior, taedium, nata, meus, ergo, cum, tenuis, sum, muto, in, umbra, candidus, os, supra, niger, fauilla, tego, ante, meus, uenio, longus, incomis, capillus, et, fleo, ante, meus, maestus, neaera, rogus, sed, uenio, carus, mater, comito, dolor, maereo, hic, gener, maereo, ille, uir, praefor, ante, meus, manes, anima, preco, perfundo, pius, ante, liquor, manus, pars, qui, solus, meus, supero, corpus, os, incingo, niger, candidus, uestis, lego, et, primus, annosus, spargo, colligo, lyaeo, mox, etiam, niueus, lac, pareo, post, hic, carbaseis, umor, tollo, uelum, atque, in, marmoreus, pono, sicco, domus, illic, qui, mitto, diues, panchaia, merces, eoique, a-rabo, diues, et, assyria, et, noster, memor, lacrima, fundo, idem, sic, ego, compono, uersus, in, os, uolo, sed, tristis, mors, demonstro, littera, causa, atque, hic, in, celeber, carmen, frons, noto, lygdamus, hic, sino, sum, dolor, hic, et, cura, neaerae, coniunx, eripio, causa, pereo, sum",188,"NaN, 0.5, NaN, NaN, 1.0, NaN, NaN, NaN, NaN, NaN, NaN, -0.5, NaN, NaN, NaN, NaN, NaN, NaN, -1.0, NaN, NaN, NaN, -0.5, NaN, NaN, NaN, NaN, 1.0, NaN, NaN, NaN, NaN, NaN, NaN, 0.5, NaN, 0.5, NaN, -1.0, NaN, NaN, 0.5, NaN, 0.5, NaN, 0.0, NaN, NaN, -1.0, NaN, -1.0, NaN, 0.0, NaN, NaN, 0.0, NaN, NaN, NaN, NaN, NaN, 0.0, NaN, NaN, NaN, NaN, NaN, 0.0, NaN, 0.0, -1.0, NaN, NaN, NaN, NaN, 0.0, -1.0, NaN, NaN, NaN, NaN, 1.0, 0.0, NaN, -1.0, NaN, NaN, NaN, NaN, NaN, 0.5, NaN, NaN, 0.0, NaN, 0.5, NaN, NaN, NaN, NaN, NaN, 0.0, 0.0, NaN, -0.5, 0.0, NaN, 0.0, 0.0, NaN, NaN, NaN, NaN, NaN, NaN, 0.5, NaN, NaN, NaN, NaN, NaN, NaN, NaN, NaN, NaN, NaN, NaN, NaN, NaN, NaN, NaN, NaN, NaN, NaN, NaN, NaN, 0.0, NaN, NaN, NaN, 0.5, NaN, 1.0, NaN, NaN, 0.5, NaN, NaN, NaN, NaN, 1.0, NaN, NaN, NaN, NaN, NaN, NaN, NaN, NaN, 0.0, NaN, NaN, -1.0, -1.0, NaN, 0.0, 0.0, NaN, NaN, NaN, NaN, 0.0, 0.0, NaN, NaN, NaN, NaN, NaN, -1.0, NaN, NaN, -1.0, NaN, -0.5, NaN, 0.0, NaN, NaN",-0.016,-0.069,"hic, hic, pudor, taedium, capillus, neaera, rogus, hic, uestis, niueus, hic, hic, hic, hic",0.074
tibullus.elegies,3.3,"quis, prodo, caelum, uotum, impleo, neaera, blandus, cum, multus, tus, do, prex, non, ut, marmoreus, prodeo, e, limen, tectum, insignis, clarus, conspicuus, domus, aut, ut, multus, meus, renouo, iugerum, taurus, et, magnus, messis, terra, benignus, do, sed, cum, tu, ut, longus, sociaris, gaudium, uita, in, tuus, cado, noster, senecta, sinus, tum, cum, permetior, defungor, tempus, lucus, nudus, lethaea, cogo, eo, ratis, nam, grauis, quis, prodo, pondus, ego, diues, aurum, aruum, si, findo, pinguis, mille, bos, quis, domus, prodo, phrygiis, innitor, columna, taenaris, siue, tuus, siue, caryste, tuus, et, nemus, in, domus, sacer, imito, lucus, auro, trabs, marmoreus, solus, quis, in, erythraeus, lego, qui, litus, concha, tingo, sidonio, murex, lana, iuuo, et, qui, praeterea, populus, miro, in, ille, inuidia, sum, fallo, multus, uulgus, amo, non, ops, mens, homo, cura, leuo, neque, fortuna, suus, tempus, lex, rego, sum, ego, paupertas, cum, tu, iucundus, neaera, at, sine, tu, rex, munus, nullus, uolo, o, niueus, qui, tu, possum, ego, reddo, lux, o, ego, felix, ter, quater, dies, at, si, pro, dulcis, reditus, quicumque, uouentur, audio, auerto, non, meus, auris, deus, neque, ego, regnum, iuuo, neque, lydius, aurifer, amnis, neque, qui, terra, sustineo, orbis, ops, hic, alius, cupio, licet, ego, pauper, cultus, securus, carus, coniunx, possum, fruor, adsum, et, timidus, faueo, saturnia, uotum, et, faueo, concha, cypria, ueho, tuus, aut, si, fatum, nego, redeo, tristis, soror, stamen, qui, duco, quisque, sum, neunt, ego, uoco, in, uastus, amnis, niger, palus, diues, in, ignauus, luridus, orcus, aqua",240,"NaN, NaN, 0.5, 0.0, NaN, NaN, 0.5, NaN, 0.0, NaN, NaN, 0.0, NaN, NaN, NaN, NaN, NaN, NaN, NaN, 0.0, 0.5, 1.0, 0.0, NaN, NaN, 0.0, 0.0, NaN, NaN, NaN, NaN, 0.0, NaN, 0.0, 1.0, NaN, NaN, NaN, NaN, NaN, 0.0, NaN, 1.0, 0.0, NaN, 0.0, NaN, NaN, NaN, NaN, NaN, NaN, NaN, NaN, 0.0, NaN, 0.0, NaN, NaN, NaN, NaN, NaN, -0.5, NaN, NaN, NaN, NaN, 0.5, 0.5, NaN, NaN, NaN, NaN, NaN, NaN, NaN, 0.0, NaN, NaN, NaN, NaN, NaN, NaN, 0.0, NaN, NaN, 0.0, NaN, NaN, NaN, 0.0, 1.0, NaN, NaN, NaN, 0.0, NaN, -0.5, NaN, NaN, NaN, NaN, NaN, NaN, NaN, NaN, NaN, NaN, NaN, NaN, NaN, NaN, NaN, 0.0, NaN, NaN, NaN, -1.0, NaN, NaN, 0.0, 0.0, NaN, NaN, 0.0, 0.5, 0.0, -1.0, NaN, NaN, 0.0, NaN, 0.0, 0.5, NaN, NaN, NaN, -1.0, NaN, NaN, 1.0, NaN, NaN, NaN, NaN, 0.0, 0.5, NaN, NaN, NaN, NaN, NaN, NaN, NaN, NaN, NaN, NaN, NaN, NaN, 1.0, NaN, NaN, 0.0, NaN, NaN, NaN, 0.5, 0.0, NaN, NaN, NaN, NaN, NaN, 0.0, NaN, 0.0, NaN, NaN, 0.0, NaN, NaN, NaN, NaN, NaN, NaN, NaN, 0.0, NaN, NaN, 0.0, NaN, NaN, NaN, NaN, NaN, -1.0, -0.5, 1.0, 1.0, -0.5, NaN, NaN, NaN, NaN, -0.5, NaN, NaN, 0.0, NaN, NaN, NaN, NaN, NaN, 0.0, NaN, NaN, 0.0, NaN, NaN, -1.0, NaN, NaN, NaN, NaN, NaN, NaN, NaN, NaN, NaN, NaN, -1.0, NaN, NaN, NaN, 0.5, NaN, -1.0, -1.0, NaN, 0.0",0.01,-0.044,"neaera, tu, phrygiis, sidonio, lana, inuidia, fallo, tu, neaera, tu, niueus, tu, hic, timidus, uastus, ignauus",0.067
tibullus.elegies,3.4,"deus, bonus, fero, neque, sum, ego, somnio, uerus, qui, fero, hesternus, malus, nox, quies, eo, procul, uanus, fallo, auerto, uideo, desino, in, nos, quaero, uolo, fides, diuus, uerus, moneo, uenio, nuntia, sors, uerus, moneo, tusci, exta, probo, uir, somnio, fallax, ludo, temerarius, nox, et, pauidus, mens, fallo, timeo, iubeo, et, natus, in, cura, homo, genus, omen, nox, far, pius, placo, et, salio, sal, et, tamen, utcumque, sum, siue, ille, uerus, moneo, mendacium, somnus, credo, siue, uolo, efficio, uanus, nox, lucinus, timor, et, frustra, immeritus, pertimeo, uolo, si, meus, neque, turpis, mens, sum, obnoxius, facio, neque, laedo, magnus, impius, lingua, deus, iam, nox, aetherius, niger, emetior, quadrigae, mundus, cacruleo, lauerat, amnis, roto, neque, ego, sopio, mens, deus, utilis, aeger, somnus, sollicitus, deficio, ante, domus, tandem, cum, superus, phoebus, prospicio, ab, ortus, premo, langueo, lumen, serus, quies, hic, iuuenis, castus, redimio, tempus, laurus, sum, uideo, noster, pono, sedes, pedis, non, ille, quisquam, formosus, ullus, prior, aetas, heros, neque, fero, ullus, domus, intondeo, crinis, longus, ceruix, fluo, stillo, syrio, myrteus, ros, coma, candor, sum, qual, praefero, latonia, luna, et, color, in, niueus, corpus, purpureus, ut, iuuenis, primus, uirgo, deduco, marito, inficio, tener, os, rubeo, gena, et, cum, contexo, amarantus, albus, puella, lilium, et, auctumnus, candidus, malus, rubeo, imus, uideo, talis, illudo, palla, namque, hic, in, nitidus, corpus, uestis, sum, ars, opus, rarus, fulgeo, testudo, et, aurum, pendo, laeuus, garrulus, pars, lyra, hic, primus, uenio, plectrum, modulor, eburnus, felix, cantus, os, sono, do, sed, postquam, sum, digitus, cum, uox, loquor, edo, hic, dulcis, tristis, uerbum, modo, salueo, cura, deus, castus, nam, rite, poeta, phoebusque, et, bacchus, pieridesque, faueo, sed, proles, semelae, bacchus, doceo, soror, dico, non, nosco, quis, fero, hora, sequor, at, ego, fatum, lex, aeuisque, sum, euenio, pater, possum, uideo, do, quare, ego, qui, dico, non, fallax, accipio, uates, quisque, deus, uerus, cynthius, os, fero, tantus, carus, tu, quantus, neque, filia, mater, quantus, neque, cupido, bellum, puella, uir, pro, qui, sollicitus, caelestis, numen, uotum, qui, tu, securus, non, sino, eo, dies, et, cum, tu, fuscus, somnus, uelo, amictus, uanum, nocturnus, fallo, imago, carmen, celebro, tuus, formosus, neaera, alter, mauultl, sum, puella, uir, diuerto, suus, agito, mens, impius, cura, neque, gaudeo, castus, nubo, neaera, domus, ab, crudelis, genus, neque, fidus, femina, nomen, ab, pereo, disco, fallo, si, qui, uir, sed, flecto, possum, mens, sum, mutabilis, ille, tu, modo, cum, multus, bracchium, tendo, fides, saeuus, amor, doceo, ualidus, tento, labor, saeuus, amor, doceo, uerbero, possum, patior, ego, quondam, admetior, niueas, pasco, iuuenca, non, sum, in, uanum, fabula, fictum, iocus, tunc, ego, neque, cithara, possum, gaudeo, sonorus, neque, similis, chordus, reddo, uox, sonus, sed, perluceo, cano, meditor, auena, ille, ego, latonae, filius, atque, iuppiter, nescio, quis, sum, amor, iuuenis, si, fero, recuso, immitis, domina, coniugium, ferus, ergo, ne, dubito, blandus, adhibeo, querela, uinco, mollis, pectus, durus, prex, qui, si, uerus, cano, sacrum, oraculum, templum, hic, ille, noster, nomen, dictum, refero, hic, tu, conigium, promitto, delius, ipse, felix, hic, alius, desino, uolo, uir, dico, et, ignauus, defluo, corpus, somnus, ab, ego, ne, possum, tantus, uideo, malus, neque, tu, credo, uotum, contrarius, uotum, neque, tantus, crimen, pectus, insum, tuus, nam, tu, neque, uastus, gigno, aequor, pontus, neque, flamma, uoluo, os, chimaera, fero, neque, canis, anguineus, redimio, tergum, caterua, qui, tres, sum, lingua, trigeminus, caput, scyllaque, uirgineam, canis, succingo, figura, neque, tu, concipio, saeuus, leaena, fero, barbarum, neque, scythiae, tellus, horrendaue, syrtis, sed, colo, et, durus, non, habito, domus, et, longus, ante, alius, omnis, mitis, mater, eo, pater, quo, non, alter, amabilis, hic, deus, in, bonus, crudelis, somnio, uerto, et, iubeo, tepidus, irrito, fero, nosco",586,"0.0, 1.0, NaN, NaN, NaN, NaN, NaN, 0.5, NaN, NaN, NaN, -1.0, 0.0, NaN, NaN, NaN, -0.5, NaN, NaN, NaN, NaN, NaN, NaN, NaN, NaN, 1.0, 0.0, 0.5, NaN, NaN, NaN, -1.0, 0.5, NaN, NaN, NaN, NaN, 0.5, NaN, -1.0, NaN, -1.0, 0.0, NaN, -1.0, 0.5, NaN, NaN, NaN, NaN, 0.0, NaN, -1.0, 0.0, 0.0, NaN, 0.0, 0.0, NaN, NaN, NaN, NaN, NaN, NaN, NaN, NaN, NaN, NaN, NaN, 0.5, NaN, -1.0, 0.5, NaN, NaN, NaN, NaN, -0.5, 0.0, NaN, -0.5, NaN, NaN, NaN, NaN, NaN, NaN, 0.0, NaN, -1.0, 0.5, NaN, -0.5, NaN, NaN, NaN, 0.0, -1.0, -0.5, 0.0, NaN, 0.0, NaN, NaN, NaN, NaN, 1.0, NaN, NaN, NaN, NaN, NaN, NaN, NaN, 0.5, 0.0, 1.0, -1.0, 0.5, -1.0, NaN, NaN, 0.0, NaN, NaN, NaN, NaN, NaN, NaN, NaN, NaN, NaN, NaN, NaN, NaN, NaN, NaN, NaN, NaN, 0.0, NaN, NaN, NaN, NaN, NaN, 0.0, 0.0, NaN, NaN, NaN, 1.0, NaN, 0.5, 0.0, NaN, NaN, NaN, NaN, 0.0, NaN, NaN, 0.0, NaN, NaN, NaN, NaN, NaN, NaN, NaN, 0.5, NaN, NaN, NaN, NaN, NaN, NaN, 0.0, NaN, NaN, 0.0, NaN, NaN, NaN, 0.5, NaN, NaN, NaN, NaN, NaN, 0.0, NaN, NaN, NaN, NaN, NaN, NaN, NaN, NaN, NaN, NaN, 0.0, NaN, -1.0, NaN, NaN, NaN, NaN, NaN, NaN, NaN, NaN, NaN, 0.5, 0.0, NaN, NaN, 0.0, 0.5, NaN, NaN, NaN, NaN, 0.5, NaN, -1.0, NaN, 0.0, 0.0, NaN, 0.5, NaN, NaN, NaN, NaN, 1.0, 0.0, 0.0, NaN, NaN, NaN, NaN, NaN, NaN, NaN, 0.0, NaN, NaN, NaN, 0.5, -1.0, 0.0, NaN, NaN, -1.0, 0.0, NaN, NaN, NaN, 0.0, NaN, NaN, NaN, NaN, NaN, NaN, 0.0, NaN, NaN, NaN, NaN, NaN, NaN, NaN, NaN, NaN, NaN, NaN, NaN, NaN, 0.0, 0.5, NaN, NaN, NaN, 0.0, NaN, NaN, NaN, NaN, NaN, NaN, NaN, NaN, -1.0, NaN, NaN, NaN, 0.0, 0.5, NaN, 0.0, NaN, NaN, 1.0, NaN, NaN, NaN, NaN, 0.0, NaN, NaN, -0.5, 0.0, NaN, 0.5, NaN, NaN, -1.0, NaN, NaN, 0.0, NaN, NaN, 1.0, NaN, NaN, NaN, 0.0, NaN, NaN, NaN, NaN, 0.5, NaN, 0.5, -1.0, NaN, NaN, NaN, 0.0, NaN, 0.0, 1.0, NaN, NaN, NaN, NaN, NaN, 0.5, NaN, NaN, NaN, 0.5, -1.0, -1.0, NaN, NaN, NaN, NaN, NaN, 0.0, NaN, -1.0, 0.0, NaN, 1.0, 0.0, 0.0, NaN, NaN, NaN, NaN, NaN, NaN, 0.5, NaN, NaN, NaN, 0.5, NaN, NaN, NaN, NaN, NaN, NaN, 0.0, NaN, NaN, 1.0, -1.0, 1.0, NaN, 1.0, NaN, -0.5, -1.0, 1.0, NaN, NaN, NaN, NaN, NaN, NaN, NaN, NaN, NaN, 0.0, NaN, NaN, NaN, -1.0, 0.0, NaN, -0.5, NaN, NaN, NaN, NaN, NaN, NaN, NaN, NaN, 0.0, NaN, NaN, 0.0, NaN, NaN, NaN, NaN, NaN, 0.0, NaN, NaN, NaN, 0.0, NaN, NaN, NaN, NaN, NaN, 1.0, NaN, NaN, NaN, NaN, -1.0, NaN, NaN, -1.0, NaN, NaN, NaN, 0.5, NaN, -0.5, NaN, NaN, NaN, -0.5, 0.0, NaN, NaN, 0.5, NaN, NaN, NaN, NaN, NaN, NaN, NaN, 0.0, 0.0, NaN, NaN, NaN, NaN, NaN, NaN, NaN, 1.0, NaN, NaN, NaN, NaN, 0.5, NaN, NaN, -1.0, NaN, 0.0, 0.5, NaN, NaN, NaN, NaN, NaN, NaN, -1.0, NaN, NaN, NaN, 0.0, NaN, 0.0, NaN, NaN, -1.0, NaN, NaN, 0.0, NaN, NaN, NaN, -1.0, NaN, 0.0, 0.0, NaN, NaN, NaN, 0.0, NaN, NaN, NaN, NaN, NaN, NaN, NaN, NaN, NaN, NaN, NaN, -0.5, NaN, 0.0, NaN, NaN, NaN, NaN, NaN, NaN, NaN, NaN, -1.0, NaN, NaN, NaN, NaN, NaN, NaN, NaN, NaN, NaN, NaN, NaN, -0.5, NaN, NaN, 0.0, NaN, 0.0, NaN, NaN, NaN, 1.0, 0.0, NaN, 0.0, NaN, NaN, NaN, 1.0, NaN, 0.0, NaN, 1.0, -1.0, NaN, NaN, NaN, NaN, NaN, NaN, NaN, NaN",-0.006,-0.065,"uanus, fallo, temerarius, fallo, mendacium, uanus, turpis, impius, hic, syrio, niueus, uirgo, marito, gena, hic, uestis, garrulus, hic, hic, tu, tu, tu, fallo, neaera, impius, nubo, neaera, crudelis, fallo, tu, saeuus, saeuus, uerbero, fictum, immitis, ferus, hic, hic, tu, hic, ignauus, tu, crimen, tu, uastus, tu, saeuus, leaena, barbarum, hic, crudelis",0.087
tibullus.elegies,3.5,"tu, teneo, etruscus, mano, qui, fons, unda, unda, sub, aestiuus, non, adeo, canis, nunc, autem, sacrum, baiaris, propior, lympha, cum, sui, purpureus, uerus, remitto, humus, at, ego, persephone, niger, denuntio, hora, immeritus, iuuenis, parco, noceo, dea, non, ego, tento, nullus, temero, uir, audax, laudo, sacer, doceo, dea, neque, meus, mortiferis, inficio, poculum, sucus, dextera, neque, quisquam, tero, uenenum, do, neque, nos, sacrilegus, templum, admoueo, ignis, neque, cor, sollicito, facio, nefandus, meus, neque, nos, insanus, meditor, iurgium, mens, impius, in, aduerto, soluo, os, deus, et, nondum, canis, niger, laedo, capillus, neque, uenio, tardo, curuo, senecta, pes, natal, primus, nos, uideo, parens, cum, cado, fatum, consul, uterque, par, quis, fraudaris, iuuo, uito, cresco, uua, et, modo, nata, malus, uello, pomum, manus, parco, palleo, unda, quicumque, teneo, duro, sortio, tertius, regnum, deus, elysios, olim, licet, cognosco, campus, lethaeamque, ratis, cimmeriosque, lacus, cum, meus, rugosus, palleo, os, senecta, et, refero, puer, tempus, priscus, senex, atque, utinam, uanus, nequiquam, terreo, aestus, langueo, ter, quini, sed, meus, membrum, dies, at, tu, tuscae, celebro, numen, lympha, et, facilis, lentus, pello, unda, manus, uiuite, felix, memor, et, uiuo, noster, siue, sum, seu, nos, fatum, sum, uolo, interea, niger, pecus, promitto, diues, et, niueus, lac, poculum, misceo, merus",199,"NaN, NaN, NaN, NaN, NaN, NaN, 0.0, 0.0, NaN, NaN, NaN, NaN, NaN, NaN, NaN, NaN, NaN, 0.0, 0.0, NaN, NaN, NaN, 0.5, NaN, NaN, NaN, NaN, NaN, NaN, NaN, NaN, NaN, NaN, NaN, NaN, NaN, NaN, NaN, NaN, NaN, NaN, 0.5, NaN, NaN, 1.0, NaN, NaN, NaN, 0.0, NaN, NaN, NaN, NaN, 0.0, NaN, NaN, NaN, -0.5, NaN, NaN, NaN, -1.0, NaN, NaN, 0.0, NaN, NaN, NaN, NaN, -1.0, 0.0, NaN, NaN, -1.0, NaN, -1.0, 0.5, -1.0, NaN, NaN, NaN, 0.0, 0.0, NaN, NaN, NaN, NaN, NaN, NaN, NaN, NaN, NaN, NaN, NaN, 0.0, NaN, 0.5, NaN, NaN, 0.5, NaN, NaN, 0.0, 0.5, NaN, 0.5, NaN, NaN, NaN, NaN, NaN, NaN, NaN, NaN, NaN, -1.0, NaN, 0.0, 0.0, NaN, NaN, 0.0, NaN, NaN, NaN, NaN, 0.0, 0.0, 0.0, NaN, NaN, NaN, NaN, 0.0, NaN, NaN, NaN, 0.0, NaN, 0.0, NaN, NaN, 0.0, NaN, NaN, NaN, 0.0, 0.0, 0.0, 0.0, NaN, NaN, -0.5, NaN, NaN, NaN, NaN, NaN, NaN, NaN, 0.0, NaN, 0.0, NaN, NaN, NaN, NaN, NaN, 0.0, NaN, 0.5, NaN, NaN, 0.0, 0.0, NaN, 1.0, 1.0, NaN, NaN, NaN, NaN, NaN, NaN, NaN, 0.0, NaN, NaN, NaN, NaN, NaN, NaN, 0.5, NaN, NaN, NaN, NaN, NaN, NaN",0.003,-0.035,"tu, humus, noceo, temero, audax, sacrilegus, nefandus, insanus, impius, capillus, uanus, tu, niueus",0.065
