Text,Stelle,Inahlt,Wortzahl,Sentiment Rechnung,Sentiment-Score,alternativer Sentiment-Score,Invektiven,Invektivitäts-Score
tibullus.elegies,1.8,"non, ego, celaris, possum, quis, nutus, amo, quis, fero, mitis, lenis, uerbum, sonus, neque, ego, sum, sors, neque, conscius, fibra, deus, praecino, euenio, neque, ego, cantus, auus, ipse, uenus, magicus, religo, bracchium, nodus, perdoceo, multus, non, sine, uerber, desino, dissimulo, deus, crudelis, uro, qui, uideo, inuitus, sub-cubo, sui, quis, tu, nunc, mollis, prodo, colo, capillus, saepis, muto, dispono, como, quis, fuco, splendeo, gena, ornaris, quis, unguis, artifex, doceo, subseco, manus, frustra, iam, uestis, frustra, muto, amicio, ansa, con-premo, con-ligo, artus, pes, ille, placeo, quiuis, incultus, uenio, os, neque, nitidus, tardus, como, ars, caput, num, tu, carmen, num, tu, palleo, herba, de_-uoueo, taceo, tempus, nox, anus, cantus, uicinus, frugis, traduco, ab, ager, cantus, et, irascor, detineo, anguis, iter, cantus, et, e, currus, luna, deduco, tento, et, facio, si, non, aes, repello, sono, quis, queror, heu, mitto, carmen, noceo, quis, herba, forma, nihil, magicus, uto, auxilium, sed, corpus, tango, noceo, sed, longus, do, osculum, sed, femori, consero, femur, neque, tu, difficilis, puer, tamen, sum, memento, persequor, poenio, tristis, facio, uenus, munus, ne, posco, do, munus, canus, amator, ut, foueo, mollis, frigidus, membrum, sinus, carus, sum, aurum, iuuenis, qui, leuis, fulgeo, os, neque, amplector, asper, barba, tero, hic, tu, candeo, umerus, sub-pono, lacertus, et, rex, magnus, despicio, ops, at, uenus, inuenio, puer, concumbo, furtim, dum, timeo, et, tener, consero, usque, sinus, et, do, anhelo, pugno, umidus, lingua, osculum, et, in, collum, figo, dens, nosco, non, lapis, hic, gemma, iuuo, qui, frigor, solus, dormio, et, nullus, sum, cupio, uir, heu, serus, reuoco, amor, sero, iuuenta, cum, uetus, inficio, canus, senecta, caput, tum, studium, forma, sum, coma, tum, muto, ut, annus, dissimulo, uiridis, cortex, tingo, nucis, tollo, tum, cura, sum, albus, ab, stirps, capillus, et, facies, dempta, pello, refero, nouus, at, tu, dum, primus, floreo, tu, tempus, aetas, utor, non, tardo, labor, ille, pes, neu, marathum, torquis, puer, qui, gloria, uinco, sum, in, uetus, sum, durus, puella, senex, parco, precor, tener, non, ille, sonticus, causa, sum, sed, nimius, lutum, corpus, tingo, amor, uel, miser, absum, maestus, quam, saepe, querela, conicio, et, lacrima, omnis, plenus, madeo, quis, ego, sperno, aio, possum, custodia, uinco, ipse, do, cupidus, fallo, possum, deus, nosco, uenus, furtiuus, ego, sum, ut, lenis, ago, spiritus, ut, neque, do, osculum, rapio, sonus, et, possum, medius, quiuis, obrepo, nox, et, strepitus, nullus, clam, reseraris, foris, quis, prosum, ars, miser, si, sperno, amo, et, fugio, ex, ipse, saeuus, puella, torus, uel, cum, promitto, subeo, sed, perfidus, fallo, sum, ego, nox, multus, euigilo, malus, dum, ego, uenio, fingo, quicumque, moueo, ille, credo, tunc, sono, pes, desisto, lacrimaris, puer, non, frango, ille, et, tuus, iam, fleo, lumen, fessus, tumeo, odi, pholoe, moneo, fastidium, diuus, neque, prodo, sanctus, tus, do, focus, hic, marathus, quondam, miser, ludo, amo, nescius, ultor, post, caput, sum, deus, saepe, etiam, lacrima, fero, rideo, doleo, et, cupidus, fictum, detineo, mora, nunc, omnis, odi, fastus, nunc, displiceo, ille, quicumque, oppono, sum, ianua, durus, serus, at, tu, poena, maneo, ni, desino, sum, superbus, quam, cupio, uoueo, hic, reuocaris, dies",492,"NaN, NaN, NaN, NaN, NaN, NaN, NaN, NaN, NaN, 1.0, 1.0, 0.0, NaN, NaN, NaN, NaN, -1.0, NaN, -0.5, NaN, 0.0, NaN, NaN, NaN, NaN, 0.0, NaN, NaN, 1.0, NaN, NaN, NaN, NaN, NaN, 0.0, NaN, NaN, NaN, NaN, NaN, 0.0, -1.0, NaN, NaN, NaN, -0.5, NaN, NaN, NaN, NaN, NaN, NaN, NaN, NaN, NaN, NaN, NaN, NaN, NaN, NaN, NaN, NaN, NaN, NaN, NaN, NaN, 0.0, NaN, NaN, 0.0, NaN, NaN, NaN, NaN, NaN, NaN, NaN, NaN, NaN, NaN, 0.0, NaN, NaN, NaN, -0.5, NaN, 0.0, NaN, 0.5, NaN, NaN, 0.0, 0.0, NaN, NaN, 0.0, NaN, NaN, NaN, NaN, NaN, NaN, 0.0, 0.0, 0.0, 0.0, 0.0, NaN, NaN, NaN, 0.0, 0.0, NaN, NaN, NaN, NaN, 0.0, 0.0, NaN, NaN, NaN, NaN, NaN, NaN, NaN, NaN, NaN, NaN, NaN, NaN, NaN, NaN, NaN, NaN, NaN, 0.0, NaN, NaN, NaN, 1.0, NaN, NaN, NaN, 0.0, NaN, 0.0, NaN, NaN, NaN, 0.0, NaN, 0.0, NaN, NaN, NaN, NaN, NaN, NaN, -0.5, 0.0, NaN, NaN, NaN, NaN, NaN, -1.0, NaN, 1.0, 0.5, NaN, NaN, NaN, 0.5, NaN, NaN, NaN, NaN, NaN, NaN, NaN, NaN, 1.0, NaN, 0.5, NaN, NaN, 0.0, NaN, 0.0, NaN, NaN, -0.5, NaN, NaN, NaN, NaN, NaN, NaN, NaN, NaN, NaN, 0.0, 0.0, NaN, 0.0, NaN, 1.0, NaN, 0.0, NaN, NaN, NaN, NaN, NaN, NaN, NaN, NaN, NaN, NaN, NaN, NaN, NaN, NaN, -0.5, 0.0, NaN, NaN, NaN, NaN, NaN, NaN, NaN, 0.0, NaN, NaN, NaN, NaN, NaN, -0.5, NaN, NaN, NaN, NaN, NaN, 0.5, NaN, NaN, NaN, 1.0, NaN, NaN, NaN, 0.0, NaN, NaN, NaN, 0.0, NaN, 0.5, 1.0, NaN, NaN, NaN, NaN, NaN, 0.0, NaN, NaN, NaN, NaN, NaN, NaN, NaN, -1.0, NaN, NaN, NaN, NaN, NaN, NaN, 0.0, NaN, NaN, NaN, 1.0, NaN, NaN, NaN, 0.5, NaN, NaN, 0.0, 0.0, NaN, NaN, NaN, -0.5, NaN, 0.0, NaN, NaN, NaN, 0.0, NaN, 0.0, NaN, NaN, NaN, 0.0, NaN, -0.5, NaN, 0.0, NaN, NaN, NaN, NaN, NaN, -1.0, 0.0, NaN, NaN, NaN, -0.5, 0.0, NaN, 1.0, NaN, -1.0, NaN, -1.0, NaN, NaN, -0.5, NaN, NaN, NaN, NaN, 0.0, NaN, NaN, NaN, NaN, NaN, NaN, NaN, NaN, NaN, NaN, -0.5, NaN, NaN, 0.0, NaN, 1.0, -1.0, NaN, NaN, NaN, 1.0, NaN, 0.0, NaN, NaN, NaN, 0.0, NaN, NaN, NaN, NaN, 0.0, NaN, NaN, 0.0, NaN, NaN, NaN, NaN, NaN, NaN, NaN, NaN, 0.0, -1.0, NaN, NaN, NaN, NaN, NaN, NaN, NaN, -1.0, NaN, NaN, NaN, NaN, NaN, NaN, NaN, -1.0, NaN, NaN, NaN, 0.0, 0.0, NaN, -1.0, NaN, NaN, NaN, NaN, NaN, NaN, NaN, NaN, NaN, NaN, 0.0, NaN, NaN, 0.0, NaN, NaN, NaN, NaN, 0.0, NaN, NaN, NaN, NaN, NaN, NaN, NaN, NaN, NaN, 0.0, NaN, NaN, 1.0, NaN, NaN, 0.0, NaN, NaN, NaN, -1.0, NaN, NaN, -0.5, NaN, NaN, 0.0, NaN, 0.0, NaN, NaN, NaN, NaN, NaN, NaN, NaN, -0.5, NaN, NaN, NaN, NaN, NaN, NaN, -1.0, NaN, NaN, NaN, NaN, NaN, NaN, NaN, -0.5, NaN, NaN, NaN, -1.0, NaN, NaN, NaN, NaN, -1.0, NaN, NaN, NaN, NaN, NaN, 0.0",-0.012,-0.048,"conscius, uerber, crudelis, tu, capillus, fuco, gena, subseco, uestis, tu, tu, heu, noceo, noceo, tu, amator, hic, tu, concumbo, hic, heu, capillus, tu, tu, nimius, miser, fallo, miser, saeuus, perfidus, fallo, fingo, hic, miser, nescius, ultor, fictum, tu, poena, hic",0.081
tibullus.elegies,1.9,"quis, ego, si, sum, miser, laedo, amor, foedero, per, diuus, clam, uiolo, do, ab, miser, et, siquis, primus, periurium, celo, serus, tamen, taceo, poena, uenio, pes, parco, caelestis, aequus, sum, impunis, licet, numen, formosus, laedo, uester, semel, lucrum, peto, habilis, taurus, adiungo, arater, et, durus, terra, rusticus, urgeo, opus, lucrum, peto, fretus, per, pareo, uenio, duco, instabilis, sidus, certus, ratis, munus, meus, sum, capio, puer, at, deus, ille, in, cunerem, et, liquidus, munus, uerto, aqua, iam, ego, persoluo, poena, puluis, decoro, detraho, et, uenio, horridus, facio, coma, uro, facies, uro, sol, capillus, detero, inualidus, et, uia, longus, pes, admoneo, quotiens, aurum, ne, polluo, forma, saepe, soleo, aurum, multus, subsum, malus, diuitiae, capio, siquis, uiolo, amor, asper, sum, ille, difficilis, uenus, uro, meus, potis, flamma, caput, et, peto, ferrum, corpus, et, intorqueo, uerber, tergum, seco, neque, tu, celo, spes, sum, peccaris, paro, sum, deus, occulo, qui, ueto, sum, dolus, ipse, deus, taceo, permitto, lenis, ministro, edo, ut, multus, liber, uerbum, merus, ipse, deus, somnus, domo, emitto, uoco, iubeo, et, inuitus, facio, tego, loquor, hic, ego, dico, nunc, ego, fleo, loquor, nunc, pudeo, ad, tener, procumbo, pes, tum, ego, iuro, nullus, tu, diues, aurum, pondus, non, gemma, uendo, uolo, fides, non, tu, si, pretium, campaneus, terra, do, non, tu, si, bacchi, cura, falernus, ager, ille, eripio, uerbum, ego, sidus, caelum, luceo, et, purus, fulmen, sum, uia, quin, etiam, fleo, at, non, ego, fallo, doceo, tergeo, umeo, credulus, usque, gena, quis, facio, nisi, et, ipse, foris, in, amor, puella, sed, precor, exemplum, sum, leuis, ille, tuus, o, quotiens, uerbum, ne, quisquam, conscius, sum, ipse, comes, multus, lumen, nox, fero, saepe, in-spero, uenio, tu, munus, noster, et, lateo, claudo, post, adoperio, foris, tum, miser, intereo, stultus, confido, amo, nam, possum, ad, laqueus, caueo, sum, tuus, quin, etiam, ad-tono, laus, tu, mens, caneo, et, ego, nunc, noster, pieridumque, pudeo, ille, uolo, rapidus, uolcanus, carmen, flamma, torreo, et, liquidus, deleo, amnis, aqua, tu, procul, hinc, absum, qui, forma, uendo, cura, sum, et, pretium, plenus, grandis, refero, manus, at, tu, qui, puer, donum, corrumpo, sum, audeo, rideo, assiduus, uxor, inultus, dolus, et, cum, furtiuus, iuuenis, lasso, usus, cum, tu, interpono, languidus, uestis, cubo, semper, sum, externus, tuus, uestigium, lectus, et, pateo, cupidus, semper, apertus, domus, neque, lasciuus, soror, dico, multus, bibo, poculum, uel, multus, emereo, uir, ille, saepe, fero, conuiuium, duco, baccho, dum, rota, lucifer, prouoco, orior, dies, ille, nullus, queo, bonus, consumo, nox, aut, opus, uario, dispono, uicis, at, tuus, perdisco, neque, tu, stultus, sentio, cum, tu, non, soleo, corpus, ab, ars, moueo, tu, -ne, puto, ille, pro, tu, dispono, crinis, aut, tenuis, densus, pecto, dens, como, iste, hic, persuadeo, facies, aurum, lacertus, uincio, et, tyrio, pro-eo, apto, sinus, non, tu, sed, iuuenis, quidam, uolo, bellum, uideo, deuoueo, pro, quo, res, domus, tuus, neque, facio, hic, uitio, sed, corpus, foedus, podagra, et, senex, amplector, colo, puella, fugio, hic, tamen, ad-cubo, noster, puer, hic, ego, credo, cum, trux, uenerem, iungo, possum, fera, blanditia, -ne, meus, alius, tu, uendo, sum, audeo, tu, -ne, alius, demens, osculum, fero, meus, tum, fleo, cum, ego, uincio, puer, alter, habeo, et, gero, in, regnum, regnum, superbus, tuus, at, tuus, tum, ego, poena, iuuo, uenerique, mereo, figo, noto, casus, aureus, palmo, meus, hic, tu, fallax, resoluo, amor, tibullus, dedico, et, gratus, sum, dea, mens, rogo",542,"NaN, NaN, NaN, NaN, -1.0, NaN, 1.0, NaN, NaN, 0.0, NaN, NaN, NaN, NaN, -1.0, NaN, NaN, 0.5, -1.0, NaN, NaN, NaN, NaN, -1.0, NaN, 0.0, NaN, NaN, 0.5, NaN, -0.5, NaN, NaN, 1.0, NaN, NaN, NaN, 0.5, NaN, NaN, NaN, NaN, NaN, NaN, -0.5, 0.0, -0.5, NaN, 0.5, 0.5, NaN, 0.5, NaN, NaN, NaN, NaN, -0.5, NaN, 0.5, NaN, 0.5, 0.0, NaN, NaN, 0.0, NaN, 0.0, NaN, NaN, NaN, NaN, NaN, 0.5, NaN, 0.0, NaN, NaN, NaN, -1.0, NaN, NaN, NaN, NaN, NaN, -1.0, NaN, NaN, NaN, 0.0, NaN, NaN, NaN, NaN, -1.0, NaN, 0.0, 0.0, 0.0, NaN, NaN, 0.5, NaN, NaN, 1.0, NaN, NaN, 0.5, 0.0, NaN, -1.0, 0.5, NaN, NaN, NaN, 1.0, -0.5, NaN, NaN, -0.5, 1.0, NaN, 0.0, 0.0, NaN, 0.0, NaN, NaN, NaN, 0.0, NaN, NaN, NaN, NaN, NaN, NaN, NaN, NaN, 0.5, NaN, NaN, NaN, NaN, 0.0, NaN, NaN, NaN, NaN, NaN, NaN, 0.0, NaN, NaN, 1.0, NaN, NaN, NaN, 0.0, 0.5, 0.0, NaN, NaN, 0.0, 0.5, NaN, NaN, NaN, NaN, NaN, -0.5, NaN, NaN, NaN, NaN, NaN, NaN, NaN, NaN, NaN, NaN, NaN, NaN, NaN, NaN, NaN, 0.0, NaN, NaN, NaN, NaN, NaN, 0.5, 0.5, NaN, NaN, NaN, NaN, NaN, 1.0, NaN, NaN, NaN, 1.0, NaN, 0.0, NaN, NaN, NaN, NaN, NaN, -1.0, NaN, 0.0, NaN, NaN, 0.0, NaN, NaN, 0.5, NaN, NaN, 1.0, NaN, NaN, 0.0, NaN, NaN, NaN, NaN, NaN, NaN, NaN, NaN, NaN, NaN, -0.5, NaN, NaN, NaN, NaN, NaN, NaN, NaN, NaN, NaN, 1.0, NaN, NaN, NaN, 0.0, NaN, 0.0, NaN, 0.0, NaN, NaN, 0.0, NaN, NaN, -0.5, NaN, NaN, NaN, 0.0, NaN, 0.0, NaN, NaN, NaN, NaN, NaN, 0.5, NaN, NaN, NaN, NaN, NaN, NaN, NaN, NaN, -1.0, NaN, -1.0, NaN, NaN, NaN, NaN, NaN, NaN, NaN, NaN, 0.0, NaN, NaN, NaN, 1.0, NaN, 0.5, NaN, NaN, NaN, NaN, NaN, NaN, NaN, NaN, NaN, NaN, NaN, 0.0, NaN, NaN, NaN, NaN, NaN, NaN, 0.0, NaN, NaN, NaN, NaN, NaN, 1.0, NaN, -1.0, NaN, NaN, 1.0, 0.0, 0.0, NaN, 0.0, NaN, NaN, NaN, 0.0, 0.0, NaN, NaN, NaN, NaN, 0.5, 0.0, -0.5, NaN, NaN, NaN, -1.0, NaN, NaN, NaN, NaN, NaN, NaN, NaN, NaN, NaN, NaN, NaN, 0.0, 0.0, NaN, 0.0, NaN, NaN, -0.5, NaN, NaN, 0.0, NaN, NaN, NaN, NaN, 0.0, NaN, NaN, NaN, 0.0, NaN, 0.5, NaN, NaN, NaN, NaN, NaN, NaN, NaN, NaN, NaN, NaN, NaN, 0.0, NaN, NaN, NaN, 1.0, NaN, 0.0, NaN, 0.5, NaN, NaN, NaN, NaN, 0.0, NaN, NaN, NaN, -1.0, NaN, NaN, NaN, NaN, NaN, 0.0, NaN, 0.0, NaN, NaN, NaN, NaN, NaN, NaN, NaN, NaN, NaN, NaN, 0.0, NaN, NaN, NaN, NaN, NaN, NaN, NaN, 0.0, 0.5, NaN, NaN, NaN, NaN, NaN, NaN, NaN, NaN, NaN, NaN, NaN, NaN, NaN, 0.0, NaN, NaN, NaN, NaN, 0.0, 0.0, 0.0, NaN, NaN, NaN, NaN, NaN, 0.0, -1.0, 0.0, NaN, 0.0, NaN, NaN, NaN, NaN, NaN, NaN, NaN, NaN, 0.0, NaN, NaN, NaN, NaN, NaN, NaN, NaN, NaN, NaN, 0.5, NaN, 0.0, NaN, NaN, NaN, NaN, NaN, NaN, NaN, NaN, -1.0, 0.0, NaN, 0.0, NaN, NaN, NaN, NaN, NaN, 0.0, NaN, NaN, NaN, NaN, NaN, 0.0, 0.0, -1.0, 0.0, NaN, 0.0, NaN, NaN, -1.0, NaN, NaN, NaN, NaN, NaN, 0.0, 0.5, NaN, 0.0, NaN, NaN, -1.0, NaN, 1.0, NaN, NaN, NaN, 1.0, NaN, NaN, 0.5, NaN",0.009,-0.045,"miser, foedero, uiolo, miser, periurium, poena, impunis, poena, capillus, polluo, uiolo, uerber, tu, dolus, hic, pudeo, tu, uendo, tu, pretium, tu, fallo, credulus, gena, conscius, tu, miser, stultus, tu, pudeo, tu, uendo, pretium, tu, uxor, inultus, dolus, tu, uestis, lasciuus, conuiuium, tu, stultus, tu, tu, tu, pecto, hic, tu, hic, hic, hic, trux, fera, blanditia, tu, uendo, tu, demens, poena, hic, tu",0.114
tibullus.elegies,1.1,"quis, sum, horreo, primus, qui, profero, ensis, quam, ferus, et, uerus, ferreus, ille, sum, tum, caedes, homo, gener, tum, proelio, nata, tum, breuis, dirus, mors, apertus, uia, sum, an, nihil, ille, miser, mereo, nos, ad, malus, noster, uerto, in, saeuus, qui, do, ille, ferus, diues, hic, uitium, sum, aurum, neque, bellum, sum, faginus, asto, cum, scyphus, ante, daps, non, arx, non, uallus, sum, somnus, peto, securus, spargo, dux, grex, inter, ouo, tunc, ego, uito, sum, uulgus, neque, tristis, nosco, arma, neque, audio, cor, mico, tuba, nunc, ad, bellum, traho, et, iam, quis, forsitan, hostis, haereo, in, noster, telum, gero, lateo, sed, patrius, seruo, lar, alo, et, idem, cursaris, uester, cum, tener, ante, pes, neu, pudeo, priscus, tu, sum, e, stipes, facio, sic, ueto, sedes, incolo, auus, tum, bonus, teneo, fides, cum, pauper, cultus, sto, in, exiguus, ligneus, aedes, deus, hic, placo, sum, seu, quis, libo, labrusca, seu, do, sancio, spiceus, sero, coma, atque, aliquis, uoueo, compos, libo, ipse, fero, post, comes, purus, filia, paruus, fauus, at, nos, aeratus, lar, depello, telum, hostia, e, plenus, rusticus, porcus, hara, hic, purus, cum, uestis, sequor, myrtum, canistrum, uincio, gero, myrtum, uincio, et, ipse, caput, sic, placeo, tu, alius, sum, fortis, in, arma, sterno, et, aduerro, martes, faueo, dux, ut, ego, poto, possum, suus, dico, facio, miles, et, in, mensa, pingo, castrum, merus, quis, furor, sum, ater, bellum, arcesso, mors, inmino, et, taceo, clam, uenio, ille, pes, non, seges, sum, infra, non, uinea, colo, sed, audax, cerberus, et, stygiae, nauta, turpis, aqua, illic, percutio, gena, uro, capillus, erro, ad, obscurus, pallidus, turba, lacus, quam, potis, laudo, hic, sum, qui, proles, paro, occupo, in, paruus, piger, senecta, cado, ipse, suus, sector, ouo, at, filius, agnus, et, calida, fatisco, con-paro, uxor, aqua, sic, ego, sum, liceo, caput, candescere, canis, tempus, et, priscus, facio, refero, senex, interea, pax, aruum, colo, pax, candidus, primus, duco, aro, sub, iugum, curuo, bos, pax, alo, uito, et, sucus, condo, labrusca, fundo, ut, natus, testa, paternus, merus, pax, bidens, uomerque, niteo, at, tristis, durus, miles, in, tenebrae, occupo, arma, sino, rusticus, e, lucus, ueho, malus, sobrius, ipse, uxor, plaustrum, progenies, domus, sed, uenio, tum, bellum, caleo, scissus, capillus, femina, perfringo, conqueror, foris, fleo, tener, subtusus, gena, sed, uictor, et, ipse, fleo, sui, demo, tam, ualeo, manus, at, lasciuus, amor, rixa, malus, uerbum, ministro, inter, et, irascor, lentus, uterque, sedeo, ab, lapis, sum, ferrum, suus, quicumque, puella, uerbero, e, caelum, deripio, ille, deus, sum, satis, e, membrum, tenuis, rescindo, uestis, sum, satis, orno, dissoluo, coma, sum, lacrima, moueo, satis, quater, ille, beatus, quo, tener, irascor, fleo, puella, possum, sed, manus, qui, saeuus, sum, scutum, sudo, is, gero, et, mitis, sum, procul, ab, uenio, at, nos, pax, almus, uenio, spica, teneo, perfluo, et, pomum, candidus, ante, sinus",453,"NaN, NaN, NaN, 0.5, NaN, NaN, NaN, NaN, -1.0, NaN, 0.5, NaN, NaN, NaN, NaN, -0.5, 0.0, NaN, NaN, NaN, NaN, NaN, NaN, -1.0, -1.0, NaN, 0.0, NaN, NaN, NaN, NaN, -1.0, NaN, NaN, NaN, -1.0, NaN, NaN, NaN, -1.0, NaN, NaN, NaN, -1.0, 0.5, NaN, -1.0, NaN, 0.5, NaN, 0.0, NaN, NaN, NaN, NaN, NaN, NaN, NaN, NaN, NaN, NaN, 0.0, NaN, 0.5, NaN, 1.0, NaN, 0.5, NaN, NaN, NaN, NaN, NaN, NaN, NaN, 0.0, NaN, -1.0, NaN, 0.0, NaN, NaN, NaN, NaN, NaN, NaN, NaN, 0.0, NaN, NaN, NaN, NaN, NaN, -1.0, NaN, NaN, NaN, NaN, NaN, NaN, NaN, 0.0, NaN, NaN, NaN, NaN, NaN, NaN, NaN, NaN, NaN, NaN, 0.0, NaN, NaN, 0.0, NaN, NaN, NaN, NaN, NaN, NaN, NaN, 0.0, NaN, NaN, NaN, 1.0, NaN, 1.0, NaN, -1.0, -0.5, NaN, NaN, 0.0, NaN, 0.0, 0.0, NaN, NaN, NaN, NaN, NaN, NaN, NaN, NaN, NaN, NaN, NaN, NaN, NaN, NaN, NaN, NaN, NaN, NaN, NaN, NaN, NaN, NaN, 1.0, NaN, 0.0, NaN, NaN, NaN, NaN, NaN, NaN, NaN, NaN, NaN, 0.0, -0.5, NaN, NaN, NaN, 1.0, NaN, NaN, NaN, NaN, NaN, NaN, NaN, NaN, NaN, NaN, NaN, 0.0, NaN, NaN, NaN, NaN, NaN, 0.5, NaN, 0.0, NaN, NaN, NaN, NaN, NaN, 0.5, NaN, NaN, NaN, NaN, NaN, NaN, NaN, 0.0, NaN, NaN, 0.0, NaN, NaN, NaN, NaN, -1.0, NaN, NaN, 0.0, NaN, -1.0, NaN, NaN, NaN, NaN, NaN, NaN, 0.0, NaN, NaN, NaN, NaN, NaN, NaN, NaN, NaN, NaN, NaN, NaN, NaN, NaN, -1.0, 0.0, NaN, NaN, NaN, NaN, NaN, 0.0, NaN, NaN, NaN, 0.0, 0.0, NaN, 0.0, NaN, NaN, NaN, NaN, 0.0, NaN, NaN, NaN, 0.0, NaN, NaN, NaN, NaN, NaN, NaN, NaN, NaN, 0.0, NaN, NaN, NaN, NaN, NaN, 0.0, 0.0, NaN, NaN, NaN, NaN, 0.0, NaN, NaN, 0.0, NaN, 0.0, NaN, NaN, 0.0, NaN, 0.5, NaN, NaN, 0.5, NaN, 0.5, NaN, NaN, NaN, NaN, NaN, NaN, 0.5, NaN, NaN, NaN, NaN, NaN, NaN, NaN, NaN, 0.0, 0.0, NaN, NaN, 0.5, NaN, NaN, NaN, NaN, -1.0, -0.5, 0.0, NaN, NaN, NaN, 0.0, NaN, -0.5, NaN, NaN, NaN, -1.0, NaN, NaN, 0.0, NaN, 0.0, 0.0, NaN, NaN, NaN, 0.0, NaN, NaN, NaN, 0.0, NaN, NaN, NaN, NaN, NaN, NaN, NaN, NaN, NaN, NaN, NaN, NaN, NaN, NaN, NaN, NaN, 0.0, NaN, NaN, 1.0, NaN, -1.0, 0.0, NaN, NaN, NaN, NaN, NaN, NaN, NaN, NaN, 0.0, NaN, NaN, NaN, NaN, NaN, NaN, NaN, 0.5, NaN, NaN, 0.0, NaN, 0.5, NaN, NaN, 0.0, NaN, NaN, NaN, 0.5, NaN, NaN, NaN, NaN, NaN, NaN, 0.5, NaN, NaN, 1.0, NaN, NaN, NaN, NaN, NaN, NaN, NaN, 0.0, NaN, -1.0, NaN, NaN, NaN, NaN, NaN, NaN, 1.0, NaN, NaN, NaN, NaN, NaN, NaN, 0.5, NaN, NaN, NaN, NaN, NaN, NaN, 0.0, NaN, NaN, NaN",-0.008,-0.045,"ferus, caedes, dirus, miser, saeuus, ferus, hic, pudeo, tu, ligneus, hic, hostia, hic, uestis, tu, furor, audax, turpis, gena, capillus, hic, uxor, testa, sobrius, uxor, capillus, gena, lasciuus, uerbero, uestis, saeuus",0.068
tibullus.elegies,2.1,"quisquis, adsum, faueo, frugis, lustro, et, ager, ritus, ut, ab, priscus, trado, extat, auus, bacche, uenio, dulcis, tuus, e, cornu, uua, pendeo, et, spica, tempus, cingo, cero, lux, sacer, requiesco, humus, requiesco, arator, et, grauis, suspendo, uomo, cesso, opus, soluo, uinculum, iugum, nunc, ad, praesaepe, debeo, plenus, corono, sto, bos, caput, omnis, sum, opero, deus, non, audeo, ullus, lanifica, pendo, impono, manus, tu, quoque, absum, procul, iubeo, discedo, ab, ara, qui, fero, hesternus, gaudium, nox, uenus, castus, placeo, superi, purus, cum, uestis, uenio, et, manus, purus, sumo, fons, aqua, cerno, fulgeo, ut, eo, sacer, agnus, ad, ara, uinctaque, post, olea, candidus, turba, como, deus, patrius, purgo, ager, purgo, agrestis, tu, malus, de, noster, pello, limes, neu, seges, eludo, messis, fallax, herba, neu, timeo, celer, tardus, agna, lupus, tunc, nitidus, plenus, confido, rusticus, ager, ingero, ardeo, grandis, lignum, focus, turbo, uernaris, satur, bonus, signum, colonus, ludo, et, ex, uirga, extruet, ante, cado, euenio, precor, uideo, -ne, ut, felix, exta, significo, placidus, nuntia, fibra, deus, nunc, ego, fumosus, uetus, profero, falernos, consul, et, chio, soluo, uinculum, cadus, uinum, dies, celebro, non, festus, lux, madeo, sum, rubor, erro, et, malus, fero, pes, sed, bene, messallam, suus, quisque, ad, poculum, dico, nomen, et, absum, singulus, uerbum, sono, gens, aquitanae, celeber, messalla, triumphus, et, magnus, intondeo, gloria, uictor, auis, huc, adsum, aspiraque, ego, dum, carmen, noster, reddo, agricola, gratia, caelitibus, rus, cano, rus, deus, hic, uita, magister, desueuit, quernus, pello, glande, fames, ille, compono, primus, doceo, tigillum, exiguus, uiridis, frons, operio, domus, ille, etiam, taurus, primus, doceo, fero, seruitium, et, plaustrum, suppono, rota, tum, uinco, abeo, ferio, tum, consero, pomus, tum, bibo, irriguus, fertilis, hortus, aqua, aureus, tum, premo, pes, do, uua, liquor, misceo, securus, sum, sobrius, lympha, merus, rus, fero, messis, calidus, cum, sido, aestus, depono, flauus, annuus, terra, como, rus, leuis, uernus, floreo, apis, ingero, alueus, compleo, ut, dulcis, sedulus, mel, fauus, agricola, assiduus, primus, satio, arater, canto, certus, rusticus, uerbum, pes, et, satur, areo, primus, sum, modulor, auena, carmen, ut, orno, dico, ante, deus, agricola, et, minium, suffundo, bacche, rubeo, primus, inexpertus, duco, ab, ars, chorus, hic, do, ab, plenus, memorabilis, munus, ouilis, dux, pecus, curtas, augeo, hircus, ops, rus, puer, uernus, primus, de, floreo, corona, facio, et, antiquus, impono, laris, rus, etiam, teneo, cura, exhibeo, puella, mollis, gero, tergum, lucidus, uellus, ouis, hinc, et, femineus, labor, sum, hinc, pensum, colus, fundo, et, appono, polliceo, uerso, opus, atque, aliqui, assiduus, textrix, opero, minerua, canto, et, ab, pulso, telum, sono, lateo, ipse, quoque, inter, ager, inter, armentum, cupido, nascor, et, indomitus, dico, inter, equa, illic, indoctus, primus, sui, exerceo, arcus, is, ego, quam, doceo, nunc, habeo, ille, manus, neque, pecus, uelut, ante, peto, figo, puella, gestio, et, audax, perdomo, uir, hic, iuuenis, detraho, ops, hic, dico, iubeo, limen, ad, irascor, uerbum, pudeo, senex, hic, dux, custos, furtim, transgredior, iaceo, ad, iuuenis, tenebrae, solus, puella, uenio, et, pes, praetempto, iter, suspendo, timor, exploro, caecus, qui, manus, ante, uia, ab, miser, qui, hic, grauis, deus, urgeo, at, ille, felix, qui, placidus, lenis, afflo, amor, sancio, uenio, daps, festus, sed, pono, sagitto, et, procul, ardeo, hinc, precor, abde, fax, tu, celebro, cantas, deus, pecus, uoco, uox, palam, pecus, clam, sui, quisque, uoco, aut, etiam, sui, quisque, palam, nam, rurba, iocosus, obstrepo, et, phrygio, tibia, curuo, sonus, ludo, iam, nox, iungo, equus, currus, sequor, mater, lasciuus, sidus, fuluus, chorus, post, uenio, taceo, furuis, circumdo, ala, somnus, et, incertum, somnio, niger, pes",564,"NaN, NaN, NaN, NaN, NaN, NaN, 0.0, NaN, NaN, NaN, 0.0, NaN, NaN, NaN, NaN, NaN, 0.5, 0.0, NaN, NaN, NaN, NaN, NaN, NaN, 0.0, NaN, NaN, NaN, 1.0, NaN, NaN, NaN, NaN, NaN, -0.5, NaN, NaN, NaN, 0.5, NaN, NaN, NaN, NaN, NaN, NaN, NaN, 0.0, NaN, NaN, NaN, 0.0, NaN, NaN, NaN, 0.0, NaN, NaN, NaN, NaN, NaN, NaN, 0.0, NaN, NaN, NaN, NaN, NaN, NaN, NaN, NaN, NaN, NaN, NaN, 1.0, 0.0, 1.0, NaN, NaN, NaN, 1.0, NaN, NaN, NaN, NaN, 0.0, 1.0, NaN, NaN, 0.0, NaN, NaN, NaN, NaN, 1.0, NaN, NaN, NaN, NaN, NaN, NaN, NaN, 0.0, NaN, 0.0, 0.0, NaN, 0.0, NaN, NaN, NaN, -1.0, NaN, NaN, NaN, 0.0, NaN, NaN, NaN, NaN, -1.0, NaN, NaN, NaN, NaN, NaN, 0.0, 0.0, NaN, 0.5, 0.0, NaN, -0.5, 0.0, NaN, NaN, 0.0, NaN, 0.0, NaN, NaN, 0.5, 1.0, 0.0, 0.0, NaN, NaN, NaN, NaN, NaN, NaN, NaN, NaN, NaN, NaN, NaN, NaN, 1.0, NaN, NaN, 1.0, NaN, NaN, 0.0, NaN, NaN, NaN, 0.0, NaN, NaN, 0.5, NaN, NaN, NaN, NaN, NaN, NaN, 0.0, NaN, NaN, NaN, NaN, NaN, NaN, NaN, 0.0, NaN, -1.0, NaN, 0.0, NaN, NaN, NaN, NaN, NaN, NaN, NaN, NaN, 0.0, NaN, NaN, 0.0, 0.0, NaN, 0.0, NaN, NaN, NaN, NaN, NaN, 0.0, NaN, 0.0, NaN, NaN, NaN, NaN, NaN, NaN, NaN, 0.0, NaN, NaN, NaN, 1.0, NaN, 0.0, NaN, 0.0, 0.0, NaN, 0.0, 0.5, NaN, NaN, NaN, NaN, -0.5, NaN, NaN, 0.5, NaN, NaN, 0.0, NaN, 0.0, NaN, 0.0, NaN, NaN, NaN, 0.5, NaN, NaN, -1.0, NaN, NaN, NaN, NaN, NaN, NaN, NaN, NaN, NaN, NaN, 0.0, NaN, NaN, NaN, 1.0, NaN, 0.0, 0.5, NaN, NaN, 0.0, NaN, NaN, NaN, NaN, 1.0, NaN, NaN, 0.0, NaN, 0.0, NaN, NaN, NaN, NaN, NaN, NaN, NaN, NaN, 0.0, 0.0, NaN, 0.0, 0.0, NaN, NaN, NaN, NaN, NaN, NaN, NaN, 0.5, NaN, NaN, NaN, NaN, 0.5, 0.5, NaN, NaN, 0.0, 0.5, -0.5, 0.0, 0.0, NaN, 0.5, NaN, 0.5, NaN, NaN, 0.0, 0.0, NaN, NaN, NaN, NaN, 0.0, NaN, NaN, NaN, NaN, NaN, NaN, 0.5, -0.5, NaN, NaN, 0.0, NaN, NaN, NaN, NaN, 0.0, NaN, 0.5, NaN, 0.5, NaN, NaN, NaN, NaN, 0.0, 0.0, 0.0, NaN, 0.5, NaN, NaN, NaN, NaN, NaN, 0.0, NaN, NaN, 0.0, NaN, NaN, -1.0, NaN, NaN, NaN, NaN, NaN, NaN, NaN, NaN, NaN, NaN, -0.5, -0.5, NaN, NaN, NaN, NaN, NaN, NaN, NaN, NaN, NaN, 0.5, NaN, NaN, 0.5, NaN, NaN, NaN, 0.0, NaN, NaN, NaN, NaN, NaN, NaN, NaN, NaN, NaN, 0.0, NaN, NaN, -0.5, NaN, NaN, NaN, NaN, NaN, NaN, NaN, NaN, 0.5, NaN, NaN, NaN, NaN, NaN, NaN, NaN, NaN, NaN, NaN, 0.0, NaN, NaN, NaN, NaN, NaN, NaN, NaN, NaN, NaN, NaN, NaN, 0.5, NaN, NaN, NaN, 0.0, NaN, NaN, NaN, NaN, NaN, NaN, 0.0, NaN, 0.0, NaN, 0.5, NaN, NaN, NaN, NaN, NaN, NaN, NaN, -0.5, NaN, NaN, NaN, 0.0, NaN, 0.0, NaN, -0.5, NaN, -1.0, NaN, 0.0, NaN, 0.0, NaN, -1.0, NaN, NaN, -0.5, 0.0, NaN, NaN, NaN, 1.0, NaN, 1.0, 1.0, NaN, 1.0, NaN, NaN, NaN, NaN, NaN, NaN, NaN, NaN, NaN, NaN, NaN, NaN, NaN, NaN, NaN, NaN, NaN, 0.0, NaN, NaN, 0.0, NaN, NaN, NaN, NaN, NaN, NaN, NaN, NaN, NaN, NaN, NaN, NaN, NaN, NaN, NaN, NaN, NaN, NaN, NaN, NaN, NaN, NaN, 0.0, NaN, NaN, NaN, NaN, 0.0, NaN, NaN, NaN, NaN, NaN, NaN, NaN, NaN, NaN, NaN, 0.5, NaN, NaN, NaN, NaN, 0.0",0.028,-0.022,"humus, tu, uestis, tu, agna, rubor, hic, sobrius, hic, indomitus, audax, hic, hic, pudeo, hic, iaceo, miser, hic, fax, tu, lasciuus",0.037
