Text,Stelle,Inahlt,Wortzahl,Sentiment Rechnung,Sentiment-Score,alternativer Sentiment-Score,Invektiven,Invektivitäts-Score
tibullus.elegies,2.2,"dico, bonus, uerbum, uenio, natal, ad, ara, quisquis, adsum, lingua, uir, mulier, for, uro, pius, tus, focus, uro, odoro, qui, tener, e, terra, diues, mitto, arabs, ipse, suus, genius, adsum, uideo, honor, qui, decoro, sancio, mollis, sero, como, ille, purus, destillo, tempus, nardus, atque, satur, libo, sum, madeo, merus, annuo, et, cornutus, tu, quicumque, rogo, en, ago, quis, cesso, annuo, ille, rogo, auguro, uxor, fidus, opto, amor, iam, reor, hic, ipse, edisco, deus, neque, tu, malo, totus, quicumque, per, orbis, fortis, aro, ualidus, rusticus, aruum, bos, neque, tu, gemmaris, quisquis, felix, indo, nascor, eoi, qui, mare, unda, rubeo, uotum, cado, utinam, strepito, aduolo, ala, flauus, coniugium, uinculum, porto, amor, uinculum, qui, maneo, semper, dum, tardus, senectus, induco, ruga, inficio, como, hic, uenio, natal, auis, proles, ministro, ludo, et, ante, tuus, turba, nouellus, pes",133,"NaN, 1.0, 0.0, NaN, NaN, NaN, NaN, NaN, NaN, -0.5, 0.5, 0.0, NaN, NaN, NaN, NaN, 0.0, NaN, NaN, NaN, NaN, NaN, 0.0, 0.5, NaN, NaN, NaN, NaN, NaN, NaN, NaN, 1.0, NaN, NaN, NaN, NaN, NaN, NaN, NaN, 1.0, NaN, 0.0, NaN, NaN, 0.5, NaN, NaN, NaN, NaN, NaN, NaN, NaN, NaN, NaN, NaN, NaN, NaN, NaN, NaN, NaN, NaN, NaN, NaN, 0.0, 1.0, NaN, 1.0, NaN, NaN, NaN, NaN, NaN, 0.0, NaN, NaN, NaN, NaN, NaN, NaN, NaN, 0.5, NaN, 1.0, -0.5, NaN, NaN, NaN, NaN, NaN, NaN, 1.0, NaN, NaN, NaN, NaN, 0.0, 0.0, NaN, 0.0, NaN, NaN, NaN, NaN, NaN, NaN, NaN, NaN, NaN, 1.0, NaN, NaN, NaN, NaN, NaN, NaN, 0.0, NaN, NaN, NaN, NaN, NaN, NaN, NaN, NaN, 0.0, NaN, NaN, NaN, NaN, 0.0, 0.0, NaN, 0.0",0.068,-0.008,"mulier, tu, uxor, hic, tu, tu, hic",0.053
tibullus.elegies,2.3,"rus, meus, cornutus, teneo, uilla, puella, ferreus, sum, heu, heu, quisquis, in, urbs, maneo, ipse, uenus, fero, iam, nunc, migro, in, ager, uerbum, arator, rusticus, disco, amor, o, ego, cum, aspicio, domina, quam, fortis, illic, uersaris, ualidus, pinguis, bidens, solus, agricola, modo, curuus, sector, arater, dum, subigo, sterilis, aruum, sero, bos, neque, queror, qui, sol, gracilis, exuro, artus, laedo, et, tener, pussula, rumpo, manus, pasco, et, admetior, taurus, formosus, apollo, neque, cithara, intondeo, profueruntue, coma, neque, possum, cura, sano, salubris, herba, quisquis, sum, medica, uinco, ars, amor, ipse, deus, soleo, stabulis, expello, uaccas, et, misceo, nouus, doceo, coagulo, lac, lacteus, et, misceo, ob-rigesco, liquo, tunc, fiscella, leuis, detexo, sum, uimen, iuncus, rarus, per, necto, sum, uia, facio, serus, o, quotiens, ille, uitulus, gesto, per, ager, dico, occurro, erubesco, soror, o, quotiens, audeo, caneo, dum, ualles, sub, altus, rumpo, mugitus, carmen, doceo, bos, saepe, dux, trepidus, peto, oraculum, res, uenio, et, ab, templum, irrito, turba, domus, saepe, horreo, sacer, doleo, latona, capillus, qui, admiror, sum, ipse, nouerca, prior, quisquis, inornatus, caput, crinis, soluo, aspicio, phoebus, quaero, ille, como, delos, ubi, nunc, phoebus, tuus, sum, ubi, delphica, pytho, nempe, amor, in, paruus, tu, iubeo, sum, cado, felix, olim, ueneri, cum, fero, apertus, seruio, aeternus, non, pudeo, deus, fabula, nunc, ille, sum, sed, qui, suus, cura, puella, sum, fabula, sum, malo, quam, sine, amor, deus, at, tu, quisquis, is, sum, qui, tristis, frons, cupido, impero, ut, noster, sum, tuus, castrum, domus, ferreus, non, uenerem, sed, praeda, saeculum, laudo, praeda, tamen, multus, sum, opero, malus, praeda, ferus, acies, cingo, discordibus, arma, hinc, cruor, hinc, caedes, mors, propio, uenio, praeda, uago, iubeo, geminaris, periculum, pontus, bellicus, cum, dubius, rostrum, do, ratis, praedator, cupio, immensus, obsido, campus, ut, multus, innumerus, iugerum, pasco, ouis, qui, lapis, externus, cura, sum, urbs, tumultus, porto, ualidus, mille, columna, iugum, claudo, et, indomitus, moles, mare, lentus, ut, intra, neglego, hiberno, piscis, adsum, minae, at, ego, laetus, traho, zamia, conuiuium, testa, fingo, cumana, lubricus, terra, rota, heu, heu, diues, uideo, gaudeo, puella, iam, uenio, praeda, si, uenus, opto, ops, ut, meus, luxuria, nemesis, fluo, ut, per, urbs, incedo, donum, conspicio, meus, ille, gero, uestis, tenuis, qui, femina, cous, texuit, auro, dispono, uia, ille, sum, comes, fuscus, qui, india, torreo, sol, et, admoueo, inficio, ignis, equus, ille, seligo, certo, praebeo, color, africa, puniceus, purpureus, tyros, nosco, loquor, regnum, ipse, teneo, qui, saepe, cogo, barbarum, gypso, fero, catasta, pes, at, tu, durus, seges, nemesim, qui, abduco, ab, urbs, persoluat, nullus, semen, terra, fides, et, tu, bacche, tener, iucundus, consitor, uua, tu, quoque, de_-uoueo, bacche, relinquo, lacus, haud, impunis, licet, formosus, tristis, ager, abdo, non, tantus, sum, tuus, mustus, pater, o, ualeo, frugis, ne, sum, modo, rus, puella, glans, alo, et, priscus, mos, bibo, aqua, glans, alo, ueteres, et, passim, semper, amo, quis, noceo, sulcus, non, habeo, sero, tunc, qui, aspiro, amor, praebeo, apertus, mitis, in, umbrosus, gaudium, ualles, uenus, nullus, sum, custos, nullus, excludo, doleo, ianua, si, fas, sum, mos, precor, ille, redeo, horridus, uillosus, corpus, uestis, tego, nunc, si, claudo, meus, sum, si, copia, rarus, uideo, heu, miser, laxus, quis, iuuo, sum, toga, duco, ad, imperium, domina, sulco, ager, non, ego, ego, uinclum, uerber, nego",522,"0.0, 0.0, NaN, NaN, NaN, NaN, NaN, NaN, NaN, NaN, NaN, NaN, 0.5, NaN, NaN, 1.0, NaN, NaN, NaN, NaN, NaN, 0.0, 0.0, NaN, -0.5, NaN, 1.0, NaN, NaN, NaN, NaN, NaN, NaN, 0.5, NaN, NaN, 1.0, NaN, NaN, -0.5, NaN, NaN, NaN, NaN, NaN, NaN, NaN, -0.5, NaN, NaN, NaN, NaN, NaN, NaN, NaN, NaN, NaN, NaN, NaN, NaN, NaN, NaN, NaN, 0.0, NaN, NaN, NaN, NaN, 1.0, NaN, NaN, NaN, NaN, NaN, NaN, NaN, NaN, -1.0, NaN, 1.0, NaN, NaN, NaN, NaN, NaN, 0.0, 1.0, NaN, 0.0, NaN, NaN, NaN, NaN, NaN, NaN, 1.0, NaN, NaN, NaN, NaN, NaN, NaN, NaN, NaN, NaN, NaN, 0.0, NaN, NaN, NaN, NaN, NaN, NaN, NaN, NaN, 0.0, NaN, NaN, NaN, NaN, NaN, NaN, NaN, NaN, 0.0, NaN, NaN, NaN, NaN, NaN, NaN, NaN, NaN, NaN, NaN, NaN, 0.5, NaN, NaN, 0.0, NaN, NaN, NaN, 0.5, -1.0, NaN, NaN, 0.0, NaN, NaN, NaN, NaN, NaN, 0.0, 0.0, NaN, NaN, 1.0, NaN, NaN, NaN, NaN, NaN, NaN, NaN, NaN, 0.5, NaN, NaN, 0.0, NaN, NaN, NaN, NaN, NaN, NaN, NaN, NaN, NaN, NaN, NaN, 0.0, NaN, NaN, NaN, NaN, NaN, 1.0, NaN, 0.0, NaN, NaN, NaN, NaN, 1.0, NaN, NaN, NaN, NaN, NaN, NaN, 0.5, NaN, NaN, 0.0, 0.0, NaN, NaN, NaN, NaN, NaN, NaN, -1.0, NaN, NaN, 0.0, NaN, NaN, NaN, NaN, 1.0, 0.0, NaN, NaN, NaN, NaN, NaN, NaN, -1.0, 0.0, -0.5, NaN, NaN, NaN, NaN, 0.0, NaN, 0.0, NaN, NaN, NaN, NaN, NaN, NaN, NaN, NaN, NaN, 0.0, NaN, NaN, -1.0, NaN, -1.0, 0.0, NaN, NaN, 0.0, NaN, NaN, NaN, -0.5, -1.0, NaN, NaN, NaN, NaN, NaN, NaN, -1.0, 0.0, 0.0, NaN, -0.5, NaN, NaN, NaN, NaN, NaN, 0.0, NaN, 0.0, NaN, 0.0, NaN, NaN, NaN, NaN, NaN, 0.0, 0.0, -1.0, NaN, 0.5, NaN, NaN, 1.0, NaN, NaN, NaN, NaN, NaN, NaN, NaN, 0.0, NaN, NaN, NaN, NaN, NaN, NaN, NaN, -0.5, NaN, NaN, 1.0, NaN, NaN, NaN, 0.0, NaN, NaN, NaN, 0.0, NaN, NaN, NaN, 0.5, NaN, NaN, NaN, NaN, NaN, NaN, NaN, 1.0, NaN, 0.0, NaN, 0.0, -0.5, NaN, NaN, NaN, NaN, 0.5, NaN, 0.0, NaN, 0.0, NaN, NaN, NaN, 0.0, NaN, 0.0, NaN, NaN, NaN, NaN, 0.0, NaN, NaN, NaN, NaN, NaN, NaN, NaN, NaN, NaN, NaN, NaN, 0.0, NaN, NaN, NaN, NaN, NaN, 0.0, NaN, NaN, NaN, NaN, NaN, NaN, 0.0, NaN, NaN, NaN, NaN, NaN, NaN, NaN, NaN, NaN, 0.0, NaN, NaN, -0.5, NaN, NaN, NaN, NaN, NaN, 0.5, NaN, NaN, NaN, 0.0, 1.0, NaN, NaN, NaN, NaN, 1.0, NaN, NaN, NaN, NaN, NaN, NaN, NaN, 0.0, NaN, -0.5, NaN, 1.0, -1.0, 0.0, NaN, NaN, NaN, NaN, 0.0, NaN, 0.0, NaN, NaN, NaN, NaN, NaN, NaN, 0.0, NaN, NaN, NaN, NaN, 0.0, 0.5, NaN, 0.0, NaN, NaN, NaN, NaN, NaN, NaN, NaN, NaN, NaN, NaN, NaN, NaN, NaN, NaN, NaN, NaN, 1.0, NaN, NaN, 1.0, NaN, NaN, 1.0, NaN, 1.0, NaN, NaN, NaN, NaN, NaN, NaN, NaN, NaN, NaN, NaN, 0.5, NaN, NaN, NaN, -1.0, NaN, 0.0, NaN, NaN, NaN, NaN, NaN, 0.0, NaN, NaN, 0.5, NaN, NaN, NaN, -1.0, NaN, NaN, NaN, NaN, NaN, NaN, NaN, 0.0, NaN, NaN, 0.0, NaN, NaN, NaN, NaN, NaN, NaN",0.02,-0.033,"heu, heu, erubesco, capillus, nouerca, tu, pudeo, tu, ferus, cruor, caedes, indomitus, conuiuium, testa, fingo, heu, heu, luxuria, uestis, puniceus, barbarum, gypso, catasta, tu, tu, tu, impunis, noceo, uillosus, uestis, heu, miser, uinclum, uerber",0.065
tibullus.elegies,2.4,"hic, ego, seruitium, uideo, domina, paro, iam, ego, libertas, ille, paternus, ualeo, seruitium, sed, tristis, do, teneo, catena, et, numquam, mitto, uinculum, remitto, amor, et, seu, quis, mereo, seu, nihil, pecco, uro, uro, io, remus, saeuus, puella, fax, o, ego, ne, possum, talis, sentio, dolor, quam, malo, in, gelidus, mons, sum, lapis, sto, uel, insanus, cautes, obnoxius, uentus, naufragus, quam, uastus, tundo, unda, mare, nunc, et, amarus, dies, et, nox, amarus, umbra, sum, omnis, nam, tristis, tempus, felle, madeo, neque, prosum, eligo, neque, carmen, auctor, apollo, ille, cauus, pretium, flagito, usque, manus, eo, procul, musa, si, non, prosum, amo, non, ego, tu, ut, sum, bellum, caneo, colo, neque, refero, solus, uia, et, qualis, ubi, orbis, compleo, uerto, luna, recurro, equus, ad, domina, facilis, aditus, per, carmen, quaero, eo, procul, musa, si, nihil, iste, ualeo, at, ego, per, caedes, et, facinus, sum, donum, paro, ne, iaceo, claudo, flebilis, ante, domus, aut, rapio, suspendo, sacrum, insigne, fanum, sed, uenus, ante, alius, sum, uiolo, ego, ille, malus, facinus, suadeo, domina, rapax, do, ego, sacrilega, sentio, ille, manus, o, pereo, quicumque, lego, uiridis, smaragdus, et, niueus, tyrio, murex, tingo, ouis, addo, auaritia, causa, et, cous, puella, uestis, et, e, rubrus, lucidus, concha, mare, hic, facio, mala, hinc, clauim, ianua, sentio, et, coepio, custos, limen, sum, canis, sed, pretium, si, grandis, ferus, custodia, uiuo, sum, neque, prohibeo, clauis, et, canis, ipse, taceo, heu, quicumque, do, fomlam, caelestis, auarus, qualis, bonus, multus, affero, ille, malus, hinc, fletus, rixa, sono, hic, denique, causa, facio, ut, infamis, nunc, deus, erro, amor, at, tu, qui, pretium, uinco, excludo, amo, eripio, pario, uentus, et, ignis, ops, quin, tuus, tunc, iuuenis, specto, incendium, laetus, neque, quisquam, flamma, sedulus, addo, aqua, seu, uenio, tu, mors, neque, sum, qui, lugeo, ullus, neque, qui, do, maestus, munus, in, exsequiae, at, bonus, qui, neque, auarus, sum, centum, licet, annus, uiuo, ardeo, fleo, ante, rogus, atque, aliquis, senex, ueteres, ueneror, amor, annuus, construo, sero, do, tumulus, et, bene, discedo, dico, placidus, quiesco, terra, securus, sum, super, os, leuis, uerus, quidem, moneo, sed, prosum, quis, ego, uerus, ille, sum, nos, lex, colo, amor, quin, etiam, sedes, iubeo, si, uendo, auitus, eo, sub, imperium, sub, titulus, lar, quisquis, habeo, circos, quisquis, medea, uenenum, quisquis, et, herba, thessala, terra, gero, et, qui, ubi, indomitus, grex, uenus, afflo, amor, hippomanes, cupidus, stillo, ab, inguine, equa, si, modo, ego, placidus, uideo, nemesis, meus, uultus, mille, alius, herba, misceo, ille, bibo",399,"NaN, NaN, -1.0, NaN, NaN, NaN, NaN, NaN, 0.5, NaN, NaN, NaN, -1.0, NaN, -1.0, NaN, NaN, 0.0, NaN, NaN, NaN, NaN, NaN, 1.0, NaN, NaN, NaN, NaN, NaN, NaN, NaN, NaN, NaN, NaN, NaN, -1.0, NaN, NaN, NaN, NaN, NaN, NaN, NaN, NaN, -1.0, NaN, NaN, NaN, NaN, NaN, NaN, 0.0, NaN, NaN, -1.0, 0.0, -0.5, NaN, -0.5, NaN, -1.0, NaN, 0.0, 0.0, NaN, NaN, -0.5, 0.0, NaN, 0.0, -0.5, NaN, NaN, NaN, NaN, -1.0, 0.0, NaN, NaN, NaN, NaN, NaN, NaN, 0.0, NaN, NaN, NaN, NaN, 1.0, NaN, NaN, 0.0, NaN, NaN, NaN, NaN, NaN, NaN, NaN, NaN, NaN, NaN, NaN, NaN, 0.0, NaN, NaN, NaN, NaN, -0.5, 0.0, NaN, NaN, NaN, NaN, NaN, NaN, NaN, NaN, NaN, NaN, NaN, 0.5, NaN, NaN, 0.0, NaN, NaN, NaN, NaN, NaN, NaN, NaN, NaN, NaN, NaN, NaN, -0.5, NaN, -1.0, NaN, 0.0, NaN, NaN, NaN, NaN, -1.0, NaN, 0.0, NaN, NaN, NaN, NaN, NaN, NaN, NaN, 1.0, NaN, NaN, NaN, NaN, NaN, NaN, -1.0, -1.0, NaN, NaN, NaN, NaN, NaN, NaN, NaN, NaN, 0.0, NaN, NaN, NaN, NaN, NaN, NaN, NaN, NaN, NaN, NaN, NaN, NaN, NaN, -1.0, 0.0, NaN, NaN, NaN, NaN, NaN, NaN, NaN, NaN, NaN, 0.0, NaN, NaN, NaN, NaN, NaN, NaN, NaN, NaN, NaN, NaN, NaN, NaN, NaN, NaN, 1.0, NaN, 0.0, -1.0, NaN, NaN, NaN, NaN, NaN, NaN, NaN, NaN, NaN, NaN, NaN, NaN, NaN, NaN, NaN, -1.0, NaN, 1.0, 0.0, NaN, NaN, -1.0, NaN, NaN, NaN, NaN, NaN, NaN, 0.0, NaN, NaN, -1.0, NaN, 0.0, 0.0, 1.0, NaN, NaN, NaN, 1.0, NaN, NaN, NaN, NaN, NaN, NaN, NaN, 0.0, 0.0, NaN, 0.0, NaN, NaN, NaN, NaN, 1.0, NaN, NaN, NaN, NaN, NaN, 0.0, NaN, NaN, NaN, -1.0, NaN, NaN, NaN, NaN, NaN, NaN, NaN, NaN, -1.0, 0.5, NaN, -0.5, NaN, 1.0, NaN, NaN, -1.0, NaN, NaN, NaN, 0.0, NaN, NaN, NaN, NaN, NaN, NaN, NaN, 0.0, NaN, NaN, 1.0, 0.0, NaN, NaN, NaN, NaN, NaN, NaN, NaN, NaN, 1.0, NaN, 0.0, 1.0, NaN, NaN, 0.0, 0.0, 0.5, NaN, NaN, NaN, NaN, NaN, NaN, 0.5, NaN, NaN, NaN, 0.5, NaN, 1.0, NaN, NaN, 0.0, NaN, NaN, NaN, NaN, NaN, NaN, 0.0, NaN, NaN, NaN, NaN, NaN, NaN, NaN, NaN, -0.5, NaN, NaN, NaN, NaN, 0.0, NaN, NaN, NaN, NaN, NaN, NaN, 1.0, NaN, 1.0, NaN, -0.5, NaN, NaN, NaN, NaN, NaN, NaN, NaN, 1.0, NaN, NaN, 0.0, NaN, NaN, NaN, NaN, NaN, NaN, NaN",-0.014,-0.061,"hic, catena, saeuus, fax, insanus, naufragus, uastus, pretium, tu, caedes, facinus, iaceo, uiolo, facinus, niueus, auaritia, uestis, hic, pretium, ferus, heu, auarus, hic, infamis, tu, pretium, tu, auarus, rogus, uendo, medea, indomitus",0.08
tibullus.elegies,2.5,"phoebus, for, nouus, ingredior, tuus, templum, sacerdos, huc, ago, cum, cithara, carmen, uenio, nunc, tu, uocal, impello, polliceo, chorda, nunc, precor, ad, laus, flecto, uerbum, meus, ipse, triumphal, deuincio, tempus, laurus, dum, cumulo, ara, ad, tuus, sacer, uenio, sed, nitidus, pulcher, uenio, nunc, induo, uestis, sepono, longus, nunc, bene, pecto, como, qual, tu, memoro, saturno, rex, fugo, uictor, laus, concino, iuppiter, tu, procul, euenio, uideo, tu, dedo, augur, scio, bene, quis, fatum, prouidus, canto, auis, tu, rex, sors, per, tu, praesentio, haruspex, lubricus, signo, cum, deus, exta, nosco, tu, dux, romanus, numquam, frustro, sibylla, abdo, qui, senex, fatum, cano, pes, phoebus, sacer, messalinum, sine, tango, charta, uates, et, ipse, precor, quis, cano, ille, doceo, hic, do, aeneus, sors, postquam, ille, parens, dico, et, rapio, sustineo, lar, neque, sum, credo, roma, cum, maestus, ab, altus, ilium, -ne, ardeo, respicio, deus, romulus, aeternus, nondum, formo, urbs, moenia, consortio, non, habito, remus, sed, tunc, pasco, herbosus, palatium, uacca, et, sto, humilis, in, iuppiter, arx, cado, lac, madeo, illic, subsum, pan, ilex, umbra, et, facio, agrestis, ligneus, falx, pal, pendeo, uagus, pastor, in, arbor, uotum, garrulus, siluestri, fistula, sacer, deus, fistula, qui, semper, decresco, harundo, ordo, nam, calamus, cero, iungo, usque, paruus, at, qui, uelabrum, regius, pateo, eo, soleo, exiguus, pello, per, uadum, linter, aqua, ille, saepe, grex, diues, placeo, magister, ad, iuuenis, festus, sum, ueho, puella, dies, cum, qui, fecundus, redeo, munus, rus, caseus, et, niueus, candidus, agnus, ouis, impiger, aeneas, uolito, frater, amor, troica, qui, profugio, sacer, ueho, ratis, iam, tu, laurentes, ad-signo, iuppiter, ager, iam, uoco, erro, hospita, terra, lar, illic, sancio, sum, cum, tu, ueneror, numici, unda, deus, caelum, mitto, indigeto, ecce, super, fessus, uolito, uictoria, puppis, tandem, ad, troianos, diuus, superbus, uenio, ecce, ego, luceo, rutulis, incendium, castrum, iam, tu, praedico, barbaris, turne, nex, ante, oculus, laurens, castra, murus, lauinium, sum, album, ab, ascanius, condio, longus, dux, tu, quoque, iam, uideo, mars, placeo, sacerdos, ilia, uestal, desero, focus, concubo, tuus, furtim, uitta, iaceo, et, cupidus, ad, ripa, arma, relinquo, deus, carpo, nunc, taurus, de, septem, mons, herba, dum, licet, hic, magnus, iam, locus, urbs, sum, roma, tuus, nomen, terra, fatalis, rego, qui, suus, de, caelum, prospicio, aruum, cero, quisque, pateo, ortus, et, qui, fluito, unda, sol, anhelo, abluo, amnis, equus, troia, quidem, tunc, sui, miro, et, sui, dico, tu, bene, tam, longus, consulo, uia, uerus, cano, sic, usque, sacer, innoxius, laurus, uescar, et, aeternus, sum, ego, uirginitas, hic, cano, uates, et, tu, sui, phoebus, uoco, iacto, fundo, et, caput, ante, como, quisquis, amalthea, quisquis, marpesia, dico, herophilis, phyto, graius, qui, admoneo, quisque, aniena, sacer, tiburs, per, flumen, sors, portarat, sicco, perfero, sinus, hic, sum, dico, bellum, malus, signum, cometes, -ne, multus, ut, in, terra, depluo, lapis, atque, tuba, atque, arma, fero, strepito, caelum, audio, et, lucus, praecino, fuga, ipse, etiam, sol, deficio, lumen, uideo, iungo, palleo, nubilus, annus, equus, et, simulacrum, deus, lacrima, fundo, tepeo, for, uocal, praemoneo, bos, hic, sum, olim, sed, tu, iam, mitis, apollo, prodigium, indomitus, mergo, sub, aequor, et, succendo, sacrum, crepito, bene, laureus, flamma, omen, quo, felix, et, sacer, annus, sum, laurus, ubi, bonus, signum, do, gaudeo, colonus, distendo, spica, horreum, plenus, cero, obliuiscor, et, mustus, ferio, pes, rusticus, uua, dolium, dum, magnus, deficio, lacus, atque, madidus, baccho, suus, festus, palilia, pastor, concino, ab, stabulis, tunc, procul, sum, lupus, ille, leuis, stipula, sollemnis, potus, aceruus, accendo, flamma, transilietque, sacer, et, fetus, matrona, do, nascor, parens, osculum, comprensis, auris, eripio, neque, taedet, auus, paruus, aduigilaris, nepos, balbus, cum, puer, dico, uerbum, senex, tunc, opero, deus, pubes, discumbo, in, herba, arbor, antiquus, qui, leuis, umbra, cado, aut, e, uestis, suus, tendo, umbraculum, serta, uincio, corono, sto, et, ipse, calix, at, sui, quisque, daps, et, festus, extruet, altus, caespes, mensa, caespes, torus, ingero, hic, potus, iuuenis, maledico, puella, postmodo, qui, uotum, irrito, facio, uolo, nam, ferus, ille, suus, ploro, sobrius, idem, et, sui, iuro, mens, sum, malus, pax, tuus, pereo, arcus, pereo, sagitta, phoebus, modo, in, terra, erro, inermis, amor, ars, bonus, sed, postquam, sumo, sui, telum, cupido, heu, heu, quam, multus, ars, do, iste, malus, et, ego, praecipuus, iaceo, cum, saucius, annus, et, faueo, morbus, cum, iuuo, ipse, dolor, usque, cano, nemesim, sine, qui, uersus, ego, nullus, uerbum, possum, iustus, aut, reperio, pes, at, tu, nam, diuus, seruo, tutela, poeta, praemoneo, uates, parco, puella, sacro, ut, messalinum, celebro, cum, praemium, bellum, ante, suus, currus, oppidum, uiuo, fero, ipse, gero, laurus, laurus, deuincio, agrestis, miles, io, magnus, uox, triumphus, cano, tunc, messalla, meus, pius, do, spectaculum, turba, et, plaudo, currus, praetereo, pater, annuo, sic, tu, sum, intondeo, phoebus, capillus, sic, tuus, perpetuus, sum, tu, castus, soror",759,"NaN, NaN, 1.0, NaN, 0.0, NaN, NaN, NaN, NaN, NaN, NaN, 0.0, NaN, NaN, NaN, NaN, NaN, NaN, 1.0, NaN, NaN, NaN, 1.0, NaN, 0.0, 0.0, NaN, NaN, NaN, 0.0, NaN, NaN, NaN, NaN, NaN, 0.0, 1.0, NaN, NaN, 0.5, 1.0, NaN, NaN, NaN, NaN, NaN, 0.0, NaN, NaN, NaN, NaN, NaN, NaN, NaN, NaN, 0.0, NaN, NaN, 1.0, NaN, NaN, NaN, NaN, NaN, NaN, NaN, NaN, NaN, NaN, NaN, NaN, 0.0, 1.0, 0.0, NaN, NaN, 0.0, -1.0, NaN, NaN, NaN, NaN, NaN, NaN, NaN, 0.0, NaN, NaN, NaN, 0.5, NaN, NaN, NaN, NaN, NaN, NaN, 0.0, 0.0, NaN, 0.0, NaN, 1.0, NaN, NaN, NaN, NaN, NaN, NaN, NaN, NaN, NaN, NaN, NaN, NaN, NaN, NaN, 0.0, -1.0, NaN, NaN, 0.5, NaN, NaN, NaN, NaN, NaN, NaN, NaN, NaN, NaN, NaN, -1.0, NaN, 0.5, NaN, NaN, NaN, NaN, 0.0, NaN, 0.5, NaN, NaN, 0.5, NaN, NaN, NaN, NaN, NaN, NaN, NaN, NaN, NaN, NaN, NaN, NaN, NaN, NaN, NaN, NaN, NaN, NaN, NaN, NaN, NaN, NaN, NaN, NaN, NaN, NaN, NaN, NaN, NaN, NaN, NaN, NaN, NaN, NaN, NaN, NaN, 0.0, NaN, NaN, NaN, 1.0, 0.0, NaN, NaN, NaN, NaN, NaN, 0.5, NaN, NaN, NaN, NaN, NaN, 0.0, NaN, NaN, NaN, 0.0, NaN, NaN, NaN, 0.0, NaN, NaN, NaN, NaN, 0.0, NaN, NaN, NaN, 0.5, NaN, 0.5, NaN, NaN, NaN, NaN, NaN, NaN, 0.0, NaN, NaN, 1.0, NaN, 0.5, 0.0, NaN, NaN, NaN, NaN, NaN, NaN, NaN, NaN, NaN, 0.0, 1.0, NaN, NaN, NaN, 1.0, NaN, NaN, NaN, NaN, NaN, NaN, NaN, 0.0, NaN, NaN, 0.0, 0.5, 0.0, NaN, NaN, NaN, NaN, NaN, NaN, NaN, NaN, 0.0, 0.0, 0.5, NaN, NaN, NaN, NaN, NaN, NaN, NaN, NaN, NaN, NaN, NaN, 0.0, -1.0, NaN, NaN, NaN, NaN, NaN, NaN, NaN, NaN, NaN, NaN, NaN, NaN, -1.0, NaN, 0.0, NaN, 0.0, NaN, NaN, NaN, NaN, NaN, NaN, NaN, 0.0, 0.5, NaN, NaN, NaN, NaN, NaN, NaN, NaN, NaN, NaN, NaN, 0.0, NaN, 0.0, NaN, NaN, NaN, NaN, -0.5, NaN, NaN, 0.0, NaN, 0.0, NaN, NaN, NaN, NaN, NaN, NaN, NaN, NaN, NaN, NaN, 0.0, NaN, 0.0, 0.5, NaN, NaN, 0.0, 0.0, 0.0, 0.0, NaN, NaN, NaN, NaN, 0.5, NaN, NaN, NaN, NaN, NaN, NaN, NaN, NaN, NaN, 0.0, NaN, NaN, NaN, NaN, NaN, NaN, NaN, NaN, NaN, NaN, NaN, NaN, NaN, NaN, NaN, NaN, 0.0, NaN, 0.0, 0.5, NaN, NaN, NaN, 1.0, 0.5, NaN, NaN, NaN, 0.5, NaN, NaN, NaN, NaN, NaN, NaN, NaN, NaN, NaN, NaN, NaN, NaN, NaN, NaN, 0.0, NaN, NaN, NaN, NaN, NaN, NaN, NaN, NaN, NaN, NaN, NaN, NaN, NaN, NaN, 1.0, NaN, NaN, NaN, -1.0, NaN, NaN, NaN, NaN, NaN, NaN, NaN, 0.0, -1.0, 0.0, NaN, NaN, 0.0, NaN, NaN, 0.0, NaN, 0.0, NaN, NaN, NaN, 0.0, NaN, NaN, 0.5, NaN, NaN, NaN, NaN, -0.5, NaN, NaN, NaN, NaN, NaN, NaN, NaN, NaN, NaN, 0.0, NaN, NaN, 0.0, 0.0, NaN, NaN, NaN, NaN, NaN, NaN, NaN, NaN, NaN, NaN, NaN, NaN, NaN, 1.0, NaN, 0.0, NaN, NaN, NaN, 0.0, NaN, NaN, NaN, NaN, NaN, NaN, NaN, NaN, NaN, 1.0, NaN, 1.0, 0.0, NaN, NaN, NaN, 1.0, 0.0, NaN, NaN, 0.0, NaN, NaN, NaN, 0.0, NaN, NaN, NaN, NaN, NaN, 0.0, -0.5, NaN, NaN, NaN, 0.0, NaN, 0.0, NaN, NaN, NaN, NaN, NaN, NaN, NaN, NaN, NaN, NaN, NaN, NaN, NaN, 0.0, NaN, 0.0, NaN, 0.0, NaN, NaN, NaN, NaN, NaN, 1.0, NaN, NaN, -0.5, NaN, NaN, 0.5, 0.0, NaN, NaN, NaN, NaN, NaN, NaN, 0.0, NaN, 0.0, NaN, NaN, 0.0, NaN, 0.0, 0.0, NaN, NaN, 0.0, NaN, NaN, NaN, NaN, NaN, 0.0, NaN, 0.0, NaN, NaN, NaN, NaN, NaN, NaN, NaN, NaN, NaN, NaN, NaN, NaN, NaN, NaN, NaN, NaN, NaN, NaN, NaN, NaN, NaN, NaN, 0.5, NaN, 0.0, NaN, NaN, NaN, NaN, NaN, NaN, NaN, NaN, NaN, NaN, 0.0, NaN, NaN, NaN, NaN, -1.0, NaN, NaN, NaN, NaN, NaN, NaN, NaN, NaN, 0.5, NaN, -1.0, 0.5, 0.0, NaN, NaN, NaN, NaN, NaN, NaN, NaN, 0.0, 0.0, 0.0, 1.0, 0.0, 1.0, NaN, NaN, NaN, NaN, NaN, -0.5, NaN, NaN, NaN, 0.0, 0.0, NaN, NaN, -1.0, NaN, NaN, 0.0, NaN, NaN, NaN, 0.0, NaN, NaN, -1.0, NaN, NaN, NaN, -1.0, NaN, NaN, NaN, NaN, NaN, NaN, NaN, NaN, 0.0, NaN, 1.0, NaN, NaN, 0.0, NaN, NaN, NaN, 0.0, NaN, NaN, 0.0, NaN, NaN, NaN, NaN, NaN, NaN, NaN, NaN, NaN, 1.0, 0.0, NaN, NaN, NaN, NaN, NaN, NaN, NaN, NaN, NaN, NaN, NaN, NaN, 0.0, NaN, 0.0, 0.0, NaN, NaN, NaN, NaN, 0.0, NaN, NaN, 0.0, 0.0, NaN, NaN, NaN, NaN, 0.0, NaN, NaN, NaN, NaN, NaN, NaN, NaN, NaN, 0.0, 0.0, NaN, NaN, NaN, NaN",0.026,-0.019,"tu, uestis, pecto, tu, tu, tu, tu, tu, haruspex, tu, hic, humilis, ligneus, garrulus, uadum, niueus, profugio, tu, hospita, tu, tu, barbaris, nex, tu, concubo, iaceo, hic, fluito, tu, hic, tu, hic, hic, tu, prodigium, indomitus, crepito, dolium, matrona, uestis, hic, maledico, ferus, sobrius, heu, heu, iaceo, tu, spectaculum, tu, capillus, tu",0.069
